index,url,valid,domain,title,description,image,published,archive,content,quote,language,keyword
https://www.focus.de/finanzen/news/energiewende-macht-probleme-zu-wenig-strom-stromanbieter-in-angst-vor-netz-kollaps-doch-tesla-und-viessmann-protestieren_id_184709076.html,https://www.focus.de/finanzen/news/energiewende-macht-probleme-zu-wenig-strom-stromanbieter-in-angst-vor-netz-kollaps-doch-tesla-und-viessmann-protestieren_id_184709076.html,0,www.focus.de,Energiewende macht Probleme - Stromanbieter in Angst vor Netz-Kollaps - wegen E-Autos und Wärmepumpen,"Elektroautos und Wärmepumpen sind entscheidende Bausteine für eine Energiewende in Deutschland. Doch wenn alle sie nutzen, bricht das Stromnetz zusammen. Deswegen sollen Stromversorger den Saft auch mal drosseln dürfen. Doch Unternehmen wie Tesla und Viessman…",https://p6.focus.de/img/fotos/id_184708434/stromleitung.jpg?im=Crop%3D%280%2C165%2C2048%2C1024%29%3BResize%3D%281200%2C627%29&impolicy=perceptual&quality=medium&hash=28bc7558bbb12ae6e8a04ca4c00cc3f1e1728f5af436f530f6b1af824e7ff810,2023-02-04T09:28:21Z,https://web.archive.org/web/20230204094944/https://www.focus.de/finanzen/news/energiewende-macht-probleme-zu-wenig-strom-stromanbieter-in-angst-vor-netz-kollaps-doch-tesla-und-viessmann-protestieren_id_184709076.html,"Elektroautos und Wärmepumpen sind entscheidende Bausteine für eine Energiewende in Deutschland. Doch wenn alle sie nutzen, bricht das Stromnetz zusammen. Deswegen sollen Stromversorger den Saft auch … [+6356 chars]",,de,'Netzagentur'
https://www.welt.de/wirtschaft/video243596707/Russisches-Oel-Sanktionen-werden-tiefer-in-das-Wirtschaftswachstum-der-russischen-Industrie-hineingreifen.html,https://www.welt.de/wirtschaft/video243596707/Russisches-Oel-Sanktionen-werden-tiefer-in-das-Wirtschaftswachstum-der-russischen-Industrie-hineingreifen.html,0,www.welt.de,„Sanktionen werden tiefer in das Wirtschaftswachstum der russischen Industrie hineingreifen“,"Die EU-Länder einigen sich auf einen Preisdeckel für russische Ölprodukte. Die Obergrenze liegt auf Diesel bei 100 Dollar je Barrel und auf Heizöl bei 45 Dollar. Man setzte damit „einen klaren Maßstab“, sagt der Experte für Geopolitik, Maximilian Terhalle.",https://img.welt.de/img/incoming/mobile243597119/1921357317-ci16x9-w1200/389943455-jpg.jpg,2023-02-04T10:21:44Z,,"Die WELT als ePaper: Die vollständige Ausgabe steht Ihnen bereits am Vorabend zur Verfügung so sind Sie immer hochaktuell informiert. Weitere Informationen: http://epaper.welt.de 
 Der Kurz-Link die… [+49 chars]",,de,'Heizöl'
https://www.dw.com/de/habeck-hoffnung-auf-ein-ende-der-energiekrise/a-64610293,https://www.dw.com/de/habeck-hoffnung-auf-ein-ende-der-energiekrise/a-64610293,0,www.dw.com,Habeck: Hoffnung auf ein Ende der Energiekrise,"Bei einem Besuch in Schweden wendet sich Deutschlands Wirtschaftsminister Robert Habeck wieder seinem Lieblingsthema zu: der Energiewende. Doch es gibt Gegenwind aus den USA. Aus Stockholm berichtet Jens Thurau. Etwas müde wirkt er schon, der deutsche Ministe…",https://static.dw.com/image/64593230_6.jpg,2023-02-04T11:11:00Z,,"Etwas müde wirkt er schon, der deutsche Minister für Wirtschaft und Klimaschutz, Robert Habeck. 2022 war ein hartes erstes Jahr als Vizekanzler und Minister in der sogenannten Ampelkoalition aus SPD,… [+6077 chars]",,de,'Energiewende Gas'
https://www.stern.de/gesellschaft/regional/bayern/kommunen---spielzeugmuseum-schliesst-wegen-energiepreisen-voruebergehend-33166722.html,https://www.stern.de/gesellschaft/regional/bayern/kommunen---spielzeugmuseum-schliesst-wegen-energiepreisen-voruebergehend-33166722.html,0,www.stern.de,Kommunen;: Spielzeugmuseum schließt wegen Energiepreisen vorübergehend,"Das Münchner Spielzeugmuseum ist wegen der gestiegenen Energiekosten bis Ende März geschlossen. ""Im November war die Prognose, dass die Heizkosten um das Zweieinhalbfache steigen. Für unser privates Museum hätte das Mehrkosten von 10 000 Euro bedeutet von Jan…",https://image.stern.de/6681672/t/31/v5/w1440/r1.7778/-/video-fallback-image.jpg,2023-02-04T11:18:13Z,https://web.archive.org/web/20230204113510/https://www.stern.de/gesellschaft/regional/bayern/kommunen---spielzeugmuseum-schliesst-wegen-energiepreisen-voruebergehend-33166722.html,"Das Münchner Spielzeugmuseum ist wegen der gestiegenen Energiekosten bis Ende März geschlossen. ""Im November war die Prognose, dass die Heizkosten um das Zweieinhalbfache steigen. Für unser privates … [+1040 chars]",,de,'Energiepreise'
https://www.focus.de/politik/ausland/habeck-hoffnung-auf-ein-ende-der-energiekrise_id_184904426.html,https://www.focus.de/politik/ausland/habeck-hoffnung-auf-ein-ende-der-energiekrise_id_184904426.html,0,www.focus.de,Diskussionen um Reaktion auf US-Investitionsprogramm - Habeck: Hoffnung auf ein Ende der Energiekrise,Bei einem Besuch in Schweden wendet sich Deutschlands Wirtschaftsminister Robert Habeck wieder seinem Lieblingsthema zu: der Energiewende. Doch es gibt Gegenwind aus den USA. Aus Stockholm berichtet Jens Thurau.,https://p6.focus.de/img/politik/ausland/id_184904408/er-muede-sie-energiegeladen-wirtschaftsminister-robert-habeck-und-seine-schwedische-kollegin-ebba-busch.jpg?im=Crop%3D%280%2C29%2C940%2C470%29%3BResize%3D%281200%2C627%29&hash=5b20685c562179c713f32acf2ef9fde0792a26fceba025e38e1cd3f46debe657,2023-02-04T11:25:06Z,,"Etwas müde wirkt er schon, der deutsche Minister für Wirtschaft und Klimaschutz, Robert Habeck. 2022 war ein hartes erstes Jahr als Vizekanzler und Minister in der sogenannten Ampelkoalition aus SPD,… [+5769 chars]",,de,'Energiekrise'
https://www.sueddeutsche.de/muenchen/muenchen-spielzeugmuseum-geschlossen-oeffnung-marienplatz-ausstellung-1.5745056,https://www.sueddeutsche.de/muenchen/muenchen-spielzeugmuseum-geschlossen-oeffnung-marienplatz-ausstellung-1.5745056,0,www.sueddeutsche.de,Ausstellung: Spielzeugmuseum bleibt wegen hoher Energiekosten geschlossen,"Die private Ausstellung am Münchner Marienplatz soll erst im April wieder öffnen. Es ist die einzige Sammlung in der Stadt, die wegen der Energiepreise dicht gemacht hat.",https://www.sueddeutsche.de/image/sz.1.3867033/1200x675?v=1675511446,2023-02-04T11:51:00Z,https://web.archive.org/web/20230204115224/https://www.sueddeutsche.de/muenchen/muenchen-spielzeugmuseum-geschlossen-oeffnung-marienplatz-ausstellung-1.5745056,"Die private Ausstellung am Münchner Marienplatz soll erst im April wieder öffnen. Es ist die einzige Sammlung in der Stadt, die wegen der Energiepreise dicht gemacht hat.Das Münchner Spielzeugmuseum … [+1461 chars]",,de,'Energiepreise'
https://www.tagesspiegel.de/wirtschaft/russisches-erdol-eu-einigt-sich-auf-preisdeckel-9293468.html,https://www.tagesspiegel.de/wirtschaft/russisches-erdol-eu-einigt-sich-auf-preisdeckel-9293468.html,0,www.tagesspiegel.de,Russisches Erdöl: EU einigt sich auf Preisdeckel,"EU, G7-Staaten und Australien einigen sich auf eine Preisobergrenze für Diesel und Kerosin bei 100 Dollar pro Barrel und Heizöl bei 45 Dollar.",https://www.tagesspiegel.de/images/olterminal-in-russland1/alternates/BASE_16_9_W1400/oelterminal-in-russland.jpeg,2023-02-04T11:56:45Z,,Die EU-Mitgliedsstaaten haben sich auf Preisobergrenzen für russische Erdölprodukte geeinigt. Die EU-Botschafter haben heute die Preisobergrenzen für Erdölprodukte gebilligt vor einer endgültigen Ver… [+2290 chars],,de,'Russland Erdöl'
https://www.bild.de/regional/muenchen/muenchen-aktuell/in-muenchen-spielzeugmuseum-schliesst-wegen-hoher-energiepreise-82787342.bild.html,https://www.bild.de/regional/muenchen/muenchen-aktuell/in-muenchen-spielzeugmuseum-schliesst-wegen-hoher-energiepreise-82787342.bild.html,0,www.bild.de,In München - Spielzeugmuseum schließt wegen hoher Energiepreise,München – Das Spielzeugmuseum ist wegen der gestiegenen Energiekosten bis Ende März zuFoto: Daniel Karmann/dpa,"https://images.bild.de/63de55f70246753a562418bf/3892a11310f4e1ff37221112a2dbab27,1b9a9af3?w=1280",2023-02-04T13:11:16Z,https://web.archive.org/web/20230204155448/https://www.bild.de/regional/muenchen/muenchen-aktuell/in-muenchen-spielzeugmuseum-schliesst-wegen-hoher-energiepreise-82787342.bild.html,"München Das Spielzeugmuseum ist wegen der gestiegenen Energiekosten bis Ende März geschlossen.
Im November war die Prognose, dass die Heizkosten um das Zweieinhalbfache steigen. Für unser privates M… [+380 chars]",,de,'Energiekosten'
https://www.stern.de/news/eu--g7-und-australien-beschliessen-preisdeckel-fuer-diesel-und-heizoel-aus-russland-33166868.html,https://www.stern.de/news/eu--g7-und-australien-beschliessen-preisdeckel-fuer-diesel-und-heizoel-aus-russland-33166868.html,0,www.stern.de,"EU, G7 und Australien beschließen Preisdeckel für Diesel und Heizöl aus Russland","Die Europäische Union, die G7-Staaten und Australien haben sich auf Preisobergrenzen für russische Erdölprodukte geeinigt. ""Dieser Beschluss wird die Einnahmen Russlands noch stärker beschneiden und seine Fähigkeit zur Kriegführung in der Ukraine einschränken…",https://image.stern.de/33166870/t/dw/v1/w1440/r1.7778/-/04--russische-tankstelle-des-oelproduzenten-gazprom-neft---153927f7253de51e.jpg,2023-02-04T13:23:39Z,,"Die Europäische Union, die G7-Staaten und Australien haben sich auf Preisobergrenzen für russische Erdölprodukte geeinigt. ""Dieser Beschluss wird die Einnahmen Russlands noch stärker beschneiden und … [+3418 chars]",,de,'Heizöl'
https://www.stern.de/wirtschaft/auf-nachtspeicherheizung-angewiesen--finanzexperte-gibt-tipp--wie-man-dennoch-sparen-kann-33164772.html,https://www.stern.de/wirtschaft/auf-nachtspeicherheizung-angewiesen--finanzexperte-gibt-tipp--wie-man-dennoch-sparen-kann-33164772.html,0,www.stern.de,"Preisbarometer: Auf Nachtspeicherheizung angewiesen? Finanzexperte erklärt, wie man dennoch sparen kann","Trotz aller Entlastungen der Regierung sind die Energiepreise hoch. Viele wollen sparen- Wie sie das machen können, erklärt Finanztip-Experte Benjamin Weigl.",https://image.stern.de/33164796/t/dD/v1/w1440/r1.7778/-/nachtspeicherheizung.jpg,2023-02-04T14:41:00Z,https://web.archive.org/web/20230204144545/https://www.stern.de/wirtschaft/auf-nachtspeicherheizung-angewiesen--finanzexperte-gibt-tipp--wie-man-dennoch-sparen-kann-33164772.html,"Zugang zu allen STERN PLUS-Inhalten und Artikeln aus dem Print-Magazin
werbefrei &amp; jederzeit kündbar
Bereits registriert?
Hier anmelden",,de,'Energiepreise'
https://www.morgenpost.de/politik/inland/article237548273/Linken-Chef-fordert-automatischen-Inflationsausgleich.html,https://www.morgenpost.de/politik/inland/article237548273/Linken-Chef-fordert-automatischen-Inflationsausgleich.html,0,www.morgenpost.de,Soziales: Linken-Chef fordert automatischen Inflationsausgleich,"Steigende Preise für Energie, Kleidung und Lebensmittel: Die Inflation treffe besonders Menschen mit niedrigem Einkommen hart, sagt Martin Schirdewan - und fordert weitere direkte Hilfen.",https://img.morgenpost.de/img/inland/crop237548271/4592609491-w820-cv16_9-q85/Martin-Schirdewan.jpg,2023-02-04T15:03:16Z,https://web.archive.org/web/20230204155344/https://www.morgenpost.de/politik/inland/article237548273/Linken-Chef-fordert-automatischen-Inflationsausgleich.html,"Berlin. Angesichts der hohen Inflation fordert Linken-Co-Vorsitzender Martin Schirdewan weitere direkte Hilfen für besonders Betroffene. 
Ihm schwebe vor, dass für Menschen, die Mindestlohn beziehen… [+1739 chars]",,de,'Strompreisbremse'
https://www.morgenpost.de/ratgeber/article237479519/waermepumpe-wohngebaeude-klimaanlage-nachruesten-verbraucher-kosten.html,https://www.morgenpost.de/ratgeber/article237479519/waermepumpe-wohngebaeude-klimaanlage-nachruesten-verbraucher-kosten.html,0,www.morgenpost.de,Energiesparen: Wärmepumpe nachrüsten und als Klimaanlage nutzen: So geht's,"Die Wärmepumpe als Klimaanlage nutzen – das ist bei manchen Modellen möglich. Wie das funktioniert und was die Kühlfunktion kostet, erfahren Sie hier.",https://img.morgenpost.de/img/frontpage/crop237505613/4032609981-w820-cv16_9-q85/Die-Waermepumpe-im-Sommer-als-Klimaanlage-nutzen.jpg,2023-02-04T15:43:58Z,https://web.archive.org/web/20230204180902/https://www.morgenpost.de/ratgeber/article237479519/waermepumpe-wohngebaeude-klimaanlage-nachruesten-verbraucher-kosten.html,Berlin. Das Jahr 2022 war von der Energie- und Preiskrise geprägt. Die Kosten für klassische Brennstoffe wie Heizöl und Gas sind im Frühjahr massiv gestiegen. Zeitweise kostete ein Liter Heizöl über … [+8110 chars],,de,'Energiepreise'
https://www.wiwo.de/politik/deutschland/soziales-linken-chef-fordert-automatischen-inflationsausgleich/28964092.html,https://www.wiwo.de/politik/deutschland/soziales-linken-chef-fordert-automatischen-inflationsausgleich/28964092.html,0,www.wiwo.de,Soziales: Linken-Chef fordert automatischen Inflationsausgleich,"Steigende Preise für Energie, Kleidung und Lebensmittel: Die Inflation treffe besonders Menschen mit niedrigem Einkommen hart, sagt Martin Schirdewan – und fordert weitere direkte Hilfen.",https://www.wiwo.de/images/martin-schirdewan/28964090/1-format11240.jpg,2023-02-04T15:46:02Z,,"Angesichts der hohen Inflation fordert Linken-Co-Vorsitzender Martin Schirdewan weitere direkte Hilfen für besonders Betroffene. Ihm schwebe vor, dass für Menschen, die Mindestlohn beziehen, also für… [+2087 chars]",,de,'Inflation'
https://www.n-tv.de/wirtschaft/Wir-sollten-ueber-aktive-Preisbeobachtung-nachdenken-article23891143.html,https://www.n-tv.de/wirtschaft/Wir-sollten-ueber-aktive-Preisbeobachtung-nachdenken-article23891143.html,0,www.n-tv.de,"Frühwarnsystem für Inflation: ""Wir sollten über aktive Preisbeobachtung nachdenken""","Die Volkswirtin Isabella Weber gilt als Erfinderin des Gaspreisdeckels. Sie sucht aber auch nach Lösungen im Kampf gegen steigende Preise. Der Staat sollte die ""systemisch relevanten"" Preistreiber am Markt finden, plädiert sie. Dann könne er ""zielgenau interv…",https://bilder1.n-tv.de/img/incoming/crop23891220/0981324884-cImg_16_9-w1200/382134380.jpg,2023-02-04T17:35:07Z,https://web.archive.org/web/20230204185333/http://www.n-tv.de/wirtschaft/Wir-sollten-ueber-aktive-Preisbeobachtung-nachdenken-article23891143.html,Die Volkswirtin Isabella Weber gilt als Erfinderin des Gaspreisdeckels. Darüber hinaus sucht sie aber auch nach Lösungen im Kampf gegen steigende Preise. Bei der aktuellen Inflation handelt es sich i… [+9997 chars],,de,'Gaspreisdeckel'
https://www.welt.de/politik/ausland/article243595721/Ukraine-News-Rund-eine-halbe-Million-Haushalte-in-Odessa-ohne-Strom.html,https://www.welt.de/politik/ausland/article243595721/Ukraine-News-Rund-eine-halbe-Million-Haushalte-in-Odessa-ohne-Strom.html,0,www.welt.de,„Ausmaß ist beträchtlich“ – Rund eine halbe Million Haushalte in Odessa ohne Strom,Infolge der russischen Angriffe kam es in der Südukraine zu einer Havarie in einem Umspannwerk. Eine schnelle Wiederherstellung der Stromversorgung sei nicht möglich. Dmitri Medwedjew droht derweil nach den Waffenlieferungen an die Ukraine mit Vergeltungsschl…,https://img.welt.de/img/politik/ausland/mobile243603153/7701353177-ci16x9-w1200/UKRAINE-RUSSIA-CONFILCT-WAR.jpg,2023-02-04T18:20:00Z,http://archive.md/20230204192203/https://www.welt.de/politik/ausland/article243595721/Ukraine-News-Rund-eine-halbe-Million-Haushalte-in-Odessa-ohne-Strom.html,"In der südukrainischen Hafenstadt Odessa sind nach einer Havarie in einem Umspannwerk rund 500.000 Haushalte ohne Strom. Die Situation ist komplex, das Ausmaß des Unfalls ist beträchtlich, schrieb Mi… [+20864 chars]",,de,'Heizöl'
https://www.tagesschau.de/wirtschaft/verbraucher/diesel-heizoel-oel-embargo-russland-101.html,https://www.tagesschau.de/wirtschaft/verbraucher/diesel-heizoel-oel-embargo-russland-101.html,0,www.tagesschau.de,Warum Diesel und Heizöl jetzt teurer werden könnten,Heute tritt der dritte Teil des EU-Embargos gegen russisches Öl in Kraft. Droht Diesel- und Heizöl-Kunden wegen des Wegfalls der Lieferungen aus Russland nun ein böses Erwachen? <em>Von Angela Göpfert.</em>,https://www.tagesschau.de/multimedia/bilder/diesel-209~_v-original.jpg,2023-02-05T00:33:32Z,https://web.archive.org/web/20230205005629/https://www.tagesschau.de/wirtschaft/verbraucher/diesel-heizoel-oel-embargo-russland-101.html,"Heute tritt der dritte Teil des EU-Embargos gegen russisches Öl in Kraft. Droht Diesel- und Heizöl-Kunden wegen des Wegfalls der Lieferungen aus Russland nun ein böses Erwachen?
Die EU hat die dritt… [+4474 chars]",,de,'Heizöl'
https://www.stern.de/news/eu-preisdeckel-fuer-diesel-und-heizoel-aus-russland-tritt-in-kraft-33167650.html,https://www.stern.de/news/eu-preisdeckel-fuer-diesel-und-heizoel-aus-russland-tritt-in-kraft-33167650.html,0,www.stern.de,EU-Preisdeckel für Diesel und Heizöl aus Russland tritt in Kraft,"Der von der Europäischen Union, den G7-Staaten und Australien beschlossene Preisdeckel für russische Ölprodukte gilt ab Sonntag. Die Preisobergrenzen liegen bei 100 US-Dollar pro Barrel (rund 93 Euro für 159 Liter) für Kraftstoffe wie Diesel, Kerosin und Benz…",https://image.stern.de/33167652/t/qm/v1/w1440/r1.7778/-/05--eukommissionschefin-von-der-leyen---ab70c3ee07abc277.jpg,2023-02-05T03:11:01Z,,"Der von der Europäischen Union, den G7-Staaten und Australien beschlossene Preisdeckel für russische Ölprodukte gilt ab Sonntag. Die Preisobergrenzen liegen bei 100 US-Dollar pro Barrel (rund 93 Euro… [+549 chars]",,de,'Heizöl'
https://www.telepolis.de/features/Hohe-Energiepreise-Industrie-streicht-Jobs-und-investiert-im-Ausland-7485080.html,https://www.telepolis.de/features/Hohe-Energiepreise-Industrie-streicht-Jobs-und-investiert-im-Ausland-7485080.html,0,www.telepolis.de,Hohe Energiepreise: Industrie streicht Jobs und investiert im Ausland,Die Kosten für Erdgas und Strom sind ein Nachteil im internationalen Wettbewerb. Chemische Industrie will Investitionen ins Ausland verlagern. Andere Branchen klagen über Rückgang der Produktion.,https://heise.cloudimg.io/bound/1200x1200/q85.png-lossy-85.webp-lossy-85.foil1/_www-heise-de_/imgs/18/3/6/9/3/3/1/4/energiepreise_ho-0b2b63a8c060911a.png,2023-02-05T07:00:00Z,,"Die Kosten für Erdgas und Strom sind ein Nachteil im internationalen Wettbewerb. Chemische Industrie will Investitionen ins Ausland verlagern. Andere Branchen klagen über Rückgang der Produktion.
Di… [+3355 chars]",,de,'Energiepreise'
https://www.dw.com/de/kanzler-scholz-will-vier-bis-f%C3%BCnf-neue-windr%C3%A4der-t%C3%A4glich/a-64614458,https://www.dw.com/de/kanzler-scholz-will-vier-bis-f%C3%BCnf-neue-windr%C3%A4der-t%C3%A4glich/a-64614458,0,www.dw.com,Kanzler Scholz will vier bis fünf neue Windräder täglich,"Bundeskanzler Olaf Scholz will beim Ausbau der Windkraft in Deutschland Gas geben. Die Bundesländer sollten künftig monatlich über die Fortschritte berichten, kündigt der Regierungschef an. Bundeskanzler Olaf Scholz hat einen bundesweiten Plan zum Ausbau der …",https://static.dw.com/image/64614701_6.jpg,2023-02-05T07:08:00Z,,"Bundeskanzler Olaf Scholz hat einen bundesweiten Plan zum Ausbau der Windkraft angekündigt. ""Den Ausbau gehen wir generalstabsmäßig an: Gerade erstellen wir einen Fahrplan, was bis wann an neuen Anla… [+1391 chars]",,de,'Energiewende Gas'
https://www.focus.de/finanzen/news/heizkosten-soll-ich-jetzt-schon-heizoel-pellets-oder-brennholz-kaufen_id_184829527.html,https://www.focus.de/finanzen/news/heizkosten-soll-ich-jetzt-schon-heizoel-pellets-oder-brennholz-kaufen_id_184829527.html,0,www.focus.de,"Heizkosten - Soll ich jetzt schon Heizöl, Pellets oder Brennholz kaufen?","Der Winter ist noch nicht vorbei. Die Temperaturen bleiben niedrig. Viele Haushalte überlegen jetzt, wann sie Heizöl oder Brennholz bestellen sollen. Entweder um für den Rest des Winters gerüstet zu sein oder um für den nächsten Winter vorzusorgen. FOCUS onli…",https://p6.focus.de/img/fotos/id_98030979/heizoel-72682473.jpg?im=Crop%3D%280%2C204%2C3489%2C1746%29%3BResize%3D%281200%2C627%29&impolicy=perceptual&quality=medium&hash=accd477c4a9af5b9ee56194b8a9cb57b2331cbc512496c4c2744edaf3d5c6fd1,2023-02-05T10:03:58Z,https://web.archive.org/web/20230205120526/https://www.focus.de/finanzen/news/heizkosten-soll-ich-jetzt-schon-heizoel-pellets-oder-brennholz-kaufen_id_184829527.html,"Der Winter ist noch nicht vorbei. Die Temperaturen bleiben niedrig. Viele Haushalte überlegen jetzt, wann sie Heizöl oder Brennholz bestellen sollen. Entweder um für den Rest des Winters gerüstet zu … [+5252 chars]",,de,'Heizöl'
https://www.wiwo.de/politik/konjunktur/embargo-gegen-russland-zum-jahresende-koennte-der-oelpreis-die-100-dollar-marke-erreichen/28951546.html,https://www.wiwo.de/politik/konjunktur/embargo-gegen-russland-zum-jahresende-koennte-der-oelpreis-die-100-dollar-marke-erreichen/28951546.html,0,www.wiwo.de,Embargo gegen Russland: „Zum Jahresende könnte der Ölpreis die 100-Dollar-Marke erreichen“,Ab Sonntag gilt das EU-Embargo gegen Raffinerieprodukte aus Russland. Rohstoffanalyst Carsten Fritsch über die Folgen für Diesel- und Heizölkäufer – und die Entwicklung des globalen Ölmarktes in den kommenden Monaten.,https://www.wiwo.de/images/imago0101667702h/28964338/2-format11240.jpg,2023-02-05T10:24:37Z,https://web.archive.org/web/20230205122311/https://www.wiwo.de/politik/konjunktur/embargo-gegen-russland-zum-jahresende-koennte-der-oelpreis-die-100-dollar-marke-erreichen/28951546.html,"WirtschaftsWoche: Herr Fritsch, am 5. Februar tritt das EU-Embargo gegen russischen Diesel in Kraft. Was bedeutet das für die Autofahrer an der Zapfsäule?Carsten Fritsch: Der Dieselpreis dürfte vermu… [+3464 chars]",,de,'Heizöl'
https://www.faz.net/aktuell/wirtschaft/skandal-in-grossbritannien-um-british-gas-schuldeneintreiber-18652696.html,https://www.faz.net/aktuell/wirtschaft/skandal-in-grossbritannien-um-british-gas-schuldeneintreiber-18652696.html,0,www.faz.net,Energiekrise in Großbritannien: Wenn der Gasmann die Tür aufbricht,"Schuldeneintreiber von British Gas haben bei säumigen Haushalten die Wohnung aufgebrochen, um Vorkasse-Gaszähler einzubauen. Nun ist der Konzern entsetzt – und bittet um Entschuldigung",https://media0.faz.net/ppmedia/aktuell/1574235715/1.8655496/facebook_teaser/keine-teestunde-ohne-gas-in.jpg,2023-02-05T12:50:30Z,https://web.archive.org/web/20230206015212/https://www.faz.net/aktuell/wirtschaft/skandal-in-grossbritannien-um-british-gas-schuldeneintreiber-18652696.html,"Der rabiate Umgang des Gasversorgers British Gas mit vulnerablen säumigen Kunden, deren Wohnung aufgebrochen wurde, hat in Großbritannien für einen Skandal gesorgt. Der British-Gas-Mutterkonzern Cent… [+3442 chars]",,de,'Energiepreise'
https://www.tagesspiegel.de/erneuerbare-energien-scholz-kundigt-plan-zum-massiven-ausbau-der-windkraft-an-9295253.html,https://www.tagesspiegel.de/erneuerbare-energien-scholz-kundigt-plan-zum-massiven-ausbau-der-windkraft-an-9295253.html,0,www.tagesspiegel.de,Erneuerbare Energien: Scholz kündigt Plan zum massiven Ausbau der Windkraft an,"„Generalstabsmäßig“ soll die Errichtung neuer Anlagen vorangetrieben werden, so der Bundeskanzler.",https://www.tagesspiegel.de/images/winter-in-niedersachsen2/alternates/BASE_16_9_W1400/winter-in-niedersachsen.jpeg,2023-02-05T14:00:09Z,,"Bundeskanzler Olaf Scholz (SPD) hat einen bundesweiten Plan zum Ausbau der Windkraft angekündigt. Bis 2030 werden das an Land im Schnitt vier bis fünf Windräder jeden Tag sein, sagte Scholz der Bild … [+1370 chars]",,de,'Erneuerbare Energie'
https://stadt-bremerhaven.de/weniger-briefe-wurden-verschickt-deutsche-post-dhl-weiter-fuehrend-im-paketmarkt/,https://stadt-bremerhaven.de/weniger-briefe-wurden-verschickt-deutsche-post-dhl-weiter-fuehrend-im-paketmarkt/,0,stadt-bremerhaven.de,"Weniger Briefe wurden verschickt, Deutsche Post DHL weiter führend im Paketmarkt","Die Bundesnetzagentur hat ihre Postmarktdaten für 2021 und 2022 veröffentlicht. Grundlage für die Zahlen ist die jährliche Markterhebung im Postbereich. Die Zahlen für 2022 basieren auf Schätzungen der Postdienstleister, so die Agentur. Die Zahlen belegen, da…",https://stadt-bremerhaven.de/wp-content/uploads/2022/11/deutsche-post.jpg,2023-02-05T14:30:26Z,,Die Bundesnetzagentur hat ihre Postmarktdaten für 2021 und 2022 veröffentlicht. Grundlage für die Zahlen ist die jährliche Markterhebung im Postbereich. Die Zahlen für 2022 basieren auf Schätzungen d… [+2642 chars],,de,'Bundesnetzagentur'
https://www.morgenpost.de/politik/article237557273/wohnen-mieten-indexmiete-hoehe-gruene.html,https://www.morgenpost.de/politik/article237557273/wohnen-mieten-indexmiete-hoehe-gruene.html,0,www.morgenpost.de,Inflation: Wohnen: Warum Indexmieten für Mieter zum Problem werden,"Indexmieten werden für viele Mieter zum Problem. Die Grünen wollen dagegen vorgehen, doch die Ampel ist in der Mietenpolitik blockiert.",https://img.morgenpost.de/img/politik/crop237557271/3162603186-w820-cv16_9-q85/6a9feb10-a565-11ed-b2c3-3e6148bd5b8b.jpg,2023-02-05T15:31:24Z,https://web.archive.org/web/20230205170447/https://www.morgenpost.de/politik/article237557273/wohnen-mieten-indexmiete-hoehe-gruene.html,"Berlin.  Langsam, aber stetig klettert die Inflationsrate herunter von den Rekordhöhen des letzten Jahres, der Gipfel scheint überschritten. Für viele Mieter und Mieterinnen ist das nur ein schwacher… [+5749 chars]",,de,'Energiepreise'
