index,url,valid,domain,title,description,image,published,archive,content,quote,language,keyword
https://www.morgenpost.de/wirtschaft/article241790810/Gas-wird-teurer-Familien-zahlen-bald-Hunderte-Euro-mehr.html,https://www.morgenpost.de/wirtschaft/article241790810/Gas-wird-teurer-Familien-zahlen-bald-Hunderte-Euro-mehr.html,0,www.morgenpost.de,Gas wird teurer: Familien zahlen bald Hunderte Euro mehr,Ab April gilt für Erdgas wieder der reguläre Mehrwertsteuersatz. Verbraucherinnen und Verbraucher erwartet ein Anstieg der Heizkosten.,https://img.sparknews.funkemedien.de/238814325/238814325_1709288769_v4_3_800.jpeg,2024-03-01T10:25:55Z,https://web.archive.org/web/20240301115514/https://www.morgenpost.de/wirtschaft/article241790810/Gas-wird-teurer-Familien-zahlen-bald-Hunderte-Euro-mehr.html,"Berlin. Ab April gilt für Erdgas wieder der reguläre Mehrwertsteuersatz. Verbraucherinnen und Verbraucher erwartet ein Anstieg der Heizkosten.
Ab April müssen sich Verbraucherinnen und Verbraucher a… [+2942 chars]",,de,'Heizkosten'
https://www.morgenpost.de/wirtschaft/article241757800/pelletspreise-aktuell-heute-1-maerz-pellets-heizung-kosten.html,https://www.morgenpost.de/wirtschaft/article241757800/pelletspreise-aktuell-heute-1-maerz-pellets-heizung-kosten.html,0,www.morgenpost.de,Pelletspreise heute am 1. März: Der aktuelle Preis pro Tonne,Die Inflation in Deutschland geht aktuell zurück. ○ Hat das Auswirkungen auf die Pelletspreise? ○ So viel kostet eine Tonne heute (1. März).,https://img.sparknews.funkemedien.de/237047837/237047837_1669908877_v4_3_800.jpeg,2024-03-01T10:59:00Z,,"Berlin. Die Inflation in Deutschland geht aktuell zurück. Hat das Auswirkungen auf die Pelletspreise? So viel kostet eine Tonne heute (1. März).
Die zeitweise extrem hohe Inflation in Deutschland ge… [+6725 chars]",,de,'Inflation'
https://www.welt.de/wirtschaft/article250368108/Habeck-Gas-Alarmstufe-bleibt-bestehen.html,https://www.welt.de/wirtschaft/article250368108/Habeck-Gas-Alarmstufe-bleibt-bestehen.html,0,www.welt.de,Wirtschaftsministerium – Gas-Alarmstufe bleibt bestehen,"Vielerorts war zuletzt von einer Entspannung auf dem Markt die Rede. „Es ist an der Zeit, den Gasnotfallplan aufzuheben“, sagt etwa Ökonomin Claudia Kemfert. Das Habeck-Ministerium hingegen hält an der Alarmstufe wie auch am Rügener LNG-Terminal fest.",https://img.welt.de/img/wirtschaft/mobile250368110/3231353937-ci16x9-w1200/Energie-Terminal-Deutsche-Ostsee-im-Hafen-Mukran.jpg,2024-03-02T05:48:02Z,,"Die Bundesregierung hält die Gasversorgungslage weiterhin für angespannt. Man beabsichtige derzeit nicht, die seit Sommer 2022 geltenden Alarmstufe des Notfallplans Gas zu beenden, erklärte das Bunde… [+2774 chars]",,de,'Energieversorgung'
https://www.zeit.de/news/2024-03/02/bund-gas-alarmstufe-bleibt-bestehen-lng-terminal-noetig,https://www.zeit.de/news/2024-03/02/bund-gas-alarmstufe-bleibt-bestehen-lng-terminal-noetig,0,www.zeit.de,"Energie: Bund: Gas-Alarmstufe bleibt bestehen, LNG-Terminal nötig","Hier finden Sie Informationen zu dem Thema „Energie“. Lesen Sie jetzt „Bund: Gas-Alarmstufe bleibt bestehen, LNG-Terminal nötig“.",https://img.zeit.de/news/2024-03/02/bund-gas-alarmstufe-bleibt-bestehen-lng-terminal-noetig-image-group/wide__1300x731,2024-03-02T07:25:27Z,https://web.archive.org/web/20240302100707/https://www.zeit.de/news/2024-03/02/bund-gas-alarmstufe-bleibt-bestehen-lng-terminal-noetig,"Die Bundesregierung hält die Gasversorgungslage weiterhin für angespannt. Man beabsichtige derzeit nicht, die seit Sommer 2022 geltenden Alarmstufe des Notfallplans Gas zu beenden, erklärte das Bunde… [+3507 chars]",,de,'LNG'
https://www.stern.de/wirtschaft/news/energie--bund--gas-alarmstufe-bleibt-bestehen-34510238.html,https://www.stern.de/wirtschaft/news/energie--bund--gas-alarmstufe-bleibt-bestehen-34510238.html,0,www.stern.de,Energie: Bund: Gas-Alarmstufe bleibt bestehen,Vielerorts war zuletzt von einer Entspannung der Gasversorgungslage die Rede. Trotzdem hält der Bund an der Gas-Alarmstufe fest. Und auch das Rügener LNG-Terminal sei weiter nötig.,https://image.stern.de/34510240/t/9y/v1/w1440/r1.7778/-/02--urnnewsmldpacom2009010124030299191883v3w800h600l640t382r1920b1146jpeg---4aed0c87e12a167a.jpg,2024-03-02T09:04:31Z,https://web.archive.org/web/20240302092232/https://www.stern.de/wirtschaft/news/energie--bund--gas-alarmstufe-bleibt-bestehen-34510238.html,"Vielerorts war zuletzt von einer Entspannung der Gasversorgungslage die Rede. Trotzdem hält der Bund an der Gas-Alarmstufe fest. Und auch das Rügener LNG-Terminal sei weiter nötig.
Die Bundesregieru… [+3049 chars]",,de,'LNG'
https://www.focus.de/finanzen/news/energie-bund-gas-alarmstufe-bleibt-bestehen_id_259722298.html,https://www.focus.de/finanzen/news/energie-bund-gas-alarmstufe-bleibt-bestehen_id_259722298.html,0,www.focus.de,Energie - Bund: Gas-Alarmstufe bleibt bestehen,Vielerorts war zuletzt von einer Entspannung der Gasversorgungslage die Rede. Trotzdem hält der Bund an der Gas-Alarmstufe fest. Und auch das Rügener LNG-Terminal sei weiter nötig.,https://p6.focus.de/img/finanzen/news/id_259722296/die-fast-300-meter-lange-energos-power-laeuft-begleitet-von-schleppern-in-den-hafen-von-mukran-ein..jpg?im=Crop%3D%280%2C99%2C2048%2C1024%29%3BResize%3D%281200%2C627%29&impolicy=perceptual&quality=mediumHigh&hash=b5bcac0f3034dc8260504ec44698ec89efb883822cf222551c370131351ceb6b,2024-03-02T09:10:04Z,,"Die Bundesregierung hält die Gasversorgungslage weiterhin für angespannt. Man beabsichtige derzeit nicht, die seit Sommer 2022 geltenden Alarmstufe des Notfallplans Gas zu beenden, erklärte das Bunde… [+2858 chars]",,de,'LNG-Terminal'
https://www.zeit.de/wirtschaft/2024-03/gas-ersorgung-bundesregierung-lng-terminal,https://www.zeit.de/wirtschaft/2024-03/gas-ersorgung-bundesregierung-lng-terminal,0,www.zeit.de,LNG-Terminal vor Rügen: Bundesregierung sieht weiterhin Engpässe bei Gasversorgung,"Weil die Versorgung mit Gas weiterhin unsicher sei, möchte die Ampel nicht vom Bau der LNG-Terminals abweichen. Ihre Einschätzung unterscheidet sich von der des DIW.",https://img.zeit.de/administratives/sharing/fallback-image/wide__1300x731,2024-03-02T10:09:42Z,,Die seit Sommer 2022 geltende Alarmstufe des Notfallplans Gas soll vorerst nicht beendet werden. Das teilte das Bundeswirtschaftsministerium in seiner Antwort auf eine parlamentarische Anfrage des Af… [+1003 chars],,de,'LNG'
https://www.faz.net/aktuell/wirtschaft/laut-bundesregierung-alarmstufe-fuer-gas-soll-weiter-gelten-19559263.html,https://www.faz.net/aktuell/wirtschaft/laut-bundesregierung-alarmstufe-fuer-gas-soll-weiter-gelten-19559263.html,0,www.faz.net,Laut Bundesregierung: Alarmstufe für Gas soll weiter gelten,"Die Bundesregierung gibt keine Entwarnung, was die Gasversorgung in Deutschland angeht. Deshalb werde auch das Flüssiggasterminal auf Rügen weiter gebraucht.",https://media0.faz.net/ppmedia/aktuell/wirtschaft/2375379425/1.9559400/facebook_teaser/neue-energie-auf-ruegen-das.jpg,2024-03-02T11:03:00Z,,"Die Bundesregierung hält die Gasversorgungslage weiter für angespannt. Man beabsichtige derzeit nicht, die seit Sommer 2022 geltende Alarmstufe des Notfallplans Gas zu beenden, erklärte das Bundeswir… [+2746 chars]",,de,'Gasversorgung'
https://www.faz.net/aktuell/politik/inland/nrw-ministerpraesident-hendrik-wuest-und-der-kohleausstieg-19557491.html,https://www.faz.net/aktuell/politik/inland/nrw-ministerpraesident-hendrik-wuest-und-der-kohleausstieg-19557491.html,0,www.faz.net,Kraftwerke in NRW: Ein Kohleausstieg ist kein Wert an sich,"Hendrik Wüst zeigt sich besorgt, dass der beschlossene Kohleausstieg bis 2030 scheitern könnte. Der CDU-Ministerpräsident von NRW befürchtet besonders ein Szenario.",https://media0.faz.net/ppmedia/aktuell/gesellschaft/770804347/1.9557490/facebook_teaser_fplus/wird-noch-lange-gebraucht-das.jpg,2024-03-02T18:01:58Z,,"Der nordrhein-westfälische Ministerpräsident Hendrik Wüst (CDU) ließ aufhorchen, als er am Dienstag so deutlich wie nie vor einem Scheitern des Kohleausstiegs bis 2030 warnte. Die Ampelregierung müss… [+570 chars]",,de,'Kohleausstieg'
https://www.teltarif.de/bundesnetzagentur-x-temu/news/94804.html,https://www.teltarif.de/bundesnetzagentur-x-temu/news/94804.html,0,www.teltarif.de,Bericht: Bundesnetzagentur will hart gegen X vorgehen,"Der Chef der Bundesnetzagentur, Klaus Müller, will gegen Hassrede auf der Onlineplattform X (früher Twitter) vorgehen. Auch Temu steht unter Beobachtung.",https://www.teltarif.de/img/arch/2024/kw09/bundesnetzagentur-x-temu-1og.jpg,2024-03-03T10:28:00Z,,"BNetzA-Chef Klaus MüllerFoto: Picture Alliance/dpa
Die Bundes­netz­agentur erwartet im Konflikt mit der Platt­form X (früher Twitter) von Milli­ardär Elon Musk einen langen Rechts­streit. Seit der Ü… [+2522 chars]",,de,'Bundesnetzagentur'
https://www.golem.de/sonstiges/zustimmung/auswahl.html?from=https://www.golem.de/news/russische-desinformation-bundesnetzagentur-will-dass-x-vor-gericht-landet-2403-182802.html&referer=https://t.co/060b5f9e77,https://www.golem.de/sonstiges/zustimmung/auswahl.html?from=https://www.golem.de/news/russische-desinformation-bundesnetzagentur-will-dass-x-vor-gericht-landet-2403-182802.html&referer=https://t.co/060b5f9e77,0,www.golem.de,"Russische Desinformation: Bundesnetzagentur will, dass X vor Gericht landet","Seit der Übernahme durch Elon Musk werde ""offensichtlich"" nicht genug gegen rechtswidrige Inhalte getan, so der Chef der Bundesnetzagentur. (Bundesnetzagentur, Zensur)",,2024-03-03T12:37:02Z,,"Besuchen Sie Golem.de wie gewohnt mit Werbung und Tracking,
 indem Sie der Nutzung aller Cookies zustimmen.
 Details zum Tracking finden Sie im Privacy Center.
Skript wurde nicht geladen. Informat… [+607 chars]",,de,'Bundesnetzagentur'
https://www.stern.de/gesellschaft/regional/berlin-brandenburg/betriebe--schlechte-stimmung-im-handwerk--sinkende-umsaetze-erwartet-34512536.html,https://www.stern.de/gesellschaft/regional/berlin-brandenburg/betriebe--schlechte-stimmung-im-handwerk--sinkende-umsaetze-erwartet-34512536.html,0,www.stern.de,Betriebe: Schlechte Stimmung im Handwerk: Sinkende Umsätze erwartet,"Hohe Steuern und Energiepreise, zu viel Bürokratie: Die Handwerksbetriebe in Brandenburg sehen dem ersten Halbjahr laut einer Umfrage pessimistisch entgegen. Ein Appell an die Politik ist eindringlich.",https://image.stern.de/34512538/t/gO/v1/w1440/r1.7778/-/03--urnnewsmldpacom2009010124030399205367v2w800h600l1113t745r3344b2241jpeg---86eeca9903fd5a1b.jpg,2024-03-03T15:46:10Z,,"Hohe Steuern und Energiepreise, zu viel Bürokratie: Die Handwerksbetriebe in Brandenburg sehen dem ersten Halbjahr laut einer Umfrage pessimistisch entgegen. Ein Appell an die Politik ist eindringlic… [+2111 chars]",,de,'Energieversorgung'
https://www.morgenpost.de/politik/article241806732/Energie-Es-gilt-weiter-vorsichtig-zu-bleiben.html,https://www.morgenpost.de/politik/article241806732/Energie-Es-gilt-weiter-vorsichtig-zu-bleiben.html,0,www.morgenpost.de,"Energie: Es gilt weiter, vorsichtig zu bleiben",Die bisher größte Energiekrise ist vorerst überstanden. Grund zur Entwarnung ist das aber noch nicht.,https://img.sparknews.funkemedien.de/241806730/241806730_1709489499_v4_3_800.jpeg,2024-03-03T18:11:39Z,,"Berlin. Die bisher größte Energiekrise ist vorerst überstanden. Grund zur Entwarnung ist das aber noch nicht.
Die bisher größte Energiekrise ist zum Glück erst einmal überstanden. Die Preise sind in… [+1850 chars]",,de,'Bundesnetzagentur'
https://www.jungewelt.de/artikel/470588.us-blockade-und-wirtschaftsprobleme-neue-preisstruktur-in-kuba.html,https://www.jungewelt.de/artikel/470588.us-blockade-und-wirtschaftsprobleme-neue-preisstruktur-in-kuba.html,0,www.jungewelt.de,US-Blockade und Wirtschaftsprobleme: Neue Preisstruktur in Kuba,"Kubas Energieminister: Es gehe nicht darum, die Subventionen des Stromtarifs abzuschaffen, sondern durch gezielte Maßnahmen »Einsparungen zu erzielen, ohne unseren Lebensstandard zu verlieren«.",https://www.jungewelt.de/img/1100/192046.jpg,2024-03-03T18:36:53Z,,"Am Freitag vermeldete die kubanische KP-Zeitung Granma eine gute Nachricht: Die Ankunft eines Schiffes aus Brasilien, das 375 Tonnen Milchpulver transportierte. Dadurch werde die unentgeltliche Verte… [+3852 chars]",,de,'Energieminister'
https://www.focus.de/earth/analyse/stromautobahnen-fuer-deutschland-das-ist-der-320-milliarden-plan-fuer-die-deutsche-energiewende_id_259725611.html,https://www.focus.de/earth/analyse/stromautobahnen-fuer-deutschland-das-ist-der-320-milliarden-plan-fuer-die-deutsche-energiewende_id_259725611.html,0,www.focus.de,Stromautobahnen für Deutschland - Das ist der 320-Milliarden-Plan für die deutsche Energiewende,"Windräder und PV-Anlagen nutzen nichts, wenn es nicht genügend Stromleitungen für den Transport gibt. Der Ausbau großer „Stromautobahnen“ ist für das Gelingen der Energiewende essenziell. Jetzt hat die Bundesnetzagentur ihren großen Ausbau-Plan vorgelegt - un…",https://p6.focus.de/img/fotos/id_259726138/imago0412946025h.jpg?im=Crop%3D%280%2C577%2C3464%2C1732%29%3BResize%3D%281200%2C627%29&impolicy=perceptual&quality=mediumHigh&hash=16c2f459dcc523cb24d0937cca50912e91fdb69aa0d9256e86fd930919d17344,2024-03-04T10:22:28Z,,"Windräder und PV-Anlagen nutzen nichts, wenn es nicht genügend Stromleitungen für den Transport gibt. Der Ausbau großer Stromautobahnen ist für das Gelingen der Energiewende essenziell. Jetzt hat die… [+4734 chars]",,de,'Bundesnetzagentur'
https://www.sueddeutsche.de/muenchen/muenchen-heizkraftwerk-nord-energieversorgung-unterfoehring-1.6420346,https://www.sueddeutsche.de/muenchen/muenchen-heizkraftwerk-nord-energieversorgung-unterfoehring-1.6420346,0,www.sueddeutsche.de,Energieversorgung: Heizkraftwerk Nord soll auf Gasbetrieb umgestellt werden,"In der Anlage in Unterföhring soll schon bald keine Kohle mehr verbrannt werden. Der Beschluss ist grundsätzlich gefasst, nun nennen die Stadtwerke erstmals Details.",https://www.sueddeutsche.de/image/sz.1.6420521/1200x675?v=1709558794,2024-03-04T13:26:38Z,,Der Umrüstung des Heizkraftwerks Nord von Kohle- auf Gasbetrieb steht wohl nichts mehr im Weg. Vertreter der Stadtwerke München (SWM) haben in der jüngsten Sitzung des Klimarats ihre Pläne für die kü… [+5020 chars],,de,'Energieversorgung'
https://orf.at/stories/3350566/,https://orf.at/stories/3350566/,0,orf.at,Energieminister: Gasverbrauch soll weiter gedrosselt werden,,https://orf.at/mojo/1_4_1/storyserver//news/common/images/og-fallback-news.png,2024-03-04T14:45:21Z,,"Die EU-Staaten wollen ihren Gasverbrauch weiter drosseln. Darauf einigten sich die EU-Energieministerinnen und -minister heute in Brüssel.
Eine entsprechende EU-Verordnung, die Ende März ausläuft, s… [+1328 chars]",,de,'Energieminister'
https://www.stern.de/gesellschaft/regional/mecklenburg-vorpommern/gas--lng-terminal-speist-bei-probebetrieb-erstmals-gas-ein-34515016.html,https://www.stern.de/gesellschaft/regional/mecklenburg-vorpommern/gas--lng-terminal-speist-bei-probebetrieb-erstmals-gas-ein-34515016.html,0,www.stern.de,Gas: LNG-Terminal speist bei Probebetrieb erstmals Gas ein,Der Winter ist nicht mehr lang. Das umstrittene Rügener LNG-Terminal soll vor dem Ende betriebsbereit sein. Nun wurde im Probebetrieb erstmals Gas eingespeist.,https://image.stern.de/34515018/t/Fv/v1/w1440/r1.7778/-/04--urnnewsmldpacom2009010124030499216174v3w800h600l366t187r1809b1595jpeg---b14ff1aa6201e5c3.jpg,2024-03-04T14:53:10Z,https://web.archive.org/web/20240304152804/https://www.stern.de/gesellschaft/regional/mecklenburg-vorpommern/gas--lng-terminal-speist-bei-probebetrieb-erstmals-gas-ein-34515016.html,"Der Winter ist nicht mehr lang. Das umstrittene Rügener LNG-Terminal soll vor dem Ende betriebsbereit sein. Nun wurde im Probebetrieb erstmals Gas eingespeist.
Im Rahmen des laufenden Probebetriebs … [+2093 chars]",,de,'LNG-Terminal'
https://www.zeit.de/news/2024-03/04/lng-terminal-speist-bei-probebetrieb-erstmals-gas-ein,https://www.zeit.de/news/2024-03/04/lng-terminal-speist-bei-probebetrieb-erstmals-gas-ein,0,www.zeit.de,Gas: LNG-Terminal speist bei Probebetrieb erstmals Gas ein,Hier finden Sie Informationen zu dem Thema „Gas“. Lesen Sie jetzt „LNG-Terminal speist bei Probebetrieb erstmals Gas ein“.,https://img.zeit.de/news/2024-03/04/lng-terminal-speist-bei-probebetrieb-erstmals-gas-ein-image-group/wide__1300x731,2024-03-04T14:53:10Z,https://web.archive.org/web/20240305205032/https://www.zeit.de/news/2024-03/04/lng-terminal-speist-bei-probebetrieb-erstmals-gas-ein,Im Rahmen des laufenden Probebetriebs hat das umstrittene Rügener Terminal für Flüssigerdgas (LNG) erstmals Gas ins Netz eingespeist. Laut im Internet zugänglichen Netzdaten wurde bereits am vergange… [+2854 chars],,de,'LNG'
https://www.morgenpost.de/ratgeber/article241816876/Warum-der-fruehe-Fruehlingsbeginn-fuer-Igel-zur-Gefahr-wird.html,https://www.morgenpost.de/ratgeber/article241816876/Warum-der-fruehe-Fruehlingsbeginn-fuer-Igel-zur-Gefahr-wird.html,0,www.morgenpost.de,Warum der frühe Frühlingsbeginn für Igel zur Gefahr wird,Igel erwachen bei milden Temperaturen früher aus dem Winterschlaf. Warum das den Wildtieren schadet – und wie man ihnen helfen kann.,https://img.sparknews.funkemedien.de/240747474/240747474_1701779239_v4_3_800.jpeg,2024-03-04T19:38:54Z,,"Berlin. Igel erwachen bei milden Temperaturen früher aus dem Winterschlaf. Warum das den Wildtieren schadet und wie man ihnen helfen kann.
Igel überbrücken die nahrungsarme Zeit im Winter mit Schlaf… [+4400 chars]",,de,'milden Winter'
https://taz.de/Brand-bei-Gruenheide/!5995895/,https://taz.de/Brand-bei-Gruenheide/!5995895/,0,taz.de,Brand bei Grünheide: Tesla-Werk evakuiert,"Am frühen Morgen hat südlich von Berlin ein Strommast gebrannt, die Energieversorgung wurde unterbrochen. Nun steht die Gigafactory still.",https://taz.de/picture/6868477/948/34816209-1.jpeg,2024-03-05T09:02:00Z,,"Am frühen Morgen hat südlich von Berlin ein Strommast gebrannt, die Energieversorgung wurde unterbrochen. Nun steht die Gigafactory still.
Das Tesla-Werk in Grünheide
GRÜNHEIDEdpa/rtr | Die Produkt… [+2148 chars]",,de,'Energieversorgung'
https://taz.de/Energiekrise-vorbeugen/!5993634/,https://taz.de/Energiekrise-vorbeugen/!5993634/,0,taz.de,Energiekrise vorbeugen: EU hält am Gassparen fest,Die EU-Energiekommissarin kritisiert die deutschen Umlagen beim Gashandel als unsolidarisch. Ihre bisherigen Sparziele hat die Union erreicht.,https://taz.de/picture/6871921/948/348Gas-Energie-Deutschland-1.jpeg,2024-03-05T16:49:00Z,,"Die EU-Energiekommissarin kritisiert die deutschen Umlagen beim Gashandel als unsolidarisch. Ihre bisherigen Sparziele hat die Union erreicht.
Der Erdgasspeicher Bierwang in Mühldorf am Inn Foto: Fr… [+3499 chars]",,de,'Energie sparen'
https://futurezone.at/digital-life/herd-integriert-akku-batterie-speicher-kochen-blackout-stromnetz-stromausfall-induktion/402807514,https://futurezone.at/digital-life/herd-integriert-akku-batterie-speicher-kochen-blackout-stromnetz-stromausfall-induktion/402807514,0,futurezone.at,Herde mit integriertem Akku: Auch beim Blackout groß aufkochen,"Eine neue Produktkategorie kann helfen, Leistungsspitzen abzufangen, das Stromnetz zu schonen und Stromausfälle zu überbrücken.",https://image.futurezone.at/images/facebook/8570692/impulseherdi.jpg,2024-03-06T05:00:00Z,,"Eine neue Produktkategorie kann helfen, Leistungsspitzen abzufangen, das Stromnetz zu schonen und Stromausfälle zu überbrücken.
Die Herd-Backofen-Kombi Charlie von Channing Street Copper enthält ein… [+119 chars]",,de,'Blackout'
https://www.stern.de/gesellschaft/regional/berlin-brandenburg/autoindustrie--dihk-mahnt-besseren-schutz-von-unternehmen-an-34519930.html,https://www.stern.de/gesellschaft/regional/berlin-brandenburg/autoindustrie--dihk-mahnt-besseren-schutz-von-unternehmen-an-34519930.html,0,www.stern.de,Autoindustrie: DIHK mahnt besseren Schutz von Unternehmen an,"Der Anschlag auf die Stromversorgung des Tesla-Werks in Grünheide bei Berlin zeigt nach Einschätzung der Deutschen Industrie- und Handelskammer, dass sich physische Sicherheit und die Sicherheit von Daten und Informationen nicht mehr trennen lassen. ""Politik …",https://image.stern.de/34519932/t/El/v1/w1440/r1.7778/-/06--urnnewsmldpacom2009010124030699237363v2w800h600l480t269r1440b809jpeg---ef65f52c9968c6fa.jpg,2024-03-06T08:34:28Z,,"Der Anschlag auf die Stromversorgung des Tesla-Werks in Grünheide bei Berlin zeigt nach Einschätzung der Deutschen Industrie- und Handelskammer, dass sich physische Sicherheit und die Sicherheit von … [+2215 chars]",,de,'Blackout'
https://www.diepresse.com/18246767/die-ukraine-wird-ab-2025-kein-russisches-gas-mehr-nach-europa-lassen-betroffen-ist-vor-allem-oesterreich,https://www.diepresse.com/18246767/die-ukraine-wird-ab-2025-kein-russisches-gas-mehr-nach-europa-lassen-betroffen-ist-vor-allem-oesterreich,0,www.diepresse.com,Die Ukraine wird ab 2025 kein russisches Gas mehr nach Europa lassen - betroffen ist vor allem Österreich [premium],"Der ukrainische Energieminister zerstreut Hoffnungen, dass nach Auslaufen der Transitverträge doch noch über private kommerzielle Verträge weiter Gas fließen wird. Und er bringt einen eigenen ukrainischen Lösungsvorschlag ins Spiel. Wird es für Österreichs Ve…",https://img.diepresse.com/public/incoming/fky9fo-A-pipe-and-a-valve-are-seen-at-a-Ukrainian-main-pipeline-in-the-village-of-Boyarka-near-the-capital-Kiev_1664192757719562.jpg/alternates/DPR_SOCIAL_NACHRICHTEN_PAID/A-pipe-and-a-valve-are-seen-at-a-Ukrainian-main-pipeline-in-the-village-of-Boyarka-near-the-capital-Kiev_1664192757719562.jpg,2024-03-06T08:53:20Z,,"Der ukrainische Energieminister zerstreut Hoffnungen, dass nach Auslaufen der Transitverträge doch noch über private kommerzielle Verträge weiter Gas fließen wird. Und er bringt einen eigenen ukraini… [+926 chars]",,de,'Gas Ukraine'
https://www.stern.de/gesellschaft/regional/berlin-brandenburg/us-autobauer--stromausfall-bei-tesla--debatte-um-schutz-der-infrastruktur-34519930.html,https://www.stern.de/gesellschaft/regional/berlin-brandenburg/us-autobauer--stromausfall-bei-tesla--debatte-um-schutz-der-infrastruktur-34519930.html,0,www.stern.de,US-Autobauer: Stromausfall bei Tesla: Debatte um Schutz der Infrastruktur,Der Angriff auf die Stromversorgung mit gewaltigen Folgen für den Autobauer Tesla in Grünheide hat die Politik aufgeschreckt. Wie kann der Staat die Energieversorgung als kritische Infrastruktur schützen?,https://image.stern.de/34519932/t/gH/v2/w1440/r1.7778/-/06--urnnewsmldpacom2009010124030699237363v2w800h600l480t269r1440b809jpeg---ef65f52c9968c6fa.jpg,2024-03-06T10:08:56Z,,Der Angriff auf die Stromversorgung mit gewaltigen Folgen für den Autobauer Tesla in Grünheide hat die Politik aufgeschreckt. Wie kann der Staat die Energieversorgung als kritische Infrastruktur schü… [+4021 chars],,de,'Stromversorgung'
https://www.tagesspiegel.de/politik/das-gefahrdungspotenzial-ist-hoch-faeser-warnt-nach-anschlag-auf-tesla-stromversorgung-vor-linksextremen-11320546.html,https://www.tagesspiegel.de/politik/das-gefahrdungspotenzial-ist-hoch-faeser-warnt-nach-anschlag-auf-tesla-stromversorgung-vor-linksextremen-11320546.html,0,www.tagesspiegel.de,„Das Gefährdungspotenzial ist hoch“: Faeser warnt nach Anschlag auf Tesla-Stromversorgung vor Linksextremen,Bundesinnenministerin Faeser sieht die Gefahr durch Linksextremismus auf einem hohen Niveau. Nach dem Anschlag auf das Tesla-Werk in Grünheide wird über den Schutz von Infrastruktur diskutiert.,https://www.tagesspiegel.de/images/bundesinnenministerin-faeser-besucht-brasilien1/alternates/BASE_16_9_W1400/bundesinnenministerin-faeser-besucht-brasilien.jpeg,2024-03-06T10:18:40Z,,Bundesinnenministerin Nancy Faeser (SPD) hat nach dem Brandanschlag auf die Stromversorgung nahe dem Tesla-Werk im brandenburgischen Grünheide vor einer von der gewaltbereiten linksextremistischen Sz… [+3411 chars],,de,'Stromversorgung'
https://www.zeit.de/news/2024-03/06/landesregierung-beschliesst-erhoehung-des-windeuro,https://www.zeit.de/news/2024-03/06/landesregierung-beschliesst-erhoehung-des-windeuro,0,www.zeit.de,Energieversorgung: Landesregierung beschließt Erhöhung des «Windeuro»,"Hier finden Sie Informationen zu dem Thema „Energieversorgung“. Lesen Sie jetzt „Landesregierung beschließt Erhöhung des ""Windeuro""“.",https://img.zeit.de/news/2024-03/06/landesregierung-beschliesst-erhoehung-des-windeuro-image-group/wide__1300x731,2024-03-06T15:32:52Z,,"Brandenburg will ab 2026 den sogenannten Windeuro erhöhen - eine Sonderabgabe der Betreiber von Windenergieanlagen an die umliegenden Kommunen. Wie das Wirtschaftsministerium am Mittwoch mitteilte, s… [+2523 chars]",,de,'Energieversorgung'
https://www.stern.de/wirtschaft/nachbarland-plant-atomkraftwerk-an-nrw-grenze---gefahr-fuer-buerger--34520160.html,https://www.stern.de/wirtschaft/nachbarland-plant-atomkraftwerk-an-nrw-grenze---gefahr-fuer-buerger--34520160.html,0,www.stern.de,Energieversorgung: Nachbarland plant Atomkraftwerk an NRW-Grenze – Gefahr für Bürger?,Vergangenes Jahr gingen die letzten deutschen AKW vom Netz. Nie wieder sollte ein Unfall oder die Endlagerung von Atommüll unsere Gesundheit gefährden. Ein Nachbarland stellt diese Sicherheit nun infrage.,https://image.stern.de/34521044/t/Hr/v2/w1440/r1.7778/-/niederlande-baut-neue-atomkraftwerke-bild-5.jpg,2024-03-06T16:42:00Z,,"Nach dem Super-GAU von Fukushima im Jahr 2011 hatte Deutschland den Atomausstieg beschlossen. Letztes Jahr gingen dann die letzten drei deutschen Kernkraftwerke vom Netz: Isar 2, Neckarwestheim 2 und… [+3614 chars]",,de,'Energieversorgung'
