index,url,valid,domain,title,description,image,published,archive,content,quote,language,keyword
https://taz.de/Energiepolitik-der-Bundesregierung/!6159456/,https://taz.de/Energiepolitik-der-Bundesregierung/!6159456/,0,taz.de,Energiepolitik der Bundesregierung: Der Irankrieg und die deutschen Heizungen,"Die Preisschocks wegen des Irankonflikts zeigen, dass Deutschland sich von den Fossilen lösen muss. Doch die Bundesregierung tut genau das Gegenteil.",https://taz.de/picture/8291113/1200/Iran-USA-Krieg-Energiewende.jpeg,2026-03-03T14:51:00Z,,"Die Preisschocks wegen des Irankonflikts zeigen, dass Deutschland sich von den Fossilen lösen muss. Doch die Bundesregierung tut genau das Gegenteil. mehr...",,de,'Energiepolitik'
https://www.n-tv.de/wirtschaft/Preise-fuer-Diesel-und-Benzin-steigen-auf-hoechste-Werte-seit-zwei-Jahren-id30426815.html,https://www.n-tv.de/wirtschaft/Preise-fuer-Diesel-und-Benzin-steigen-auf-hoechste-Werte-seit-zwei-Jahren-id30426815.html,0,www.n-tv.de,Heizöl deutlich verteuert: Preise für Diesel und Benzin steigen auf höchste Werte seit zwei Jahren,Die Auswirkungen des Kriegs im Nahen Osten kommen umgehend bei den Verbrauchern in Deutschland an. Die Preise an den Tankstellen schnellen deutlich nach oben. Auch beim Heizöl wird es teurer.,https://www.n-tv.de/img/30426812/1772551380/Img_16_9/1200/Prix-de-l-essence-une-forte-hausse-redoutee-dans-les-stations-services-afflux-de-conducteur-pour-faire-le-plein-Promenade-des-Anglais.jpg,2026-03-03T15:06:15Z,,"Heizöl deutlich verteuertPreise für Diesel und Benzin steigen auf höchste Werte seit zwei Jahren
Derzeit eine besonders teure Angelegenheit: Tanken. (Foto: picture alliance / SIPA)
Die Auswirkungen… [+3901 chars]",,de,'Heizöl'
https://www.focus.de/finanzen/100-liter-fuer-130-euro-heizoel-lieferant-raet-kunden-zum-abwarten-und-spricht-ueber-hoelle-am-wochenstart_3cd030c3-c0fb-4661-8adc-a03a84aafecb.html,https://www.focus.de/finanzen/100-liter-fuer-130-euro-heizoel-lieferant-raet-kunden-zum-abwarten-und-spricht-ueber-hoelle-am-wochenstart_3cd030c3-c0fb-4661-8adc-a03a84aafecb.html,0,www.focus.de,"100 Liter für 130 Euro: Heizöl-Lieferant rät Kunden zum Abwarten und spricht über ""Hölle"" am Wochenstart","Seit Montag hören bei vielen Heizöl-Lieferanten die Telefone nicht mehr auf zu klingeln. Im Gespräch mit FOCUS online berichten zwei Unternehmer, wie sich der Iran-Krieg auf ihre Geschäft und die Kunden auswirkt.",https://quadro.burda-forward.de/ctf/637d98a3-05ac-4f59-9e98-2bd63a9bd125.c347ef4e-3cf3-41f9-ab31-daf853777a01.jpg?im=RegionOfInterestCrop%3D%281200%2C630%29%2CregionOfInterest%3D%28470%2C281.5%29&hash=7d95b81a1782723cbcd780eb501aa9135226e9b9bafcfb9ef75be3843419aa24,2026-03-03T15:07:00Z,,"So stressig läuft der Wochenstart bei Manuel Weiss selten. Der Tag gestern war die Hölle, sagt der Heizöl-Lieferant aus Worms im Gespräch mit FOCUS online am Dienstag. Von 5 Uhr morgens an habe sein … [+4269 chars]",,de,'Heizöl'
https://www.bild.de/leben-wissen/mein-geld-finanzportal/krieg-im-nahen-osten-schon-wieder-droht-ein-heizkosten-schock-69a6c9d5083f7c40d021a79b,https://www.bild.de/leben-wissen/mein-geld-finanzportal/krieg-im-nahen-osten-schon-wieder-droht-ein-heizkosten-schock-69a6c9d5083f7c40d021a79b,0,www.bild.de,Krieg im Nahen Osten - Schon wieder droht ein Heizkosten-Schock,Öl- und Gaspreise steigen durch den Iran-Krieg erneut. Verbraucher spüren Heizöl-Preisschock sofort. Wie heftig wird es Verbraucher bei uns noch treffen?,"https://images.bild.de/69a6c9d5083f7c40d021a79b/a63d087f99197168869247f040f42e25,d6d3083f?w=1280",2026-03-03T15:13:42Z,,"+++Kranke, Schwangere und Kinder dürfen mit Erster deutscher Rückholflug startet Mittwoch aus dem Oman
+++Kranke, Schwangere und Kinder dürfen mit Erster deutscher Rückholflug startet Mittwoch aus d… [+838 chars]",,de,'Heizöl'
https://taz.de/Preisspruenge-wegen-Irankrieg/!6159375/,https://taz.de/Preisspruenge-wegen-Irankrieg/!6159375/,0,taz.de,Preissprünge wegen Irankrieg: EU und Bund setzen Energie-Krisenstäbe ein,"Der Großhandelspreis beim Gas verdoppelt sich, die Kosten für Sprit und Heizöl ziehen an. Grüne kritisieren Festhalten der Regierung an Fossilen.",https://taz.de/picture/8290522/1200/Energiesicherheit-Deutschland.jpeg,2026-03-03T15:23:00Z,,"Der Großhandelspreis beim Gas verdoppelt sich, die Kosten für Sprit und Heizöl ziehen an. Grüne kritisieren Festhalten der Regierung an Fossilen. mehr...",,de,'Heizöl'
https://www.nzz.ch/wirtschaft/der-iran-krieg-kommt-an-den-schweizer-tankstellen-an-aber-am-staerksten-steigen-die-preise-fuer-heizoel-ld.1927467,https://www.nzz.ch/wirtschaft/der-iran-krieg-kommt-an-den-schweizer-tankstellen-an-aber-am-staerksten-steigen-die-preise-fuer-heizoel-ld.1927467,0,www.nzz.ch,Der Iran-Krieg kommt an den Schweizer Tankstellen an – aber am stärksten steigen die Preise für Heizöl,Der Rohstoff Erdöl hat sich wegen des Iran-Krieges deutlich verteuert. Das spüren nun auch die Konsumenten in der Schweiz.,"https://img.nzz.ch/2026/03/03/8d365760-4fbd-461f-8e25-0e02c03a5c31.jpg?width=1200&height=675&fit=bounds&quality=75&auto=webp&crop=7089,3988,x0,y117&wmark=nzz",2026-03-03T15:58:59Z,,"Der Rohstoff Erdöl hat sich wegen des Iran-Krieges deutlich verteuert. Das spüren nun auch die Konsumenten in der Schweiz.
Zusammenfassung
Merken
Schweizer Autofahrer müssen mit höheren Kosten pro… [+5343 chars]",,de,'Heizöl'
https://www.zeit.de/politik/2026-03/oel-gaspreise-nahost-krise-verbraucher-nachrichtenpodcast,https://www.zeit.de/politik/2026-03/oel-gaspreise-nahost-krise-verbraucher-nachrichtenpodcast,0,www.zeit.de,Öl- und Gaspreise: Wie sich der Krieg gegen den Iran auf den Spritpreis auswirkt,Nach der Eskalation im Nahen Osten steigen Öl- und Gaspreise weltweit stark an. Was bedeutet das für Verbraucher? Und: Erstes Flugzeug holt Deutsche aus Dubai zurück.,https://img.zeit.de/politik/2026-03/oel-gaspreise-nahost/wide__1300x731,2026-03-03T16:09:12Z,,Die Preise für Öl und Gas sind seit dem Krieg gegen den Iran deutlich gestiegen. Ölpreise legten zeitweise um mehr als zehn Prozent zu und erreichten den höchsten Stand seit 2024. Auch Gas verteuerte… [+2250 chars],,de,'Heizöl'
https://www.n-tv.de/wirtschaft/Warum-die-Energiekrise-noch-nicht-zurueckkehrt-id30426106.html,https://www.n-tv.de/wirtschaft/Warum-die-Energiekrise-noch-nicht-zurueckkehrt-id30426106.html,0,www.n-tv.de,Keine Panik wie 2022: Warum die Energiekrise (noch) nicht zurückkehrt,An den Börsen schnellen die Preise für Gas und Öl in die Höhe. Warnungen vor einer Rückkehr der Inflation werden laut und Erinnerungen an die Energiekrise ab 2022 wach. Doch der Energiemarkt hat sich grundlegend verändert.,https://www.n-tv.de/img/30426167/1772545380/Img_16_9/1200/A-man-fills-his-fuel-canister-at-an-Aral-gas-station-in-Berlin-Germany-March-2-2026.jpg,2026-03-03T17:22:41Z,,"An den Tankstellen ist der steigende Ölpreis sofort zu spüren. (Foto: REUTERS)
An den Börsen schnellen die Preise für Gas und Öl in die Höhe. Warnungen vor einer Rückkehr der Inflation werden laut u… [+5380 chars]",,de,'Energiemarkt'
https://www.n-tv.de/politik/Merz-warnt-Trump-vor-wirtschaftlichen-Folgen-des-Irak-Krieges-id30427723.html,https://www.n-tv.de/politik/Merz-warnt-Trump-vor-wirtschaftlichen-Folgen-des-Irak-Krieges-id30427723.html,0,www.n-tv.de,"Frieden ""so schnell wie möglich"": Merz warnt Trump vor wirtschaftlichen Folgen des Irak-Krieges","Friedrich Merz ist zum dritten Mal zu Gast im Weißen Haus. Der Bundeskanzler lobt Trump für den Kampf gegen das Regime im Iran - warnt zugleich aber vor steigenden Öl- und Gaspreisen, was beide Länder hart treffen würde.",https://www.n-tv.de/img/30427707/1772561915/Img_16_9/1200/US-Praesident-Donald-Trump-r-empfaengt-Bundeskanzler-Friedrich-Merz-CDU-im-Weissen-Haus-Themen-sind-der-Krieg-im-Iran-der-Zollstreit-zwischen-der-EU-und-den-USA-gehen-der-russische-Angriffskrieg-gegen-die-Ukraine-und-die-China-Politik.jpg,2026-03-03T17:59:07Z,,"US-Präsident Donald Trump empfängt Bundeskanzler Friedrich Merz im Weißen Haus. (Foto: picture alliance/dpa)
Friedrich Merz ist zum dritten Mal zu Gast im Weißen Haus. Der Bundeskanzler lobt Trump f… [+1611 chars]",,de,'Krieg Gas'
https://www.faz.net/aktuell/wirtschaft/klima-nachhaltigkeit/iran-krieg-angst-vor-neuer-energiekrise-110847206.html,https://www.faz.net/aktuell/wirtschaft/klima-nachhaltigkeit/iran-krieg-angst-vor-neuer-energiekrise-110847206.html,0,www.faz.net,Irankrieg: Angst vor neuer Energiekrise,"Die Gaspreise schießen weiter in die Höhe, Strom dürfte mittelfristig teurer werden. Der Irankrieg droht zur nächsten Belastung für Verbraucher und Industrie zu werden.",https://media0.faz.net/image/w1200h627/53a547207e91/w3000h1567x0y356o/032022/1.10847204/derzeit-gefaehrlich-leer-die.webp,2026-03-03T18:26:34Z,,"Die angespannte Lage auf dem Gasmarkt hat sich am Dienstag weiter verschärft. Der Energieträger wurde infolge des Konfliktes im Nahen Osten zwischenzeitlich zu 65 Euro je Megawattstunde gehandelt, ei… [+6994 chars]",,de,'Energiekrise'
https://www.zeit.de/wirtschaft/2026-03/gas-preise-iran-katar-energieversorgung,https://www.zeit.de/wirtschaft/2026-03/gas-preise-iran-katar-energieversorgung,0,www.zeit.de,"Gas: ""Am LNG-Markt herrscht Panik""","Der Irankrieg trifft die globalen Energiemärkte ins Mark. Gas wird so teuer, dass Experten alarmiert sind. Wann kommen die extremen Preissprünge beim Verbraucher an?",https://img.zeit.de/wirtschaft/2026-03/erdgas-erdgasspeicher-speicheranlage/wide__1300x731,2026-03-03T19:08:41Z,,"Schließen
Artikelzusammenfassung
Die Kriegswirren in der Golf-Region treffen nicht nur die Menschen vor Ort, sondern haben auch massive Auswirkungen auf die globalen Energiemärkte. QatarEnergy, ein… [+841 chars]",,de,'LNG'
https://www.n-tv.de/wirtschaft/Deutschlands-Gasspeicher-fuellen-sich-trotz-Nahost-Konflikt-langsam-wieder-id30428131.html,https://www.n-tv.de/wirtschaft/Deutschlands-Gasspeicher-fuellen-sich-trotz-Nahost-Konflikt-langsam-wieder-id30428131.html,0,www.n-tv.de,Netzagentur erwartet hohe Preise: Deutschlands Gasspeicher füllen sich trotz Nahost-Konflikt langsam wieder,"Die gestiegenen Energiepreise seien ""ein harter Schlag"" für die Industrie, doch Lieferengpässe fürchtet Bundesnetzagentur-Chef Klaus Müller nicht. Sollte der Konflikt in der Golfregion aber länger andauern, könnten auch Privathaushalte die Auswirkungen spüren.",https://www.n-tv.de/img/30428168/1772573155/Img_16_9/1200/Klaus-Mueller-Praesident-der-Bundesnetzagentur-spricht-waehrend-der-Digitalmesse-Republica-in-der-Station-Berlin.jpg,2026-03-03T21:08:48Z,,"Klaus Müller, Präsident der Bundesnetzagentur, sieht vorerst keine Versorgungsprobleme. (Foto: picture alliance/dpa)
Die gestiegenen Energiepreise seien ""ein harter Schlag"" für die Industrie, doch L… [+1786 chars]",,de,'Netzagentur'
https://www.faz.net/aktuell/wirtschaft/unternehmen/iran-krieg-stahl-aluminium-und-chemie-fuerchten-hohe-energiepreise-accg-110847198.html,https://www.faz.net/aktuell/wirtschaft/unternehmen/iran-krieg-stahl-aluminium-und-chemie-fuerchten-hohe-energiepreise-accg-110847198.html,0,www.faz.net,Eskalation in Nahost: Die Industrie fürchtet den Energiepreisschock,"Chemie-, Stahl- und Aluminiumbranche machen sich Sorgen wegen der Folgen der Kämpfe in Nahost. Die IG Metall zieht sogar Parallelen zur Energiekrise 2022.",https://media0.faz.net/image/w1200h627/41e251ff9881/w3000h1567x0y60o/202601/43601.0.1669210702/gaskraftwerke-bestimmen-oft.webp,2026-03-04T05:53:59Z,,"Die eskalierende Lage in Iran und in Nahost könnte den energieinten­siven Industrien hierzulande schwer zu schaffen machen. Branchen wie Chemie, Stahl und Aluminium kämpfen in Deutschland ohnehin mit… [+7072 chars]",,de,'Gas Industrie'
https://www.focus.de/finanzen/100-liter-fuer-130-euro-heizoel-lieferant-raet-kunden-zum-abwarten-und-spricht-ueber-hoelle-wegen-des-iran-kriegs_3cd030c3-c0fb-4661-8adc-a03a84aafecb.html,https://www.focus.de/finanzen/100-liter-fuer-130-euro-heizoel-lieferant-raet-kunden-zum-abwarten-und-spricht-ueber-hoelle-wegen-des-iran-kriegs_3cd030c3-c0fb-4661-8adc-a03a84aafecb.html,0,www.focus.de,"100 Liter für 130 Euro: Heizöl-Lieferant rät Kunden zum Abwarten und spricht über ""Hölle"" wegen des Iran-Kriegs","Seit Montag hören bei vielen Heizöl-Lieferanten die Telefone nicht mehr auf zu klingeln. Im Gespräch mit FOCUS online berichten zwei Unternehmer, wie sich der Iran-Krieg auf ihre Geschäft und die Kunden auswirkt.",https://quadro.burda-forward.de/ctf/637d98a3-05ac-4f59-9e98-2bd63a9bd125.c347ef4e-3cf3-41f9-ab31-daf853777a01.jpg?im=RegionOfInterestCrop%3D%281200%2C630%29%2CregionOfInterest%3D%28470%2C281.5%29&hash=7d95b81a1782723cbcd780eb501aa9135226e9b9bafcfb9ef75be3843419aa24,2026-03-04T07:08:00Z,,"So stressig läuft der Wochenstart bei Manuel Weiss selten. Der Tag gestern war die Hölle, sagt der Heizöl-Lieferant aus Worms im Gespräch mit FOCUS online am Dienstag. Von 5 Uhr morgens an habe sein … [+4269 chars]",,de,'Heizöl'
https://www.welt.de/wirtschaft/video69a8062a906b538390b6585c/steigende-energiepreise-bin-furchtbar-enttaeuscht-von-den-gruenen-sagt-stelter.html,https://www.welt.de/wirtschaft/video69a8062a906b538390b6585c/steigende-energiepreise-bin-furchtbar-enttaeuscht-von-den-gruenen-sagt-stelter.html,0,www.welt.de,"„Bin furchtbar enttäuscht von den Grünen“, sagt Stelter","Ökonom Daniel Stelter analysiert die Auswirkungen des Iran-Krieges auf die Wirtschaft. Er warnt vor Panik und fordert mehr Resilienz für Deutschland. „Wenn wir die AKW nicht abgerissen hätten, hätten wir mehr Unabhängigkeit“, sagt Stelter.",https://images.welt.de/69a8062a906b538390b6585c/e73cf28a19da9c25432c992761a6d188/ci16x9-w1200/dr-daniel-stelter-2019-14,2026-03-04T10:51:50Z,,"Ökonom Daniel Stelter analysiert die Auswirkungen des Iran-Krieges auf die Wirtschaft. Er warnt vor Panik und fordert mehr Resilienz für Deutschland. Wenn wir die AKW nicht abgerissen hätten, hätten … [+97 chars]",,de,'AKW'
https://www.n-tv.de/politik/Reiche-plant-keine-Spritpreisbremse-id30430011.html,https://www.n-tv.de/politik/Reiche-plant-keine-Spritpreisbremse-id30430011.html,0,www.n-tv.de,"""Wir sehen keine Knappheit"": Reiche plant keine Spritpreisbremse",Der Krieg im Iran wirkt sich auf die Öl- und Gaspreise aus. Das macht sich an deutschen Tankstellen bemerkbar. Wirtschaftsministerin Reiche sieht die Versorgung nicht in Gefahr. Zu möglichen Krisenplänen hält sie sich bedeckt.,https://www.n-tv.de/img/30430056/1772625840/Img_16_9/1200/Katherina-Reiche-CDU-Bundesministerin-fuer-Wirtschaft-und-Energie-spricht-bei-der-Eroeffnung-der-Internationalen-Handwerksmesse.jpg,2026-03-04T11:39:57Z,,"Die Bundesregierung habe eine Taskforce eingesetzt, um die Entwicklung analysieren, so Reiche. (Foto: picture alliance/dpa)
Der Krieg im Iran wirkt sich auf die Öl- und Gaspreise aus. Das macht sich… [+2204 chars]",,de,'Heizöl'
https://www.n-tv.de/wirtschaft/Auch-Deutschland-wird-Gas-zu-diesen-Preisen-kaufen-muessen-id30429737.html,https://www.n-tv.de/wirtschaft/Auch-Deutschland-wird-Gas-zu-diesen-Preisen-kaufen-muessen-id30429737.html,0,www.n-tv.de,"Wiederholung der Energiekrise?: ""Auch Deutschland wird Gas zu diesen Preisen kaufen müssen""","Deutschland bezieht kein Flüssiggas aus Katar, Europa nur sehr wenig. Dennoch explodiert der hiesige Gaspreis durch den Iran-Konflikt. Auf Verbraucher im Pech schlagen die Verwerfungen bereits durch, sagte ein Energiemarktexperte bei ntv.de. Noch schlimmer tr…",https://www.n-tv.de/img/30429971/1772627054/Img_16_9/1200/Visitors-gather-at-the-exhibition-entrance-beneath-a-large-QatarEnergy-display-reading-Home-of-LNG-during-the-21st-International-Conference-and-Exhibition-on-Liquefied-Natural-Gas-LNG2026-This-photo-is-taken-on-February-2-2026-QatarEnergy-announces-a-complete-shutdown-of-its-liquefied-natural-gas-production-following-Iranian-drone-strikes-on-its-facilities-in-Ras-Laffan-and-Mesaieed-amid-a-wider-regional-escalation-on-March-2-2026-Photo-by-Noushad-Thekkayil-NurPhoto.jpg,2026-03-04T11:40:33Z,,"Katar, Heimat des Flüssigerdgases. Durch den Iran-Konflikt explodieren die LNG-Preise weltweit. Was bedeutet das für die deutsche Energieversorgung? (Foto: picture alliance / NurPhoto)
Deutschland b… [+9222 chars]",,de,'Flüssiggas'
https://www.focus.de/finanzen/preise-fuer-gas-und-explodieren-und-wir-sind-schutzlos_e78e78bf-7d72-485f-8ea1-20b17e5e85ed.html,https://www.focus.de/finanzen/preise-fuer-gas-und-explodieren-und-wir-sind-schutzlos_e78e78bf-7d72-485f-8ea1-20b17e5e85ed.html,0,www.focus.de,Preise für Gas und explodieren – und wir sind schutzlos,"Öl springt um 14 Prozent, Gas um mehr als 50 Prozent. Die Speicher sind nur zu einem Fünftel gefüllt. Der Krieg im Iran trifft Deutschland ins Mark. Wind und Sonne können uns nicht helfen.",https://quadro.burda-forward.de/ctf/809956ba-e601-4dab-8459-22aaaad0440f.43a2d44f-319e-4511-9857-4aca094f74a4.jpg?im=RegionOfInterestCrop%3D%281200%2C630%29%2CregionOfInterest%3D%281026%2C886%29&hash=a9ae7ff625dcd034b13866d5ebedc06bc156e419fd29f9cd62345c27b70449b4,2026-03-04T11:58:00Z,,"Drei Tage haben gereicht, um die Illusion von Deutschland als autark werdendes Energiewende-Land zu zerbröseln wie altes Mauerwerk. Seit dem vergangenen Wochenende zeigt der Weltmarkt, wer am längere… [+6568 chars]",,de,'Krieg Gas'
https://www.stern.de/politik/deutschland/katherina-reiche---ist-sie-in-der-krise-so-gut-wie-habeck---37189872.html,https://www.stern.de/politik/deutschland/katherina-reiche---ist-sie-in-der-krise-so-gut-wie-habeck---37189872.html,0,www.stern.de,Meinung: Krisenmanagerin Reiche: Ausgerechnet an Habeck muss sie sich jetzt messen lassen,"Energiepolitik in Zeiten des Krieges: Eben noch war Wirtschaftsministerin Reiche bemüht, den Geist des Vorgängers zu vertreiben. Jetzt muss sie es erstmal so gut machen wie er.",https://image.stern.de/37189870/t/02/v1/w1440/r1.7778/-/foto-katherina-reiche.jpg,2026-03-04T12:48:00Z,,"Kopiere den aktuellen Link
Zur Merkliste hinzufügen
Energiepolitik in Zeiten des Krieges: Eben noch war Wirtschaftsministerin Reiche bemüht, den Geist des Vorgängers zu vertreiben. Jetzt muss sie e… [+4795 chars]",,de,'Energiepolitik'
https://www.golem.de/sonstiges/zustimmung/auswahl.html?from=https://www.golem.de/news/irankrieg-wie-europa-eine-gaskrise-verhindern-kann-2603-206039.html&referer=https://t.co/a4bec5e70c,https://www.golem.de/sonstiges/zustimmung/auswahl.html?from=https://www.golem.de/news/irankrieg-wie-europa-eine-gaskrise-verhindern-kann-2603-206039.html&referer=https://t.co/a4bec5e70c,0,www.golem.de,Irankrieg: Wie Europa eine Gaskrise verhindern kann,"Durch den Irankrieg hat sich der Gaspreis verdoppelt. Viele Länder in der EU haben vorgesorgt, aber Deutschland bleibt zögerlich. Von Mario Petzold (Erneuerbare Energien, Akku)",,2026-03-04T13:00:01Z,,"Besuchen Sie Golem.de wie gewohnt mit Werbung und Tracking,
 indem Sie der Nutzung aller Cookies zustimmen.
 Details zum Tracking finden Sie im Privacy Center.
Skript wurde nicht geladen. Informat… [+607 chars]",,de,'Gas Erneuerbare'
https://www.focus.de/finanzen/kampf-um-trumps-lng-china-gegen-europa_0e8c59be-94fd-4b7c-9193-4004a5784f5e.html,https://www.focus.de/finanzen/kampf-um-trumps-lng-china-gegen-europa_0e8c59be-94fd-4b7c-9193-4004a5784f5e.html,0,www.focus.de,Kampf um Trumps LNG – China gegen Europa,"Am LNG-Markt herrscht ""Panik"". Die Krise im Iran treibt die Preise hoch. Außerdem muss China sich nach alternativen Zulieferern umsehen.",https://quadro.burda-forward.de/ctf/827dd99e-7183-48f5-b962-25c90b7d99cd.d1fb6d59-cf57-4357-85a0-ad77c2f12b45.jpg?im=RegionOfInterestCrop%3D%281200%2C630%29%2CregionOfInterest%3D%282787%2C1678%29&hash=c799349d94051dc18bffedb83e0af433edb1b658a230a5f3b3f79654e8a85e2c,2026-03-04T13:26:00Z,,"Für den Energiemarkt kam die Nachricht am Montag wie ein Paukenschlag: Sowohl der saudi-arabische Ölkonzern Saudi Aramco als auch QatarEnergy, der größte LNG-Hersteller der Welt, mussten die Produkti… [+3629 chars]",,de,'LNG'
https://www.welt.de/wirtschaft/article69a849b0563ae9c42dea45d3/sprit-immer-teurer-nutzen-mineraloelkonzerne-die-lage-aus-koalition-setzt-taskforce-zu-energiepreisen-ein.html,https://www.welt.de/wirtschaft/article69a849b0563ae9c42dea45d3/sprit-immer-teurer-nutzen-mineraloelkonzerne-die-lage-aus-koalition-setzt-taskforce-zu-energiepreisen-ein.html,0,www.welt.de,Nutzen Mineralölkonzerne die Lage aus? Koalition setzt Taskforce zu Energiepreisen ein,"Die Autofahrer stöhnen wegen der hohen Benzinpreise. Die Bundesregierung reagiert. „Sollte sich zeigen, dass Mineralölkonzerne geopolitische Unsicherheiten nutzen, um überzogene Gewinne zu erzielen, wäre das inakzeptabel“, warnt ein SPD-Politiker.",https://images.welt.de/69a849b0563ae9c42dea45d3/7753f79051831b001967340685e21b4f/ci16x9-w1200/579519395-jpg,2026-03-04T15:52:41Z,,"Die Autofahrer stöhnen wegen der hohen Benzinpreise. Die Bundesregierung reagiert. Sollte sich zeigen, dass Mineralölkonzerne geopolitische Unsicherheiten nutzen, um überzogene Gewinne zu erzielen, w… [+2319 chars]",,de,'Energiepreise'
https://www.morgenpost.de/berlin/article411367582/krieg-im-nahen-osten-berliner-wirtschaft-befuerchtet-negative-auswirkungen.html,https://www.morgenpost.de/berlin/article411367582/krieg-im-nahen-osten-berliner-wirtschaft-befuerchtet-negative-auswirkungen.html,0,www.morgenpost.de,Krieg im Nahen Osten: Das sind die Auswirkungen auf die Berliner Wirtschaft,"Benzin- und Heizölpreise gehen durch die Decke, die Straße von Hormus wird zum Nadelöhr. Die Wirtschaft fürchtet negative Folgen.",https://img.sparknews.funkemedien.de/411369150/411369150_1772640187_v16_9_1600.jpeg,2026-03-04T16:18:00Z,,Der Iran hatte den Schiffsverkehr durch die Straße von Hormus blockiert. Für den internationalen Handel ist diese Meerenge eine der wichtigsten Verkehrsrouten. Durch sie transportieren riesige Tanker… [+3078 chars],,de,'Heizöl'
https://www.stern.de/news/gas-tanker-sinkt-vor-libyen-nach-explosion---putin-spricht-von--terrorangriff--kiews-37190896.html,https://www.stern.de/news/gas-tanker-sinkt-vor-libyen-nach-explosion---putin-spricht-von--terrorangriff--kiews-37190896.html,0,www.stern.de,"Gas-Tanker sinkt vor Libyen nach Explosion - Putin spricht von ""Terrorangriff"" Kiews","Russland hat die Ukraine beschuldigt, einen russischen Flüssigerdgas-Frachter vor der libyschen Küste angegriffen und versenkt zu haben. Es handele sich um einen ""Terrorangriff"" Kiews, sagte Kreml-Chef Wladimir Putin am Mittwoch. Laut dem russischen Verteidig…",https://image.stern.de/37192238/t/I4/v1/w1440/r1.7778/-/04--symbolbild-eines-fluessigerdgastankers-lng---b4ea9f7d012e4422.jpg,2026-03-04T18:49:12Z,,"Kopiere den aktuellen Link
Zur Merkliste hinzufügen
Russland hat die Ukraine beschuldigt, einen russischen Flüssigerdgas-Frachter vor der libyschen Küste angegriffen und versenkt zu haben. Es hande… [+2039 chars]",,de,'Gas Putin'
https://www.faz.net/aktuell/wirtschaft/auto-verkehr/teurer-sprit-durch-iran-krieg-kommt-der-tankrabatt-zurueck-110847609.html,https://www.faz.net/aktuell/wirtschaft/auto-verkehr/teurer-sprit-durch-iran-krieg-kommt-der-tankrabatt-zurueck-110847609.html,0,www.faz.net,Irankrieg verteuert Sprit: Kommt jetzt der Tankrabatt zurück?,Angesichts des Preisanstiegs für Öl und Gas gibt es die ersten Rufe nach Entlastungen für Bürger und Unternehmen. Eine höhere Inflation und weniger Wachstum können Union und SPD in diesem Wahljahr nicht gebrauchen.,https://media0.faz.net/image/w1200h627/eb034c669454/w6000h3135x0y433o/202603/43601.0.1845343952/teures-tanken-die-spritpreise.webp,2026-03-04T20:23:36Z,,"Die AfD wittert ein Thema, mit dem sie Wähler mobilisieren kann. Postet mir Euren Benzinpreis-Schock unter dem Hashtag #DankeCDU, schrieb Fraktionschefin Alice Weidel am Mittwoch auf der Plattform X … [+6420 chars]",,de,'Inflation'
https://www.nzz.ch/wirtschaft/der-golfkrieg-hat-gravierende-folgen-fuer-die-globale-erdgasversorgung-droht-europa-nun-eine-neue-energiekrise-ld.1927626,https://www.nzz.ch/wirtschaft/der-golfkrieg-hat-gravierende-folgen-fuer-die-globale-erdgasversorgung-droht-europa-nun-eine-neue-energiekrise-ld.1927626,0,www.nzz.ch,Der Iran-Krieg hat gravierende Folgen für die globale Erdgasversorgung – droht Europa nun eine neue Energiekrise?,Der Preis für Erdgas ist seit Kriegsbeginn viel stärker gestiegen als der Erdölpreis. Das könnten zuerst Industrie- und später Privatkunden spüren – in Deutschland nicht zuletzt über den Strompreis.,"https://img.nzz.ch/2026/03/04/02a9655d-777b-476d-95aa-8750ebb4c4ed.jpg?width=1200&height=674&fit=bounds&quality=75&auto=webp&crop=4376,2461,x0,y211&wmark=nzz",2026-03-05T04:30:00Z,,"Der Preis für Erdgas ist seit Kriegsbeginn viel stärker gestiegen als der Erdölpreis. Das könnten zuerst Industrie- und später Privatkunden spüren in Deutschland nicht zuletzt über den Strompreis.
Z… [+8863 chars]",,de,'Energiekrise'
