index,url,valid,domain,title,description,image,published,archive,content,quote,language,keyword
https://www.zeit.de/wirtschaft/2023-10/energie-russland-europa-ukraine-krieg-energiepolitik,https://www.zeit.de/wirtschaft/2023-10/energie-russland-europa-ukraine-krieg-energiepolitik,0,www.zeit.de,Energie aus Russland: Europas dreckige Geschäfte mit Russland,Die EU will sich eigentlich von Russland unabhängig machen – doch noch immer fließen jeden Monat Gas und Öl im Milliardenwert. Nur ein Instrument könnte das beenden.,https://img.zeit.de/wirtschaft/2023-11/energie-russland-europa-ukraine-krieg-energiepolitik-bild/wide__1300x731,2023-11-02T06:55:44Z,,"Die Heizsaison hat begonnen und zwar unter anderen
Vorzeichen als noch im letzten Jahr: Die Gasspeicher sind vollständig gefüllt,
die Bundesnetzagenturblickt
optimistisch in den Winter. Und auch R… [+532 chars]",,de,'Russland Gas'
https://www.morgenpost.de/wirtschaft/article239912981/pelletspreise-aktuell-heute-2-november-heizen-heizung-energie.html,https://www.morgenpost.de/wirtschaft/article239912981/pelletspreise-aktuell-heute-2-november-heizen-heizung-energie.html,0,www.morgenpost.de,Energiepreise heute: Pelletspreise am 2. November: Der aktuelle Preis pro Tonne,Die Pelletspreise sind im Abwärtstrend ○ Wie viel kostet eine Tonne Pellets heute am 2. November? ○ Die aktuellen Preise finden Sie hier.,https://img.morgenpost.de/img/wirtschaft/crop238187879/258260833-w820-cv16_9-q85/Holzpellets-mit-Blatt-und-Baumstaemmen.jpg,2023-11-02T07:00:00Z,https://web.archive.org/web/20231102142623/https://www.morgenpost.de/wirtschaft/article239912981/pelletspreise-aktuell-heute-2-november-heizen-heizung-energie.html,Berlin. Die Heizperiode in Deutschland hat begonnen. Dennoch drehen etliche Verbraucherinnen und Verbraucher nur zögerlich am Heizungsregler: Schließlich erreichen die Heizkosten üblicherweise im Win… [+9762 chars],,de,'Energiepreise'
https://www.tagesschau.de/wirtschaft/bundesbank-praesident-interview-100.html,https://www.tagesschau.de/wirtschaft/bundesbank-praesident-interview-100.html,0,www.tagesschau.de,"Bundesbank-Chef: ""Deutschland ist nicht der kranke Mann Europas""","Es wird wieder Wirtschaftswachstum geben, sagt Bundesbankpräsident Nagel im Interview mit der ARD-Finanzredaktion. Was die Lage im Nahen Osten für wirtschaftliche Folgen hat - und wie das Inflationsziel erreicht werden soll.",https://images.tagesschau.de/image/95350f36-d4e1-4e2d-b7c1-13207078afb5/AAABi48O4sY/AAABibBxqrQ/16x9-1280/joachim-nagel-114.jpg,2023-11-02T08:00:29Z,,"Stand: 02.11.2023 09:00 Uhr
Es wird wieder Wirtschaftswachstum geben, sagt Bundesbankpräsident Nagel im Interview mit der ARD-Finanzredaktion. Was die Lage im Nahen Osten für wirtschaftliche Folgen … [+7589 chars]",,de,'Inflation'
https://www.morgenpost.de/politik/article239930302/Gasversorgung-So-ist-Deutschland-fuer-den-Winter-geruestet.html,https://www.morgenpost.de/politik/article239930302/Gasversorgung-So-ist-Deutschland-fuer-den-Winter-geruestet.html,0,www.morgenpost.de,Bundesnetzagentur: Gasversorgung: So ist Deutschland für den Winter gerüstet,Im letzten Winter stand die Gasversorgung in Deutschland noch auf der Kippe. So schätzt die Bundesnetzagentur die aktuelle Lage ein.,https://img.morgenpost.de/img/frontpage/crop239818291/7452604882-w820-cv16_9-q85/405041616.jpg,2023-11-02T08:55:29Z,,Berlin. Die mangelnde Gasversorgung bereitete im vergangenen Winter vielen Menschen große Sorgen. Doch in diesem Jahr wird es dafür voraussichtlich keinen Anlass geben: Der Chef der Bundesnetzagentur… [+3886 chars],,de,'Gaslieferungen'
https://www.faz.net/aktuell/wirtschaft/kohleausstieg-die-warnung-vor-einem-verfruehten-ausstieg-ist-richtig-19283805.html,https://www.faz.net/aktuell/wirtschaft/kohleausstieg-die-warnung-vor-einem-verfruehten-ausstieg-ist-richtig-19283805.html,0,www.faz.net,Debatte um früheren Ausstieg: Wir brauchen die Kohle,"Die Warnung vor einem verfrühten Kohleausstieg ist richtig und gut. Denn der Kernkraft vorzeitig Adieu zu sagen, war schon ein schwerer Fehler. Er darf sich im Falle der Kohle nicht wiederholen.",https://media1.faz.net/ppmedia/aktuell/politik/2349223851/1.9284315/facebook_teaser_fplus/bergbaumaschinen-im-tagebau.jpg,2023-11-02T08:58:06Z,,"Es ist gut und richtig, dass Finanzminister Christian Lindner (FDP) davor warnt, überstürzt aus der Kohleverstromung auszusteigen. Diese Haltung ist nicht, wie man zuweilen liest, eine Abkehr von der… [+374 chars]",,de,'Kohleausstieg'
https://www.stern.de/news/bundesnetzagentur-haelt-gasversorgung-in-diesem-winter-fuer-weitgehend-gesichert-33964376.html,https://www.stern.de/news/bundesnetzagentur-haelt-gasversorgung-in-diesem-winter-fuer-weitgehend-gesichert-33964376.html,0,www.stern.de,Bundesnetzagentur hält Gasversorgung in diesem Winter für weitgehend gesichert,"Volle Speicher, stabile Importe und anhaltende Einsparungen: Die Bundesnetzagentur hält Deutschlands Gasversorgung im anstehenden Winter für weitgehend gesichert. ""Die Ausgangssituation zu Beginn der Heizperiode ist deutlich besser als im vergangenen Jahr"", e…",https://image.stern.de/33964378/t/Xa/v1/w1440/r1.7778/-/02--thermostat---961a4af828fe0c07.jpg,2023-11-02T11:26:12Z,,"Volle Speicher, stabile Importe und anhaltende Einsparungen: Die Bundesnetzagentur hält Deutschlands Gasversorgung im anstehenden Winter für weitgehend gesichert. ""Die Ausgangssituation zu Beginn der… [+2512 chars]",,de,'Heizperiode'
https://www.zeit.de/news/2023-11/02/energiepreisbremsen-kosten-dem-staat-weniger-als-geplant,https://www.zeit.de/news/2023-11/02/energiepreisbremsen-kosten-dem-staat-weniger-als-geplant,0,www.zeit.de,Energie: Energiepreisbremsen kosten dem Staat weniger als geplant,Hier finden Sie Informationen zu dem Thema „Energie“. Lesen Sie jetzt „Energiepreisbremsen kosten dem Staat weniger als geplant“.,https://img.zeit.de/news/2023-11/02/energiepreisbremsen-kosten-dem-staat-weniger-als-geplant-image-group/wide__1300x731,2023-11-02T15:23:54Z,https://web.archive.org/web/20231104101209/https://www.zeit.de/news/2023-11/02/energiepreisbremsen-kosten-dem-staat-weniger-als-geplant,"Für die Preisbremsen bei Strom und Gas braucht der Bund bislang deutlich weniger Geld, als im Haushalt 2023 eingeplant ist. Zusammen sind es 31,2 Milliarden Euro, wie aus Zahlen des Wirtschaftsminist… [+2308 chars]",,de,'Energiekrise'
https://www.zeit.de/politik/deutschland/2023-11/ampelkoalition-fdp-offener-brief-bundesregierung,https://www.zeit.de/politik/deutschland/2023-11/ampelkoalition-fdp-offener-brief-bundesregierung,0,www.zeit.de,Ampelkoalition: Wenn Lokalpolitiker plötzlich Gehör finden,"Kohleausstieg, Migration, Industriestrom: Die FDP treibt aus Angst um ihre Bedeutung die Ampelkoalition in die Krise. Doch damit gefährdet sie sich am Ende selbst.",https://img.zeit.de/politik/deutschland/2023-11/ampelkoalition-fdp-offener-brief/wide__1300x731,2023-11-02T15:49:01Z,https://web.archive.org/web/20231104144948/https://www.zeit.de/politik/deutschland/2023-11/ampelkoalition-fdp-offener-brief-bundesregierung,"Soll die FDP die Ampelkoalition verlassen? Das fordert eine
Gruppe von 27 FDP-Mitgliedern in einem offenen Brief mit der Überschrift
""Weckruf Freiheit"". Im Zuge einer Generalabrechnung mit der Ampe… [+914 chars]",,de,'Kohleausstieg'
https://taz.de/Prognose-zur-Gasversorgung-im-Winter/!5967145/,https://taz.de/Prognose-zur-Gasversorgung-im-Winter/!5967145/,0,taz.de,Prognose zur Gasversorgung im Winter: Läuft doch,"Die Prognose der Bundesnetzagentur zur Gas-Versorgungslage im Winter klingt optimistisch. Was andere Krisen angeht, stimmt sie eher skeptisch.",https://taz.de/picture/6627344/948/33970107-1.jpeg,2023-11-02T17:50:00Z,https://web.archive.org/web/20231103102940/https://taz.de/Prognose-zur-Gasversorgung-im-Winter/!5967145/,"Die Prognose der Bundesnetzagentur zur Gas-Versorgungslage im Winter klingt optimistisch. Was andere Krisen angeht, stimmt sie eher skeptisch.
Einmal beherzt am Gasregler gedreht Foto: Revierfoto/im… [+1928 chars]",,de,'Bundesnetzagentur'
https://noe.orf.at/stories/3230881/,https://noe.orf.at/stories/3230881/,0,noe.orf.at,AUA-Chefin: „Inflation macht uns zu schaffen“,"Die Luftfahrt boomt wie kaum zuvor. Auch die AUA flog heuer starke Zuwächse ein. AUA-Chefin Annette Mann rechnet mit einem weiteren Wachstum in der Branche, sieht in Österreich aber auch Baustellen: „Die höhere Inflation macht uns sehr zu schaffen“.",https://ibs.orf.at/noe?image=https%3A%2F%2Foekastatic.orf.at%2Fmims%2F2023%2F44%2F90%2Fcrops%2Fw%3D1200%2Ch%3D627%2Cq%3D75%2F1995115_master_751490_b2a2a397-353f-4140-b3fe-143c9c264daf.jpg%3Fs%3D80c503cdabae4ae3674570304057633e3e148095,2023-11-02T18:07:42Z,,Die Austrian Airlines (AUA) erzielten im dritten Quartal ein deutliches Plus: So stieg der Umsatz gegenüber dem Vorjahreszeitraum um acht Prozent auf 741 Mio. Euro und das Betriebsergebnis (Ebit) um … [+7105 chars],,de,'Ukraine CO2'
https://www.stern.de/gesellschaft/regional/nordrhein-westfalen/notfalleinsatz--feuerwehr--hund-riecht-gas-und-warnt-vor-kellerbrand-33967034.html,https://www.stern.de/gesellschaft/regional/nordrhein-westfalen/notfalleinsatz--feuerwehr--hund-riecht-gas-und-warnt-vor-kellerbrand-33967034.html,0,www.stern.de,Notfalleinsatz: Feuerwehr: Hund riecht Gas und warnt vor Kellerbrand,"Ein Hund hat nach Angaben der Feuerwehr ein noch schlafendes Paar vor einem Gasaustritt im sauerländischen Olsberg gewarnt. Die Besitzerin des Tiers wachte am Freitagmorgen auf, weil es unruhig geworden sei, teilte die Feuerwehr mit. Abgase und Rauch seien au…",https://image.stern.de/33967036/t/Um/v1/w1440/r1.7778/-/03--urnnewsmldpacom2009010123110399808985v3w800h600l640t425r1920b1278jpeg---5fe6456dcd8696c5.jpg,2023-11-03T10:24:53Z,,"Ein Hund hat nach Angaben der Feuerwehr ein noch schlafendes Paar vor einem Gasaustritt im sauerländischen Olsberg gewarnt. Die Besitzerin des Tiers wachte am Freitagmorgen auf, weil es unruhig gewor… [+939 chars]",,de,'Gasaustritt'
https://www.zeit.de/news/2023-11/03/keine-umweltvertraeglichkeitspruefung-fuer-lng-terminal,https://www.zeit.de/news/2023-11/03/keine-umweltvertraeglichkeitspruefung-fuer-lng-terminal,0,www.zeit.de,Ministerium: Keine Umweltverträglichkeitsprüfung für LNG-Terminal,Hier finden Sie Informationen zu dem Thema „Ministerium“. Lesen Sie jetzt „Keine Umweltverträglichkeitsprüfung für LNG-Terminal“.,https://img.zeit.de/news/2023-11/03/keine-umweltvertraeglichkeitspruefung-fuer-lng-terminal-image-group/wide__1300x731,2023-11-03T15:07:06Z,,"Für das an Rügens Küste geplante Flüssigerdgas-Terminal (LNG) wird es nach Regierungsangaben in Schwerin keine Umweltverträglichkeitsprüfung geben. Zwar habe es zeitweise Zweifel gegeben, ob eine sol… [+2208 chars]",,de,'LNG'
https://www.stern.de/gesellschaft/regional/mecklenburg-vorpommern/ministerium--betreiberfirmen-erwarten-keine-verzoegerung-bei-lng-terminal--33968064.html,https://www.stern.de/gesellschaft/regional/mecklenburg-vorpommern/ministerium--betreiberfirmen-erwarten-keine-verzoegerung-bei-lng-terminal--33968064.html,0,www.stern.de,Ministerium: Betreiberfirmen erwarten keine Verzögerung bei LNG-Terminal,Zuletzt war vermehrt über mögliche Gründe für einen deutlich späteren Start des Rügener LNG-Terminals und vermeintliche Hinweise darauf spekuliert worden. Behörden und ein Vorhabenträger widersprechen.,https://image.stern.de/33968066/t/EF/v1/w1440/r1.7778/-/03--urnnewsmldpacom2009010123110399813332v3w800h600l640t430r1920b1293jpeg---fb0e8c4182e2da04.jpg,2023-11-03T16:04:14Z,https://web.archive.org/web/20231107044800/https://www.stern.de/gesellschaft/regional/mecklenburg-vorpommern/ministerium--betreiberfirmen-erwarten-keine-verzoegerung-bei-lng-terminal--33968064.html,Zuletzt war vermehrt über mögliche Gründe für einen deutlich späteren Start des Rügener LNG-Terminals und vermeintliche Hinweise darauf spekuliert worden. Behörden und ein Vorhabenträger widerspreche… [+3254 chars],,de,'Gasmangellage'
https://www.tagesspiegel.de/internationales/european-focus-50-wie-ist-die-energie-lage-in-europa-10722316.html,https://www.tagesspiegel.de/internationales/european-focus-50-wie-ist-die-energie-lage-in-europa-10722316.html,0,www.tagesspiegel.de,European Focus #50: Wie ist die Energie-Lage in Europa?,Ungarn spielt Russisches Energie-Roulette +++ Zahl der Woche: 10 +++ Warten auf den Angriff +++ „Eisbär“ zerstört mehrere Unterwasserkabel +++ „Frankreichs AKW-System ist wieder ein Aktivposten für die Energieversorgung“,https://www.tagesspiegel.de/images/main-logo-c-european-focusjpg/alternates/BASE_16_9_W1400/main-logo-c-european-focusjpg.jpeg,2023-11-03T16:18:30Z,https://web.archive.org/web/20231104022403/https://www.tagesspiegel.de/internationales/european-focus-50-wie-ist-die-energie-lage-in-europa-10722316.html,"Hallo aus Berlin, 
die Konflikte um uns herum eskalieren mit unglaublicher Geschwindigkeit. Nachdem wir in Europa schon seit gut eineinhalb Jahren mit dem Krieg in der Ukraine leben, sehen wir seitK… [+12142 chars]",,de,'AKW'
https://www.welt.de/wirtschaft/plus248250240/Erstes-Zeugnis-fuer-den-Superminister-so-gut-schlaegt-sich-Robert-Habeck.html,https://www.welt.de/wirtschaft/plus248250240/Erstes-Zeugnis-fuer-den-Superminister-so-gut-schlaegt-sich-Robert-Habeck.html,0,www.welt.de,Erstes Zeugnis für den Superminister – so schlägt sich Robert Habeck,"Vor zwei Jahren trat Robert Habeck als erster Bundesminister an, der gleichzeitig für Klimaschutz und Wirtschaft verantwortlich ist. Energiekrise, Heizungschaos oder auch der Ausbau der Erneuerbaren sind seine großen Herausforderungen. WELT analysiert, wie gu…",https://img.welt.de/img/wirtschaft/mobile248340664/3391359527-ci16x9-w1200-fnov-fpotl-fpi157750653/DWO-Teaser-WI-Habeck-Superminister-ks.jpg,2023-11-04T18:39:15Z,https://web.archive.org/web/20231105003127/http://www.welt.de/wirtschaft/plus248250240/Erstes-Zeugnis-fuer-den-Superminister-so-gut-schlaegt-sich-Robert-Habeck.html,"Als Robert Habeck am Dienstag den innerkoalitionären Wahlkampf einläutet, ist gerade erst die Hälfte seiner vierjährigen Amtszeit vorbei. Der grüne Vizekanzler stellt seine Industriestrategie vor ohn… [+6485 chars]",,de,'Winter Gas'
https://www.morgenpost.de/berlin/article239947484/Gasag-Chef-Es-ist-noch-viel-Nervositaet-im-Gasmarkt.html,https://www.morgenpost.de/berlin/article239947484/Gasag-Chef-Es-ist-noch-viel-Nervositaet-im-Gasmarkt.html,0,www.morgenpost.de,Energiepreise: Gasag-Chef: „Es ist noch viel Nervosität im Gasmarkt“,"Vorstandschef Georg Friedrichs spricht im Interview über die Sicherheit der Gasversorgung und die Frage, ob die Berliner weiterhin Gas sparen müssen.",https://img.morgenpost.de/img/frontpage/crop239947482/3807543082-w820-cv16_9-q85-fnov-fpi231768577-fpotl/405127171.jpg,2023-11-05T05:00:00Z,,=tqbo dmbttµ#bsujdmf``mpdbujpo#?Cfsmjo/'octq´=0tqbo?Hbtqsfjtf gbtu xjfefs bvg Wpslsjtfo.Ojwfbv voe wpmmf Hbttqfjdifs; L÷oofo xjs foemjdi bvgbunfo pefs nýttfo xjs bvdi jo ejftfn Xjoufs xjfefs ejf =tus… [+26831 chars],,de,'Gasmarkt'
https://www.faz.net/aktuell/technik-motor/schlusslicht-pipelines-in-der-pipeline-19286791.html,https://www.faz.net/aktuell/technik-motor/schlusslicht-pipelines-in-der-pipeline-19286791.html,0,www.faz.net,Schlusslicht: Pipelines in der Pipeline,Die Industrie kann jetzt mal aufhören zu jammern über den Standort und die Energiepreise. Das Thema ist gelöst. Das sollte sich auch der nörgelnde Christian Lindner mal merken.,https://media1.faz.net/ppmedia/aktuell/604037561/1.9288723/facebook_teaser/nach-der-pipeline-ist-vor-dem.jpg,2023-11-05T07:34:00Z,,"Die Woche ist gut gelaufen, wir spüren Entspannung. Nicht an der politisch-militärischen Front, dort leider nirgends, aber an der wirtschaftlichen. Die Inflationsrate ist im Oktober auf 3,8 Prozent g… [+2217 chars]",,de,'Energiepreise'
https://taz.de/Podcast-klima-update/!5970778/,https://taz.de/Podcast-klima-update/!5970778/,0,taz.de,Podcast „klima update°“: Die Klima-News der Woche,Das globale CO2-Budget schrumpft. Christian Lindner stellt den Kohleausstieg 2030 infrage. Fridays for Future in der Kritik.,https://taz.de/picture/6629372/948/33912658-1.jpeg,2023-11-05T08:43:00Z,,"Das globale CO2-Budget schrumpft. Christian Lindner stellt den Kohleausstieg 2030 infrage. Fridays for Future in der Kritik.
Wie verhalten sich die deutschen Fridays zu antisemitischen Positionen de… [+1144 chars]",,de,'Kohleausstieg'
https://www.faz.net/aktuell/politik/inland/wo-an-abwehrsystemen-gegen-drohnen-getueftelt-wird-19281512.html,https://www.faz.net/aktuell/politik/inland/wo-an-abwehrsystemen-gegen-drohnen-getueftelt-wird-19281512.html,0,www.faz.net,Strickscheid in der Eifel: Wo an Abwehrsystemen gegen Drohnen getüftelt wird,Abwehrsysteme sollen auch jenseits von Kriegen Flughäfen oder kritische Infrastruktur vor unbemannten Fluggeräten schützen. Einen allumfassenden Schutz bieten sie nicht. Zu Besuch bei einem Drohnenabwehrunternehmen.,https://media1.faz.net/ppmedia/aktuell/4024509402/1.9281511/facebook_teaser_fplus/kommandozentrale-das.jpg,2023-11-05T17:54:50Z,https://web.archive.org/web/20231105191808/https://www.faz.net/aktuell/politik/inland/wo-an-abwehrsystemen-gegen-drohnen-getueftelt-wird-19281512.html,"Die Drohne klingt bedrohlich. Wie ein Bienenschwarm, der immer näher kommt. Dabei wiegt eine DJI Mavic Air 2 gerade mal etwas mehr als 550 Gramm, ist kleiner als ein Fußball und man verliert sie schn… [+1165 chars]",,de,'Drohne Infrastruktur'
https://www.zeit.de/news/2023-11/05/erdgasspeicher-randvoll-bundesnetzagentur-erleichtert,https://www.zeit.de/news/2023-11/05/erdgasspeicher-randvoll-bundesnetzagentur-erleichtert,0,www.zeit.de,Heizperiode: Erdgasspeicher randvoll: Bundesnetzagentur erleichtert,Hier finden Sie Informationen zu dem Thema „Heizperiode“. Lesen Sie jetzt „Erdgasspeicher randvoll: Bundesnetzagentur erleichtert“.,https://img.zeit.de/news/2023-11/05/erdgasspeicher-randvoll-bundesnetzagentur-erleichtert-image-group/wide__1300x731,2023-11-05T19:07:45Z,,"Der Füllstand der deutschen Erdgasspeicher hat die Marke von 100 Prozent erreicht. Der europäische Gasspeicherverbands GIE registrierte genau 100,03 Prozent, wie aus im Internet veröffentlichten, vor… [+2279 chars]",,de,'Bundesnetzagentur'
https://www.stern.de/news/heizperiode--erdgasspeicher-randvoll--bundesnetzagentur-erleichtert-33972004.html,https://www.stern.de/news/heizperiode--erdgasspeicher-randvoll--bundesnetzagentur-erleichtert-33972004.html,0,www.stern.de,Heizperiode: Erdgasspeicher randvoll: Bundesnetzagentur erleichtert,Gute Nachrichten: Die 100-Prozent-Marke der Füllstände deutscher Erdgasspeicher ist erreicht. Für eine vollständige Entwarnung vor den kalten Wintermonaten ist es aber zu früh.,https://image.stern.de/33972006/t/ZI/v1/w1440/r1.7778/-/05--urnnewsmldpacom2009010123110599834762v4w800h600l535t274r1815b1127jpeg---b413438edf5243c6.jpg,2023-11-05T19:07:45Z,https://web.archive.org/web/20231107054525/https://www.stern.de/news/heizperiode--erdgasspeicher-randvoll--bundesnetzagentur-erleichtert-33972004.html,"Gute Nachrichten: Die 100-Prozent-Marke der Füllstände deutscher Erdgasspeicher ist erreicht. Für eine vollständige Entwarnung vor den kalten Wintermonaten ist es aber zu früh.
Der Füllstand der deu… [+1551 chars]",,de,'Winter Gas'
https://www.focus.de/finanzen/news/heizperiode-erdgasspeicher-randvoll-bundesnetzagentur-erleichtert_id_239886631.html,https://www.focus.de/finanzen/news/heizperiode-erdgasspeicher-randvoll-bundesnetzagentur-erleichtert_id_239886631.html,0,www.focus.de,Heizperiode - Erdgasspeicher randvoll: Bundesnetzagentur erleichtert,Gute Nachrichten: Die 100-Prozent-Marke der Füllstände deutscher Erdgasspeicher ist erreicht. Für eine vollständige Entwarnung vor den kalten Wintermonaten ist es aber zu früh.,https://p6.focus.de/img/finanzen/news/id_239886621/bei-der-speicheranlage-in-rehden-handelt-es-sich-um-den-groessten-erdgasspeicher-in-westeuropa..jpg?im=Crop%3D%280%2C170%2C2048%2C1024%29%3BResize%3D%281200%2C627%29&impolicy=perceptual&quality=mediumHigh&hash=b280523168e360293b895c5d59b5046f576a3b9a2bdccd7441210d9e8a2b4691,2023-11-05T19:10:06Z,,"Der Füllstand der deutschen Erdgasspeicher hat die Marke von 100 Prozent erreicht. Der europäische Gasspeicherverbands GIE registrierte genau 100,03 Prozent, wie aus im Internet veröffentlichten, vor… [+1327 chars]",,de,'Bundesnetzagentur'
https://www.faz.net/aktuell/wirtschaft/mehr-wirtschaft/deutsche-erdgasspeicher-randvoll-fuellstand-bei-100-prozent-19293366.html,https://www.faz.net/aktuell/wirtschaft/mehr-wirtschaft/deutsche-erdgasspeicher-randvoll-fuellstand-bei-100-prozent-19293366.html,0,www.faz.net,Energieversorgung: Füllstand deutscher Erdgasspeicher bei 100 Prozent,"100,03 Prozent beträgt der Füllstand des deutschen Erdgasspeichers am Sonntag – eine Menge, die den Verbrauch von zwei bis drei Wintermonaten abdeckt. Der Präsident der Bundesnetzagentur äußert sich erleichtert.",https://media1.faz.net/ppmedia/aktuell/wirtschaft/2493726689/1.9293371/facebook_teaser/die-groesste.jpg,2023-11-05T20:46:31Z,,"Der Füllstand der deutschen Erdgasspeicher hat am Sonntagmorgen die Marke von 100 Prozent erreicht. Der europäische Gasspeicherverbands GIE registrierte genau 100,03 Prozent, wie am Sonntagabend aus … [+1371 chars]",,de,'Energieversorgung'
https://www.zeit.de/wirtschaft/2023-11/erdgas-speicher-fuellstand-100-prozent,https://www.zeit.de/wirtschaft/2023-11/erdgas-speicher-fuellstand-100-prozent,0,www.zeit.de,Energie: Deutsche Erdgasspeicher sind zu 100 Prozent gefüllt,"Die zur Energieversorgung vor allem im Winter wichtigen Gasspeicher sind vollständig gefüllt, die Bundesnetzagentur zeigt sich zufrieden. Und rät dennoch zu Sparsamkeit.",https://img.zeit.de/wirtschaft/2023-11/erdgas-speicher-fuellstand-100-prozent-bild/wide__1300x731,2023-11-05T21:54:26Z,,Die Erdgasspeicher in Deutschland haben zu Beginn der kalten Jahreszeit einen Füllstand von 100 Prozent erreicht. Das geht aus vorläufigen Daten des europäischen Gasspeicherverbands (GIE) hervor. Die… [+2823 chars],,de,'Gasspeicher'
https://www.stern.de/news/energie--erdgasspeicher-in-deutschland-sind-randvoll-33972004.html,https://www.stern.de/news/energie--erdgasspeicher-in-deutschland-sind-randvoll-33972004.html,0,www.stern.de,Energie: Erdgasspeicher in Deutschland sind randvoll,"Als Russland im Sommer 2022 den wichtigsten Gashahn zudrehte, war die Sorge groß, dass im Winter zu wenig Erdgas da sein könnte. Doch so weit kam es nicht. Die Gasspeicher sind mittlerweile erneut randvoll.",https://image.stern.de/33972006/t/gE/v2/w1440/r1.7778/-/06--urnnewsmldpacom2009010123110599834762v4w800h600l535t274r1815b1127jpeg---b413438edf5243c6.jpg,2023-11-05T23:20:05Z,https://web.archive.org/web/20231107013914/https://www.stern.de/news/energie--erdgasspeicher-in-deutschland-sind-randvoll-33972004.html,"Als Russland im Sommer 2022 den wichtigsten Gashahn zudrehte, war die Sorge groß, dass im Winter zu wenig Erdgas da sein könnte. Doch so weit kam es nicht. Die Gasspeicher sind mittlerweile erneut ra… [+4434 chars]",,de,'Erdgas Russland'
https://www.welt.de/wirtschaft/article248379524/Gas-Erdgasspeicher-zu-100-Prozent-gefuellt-Vorrat-fuer-zwei-bis-drei-Monate.html,https://www.welt.de/wirtschaft/article248379524/Gas-Erdgasspeicher-zu-100-Prozent-gefuellt-Vorrat-fuer-zwei-bis-drei-Monate.html,0,www.welt.de,Erdgasspeicher zu 100 Prozent gefüllt – Vorrat für zwei bis drei Monate,"Deutschland ist für zwei bis drei Monate Winter gerüstet: Der Füllstand der Gasspeicher stieg am Wochenende auf 100 Prozent. Größere Mengen stammen aus Norwegen, Belgien und den Niederlanden – und nur zu einem geringen Teil aus deutschen LNG-Terminals.",https://img.welt.de/img/bildergalerien/mobile248379502/4951351257-ci16x9-w1200/Einziger-Gasspeicher-in-Mecklenburg-Vorpommern.jpg,2023-11-06T04:46:12Z,https://web.archive.org/web/20231106194939/http://www.welt.de/wirtschaft/article248379524/Gas-Erdgasspeicher-zu-100-Prozent-gefuellt-Vorrat-fuer-zwei-bis-drei-Monate.html,"Die Erdgasspeicher in Deutschland haben am Sonntagmorgen die 100-Prozent-Marke erreicht. Der Füllstand lag bei 100,03 Prozent, wie am Sonntagabend aus im Internet veröffentlichten, vorläufigen Daten … [+3969 chars]",,de,'Gasspeicher'
https://www.tagesspiegel.de/wirtschaft/wir-sind-viel-besser-vorbereitet-als-im-letzten-jahr-deutsche-erdgasspeicher-haben-die-100-prozent-marke-erreicht-10735753.html,https://www.tagesspiegel.de/wirtschaft/wir-sind-viel-besser-vorbereitet-als-im-letzten-jahr-deutsche-erdgasspeicher-haben-die-100-prozent-marke-erreicht-10735753.html,0,www.tagesspiegel.de,„Wir sind viel besser vorbereitet als im letzten Jahr“: Deutsche Erdgasspeicher haben die 100-Prozent-Marke erreicht,"Als Russland 2022 den wichtigsten Gashahn zudrehte, war die Sorge groß, dass zu wenig Erdgas da sein könnte. Doch so weit kam es nicht. Auch jetzt sind Speicher bereits randvoll.",https://www.tagesspiegel.de/images/erdgasspeicher1/alternates/BASE_16_9_W1400/erdgasspeicher.jpeg,2023-11-06T05:55:51Z,,"Die Erdgasspeicher in Deutschland haben am Sonntagmorgen die 100-Prozent-Marke erreicht. Der Füllstand lag bei 100,03 Prozent, wie am Sonntagabend aus im Internet veröffentlichten, vorläufigen Daten … [+4825 chars]",,de,'Erdgas Russland'
