index,url,valid,domain,title,description,image,published,archive,content,quote,language,keyword
https://www.n-tv.de/politik/Studie-prognostiziert-deutlich-sinkenden-Gasbedarf-article24416476.html,https://www.n-tv.de/politik/Studie-prognostiziert-deutlich-sinkenden-Gasbedarf-article24416476.html,0,www.n-tv.de,Speicher für Winter gut gefüllt: Studie prognostiziert deutlich sinkenden Gasbedarf,Die Nachfrage nach Erdgas wird in den kommenden Jahren erheblich sinken. Zu diesem Ergebnis kommt eine Studie. Allerdings müssen dafür die angepeilten Klimaschutzziele in der EU auch eingehalten werden.,https://bilder2.n-tv.de/img/incoming/crop24416473/1051329339-cImg_16_9-w1200/426250219.jpg,2023-09-22T12:47:24Z,https://web.archive.org/web/20230922163926/https://www.n-tv.de/politik/Studie-prognostiziert-deutlich-sinkenden-Gasbedarf-article24416476.html,Die Nachfrage nach Erdgas wird in den kommenden Jahren erheblich sinken. Zu diesem Ergebnis kommt eine Studie. Allerdings müssen dafür die angepeilten Klimaschutzziele in der EU auch eingehalten werd… [+3351 chars],,de,'Winter Gas'
https://www.faz.net/aktuell/sport/formel-1/max-verstappen-erster-bei-formel-1-quali-zum-rennen-in-suzuka-in-japan-19195397.html,https://www.faz.net/aktuell/sport/formel-1/max-verstappen-erster-bei-formel-1-quali-zum-rennen-in-suzuka-in-japan-19195397.html,0,www.faz.net,Formel-1-Qualifying in Japan: Verstappen demoralisiert die Konkurrenz,"Es gibt zwar einen Blackout der Technik, aber keiner beim Fahrer. Nach dem schwarzen Fleck von Singapur auf Max Verstappens Siegerweste zeigt es der Formel-1-Weltmeister im Qualifying in Suzuka allen.",https://media0.faz.net/ppmedia/aktuell/3594339728/1.9195444/facebook_teaser/der-weltmeister-ist-wieder.jpg,2023-09-23T07:53:45Z,,"Er kann's noch: Max Verstappen startet beim Großen Preis von Japan an diesem Sonntag (7.00 Uhr MESZ im F.A.Z.-Liveticker zur Formel 1 und bei Sky) von der Pole-Position. Ganz so, als ob es den schwar… [+5066 chars]",,de,'Blackout'
https://www.zeit.de/news/2023-09/23/hunderte-bei-demonstration-gegen-lng-terminal-auf-ruegen,https://www.zeit.de/news/2023-09/23/hunderte-bei-demonstration-gegen-lng-terminal-auf-ruegen,0,www.zeit.de,Energie: Hunderte bei Demonstration gegen LNG-Terminal auf Rügen,,,2023-09-23T11:19:27Z,,"When browsing with ads:
We collect personal data and also transmit it to third-party providers
 that help us improve and finance our digital content. Some of the information stored on your device, … [+821 chars]",,de,'LNG'
https://www.n-tv.de/politik/Hofreiter-fordert-Gas-Embargo-gegen-Aserbaidschan-article24418445.html,https://www.n-tv.de/politik/Hofreiter-fordert-Gas-Embargo-gegen-Aserbaidschan-article24418445.html,0,www.n-tv.de,"""So schnell wie möglich"": Hofreiter fordert Gas-Embargo gegen Aserbaidschan",Nach dem Beginn des russischen Angriffskrieges gegen die Ukraine findet die EU in Aserbaidschan Ersatz für russisches Gas. Grünen-Politiker Anton Hofreiter hält das nach der jüngst gestarteten Großoffensive aus Baku für einen Fehler - und fordert sofortige Sa…,https://bilder3.n-tv.de/img/incoming/crop24418474/4041324973-cImg_16_9-w1200/424230388.jpg,2023-09-23T13:32:33Z,,Nach dem Beginn des russischen Angriffskrieges gegen die Ukraine findet die EU in Aserbaidschan Ersatz für russisches Gas. Grünen-Politiker Anton Hofreiter hält das nach der jüngst gestarteten Großof… [+2098 chars],,de,'russisches Gas'
https://www.zeit.de/news/2023-09/23/aktivisten-klettern-auf-rohre-fuer-lng-pipeline-in-mukran,https://www.zeit.de/news/2023-09/23/aktivisten-klettern-auf-rohre-fuer-lng-pipeline-in-mukran,0,www.zeit.de,Demonstration: Aktivisten klettern auf Rohre für LNG-Pipeline in Mukran,,,2023-09-23T14:35:12Z,,"When browsing with ads:
We collect personal data and also transmit it to third-party providers
 that help us improve and finance our digital content. Some of the information stored on your device, … [+821 chars]",,de,'LNG'
https://www.tagesspiegel.de/politik/russisches-lng-auch-in-deutschland-opposition-kritisiert-habeck-fur-blindflug-10516087.html,https://www.tagesspiegel.de/politik/russisches-lng-auch-in-deutschland-opposition-kritisiert-habeck-fur-blindflug-10516087.html,0,www.tagesspiegel.de,Russisches LNG auch in Deutschland?: Opposition kritisiert Habeck für „Blindflug“,"Die Bundesregierung kann keine Auskunft darüber geben, ob über die Nachbarländer russisches LNG nach Deutschland kommt. Die EU könnte damit weiter die Kriegskassen des Kreml füllen.",https://www.tagesspiegel.de/images/imago0257744470hjpg/alternates/BASE_16_9_W1400/imago0257744470hjpg.jpeg,2023-09-24T09:38:37Z,,"Es ist die politische Leistung, auf die Wirtschaftsminister Robert Habeck (Grüne) vermutlich besonders stolz ist. In nur wenigen Monaten hat es Deutschland im vergangenen Jahr unter seiner Aufsicht g… [+3973 chars]",,de,'LNG'
https://www.zeit.de/wirtschaft/2023-09/energieversorgung-stromnetz-windenergie-energiewende-blackout,https://www.zeit.de/wirtschaft/2023-09/energieversorgung-stromnetz-windenergie-energiewende-blackout,0,www.zeit.de,Energieversorgung: Hier kämpfen sie täglich gegen den Blackout,"An einem streng bewachten Ort muss Netzbetreiber 50Hertz europaweite Stromausfälle verhindern. Doch je mehr Ökostrom, desto komplizierter wird das – mit skurrilen Folgen.",,2023-09-24T12:55:26Z,,"When browsing with ads:
We collect personal data and also transmit it to third-party providers
 that help us improve and finance our digital content. Some of the information stored on your device, … [+821 chars]",,de,'Blackout'
https://taz.de/Proteste-gegen-LNG-Terminal-auf-Ruegen/!5959606/,https://taz.de/Proteste-gegen-LNG-Terminal-auf-Ruegen/!5959606/,0,taz.de,Proteste gegen LNG-Terminal auf Rügen: Robert Habeck muss zurückrudern,"Die Proteste auf Rügen gegen das LNG-Terminal lenken den Blick auf ein überflüssiges, ökologisch gefährliches Projekt. Und auf die Rolle der Grünen dabei.",https://taz.de/picture/6540339/948/pipeline-mukran-lng-1.jpeg,2023-09-24T13:13:00Z,https://web.archive.org/web/20230928031318/https://taz.de/Proteste-gegen-LNG-Terminal-auf-Ruegen/!5959606/,"Die Proteste auf Rügen gegen das LNG-Terminal lenken den Blick auf ein überflüssiges, ökologisch gefährliches Projekt. Und auf die Rolle der Grünen dabei.
Symbolische Kletteraktion: Klima-Aktivist*i… [+2004 chars]",,de,'LNG'
https://noe.orf.at/stories/3225334/,https://noe.orf.at/stories/3225334/,0,noe.orf.at,Erste Gemeinde bekommt Blackout-Zertifikat,Die Sicherheitsfachakademie hat zum ersten Mal ein sogenanntes „Blackout-Zertifikat“ ausgestellt. Die Gemeinde Vösendorf setzte sich zwei Monate lang intensiv mit Notfallplänen auseinander.  Der Bürgermeister sieht sich für den Ernstfall gut gerüstet.,https://ibs.orf.at/noe?image=https%3A%2F%2Foekastatic.orf.at%2Fmims%2F2023%2F38%2F12%2Fcrops%2Fw%3D1200%2Ch%3D627%2Cq%3D75%2F1949265_master_732912_blackout_2009_-_panoramio.jpg%3Fs%3D60560dca30324c2cb472f22191530624ee165fca,2023-09-25T04:36:00Z,,"Im Falle eines Blackouts wissen, was zu tun ist dieses Ziel verfolgt die Sicherheitsakademie mit der Zertifizierung. Im Mittelpunkt stehen die Sensibilisierung und Schulung aller Personen, die täglic… [+1893 chars]",,de,'Blackout'
https://www.tagesschau.de/wirtschaft/weltwirtschaft/oel-russland-sanktionen-preosobergrenze-100.html,https://www.tagesschau.de/wirtschaft/weltwirtschaft/oel-russland-sanktionen-preosobergrenze-100.html,0,www.tagesschau.de,Russland umgeht immer häufiger Sanktionen für Ölexporte,"Mithilfe einer Preisobergrenze versuchen die G7-Staaten, die russischen Erdöleinnahmen zu reduzieren. Weil Russland aber mittlerweile oft auf westliche Dienstleistungen verzichtet, verliert die Sanktion an Wirkung.",https://images.tagesschau.de/image/5442f521-84c2-425f-a1d3-74982bd34dfd/AAABisvNw-o/AAABibBxqrQ/16x9-1280/russland-oel-106.jpg,2023-09-25T12:04:07Z,,"Stand: 25.09.2023 14:04 Uhr
Mithilfe einer Preisobergrenze versuchen die G7-Staaten, die russischen Erdöleinnahmen zu reduzieren. Weil Russland aber mittlerweile oft auf westliche Dienstleistungen v… [+3621 chars]",,de,'Inflation'
https://t3n.de/news/microsoft-ki-cloud-atomreaktoren-betrieben-1578300/,https://t3n.de/news/microsoft-ki-cloud-atomreaktoren-betrieben-1578300/,0,t3n.de,Microsoft will KI und Cloud mit eigenen Atomreaktoren betreiben,"Microsoft plant, eigene Small Modular Reactors (SMR) und Mikroreaktoren für die Energieversorgung seiner Azure-Cloud und KI-Rechenzentren einzusetzen. Das könnte das Unternehmen energieunabhängig machen.
weiterlesen auf t3n.de",https://t3n.de/news/wp-content/uploads/2023/09/Mikroreaktor.jpg,2023-09-25T12:10:53Z,,"Microsoft plant den Aufbau eines Netzwerks an Small Modular Reactors (SMR) und Mikroreaktoren. Die Mini-Atomkraftwerke sollen die Azure-Cloud und KI-Rechenzentren mit Energie versorgen.
Ein erster H… [+1724 chars]",,de,'Energieversorgung'
https://www.faz.net/aktuell/wirtschaft/unternehmen/kernkraft-soll-microsofts-datencenter-versorgen-19199565.html,https://www.faz.net/aktuell/wirtschaft/unternehmen/kernkraft-soll-microsofts-datencenter-versorgen-19199565.html,0,www.faz.net,"Microsoft überlegt, für Datencenter auf Atomkraft zu setzen","Das Training von KI-Modellen verbraucht viel Energie. Deshalb erwägt Microsoft nun, für die Energieversorgung seiner Datencenter auf kleine Kernkraftwerke zu setzen - ganz im Sinne von Bill Gates.",https://media1.faz.net/ppmedia/aktuell/wirtschaft/3118125291/1.9200057/facebook_teaser/symbolbild-das-kernkraftwerk.jpg,2023-09-25T14:57:13Z,,"Der Microsoft-Konzern erwägt den Aufbau einer Flotte kleiner Nuklearreaktoren, die die Datencenter der Cloudsparte mit sicherem Strom versorgen sollen. Dafür will Microsoft Fachleute der Nuklearindus… [+1840 chars]",,de,'Energieversorgung'
https://www.dw.com/de/ein-jahr-nordstream-sprengung-viel-spekulation-wenige-fakten/a-66889347,https://www.dw.com/de/ein-jahr-nordstream-sprengung-viel-spekulation-wenige-fakten/a-66889347,0,www.dw.com,"Ein Jahr Nordstream-Sprengung: Viel Spekulation, wenige Fakten","Vor einem Jahr zerstörten vier Explosionen ein zentrales Element der europäischen Energieinfrastruktur. Vom Ende einer umstrittenen Gas-Pipeline, gefährlichen Abhängigkeiten und hochpolitischen Ermittlungen. Es ist zwei Uhr morgens am 26. September 2022, als …",https://static.dw.com/image/65246567_6.jpg,2023-09-25T15:42:00Z,,"Es ist zwei Uhr morgens am 26. September 2022, als seismische Stationen in Dänemark, Schweden und Deutschland einen schwachen Erdstoß registrieren. Parallel registrieren Mitarbeiter des Pipelinebetre… [+9030 chars]",,de,'Gazprom'
https://www.dw.com/de/nord-stream-anschl%C3%A4ge-viel-spekulation-wenige-fakten/a-66889347,https://www.dw.com/de/nord-stream-anschl%C3%A4ge-viel-spekulation-wenige-fakten/a-66889347,0,www.dw.com,"Nord-Stream-Anschläge: Viel Spekulation, wenige Fakten","Vor einem Jahr zerstörten vier Explosionen ein zentrales Element der europäischen Energieinfrastruktur. Wer hinter dem Sabotageakt steckt, ist weiterhin unklar. Es ist zwei Uhr morgens am 26. September 2022, als seismische Stationen in Dänemark, Schweden und …",https://static.dw.com/image/65246567_6.jpg,2023-09-25T15:42:00Z,,"Es ist zwei Uhr morgens am 26. September 2022, als seismische Stationen in Dänemark, Schweden und Deutschland einen schwachen Erdstoß registrieren. Parallel registrieren Mitarbeiter des Pipelinebetre… [+9143 chars]",,de,'Gazprom'
https://www.stern.de/gesellschaft/regional/sachsen/energie--chemnitzer-braunkohlekraftwerk-geht-anfang-2024-vom-netz--33858244.html,https://www.stern.de/gesellschaft/regional/sachsen/energie--chemnitzer-braunkohlekraftwerk-geht-anfang-2024-vom-netz--33858244.html,0,www.stern.de,Energie: Chemnitzer Braunkohlekraftwerk geht Anfang 2024 vom Netz,Seit Jahrzehnten werden Haushalte und Unternehmen in Chemnitz mit Wärme und Strom aus Braunkohle versorgt. Damit ist 2024 Schluss. Doch klimaneutral ist die Energieversorgung dann trotzdem noch nicht.,https://image.stern.de/33858246/t/UN/v1/w1440/r1.7778/-/25--urnnewsmldpacom2009010123092599328971v3w800h600l838t469r2118b1429jpeg---8dad80f57dd0505e.jpg,2023-09-25T16:19:09Z,,Seit Jahrzehnten werden Haushalte und Unternehmen in Chemnitz mit Wärme und Strom aus Braunkohle versorgt. Damit ist 2024 Schluss. Doch klimaneutral ist die Energieversorgung dann trotzdem noch nicht… [+2823 chars],,de,'Energieversorgung'
https://www.basicthinking.de/blog/2023/09/25/schwimmende-solaranlage-frankreich/,https://www.basicthinking.de/blog/2023/09/25/schwimmende-solaranlage-frankreich/,0,www.basicthinking.de,Frankreich: Das ist die größte schwimmende Solaranlage in Europa,In Frankreich ersteht derzeit die größte schwimmende Solaranlage in Europa. Denn der französische Energieerzeuger Q Energy plant die Installation von etwa 135.000 Solarmodulen auf dem Wasser.  Im Kampf gegen den Klimawandel gilt es die Energieversorgung auf n…,https://www.basicthinking.de/blog/wp-content/uploads/2023/09/schwimmende-solarfarm-frankreich.jpg,2023-09-25T16:30:39Z,,"In Frankreich ersteht derzeit die größte schwimmende Solaranlage in Europa. Denn der französische Energieerzeuger Q Energy plant die Installation von etwa 135.000 Solarmodulen auf dem Wasser. 
Im Ka… [+2302 chars]",,de,'Energieversorgung'
https://www.focus.de/politik/ausland/nordstream-sprengung-ermittler-keine-spur-fuehrt-nach-russland-keine-in-usa_id_212711786.html,https://www.focus.de/politik/ausland/nordstream-sprengung-ermittler-keine-spur-fuehrt-nach-russland-keine-in-usa_id_212711786.html,0,www.focus.de,"Nordstream-Sprengung - Viel Spekulation, wenige Fakten","Vor einem Jahr zerstörten vier Explosionen ein zentrales Element der europäischen Energieinfrastruktur. Vom Ende einer umstrittenen Gas-Pipeline, gefährlichen Abhängigkeiten und hochpolitischen Ermittlungen.",https://p6.focus.de/img/politik/ausland/id_212711785/folge-der-sprengung-gas-steigt-auf-vom-boden-der-ostsee.jpg?im=Crop%3D%280%2C29%2C940%2C470%29%3BResize%3D%281200%2C627%29&impolicy=perceptual&quality=mediumHigh&hash=b4dded7ed1c1b87460a907959dd97f268e100a6da894843b2aa668c8c7411c96,2023-09-25T17:21:44Z,,"Es ist zwei Uhr morgens am 26. September 2022, als seismische Stationen in Dänemark, Schweden und Deutschland einen schwachen Erdstoß registrieren. Parallel registrieren Mitarbeiter des Pipelinebetre… [+8672 chars]",,de,'Pipeline Explosionen'
https://www.n-tv.de/wirtschaft/Russland-umschifft-den-Olpreisdeckel-immer-erfolgreicher-article24421800.html,https://www.n-tv.de/wirtschaft/Russland-umschifft-den-Olpreisdeckel-immer-erfolgreicher-article24421800.html,0,www.n-tv.de,Schifffahrtsdaten ausgewertet: Russland umschifft den Ölpreisdeckel immer erfolgreicher,"Um Russlands Öleinnahmen zu schmälern, verpflichtet der Westen seine Reedereien und Versicherer, russisches Öl für höchstens 60 Dollar pro Barrel zu verschiffen. Russland verkauft sein Öl trotzdem zu höheren Preisen.",https://bilder1.n-tv.de/img/incoming/crop24422092/6081324672-cImg_16_9-w1200/Oltanker-in-Murmansk.jpg,2023-09-25T18:00:09Z,,"Um Russlands Öleinnahmen zu schmälern, verpflichtet der Westen seine Reedereien und Versicherer, russisches Öl für höchstens 60 Dollar pro Barrel zu verschiffen. Russland verkauft sein Öl trotzdem zu… [+3759 chars]",,de,'Schattenflotte'
https://www.nzz.ch/zuerich/zuerich-svp-will-atomstrompflicht-fuer-winterthur-ld.1757293,https://www.nzz.ch/zuerich/zuerich-svp-will-atomstrompflicht-fuer-winterthur-ld.1757293,0,www.nzz.ch,"Strom aus Kernkraft gilt als grün und günstig, aber aus politischen Gründen können Private ihn kaum noch kaufen – eine Initiative will dies nun ändern","In Winterthur soll der Stromversorger zwingend wieder Kernenergie anbieten müssen. Alles andere sei bevormundend, sagt die SVP.","https://img.nzz.ch/2023/09/22/1430a20b-d985-4e6f-90a5-4bfdcdf858c8.jpeg?width=1200&height=674&fit=bound&quality=75&auto=webp&crop=5471,3073,x0,y31&wmark=nzz",2023-09-26T03:03:00Z,,"Rekordtiefe Produktionskosten: Kernkraftwerk Leibstadt.
Die Schweiz hat eine Marktwirtschaft, aber nicht beim Strom. Nur grosse Verbraucher können ihren Anbieter frei wählen. Privathaushalte und Kle… [+7311 chars]",,de,'Winter Kernkraft'
https://www.nzz.ch/international/nord-stream-wer-hat-die-pipelines-gesprengt-eine-rekonstruktion-ld.1756488,https://www.nzz.ch/international/nord-stream-wer-hat-die-pipelines-gesprengt-eine-rekonstruktion-ld.1756488,0,www.nzz.ch,Der Anschlag auf die Nord Stream-Pipelines ist eine der grössten Sabotageaktionen der Geschichte. Wer steckt dahinter?,"Eine Rekonstruktion der Explosionen an den Nord-Stream-Pipelines. Wer hatte die Möglichkeit – und vor allem ein Motiv –, Nord Stream zu sprengen?","https://img.nzz.ch/2023/09/22/a736d086-84ab-4dea-8e17-c4df95a269a7.gif?width=1198&height=674&fit=bound&quality=75&auto=webp&crop=1198,674,x1,y0&wmark=nzz",2023-09-26T03:30:00Z,,"Am Abend des 26. September 2022 segelt Kapitän Fridtjof Jungeling auf dem Segelschiff «Christian Radich» nordöstlich der dänischen Insel Bornholm, als er zwei ungewöhnliche rote Punkte auf seinem Rad… [+15456 chars]",,de,'Gazprom'
https://www.faz.net/aktuell/rhein-main/wirtschaft/aerger-wegen-energiepreisbremse-19197785.html,https://www.faz.net/aktuell/rhein-main/wirtschaft/aerger-wegen-energiepreisbremse-19197785.html,0,www.faz.net,Ärger wegen Energiepreisbremse,"Für Gas und Strom übernimmt der Staat seit Anfang des Jahres einen Teil der Kosten, doch auf eine finanzielle Entlastung muss manch ein Kunde lange warten. Eine unpräzise Gesetzgebung erschwert die Situation weiter.",https://media0.faz.net/ppmedia/aktuell/wirtschaft/4162333868/1.9197784/facebook_teaser/fehler-und-verzoegerungen-in.jpg,2023-09-26T05:16:43Z,,"Als zum 1. März die Energiepreisbremsen in das Rechnungsverfahren der Energieversorger Einzug hielten von dem Tag an sollten die Unternehmen die Abschläge für Strom, Gas und Fernwärme anpassen , hatt… [+5432 chars]",,de,'Energiepreisbremse'
https://www.spektrum.de/rezension/buchkritik-zu-die-moskau-connection/2160357,https://www.spektrum.de/rezension/buchkritik-zu-die-moskau-connection/2160357,0,www.spektrum.de,Günstiges Gas und teure Abhängigkeit,Wie konnte Deutschland in eine energiepolitische Abhängigkeit von Russland geraten? Eine Spurensuche – für Leser mit Vorkenntnissen. Eine Rezension (Rezension zu Die Moskau-Connection von Reinhard Bingener; Markus Wehner ),https://static.spektrum.de/fm/47/f2000/cover.7929957.jpg,2023-09-26T06:08:30Z,,"Erst als Russland am 24. Februar 2022 in die Ukraine einmarschierte und sich der Westen mit antirussischen Sanktionspaketen kollektiv hinter das angegriffene Land stellte, wurde vielen Menschen bewus… [+1425 chars]",,de,'Gazprom'
https://www.faz.net/aktuell/wirtschaft/ein-jahr-doppelwumms-energiebranche-warnt-vor-neuen-preisspruengen-19201140.html,https://www.faz.net/aktuell/wirtschaft/ein-jahr-doppelwumms-energiebranche-warnt-vor-neuen-preisspruengen-19201140.html,0,www.faz.net,Energieversorger warnen vor neuen Preissprüngen,Vor einem Jahr kündigte Kanzler Scholz (SPD) einen „Abwehrschirm“ gegen die stark gestiegenen Energiepreise an – mit einem Volumen von bis zu 200 Milliarden Euro. Nun warnt die Energiebrache vor dem kommenden Winter.,https://media1.faz.net/ppmedia/aktuell/wirtschaft/593918541/1.9122659/facebook_teaser/in-willhelmshaven-steht.jpg,2023-09-26T06:30:12Z,,Ein Jahr nach den als Doppelwumms bekannt gewordenen Maßnahmen der Bundesregierung zur Entlastung der Kunden hat die Energiebranche vor neuen Preissprüngen gewarnt. Zwar hätten sich inzwischen die Pr… [+5110 chars],,de,'Energieversorgung'
https://www.diepresse.com/17702175/auf-europas-gasmarkt-haben-die-usa-den-krieg-gegen-die-russen-bereits-gewonnen,https://www.diepresse.com/17702175/auf-europas-gasmarkt-haben-die-usa-den-krieg-gegen-die-russen-bereits-gewonnen,0,www.diepresse.com,Auf Europas Gasmarkt haben die USA den Krieg gegen die Russen bereits gewonnen [premium],"Die Lücke, die Gazprom in Europa hinterlässt, wird nun vor allem vom teureren US-Gas gefüllt. Und das wohl auf Jahrzehnte, wie eine hochrangige EU-Vertreterin soeben ausplauderte. Pikantes Detail: Die Konzerne wurden für das, was sie nun wieder machen, vor Ku…",https://img.diepresse.com/public/incoming/r61ao1-588166984/alternates/DPR_SOCIAL_MAGAZIN_PAID/588166984,2023-09-26T07:44:34Z,,"Die Lücke, die Gazprom in Europa hinterlässt, wird nun vor allem vom teureren US-Gas gefüllt. Und das wohl auf Jahrzehnte, wie eine hochrangige EU-Vertreterin soeben ausplauderte. Pikantes Detail: Di… [+540 chars]",,de,'Krieg Gas'
https://www.morgenpost.de/wirtschaft/article239667933/heizung-preise-teurer-energie-heizen-verbraucher-winter-2023.html,https://www.morgenpost.de/wirtschaft/article239667933/heizung-preise-teurer-energie-heizen-verbraucher-winter-2023.html,0,www.morgenpost.de,Vor der Heizsaison: Energiebranche schlägt Alarm: Preise könnten weiter steigen,Kurz vor Beginn der Heizsaison könnten die Energiepreise erneut steigen. Was Verbraucher zu befürchten haben und was die Ursache ist.,https://img.morgenpost.de/img/frontpage/crop239636705/9262601371-w820-cv16_9-q85/fd847e6e-591a-11ee-9d0f-f9ee5833d19f.jpg,2023-09-26T08:41:36Z,,"Berlin. Die Nachricht ist alarmierend: Die Energiebranche warnt vor erneuten Preissteigerungen und das ein Jahr nach den als ""Doppelwumms"" bekannt gewordenen Maßnahmen der Bundesregierung zur Entlast… [+1215 chars]",,de,'Energieversorgung'
https://www.n-tv.de/wirtschaft/Energiebranche-warnt-vor-neuen-Preisspruengen-article24423108.html,https://www.n-tv.de/wirtschaft/Energiebranche-warnt-vor-neuen-Preisspruengen-article24423108.html,0,www.n-tv.de,"Krieg dauert an, Kälte kommt: Energiebranche warnt vor neuen Preissprüngen","Als Folge des russischen Angriffskriegs in der Ukraine steigen 2022 die Energiepreise stark. Um diese zu dämpfen, holt die Bundesregierung vor einem Jahr zu einem ""Doppelwumms"" an Maßnahmen aus. Sie entlasten die Verbraucher. Aber sind sie noch notwendig?",https://bilder4.n-tv.de/img/incoming/crop24423095/3521327979-cImg_16_9-w1200/419998936.jpg,2023-09-26T09:01:48Z,,"Als Folge des russischen Angriffskriegs in der Ukraine steigen 2022 die Energiepreise stark. Um diese zu dämpfen, holt die Bundesregierung vor einem Jahr zu einem ""Doppelwumms"" an Maßnahmen aus. Sie … [+5472 chars]",,de,'Energieversorgung'
https://www.stern.de/wirtschaft/daenemark-hat-die-niedrigste-inflation-in-der-eu--das-sind-die-gruende-33856602.html,https://www.stern.de/wirtschaft/daenemark-hat-die-niedrigste-inflation-in-der-eu--das-sind-die-gruende-33856602.html,0,www.stern.de,Verbraucherpreise: Dänemark hat gerade die niedrigste Inflation in der EU. Woran liegt das?,"Die Inflation treibt gerade die Verbraucherpreise nach oben, in Deutschland sowie dem Rest Europas. Das ist auch in Dänemark so, doch im August lag die Inflationsrate bei 2,3 Prozent – niedrigster Wert der EU. Was sind die Gründe dafür?",https://image.stern.de/33856604/t/2q/v1/w1440/r1.7778/-/daenemark-inflation-1.png,2023-09-26T09:14:00Z,,"Alles ist teurer geworden, Inflation sei Dank. Immerhin ist sie etwas gesunken: So lag der Verbraucherpreisindex im August dieses Jahres bei 6,1 Prozent im Vorjahresmonat waren es noch 7,0 Prozent. D… [+7707 chars]",,de,'Inflation'
https://www.welt.de/wirtschaft/article247671772/Energiepreis-Branche-warnt-vor-neuen-Preisspruengen-mitten-in-der-Heizsaison.html,https://www.welt.de/wirtschaft/article247671772/Energiepreis-Branche-warnt-vor-neuen-Preisspruengen-mitten-in-der-Heizsaison.html,0,www.welt.de,Energiebranche warnt vor neuen Preissprüngen,"Seit dem letzten Winter haben sich die Energiepreise stabilisiert. Eigentlich – denn der Bundesverband der Energie- und Wasserwirtschaft warnt, dass eine „vorschnelle Rücknahme der Entlastungen“ zu neuen Preissprüngen führen könnte.",https://img.welt.de/img/bildergalerien/mobile247671176/5221353087-ci16x9-w1200/Stromkosten.jpg,2023-09-26T09:37:16Z,,Die Energiebranche hat ein Jahr nach den als Doppelwumms bekannt gewordenen Maßnahmen der Bundesregierung zur Entlastung der Kunden vor neuen Preissprüngen gewarnt. Zwar hätten sich inzwischen die Pr… [+985 chars],,de,'Energiepreise'
https://www.n-tv.de/politik/Ein-Jahr-danach-Wer-steckt-hinter-der-Nord-Stream-Sabotage-article24422945.html,https://www.n-tv.de/politik/Ein-Jahr-danach-Wer-steckt-hinter-der-Nord-Stream-Sabotage-article24422945.html,0,www.n-tv.de,"USA, Russland, Ukraine im Visier: Ein Jahr danach: Wer steckt hinter der Nord-Stream-Sabotage?","Seit einem Jahr untersuchen zahlreiche Ermittler, wer für die Anschläge auf die Nord-Stream-Pipelines verantwortlich ist. Ansätze gibt es viele, belastbare Informationen fehlen. Eine gecharterte Jacht ist bisher die heißeste Spur.",https://bilder4.n-tv.de/img/incoming/crop24422967/5711327351-cImg_16_9-w1200/395601208.jpg,2023-09-26T09:47:09Z,,Vor einem Jahr - inmitten geopolitischer Spannungen wegen Russlands Einmarsch in die Ukraine und der Gaskrise in Europa - rissen Explosionen mehrere Löcher in die Erdgas-Leitungen Nord Stream 1 und 2… [+5142 chars],,de,'Gazprom'
