index,url,valid,domain,title,description,image,published,archive,content,quote,language,keyword
https://www.tagesspiegel.de/berlin/nach-brandanschlag-in-grunheide-produktion-bei-tesla-steht-noch-bis-ende-der-nachsten-woche-still-11326267.html,https://www.tagesspiegel.de/berlin/nach-brandanschlag-in-grunheide-produktion-bei-tesla-steht-noch-bis-ende-der-nachsten-woche-still-11326267.html,0,www.tagesspiegel.de,Nach Brandanschlag in Grünheide: Produktion bei Tesla steht noch bis Ende der nächsten Woche still,Der Angriff auf die Stromversorgung mit gewaltigen Folgen für den Autobauer Tesla in Grünheide schreckt Politik und Wirtschaft auf. Es geht um einen größeren Schutz der Energieversorgung – aber wie?,https://www.tagesspiegel.de/images/tesla-fabrik-stillstand-nach-stromausfall11/alternates/BASE_16_9_W1400/tesla-fabrik---stillstand-nach-stromausfall.jpeg,2024-03-06T18:25:56Z,,Nach dem Anschlag auf einen Strommast bleibt die Produktion beim US-Elektroautobauer Tesla in Grünheide bei Berlin bis voraussichtlich Ende nächster Woche unterbrochen. Das teilte das Unternehmen am … [+8875 chars],,de,'Stromversorgung'
https://www.tagesspiegel.de/berlin/nach-anschlag-auf-tesla-in-grunheide-politik-und-wirtschaft-fordern-besseren-schutz-der-kritischen-infrastruktur-11326267.html,https://www.tagesspiegel.de/berlin/nach-anschlag-auf-tesla-in-grunheide-politik-und-wirtschaft-fordern-besseren-schutz-der-kritischen-infrastruktur-11326267.html,0,www.tagesspiegel.de,Nach Anschlag auf Tesla in Grünheide: Politik und Wirtschaft fordern besseren Schutz der kritischen Infrastruktur,Der Angriff auf die Stromversorgung mit gewaltigen Folgen für den Autobauer Tesla in Grünheide schreckt Politik und Wirtschaft auf. Es geht um einen größeren Schutz der Energieversorgung – aber wie?,https://www.tagesspiegel.de/images/tesla-fabrik-stillstand-nach-stromausfall11/alternates/BASE_16_9_W1400/tesla-fabrik---stillstand-nach-stromausfall.jpeg,2024-03-06T18:25:56Z,,"Die Wirtschaft in Deutschland dringt nach dem Anschlag auf die Stromversorgung der Tesla-Autofabrik in Grünheide bei Berlin auf mehr Sicherheit. Politik und Wirtschaft sind gemeinsam gefordert, die S… [+8644 chars]",,de,'Energieversorgung'
https://www.faz.net/aktuell/wirtschaft/unternehmen/tesla-produktion-ruht-noch-bis-ende-naechster-woche-19568929.html,https://www.faz.net/aktuell/wirtschaft/unternehmen/tesla-produktion-ruht-noch-bis-ende-naechster-woche-19568929.html,0,www.faz.net,Blackout in Grünheide: Tesla-Produktion ruht noch bis Ende nächster Woche,Nach dem gestrigen mutmaßlichen Anschlag der linksextremen „Vulkangruppe“ bleibt die Produktion noch bin Ende nächster Woche ruhig. Der Schaden befinde sich  „im hohen neunstelligen Bereich“.,https://media1.faz.net/ppmedia/aktuell/wirtschaft/3807801269/1.9568931/facebook_teaser/nur-wenige-autos-von.jpg,2024-03-06T19:39:43Z,,Nach dem Anschlag auf einen Strommast bleibt die Produktion beim US-Elektroautobauer Tesla in Grünheide bei Berlin bis voraussichtlich Ende nächster Woche unterbrochen. Das teilte das Unternehmen am … [+1835 chars],,de,'Blackout'
https://www.tagesschau.de/wirtschaft/finanzen/ezb-lagarde-kritik-100.html,https://www.tagesschau.de/wirtschaft/finanzen/ezb-lagarde-kritik-100.html,0,www.tagesschau.de,EZB-Ratssitzung: Schlechte Stimmung im Eurotower,In Frankfurt tagt der EZB-Rat. In der Belegschaft gibt es derzeit viel Kritik an Zentralbankchefin Lagarde. Die gibt sich unbeeindruckt und konzentriert sich auf den Kampf gegen die Inflation. Von Klaus-Rainer Jackisch.,https://images.tagesschau.de/image/c7de764a-3f10-4f38-b559-d19001236092/AAABjO2IeSU/AAABjcWen7M/16x9-1280/ezb-448.jpg,2024-03-07T07:15:45Z,,"Stand: 07.03.2024 08:15 Uhr
In Frankfurt tagt der EZB-Rat. In der Belegschaft gibt es derzeit viel Kritik an Zentralbankchefin Lagarde. Die gibt sich unbeeindruckt und konzentriert sich auf den Kamp… [+7793 chars]",,de,'Energieversorgung'
https://www.tagesspiegel.de/potsdam/brandenburg/anschlag-auf-teslas-stromversorgung-brandenburgs-innenminister-vermutet-linksextreme-tater-in-berlin-11327698.html,https://www.tagesspiegel.de/potsdam/brandenburg/anschlag-auf-teslas-stromversorgung-brandenburgs-innenminister-vermutet-linksextreme-tater-in-berlin-11327698.html,0,www.tagesspiegel.de,Anschlag auf Teslas-Stromversorgung: Brandenburgs Innenminister vermutet linksextreme Täter in Berlin,Der Brandanschlag auf einen Strommast legte die Teslafabrik in Grünheide erstmal still. Zu der Tat bekannte sich die Vulkangruppe. Laut Michael Stübgen agiert die Gruppe bundesweit.,https://www.tagesspiegel.de/images/tesla-fabrik-stillstand-nach-stromausfall14/alternates/BASE_16_9_W1400/tesla-fabrik---stillstand-nach-stromausfall.jpeg,2024-03-07T08:13:25Z,,"Nach dem Brandanschlag auf die Stromversorgung des Elektroauto-Konzerns Tesla vermutet Brandenburgs Innenminister Michael Stübgen (CDU) die Täter in Berlin. Die linksextreme Vulkangruppe, deren Beken… [+2562 chars]",,de,'Stromversorgung'
https://www.bild.de/bild-plus/unterhaltung/leute/leute/tv-star-jochen-busse-schwer-geschockt-ploetzlich-blackout-mitten-auf-der-buehne-87419212.bild.html,https://www.bild.de/bild-plus/unterhaltung/leute/leute/tv-star-jochen-busse-schwer-geschockt-ploetzlich-blackout-mitten-auf-der-buehne-87419212.bild.html,0,www.bild.de,*** BILDplus Inhalt *** „Habe hinterhältige Störung“ - Sorge um Jochen Busse! Blackout auf der Bühne,Von einem Moment auf den anderen fehlten ihm die Worte! TV-Star Jochen Busse erlitt während einer Premiere auf der Bühne einen Blackout.,"https://images.bild.de/65e84dd763364e66339c052b/63db9da4626fd98cdb77a8dc70ef1c73,18d06dbe?w=1280",2024-03-07T09:17:43Z,,"Plötzlich sah er nur noch kleine Kringel vor den Augen!
Schlimmer Moment für TV-Star Jochen Busse (83, 7 Tage, 7 Köpfe). Mitten während einer Theater-Premiere hatte der Schauspieler auf der Bühne ei… [+252 chars]",,de,'Blackout'
https://www.n-tv.de/wirtschaft/Innenminister-sieht-linksextreme-Taeter-in-Berlin-article24788929.html,https://www.n-tv.de/wirtschaft/Innenminister-sieht-linksextreme-Taeter-in-Berlin-article24788929.html,0,www.n-tv.de,Anschlag auf Stromversorgung: Innenminister sieht linksextreme Täter in Berlin,Der Brandanschlag auf einen Strommast legt die Teslafabrik bei Berlin wohl bis Ende nächster Woche still. Der wirtschaftliche Schaden ist laut dem Unternehmen immens. Brandenburgs Innenminister verortet die Täter in der linksextremen Szene Berlin und sieht je…,https://bilder2.n-tv.de/img/incoming/crop24788925/895132703-cImg_16_9-w1200/451142974.jpg,2024-03-07T09:29:43Z,,Der Brandanschlag auf einen Strommast legt die Teslafabrik bei Berlin wohl bis Ende nächster Woche still. Der wirtschaftliche Schaden ist laut dem Unternehmen immens. Brandenburgs Innenminister veror… [+2421 chars],,de,'Energieversorgung'
https://www.tagesspiegel.de/politik/energie-klima/energiewende-schreitet-voran-strom-in-deutschland-kam-2023-mehrheitlich-aus-erneuerbaren-11328100.html,https://www.tagesspiegel.de/politik/energie-klima/energiewende-schreitet-voran-strom-in-deutschland-kam-2023-mehrheitlich-aus-erneuerbaren-11328100.html,0,www.tagesspiegel.de,Energiewende schreitet voran: Strom in Deutschland kam 2023 mehrheitlich aus Erneuerbaren,"Weniger Kohle, weniger Atom, mehr Strom aus Sonne und Wind: Die Gleichgewichte auf dem deutschen Energiemarkt haben sich laut Statistischem Bundesamt verschoben.",https://www.tagesspiegel.de/images/sonne-und-wolken-in-thuringen/alternates/BASE_16_9_W1400/sonne-und-wolken-in-thueringen.jpeg,2024-03-07T09:34:31Z,,"Mit einem Anteil von 56 Prozent stammte der im Jahr 2023 erzeugte und ins Netz eingespeiste Strom in Deutschland mehrheitlich aus erneuerbaren Energieträgern. Im Jahr zuvor hatte der Anteil noch 46,3… [+2442 chars]",,de,'Erneuerbare Energie'
https://www.stern.de/politik/deutschland/extremismus--faeser-sieht-mehr-gewaltbereitschaft-bei-linksradikalen-34524058.html,https://www.stern.de/politik/deutschland/extremismus--faeser-sieht-mehr-gewaltbereitschaft-bei-linksradikalen-34524058.html,0,www.stern.de,Extremismus: Faeser sieht mehr Gewaltbereitschaft bei Linksradikalen,Bundesinnenministerin Faeser zeigt sich alarmiert vom Brandanschlag auf die Stromversorgung der Tesla-Fabrik in Brandenburg und verlangt empfindliche Konsequenzen.,https://image.stern.de/34524060/t/PS/v1/w1440/r1.7778/-/07--urnnewsmldpacom2009010124030799251832v3w800h600l903t399r1607b1154jpeg---298a1601e67b649c.jpg,2024-03-07T10:24:53Z,,"Bundesinnenministerin Faeser zeigt sich alarmiert vom Brandanschlag auf die Stromversorgung der Tesla-Fabrik in Brandenburg und verlangt empfindliche Konsequenzen.
Nach dem Brandanschlag auf die Str… [+1992 chars]",,de,'Energieversorgung'
https://www.morgenpost.de/politik/inland/article241834212/Faeser-sieht-mehr-Gewaltbereitschaft-bei-Linksradikalen.html,https://www.morgenpost.de/politik/inland/article241834212/Faeser-sieht-mehr-Gewaltbereitschaft-bei-Linksradikalen.html,0,www.morgenpost.de,Faeser sieht mehr Gewaltbereitschaft bei Linksradikalen,Bundesinnenministerin Faeser zeigt sich alarmiert vom Brandanschlag auf die Stromversorgung der Tesla-Fabrik in Brandenburg und verlangt empfindliche Konsequenzen.,https://img.sparknews.funkemedien.de/241834210/241834210_1709807220_v4_3_800.jpeg,2024-03-07T10:24:53Z,,"Berlin. Bundesinnenministerin Faeser zeigt sich alarmiert vom Brandanschlag auf die Stromversorgung der Tesla-Fabrik in Brandenburg und verlangt empfindliche Konsequenzen.
Nach dem Brandanschlag auf… [+2028 chars]",,de,'Stromversorgung'
https://www.n-tv.de/politik/Faeser-Linksradikalismus-wird-haerter-und-gewaltbereiter-article24789278.html,https://www.n-tv.de/politik/Faeser-Linksradikalismus-wird-haerter-und-gewaltbereiter-article24789278.html,0,www.n-tv.de,Nach Brandanschlag auf Tesla: Faeser: Linksradikalismus wird härter und gewaltbereiter,Unbekannte setzen einen Strommast bei Berlin in Brand. Sie kappen damit die Energieversorgung des Autobauers Tesla und von Zehntausenden Bewohnern der Region. Eine linksextremistische Gruppe bekennt sich zu der Aktion. Innenministerin Faeser sieht darin eine …,https://bilder1.n-tv.de/img/incoming/crop24789324/7971322327-cImg_16_9-w1200/451130863.jpg,2024-03-07T10:59:26Z,,Unbekannte setzen einen Strommast bei Berlin in Brand. Sie kappen damit die Energieversorgung des Autobauers Tesla und von Zehntausenden Bewohnern der Region. Eine linksextremistische Gruppe bekennt … [+2009 chars],,de,'Energieversorgung'
https://www.stern.de/wirtschaft/news/energieversorgung--physikerin--atomkraft-nur-auf-steuerzahler-kosten-machbar-34525124.html,https://www.stern.de/wirtschaft/news/energieversorgung--physikerin--atomkraft-nur-auf-steuerzahler-kosten-machbar-34525124.html,0,www.stern.de,Energieversorgung: Physikerin: Atomkraft nur auf Steuerzahler-Kosten machbar,"Der deutsche Ausstieg aus der Kernenergie sorgt weiterhin für viele Debatten. Befürworter behaupten gerne, mit ihr würde Strom billiger. Dieser Aussage wird von Expertenseite klar widersprochen.",https://image.stern.de/34525126/t/Me/v1/w1440/r1.7778/-/07--urnnewsmldpacom2009010124030799254798v4w800h600l212t238r1343b1103jpeg---a83c94b1f5f1756f.jpg,2024-03-07T13:24:04Z,,"Der deutsche Ausstieg aus der Kernenergie sorgt weiterhin für viele Debatten. Befürworter behaupten gerne, mit ihr würde Strom billiger. Dieser Aussage wird von Expertenseite klar widersprochen.
Die… [+1501 chars]",,de,'Energieversorgung'
https://www.zeit.de/news/2024-03/07/physikerin-atomkraft-nur-auf-steuerzahler-kosten-machbar,https://www.zeit.de/news/2024-03/07/physikerin-atomkraft-nur-auf-steuerzahler-kosten-machbar,0,www.zeit.de,Energieversorgung: Physikerin: Atomkraft nur auf Steuerzahler-Kosten machbar,Hier finden Sie Informationen zu dem Thema „Energieversorgung“. Lesen Sie jetzt „Physikerin: Atomkraft nur auf Steuerzahler-Kosten machbar“.,https://img.zeit.de/news/2024-03/07/physikerin-atomkraft-nur-auf-steuerzahler-kosten-machbar-image-group/wide__1300x731,2024-03-07T13:24:04Z,,"Die von der Union, FDP und der AfD wiederholt geforderte Renaissance der Atomenergie in Deutschland macht aus Sicht der Physikerin Almut Kirchner keinen Sinn. Sowohl europäisch als auch weltweit zeig… [+2324 chars]",,de,'Energieversorgung'
https://www.focus.de/finanzen/news/energieversorgung-physikerin-atomkraft-nur-auf-steuerzahler-kosten-machbar_id_259738973.html,https://www.focus.de/finanzen/news/energieversorgung-physikerin-atomkraft-nur-auf-steuerzahler-kosten-machbar_id_259738973.html,0,www.focus.de,Energieversorgung - Physikerin: Atomkraft nur auf Steuerzahler-Kosten machbar,"Der deutsche Ausstieg aus der Kernenergie sorgt weiterhin für viele Debatten. Befürworter behaupten gerne, mit ihr würde Strom billiger. Dieser Aussage wird von Expertenseite klar widersprochen.",https://p6.focus.de/img/finanzen/news/id_259738972/das-atomkraftwerk-neckarwestheim-2-war-neben-emsland-und-isar-2-das-letzte-akw-in-deutschland-das-in-betrieb-war..jpg?im=Crop%3D%280%2C170%2C2048%2C1024%29%3BResize%3D%281200%2C627%29&impolicy=perceptual&quality=mediumHigh&hash=267ba1256a42660587e9cc98d75484041796b0a34eaf811c13263290ec450fc8,2024-03-07T13:30:05Z,,"Die von der Union, FDP und der AfD wiederholt geforderte Renaissance der Atomenergie in Deutschland macht aus Sicht der Physikerin Almut Kirchner keinen Sinn. Sowohl europäisch als auch weltweit zeig… [+1296 chars]",,de,'Energieversorgung'
https://www.stern.de/kultur/tv/tv-tipp--wohnen-im-wald---blackout-bei-wellmanns--34526254.html,https://www.stern.de/kultur/tv/tv-tipp--wohnen-im-wald---blackout-bei-wellmanns--34526254.html,0,www.stern.de,"TV-Tipp: Wohnen im Wald: ""Blackout bei Wellmanns""","Job weg, Stromausfall, Familie am Rande des Nervenzusammenbruchs. Als Ausweg aus dem Blackout scheint es nur eins zu geben: zurück zu den Wurzeln und ab in den Wald.",https://image.stern.de/34526256/t/i0/v1/w1440/r1.7778/-/08--urnnewsmldpacom2009010124030699242759v2w800h600l460t126r2228b1416jpeg---beae9e0599ee208c.jpg,2024-03-07T14:47:49Z,,"Job weg, Stromausfall, Familie am Rande des Nervenzusammenbruchs. Als Ausweg aus dem Blackout scheint es nur eins zu geben: zurück zu den Wurzeln und ab in den Wald.
Thomas Wellmann (Wotan Wilke Möh… [+3144 chars]",,de,'Blackout'
https://www.tagesschau.de/inland/innenpolitik/energiewende-rechnungshof-kritik-100.html,https://www.tagesschau.de/inland/innenpolitik/energiewende-rechnungshof-kritik-100.html,0,www.tagesschau.de,Bericht des Rechnungshofes: Deutschland hinkt Energiezielen hinterher,Der Bundesrechnungshof hat der Regierung ein schlechtes Zeugnis für die Energiewende ausgestellt. Der Ausbau Erneuerbarer Energien gehe zu langsam voran - und dies treibe den Strompreis in die Höhe.,https://images.tagesschau.de/image/37f84827-1478-4c36-a208-9ac8fa2a5b90/AAABjhmO3nY/AAABjcWen7M/16x9-1280/windkraft-energiewende-100.jpg,2024-03-07T16:58:31Z,,"Stand: 07.03.2024 17:58 Uhr
Der Bundesrechnungshof hat der Regierung ein schlechtes Zeugnis für die Energiewende ausgestellt. Der Ausbau Erneuerbarer Energien gehe zu langsam voran - und dies treibe… [+3401 chars]",,de,'Energieversorgung'
https://www.focus.de/earth/erstes-krankenhaus-mit-wasserstoff-versorgung-einfach-mal-machen-anstatt-lange-zu-diskutieren_id_259735236.html,https://www.focus.de/earth/erstes-krankenhaus-mit-wasserstoff-versorgung-einfach-mal-machen-anstatt-lange-zu-diskutieren_id_259735236.html,0,www.focus.de,Bundesweiter Pionier - Im Kohlerevier wagt das erste deutsche Krankenhaus das Wasserstoff-Experiment,Ein Krankenhaus in Erkelenz im Rheinischen Braunkohlerevier geht neue Wege bei der Energieversorgung. Ein Teil des Stroms und der Wärme wird demnächst durch Wasserstoff erzeugt. Von FOCUS-online-Redakteur Frank Gerstenberg,https://p6.focus.de/img/fotos/id_259735325/wasserstoff.jpg?im=Crop%3D%280%2C288%2C3464%2C1732%29%3BResize%3D%281200%2C627%29&impolicy=perceptual&quality=mediumHigh&hash=bb27b0f35789502502c861808b7b77f240bba4cf88cadeaff056156a5b0ad5b4,2024-03-07T17:57:12Z,,"<ul><li>
Kommentare</li><li>
E-Mail</li><li>
Teilen</li><li>
Mehr</li><li>
Twitter</li><li>
Drucken</li><li>
Feedback</li><li>
Fehler meldenSie haben einen Fehler gefunden?
Bitte markieren S… [+6474 chars]",,de,'Energieversorgung'
https://www.brigitte.de/aktuell/jochen-busse---7-tage--7-koepfe--star-macht-migraene-diagnose-oeffentlich-13782244.html,https://www.brigitte.de/aktuell/jochen-busse---7-tage--7-koepfe--star-macht-migraene-diagnose-oeffentlich-13782244.html,0,www.brigitte.de,"Jochen Busse: ""7 Tage, 7 Köpfe""-Star macht Migräne-Diagnose öffentlich",Jochen Busse hat über die Gründe für seinen jüngsten Blackout auf der Theaterbühne und ein mögliches Karriere-Aus gesprochen.,https://image.brigitte.de/13782246/t/ed/v1/w1440/r1.7778/-/07---7-tage--7-koepfe--star-macht-migraene-diagnose-oeffentlich---1-1---spoton-article-1062680.jpg,2024-03-07T18:44:00Z,,"Jochen Busse hat über die Gründe für seinen jüngsten Blackout auf der Theaterbühne und ein mögliches Karriere-Aus gesprochen.
Jochen Busse (83) hat im Interview mit der ""Bild""-Zeitung über einen Vor… [+1746 chars]",,de,'Blackout'
https://www.focus.de/kultur/vermischtes/bin-dann-wie-paralysiert-jochen-busse-droht-wegen-hinterhaeltiger-stoerung-das-karriere-aus_id_259740198.html,https://www.focus.de/kultur/vermischtes/bin-dann-wie-paralysiert-jochen-busse-droht-wegen-hinterhaeltiger-stoerung-das-karriere-aus_id_259740198.html,0,www.focus.de,„Bin dann wie paralysiert“ - Jochen Busse droht wegen „hinterhältiger Störung“ das Karriere-Aus,"Jochen Busse hat in einem Interview über die Gründe für seinen jüngsten Blackout auf der Theaterbühne gesprochen: „Ich leide seit etwa zehn Jahren an einer hinterhältigen Störung, gegen die es nichts gibt.“",https://p6.focus.de/img/kultur/vermischtes/id_259740197/jochen-busse-wurde-mit-einer-rtl-freitagabendshow-bekannt..jpg?im=Crop%3D%280%2C125%2C1000%2C500%29%3BResize%3D%281200%2C627%29&impolicy=perceptual&quality=mediumHigh&hash=4f8a67b9431b678d9f52bdfaf4773b94f398cdd2e195fc9c61ee34c87e9c56ac,2024-03-07T18:50:04Z,,Jochen Busse (83) hat im Interview mit der Bild-Zeitung über einen Vorfall auf der Theaterbühne gesprochen. Bei der Premiere des Stücks Weiße Turnschuhe am vergangenen Donnerstag in München hatte der… [+1598 chars],,de,'Blackout'
https://www.stern.de/lifestyle/leute/jochen-busse--droht-das-karriere-aus-wegen-migraene--34525946.html,https://www.stern.de/lifestyle/leute/jochen-busse--droht-das-karriere-aus-wegen-migraene--34525946.html,0,www.stern.de,Jochen Busse: Droht das Karriere-Aus wegen Migräne?,Jochen Busse hat über die Gründe für seinen jüngsten Blackout auf der Theaterbühne und ein mögliches Karriere-Aus gesprochen.,https://image.stern.de/34525950/t/M5/v1/w1440/r1.7778/-/07--droht-das-karriere-aus-wegen-migraene----16-9---spoton-article-1062680.jpg,2024-03-07T18:52:00Z,,"Jochen Busse hat über die Gründe für seinen jüngsten Blackout auf der Theaterbühne und ein mögliches Karriere-Aus gesprochen.
Jochen Busse (83) hat im Interview mit der ""Bild""-Zeitung über einen Vor… [+1746 chars]",,de,'Blackout'
https://www.brigitte.de/aktuell/vorschau---der-staatsanwalt--ein-neues-leben--im-zdf-13782318.html,https://www.brigitte.de/aktuell/vorschau---der-staatsanwalt--ein-neues-leben--im-zdf-13782318.html,0,www.brigitte.de,"Vorschau: ""Der Staatsanwalt: Ein neues Leben"" im ZDF","Der ""Staatsanwalt"" (ZDF) ermittelt nach einem mutmaßlichen Rachemord. Bei ""Let's Dance"" (RTL) wagen sich Promis aufs Parkett. In ""Blackout bei Wellmanns"" (arte) muss sich eine Familie nach einem Stromausfall beweisen.",https://image.brigitte.de/13782320/t/XH/v1/w1440/r1.7778/-/08---der-staatsanwalt--ein-neues-leben--im-zdf---1-1---spoton-article-1061987.jpg,2024-03-08T04:58:00Z,,"Der ""Staatsanwalt"" (ZDF) ermittelt nach einem mutmaßlichen Rachemord. Bei ""Let's Dance"" (RTL) wagen sich Promis aufs Parkett. In ""Blackout bei Wellmanns"" (arte) muss sich eine Familie nach einem Stro… [+2870 chars]",,de,'Blackout'
https://www.focus.de/finanzen/news/habeck-lebt-auf-seinem-eigenen-stern-jetzt-holt-ihn-die-harte-energie-realitaet-ein_id_259740844.html,https://www.focus.de/finanzen/news/habeck-lebt-auf-seinem-eigenen-stern-jetzt-holt-ihn-die-harte-energie-realitaet-ein_id_259740844.html,0,www.focus.de,Gastbeitrag von Gabor Steingart - Habeck lebt auf seinem eigenen Stern - jetzt holt ihn die harte Energie-Realität ein,"Robert Habeck lebt auf seinem eigenen Stern. Auf diesem Planeten scheint die Sonne und es weht der Wind. Die Energieversorgung ergrünt und überall da, wo noch das Alte und Braune und Schmutzige herrscht, schreitet die Planerfüllung voran.",https://p6.focus.de/img/panorama/id_259740094/robert-habeck-bundesminister-fuer-wirtschaft-und-klimaschutz-und-vizekanzler-beim-koelner-literaturfestival-archivbild-vom-6.-maerz-2023-..jpg?im=Crop%3D%280%2C250%2C1000%2C500%29%3BResize%3D%281200%2C627%29&impolicy=perceptual&quality=mediumHigh&hash=021523d234532843d6caba8bc6bf7dba49f6839621ce0be88e9e161cef7a8011,2024-03-08T07:01:36Z,,"Robert Habeck lebt auf seinem eigenen Stern. Auf diesem Planeten scheint die Sonne und es weht der Wind. Die Energieversorgung ergrünt und überall da, wo noch das Alte und Braune und Schmutzige herrs… [+5390 chars]",,de,'Energieversorgung'
https://www.zeit.de/news/2024-03/08/netzbetreiber-nach-tesla-anschlag-sicherheit-erhoeht,https://www.zeit.de/news/2024-03/08/netzbetreiber-nach-tesla-anschlag-sicherheit-erhoeht,0,www.zeit.de,Energieversorgung: Netzbetreiber nach Tesla-Anschlag: Sicherheit erhöht,Hier finden Sie Informationen zu dem Thema „Energieversorgung“. Lesen Sie jetzt „Netzbetreiber nach Tesla-Anschlag: Sicherheit erhöht“.,https://img.zeit.de/news/2024-03/08/netzbetreiber-nach-tesla-anschlag-sicherheit-erhoeht-image-group/wide__1300x731,2024-03-08T10:51:11Z,,Nach dem Anschlag auf die Stromversorgung von Tesla in Grünheide sind nach Angaben des Stromnetzbetreibers Edis die Sicherheitsvorkehrungen am Gelände um den beschädigten Strommast erhöht worden. Das… [+1704 chars],,de,'Energieversorgung'
https://www.tagesspiegel.de/potsdam/brandenburg/sicherheitsdienst-im-einsatz-netzbetreiber-erhoht-nach-tesla-anschlag-sicherheit-am-angezundeten-strommast-11334238.html,https://www.tagesspiegel.de/potsdam/brandenburg/sicherheitsdienst-im-einsatz-netzbetreiber-erhoht-nach-tesla-anschlag-sicherheit-am-angezundeten-strommast-11334238.html,0,www.tagesspiegel.de,Sicherheitsdienst im Einsatz: Netzbetreiber erhöht nach Tesla-Anschlag Sicherheit am angezündeten Strommast,Unbekannte hatten einen Anschlag auf die Stromversorgung von Tesla in Brandenburg verübt. Das Gelände um den beschädigten Strommast soll nun eingezäunt werden.,https://www.tagesspiegel.de/images/tesla-fabrik-stillstand-nach-stromausfall16/alternates/BASE_16_9_W1400/tesla-fabrik---stillstand-nach-stromausfall.jpeg,2024-03-08T11:04:50Z,,Nach dem Anschlag auf die Stromversorgung von Tesla in Grünheide sind nach Angaben des Stromnetzbetreibers Edis die Sicherheitsvorkehrungen am Gelände um den beschädigten Strommast erhöht worden. Das… [+1484 chars],,de,'Blackout'
https://www.welt.de/regionales/hamburg/article250481954/Energiewende-in-Hamburg-Kohleausstieg-Klar-aber-erstmal-ohne-konkretes-Datum.html,https://www.welt.de/regionales/hamburg/article250481954/Energiewende-in-Hamburg-Kohleausstieg-Klar-aber-erstmal-ohne-konkretes-Datum.html,0,www.welt.de,Kohleausstieg? Klar – aber erstmal ohne konkretes Datum,Hamburg will keine Fernwärme aus Kohle mehr. Im Jahr 2030 soll eigentlich die letzte Tonne des fossilen Brennstoffs verfeuert sein. Ist dieses Ziel in Gefahr?,https://img.welt.de/img/regionales/hamburg/mobile250481952/2191350527-ci16x9-w1200/Heizkraftwerk-Tiefstack.jpg,2024-03-09T07:07:46Z,,"Für das angestrebte Ende der Kohlenutzung in den Heizkraftwerken Wedel und Tiefstack kann der Hamburger Senat kein konkretes Datum nennen. Das geht aus Antworten hervor, die der Senat auf Kleine Anfr… [+2695 chars]",,de,'Kohleausstieg'
https://www.stern.de/gesellschaft/regional/hamburg-schleswig-holstein/umwelt--kohleausstieg-in-hamburg--senat-kann-kein-datum-nennen-34530062.html,https://www.stern.de/gesellschaft/regional/hamburg-schleswig-holstein/umwelt--kohleausstieg-in-hamburg--senat-kann-kein-datum-nennen-34530062.html,0,www.stern.de,Umwelt: Kohleausstieg in Hamburg: Senat kann kein Datum nennen,Hamburg will keine Fernwärme aus Kohle mehr. Im Jahr 2030 soll eigentlich die letzte Tonne des fossilen Brennstoffs verfeuert sein. Ist dieses Ziel in Gefahr?,https://image.stern.de/34530064/t/rD/v1/w1440/r1.7778/-/09--urnnewsmldpacom2009010124030999275684v3w800h600l691t261r1971b1106jpeg---72c50a5109c90474.jpg,2024-03-09T07:39:37Z,,"Hamburg will keine Fernwärme aus Kohle mehr. Im Jahr 2030 soll eigentlich die letzte Tonne des fossilen Brennstoffs verfeuert sein. Ist dieses Ziel in Gefahr?
Für das angestrebte Ende der Kohlenutzu… [+3020 chars]",,de,'Kohleausstieg'
https://www.zeit.de/news/2024-03/09/kohleausstieg-in-hamburg-senat-kann-kein-datum-nennen,https://www.zeit.de/news/2024-03/09/kohleausstieg-in-hamburg-senat-kann-kein-datum-nennen,0,www.zeit.de,Umwelt: Kohleausstieg in Hamburg: Senat kann kein Datum nennen,Hier finden Sie Informationen zu dem Thema „Umwelt“. Lesen Sie jetzt „Kohleausstieg in Hamburg: Senat kann kein Datum nennen“.,https://img.zeit.de/news/2024-03/09/kohleausstieg-in-hamburg-senat-kann-kein-datum-nennen-image-group/wide__1300x731,2024-03-09T07:39:37Z,,"Für das angestrebte Ende der Kohlenutzung in den Heizkraftwerken Wedel und Tiefstack kann der Hamburger Senat kein konkretes Datum nennen. Das geht aus Antworten hervor, die der Senat auf Kleine Anfr… [+3757 chars]",,de,'Kohleausstieg'
