index,url,valid,domain,title,description,image,published,archive,content,quote,language,keyword
https://www.stern.de/gesellschaft/regional/baden-wuerttemberg/bodensee--neue-faehre-mit-fluessiggas-antrieb-bleibt-erstmal-im-hafen-33787138.html,https://www.stern.de/gesellschaft/regional/baden-wuerttemberg/bodensee--neue-faehre-mit-fluessiggas-antrieb-bleibt-erstmal-im-hafen-33787138.html,0,www.stern.de,Bodensee: Neue Fähre mit Flüssiggas-Antrieb bleibt erstmal im Hafen,"Die neue Bodensee-Fähre mit Flüssiggas-Antrieb für die Strecke zwischen Konstanz und Meersburg kann nicht wie geplant in See stechen. Die ""Richmond"" habe durch die Schiffsuntersuchungskommission (SUK) am 28. August keine Fahrerlaubnis für den Kursverkehr erha…",https://image.stern.de/6681672/t/31/v5/w1440/r1.7778/-/video-fallback-image.jpg,2023-09-01T08:34:27Z,,"Die neue Bodensee-Fähre mit Flüssiggas-Antrieb für die Strecke zwischen Konstanz und Meersburg kann nicht wie geplant in See stechen. Die ""Richmond"" habe durch die Schiffsuntersuchungskommission (SUK… [+2379 chars]",,de,'LNG'
https://www.bild.de/politik/inland/politik-inland/brisante-folge-des-akw-aus-so-viel-auslaendische-kernkraft-steckt-in-unserem-str-85250900.bild.html,https://www.bild.de/politik/inland/politik-inland/brisante-folge-des-akw-aus-so-viel-auslaendische-kernkraft-steckt-in-unserem-str-85250900.bild.html,0,www.bild.de,Brisante Folge des AKW-Aus - Wir importieren so viel Strom wie nie!,Von wegen nur Ökostrom!  Deutschland importiert so viel Strom aus dem Ausland wie nie – vor allem aus Kernkraftwerken...,"https://images.bild.de/64f0a435ce9bc15d734dcab2/e0d93bfecf858e0fa27146fb95b07f51,9d69d38a?w=1280",2023-09-01T09:46:59Z,,"Von wegen nur Ökostrom! 
Deutschland importiert so viel Strom aus dem Ausland wie nie! Und davon sind immer noch 21 Prozent aus Kernkraft und fast 30 Prozent aus Kohle, Gas etc.
Jedes Jahr gibt es … [+1924 chars]",,de,'AKW'
https://www.zeit.de/news/2023-09/01/forderung-nach-planbaren-energiekosten-fuer-seehaefen,https://www.zeit.de/news/2023-09/01/forderung-nach-planbaren-energiekosten-fuer-seehaefen,0,www.zeit.de,Schiffahrt: Forderung nach planbaren Energiekosten für Seehäfen,,,2023-09-01T10:51:32Z,,"When browsing with ads:
We collect personal data and also transmit it to third-party providers
 that help us improve and finance our digital content. Some of the information stored on your device, … [+821 chars]",,de,'Energiekosten'
https://www.faz.net/aktuell/finanzen/dritte-welle-der-inflation-warum-reagieren-boersen-nicht-skeptischer-19143353.html,https://www.faz.net/aktuell/finanzen/dritte-welle-der-inflation-warum-reagieren-boersen-nicht-skeptischer-19143353.html,0,www.faz.net,Die dritte Welle der Inflation,"5,3 Prozent im Euroraum, 6,1 Prozent in Deutschland: Warum reagieren die Börsen nicht skeptischer auf die hohe Inflation? Ein Analyst hat da eine Theorie.",https://media1.faz.net/ppmedia/aktuell/finanzen/3991539576/1.9143855/facebook_teaser/inflation.jpg,2023-09-01T11:55:28Z,https://web.archive.org/web/20230902015134/https://www.faz.net/aktuell/finanzen/dritte-welle-der-inflation-warum-reagieren-boersen-nicht-skeptischer-19143353.html,"Es war eine Woche der Inflation. In Deutschland sank die Inflationsrate im August nach heimischer Rechenweise leicht auf 6,1 Prozent, im Euroraum verharrte sie bei 5,3 Prozent. Ökonomen und Analysten… [+2298 chars]",,de,'Inflation'
https://www.zeit.de/news/2023-09/01/ostdeutsche-textilindustrie-fordert-niedrigere-energiepreise,https://www.zeit.de/news/2023-09/01/ostdeutsche-textilindustrie-fordert-niedrigere-energiepreise,0,www.zeit.de,Textil: Ostdeutsche Textilindustrie fordert niedrigere Energiepreise,,,2023-09-01T11:57:11Z,https://web.archive.org/web/20230902111627/https://www.zeit.de/news/2023-09/01/ostdeutsche-textilindustrie-fordert-niedrigere-energiepreise,"When browsing with ads:
We collect personal data and also transmit it to third-party providers
 that help us improve and finance our digital content. Some of the information stored on your device, … [+821 chars]",,de,'Energiepreise'
https://www.zeit.de/news/2023-09/01/mini-windraeder-an-mobilfunkmast-helfen-bei-stromversorgung,https://www.zeit.de/news/2023-09/01/mini-windraeder-an-mobilfunkmast-helfen-bei-stromversorgung,0,www.zeit.de,Energie: Mini-Windräder an Mobilfunkmast helfen bei Stromversorgung,,,2023-09-01T12:36:37Z,https://web.archive.org/web/20230902110619/https://www.zeit.de/news/2023-09/01/mini-windraeder-an-mobilfunkmast-helfen-bei-stromversorgung,"When browsing with ads:
We collect personal data and also transmit it to third-party providers
 that help us improve and finance our digital content. Some of the information stored on your device, … [+821 chars]",,de,'Stromversorgung'
https://www.n-tv.de/wirtschaft/Deutschland-ist-kein-Strombettler-erklaert-Bruno-Burger-von-Energy-Charts-im-Klima-Labor-article24357979.html,https://www.n-tv.de/wirtschaft/Deutschland-ist-kein-Strombettler-erklaert-Bruno-Burger-von-Energy-Charts-im-Klima-Labor-article24357979.html,0,www.n-tv.de,"""Wir sind kein Strombettler"": Warum Deutschland so viel Strom importiert","Die Kernkraftwerke sind abgeschaltet, Deutschland muss im Ausland um Strom betteln - diese Darstellung hält sich nach dem Atomausstieg hartnäckig. Das ist falsch, erklärt Bruno Burger: Wie andere Länder auch profitiert Deutschland von Stromimporten, sagt der …",https://bilder4.n-tv.de/img/incoming/crop24363107/7231326991-cImg_16_9-w1200/400498291.jpg,2023-09-01T14:35:17Z,,"Die Kernkraftwerke sind abgeschaltet- und Deutschland muss bei seinen Nachbarn um Strom betteln. Diese Darstellung hält sich seit dem Atomausstieg im Frühling hartnäckig. Aber das ist falsch.""Es gibt… [+10922 chars]",,de,'Atomausstieg'
https://www.morgenpost.de/politik/article239342105/energiekrise-gas-winter-energiesparen-gasspeicher.html,https://www.morgenpost.de/politik/article239342105/energiekrise-gas-winter-energiesparen-gasspeicher.html,0,www.morgenpost.de,Kommentar: Putins Krieg: Die Energiekrise ist noch lange nicht vorbei,Deutschlands Gasversorgung ist sicherer als vor einem Jahr. Dennoch müssen Haushalte und Unternehmen weiter Energie sparen – auf Dauer. Ein Kommentar.,https://img.morgenpost.de/img/politik/crop239342099/1482605924-w820-cv16_9-q85/8808b28c-48d4-11ee-aae5-72207211cc45.jpg,2023-09-01T15:26:57Z,,"Berlin.  Kann sich noch jemand an die Gasturbine erinnern? An jenes Riesending von der Ostsee-Pipeline Nord Stream 1, das zur Reparatur nach Kanada musste, dann in Deutschland lagerte und angeblich w… [+4037 chars]",,de,'Gasversorgung'
https://www.zeit.de/news/2023-09/01/mini-windraeder-helfen-bei-stromversorgung,https://www.zeit.de/news/2023-09/01/mini-windraeder-helfen-bei-stromversorgung,0,www.zeit.de,Am Mobilfunkmast: Mini-Windräder helfen bei Stromversorgung,,,2023-09-01T16:00:37Z,https://web.archive.org/web/20230902105711/https://www.zeit.de/news/2023-09/01/mini-windraeder-helfen-bei-stromversorgung,"When browsing with ads:
We collect personal data and also transmit it to third-party providers
 that help us improve and finance our digital content. Some of the information stored on your device, … [+821 chars]",,de,'Stromversorgung'
https://www.dw.com/de/wie-afrika-die-klimawende-in-die-hand-nehmen-will/a-66698333,https://www.dw.com/de/wie-afrika-die-klimawende-in-die-hand-nehmen-will/a-66698333,0,www.dw.com,Wie Afrika die Klimawende in die Hand nehmen will,Mit dem Africa Climate Summit will Kenias Präsident William Ruto den Kontinent auf Erneuerbare Energien polen. Auf der Suche nach einer aktiveren Rolle verlässt er sich auch auf Beratung aus den USA - und erntet Kritik.,https://static.dw.com/image/65112769_6.jpg,2023-09-01T17:01:00Z,,"Innocent Tshilombo hat einen weiten Weg hinter sich. Als Flüchtling verließ er 2009 die ostkongolesische Stadt Goma, erreichte über Uganda das Flüchtlingscamp Kakuma im Nordwesten Kenias. Dort blieb … [+6674 chars]",,de,'Klimaziele Fossile'
https://www.dw.com/de/kenia-will-klimaschutz-made-in-africa/a-66698333,https://www.dw.com/de/kenia-will-klimaschutz-made-in-africa/a-66698333,0,www.dw.com,Kenia will Klimaschutz made in Africa,Mit dem Africa Climate Summit vom 4. bis 9. September will Kenias Präsident William Ruto den Kontinent auf Erneuerbare Energien polen. Und vor allem Kenia als Vorreiter beim Kampf gegen den Klimawandel positionieren.,https://static.dw.com/image/65112769_6.jpg,2023-09-01T17:01:00Z,,"Innocent Tshilombo hat einen weiten Weg hinter sich. Als Flüchtling verließ er 2009 die ostkongolesische Stadt Goma, und erreichte über Uganda das Flüchtlingscamp Kakuma im Nordwesten von Kenia.
Dor… [+6415 chars]",,de,'Erneuerbare Energie'
https://www.n-tv.de/politik/17-13-Bundesnetzagentur-sieht-weiter-Risiken-fuer-Gasversorgung--article23143824.html,https://www.n-tv.de/politik/17-13-Bundesnetzagentur-sieht-weiter-Risiken-fuer-Gasversorgung--article23143824.html,0,www.n-tv.de,Ukraine-Krieg im Liveticker: +++ 17:13 Bundesnetzagentur sieht weiter Risiken für Gasversorgung +++,Lesen Sie alle aktuellen Entwicklungen und Nachrichten über den russischen Angriffskrieg auf die Ukraine im Liveticker von ntv.de.,https://bilder2.n-tv.de/img/incoming/crop23332537/9041326157-cImg_16_9-w1200/Liveticker1-grau-1-Kopie.jpg,2023-09-01T22:17:00Z,,"Der Präsident der Bundesnetzagentur, Klaus Müller, sieht Risiken für die Gasversorgung auch im kommenden Winter und ruft die Bürger zu einem sparsamen Gasverbrauch auf. ""Die Speicher sind zu 94 Proze… [+19455 chars]",,de,'Bundesnetzagentur'
https://www.welt.de/politik/deutschland/article247253938/Scholz-ueber-AKWs-Kernkraft-ist-ein-totes-Pferd.html,https://www.welt.de/politik/deutschland/article247253938/Scholz-ueber-AKWs-Kernkraft-ist-ein-totes-Pferd.html,0,www.welt.de,Scholz lehnt AKW-Debatte ab – „Kernkraft ist in Deutschland ein totes Pferd“,Der Bundeskanzler hält nichts von einem deutschen Wiedereinstieg in die Kernenergie. In einem Interview verwies Olaf Scholz auf die Kosten für den Bau neuer Meiler. Auch den Industriestrompreis sieht er mit Skepsis. Unklar sei vor allem die Finanzierung der M…,https://img.welt.de/img/politik/deutschland/mobile247253942/8391358957-ci16x9-w1200/Chancellor-Scholz-Visits-European-Space-Agency-ESA-In-Cologne.jpg,2023-09-01T22:33:36Z,https://web.archive.org/web/20230901235812/https://www.welt.de/politik/deutschland/article247253938/Scholz-ueber-AKWs-Kernkraft-ist-ein-totes-Pferd.html,Nach erneuten Forderungen der FDP und der AfD nach einer weiteren Nutzung der Atomenergie hat Kanzler Olaf Scholz die Debatte für beendet erklärt. Die Kernkraft ist zu Ende. Sie wird in Deutschland n… [+4110 chars],,de,'AKW'
https://www.stern.de/wirtschaft/news/energie--verbraucherschuetzer-fuer-verlaengerung-der-energiepreisbremsen-33789342.html,https://www.stern.de/wirtschaft/news/energie--verbraucherschuetzer-fuer-verlaengerung-der-energiepreisbremsen-33789342.html,0,www.stern.de,Energie: Verbraucherschützer für Verlängerung der Energiepreisbremsen,"Berlin - Die Leiterin des Bundesverbands der Verbraucherzentralen (vzbv), Ramona Pop, fordert eine längere Absicherung der Haushalte durch die Strom-",https://image.stern.de/33789344/t/3A/v1/w1440/r1.7778/-/02--urnnewsmldpacom200901012309029946761v3w800h600l445t391r1725b1189jpeg---472c6055e684c362.jpg,2023-09-01T23:58:54Z,https://web.archive.org/web/20230903211921/https://www.stern.de/wirtschaft/news/energie--verbraucherschuetzer-fuer-verlaengerung-der-energiepreisbremsen-33789342.html,"Die Energiepreisbremsen laufen eigentlich zum Jahresende aus. Verbraucherschützer fordern eine Verlängerung bis mindestens Ostern 2024.
Die Leiterin des Bundesverbands der Verbraucherzentralen (vzbv… [+1250 chars]",,de,'Gaspreisbremse'
https://www.morgenpost.de/wirtschaft/article239344527/Verbraucherschuetzer-fuer-Verlaengerung-der-Energiepreisbremsen.html,https://www.morgenpost.de/wirtschaft/article239344527/Verbraucherschuetzer-fuer-Verlaengerung-der-Energiepreisbremsen.html,0,www.morgenpost.de,Energie: Verbraucherschützer für Verlängerung der Energiepreisbremsen,Die Energiepreisbremsen laufen eigentlich zum Jahresende aus. Verbraucherschützer fordern eine Verlängerung bis mindestens Ostern 2024.,https://img.morgenpost.de/img/wirtschaft/crop239344525/7532605644-w820-cv16_9-q85/Stromrechnung.jpg,2023-09-01T23:58:54Z,https://web.archive.org/web/20230902103118/https://www.morgenpost.de/wirtschaft/article239344527/Verbraucherschuetzer-fuer-Verlaengerung-der-Energiepreisbremsen.html,"Berlin. Die Leiterin des Bundesverbands der Verbraucherzentralen (vzbv), Ramona Pop, fordert eine längere Absicherung der Haushalte durch die Strom- und Gaspreisbremse. 
Die Erwartung an die Politik… [+1109 chars]",,de,'Energiepreisbremse'
https://www.focus.de/finanzen/news/energie-verbraucherschuetzer-fuer-verlaengerung-der-energiepreisbremsen_id_203470520.html,https://www.focus.de/finanzen/news/energie-verbraucherschuetzer-fuer-verlaengerung-der-energiepreisbremsen_id_203470520.html,0,www.focus.de,Energie - Verbraucherschützer für Verlängerung der Energiepreisbremsen,Die Energiepreisbremsen laufen eigentlich zum Jahresende aus. Verbraucherschützer fordern eine Verlängerung bis mindestens Ostern 2024.,https://p6.focus.de/img/finanzen/news/id_203470519/verbraucherschuetzer-fordern-eine-laengere-absicherung-der-haushalte-durch-die-strom-und-gaspreisbremse..jpg?im=Crop%3D%280%2C128%2C2048%2C1024%29%3BResize%3D%281200%2C627%29&impolicy=perceptual&quality=mediumHigh&hash=2e419d3528051e53cbb690cec09066fd13de580fd82bd467fa31f11415aec05a,2023-09-02T00:05:11Z,,"Die Leiterin des Bundesverbands der Verbraucherzentralen (vzbv), Ramona Pop, fordert eine längere Absicherung der Haushalte durch die Strom- und Gaspreisbremse.
«Die Erwartung an die Politik ist gan… [+1104 chars]",,de,'Energiepreisbremse'
https://www.tagesschau.de/inland/scholz-atomkraft-100.html,https://www.tagesschau.de/inland/scholz-atomkraft-100.html,0,www.tagesschau.de,"Scholz hält Kernkraft für ""totes Pferd""","Um die hohen Energiepreise zu senken, schlägt der Präsident des Ifo-Instituts, Fuest, vor, neue Energien zu erforschen - aber auch den Wiedereinstieg in die Kernenergie. Kanzler Scholz erklärt die Debatte über eine weitere Nutzung für beendet.",https://images.tagesschau.de/image/1e2e6c07-81eb-4f16-a7d4-6836a3a94aec/AAABieWofLQ/AAABibBxqrQ/16x9-1280/olaf-scholz-452.jpg,2023-09-02T02:49:14Z,,"Stand: 02.09.2023 04:49 Uhr
Um die hohen Energiepreise zu senken, schlägt der Präsident des Ifo-Instituts, Fuest, vor, neue Energien zu erforschen - aber auch den Wiedereinstieg in die Kernenergie. … [+2997 chars]",,de,'Energiepreise'
https://www.sueddeutsche.de/politik/atomkraft-fdp-scholz-1.6186796,https://www.sueddeutsche.de/politik/atomkraft-fdp-scholz-1.6186796,0,www.sueddeutsche.de,"Energiepolitik: ""Das Thema Kernkraft ist in Deutschland ein totes Pferd""","Kanzler Scholz lehnt die Forderung seines Koalitionspartners FDP ab, den Rückbau der Atommeiler in Deutschland zu stoppen.",https://www.sueddeutsche.de/image/sz.1.6186797/1200x675?v=1693634428,2023-09-02T06:01:16Z,https://web.archive.org/web/20230902064351/https://www.sueddeutsche.de/politik/atomkraft-fdp-scholz-1.6186796,"Kanzler Scholz lehnt die Forderung seines Koalitionspartners FDP ab, den Rückbau der Atommeiler in Deutschland zu stoppen.Nach neuerlichen Forderungen der FDP und der AfD nach einer weiteren Nutzung … [+1531 chars]",,de,'Energiepolitik'
https://www.zeit.de/politik/deutschland/2023-09/energiepreise-winter-preisbremse-verbraucher,https://www.zeit.de/politik/deutschland/2023-09/energiepreise-winter-preisbremse-verbraucher,0,www.zeit.de,Energiepresie: Verbraucherschützer fordern längere Laufzeit der Energiepreisbremsen,Der Verbraucherzentrale Bundesverband fürchtet höhere Energiepreise im Winter. Die Strom- und Gaspreisbremse solle daher bis mindestens Ostern 2024 verlängert werden.,,2023-09-02T06:36:26Z,https://web.archive.org/web/20230902092208/https://www.zeit.de/politik/deutschland/2023-09/energiepreise-winter-preisbremse-verbraucher,"When browsing with ads:
We collect personal data and also transmit it to third-party providers
 that help us improve and finance our digital content. Some of the information stored on your device, … [+821 chars]",,de,'Energiepreise'
https://www.stern.de/gesellschaft/regional/baden-wuerttemberg/preisbremse--geringe-nachfrage-nach-finanzhilfen-fuer-energiekosten-33789858.html,https://www.stern.de/gesellschaft/regional/baden-wuerttemberg/preisbremse--geringe-nachfrage-nach-finanzhilfen-fuer-energiekosten-33789858.html,0,www.stern.de,Preisbremse: Geringe Nachfrage nach Finanzhilfen für Energiekosten,"Strom- und Gaskunden profitieren von Preisbremsen. Für Menschen, die mit Holz, Öl oder anderen Brennstoffen heizen, gibt es direkte Finanzhilfen - die werden nicht stark nachgefragt.",https://image.stern.de/33789860/t/z4/v1/w1440/r1.7778/-/02--urnnewsmldpacom200901012309029948718v3w800h600l214t543r1492b1480jpeg---024b0fe4267223cc.jpg,2023-09-02T07:31:12Z,,"Strom- und Gaskunden profitieren von Preisbremsen. Für Menschen, die mit Holz, Öl oder anderen Brennstoffen heizen, gibt es direkte Finanzhilfen - die werden nicht stark nachgefragt.
Die Finanzhilfe… [+1396 chars]",,de,'Winter heizen'
https://www.stern.de/news/scholz-weist-fdp-forderung-nach-stopp-des-akw-rueckbaus-zurueck-33789872.html,https://www.stern.de/news/scholz-weist-fdp-forderung-nach-stopp-des-akw-rueckbaus-zurueck-33789872.html,0,www.stern.de,Scholz weist FDP-Forderung nach Stopp des Akw-Rückbaus zurück,"Bundeskanzler Olaf Scholz (SPD) hat die FDP-Forderung nach einem Stopp des Rückbaus abgeschalteter Atomkraftwerke zurückgewiesen. ""Das Thema Kernkraft ist in Deutschland ein totes Pferd"", sagte Scholz im ""Interview der Woche"" des Deutschlandfunks. Die Atomkra…",https://image.stern.de/33789874/t/iq/v1/w1440/r1.7778/-/02--bundeskanzler-olaf-scholz-spd---198d4089796163eb.jpg,2023-09-02T07:33:25Z,https://web.archive.org/web/20230907060103/https://www.stern.de/news/scholz-weist-fdp-forderung-nach-stopp-des-akw-rueckbaus-zurueck-33789872.html,"Bundeskanzler Olaf Scholz (SPD) hat die FDP-Forderung nach einem Stopp des Rückbaus abgeschalteter Atomkraftwerke zurückgewiesen. ""Das Thema Kernkraft ist in Deutschland ein totes Pferd"", sagte Schol… [+2206 chars]",,de,'Akw'
https://www.handelsblatt.com/politik/deutschland/energiepreise-oekonomen-fordern-reduzierung-der-energiepreise-scholz-fragt-nach-finanzierung/29369212.html,https://www.handelsblatt.com/politik/deutschland/energiepreise-oekonomen-fordern-reduzierung-der-energiepreise-scholz-fragt-nach-finanzierung/29369212.html,0,www.handelsblatt.com,Energiepreise: Ökonomen fordern Reduzierung der Energiepreise – Scholz fragt nach Finanzierung,"Führende Ökonomen fordern die Regierung auf, mehr für dauerhaft niedrigere Energiepreise zu tun. Der Kanzler vermeidet es, Stellung zu nehmen. Der Ursprung des Geldes müsse geklärt werden.",https://www.handelsblatt.com/images/veronika-grimm/29369218/2-format2003.jpg,2023-09-02T08:48:39Z,https://web.archive.org/web/20230903013335/https://www.handelsblatt.com/politik/deutschland/energiepreise-oekonomen-fordern-reduzierung-der-energiepreise-scholz-fragt-nach-finanzierung/29369212.html,"Veronika GrimmWährend Wirtschaftsweise Grimm unter anderem die Stromsteuer auf den europäischen Mindestsatz senken will, fordert Michael Hüther, der Direktor des Instituts der deutschen Wirtschaft, e… [+3631 chars]",,de,'Energiepreise'
https://orf.at/stories/3329736/,https://orf.at/stories/3329736/,0,orf.at,Deutschland sieht Risiken bei Gasversorgung im Winter,,https://orf.at/mojo/1_4_1/storyserver//news/common/images/og-fallback-news.png,2023-09-02T14:32:44Z,,"Der Präsident der deutschen Bundesnetzagentur, Klaus Müller, sieht Risiken für die Gasversorgung auch im kommenden Winter und ruft die Bürgerinnen und Bürger des Landes zu einem grundsätzlich sparsam… [+768 chars]",,de,'Gasversorgung'
https://www.n-tv.de/politik/Bundesnetzagentur-warnt-vor-Suedost-Europa-Risiko-article24368378.html,https://www.n-tv.de/politik/Bundesnetzagentur-warnt-vor-Suedost-Europa-Risiko-article24368378.html,0,www.n-tv.de,"Genug Gas gespeichert, aber...: Bundesnetzagentur warnt vor Südost-Europa-Risiko","Deutschlands Gasspeicher sind schon jetzt gut gefüllt. Bundesnetzagentur-Chef Klaus Müller sieht daher Grund für Optimismus - nicht aber für Entwarnung. Denn es gibt noch ein Risiko, das bislang wenig bedacht wurde. Die Wirtschaftsweise Grimm sieht einen Vort…",https://bilder1.n-tv.de/img/incoming/crop24163976/8741327767-cImg_16_9-w1200/385649957.jpg,2023-09-02T16:58:20Z,,"Deutschlands Gasspeicher sind schon jetzt gut gefüllt. Bundesnetzagentur-Chef Klaus Müller sieht daher Grund für Optimismus - nicht aber für Entwarnung. Denn es gibt noch ein Risiko, das bislang weni… [+2821 chars]",,de,'Gas Ukraine'
https://www.n-tv.de/mediathek/videos/panorama/Tagelang-geweint-China-fuerchtet-Fukushima-Kuehlwasser-article24368758.html,https://www.n-tv.de/mediathek/videos/panorama/Tagelang-geweint-China-fuerchtet-Fukushima-Kuehlwasser-article24368758.html,0,www.n-tv.de,"Laut Experten unbedenklich: ""Tagelang geweint"" - China fürchtet Fukushima-Kühlwasser","Während in Japan hochrangige Politiker, darunter Premierminister Fumio Kishida, Fisch aus der Region Fukushima essen, hamstern die Menschen in China Jod-Salz. Sie haben Angst vor dem Kühlwasser aus dem ehemaligen AKW, welches nun ins Meer abgeleitet wird. Exp…",https://bilder3.n-tv.de/img/incoming/crop24368846/7391322299-cImg_16_9-w1200/fuku.jpg,2023-09-03T08:16:09Z,https://web.archive.org/web/20230903140114/https://www.n-tv.de/mediathek/videos/panorama/Tagelang-geweint-China-fuerchtet-Fukushima-Kuehlwasser-article24368758.html,,,de,'AKW'
https://www.handelsblatt.com/politik/international/europaeische-union-deutsche-ministerpraesidenten-fordern-in-bruessel-industriestrompreis/29369484.html,https://www.handelsblatt.com/politik/international/europaeische-union-deutsche-ministerpraesidenten-fordern-in-bruessel-industriestrompreis/29369484.html,0,www.handelsblatt.com,Europäische Union: Energiekosten als „Hemmnis für die Erholung der Konjunktur“ – Ministerpräsidenten fordern in Brüssel Industriestrompreis,Die Bundesländer wollen mehr Subventionen für deutsche Unternehmen und Regionen durchsetzen. Diese Woche treffen sie Kommissionschefin Ursula von der Leyen.,https://www.handelsblatt.com/images/eu-kommissionspraesidentin/29369496/2-format2003.jpg,2023-09-03T08:23:17Z,,"EU-KommissionspräsidentinUrsula von der Leyen trifft sich mit den deutschen Ministerpräsidenten in Brüssel.
(Foto: Reuters)
Brüssel Die EU-Kommission soll es den nationalen Regierungen ermöglichen,… [+3181 chars]",,de,'Energiekosten'
https://www.welt.de/wirtschaft/article247267948/Bis-Ostern-Hohe-Preise-zum-Winter-Verbraucherschuetzer-fordern-Verlaengerung-der-Energiepreisbremsen.html,https://www.welt.de/wirtschaft/article247267948/Bis-Ostern-Hohe-Preise-zum-Winter-Verbraucherschuetzer-fordern-Verlaengerung-der-Energiepreisbremsen.html,0,www.welt.de,Hohe Preise zum Winter? – Verbraucherschützer fordern Verlängerung der Energiepreisbremsen,"Bis Ostern 2024 sollte die Politik die Strom- und Gaspreisbremse weiter in Kraft halten. Dafür plädieren Verbraucherschützer, sie fürchten stark steigende Energiepreise. Habeck hatte sich bereits dafür ausgesprochen. Experten raten zudem zum Einsparen von Str…",https://img.welt.de/img/bildergalerien/mobile247267916/5871353997-ci16x9-w1200/Stromrechnung.jpg,2023-09-03T09:24:38Z,https://web.archive.org/web/20230903130113/https://www.welt.de/wirtschaft/article247267948/Bis-Ostern-Hohe-Preise-zum-Winter-Verbraucherschuetzer-fordern-Verlaengerung-der-Energiepreisbremsen.html,"Die Leiterin des Bundesverbands der Verbraucherzentralen (vzbv), Ramona Pop, fordert eine längere Absicherung der Haushalte durch die Strom- und Gaspreisbremse. Die Erwartung an die Politik ist ganz … [+2680 chars]",,de,'Gas sparen'
https://www.morgenpost.de/ratgeber/article239311401/heizung-gasheizung-waermepumpe-kosten-wwf-studie.html,https://www.morgenpost.de/ratgeber/article239311401/heizung-gasheizung-waermepumpe-kosten-wwf-studie.html,0,www.morgenpost.de,Heizung: Neue Studie zu Gasheizung: Warum Wärmepumpe günstiger ist,Die Modernisierung der Heizung kann für Hausbesitzer teuer werden. Eine Studie zu Kosten der Gasheizung trifft nun ein klares Urteil.,https://img.morgenpost.de/img/wirtschaft/crop238182315/5152608954-w820-cv16_9-q85/0dde4a82-deba-11ed-ae46-47d421ede403.jpg,2023-09-03T12:36:00Z,,"Berlin. <ul><li>In den vergangenen Monaten gab es viele Diskussionen um die Wärmepumpe</li><li>Nun gibt es eine neue Studie, die die Kosten von Wärmepumpe und Gasheizung miteinander vergleicht</li><l… [+3417 chars]",,de,'Gasheizung'
https://www.zeit.de/news/2023-09/03/verleger-fuer-anbindung-des-ruegener-lng-terminals-erwartet,https://www.zeit.de/news/2023-09/03/verleger-fuer-anbindung-des-ruegener-lng-terminals-erwartet,0,www.zeit.de,Gas: Verleger für Anbindung des Rügener LNG-Terminals erwartet,,,2023-09-03T16:53:48Z,https://web.archive.org/web/20230905105612/https://www.zeit.de/news/2023-09/03/verleger-fuer-anbindung-des-ruegener-lng-terminals-erwartet,"When browsing with ads:
We collect personal data and also transmit it to third-party providers
 that help us improve and finance our digital content. Some of the information stored on your device, … [+821 chars]",,de,'LNG'
