index,url,valid,domain,title,description,image,published,archive,content,quote,language,keyword
https://www.telepolis.de/features/Deutschlands-Gasspeicher-prall-gefuellt-aber-reicht-das-fuer-eiskalten-Winter-9353665.html,https://www.telepolis.de/features/Deutschlands-Gasspeicher-prall-gefuellt-aber-reicht-das-fuer-eiskalten-Winter-9353665.html,0,www.telepolis.de,Deutschlands Gasspeicher prall gefüllt – aber reicht das für eiskalten Winter?,"Deutsche Gasspeicher sind fast voll, doch Risiken bleiben. Hoffen auf milden Winter und LNG-Importe. Wie kann Deutschland die kommenden Monate überstehen?",https://heise.cloudimg.io/bound/1200x1200/q85.png-lossy-85.webp-lossy-85.foil1/_www-heise-de_/imgs/18/4/3/2/8/8/5/4/gasknappheit_ho-e692b730a8a87f90.png,2023-11-06T06:00:00Z,,"Deutsche Gasspeicher sind fast voll, doch Risiken bleiben. Hoffen auf milden Winter und LNG-Importe. Wie kann Deutschland die kommenden Monate überstehen?
Die Gasspeicher in Deutschland sind voll un… [+3306 chars]",,de,'Gas Import'
https://www.morgenpost.de/wirtschaft/article239955450/heizoelpreise-aktuell-heute-6-november-heizoel-heizung-deutschland.html,https://www.morgenpost.de/wirtschaft/article239955450/heizoelpreise-aktuell-heute-6-november-heizoel-heizung-deutschland.html,0,www.morgenpost.de,Heizen und Kosten: Heizölpreise aktuell (6.11.): Der Preis pro Liter Heizöl,Sinken oder steigen die Heizölpreise? ○ Der Blick auf die Woche zeigt eine klare Tendenz ○ Die aktuellen Preise vom 6. November finden Sie hier.,https://img.morgenpost.de/img/wirtschaft/crop237618627/1292603021-w820-cv16_9-q85/Mann-vor-Tanklastwagen-beliefert-einen-Haushalt-mit-Heizoel.jpg,2023-11-06T08:39:41Z,,"Berlin. Seit rund einem Monat sorgen sich Verbraucherinnen und Verbraucher in Deutschland um ihre Heizkosten: Nicht nur, weil die Heizölpreise im Winter üblicherweise steigen. Seit Beginn des Nahost-… [+10140 chars]",,de,'Heizöl'
https://www.n-tv.de/wirtschaft/Gasspeicher-zu-ueber-100-Prozent-gefuellt-wie-geht-das-article24512169.html,https://www.n-tv.de/wirtschaft/Gasspeicher-zu-ueber-100-Prozent-gefuellt-wie-geht-das-article24512169.html,0,www.n-tv.de,"""Besser auf Winter vorbereitet"": Gasspeicher zu über 100 Prozent gefüllt - wie geht das?","Als Russland im Sommer 2022 den wichtigsten Gashahn zudreht, ist die Sorge groß, dass im Winter zu wenig Erdgas da sein könnte. Doch so weit kommt es nicht. Eine wichtige Rolle für die Gasversorgung spielen weiterhin die Gasspeicher. Sie sind erneut randvoll.",https://bilder2.n-tv.de/img/incoming/crop24436897/3731322815-cImg_16_9-w1200/419998852.jpg,2023-11-06T09:01:45Z,,"Als Russland im Sommer 2022 den wichtigsten Gashahn zudreht, ist die Sorge groß, dass im Winter zu wenig Erdgas da sein könnte. Doch so weit kommt es nicht. Eine wichtige Rolle für die Gasversorgung … [+4213 chars]",,de,'Russland Gas'
https://www.morgenpost.de/vermischtes/article239955740/Ihr-Nachbar-heizt-nicht-Das-kann-teuer-fuer-Sie-werden.html,https://www.morgenpost.de/vermischtes/article239955740/Ihr-Nachbar-heizt-nicht-Das-kann-teuer-fuer-Sie-werden.html,0,www.morgenpost.de,Energiepreise: Ihr Nachbar heizt nicht? Das kann teuer für Sie werden,"Bleibt die Nachbarwohnung unbeheizt, spürt man dies auch in den eigenen vier Wänden. Die Folgen können verheerend sein.",https://img.morgenpost.de/img/frontpage/crop239955738/0972603165-w820-cv16_9-q85/405040861.jpg,2023-11-06T09:25:01Z,,"Der Winter naht, draußen wird es spürbar kälter und damit auch zuhause in der eigenen Wohnung. Vor allem kälteempfindliche Menschen haben bereits im Oktober angefangen, ihre Heizung aufzudrehen. Aber… [+3446 chars]",,de,'Heizkosten'
https://www.focus.de/finanzen/news/und-das-gas-kommt-doch-wie-eu-laender-immer-mehr-lng-aus-russland-beziehen_id_238142128.html,https://www.focus.de/finanzen/news/und-das-gas-kommt-doch-wie-eu-laender-immer-mehr-lng-aus-russland-beziehen_id_238142128.html,0,www.focus.de,"Trotz Boykott - Flüssiggas-Terminals sind „Hintertür, um russisches Gas nach Europa zu bringen“","Eigentlich wollte Wladimir Putin kein Gas mehr nach Europa liefern, doch niemand hält sich an die Order des Machthabers. Vor allem russische Flüssiggas-Exporteure fahren die Förderung hoch. Das LNG wird in Europa mit offenen Armen empfangen. Es landet auch in…",https://p6.focus.de/img/regional/mecklenburg-vorpommern/id_236796132/auf-dem-pipeline-verlegeschiff-castoro-10-bauen-fachleute-an-der-anbindungspipeline-des-fluessigerdgas-lng-terminal-in-mukran..jpg?im=Crop%3D%280%2C156%2C2048%2C1024%29%3BResize%3D%281200%2C627%29&impolicy=perceptual&quality=mediumHigh&hash=d5b33e91616b9f3cb0c21eec9a5e156bbb8ddb6ef539e9f6ab6ccff410c506cd,2023-11-06T09:36:05Z,https://web.archive.org/web/20231106145109/https://www.focus.de/finanzen/news/und-das-gas-kommt-doch-wie-eu-laender-immer-mehr-lng-aus-russland-beziehen_id_238142128.html,"Eigentlich wollte Wladimir Putin kein Gas mehr nach Europa liefern, doch niemand hält sich an die Order des Machthabers. Vor allem russische Flüssiggas-Exporteure fahren die Förderung hoch. Das LNG w… [+4668 chars]",,de,'Erdgas Russland'
https://www.sueddeutsche.de/wirtschaft/energieversorgung-die-erdgasspeicher-sind-komplett-gefuellt-1.6298885,https://www.sueddeutsche.de/wirtschaft/energieversorgung-die-erdgasspeicher-sind-komplett-gefuellt-1.6298885,0,www.sueddeutsche.de,Energieversorgung: Die Erdgasspeicher sind komplett gefüllt,"Der Füllstand liegt sogar bei etwas mehr als 100 Prozent, das klingt überraschend. Wie kann das sein kann?",https://www.sueddeutsche.de/image/sz.1.5735384/1200x675?v=1699264015,2023-11-06T09:47:12Z,,"Es ist der zweite Winter in Folge, in dem sich Deutschland fragen muss, ob die Energie für Haushalte und die Industrie reicht. Ein Blick auf die Füllstände der Erdgasspeicher zeigt: Sie sind seit ver… [+3991 chars]",,de,'Gasspeicher'
https://www.morgenpost.de/berlin/article239950824/Welche-Berliner-Ideen-den-Klimaschutz-voranbringen.html,https://www.morgenpost.de/berlin/article239950824/Welche-Berliner-Ideen-den-Klimaschutz-voranbringen.html,0,www.morgenpost.de,Innovation: Welche Berliner Ideen den Klimaschutz voranbringen,An elf Zukunftsorten in Berlin entwickeln Forscher und Unternehmen Ideen für die neue Energieversorgung und die Schonung der Umwelt.,https://img.morgenpost.de/img/incoming/crop239950822/5107545837-w820-cv16_9-q85-fnov-fpi231768577-fpotl/405141467.jpg,2023-11-06T11:00:00Z,https://web.archive.org/web/20231107081610/https://www.morgenpost.de/berlin/article239950824/Welche-Berliner-Ideen-den-Klimaschutz-voranbringen.html,=tqbo dmbttµ#bsujdmf``mpdbujpo#?Cfsmjo/'octq´=0tqbo?Lmjnbtdivu{- Fofshjfxfoef voe obdiibmujhfs Vnhboh nju obuýsmjdifo Sfttpvsdfo tjoe =tuspoh?Tdijdltbmtgsbhfo=0tuspoh? gýs ejf Nfotdiifju/ Eb{v xjse b… [+13822 chars],,de,'Energieversorgung'
https://www.zeit.de/news/2023-11/06/inflation-in-thueringen-abgeschwaecht-hohe-lebensmittelpreise,https://www.zeit.de/news/2023-11/06/inflation-in-thueringen-abgeschwaecht-hohe-lebensmittelpreise,0,www.zeit.de,Verbraucher: Inflation in Thüringen abgeschwächt: hohe Lebensmittelpreise,Hier finden Sie Informationen zu dem Thema „Verbraucher“. Lesen Sie jetzt „Inflation in Thüringen abgeschwächt: hohe Lebensmittelpreise“.,https://img.zeit.de/news/2023-11/06/inflation-in-thueringen-abgeschwaecht-hohe-lebensmittelpreise-image-group/wide__1300x731,2023-11-06T11:01:12Z,,"Thüringens Verbraucher mussten für ihren Lebensunterhalt im Oktober 4,0 Prozent mehr ausgeben als vor einem Jahr. Preistreiber im Vergleich zu Oktober 2022 waren weniger die gesamten Energiekosten, s… [+2262 chars]",,de,'Inflation'
https://www.morgenpost.de/wirtschaft/article239960824/Gasspeicher-sind-voll-Sollen-wir-trotzdem-sparen-Ja-bitte.html,https://www.morgenpost.de/wirtschaft/article239960824/Gasspeicher-sind-voll-Sollen-wir-trotzdem-sparen-Ja-bitte.html,0,www.morgenpost.de,Kommentar: Gasspeicher sind voll: Sollen wir trotzdem sparen? Ja bitte!,"Auch wenn die deutschen Gasspeicher komplett gefüllt sind, Energie bleibt wertvoll – und sollte deshalb mit Bedacht verbraucht werden.",https://img.morgenpost.de/img/incoming/crop239960822/627260619-w820-cv16_9-q85/405145828.jpg,2023-11-06T16:29:59Z,,Berlin. Die Erdgasspeicher in Deutschland sind zu 100 Prozent voll. Was für eine gute Nachricht! Vor einem Jahr noch haben sich die Augenpaare von 84 Millionen Deutschen ängstlich auf die offiziellen… [+1818 chars],,de,'Gasspeicher'
https://praxistipps.chip.de/betrugs-sms-melden-einfach-anleitung_169031,https://praxistipps.chip.de/betrugs-sms-melden-einfach-anleitung_169031,0,praxistipps.chip.de,Betrugs-SMS melden: Einfach Anleitung,"Wenn Sie Opfer oder Geschädigter einer Betrugs-SMS geworden sind, können Sie diese entweder bei der Bundesnetzagentur oder bei der Polizei melden. … ... mehr",https://im.contentlounge.net/styles/manual_crop/s3/2023-11/85049354.jpg?im=AspectCrop%3D%281.91%2C1%29%2Cgravity%3DCenter%3BResize%3D%281200%2C630%29%2Caspect%3Dfit%3BBackgroundColor%2Ccolor%3Dffffff&hash=1bd9f64d362daa6c326330db5c57d60db101742de03c9af48fb1007afec165d9,2023-11-06T22:00:28Z,,"Wenn Sie Opfer oder Geschädigter einer Betrugs-SMS geworden sind, können Sie diese entweder bei der Bundesnetzagentur oder bei der Polizei melden. 
Die mit einem Symbol oder farbiger Unterstreichung… [+2298 chars]",,de,'Bundesnetzagentur'
https://www.stern.de/gesellschaft/regional/niedersachsen-bremen/landkreis-oldenburg--sieben-verletzte-nach-angeblichem-gasaustritt-33976096.html,https://www.stern.de/gesellschaft/regional/niedersachsen-bremen/landkreis-oldenburg--sieben-verletzte-nach-angeblichem-gasaustritt-33976096.html,0,www.stern.de,Landkreis Oldenburg: Sieben Verletzte nach angeblichem Gasaustritt,"Nach einem vermeintlichen Gasleck in Großenkneten im Landkreis Oldenburg sind sieben Menschen ins Krankenhaus gekommen. Am Montagabend hätten die Bewohner eines Mehrfamilienhauses im Ortsteil Ahlhorn einen gasähnlichen Geruch bemerkt, der Übelkeit und Kopfsch…",https://image.stern.de/33976098/t/_1/v1/w1440/r1.7778/-/07--urnnewsmldpacom2009010123110799850848v2w800h600l128t0r3464b2667jpeg---b5501adab0981633.jpg,2023-11-07T06:44:18Z,,Nach einem vermeintlichen Gasleck in Großenkneten im Landkreis Oldenburg sind sieben Menschen ins Krankenhaus gekommen. Am Montagabend hätten die Bewohner eines Mehrfamilienhauses im Ortsteil Ahlhorn… [+957 chars],,de,'Gasaustritt'
https://www.dw.com/de/frieren-ohne-russisches-gas-die-angst-der-deutschen-ist-weg/a-67319636,https://www.dw.com/de/frieren-ohne-russisches-gas-die-angst-der-deutschen-ist-weg/a-67319636,0,www.dw.com,Frieren ohne russisches Gas? Die Angst der Deutschen ist weg,Auch in diesem zweiten Winter ohne Gas aus Russland wird es keine Versorgungsprobleme geben. Risikofaktoren sind ein möglicher Kälteeinbruch und der gefährdete Gastransit durch die Ukraine.,https://static.dw.com/image/59607649_6.jpg,2023-11-07T09:34:00Z,,Die Deutschen haben keine Angst mehr vor einem kalten Winter ohne Gas aus Russland. Ernste Sorgen vor Energieknappheit gab es im vorigen Jahr und Moskau schürte damals gezielt diese Befürchtungen mit… [+6022 chars],,de,'Gas Ukraine'
https://www.zeit.de/news/2023-11/07/widerstand-gegen-lng-terminal-auf-ruegen-brief-an-bundestag,https://www.zeit.de/news/2023-11/07/widerstand-gegen-lng-terminal-auf-ruegen-brief-an-bundestag,0,www.zeit.de,Gas: Widerstand gegen LNG-Terminal auf Rügen: Brief an Bundestag,Hier finden Sie Informationen zu dem Thema „Gas“. Lesen Sie jetzt „Widerstand gegen LNG-Terminal auf Rügen: Brief an Bundestag“.,https://img.zeit.de/administratives/sharing/fallback-image/wide__1300x731,2023-11-07T14:11:21Z,,"Die Gegner des Terminals für Flüssigerdgas (LNG) in Mukran auf Rügen sehen sich durch die Entwicklungen auf dem Gasmarkt in ihrer Ablehnung bestätigt und fordern, das Projekt sofort zu stoppen. «Die … [+4084 chars]",,de,'LNG-Terminal'
https://www.focus.de/finanzen/news/frieren-ohne-russisches-gas-die-angst-der-deutschen-ist-weg_id_241035957.html,https://www.focus.de/finanzen/news/frieren-ohne-russisches-gas-die-angst-der-deutschen-ist-weg_id_241035957.html,0,www.focus.de,- Vor einem Leben ohne russisches Gas haben Deutsche jetzt keine Angst mehr,Auch in diesem zweiten Winter ohne Gas aus Russland wird es keine Versorgungsprobleme geben. Risikofaktoren sind ein möglicher Kälteeinbruch und der gefährdete Gastransit durch die Ukraine.,https://p6.focus.de/img/finanzen/news/id_241035946/frieren-und-sparen-oder-gemuetlich-und-teurer-schwierige-entscheidung-auch-in-diesem-winter.jpg?im=Crop%3D%280%2C29%2C940%2C470%29%3BResize%3D%281200%2C627%29&impolicy=perceptual&quality=mediumHigh&hash=fb30607c555ac5f96ea918c72ac600c972296597818c14392a31760e0cce3437,2023-11-07T15:22:22Z,,Die Deutschen haben keine Angst mehr vor einem kalten Winter ohne Gas aus Russland. Ernste Sorgen vor Energieknappheit gab es im vorigen Jahr und Moskau schürte damals gezielt diese Befürchtungen mit… [+5638 chars],,de,'Gasspeicher'
https://www.telepolis.de/features/LNG-Terminal-auf-Ruegen-Brief-an-Bundestag-fordert-Stopp-des-Projekts-in-Mukran-9355819.html,https://www.telepolis.de/features/LNG-Terminal-auf-Ruegen-Brief-an-Bundestag-fordert-Stopp-des-Projekts-in-Mukran-9355819.html,0,www.telepolis.de,LNG-Terminal auf Rügen: Brief an Bundestag fordert Stopp des Projekts in Mukran,Bürgermeister des Ostseebads Binz fordert in Brief an Bundestag Stopp des Projekts. Gasspeicher seien gefüllt und Versorgung gesichert. Wann wird das Terminal fertig?,https://heise.cloudimg.io/bound/1200x1200/q85.png-lossy-85.webp-lossy-85.foil1/_www-heise-de_/imgs/18/4/3/3/0/0/0/7/2x-lng-tanker_ho-a6a12fc419b1da77.jpeg,2023-11-08T06:00:00Z,,"Bürgermeister des Ostseebads Binz fordert in Brief an Bundestag Stopp des Projekts. Gasspeicher seien gefüllt und Versorgung gesichert. Wann wird das Terminal fertig?
Die Gasspeicher in Deutschland … [+2899 chars]",,de,'LNG-Terminal'
https://www.telepolis.de/features/LNG-Terminal-auf-Ruegen-Gasspeicher-voll-brauchen-wir-das-Projekt-noch-9355819.html,https://www.telepolis.de/features/LNG-Terminal-auf-Ruegen-Gasspeicher-voll-brauchen-wir-das-Projekt-noch-9355819.html,0,www.telepolis.de,LNG-Terminal auf Rügen: Gasspeicher voll – brauchen wir das Projekt noch?,Bürgermeister des Ostseebads Binz fordert in Brief an Bundestag Stopp des Projekts. Gasspeicher seien gefüllt und Versorgung gesichert. Wann wird das Terminal fertig?,https://heise.cloudimg.io/bound/1200x1200/q85.png-lossy-85.webp-lossy-85.foil1/_www-heise-de_/imgs/18/4/3/3/0/0/0/7/2x-lng-tanker_ho-a6a12fc419b1da77.jpeg,2023-11-08T06:00:00Z,,"Bürgermeister des Ostseebads Binz fordert in Brief an Bundestag Stopp des Projekts. Gasspeicher seien gefüllt und Versorgung gesichert. Wann wird das Terminal fertig?
Die Gasspeicher in Deutschland … [+2918 chars]",,de,'LNG'
https://www.tagesschau.de/wirtschaft/weltwirtschaft/un-fossilie-energien-klimawandel-100.html,https://www.tagesschau.de/wirtschaft/weltwirtschaft/un-fossilie-energien-klimawandel-100.html,0,www.tagesschau.de,"UN-Bericht: Öl- und Gasförderung widerspricht 1,5-Grad-Ziel","Die weltweiten Pläne zur Förderung von fossilen Energien widersprechen dem 1,5-Grad-Ziel zur Begrenzung des Klimawandels. Zu diesem Ergebnis kommt das Umweltprogramm der Vereinten Nationen in einem aktuellen Bericht.",https://images.tagesschau.de/image/66e63b85-be60-4891-8462-f79e0b62e04f/AAABi62m8KI/AAABibBxqrQ/16x9-1280/oel-gas-100.jpg,2023-11-08T07:50:12Z,https://web.archive.org/web/20231108123449/https://www.tagesschau.de/wirtschaft/weltwirtschaft/un-fossilie-energien-klimawandel-100.html,"Stand: 08.11.2023 08:50 Uhr
Die weltweiten Pläne zur Förderung von fossilen Energien widersprechen dem 1,5-Grad-Ziel zur Begrenzung des Klimawandels. Zu diesem Ergebnis kommt das Umweltprogramm der … [+3118 chars]",,de,'LNG'
https://www.dw.com/de/wirtschaftsweise-mit-robotern-und-ki-gegen-fachkr%C3%A4ftemangel/a-67344121,https://www.dw.com/de/wirtschaftsweise-mit-robotern-und-ki-gegen-fachkr%C3%A4ftemangel/a-67344121,0,www.dw.com,Wirtschaftsweise: Mit Robotern und KI gegen Fachkräftemangel,"Die Regierungsberater stellen der deutschen Wirtschaft ein schlechtes Zeugnis aus: Zu wenig Leistung, nicht mehr innovativ genug und obendrein geschwächt durch die Energiekrise. Die Gasspeicher sind voll in Deutschland, das ist vor dem Winter eine grundsätzli…",https://static.dw.com/image/67343612_6.jpg,2023-11-08T13:49:00Z,,"Die Gasspeicher sind voll in Deutschland, das ist vor dem Winter eine grundsätzlich gute Nachricht. Die Schlechte: Die Preise für Gas und in Folge auch für Strom bleiben hoch. Heizen bleibt teuer und… [+6379 chars]",,de,'Gasspeicher'
https://www.stern.de/wirtschaft/prognose--deutsche-wirtschaft-schrumpft---und-waechst-2024-nur-minimal-33981080.html,https://www.stern.de/wirtschaft/prognose--deutsche-wirtschaft-schrumpft---und-waechst-2024-nur-minimal-33981080.html,0,www.stern.de,"Sachverständigenrat: ""Wirtschaftsweise"": Deutsche Wirtschaft schrumpft – und wächst 2024 nur minimal","Im Frühjahr waren sie noch optimistisch, jetzt sagen auch die ""Wirtschaftsweisen"": Die deutsche Wirtschaft schrumpft in diesem Jahr. Sorgen machen ihnen nicht nur Energiekrise und Inflation.",https://image.stern.de/33981084/t/AA/v4/w1440/r1.7778/-/hhla-hamburger-hafen.jpg,2023-11-08T15:18:00Z,,"Im Frühjahr waren sie noch optimistisch, jetzt sagen auch die ""Wirtschaftsweisen"": Die deutsche Wirtschaft schrumpft in diesem Jahr. Sorgen machen ihnen nicht nur Energiekrise und Inflation.
Die deu… [+3034 chars]",,de,'Inflation'
https://www.morgenpost.de/lifestyle/wohnen/article239988800/Hydraulischer-Abgleich-Gut-fuers-Konto-und-fuers-Klima.html,https://www.morgenpost.de/lifestyle/wohnen/article239988800/Hydraulischer-Abgleich-Gut-fuers-Konto-und-fuers-Klima.html,0,www.morgenpost.de,Energie einsparen: Hydraulischer Abgleich: Gut fürs Konto und fürs Klima,Energie und Kosten sparen mit hydraulischem Abgleich - jedes dritte Wohngebäude profitiert bereits von der staatlich geförderten Maßnahme. Vor allem bei Altbauten sehen Experten noch Aufholbedarf.,https://img.morgenpost.de/img/wohnen/crop239988798/3522603912-w820-cv16_9-q85/Hydraulischer-Abgleich-Thermostat-Heizung.jpg,2023-11-08T15:19:05Z,,"Berlin (dpa/tmn). Ein wichtiger Schritt hin zur Energieeffizienz und zum Klimaschutz in den eigenen vier Wänden ist der hydraulische Abgleich der Heizungsanlage. Bei 31 Prozent der 15,5 Millionen zen… [+1787 chars]",,de,'Energie sparen'
https://www.brigitte.de/aktuell/heizung-an-oder-aus---so-sparen-wir-energie-im-herbst-und-winter-13714726.html,https://www.brigitte.de/aktuell/heizung-an-oder-aus---so-sparen-wir-energie-im-herbst-und-winter-13714726.html,0,www.brigitte.de,Heizung an oder aus?: So sparen wir Energie im Herbst und Winter,Beim Heizen herrschen in Zeiten der Energiekrise viele Fragen. Energieexperte Carsten Herbert hat die wichtigsten Tipps parat.,https://image.brigitte.de/13714728/t/1S/v1/w1440/r1.7778/-/08--so-sparen-wir-energie-im-herbst-und-winter---1-1---spoton-article-1055079.jpg,2023-11-08T15:45:00Z,,"Beim Heizen herrschen in Zeiten der Energiekrise viele Fragen. Energieexperte Carsten Herbert hat die wichtigsten Tipps parat.
Das große Rätselraten ums Heizen geht wieder los. Wenn die Temperaturen… [+6549 chars]",,de,'Energie sparen'
https://www.diepresse.com/17805088/die-speicher-sind-voll-der-winter-kann-kommen,https://www.diepresse.com/17805088/die-speicher-sind-voll-der-winter-kann-kommen,0,www.diepresse.com,Die Speicher sind voll: Der Winter kann kommen,"Österreich ist so gut auf eine neue Energiekrise vorbereitet wie nie, sagt der Regulator. Selbst der Ausfall der ukrainischen Gasleitung könne weggesteckt werden.",https://www.diepresse.com/assets_v2/images/diepresse_nachrichten.png,2023-11-08T16:09:01Z,,"Österreich ist so gut auf eine neue Energiekrise vorbereitet wie nie, sagt der Regulator. Selbst der Ausfall der ukrainischen Gasleitung könne weggesteckt werden. 
Wien. Für hundert Prozent hat es d… [+2837 chars]",,de,'Winter Gas'
https://www.zeit.de/news/2023-11/08/stader-lng-terminal-umweltorganisationen-kritisieren-amt,https://www.zeit.de/news/2023-11/08/stader-lng-terminal-umweltorganisationen-kritisieren-amt,0,www.zeit.de,Energie: Stader LNG-Terminal: Umweltorganisationen kritisieren Amt,Hier finden Sie Informationen zu dem Thema „Energie“. Lesen Sie jetzt „Stader LNG-Terminal: Umweltorganisationen kritisieren Amt“.,https://img.zeit.de/administratives/sharing/fallback-image/wide__1300x731,2023-11-08T17:42:55Z,,Umweltorganisationen haben nach der Absage eines Erörterungstermins zum Bau des LNG-Terminals an Land in Stade das Staatliche Gewerbeaufsichtsamt Lüneburg kritisiert. Der BUND Niedersachsen und die D… [+2010 chars],,de,'LNG'
https://www.morgenpost.de/wirtschaft/article239973766/Teures-Wasser-Deutsche-duschen-kuerzer-seltener-und-kaelter.html,https://www.morgenpost.de/wirtschaft/article239973766/Teures-Wasser-Deutsche-duschen-kuerzer-seltener-und-kaelter.html,0,www.morgenpost.de,"Energie: Teures Wasser: Deutsche duschen kürzer, seltener und kälter",Die gestiegenen Energiepreise haben den Wasserverbrauch in Deutschland verändert. Ein Energieexperte nennt 6 Tricks fürs Wassersparen.,https://img.morgenpost.de/img/mode/crop239042397/3202602571-w820-cv16_9-q85/Frau-unter-der-Dusche.jpg,2023-11-08T21:00:00Z,,"Dürren oder Waldbrände sind oft sichtbare Zeichen für trockene Böden und Wassermangel. Ob in Spanien, Frankreich oder Griechenland: Auch in Europa wird Trinkwasser zunehmend zum knapperen Gut. Weltwe… [+5660 chars]",,de,'Energiepreise'
https://www.stern.de/gesellschaft/regional/rheinland-pfalz-saarland/energie--rheinland-pfalz-und-saarland--gas-untertagespeicher-gefuellt-33982806.html,https://www.stern.de/gesellschaft/regional/rheinland-pfalz-saarland/energie--rheinland-pfalz-und-saarland--gas-untertagespeicher-gefuellt-33982806.html,0,www.stern.de,Energie: Rheinland-Pfalz und Saarland: Gas-Untertagespeicher gefüllt,Die Bundesnetzagentur schätzt die Gefahr einer angespannten Gasversorgung im Fall eines normal kalten Winters derzeit als gering ein. Auch im Südwesten sieht es bei der Speichermenge gut aus.,https://image.stern.de/33982808/t/Vo/v1/w1440/r1.7778/-/09--urnnewsmldpacom2009010123110999879050v3w800h600l581t33r2024b950jpeg---aed64746e4d515b5.jpg,2023-11-09T04:37:56Z,,"Die Bundesnetzagentur schätzt die Gefahr einer angespannten Gasversorgung im Fall eines normal kalten Winters derzeit als gering ein. Auch im Südwesten sieht es bei der Speichermenge gut aus.
Der ei… [+2231 chars]",,de,'Bundesnetzagentur'
https://www.stern.de/gesellschaft/regional/nordrhein-westfalen/telekommunikation--kartellamt-springt-mobilfunker-1-1-zur-seite-33982968.html,https://www.stern.de/gesellschaft/regional/nordrhein-westfalen/telekommunikation--kartellamt-springt-mobilfunker-1-1-zur-seite-33982968.html,0,www.stern.de,Telekommunikation: Kartellamt springt Mobilfunker 1&1 zur Seite,"Bei seinem schwierigen Markteintritt als vierter deutscher Handynetz-Betreiber bekommt der Telekommunikationsanbieter 1&1 Schützenhilfe vom Bundeskartellamt. Im September hatte die Bundesnetzagentur vorgeschlagen, auf die übliche Frequenzauktion zu verzichten…",https://image.stern.de/33982970/t/Im/v1/w1440/r1.7778/-/09--urnnewsmldpacom2009010123110999879675v3w800h600l207t0r1986b1157jpeg---3de479dfc2d17bdb.jpg,2023-11-09T05:44:18Z,,Bei seinem schwierigen Markteintritt als vierter deutscher Handynetz-Betreiber bekommt der Telekommunikationsanbieter 1&amp;1 Schützenhilfe vom Bundeskartellamt. Im September hatte die Bundesnetzagen… [+2377 chars],,de,'Bundesnetzagentur'
https://www.morgenpost.de/wirtschaft/article239955518/pelletspreise-aktuell-heute-9-november-heizen-heizung-deutschland.html,https://www.morgenpost.de/wirtschaft/article239955518/pelletspreise-aktuell-heute-9-november-heizen-heizung-deutschland.html,0,www.morgenpost.de,Energiepreise heute: Pelletspreise aktuell (9.11.): Der Preis pro Tonne heute,"Die Heizsaison startet. ○ Sollte man Holzpellets jetzt kaufen oder abwarten? ○ Lesen Sie hier, was eine Tonne heute am 9. November kostet.",https://img.morgenpost.de/img/wirtschaft/crop237320609/1392606941-w820-cv16_9-q85/Pelletspreis-in-Deutschland-Auch-Holz-als-Brennstoff-teurer.jpg,2023-11-09T07:05:00Z,,"Berlin. Der Preis für Holzpellets sinkt weiter: Seit mehr als fünf Monaten werden Pellets Tag für Tag günstiger. Für Verbraucherinnen und Verbraucherinnen, die mit einer Pelletheizung heizen, sind da… [+9812 chars]",,de,'Energiekrise'
https://www.zeit.de/news/2023-11/09/vermeintlicher-gasaustritt-sorgt-fuer-landebahn-sperrung,https://www.zeit.de/news/2023-11/09/vermeintlicher-gasaustritt-sorgt-fuer-landebahn-sperrung,0,www.zeit.de,Flughafen Frankfurt: Vermeintlicher Gasaustritt sorgt für Landebahn-Sperrung,Hier finden Sie Informationen zu dem Thema „Flughafen Frankfurt“. Lesen Sie jetzt „Vermeintlicher Gasaustritt sorgt für Landebahn-Sperrung“.,https://img.zeit.de/news/2023-11/09/vermeintlicher-gasaustritt-sorgt-fuer-landebahn-sperrung-image-group/wide__1300x731,2023-11-09T07:10:58Z,,Ein vermeintlicher Gasaustritt hat am Frankfurter Flughafen für eine zwischenzeitliche Verkehrsbeeinträchtigung gesorgt. Zeugen hatten der Polizei am Mittwochabend angebliche Geräusche eines Gasaustr… [+410 chars],,de,'Gasaustritt'
