index,url,valid,domain,title,description,image,published,archive,content,quote,language,keyword
https://www.faz.net/aktuell/rhein-main/wirtschaft/mainova-suewag-und-co-senken-strompreise-teuer-bleibt-es-trotzdem-accg-200387682.html,https://www.faz.net/aktuell/rhein-main/wirtschaft/mainova-suewag-und-co-senken-strompreise-teuer-bleibt-es-trotzdem-accg-200387682.html,0,www.faz.net,"Steuerzahler übernehmen: Strompreise sinken, aber die Kosten bleiben","Bei vielen Versorgern sind mit Jahresbeginn die Strompreise gesunken. Das dürfte die Kundschaft freuen, auch wenn sie die steigenden Kosten für die Energieversorgung nun auf andere Weise schultern.",https://media0.faz.net/image/w1200h627/de4b6e4924a0/w9314h4866x0y1157o/202601/e3bdc9c2-3204-4e39-832e-6239e7e3a4e7/infrastruktur-die-kostet.webp,2026-02-01T08:51:00Z,,Kurz vor Jahresende hatte auch der in Frankfurt ansässige Energieversorger Süwag gute Nachrichten zu verkünden: Man werde die Strompreise senken. Damit folgt das zum Eon-Konzern gehörende Unternehmen… [+3999 chars],,de,'Gas Ukraine'
https://www.n-tv.de/wirtschaft/Reiche-wischt-Bedenken-ueber-Gasvorraete-weg-id30311495.html,https://www.n-tv.de/wirtschaft/Reiche-wischt-Bedenken-ueber-Gasvorraete-weg-id30311495.html,0,www.n-tv.de,"""Sorgen sind nicht angebracht"": Reiche wischt Bedenken über Gasvorräte weg","Der Füllstand der deutschen Gasspeicher liegt bei weniger als 35 Prozent. Grund zur Sorge? Nicht in der Bundesregierung: Wirtschaftsministerin Reiche ist überzeugt, dass Deutschland gut durch den Winter kommt.",https://www.n-tv.de/img/30311531/1769952102/Img_16_9/1200/Katherina-Reiche-CDU-Bundesministerin-fuer-Wirtschaft-und-Energie-reist-mit-einer-Wirtschaftsdelegation-nach-Saudi-Arabien-Hier-bei-einem-Pressestatement-nach-dem-Saudi-German-Business-Council-01-02.jpg,2026-02-01T12:49:33Z,,"""Sorgen sind nicht angebracht""Reiche wischt Bedenken über Gasvorräte weg 
Katherina Reiche ist überzeugt: Die Versorgung ist abgesichert. (Foto: picture alliance / BMWE/photothek.de)
Der Füllstand … [+2645 chars]",,de,'Gas Wirtschaft'
https://www.bild.de/leben-wissen/wohnen-living/heizen-mit-eis-die-waermepumpe-macht-es-moeglich-6978e589fe9fcdf90e7cb780,https://www.bild.de/leben-wissen/wohnen-living/heizen-mit-eis-die-waermepumpe-macht-es-moeglich-6978e589fe9fcdf90e7cb780,0,www.bild.de,"Teuer, aber effizient - Heizen mit Eis – die Wärmepumpe macht es möglich",Heizen mit Eis? Die Kombination aus Eisspeicher und Wärmepumpe macht es möglich. Allerdings gibt es auch einige Nachteile.,"https://images.bild.de/6978e589fe9fcdf90e7cb780/0b68c5fabb44cd471286c4a912dd5f25-landscape,8663bc02?w=1280",2026-02-01T15:12:04Z,,"TTS-Player überspringenArtikel weiterlesenHeizen mit Eis? Was verrückt klingt, ist eine echte Alternative zur klassischen Wärmepumpe. Eine Technik, die selbst bei knackigem Frost Wärme liefert und im… [+2656 chars]",,de,'Wärmepumpe'
https://www.tagesspiegel.de/politik/die-gasmangellage-droht--schon-wieder-deutschland-bleibt-spielball-fossiler-autokraten-15209210.html,https://www.tagesspiegel.de/politik/die-gasmangellage-droht--schon-wieder-deutschland-bleibt-spielball-fossiler-autokraten-15209210.html,0,www.tagesspiegel.de,Die Gasmangellage droht – schon wieder: Deutschland bleibt Spielball fossiler Autokraten,"Erst war Europa von Russlands Gas abhängig, nun wachsen die Abhängigkeiten von den USA. Das hat nicht nur ökonomisch seinen Preis, sondern kann auch zur geopolitischen Waffe werden.",https://www.tagesspiegel.de/images/13465807/alternates/BASE_16_9_W1400/1743491447000/file-photo-illustration-shows-model-of-lng-tanker-and-the-u-s-flag.jpeg,2026-02-02T15:23:48Z,,Die Nachrichten in diesen Tagen klingen wie eine schlechte Wiederholung aus der Gaskrise von 2022/23. Deutschlands Gasspeicher entleeren sich immer mehr und sind zu nicht einmal mehr einem Drittel be… [+4324 chars],,de,'Gas Waffe'
