index,url,valid,domain,title,description,image,published,archive,content,quote,language,keyword
https://www.welt.de/wirtschaft/article256042880/Stromausfall-So-sind-die-Deutschen-auf-einen-Blackout-vorbereitet.html,https://www.welt.de/wirtschaft/article256042880/Stromausfall-So-sind-die-Deutschen-auf-einen-Blackout-vorbereitet.html,0,www.welt.de,Nach dem Mega-Blackout – So sind die Deutschen auf das Spanien-Szenario vorbereitet,"Ein Blackout wie in Spanien ist auch in Deutschland nicht völlig ausgeschlossen. Wie gut die Deutschen darauf vorbereitet wären, zeigt jetzt eine Verivox-Umfrage. Auch nach dem Vertrauen in die Behörden bei einem solchen Fall wurde gefragt.",https://img.welt.de/img/wirtschaft/mobile256043440/0217939797-ci16x9-w1200/Mass-Electrical-Outage-Spain.jpg,2025-05-01T07:31:08Z,https://web.archive.org/web/20250506155430/https://www.welt.de/wirtschaft/article256042880/Stromausfall-So-sind-die-Deutschen-auf-einen-Blackout-vorbereitet.html,"Ein Blackout wie in Spanien ist auch in Deutschland nicht völlig ausgeschlossen. Wie gut die Deutschen darauf vorbereitet wären, zeigt jetzt eine Verivox-Umfrage. Auch nach dem Vertrauen in die Behör… [+4128 chars]",,de,'Blackout'
https://www.stern.de/gesellschaft/regional/mecklenburg-vorpommern/tag-der-arbeit--hunderte-demonstrieren-in-mv-fuer-eine-gerechte-arbeitswelt-35684838.html,https://www.stern.de/gesellschaft/regional/mecklenburg-vorpommern/tag-der-arbeit--hunderte-demonstrieren-in-mv-fuer-eine-gerechte-arbeitswelt-35684838.html,0,www.stern.de,Tag der Arbeit: Hunderte demonstrieren in MV für eine gerechte Arbeitswelt,"Es geht um Tarifbindung, Energiepreise, Investitionen und den Schutz sozialer Errungenschaften: Hunderte Menschen setzten sich am Tag der Arbeit in MV für eine gerechte Arbeitswelt ein.",https://image.stern.de/35684840/t/DP/v1/w1440/r1.7778/-/01--57kkshlbbtv11axs2048jpeg---4e6a9e8bd397e573.jpg,2025-05-01T11:23:57Z,https://web.archive.org/web/20250501122502/https://www.stern.de/gesellschaft/regional/mecklenburg-vorpommern/tag-der-arbeit--hunderte-demonstrieren-in-mv-fuer-eine-gerechte-arbeitswelt-35684838.html,"Kopiere den aktuellen Link
Zur Merkliste hinzufügen
Es geht um Tarifbindung, Energiepreise, Investitionen und den Schutz sozialer Errungenschaften: Hunderte Menschen setzten sich am Tag der Arbeit … [+2098 chars]",,de,'Energiepreise'
https://orf.at/stories/3392244/,https://orf.at/stories/3392244/,0,orf.at,Energiepreise im März gesunken: Strom bleibt teuer,,https://orf.at/mojo/1_4_1/storyserver//news/common/images/og-fallback-news.png,2025-05-02T04:05:28Z,https://web.archive.org/web/20250502131937/https://orf.at/stories/3392244/,"Die Energiepreise für Haushalte sind im März 2025 erneut gesunken. Im Vergleich zum Februar verbilligte sich Haushaltsenergie laut Energiepreisindex (EPI) der Österreichischen Energieagentur um 1,5 P… [+1066 chars]",,de,'Energiepreise'
https://www.tagesschau.de/wirtschaft/verbraucher/gasspeicher-erdgas-energiebranche-100.html,https://www.tagesschau.de/wirtschaft/verbraucher/gasspeicher-erdgas-energiebranche-100.html,0,www.tagesschau.de,"Erdgas: Teures Gas, leere Speicher","Die Gasspeicher sind so leer wie selten. Staatliche Auflagen schreiben vor, dass die Speicher im Sommer wieder befüllt werden. Doch ausgerechnet dann ist Erdgas inzwischen besonders teuer. Von Ingo Nathusius.",https://images.tagesschau.de/image/02090288-7cb9-4290-a09a-9527fec758c6/AAABld-Y7YQ/AAABkZLhkrw/16x9-1280/gas-172.jpg,2025-05-02T07:13:45Z,https://web.archive.org/web/20250502074140/https://www.tagesschau.de/wirtschaft/verbraucher/gasspeicher-erdgas-energiebranche-100.html,"Stand: 02.05.2025 09:13 Uhr
Die Gasspeicher sind so leer wie selten. Staatliche Auflagen schreiben vor, dass die Speicher im Sommer wieder befüllt werden. Doch ausgerechnet dann ist Erdgas inzwische… [+5058 chars]",,de,'Gasverbrauch Industrie'
https://www.morgenpost.de/wirtschaft/article408881136/heizoelpreise-aktuell-heute-2-mai-2025-was-kostet-oel-heizung-heizen.html,https://www.morgenpost.de/wirtschaft/article408881136/heizoelpreise-aktuell-heute-2-mai-2025-was-kostet-oel-heizung-heizen.html,0,www.morgenpost.de,Heizölpreise am Freitag (2. Mai): Das kostet ein Liter heute,"Der Mai hat begonnen, die Heizperiode ist endgültig vorbei. Führt das zu sinkenden Heizölpreisen? Der aktuelle Überblick von heute (2. Mai).",https://img.sparknews.funkemedien.de/406640396/406640396_1719216868_v16_9_1600.jpeg,2025-05-02T07:23:02Z,,"Berlin. Der Mai hat begonnen, die Heizperiode ist endgültig vorbei. Führt das zu sinkenden Heizölpreisen? Der aktuelle Überblick von heute (2. Mai).
Wer mit Heizöl heizt, blickt auch Anfang Mai noch… [+7388 chars]",,de,'Heizperiode'
https://www.faz.net/aktuell/finanzen/inflation-im-euroraum-verharrt-bei-2-2-prozent-110450527.html,https://www.faz.net/aktuell/finanzen/inflation-im-euroraum-verharrt-bei-2-2-prozent-110450527.html,0,www.faz.net,"Inflation im Euroraum verharrt bei 2,2 Prozent",Je nach Euroland fällt die Teuerung etwas unterschiedlich aus. In Frankreich ist sie deutlich niedriger als in Deutschland. Was heißt die Entwicklung für die weitere Zinspolitik der EZB?,https://media0.faz.net/ppmedia/aktuell/finanzen/4139731226/1.10450528/facebook_teaser/ezb.jpg,2025-05-02T09:02:12Z,https://web.archive.org/web/20250503024222/https://www.faz.net/aktuell/finanzen/inflation-im-euroraum-verharrt-bei-2-2-prozent-110450527.html,"Die Inflation im Euroraum lag im April wie im März bei 2,2 Prozent. Das hat das europäische Statistikamt Eurostat in Luxemburg am Freitag aufgrund einer ersten Schätzung mitgeteilt.
Insbesondere die… [+4640 chars]",,de,'Energiepreise'
https://www.welt.de/regionales/hamburg/article256024476/Wasserstoff-Die-Nachfrage-nach-mehr-Anschluessen-wird-kommen.html,https://www.welt.de/regionales/hamburg/article256024476/Wasserstoff-Die-Nachfrage-nach-mehr-Anschluessen-wird-kommen.html,0,www.welt.de,„Die Nachfrage nach mehr Anschlüssen wird kommen“,"Das städtische Unternehmen Hamburger Energienetze baut ein Wasserstoffnetz für die Hansestadt auf – ohne einschätzen zu können, wie viele Unternehmen zu welchem Zeitpunkt daran angeschlossen werden können. Zugleich bleibt das Erdgasnetz wohl in den kommenden …",https://img.welt.de/img/regionales/hamburg/mobile256024734/5997939077-ci16x9-w1200/Gasnetz-Hamburg-GmbH-Gabriele-Eggers.jpg,2025-05-02T09:31:00Z,https://web.archive.org/web/20250503083420/https://www.welt.de/regionales/hamburg/article256024476/Wasserstoff-Die-Nachfrage-nach-mehr-Anschluessen-wird-kommen.html,"Das städtische Unternehmen Hamburger Energienetze baut ein Wasserstoffnetz für die Hansestadt auf ohne einschätzen zu können, wie viele Unternehmen zu welchem Zeitpunkt daran angeschlossen werden kön… [+10985 chars]",,de,'Energiepolitik'
https://www.tagesschau.de/wirtschaft/verbraucher/inflation-eurozone-april-100.html,https://www.tagesschau.de/wirtschaft/verbraucher/inflation-eurozone-april-100.html,0,www.tagesschau.de,"Inflation in Eurozone verharrt bei 2,2 Prozent",Im April sind die Verbraucherpreise in der Eurozone im Schnitt nach ersten Zahlen gleich geblieben. Besonders deutlich zogen die Preise bei Dienstleistungen wie Essengehen oder dem Friseurbesuch an.,https://images.tagesschau.de/image/4a36c2b8-ca57-4b70-af70-74aba5a4a5cf/AAABlpD2QWg/AAABkZLhkrw/16x9-1280/frisoer-112.jpg,2025-05-02T13:18:54Z,https://web.archive.org/web/20250502134753/https://www.tagesschau.de/wirtschaft/verbraucher/inflation-eurozone-april-100.html,"Stand: 02.05.2025 15:18 Uhr
Im April sind die Verbraucherpreise in der Eurozone im Schnitt nach ersten Zahlen gleich geblieben. Besonders deutlich zogen die Preise bei Dienstleistungen wie Essengehe… [+3492 chars]",,de,'Energiepreise'
https://taz.de/Debatte-um-Risikotechnologie/!6085510/,https://taz.de/Debatte-um-Risikotechnologie/!6085510/,0,taz.de,Debatte um Risikotechnologie: Dänemarks Opposition will Atomkraft-Verbot kippen,Auch Teile der Regierung zeigen sich dafür offen. Die Energiebehörde sagt aber: Das Land schafft die Energiewende auch ohne AKW.,https://taz.de/picture/7677440/1200/38212966-1.jpeg,2025-05-02T17:55:00Z,https://web.archive.org/web/20250503211931/https://taz.de/Debatte-um-Risikotechnologie/!6085510/,Auch Teile der Regierung zeigen sich dafür offen. Die Energiebehörde sagt aber: Das Land schafft die Energiewende auch ohne AKW. mehr...,,de,'Akw'
https://wien.orf.at/stories/3303746/,https://wien.orf.at/stories/3303746/,0,wien.orf.at,Fernwärmeausbau in Pioniergebiet startet,"In Mariahilf hat der Ausbau der Fernwärme begonnen. Es ist ein der vier „Raus aus Gas“-Pioniergebiete der Stadt. Ziel ist es, Gebäude von Gasheizungen auf klimafreundlichere Fernwärme umzustellen.",https://ibs.orf.at/wie?image=https%3A%2F%2Foekastatic.orf.at%2Fmims%2F2024%2F30%2F29%2Fcrops%2Fw%3D1200%2Ch%3D627%2Cq%3D75%2F2292618_master_872829_dsc_5217.jpg%3Fs%3D87f07def355bfff56649e0792c0839dcadd9edce,2025-05-03T04:00:00Z,,"Im Pioniergebiet entlang der Gumpendorfer Straße wird die Fernwärme flächendeckend ausgebaut. Die Wien Energie geht dabei in Vorleistung, wurde in einer Aussendung des Unternehmens betont. Es sollen … [+1451 chars]",,de,'Gasheizung'
https://www.tagesschau.de/ausland/asien/taiwan-atomausstieg-100.html,https://www.tagesschau.de/ausland/asien/taiwan-atomausstieg-100.html,0,www.tagesschau.de,Wie riskant ist Taiwans Atomausstieg angesichts Chinas Bedrohung?,In Taiwan geht das letzte Atomkraftwerk vom Netz. Die Regierung setzt damit ein Wahlversprechen um. Doch China droht mit einer Blockade. Kann sich Taiwan den Atomausstieg noch leisten? Von Ulrich Mendgen.,https://images.tagesschau.de/image/d175bc2d-52cf-49ab-b3c9-7d643663a5ad/AAABlpEvZaE/AAABkZLhkrw/16x9-1280/akw-kueste-taiwan-100.jpg,2025-05-04T03:25:44Z,https://web.archive.org/web/20250504060836/https://www.tagesschau.de/ausland/asien/taiwan-atomausstieg-100.html,"Stand: 04.05.2025 05:25 Uhr
In Taiwan geht das letzte Atomkraftwerk vom Netz. Die Regierung setzt damit ein Wahlversprechen um. Doch China droht mit einer Blockade. Kann sich Taiwan den Atomausstieg… [+5006 chars]",,de,'Gas Industrie'
https://www.telepolis.de/features/Bitcoin-Mining-Steigende-Kosten-fressen-Gewinne-auf-10370823.html,https://www.telepolis.de/features/Bitcoin-Mining-Steigende-Kosten-fressen-Gewinne-auf-10370823.html,0,www.telepolis.de,Bitcoin-Mining: Steigende Kosten fressen Gewinne auf,"Trotz Rekordpreisen für Bitcoin kämpfen die Miner ums Überleben. Zölle, Energiekosten und harter Wettbewerb machen das Schürfen der Kryptowährung immer teurer.",https://heise.cloudimg.io/bound/1200x1200/q85.png-lossy-85.webp-lossy-85.foil1/_www-heise-de_/imgs/18/4/8/4/7/3/0/5/shutterstock_2179657495-8c723245a2b44bbf.jpeg,2025-05-04T10:30:00Z,https://web.archive.org/web/20250504110542/https://www.telepolis.de/features/Bitcoin-Mining-Steigende-Kosten-fressen-Gewinne-auf-10370823.html,"(Bild: PalSand / Shutterstock.com)
Trotz Rekordpreisen für Bitcoin kämpfen die Miner ums Überleben. Zölle, Energiekosten und harter Wettbewerb machen das Schürfen der Kryptowährung immer teurer.
Es… [+4158 chars]",,de,'Energiekosten'
https://www.n-tv.de/politik/12-16-EU-will-Gas-Importe-aus-Russland-verbieten--article23143824.html,https://www.n-tv.de/politik/12-16-EU-will-Gas-Importe-aus-Russland-verbieten--article23143824.html,0,www.n-tv.de,Ukraine-Krieg im Liveticker: +++ 12:16 EU will Gas-Importe aus Russland verbieten +++,Lesen Sie alle aktuellen Entwicklungen und Nachrichten über den russischen Angriffskrieg auf die Ukraine im Liveticker von ntv.de.,https://www.n-tv.de/img/incoming/crop25117070/4231326595-cImg_16_9-w1200/Ukraine-Liveticker.jpg,2025-05-04T22:02:00Z,https://web.archive.org/web/20250505105114/https://www.n-tv.de/politik/12-16-EU-will-Gas-Importe-aus-Russland-verbieten--article23143824.html,"Die Europäische Union möchte laut einem Medienbericht Maßnahmen vorschlagen, die den Import von russischem Gas ab Ende 2027 verbieten. Wie die Finanznachrichtenagentur Bloomberg berichtet, sind die G… [+13871 chars]",,de,'Gas Import'
https://www.stern.de/wirtschaft/news/energie-import--umweltverbaende--kein-fluessigerdgas-mehr-aus-russland-kaufen-35693158.html,https://www.stern.de/wirtschaft/news/energie-import--umweltverbaende--kein-fluessigerdgas-mehr-aus-russland-kaufen-35693158.html,0,www.stern.de,Energie-Import: Umweltverbände: Kein Flüssigerdgas mehr aus Russland kaufen,"Noch immer kommt russisches Erdgas - verflüssigt und auf Tanker gepumpt - in erheblicher Menge nach Europa. Umweltverbände verlangen vom künftigen Kanzler Friedrich Merz, dies zu unterbinden.",https://image.stern.de/35693160/t/OO/v1/w1440/r1.7778/-/05--vruqe6txd6v3axs2048jpeg---4e270446395d470f.jpg,2025-05-05T02:00:49Z,https://web.archive.org/web/20250505063650/https://www.stern.de/wirtschaft/news/energie-import--umweltverbaende--kein-fluessigerdgas-mehr-aus-russland-kaufen-35693158.html,"Kopiere den aktuellen Link
Zur Merkliste hinzufügen
Noch immer kommt russisches Erdgas - verflüssigt und auf Tanker gepumpt - in erheblicher Menge nach Europa. Umweltverbände verlangen vom künftige… [+2341 chars]",,de,'Erdgas Russland'
https://www.nzz.ch/schweiz/die-stadtwerke-sind-unzufrieden-mit-albert-roestis-energiepolitik-man-kann-uns-nicht-alles-aufbuerden-ld.1882041,https://www.nzz.ch/schweiz/die-stadtwerke-sind-unzufrieden-mit-albert-roestis-energiepolitik-man-kann-uns-nicht-alles-aufbuerden-ld.1882041,0,www.nzz.ch,Die Stadtwerke sind unzufrieden mit Albert Röstis Energiepolitik: «Man kann uns nicht alles aufbürden»,"Der Bundesrat engagiere sich zu wenig beim Ausbau der erneuerbaren Energien, kritisiert Ronny Kaufmann, Chef des Stadtwerke-Netzwerks Swisspower. Auch die Aufhebung des AKW-Verbots ergebe keinen Sinn.","https://img.nzz.ch/2025/04/30/3951c664-7481-4703-a92d-2a4c6bcbb188.jpeg?width=1200&height=674&fit=bounds&quality=75&auto=webp&crop=1618,910,x153,y136&wmark=nzz",2025-05-05T03:30:00Z,https://web.archive.org/web/20250505054109/https://www.nzz.ch/schweiz/die-stadtwerke-sind-unzufrieden-mit-albert-roestis-energiepolitik-man-kann-uns-nicht-alles-aufbuerden-ld.1882041,"«Die Schweizer Städte werden keine Kernkraftwerke mehr bauen»: Ronny Kaufmann, CEO von Swisspower.
Herr Kaufmann, Bundesrat Albert Rösti will, dass in der Schweiz wieder Kernkraftwerke gebaut werden… [+7290 chars]",,de,'AKW'
https://www.morgenpost.de/wirtschaft/article408935772/heizoelpreise-aktuell-heute-5-mai-2025-was-kostet-oel-heizung-heizen.html,https://www.morgenpost.de/wirtschaft/article408935772/heizoelpreise-aktuell-heute-5-mai-2025-was-kostet-oel-heizung-heizen.html,0,www.morgenpost.de,Heizölpreise am Montag (5. Mai): Das kostet ein Liter heute,Die neue Woche beginnt mit Regen und Kälte. Was bedeutet der Wetterumschwung für die Heizölpreise? Der aktuelle Überblick vom 5. Mai.,https://img.sparknews.funkemedien.de/406858447/406858447_1724138717_v16_9_1600.jpeg,2025-05-05T07:21:21Z,,"Berlin. Die neue Woche beginnt mit Regen und Kälte. Was bedeutet der Wetterumschwung für die Heizölpreise? Der aktuelle Überblick vom 5. Mai.
Vergangene Woche wurde Deutschland noch von Frühlingswet… [+7393 chars]",,de,'Heizkosten'
https://www.sueddeutsche.de/wirtschaft/eu-stopp-gasimporte-russland-li.3247468,https://www.sueddeutsche.de/wirtschaft/eu-stopp-gasimporte-russland-li.3247468,0,www.sueddeutsche.de,Energie: EU will verbliebene Gasimporte aus Russland stoppen,Die EU wird einen Plan zur Beendigung der Gasimporte aus Russland vorstellen. Rund 19 Prozent des Gasbedarfs der EU stammen weiterhin aus Russland.,https://www.sueddeutsche.de/2025/01/01/71ad5859-b044-4b04-a1b2-8d134af782a2.jpeg?q=60&fm=webp&width=1200&rect=469%2C0%2C2062%2C1160,2025-05-05T13:25:00Z,,"Die Europäische Union will am Dienstag einen Plan vorlegen, wie die noch verbliebenen Gasimporte aus Russland beendet werden können. Nach früheren Angaben aus EU-Kreisen wird geprüft, wie europäische… [+2088 chars]",,de,'Flüssiggas'
https://taz.de/Umweltverbaende-fordern-Ansage-von-Merz/!6083530/,https://taz.de/Umweltverbaende-fordern-Ansage-von-Merz/!6083530/,0,taz.de,Umweltverbände fordern Ansage von Merz: Kein Flüssiggas aus Russland mehr,"Der deutsche Staatskonzern Sefe importiert LNG aus Russland. Umweltorganisationen fordern, dass der neue Kanzler Friedrich Merz etwas dagegen unternimmt.",https://taz.de/picture/7682833/1200/35617646-1.jpeg,2025-05-05T14:52:00Z,,"Der deutsche Staatskonzern Sefe importiert LNG aus Russland. Umweltorganisationen fordern, dass der neue Kanzler Friedrich Merz etwas dagegen unternimmt. mehr...",,de,'Flüssiggas'
https://www.jungewelt.de/artikel/499417.sanktionen-gegen-russland-eu-plant-gasembargo-gegen-russland.html,https://www.jungewelt.de/artikel/499417.sanktionen-gegen-russland-eu-plant-gasembargo-gegen-russland.html,0,www.jungewelt.de,Sanktionen gegen Russland: EU plant Gasembargo gegen Russland,Die EU-Kommission will einem Bericht zufolge einen Entwurf zum vollständigen Gasimportstopp vorlegen. DUH und ukrainische Organisationen unterstützen das mit einem Protestbrief.,https://www.jungewelt.de/img/1100/208449.jpg,2025-05-05T17:37:40Z,https://web.archive.org/web/20250505180526/https://www.jungewelt.de/artikel/499417.sanktionen-gegen-russland-eu-plant-gasembargo-gegen-russland.html,"Die EU verschärft den Ton gegen Russland und will Gasimporte von dort bis zum Jahr 2027 vollständig verbieten. Die EU-Kommission werde an diesem Dienstag einen entsprechenden Entwurf vorstellen, beri… [+1828 chars]",,de,'Gasembargo'
https://www.n-tv.de/politik/10-49-Insider-EU-schlaegt-Verbot-russischer-Gasimporte-bis-Ende-2027-vor--article23143824.html,https://www.n-tv.de/politik/10-49-Insider-EU-schlaegt-Verbot-russischer-Gasimporte-bis-Ende-2027-vor--article23143824.html,0,www.n-tv.de,Ukraine-Krieg im Liveticker: +++ 10:49 Insider: EU schlägt Verbot russischer Gasimporte bis Ende 2027 vor +++,Lesen Sie alle aktuellen Entwicklungen und Nachrichten über den russischen Angriffskrieg auf die Ukraine im Liveticker von ntv.de.,https://www.n-tv.de/img/incoming/crop25117070/4231326595-cImg_16_9-w1200/Ukraine-Liveticker.jpg,2025-05-05T22:02:00Z,,Die Europäische Union will Insidern zufolge neue Gas-Verträge mit Russland bis zum Jahresende verbieten und bestehende Verträge bis Ende 2027 auslaufen lassen. Entsprechende Verträge der EU-Kommissio… [+12334 chars],,de,'Flüssiggas'
https://www.faz.net/aktuell/wirtschaft/trumps-us-zoelle-im-liveticker-schweizer-anleiherendite-ist-negativ-franken-stark-zum-dollar-faz-110405237.html,https://www.faz.net/aktuell/wirtschaft/trumps-us-zoelle-im-liveticker-schweizer-anleiherendite-ist-negativ-franken-stark-zum-dollar-faz-110405237.html,0,www.faz.net,Liveblog Trump-Zölle: Schweizer Anleiherendite ist negativ – Franken stark zum Dollar,"Trump über Fed-Chef Powell: Wissen Sie, er mag mich einfach nicht +++ Stimmung in deutscher Autobranche noch schlechter +++ Opec fördert mehr Öl +++ EU bietet an, mehr Flüssiggas und Sojabohnen zu kaufen +++ alle Neuigkeiten im Liveblog",https://media0.faz.net/ppmedia/aktuell/finanzen/2702339210/1.6450546/facebook_teaser/die-schweiz-ist-gefragt.jpg,2025-05-06T07:25:41Z,,"Der vorgeschlagene Haushalt wird auch Kürzungen im Wert von über 160 Milliarden Dollar in den Bereichen Umwelt, erneuerbare Energien, Bildung und Auslandshilfe beinhalten, wie das Wall Street Journal… [+2005 chars]",,de,'Flüssiggas'
https://www.morgenpost.de/wirtschaft/article408935772/heizoelpreise-aktuell-heute-6-mai-2025-was-kostet-oel-heizung-heizen.html,https://www.morgenpost.de/wirtschaft/article408935772/heizoelpreise-aktuell-heute-6-mai-2025-was-kostet-oel-heizung-heizen.html,0,www.morgenpost.de,Heizölpreise heute (6. Mai): Der aktuelle Preis pro Liter,Nach mildem Start in den Mai wird’s wieder kühler – lohnt sich Heizöl jetzt? Alle Infos zu den Preisen am 6. Mai im aktuellen Überblick.,https://img.sparknews.funkemedien.de/406640396/406640396_1719216868_v16_9_1600.jpeg,2025-05-06T07:59:16Z,,"Berlin. Nach sonnigem Start in den Mai ziehen nun Wolken auf. Wie wirkt sich das auf die Heizölpreise aus? Der aktuelle Überblick vom 6. Mai.
Der Mai zeigt sich zum Wochenstart von seiner kühlen Sei… [+7787 chars]",,de,'Heizkosten'
https://www.stern.de/gesellschaft/regional/mecklenburg-vorpommern/statistik--inflationsrate-in-mv-im-april-gesunken-35698596.html,https://www.stern.de/gesellschaft/regional/mecklenburg-vorpommern/statistik--inflationsrate-in-mv-im-april-gesunken-35698596.html,0,www.stern.de,Statistik: Inflationsrate in MV im April gesunken,"Die Preise sind seit April 2024 im Schnitt um 1,7 Prozent im Nordosten gestiegen. Lebensmittel verteuerten sich dabei deutlich, die Energiepreise sanken hingegen.",https://image.stern.de/35698598/t/ar/v1/w1440/r1.7778/-/06--piam4kr5srv9axs2048jpeg---ed8a5f0284892bbd.jpg,2025-05-06T12:22:54Z,https://web.archive.org/web/20250506142246/https://www.stern.de/gesellschaft/regional/mecklenburg-vorpommern/statistik--inflationsrate-in-mv-im-april-gesunken-35698596.html,"Kopiere den aktuellen Link
Zur Merkliste hinzufügen
Die Preise sind seit April 2024 im Schnitt um 1,7 Prozent im Nordosten gestiegen. Lebensmittel verteuerten sich dabei deutlich, die Energiepreise… [+1220 chars]",,de,'Inflation'
https://www.n-tv.de/newsletter/breakingnews/EU-Kommission-will-Verbot-fuer-alle-russischen-Gasimporte-article25749612.html,https://www.n-tv.de/newsletter/breakingnews/EU-Kommission-will-Verbot-fuer-alle-russischen-Gasimporte-article25749612.html,0,www.n-tv.de,Bis Ende 2027: EU-Kommission will Verbot für alle russischen Gasimporte,"Die EU-Kommission will die Einfuhr von russischem Gas in die Europäische Union bis Ende 2027 vollständig verbieten. Die Kommission setzt darauf, russische Gaslieferungen durch Flüssiggas von anderen Handelspartnern zu ersetzen. das soll in zwei Stufen erfolge…",https://www.n-tv.de/img/incoming/crop25749603/2541321710-cImg_16_9-w1200/Wie-genau-die-Kommission-die-Importe-verbieten-will-teilte-sie-zunachst-nicht-mit.jpg,2025-05-06T13:39:39Z,,Die EU-Kommission will Gaslieferungen aus Russland in den kommenden Jahren vollständig verbieten. Dafür will die Kommission nach eigenen Angaben zwei Stufen vorschlagen: Zum Ende des laufenden Jahres… [+1964 chars],,de,'Flüssiggas'
https://www.zeit.de/politik/2025-05/russland-eu-kommission-gaslieferungen-ukraine,https://www.zeit.de/politik/2025-05/russland-eu-kommission-gaslieferungen-ukraine,0,www.zeit.de,Russland: EU-Kommission will Gaslieferungen aus Russland vollständig verbieten,Ab 2027 soll kein russisches Gas mehr in die EU kommen. Die EU-Kommission will Lieferungen schrittweise verbieten.,https://img.zeit.de/politik/deutschland/2025-05/russland-eu-kommission-gaslieferungen/wide__1300x731,2025-05-06T13:44:17Z,http://archive.md/20250506142016/https://www.zeit.de/politik/2025-05/russland-eu-kommission-gaslieferungen-ukraine,"Die EU-Kommission will Gaslieferungen
 aus Russland in den kommenden Jahren vollständig verbieten. Dafür will 
die Kommission nach eigenen Angaben zwei Stufen 
vorschlagen: Zum Ende des laufenden … [+2385 chars]",,de,'Russland Gas'
https://www.stern.de/news/eu-kommission-will-gaslieferungen-aus-russland-ab-2027-verbieten-35698982.html,https://www.stern.de/news/eu-kommission-will-gaslieferungen-aus-russland-ab-2027-verbieten-35698982.html,0,www.stern.de,EU-Kommission will Gaslieferungen aus Russland ab 2027 verbieten,Die EU-Kommission will Gaslieferungen aus Russland in den kommenden Jahren vollständig verbieten. Dafür will die Kommission nach eigenen Angaben vom Dienstag zwei Stufen vorschlagen: Zum Ende des laufenden Jahres will die Behörde kurzfristige Gaskäufe am soge…,https://image.stern.de/35698984/t/PB/v1/w1440/r1.7778/-/06--eukommissionschefin-von-der-leyen-am-29-april---a99270cff4338e0d.jpg,2025-05-06T13:49:48Z,,"Kopiere den aktuellen Link
Zur Merkliste hinzufügen
Die EU-Kommission will Gaslieferungen aus Russland in den kommenden Jahren vollständig verbieten. Dafür will die Kommission nach eigenen Angaben … [+2033 chars]",,de,'Flüssiggas'
https://www.bild.de/politik/ausland-und-internationales/eu-kommission-will-verbot-fuer-alle-russischen-gasimporte-ab-2027-681a113d22bab50320e6c769,https://www.bild.de/politik/ausland-und-internationales/eu-kommission-will-verbot-fuer-alle-russischen-gasimporte-ab-2027-681a113d22bab50320e6c769,0,www.bild.de,Ab 2027 - EU-Kommission will Verbot für russische Gasimporte,Klare Ansage aus Brüssel: Die EU-Kommission will Gaslieferungen aus Russland in den kommenden Jahren vollständig verbieten.,"https://images.bild.de/681a113d22bab50320e6c769/fc4940c32d83bb7be0787745cf54977e,d4e7df5b?w=1280",2025-05-06T14:11:34Z,http://archive.md/20250506161300/https://www.bild.de/politik/ausland-und-internationales/eu-kommission-will-verbot-fuer-alle-russischen-gasimporte-ab-2027-681a113d22bab50320e6c769,"Klare Ansage aus Brüssel: Die EU-Kommission will Gaslieferungen aus Russland in den kommenden Jahren vollständig verbieten. 
Dafür will die Kommission nach eigenen Angaben vom Dienstag zwei Stufen v… [+1768 chars]",,de,'Flüssiggas'
