index,url,valid,domain,title,description,image,published,archive,content,quote,language,keyword
https://www.tagesspiegel.de/wirtschaft/luftverkehr-machen-selbstfahrende-schneepfluge-den-flughafen-sicherer-13818727.html,https://www.tagesspiegel.de/wirtschaft/luftverkehr-machen-selbstfahrende-schneepfluge-den-flughafen-sicherer-13818727.html,0,www.tagesspiegel.de,Luftverkehr: Machen selbstfahrende Schneepflüge den Flughafen sicherer?,Wintereinbruch am Flughafen - bei Passagieren sind dann oft Geduld und Nerven gefragt. Künftig könnten Robo-Schneepflüge für freie Start- und Landebahnen sorgen. Doch nicht alle sind davon überzeugt.,https://www.tagesspiegel.de/images/13818724/alternates/BASE_16_9_W1400/1749261731000/winterdienstfahrzeuge-mit-autonomen-fahrfunktionen-am-flughafen.jpeg,2025-06-07T02:02:12Z,,"Winterdienst mitten im Sommer? Was die Flughäfen Stuttgart und Berlin schon vor einigen Jahren im Winter getestet haben, erprobt der Airport Leipzig/Halle nun erneut Ende Juni. Wie zuverlässig können… [+4907 chars]",,de,'Wintereinbruch'
https://www.stern.de/sport/fussball/finnlands-nationaltrainerin-nominiert-51-jaehrige-ex-spielerin-35791252.html,https://www.stern.de/sport/fussball/finnlands-nationaltrainerin-nominiert-51-jaehrige-ex-spielerin-35791252.html,0,www.stern.de,Aus Versehen: Finnische Nationaltrainerin nominiert Ex-Spielerin – die ist 51 Jahre alt,Fehler passieren: Finnlands Fußball-Nationaltrainerin muss bei der Nominierung ihres Teams einen Blackout gehabt haben. Sie verwechselte einen Vornamen.,https://image.stern.de/35791290/t/Eh/v3/w1440/r1.7778/-/finnland-frauen-nationalelf.jpg,2025-06-07T13:58:00Z,,"Kopiere den aktuellen Link
Zur Merkliste hinzufügen
Fehler passieren: Finnlands Fußball-Nationaltrainerin muss bei der Nominierung ihres Teams einen Blackout gehabt haben. Sie verwechselte einen Vo… [+1575 chars]",,de,'Blackout'
https://www.zeit.de/news/2025-06/09/lies-zur-energiewende-menschen-im-norden-nicht-ueberlasten,https://www.zeit.de/news/2025-06/09/lies-zur-energiewende-menschen-im-norden-nicht-ueberlasten,0,www.zeit.de,Erneuerbare Energien: Lies zur Energiewende: Menschen im Norden nicht überlasten,Hier finden Sie Informationen zu dem Thema „Erneuerbare Energien“. Lesen Sie jetzt „Lies zur Energiewende: Menschen im Norden nicht überlasten“.,https://img.zeit.de/news/2025-06/09/lies-zur-energiewende-menschen-im-norden-nicht-ueberlasten-image-group/wide__1300x731,2025-06-09T03:30:44Z,,Der Ausbau erneuerbarer Energien darf für Niedersachsens Ministerpräsident Olaf Lies nicht zu einer Überlastung der Menschen in Norddeutschland führen. «Der Anfang vieler Formen von erneuerbarer Ener… [+2666 chars],,de,'LNG'
https://www.stern.de/gesellschaft/regional/hamburg-schleswig-holstein/erneuerbare-energien--lies-zur-energiewende--menschen-im-norden-nicht-ueberlasten-35793500.html,https://www.stern.de/gesellschaft/regional/hamburg-schleswig-holstein/erneuerbare-energien--lies-zur-energiewende--menschen-im-norden-nicht-ueberlasten-35793500.html,0,www.stern.de,Erneuerbare Energien: Lies zur Energiewende: Menschen im Norden nicht überlasten,Energiewende ja – aber mit Maß: Niedersachsens neuer Regierungschef sieht Norddeutschland bei der Energieversorgung in einer besonderen Verantwortung. Doch es gebe auch Grenzen.,https://image.stern.de/35793502/t/Z4/v1/w1440/r1.7778/-/09--d3d5eig4awv13axs2048jpeg---9f6a1c70e84523dd.jpg,2025-06-09T03:30:44Z,,"Kopiere den aktuellen Link
Zur Merkliste hinzufügen
Energiewende ja aber mit Maß: Niedersachsens neuer Regierungschef sieht Norddeutschland bei der Energieversorgung in einer besonderen Verantwortu… [+2574 chars]",,de,'LNG'
https://kaernten.orf.at/stories/3308768/,https://kaernten.orf.at/stories/3308768/,0,kaernten.orf.at,Zecken in immer höheren Lagen,"Auch das Jahr 2025 ist wieder ein Jahr, in dem sehr viele Zecken unterwegs sind. Die milden Winter verlängern die Saison enorm. Die Spinnentiere sind Überträger etlicher schwerer Krankheiten und sie kommen mittlerweile auch in Höhenlagen um die 1.200 Meter vo…",https://ibs.orf.at/ktn?image=https%3A%2F%2Foekastatic.orf.at%2Fmims%2F2024%2F23%2F44%2Fcrops%2Fw%3D1200%2Ch%3D627%2Cq%3D75%2F2227719_master_845744_zecke.jpg%3Fs%3D5cdb1193f22972d540675c1084e79a7e02fca9ae,2025-06-09T05:48:31Z,,"Mit Krankheitserregern infizierte Zecken waren früher eher in den Niederungen zu finden. Das änderte sich mit dem Klimawandel, heute seien Zecken bis in hohe Lagen zu finden, sagte Zoologe Christian … [+2138 chars]",,de,'milden Winter'
https://www.sueddeutsche.de/politik/deutschland-abhaengigkeit-oel-gas-susanne-goetze-annika-joeres-die-milliarden-lobby-rezension-li.3262599,https://www.sueddeutsche.de/politik/deutschland-abhaengigkeit-oel-gas-susanne-goetze-annika-joeres-die-milliarden-lobby-rezension-li.3262599,0,www.sueddeutsche.de,Buch über die Energieversorgung: Die Profiteure von Öl und Gas,"Deutschland zahlt Jahr für Jahr Milliarden für den Import fossiler Brennstoffe. Und die Energiewende? Die Journalistinnen Susanne Götze und Annika Joeres sind in ihrem neuen Buch „Die Milliarden-Lobby“ auf der Spur von Geld, Macht und Einfluss.",https://www.sueddeutsche.de/2025/06/05/2c087192-6ce8-459f-b79f-5b484fd2b7b8.jpeg?q=60&fm=webp&width=1200&rect=0%2C183%2C3500%2C1969,2025-06-09T12:08:38Z,,"Götze und Joeres stellen die Frage in Erinnerung an die Energiekrise nach dem Angriff Russlands auf die Ukraine. Mehr als die Hälfte des Erdgases hatte Deutschland vorher aus Russland bezogen, Präsid… [+4638 chars]",,de,'Energiewende Gas'
https://www.nzz.ch/wirtschaft/ich-faende-es-gut-wenn-in-der-schweiz-wieder-atomkraftwerke-gebaut-werden-duerften-sagt-der-wichtigste-energieexperte-der-welt-ld.1885743,https://www.nzz.ch/wirtschaft/ich-faende-es-gut-wenn-in-der-schweiz-wieder-atomkraftwerke-gebaut-werden-duerften-sagt-der-wichtigste-energieexperte-der-welt-ld.1885743,0,www.nzz.ch,"INTERVIEW - «Ich fände es gut, wenn in der Schweiz wieder Atomkraftwerke gebaut werden dürften», sagt der wichtigste Energieexperte der Welt","Fatih Birol, Chef der Internationalen Energieagentur, ist besorgt um die Stromversorgung in Europa. Ein Gespräch über den Blackout in Spanien, die Herausforderungen von Solarstrom – und die Abkehr von der Kernkraft, die Birol einen historischen Fehler nennt.","https://img.nzz.ch/2025/06/06/fa009019-b0aa-4e58-9aca-35fd7586ec25.jpeg?width=1200&height=675&fit=bounds&quality=75&auto=webp&crop=3200,1800,x0,y505&wmark=nzz",2025-06-10T03:30:00Z,,"Fatih Birol sagt: «Sobald der Anteil von Solar- und Windenergie über etwa 50 Prozent steigt, wird die Versorgungssicherheit zur Herausforderung.»
Herr Birol, wann haben Sie persönlich letztmals eine… [+8670 chars]",,de,'Energieagentur'
https://www.faz.net/aktuell/wirtschaft/cyberangriffe-auf-solaranlagen-droht-europas-stromnetz-ein-blackout-110520793.html,https://www.faz.net/aktuell/wirtschaft/cyberangriffe-auf-solaranlagen-droht-europas-stromnetz-ein-blackout-110520793.html,0,www.faz.net,Cybergefahr für den Sonnenstrom,Solaranlagen müssen besser vor Hackerangriffen geschützt werden. Sonst droht schlimmstenfalls ein Blackout im Stromnetz.,https://media1.faz.net/ppmedia/aktuell/wirtschaft/866792429/1.10521965/facebook_teaser_fplus/einfamilienhaus-mit.jpg,2025-06-10T08:06:15Z,,"Es klingt nach düsterem Science-Fiction: Wie von Geisterhand koppeln sich Millionen von Solaranlagen auf Europas Hausdächern gleichzeitig vom Stromnetz ab, viele Gigawatt an Stromerzeugung fallen sch… [+127 chars]",,de,'Blackout'
https://www.zeit.de/news/2025-06/10/inflation-in-thueringen-verharrt-bei-1-6-prozent,https://www.zeit.de/news/2025-06/10/inflation-in-thueringen-verharrt-bei-1-6-prozent,0,www.zeit.de,"Verbraucherpreise: Inflation in Thüringen verharrt bei 1,6 Prozent","Hier finden Sie Informationen zu dem Thema „Verbraucherpreise“. Lesen Sie jetzt „Inflation in Thüringen verharrt bei 1,6 Prozent“.",https://img.zeit.de/news/2025-06/10/inflation-in-thueringen-verharrt-bei-1-6-prozent-image-group/wide__1300x731,2025-06-10T09:41:57Z,,"Die Inflation in Thüringen hat sich im Mai kaum verändert. Laut dem Landesamt für Statistik lag die Jahresteuerungsrate wie im April bei 1,6 Prozent. Verbraucher mussten im Jahresvergleich vor allem … [+1487 chars]",,de,'Heizöl'
https://www.stern.de/gesellschaft/regional/thueringen/verbraucherpreise--inflation-in-thueringen-verharrt-bei-1-6-prozent-35796182.html,https://www.stern.de/gesellschaft/regional/thueringen/verbraucherpreise--inflation-in-thueringen-verharrt-bei-1-6-prozent-35796182.html,0,www.stern.de,"Verbraucherpreise: Inflation in Thüringen verharrt bei 1,6 Prozent","Lebensmittel werden immer teurer, dafür gibt es Entlastung bei den Energiepreisen: Im Mai müssen die Verbraucher daher im Schnitt nicht unter übermäßigen Preissprüngen leiden.",https://image.stern.de/35796184/t/3O/v1/w1440/r1.7778/-/10--4laxjvt6twv8axs2048jpeg---1cd8f4150f632f08.jpg,2025-06-10T09:41:57Z,,"Kopiere den aktuellen Link
Zur Merkliste hinzufügen
Lebensmittel werden immer teurer, dafür gibt es Entlastung bei den Energiepreisen: Im Mai müssen die Verbraucher daher im Schnitt nicht unter übe… [+1678 chars]",,de,'Energiepreise'
https://www.businessinsider.de/gruenderszene/technologie/proxima-fusion-mit-fusionsenergie-geschichte-schreiben-francesco-sciortino-ceo/,https://www.businessinsider.de/gruenderszene/technologie/proxima-fusion-mit-fusionsenergie-geschichte-schreiben-francesco-sciortino-ceo/,0,www.businessinsider.de,„Wir wollen Geschichte schreiben“: Sein Startup könnte die Energiekrise beenden,"Das Münchener Startup Proxima Fusion hat das Zeug dazu, die Welt zu verändern. Im Interview erklärt Francesco Sciortino, wieso.",https://cdn.businessinsider.de/wp-content/uploads/2025/03/202503_GS_Artikel_ProximaFusion_1800x1200-1.jpg?ver=1742310965,2025-06-11T09:26:03Z,,"Seit etwa einem Jahrhundert denkt die Menschheit über Kernfusion nach. Energie zu erzeugen, wie es die Sonne oder die Sterne es tun, hätte viele Vorteile: Kernfusion könnte uns quasi unbegrenzt Energ… [+2158 chars]",,de,'Energiekrise'
https://www.stern.de/gesellschaft/regional/berlin-brandenburg/energieversorgung--leag-befuerchtet-bevorzugung-des-suedens-bei-gaskraftwerken-35803982.html,https://www.stern.de/gesellschaft/regional/berlin-brandenburg/energieversorgung--leag-befuerchtet-bevorzugung-des-suedens-bei-gaskraftwerken-35803982.html,0,www.stern.de,Energieversorgung: Leag befürchtet Bevorzugung des Südens bei Gaskraftwerken,Protest bei der Leag: Der Betriebsrat befürchtet eine Bevorzugung des Südens bei neuen Gaskraftwerken. Auf die Bundeswirtschaftsministerin sind Beschäftigte derzeit nicht gut zu sprechen.,https://image.stern.de/35803984/t/Qi/v1/w1440/r1.7778/-/12--hadveipz6fv11axs2048jpeg---7249affebbb436dc.jpg,2025-06-12T14:57:44Z,,"Kopiere den aktuellen Link
Zur Merkliste hinzufügen
Protest bei der Leag: Der Betriebsrat befürchtet eine Bevorzugung des Südens bei neuen Gaskraftwerken. Auf die Bundeswirtschaftsministerin sind B… [+3040 chars]",,de,'Blackout'
https://www.tagesspiegel.de/berlin/energieversorgung-leag-befurchtet-bevorzugung-des-sudens-bei-gaskraftwerken-13844488.html,https://www.tagesspiegel.de/berlin/energieversorgung-leag-befurchtet-bevorzugung-des-sudens-bei-gaskraftwerken-13844488.html,0,www.tagesspiegel.de,Energieversorgung: Leag befürchtet Bevorzugung des Südens bei Gaskraftwerken,Protest bei der Leag: Der Betriebsrat befürchtet eine Bevorzugung des Südens bei neuen Gaskraftwerken. Auf die Bundeswirtschaftsministerin sind Beschäftigte derzeit nicht gut zu sprechen.,https://www.tagesspiegel.de/images/13844485/alternates/BASE_16_9_W1400/1749740335000/betriebsversammlung-mit-protest-beim-unternehmen-leag.jpeg,2025-06-12T14:58:55Z,,Mehr als 1.000 Beschäftigte des Energiekonzerns Leag haben gegen eine befürchtete Benachteiligung beim Bau neuer Gaskraftwerke protestiert. Aussagen von Bundeswirtschaftsministerin Katherina Reiche (… [+3544 chars],,de,'Energieversorgung'
https://www.n-tv.de/ratgeber/Spart-Energie-und-Geld-Heizung-auf-Sommerbetrieb-stellen-article25830008.html,https://www.n-tv.de/ratgeber/Spart-Energie-und-Geld-Heizung-auf-Sommerbetrieb-stellen-article25830008.html,0,www.n-tv.de,Unnötigen Verbrauch vermeiden: Spart Energie und Geld: Heizung auf Sommerbetrieb stellen,"Die Raumheizung ist im Sommer nicht nötig, doch das Warmwasser möge bitte fließen: Das geht im Sommerbetrieb. Wann und wie Eigentümer ihre Heizung am besten umstellen, und wie viel sie dadurch sparen.",https://www.n-tv.de/img/incoming/crop24141255/1681325564-cImg_16_9-w1200/Moderne-Heizungen-konnen-sich-teils-selbst-regulieren.jpg,2025-06-12T17:02:46Z,,"Die Raumheizung ist im Sommer nicht nötig, doch das Warmwasser möge bitte fließen: Das geht im Sommerbetrieb. Wann und wie Eigentümer ihre Heizung am besten umstellen, und wie viel sie dadurch sparen… [+2462 chars]",,de,'Energie sparen'
https://www.stern.de/politik/eu-bezieht-russisches-gas-in-milliardenhoehe---trotz-krieg-35802722.html,https://www.stern.de/politik/eu-bezieht-russisches-gas-in-milliardenhoehe---trotz-krieg-35802722.html,0,www.stern.de,Trotz Ukraine-Krieg: Neue Zahlen: EU bezieht russisches Gas in Milliardenhöhe – trotz Krieg,Trotz Sanktionen bezieht die EU weiterhin flüssiges Gas aus Russland. Das geht aus neuen Eurostat-Zahlen hervor. Nun fordert eine Politikerin ein Importverbot.,https://image.stern.de/35804278/t/aE/v1/w1440/r1.7778/-/russisches-gas-an-die-eu-2.jpg,2025-06-12T22:01:00Z,,"Kopiere den aktuellen Link
Zur Merkliste hinzufügen
Trotz Sanktionen bezieht die EU weiterhin flüssiges Erdgas aus Russland. Das geht aus neuen Eurostat-Zahlen hervor. Nun fordert eine Politikerin … [+2255 chars]",,de,'russisches Gas'
https://www.n-tv.de/sport/Alexander-Zverev-leistet-sich-kuriosen-Blackout-article25831218.html,https://www.n-tv.de/sport/Alexander-Zverev-leistet-sich-kuriosen-Blackout-article25831218.html,0,www.n-tv.de,Gegner einfach vergessen: Alexander Zverev leistet sich kuriosen Blackout,Alexander Zverev hat gegen seinen Stuttgarter Viertelfinal-Gegner Brandon Nakashima bislang eine makellose Bilanz - weiß aber nichts mehr davon. Oder doch? Die Journalisten helfen ihm auf die Sprünge. Zverev reagiert cool auf den kleinen Blackout.,https://www.n-tv.de/img/incoming/crop25831216/0871327772-cImg_16_9-w1200/d9008e86764a66cce02243429a080ace.jpg,2025-06-13T04:09:08Z,,Alexander Zverev hat gegen seinen Stuttgarter Viertelfinal-Gegner Brandon Nakashima bislang eine makellose Bilanz - weiß aber nichts mehr davon. Oder doch? Die Journalisten helfen ihm auf die Sprünge… [+1995 chars],,de,'Blackout'
https://www.stern.de/news/inflationsrate-im-mai-stabil-bei-2-1-prozent-35805188.html,https://www.stern.de/news/inflationsrate-im-mai-stabil-bei-2-1-prozent-35805188.html,0,www.stern.de,"Inflationsrate im Mai stabil bei 2,1 Prozent","Die Verbraucherpreise in Deutschland sind wie in den Vormonaten auch im Mai nur mäßig gestiegen. Die Inflationsrate lag im vergangenen Monat bei 2,1 Prozent im Vorjahresvergleich, wie das Statistische Bundesamt in Wiesbaden am Freitag mitteilte und damit vorl…",https://image.stern.de/35805190/t/Kt/v1/w1440/r1.7778/-/13--tankstelle---fcffcf475e8ae64d.jpg,2025-06-13T07:09:58Z,,"Kopiere den aktuellen Link
Zur Merkliste hinzufügen
Die Verbraucherpreise in Deutschland sind wie in den Vormonaten auch im Mai nur mäßig gestiegen. Die Inflationsrate lag im vergangenen Monat bei … [+2281 chars]",,de,'Heizöl'
https://www.sueddeutsche.de/politik/ukraine-krieg-newsblog-russland-gas-eu-li.3266188,https://www.sueddeutsche.de/politik/ukraine-krieg-newsblog-russland-gas-eu-li.3266188,0,www.sueddeutsche.de,Krieg in der Ukraine: EU importiert russisches Flüssiggas in Milliardenhöhe,Seit Beginn des Krieges haben die EU-Staaten knapp 33 Milliarden Euro für russisches LNG bezahlt und damit Russlands Kriegskasse unterstützt. Das sorgt für Kritik.,https://www.sueddeutsche.de/2025/06/13/e663e929-f828-4e29-bcbe-6e268ac22d8f.jpeg?q=60&fm=webp&width=1200&rect=0%2C209%2C4000%2C2250,2025-06-13T07:17:00Z,,"Vor Beginn des Angriffskriegs gegen die Ukraine war Russland ein wichtiger Handelspartner für Deutschland. Das hat sich stark verändert: Im vergangenen Jahr hat Deutschland 94,6 Prozent weniger Waren… [+1396 chars]",,de,'Flüssiggas'
https://scilogs.spektrum.de/natur-des-glaubens/israel-iran-die-solare-energiewende-als-kommunale-friedenspolitik-danke-filderstadt/,https://scilogs.spektrum.de/natur-des-glaubens/israel-iran-die-solare-energiewende-als-kommunale-friedenspolitik-danke-filderstadt/,0,scilogs.spektrum.de,"Israel, Iran. Die solare Energiewende als kommunale Friedenspolitik. Danke, Filderstadt!","Bestimmt können die meisten nachvollziehen, wie es sich anfühlt, schon 2019 ausdrücklich & mit Bild vor der fossilen Finanzierung der Ressourcenfluch – Tyranneien Russland, Iran und Katar gewarnt zu haben. Und dann den auch wirtschaftlichen und militärischen …",https://scilogs.spektrum.de/natur-des-glaubens/files/MichaelBlumeGoldenesBuchFilderstadtChristophTraubNikolausBack102022.jpg,2025-06-13T11:14:09Z,,"Bestimmt können die meisten nachvollziehen, wie es sich anfühlt, schon 2019 ausdrücklich &amp; mit Bild vor der fossilen Finanzierung der Ressourcenfluch – Tyranneien Russland, Iran und Katar gewarnt… [+4395 chars]",,de,'Gas Ukraine'
https://www.faz.net/aktuell/wirtschaft/oelpreise-durch-israels-angriff-auf-iran-gestiegen-was-dadurch-droht-110535171.html,https://www.faz.net/aktuell/wirtschaft/oelpreise-durch-israels-angriff-auf-iran-gestiegen-was-dadurch-droht-110535171.html,0,www.faz.net,Angriff auf Iran: Was durch einen höheren Ölpreis droht,"Israels Angriff auf Iran schürt Sorgen über die Ölversorgung. Bleibt der Preis so hoch, treibt das die Inflation und erschwert den zarten Wirtschaftsaufschwung.",https://media1.faz.net/ppmedia/aktuell/3778733697/1.10535403/facebook_teaser/oelraffinerie-abadan-im.jpg,2025-06-13T13:06:40Z,,"Der Ölpreis ist am Freitag nach den israelischen Angriffen auf Iran deutlich gestiegen. Die Nordseesorte Brent verteuerte sich um knapp zwölf Prozent auf zeitweise 77,46 Dollar je Barrel (Fass zu 159… [+5606 chars]",,de,'Heizöl'
https://www.zeit.de/news/2025-06/14/mehr-zecken-nach-mildem-winter,https://www.zeit.de/news/2025-06/14/mehr-zecken-nach-mildem-winter,0,www.zeit.de,Gesundheit: Mehr Zecken nach mildem Winter?,Hier finden Sie Informationen zu dem Thema „Gesundheit“. Lesen Sie jetzt „Mehr Zecken nach mildem Winter?“.,https://img.zeit.de/news/2025-06/14/mehr-zecken-nach-mildem-winter-image-group/wide__1300x731,2025-06-14T02:13:38Z,,"In diesem Jahr sind mancherorts besonders viele Zecken in Bayern unterwegs. «Diese hohen Zahlen erklären sich durch den milden Winter, in dem viele Zecken wohl gut überleben konnten und jetzt im Früh… [+3542 chars]",,de,'mildem Winter'
https://www.stern.de/gesellschaft/regional/bayern/gesundheit--mehr-zecken-nach-mildem-winter--35807904.html,https://www.stern.de/gesellschaft/regional/bayern/gesundheit--mehr-zecken-nach-mildem-winter--35807904.html,0,www.stern.de,Gesundheit: Mehr Zecken nach mildem Winter?,"Im Garten, beim Waldspaziergang und sogar bei Rock im Park - eine Zecke hat man sich schnell gefangen. Sind es in diesem Jahr mehr? Und breiten sich neue Arten in Bayern aus?",https://image.stern.de/35807906/t/PQ/v1/w1440/r1.7778/-/14--i33y4sjfpjv3axs2048jpeg---3a8cbc9580aa51e8.jpg,2025-06-14T02:13:38Z,,"Kopiere den aktuellen Link
Zur Merkliste hinzufügen
Im Garten, beim Waldspaziergang und sogar bei Rock im Park - eine Zecke hat man sich schnell gefangen. Sind es in diesem Jahr mehr? Und breiten s… [+3842 chars]",,de,'mildem Winter'
https://www.faz.net/aktuell/wirtschaft/basf-vorstandsmitglied-scharpwinkel-niedrige-energiepreise-sind-kein-allheilmittel-110535142.html,https://www.faz.net/aktuell/wirtschaft/basf-vorstandsmitglied-scharpwinkel-niedrige-energiepreise-sind-kein-allheilmittel-110535142.html,0,www.faz.net,BASF: „Niedrige Energiepreise sind kein Allheilmittel“,"Das riesige Stammwerk des Chemiekonzerns BASF macht seit drei Jahren Verlust. Katja Scharpwinkel will es mit einem Sparprogramm wieder auf Kurs bringen. Ein Gespräch über russisches Gas, chinesisches Wachstum und einen legendären Weinkeller.",https://media1.faz.net/ppmedia/aktuell/wirtschaft/1389336753/1.10132037/facebook_teaser_fplus/basf-gelaende-in-ludwigshafen.jpg,2025-06-14T09:04:11Z,,"Zugang zu allen FAZ+ Beiträgen12,80 
 jetzt nur 0,99 
Zugang zu allen FAZ+ Beiträgen12,80 
 jetzt nur 0,99 
<ul><li>Mit einem Klick online kündbar</li></ul>",,de,'BASF Gas'
https://www.telepolis.de/features/Warum-20-GW-Gaskraftwerke-fuer-Deutschland-zu-teuer-sind-10440181.html,https://www.telepolis.de/features/Warum-20-GW-Gaskraftwerke-fuer-Deutschland-zu-teuer-sind-10440181.html,0,www.telepolis.de,Warum 20 GW Gaskraftwerke für Deutschland zu teuer sind,Wenn die Antworten von gestern nicht zu den Fragen von morgen passen und warum zusätzliche fossile Kraftwerke die Stromversorgung hierzulande nicht retten.,https://heise.cloudimg.io/bound/1200x1200/q85.png-lossy-85.webp-lossy-85.foil1/_www-heise-de_/imgs/18/4/8/7/3/4/2/2/Energie-Retro-2_21-8c56ae61ad92f065.jpeg,2025-06-14T10:00:00Z,,"Bild Katherina Reiche: Juergen Nowak / Shutterstock.com / Grafik: TP
Wenn die Antworten von gestern nicht zu den Fragen von morgen passen und warum zusätzliche fossile Kraftwerke die Stromversorgung… [+5762 chars]",,de,'Gas Industrie'
https://www.stern.de/news/portal-verivox--heizoelpreise-in-deutschland-steigen-nach-israels-angriff-auf-iran-35809792.html,https://www.stern.de/news/portal-verivox--heizoelpreise-in-deutschland-steigen-nach-israels-angriff-auf-iran-35809792.html,0,www.stern.de,Portal Verivox: Heizölpreise in Deutschland steigen nach Israels Angriff auf Iran,"Nach dem Angriff Israels auf den Iran sind die Heizölpreise in Deutschland gestiegen. 100 Liter Heizöl kosten im Schnitt derzeit rund 93 Euro, wie aus einer Analyse des Vergleichsportals Verivox hervorgeht, aus der die Funke-Zeitungen am Sonntag zitierten. Im…",https://image.stern.de/35809794/t/rt/v1/w1440/r1.7778/-/15--heizkoerper---903dda6c297c8a58.jpg,2025-06-15T08:45:16Z,,"Kopiere den aktuellen Link
Zur Merkliste hinzufügen
Nach dem Angriff Israels auf den Iran sind die Heizölpreise in Deutschland gestiegen. 100 Liter Heizöl kosten im Schnitt derzeit rund 93 Euro, wi… [+1402 chars]",,de,'Heizöl'
https://www.sueddeutsche.de/bayern/zecken-bayern-anstieg-borreliose-li.3269292,https://www.sueddeutsche.de/bayern/zecken-bayern-anstieg-borreliose-li.3269292,0,www.sueddeutsche.de,FSME-Risiko in Bayern: Viele Zecken nach mildem Winter unterwegs – mehr Borreliose-Fälle,"Durch den Klimawandel kommen auch Zecken-Arten nach Deutschland, die teils tödlich verlaufende Krankheiten wie das Krim-Kongo-Fieber übertragen können.",https://www.sueddeutsche.de/2025/06/15/c748b54f-8a32-4d17-8db4-0f1620ac4ce7.jpeg?q=60&fm=webp&width=1200&rect=0%2C209%2C4000%2C2250,2025-06-15T08:59:56Z,,"Aber auch in anderen Regionen, unter anderem dem Allgäu, Baden-Württemberg und Sachsen, seien viele Zecken beobachtet worden, sagte Dobler. Ähnlich erlebten es auch die Besucherinnen und Besucher bei… [+3085 chars]",,de,'mildem Winter'
https://www.tagesspiegel.de/politik/sprit-und-heizol-sind-teurer-geworden-so-gefahrdet-der-krieg-zwischen-israel-und-iran-die-deutsche-wirtschaft-13858165.html,https://www.tagesspiegel.de/politik/sprit-und-heizol-sind-teurer-geworden-so-gefahrdet-der-krieg-zwischen-israel-und-iran-die-deutsche-wirtschaft-13858165.html,0,www.tagesspiegel.de,Sprit und Heizöl sind teurer geworden: So gefährdet der Krieg zwischen Israel und Iran die deutsche Wirtschaft,Der neue Krieg im Nahen Osten macht schon jetzt Tanken und Heizen in Deutschland teurer. Bei einer weiteren Eskalation könnte auch die Konjunktur einbrechen und Jobs verloren gehen.,https://www.tagesspiegel.de/images/13860016/alternates/BASE_16_9_W1400/1750054320000/topshot-iran-israel-conflict.jpeg,2025-06-15T15:04:21Z,,"Nach Israels Angriff auf das Atomprogramm des Landes hat ein iranischer Brigadegeneral mit der Schließung der Straße von Hormus gedroht. Es sind Aussagen, die an den Märkten sofort Sorgen auslösten. … [+6565 chars]",,de,'Heizöl'
https://www.stern.de/wirtschaft/news/steigende-preise--krieg-im-nahen-osten---eu-will-mit-usa-energiemarkt-sichern-35811178.html,https://www.stern.de/wirtschaft/news/steigende-preise--krieg-im-nahen-osten---eu-will-mit-usa-energiemarkt-sichern-35811178.html,0,www.stern.de,Steigende Preise: Krieg im Nahen Osten - EU will mit USA Energiemarkt sichern,Seit dem Angriff Israels auf den Iran steigen die Rohölpreise und in der Folge die Sprit- und Heizölpreise. Die EU und die USA sind alarmiert - und wollen notfalls handeln.,https://image.stern.de/35811180/t/-M/v1/w1440/r1.7778/-/16--db7fejrhnuv15axs2048jpeg---c47083c8d192e59b.jpg,2025-06-16T04:51:06Z,,"Kopiere den aktuellen Link
Zur Merkliste hinzufügen
Seit dem Angriff Israels auf den Iran steigen die Rohölpreise und in der Folge die Sprit- und Heizölpreise. Die EU und die USA sind alarmiert - u… [+1607 chars]",,de,'Energiepreise'
