index,url,valid,domain,title,description,image,published,archive,content,quote,language,keyword
https://www.stern.de/gesellschaft/regional/hessen/flughafen-frankfurt--vermeintlicher-gasaustritt-sorgt-fuer-landebahn-sperrung-33983162.html,https://www.stern.de/gesellschaft/regional/hessen/flughafen-frankfurt--vermeintlicher-gasaustritt-sorgt-fuer-landebahn-sperrung-33983162.html,0,www.stern.de,Flughafen Frankfurt: Vermeintlicher Gasaustritt sorgt für Landebahn-Sperrung,"Ein vermeintlicher Gasaustritt hat am Frankfurter Flughafen für eine zwischenzeitliche Verkehrsbeeinträchtigung gesorgt. Zeugen hatten der Polizei am Mittwochabend angebliche Geräusche eines Gasaustritts gemeldet, sagte ein Sprecher der Polizei am Donnerstag.…",https://image.stern.de/33983164/t/sj/v1/w1440/r1.7778/-/09--urnnewsmldpacom2009010123110999880617v3w800h600l378t81r2318b1433jpeg---4a310aaf53fcf356.jpg,2023-11-09T07:10:58Z,,Ein vermeintlicher Gasaustritt hat am Frankfurter Flughafen für eine zwischenzeitliche Verkehrsbeeinträchtigung gesorgt. Zeugen hatten der Polizei am Mittwochabend angebliche Geräusche eines Gasaustr… [+915 chars],,de,'Gasaustritt'
https://www.morgenpost.de/test/article239974358/Test-2-Teures-Wasser-Deutsche-duschen-kuerzer-seltener-und-kaelter.html,https://www.morgenpost.de/test/article239974358/Test-2-Teures-Wasser-Deutsche-duschen-kuerzer-seltener-und-kaelter.html,0,www.morgenpost.de,"Energie: Test 2 Teures Wasser: Deutsche duschen kürzer, seltener und kälter",Die gestiegenen Energiepreise haben den Wasserverbrauch in Deutschland verändert. Ein Experte nennt sechs Tricks fürs Wassersparen.,https://img.morgenpost.de/img/incoming/crop239973990/426260423-w820-cv16_9-q85/405162029.jpg,2023-11-09T07:55:38Z,,"Berlin. Oft sind Dürren oder Waldbrände sichtbare Zeichen für trockene Böden und Wassermangel. Ob in Spanien, Frankreich oder Griechenland: Auch in Europa wird Trinkwasser zunehmend zum knapperen Gut… [+5501 chars]",,de,'Energiepreise'
https://www.mobiflip.de/shortnews/deutsche-post-buecher-und-warensendung-wird-teurer/,https://www.mobiflip.de/shortnews/deutsche-post-buecher-und-warensendung-wird-teurer/,0,www.mobiflip.de,Deutsche Post: Bücher- und Warensendung wird teurer,"Zwar hatte die Bundesnetzagentur den Antrag der Deutschen Post AG auf vorzeitige Erhöhung des Briefportos abgelehnt, das betrifft aber nicht die Bücher- und Warensendungen. Diese darf die Post genehmigungsfrei teurer […]",https://www.mobiflip.de/wp-content/uploads/2022/03/deutsche-post.jpg,2023-11-09T11:58:15Z,,"Zwar hatte die Bundesnetzagentur den Antrag der Deutschen Post AG auf vorzeitige Erhöhung des Briefportos abgelehnt, das betrifft aber nicht die Bücher- und Warensendungen. Diese darf die Post genehm… [+920 chars]",,de,'Bundesnetzagentur'
https://www.diepresse.com/17808039/schalten-die-usa-mit-sanktionen-nun-gezielt-einen-russischen-konkurrenten-aus,https://www.diepresse.com/17808039/schalten-die-usa-mit-sanktionen-nun-gezielt-einen-russischen-konkurrenten-aus,0,www.diepresse.com,Schalten die USA mit Sanktionen nun gezielt einen russischen Konkurrenten aus? [premium],"Gazprom ist aus Europa verdrängt. Nun wollen die USA das größte russische Flüssiggasprojekt „killen“, wie es ein Top-Beamter formulierte. Die Causa ist pikant, denn der russische Konzern dahinter, der Europa im Vorjahr mit Lieferungen aushalf, hat starke glob…",https://img.diepresse.com/public/incoming/o3as3a-888189110/alternates/DPR_SOCIAL_NACHRICHTEN_PAID/888189110,2023-11-09T14:24:48Z,,"Gazprom ist aus Europa verdrängt. Nun wollen die USA das größte russische Flüssiggasprojekt killen, wie es ein Top-Beamter formulierte. Die Causa ist pikant, denn der russische Konzern dahinter, der … [+1385 chars]",,de,'Gazprom'
https://www.golem.de/sonstiges/zustimmung/auswahl.html?from=https://www.golem.de/news/bundesnetzagentur-bundeskartellamt-will-frequenzauktion-wegen-1-1-2311-179290.html&referer=https://t.co/ac120819cd,https://www.golem.de/sonstiges/zustimmung/auswahl.html?from=https://www.golem.de/news/bundesnetzagentur-bundeskartellamt-will-frequenzauktion-wegen-1-1-2311-179290.html&referer=https://t.co/ac120819cd,0,www.golem.de,Bundesnetzagentur: Bundeskartellamt will Frequenzauktion wegen 1&1,"Das Bundeskartellamt will 1&1 über eine Frequenzauktion weitere Bereiche zukommen lassen. Telekom-Chef Höttges hält das ohne ein Netz für sinnlos. (Bundeskartellamt, Telekom)",,2023-11-09T17:39:01Z,,"Besuchen Sie Golem.de wie gewohnt mit Werbung und Tracking,
 indem Sie der Nutzung aller Cookies zustimmen.
 Details zum Tracking finden Sie im Privacy Center.
Skript wurde nicht geladen. Informat… [+607 chars]",,de,'Bundesnetzagentur'
https://www.bild.de/politik/inland/politik-inland/akw-weiterbetrieb-warum-lehnte-die-ampel-super-stromangebot-ab-86034668.bild.html,https://www.bild.de/politik/inland/politik-inland/akw-weiterbetrieb-warum-lehnte-die-ampel-super-stromangebot-ab-86034668.bild.html,0,www.bild.de,Betreiber für Weiterbetrieb - Warum lehnte die Ampel das Super-Stromangebot ab?,Was lief da wirklich zwischen den Kernkraft-Bossen und der Bundesregierung? Es ging um eine AKW-Wiederinbetriebnahme – für das Überleben der Industrie,"https://images.bild.de/654b9e3b8b205720a6d734a8/a4de623fbd03375b12af27b23e332b43,5e887e3b?w=1280",2023-11-09T19:29:26Z,,"Was lief da wirklich zwischen den Kernkraft-Bossen und der Bundesregierung?
PreussenElektra, Betreiber des bayerischen Kernkraftwerks Isar 2, wollte bis Ende Oktober eine AKW-Wiederinbetriebnahme er… [+3528 chars]",,de,'Energiekrise'
https://www.stern.de/gesellschaft/regional/sachsen-anhalt/wirtschaft--weihnachtsmarktbetreiber-freuen-sich-auf--normalen--betrieb-34186096.html,https://www.stern.de/gesellschaft/regional/sachsen-anhalt/wirtschaft--weihnachtsmarktbetreiber-freuen-sich-auf--normalen--betrieb-34186096.html,0,www.stern.de,"Wirtschaft: Weihnachtsmarktbetreiber freuen sich auf ""normalen"" Betrieb",Nach Corona-Pandemie und Energiekrise erwarten die Veranstalter von Weihnachtsmärkten die Rückkehr zur Normalität. Herausforderungen gibt es aber auch in diesem Jahr: Personalmangel und ein Streit um Musiklizenzen.,https://image.stern.de/34186098/t/CC/v1/w1440/r1.7778/-/10--urnnewsmldpacom2009010123111099893513v3w800h600l673t284r1953b1137jpeg---bb8a6503b6034143.jpg,2023-11-10T04:23:02Z,,Nach Corona-Pandemie und Energiekrise erwarten die Veranstalter von Weihnachtsmärkten die Rückkehr zur Normalität. Herausforderungen gibt es aber auch in diesem Jahr: Personalmangel und ein Streit um… [+1933 chars],,de,'Energiekrise'
https://www.morgenpost.de/berlin/article240186118/Heizkostenabrechnung-macht-vielen-Berliner-Mietern-Sorgen.html,https://www.morgenpost.de/berlin/article240186118/Heizkostenabrechnung-macht-vielen-Berliner-Mietern-Sorgen.html,0,www.morgenpost.de,Verbraucher: Heizkostenabrechnung macht vielen Berliner Mietern Sorgen,Die Energiekosten sind zuletzt etwas gesunken. Aber die Heizkostenabrechnungen für 2022 betrifft das noch nicht. Für manche Mieter kommt einiges zusammen.,https://img.morgenpost.de/img/berlin/crop240186116/5112601992-w820-cv16_9-q85/Heizung-und-Heizthermostat.jpg,2023-11-10T04:53:53Z,,Berlin (dpa/bb). Das Thema Heizkosten stellt viele Mieter in Berlin zunehmend vor Probleme. Den Trend beobachtete der Mieterverein schon im vergangenen Jahr. Er setzt sich allerdings noch deutlicher … [+1807 chars],,de,'Heizkosten'
https://www.stern.de/gesellschaft/regional/berlin-brandenburg/verbraucher--heizkostenabrechnung-macht-vielen-berliner-mietern-sorgen-34186146.html,https://www.stern.de/gesellschaft/regional/berlin-brandenburg/verbraucher--heizkostenabrechnung-macht-vielen-berliner-mietern-sorgen-34186146.html,0,www.stern.de,Verbraucher: Heizkostenabrechnung macht vielen Berliner Mietern Sorgen,Die Energiekosten sind zuletzt etwas gesunken. Aber die Heizkostenabrechnungen für 2022 betrifft das noch nicht. Für manche Mieter kommt einiges zusammen.,https://image.stern.de/34186148/t/S2/v1/w1440/r1.7778/-/10--urnnewsmldpacom2009010123111099893662v2w800h600l1028t466r3088b1837jpeg---4e362a7fb5d8d594.jpg,2023-11-10T04:53:53Z,,"Die Energiekosten sind zuletzt etwas gesunken. Aber die Heizkostenabrechnungen für 2022 betrifft das noch nicht. Für manche Mieter kommt einiges zusammen.
Das Thema Heizkosten stellt viele Mieter in… [+1967 chars]",,de,'Heizkosten'
https://www.morgenpost.de/wirtschaft/article239955518/pelletspreise-aktuell-heute-10-november-heizen-heizung.html,https://www.morgenpost.de/wirtschaft/article239955518/pelletspreise-aktuell-heute-10-november-heizen-heizung.html,0,www.morgenpost.de,Energiepreise heute: Pelletspreise aktuell (10.11.): Der Preis pro Tonne heute,"Die Heizsaison startet. ○ Sollte man Holzpellets jetzt kaufen oder abwarten? ○ Lesen Sie hier, was eine Tonne heute am 10. November kostet.",https://img.morgenpost.de/img/incoming/crop239326763/963260410-w820-cv16_9-q85/holz-pellets-heizung-heizen.jpg,2023-11-10T07:05:00Z,,"Berlin. Haushalte, die mit Pellets heizen, können seit rund fünf Monaten entspannen: Seither werden die Pelletspreise von Tag zu Tag günstiger. Allerdings könnte auch bei der nachhaltigen und günstig… [+9646 chars]",,de,'Energiepreise'
https://vorarlberg.orf.at/stories/3231881/,https://vorarlberg.orf.at/stories/3231881/,0,vorarlberg.orf.at,Kohlenmonoxid-Vergiftung: Drei Personen im Krankenhaus,In Götzis sind am Freitagmorgen drei Personen mit Verdacht auf Kohlenmonoxid-Vergiftung ins Krankenhaus gebracht worden. Grund für den Gasaustritt dürfte eine defekte Ölheizung gewesen sein. Kohlenmonoxid (CO) kann bei längerem Einatmen tödlich sein.,https://ibs.orf.at/vbg?image=https%3A%2F%2Foekastatic.orf.at%2Fmims%2F2023%2F45%2F67%2Fcrops%2Fw%3D1200%2Ch%3D627%2Cq%3D75%2F2002828_master_754567_384549235_663853629062569_8050896065256235683_n.jpg%3Fs%3Dfd46bdabbbeb91ee0512fafb86afdbae383c9d27,2023-11-10T10:06:47Z,,"Gegen 6.45 Uhr wurde über die RFL gemeldet, dass es in einem Mehrparteienwohnhaus in Götzis zu einem Gasaustritt gekommen sei. Ein im Erdgeschoss wohnhaftes Paar klagte unmittelbar nach dem Aufwachen… [+1433 chars]",,de,'Gasaustritt'
https://www.focus.de/finanzen/news/ampelplaene-guenstige-steuer-macht-ihren-strom-nicht-guenstiger-aber-auch-sie-profitieren_id_242947013.html,https://www.focus.de/finanzen/news/ampelplaene-guenstige-steuer-macht-ihren-strom-nicht-guenstiger-aber-auch-sie-profitieren_id_242947013.html,0,www.focus.de,"Ampelpläne - Günstige Steuer macht Ihren Strom nicht günstiger, aber auch Sie profitieren","Seit etwa zwei Jahren klagt die deutsche Wirtschaft über gestiegene Energiepreise. Die Industrie warnt sogar von Abwanderung der Geschäfte ins Ausland. Die Bundesregierung steuert gegen und plant nun, den Strompreis für einige Unternehmen zu senken. Doch was …",https://p6.focus.de/img/fotos/id_203139321/gettyimages-1416514919.jpg?im=Crop%3D%280%2C288%2C3464%2C1732%29%3BResize%3D%281200%2C627%29&impolicy=perceptual&quality=mediumHigh&hash=f9b3f6bc46b2e3e3789b39487e4deda2489e9075c4830aeff8944fb63a2a7530,2023-11-10T12:54:44Z,,Seit etwa zwei Jahren klagt die deutsche Wirtschaft über gestiegene Energiepreise. Die Industrie warnt sogar von Abwanderung der Geschäfte ins Ausland. Die Bundesregierung steuert gegen und plant nun… [+7643 chars],,de,'Energiepreise'
https://www.focus.de/finanzen/news/trotz-wieder-guenstigerer-gaspreis-tarife-so-viel-sparen-haushalte-die-nicht-wieder-in-alte-heizangewohnheiten-verfallen_id_243034519.html,https://www.focus.de/finanzen/news/trotz-wieder-guenstigerer-gaspreis-tarife-so-viel-sparen-haushalte-die-nicht-wieder-in-alte-heizangewohnheiten-verfallen_id_243034519.html,0,www.focus.de,"Trotz sinkender Gaspreise - Wer nicht mehr so heizt wie vor dem Ukraine-Krieg, spart Hunderte Euro","Gas ist wieder deutlich billiger als im vergangenen Winter – und auch die Versorgungssicherheit ist vorhanden. Haushalte, die aber weiter sparen wie in den vergangenen Monaten, haben hunderte Euro mehr auf dem Konto.",https://p6.focus.de/img/finanzen/news/id_243069137/im-niedersaechsischen-elsfleth-wird-gas-gespeichert..jpg?im=Crop%3D%280%2C170%2C2048%2C1024%29%3BResize%3D%281200%2C627%29&impolicy=perceptual&quality=mediumHigh&hash=40c9be9469fbec9a3dacbba36f6237b82157971f2462839dd8a0a6086343cdea,2023-11-10T15:02:04Z,,"<ul><li>
Kommentare</li><li>
E-Mail</li><li>
Teilen</li><li>
Mehr</li><li>
Twitter</li><li>
Drucken</li><li>
Feedback</li><li>
Fehler meldenSie haben einen Fehler gefunden?
Bitte markieren S… [+4204 chars]",,de,'Gas Ukraine'
https://www.zeit.de/news/2023-11/11/experte-erneuerbare-energien-lassen-strompreise-sinken,https://www.zeit.de/news/2023-11/11/experte-erneuerbare-energien-lassen-strompreise-sinken,0,www.zeit.de,Energiewende: Experte: Erneuerbare Energien lassen Strompreise sinken,Hier finden Sie Informationen zu dem Thema „Energiewende“. Lesen Sie jetzt „Experte: Erneuerbare Energien lassen Strompreise sinken“.,https://img.zeit.de/news/2023-11/11/experte-erneuerbare-energien-lassen-strompreise-sinken-image-group/wide__1300x731,2023-11-11T06:31:59Z,https://web.archive.org/web/20231112024833/https://www.zeit.de/news/2023-11/11/experte-erneuerbare-energien-lassen-strompreise-sinken,"Erneuerbare Energien werden die Strompreise nach Experteneinschätzung zunehmend dämpfen. «Je mehr erneuerbare Energie-Anlagen mit ihren günstigen Preisen im Stromsystem sind, desto seltener bestimmen… [+3621 chars]",,de,'Energiekrise'
https://www.zeit.de/news/2023-11/11/landrat-kerth-geht-vom-bau-des-lng-terminals-auf-ruegen-aus,https://www.zeit.de/news/2023-11/11/landrat-kerth-geht-vom-bau-des-lng-terminals-auf-ruegen-aus,0,www.zeit.de,Energie: Landrat Kerth geht vom Bau des LNG-Terminals auf Rügen aus,Hier finden Sie Informationen zu dem Thema „Energie“. Lesen Sie jetzt „Landrat Kerth geht vom Bau des LNG-Terminals auf Rügen aus“.,https://img.zeit.de/news/2023-11/11/landrat-kerth-geht-vom-bau-des-lng-terminals-auf-ruegen-aus-image-group/wide__1300x731,2023-11-11T09:53:36Z,,"Der Landrat des Kreises Vorpommern-Rügen, Stefan Kerth (parteilos), rechnet damit, dass das umstrittene Terminal für Flüssigerdgas (LNG) auf der Insel Rügen gebaut wird. «Die Messe ist gesungen», sag… [+1795 chars]",,de,'LNG-Terminal'
https://orf.at/stories/3339524/,https://orf.at/stories/3339524/,0,orf.at,Ukraine droht mit Angriffen auf russischen Öl- und Gas-Sektor,,https://orf.at/mojo/1_4_1/storyserver//news/common/images/og-fallback-news.png,2023-11-11T20:49:22Z,,"Die Ukraine hat mit Vergeltungsschlägen auf den russischen Öl- und Gassektor gedroht, wenn der Aggressor im Winter wieder gezielte Angriffe auf die ukrainische Energieinfrastruktur durchführen sollte… [+1370 chars]",,de,'Erdgas Russland'
https://www.n-tv.de/politik/17-21-Bericht-USA-versuchen-russische-Ambitionen-als-LNG-Exporteur-zu-torpedieren--article23143824.html,https://www.n-tv.de/politik/17-21-Bericht-USA-versuchen-russische-Ambitionen-als-LNG-Exporteur-zu-torpedieren--article23143824.html,0,www.n-tv.de,"Ukraine-Krieg im Liveticker: +++ 17:21 Bericht: USA versuchen russische Ambitionen, als LNG-Exporteur zu torpedieren+++",Lesen Sie alle aktuellen Entwicklungen und Nachrichten über den russischen Angriffskrieg auf die Ukraine im Liveticker von ntv.de.,https://bilder2.n-tv.de/img/incoming/crop23332537/9041326157-cImg_16_9-w1200/Liveticker1-grau-1-Kopie.jpg,2023-11-11T23:16:00Z,https://web.archive.org/web/20231113053711/https://www.n-tv.de/politik/17-21-Bericht-USA-versuchen-russische-Ambitionen-als-LNG-Exporteur-zu-torpedieren--article23143824.html,"Die USA zielen laut ""Financial Times"" direkt auf die Fähigkeit Russlands ab, zum ersten Mal Flüssigerdgas (LNG) zu exportieren, was zu Störungen auf den globalen Energiemärkten führen könnte, die Was… [+20134 chars]",,de,'LNG'
https://www.telepolis.de/features/Nord-Stream-Attentat-Spur-nach-Kiew-erhaertet-sich-Berlin-schweigt-9408010.html,https://www.telepolis.de/features/Nord-Stream-Attentat-Spur-nach-Kiew-erhaertet-sich-Berlin-schweigt-9408010.html,0,www.telepolis.de,"Nord-Stream-Attentat: Spur nach Kiew erhärtet sich, Berlin schweigt",Verfahren in der Ukraine gegen Ex-Agenten. Bundesregierung und CDU halten an Moskau-These fest. Liegt das in deutschem Interesse?,https://heise.cloudimg.io/bound/1200x1200/q85.png-lossy-85.webp-lossy-85.foil1/_www-heise-de_/imgs/18/4/3/7/9/8/0/0/nord-spreng-2_ho-44c8a6d420e3fa6b.jpeg,2023-11-12T13:00:00Z,,"Verfahren in der Ukraine gegen Ex-Agenten. Bundesregierung und CDU halten an Moskau-These fest. Liegt das in deutschem Interesse?
Der ehemalige ukrainische Geheimdienstler Roman Tscherwynsky steht i… [+3450 chars]",,de,'Erdgas Russland'
https://www.teltarif.de/mobilfunk-weisse-flecken-versorgungsauflagen-bnetza-netzausbau-mobilfunkauflagen/news/93657.html,https://www.teltarif.de/mobilfunk-weisse-flecken-versorgungsauflagen-bnetza-netzausbau-mobilfunkauflagen/news/93657.html,0,www.teltarif.de,"SPD: ""Müssen die Netzbetreiber härter rannehmen""","Die Mobilfunkbetreiber haben im Zuge der 5G-Frequenzauktion Auflagen für den Ausbau ihrer Netze erhalten. Die Bundesnetzagentur (BNetzA) soll kontrollieren, ob die Auflagen eingehalten werden. Die Politik ist mit der Aufsicht der BNetzA unzufrieden und will h…",https://www.teltarif.de/img/arch/2023/kw45/231019_buglas-jahreskongress-4og.jpg,2023-11-12T13:22:00Z,,"SPD-Digitalpolitiker Jens Zimmermann ist unzufrieden mit der Aufsicht der BNetzAFoto: Marc Hankmann
„Ich bin unzu­frieden damit, wie lasch die BNetzA über­prüft, ob die Auflagen einge­halten werden“… [+2844 chars]",,de,'Bundesnetzagentur'
https://www.n-tv.de/ratgeber/Strom-sparen-Zehn-oft-vergessene-Tipps-fuer-zu-Hause-article24522377.html,https://www.n-tv.de/ratgeber/Strom-sparen-Zehn-oft-vergessene-Tipps-fuer-zu-Hause-article24522377.html,0,www.n-tv.de,Stromplan der Bundesnetzagentur: Strom sparen: Zehn oft vergessene Tipps für zu Hause,"Wir lassen das Licht nicht unnötig brennen und achten auf Energiespar-Geräte. Trotzdem verschwenden die meisten Verbraucher Strom. Experten erklären, warum - und mit wie wir das in den Griff kriegen.",https://bilder2.n-tv.de/img/incoming/crop22418217/4471324664-cImg_16_9-w1200/imago0052184833h.jpg,2023-11-12T18:13:08Z,,"Wir lassen das Licht nicht unnötig brennen und achten auf Energiespar-Geräte. Trotzdem verschwenden die meisten Verbraucher Strom. Experten erklären, warum - und mit wie wir das in den Griff kriegen.… [+6501 chars]",,de,'Energie sparen'
https://www.basicthinking.de/blog/2023/11/13/lebenshaltungskosten-new-york/,https://www.basicthinking.de/blog/2023/11/13/lebenshaltungskosten-new-york/,0,www.basicthinking.de,Wohnen und Leben: So hoch sind die Lebenshaltungskosten in New York,Die Inflation macht vielen Mensch zu schaffen. Die Energiekrise scheint sich zwar zu entspannen und die Inflationsrate sinkt allmählich. Doch vor allem die Lebensmittelpreise sind nach wie vor hoch – von den Mieten ganz zu schweigen. Aber wie hoch sind eigent…,https://www.basicthinking.de/blog/wp-content/uploads/2023/11/lebenshaltungskosten-new-york.jpg,2023-11-13T04:45:53Z,https://web.archive.org/web/20231113044634/https://www.basicthinking.de/blog/2023/11/13/lebenshaltungskosten-new-york/,Die Inflation macht vielen Mensch zu schaffen. Die Energiekrise scheint sich zwar zu entspannen und die Inflationsrate sinkt allmählich. Doch vor allem die Lebensmittelpreise sind nach wie vor hoch v… [+3458 chars],,de,'Energiekrise'
https://www.morgenpost.de/berlin/article240569480/Woidke-fordert-Plan-fuer-Stromversorgung-der-Zukunft.html,https://www.morgenpost.de/berlin/article240569480/Woidke-fordert-Plan-fuer-Stromversorgung-der-Zukunft.html,0,www.morgenpost.de,Energie: Woidke fordert Plan für Stromversorgung der Zukunft,In Sachen Energieversorgung der Zukunft sieht Brandenburgs Ministerpräsident Woidke viele Fragen unbeantwortet. Seine Forderung: Die Bundesregierung müsse rasch liefern.,https://img.morgenpost.de/img/berlin/crop240569478/1922607647-w820-cv16_9-q85/Dietmar-Woidke.jpg,2023-11-13T10:33:14Z,https://web.archive.org/web/20231114014943/https://www.morgenpost.de/berlin/article240569480/Woidke-fordert-Plan-fuer-Stromversorgung-der-Zukunft.html,"Potsdam (dpa/bb). Brandenburgs Ministerpräsident Dietmar Woidke (SPD) hat die Bundesregierung aufgefordert, rasch ein Konzept zur Stromversorgung der Zukunft vorzulegen. Zudem ist aus seiner Sicht ei… [+1770 chars]",,de,'Stromversorgung'
https://www.tagesspiegel.de/wirtschaft/mit-gas-windkraft-und-wasserstoff-aus-norwegen-deutschland-fuhrt-die-grune-transformation-in-europa-an-10770523.html,https://www.tagesspiegel.de/wirtschaft/mit-gas-windkraft-und-wasserstoff-aus-norwegen-deutschland-fuhrt-die-grune-transformation-in-europa-an-10770523.html,0,www.tagesspiegel.de,"Mit Gas, Windkraft und Wasserstoff aus Norwegen : „Deutschland führt die grüne Transformation in Europa an“","Norwegens Wirtschaftsminister Jan Christian Vestre erklärt im Interview, warum er weiter fossile Energien fördert und deutsches CO₂ importieren möchte. Wie blickt Norwegen auf Deutschland und welche Rolle spielt es für uns?",https://www.tagesspiegel.de/images/minister-habeck-und-sein-norwegischer-amtskollege/alternates/BASE_16_9_W1400/minister-habeck-und-sein-norwegischer-amtskollege.jpeg,2023-11-13T11:23:49Z,https://web.archive.org/web/20231113155651/https://www.tagesspiegel.de/wirtschaft/mit-gas-windkraft-und-wasserstoff-aus-norwegen-deutschland-fuhrt-die-grune-transformation-in-europa-an-10770523.html,"Herr Vestre, im Ranking der Länder mit den glücklichsten Menschen liegt Norwegen auf Platz sieben und damit zehn Plätze vor Deutschland. Was macht die Menschen in Norwegen glücklicher?Die Menschen au… [+11537 chars]",,de,'Gas Erneuerbare'
https://www.n-tv.de/wissen/Welche-Rolle-spielen-Batterien-fuer-den-Strom-der-Zukunft-article24527845.html,https://www.n-tv.de/wissen/Welche-Rolle-spielen-Batterien-fuer-den-Strom-der-Zukunft-article24527845.html,0,www.n-tv.de,Erneuerbare Energie speichern: Welche Rolle spielen Batterien für den Strom der Zukunft?,"Das fossile Zeitalter soll bald enden. Um die Energiewende zu schaffen, braucht es erneuerbare Energien. Nur stehen diese nicht immer so zur Verfügung, wie sie benötigt werden. Wie die Zukunft der Stromversorgung aussieht und welchen Beitrag dabei Batterien l…",https://bilder1.n-tv.de/img/incoming/crop24528080/8131327204-cImg_16_9-w1200/295358978.jpg,2023-11-13T14:40:29Z,https://web.archive.org/web/20231113152620/https://www.n-tv.de/wissen/Welche-Rolle-spielen-Batterien-fuer-den-Strom-der-Zukunft-article24527845.html,"Das fossile Zeitalter soll bald enden. Um die Energiewende zu schaffen, braucht es erneuerbare Energien. Nur stehen diese nicht immer so zur Verfügung, wie sie benötigt werden. Wie die Zukunft der St… [+6906 chars]",,de,'Stromversorgung'
https://www.zeit.de/news/2023-11/13/abgeordnete-reagieren-auf-brief-zu-lng-terminal-auf-ruegen,https://www.zeit.de/news/2023-11/13/abgeordnete-reagieren-auf-brief-zu-lng-terminal-auf-ruegen,0,www.zeit.de,Bundestag: Abgeordnete reagieren auf Brief zu LNG-Terminal auf Rügen,Hier finden Sie Informationen zu dem Thema „Bundestag“. Lesen Sie jetzt „Abgeordnete reagieren auf Brief zu LNG-Terminal auf Rügen“.,https://img.zeit.de/news/2023-11/13/abgeordnete-reagieren-auf-brief-zu-lng-terminal-auf-ruegen-image-group/wide__1300x731,2023-11-13T18:34:22Z,https://web.archive.org/web/20231114055124/https://www.zeit.de/news/2023-11/13/abgeordnete-reagieren-auf-brief-zu-lng-terminal-auf-ruegen,"Die Gegner des Terminals für Flüssigerdgas (LNG) in Mukran auf Rügen haben Unterstützung aus dem Bundestag bekommen, und zwar gleichermaßen aus den Reihen der Koalition und der Opposition. «Man sollt… [+3098 chars]",,de,'LNG'
https://www.stern.de/gesellschaft/regional/thueringen/umschichtung-verfassungswidrig--thueringen-prueft-auswirkungen-nach-haushaltsurteil-34204082.html,https://www.stern.de/gesellschaft/regional/thueringen/umschichtung-verfassungswidrig--thueringen-prueft-auswirkungen-nach-haushaltsurteil-34204082.html,0,www.stern.de,Umschichtung verfassungswidrig: Thüringen prüft Auswirkungen nach Haushaltsurteil,"Das Thüringer Finanzministerium prüft mögliche Auswirkungen eines Urteils des Bundesverfassungsgerichts zum Bundeshaushalt 2021 auf den Freistaat. ""Ob sich daraus auch Folgerungen in Bezug auf das Sondervermögen ""Thüringer Energiekrise- und Corona-Pandemie-Hi…",https://image.stern.de/34204084/t/nx/v1/w1440/r1.7778/-/16--urnnewsmldpacom2009010123111699966413v2w800h600l1785t1162r5370b3494jpeg---225f0ae2911691ca.jpg,2023-11-16T08:45:57Z,https://web.archive.org/web/20231116091838/https://www.stern.de/gesellschaft/regional/thueringen/umschichtung-verfassungswidrig--thueringen-prueft-auswirkungen-nach-haushaltsurteil-34204082.html,"Das Thüringer Finanzministerium prüft mögliche Auswirkungen eines Urteils des Bundesverfassungsgerichts zum Bundeshaushalt 2021 auf den Freistaat. ""Ob sich daraus auch Folgerungen in Bezug auf das So… [+1530 chars]",,de,'Energiekrise'
