index,url,valid,domain,title,description,image,published,archive,content,quote,language,keyword
https://www.focus.de/panorama/welt/kamin-gate-um-nord-stream-2-klimastiftung-akten-aus-panik-verbrannt-finanzbeamtin-gesteht-unter-traenen_id_259591337.html,https://www.focus.de/panorama/welt/kamin-gate-um-nord-stream-2-klimastiftung-akten-aus-panik-verbrannt-finanzbeamtin-gesteht-unter-traenen_id_259591337.html,0,www.focus.de,"„Kamin-Gate“ um Nord Stream 2 - Klimastiftung-Akten aus „Panik“ verbrannt, Finanzbeamtin gesteht unter Tränen",Warum verbrannte eine Finanzbeamtin aus Mecklenburg-Vorpommern eine Steuererklärung der politisch hochumstrittenen Klimastiftung Mecklenburg-Vorpommern? Jetzt gibt es Antworten.,https://p6.focus.de/img/politik/deutschland/id_259591336/mitglieder-des-parlamentarischen-untersuchungsausschusses-zur-stiftung-klima-und-umweltschutz-mv-im-plenarsaal-des-schweriner-landtags.-archivbild-.jpg?im=Crop%3D%280%2C131%2C2048%2C1024%29%3BResize%3D%281200%2C627%29&impolicy=perceptual&quality=mediumHigh&hash=325d28a5ad001cc265638b40fb6444893d9b104d34a315ac6adca01cc4893dde,2024-01-19T11:25:07Z,,"Der Untersuchungsausschuss des Schweriner Landtags zur Klimastiftung Mecklenburg-Vorpommern hat sich mit der als Kamin-Gate bekannten Verbrennung von Steuerunterlagen befasst.
Als Zeugin sagte die F… [+2215 chars]",,de,'Nord Stream'
https://www.iphone-ticker.de/isdt-pb50dw-drahtlose-powerbank-mit-app-konfiguration-228198/,https://www.iphone-ticker.de/isdt-pb50dw-drahtlose-powerbank-mit-app-konfiguration-228198/,0,www.iphone-ticker.de,ISDT PB50DW: Drahtlose Powerbank mit App-Konfiguration ausprobiert,"Die Energie-Experten von ISDT sind als professioneller Anbieter von Akkuladegeräten bekannt, die sich vornehmlich an Modellbauer und Hobbyisten richten, also Anwender die in Sachen Stromversorgung eher nach professionellen Lösungen Ausschau halten. Darüber hi…",https://images.iphone-ticker.de/wp-content/uploads/2024/01/isdt-PB50DW.jpg,2024-01-19T11:56:40Z,,"Die Energie-Experten von ISDT sind als professioneller Anbieter von Akkuladegeräten bekannt, die sich vornehmlich an Modellbauer und Hobbyisten richten, also Anwender die in Sachen Stromversorgung eh… [+3152 chars]",,de,'Stromversorgung'
https://kaernten.orf.at/stories/3241322/,https://kaernten.orf.at/stories/3241322/,0,kaernten.orf.at,Klagenfurt senkt Strom- und Gaspreise,"Die Energie Klagenfurt, ein Tochterunternehmen der Stadtwerke, senkt ihre Strom- und Gaspreise ab 1. April um 20 Prozent. Grund dafür sei die aktuelle Marktentwicklung mit sinkenden Einkaufspreisen. Eine weitere Senkung wird nicht ausgeschlossen.",https://ibs.orf.at/ktn?image=https%3A%2F%2Foekastatic.orf.at%2Fmojo%2F1_4_1%2Fstoryserver%2Foeka%2Fcommon%2Fimages%2Fog-fallback-ktn.png%3Fs%3Dd1ef40bef2ffd65644b4df37900c0e4d80e97249,2024-01-19T12:05:17Z,https://web.archive.org/web/20240119124902/https://kaernten.orf.at/stories/3241322/,"Wie bereits angekündigt, geben wir die sinkenden Großhandelspreise an unsere Kunden und Kundinnen weiter"", wird Erwin Smole, der Vorstand der Stadtwerke Klagenfurt, in einer Aussendung der Stadtwerke… [+962 chars]",,de,'Gaspreis'
https://www.tagesschau.de/wirtschaft/verbraucher/telefonwerbung-rueckgang-beschwerden-bundesnetzagentur-100.html,https://www.tagesschau.de/wirtschaft/verbraucher/telefonwerbung-rueckgang-beschwerden-bundesnetzagentur-100.html,0,www.tagesschau.de,Netzagentur verhängt hohe Bußgelder wegen unerlaubter Telefonwerbung,"Aufdringliche Anrufe, aggressive Gesprächsführung - die Bundesnetzagentur hat im vergangenen Jahr besonders hohe Bußgelder wegen unerlaubter Telefonwerbung verhängt. Meist ging es dabei um die Energieversorgung.",https://images.tagesschau.de/image/2513f950-1d79-485e-9443-bbe1d7b8a817/AAABhnbNwa4/AAABibBxqrQ/16x9-1280/telefon-frau-101.jpg,2024-01-19T13:07:25Z,,"Stand: 19.01.2024 14:07 Uhr
Aufdringliche Anrufe, aggressive Gesprächsführung - die Bundesnetzagentur hat im vergangenen Jahr besonders hohe Bußgelder wegen unerlaubter Telefonwerbung verhängt. Meis… [+2179 chars]",,de,'Bundesnetzagentur'
https://www.diepresse.com/18008473/energie-klagenfurt-senkt-strom-und-gaspreise,https://www.diepresse.com/18008473/energie-klagenfurt-senkt-strom-und-gaspreise,0,www.diepresse.com,Energie Klagenfurt senkt Strom- und Gaspreise,"Alle Kunden müssen dem neuen, günstigeren Preis aber aktiv zustimmen, sonst würden sie im alten Tarif bleiben. Eine weitere Senkung in den kommenden Monaten ist nicht ausgeschlossen.",https://www.diepresse.com/assets_v2/images/diepresse_nachrichten.png,2024-01-19T13:35:41Z,,"Alle Kunden müssen dem neuen, günstigeren Preis aber aktiv zustimmen, sonst würden sie im alten Tarif bleiben. Eine weitere Senkung in den kommenden Monaten ist nicht ausgeschlossen.
Die Energie Kla… [+1213 chars]",,de,'Gaspreis'
https://www.telepolis.de/features/Joe-Bidens-Klimapolitik-Widerspruch-in-Taten-9602918.html,https://www.telepolis.de/features/Joe-Bidens-Klimapolitik-Widerspruch-in-Taten-9602918.html,0,www.telepolis.de,Joe Bidens Klimapolitik: Widerspruch in Taten,Bidens Chancen auf eine Wiederwahl schwinden. Konflikte um seine Energiepolitik erschüttern seine Position. Warum Trump eine Chance für Europa sein könnte.,https://heise.cloudimg.io/bound/1200x1200/q85.png-lossy-85.webp-lossy-85.foil1/_www-heise-de_/imgs/18/4/5/2/8/8/9/9/us-praesident-politische-instabilitaet-weisses-haus-05617b051ddead16.png,2024-01-19T14:00:00Z,,"Die Darstellung des US-Präsidenten auf unsicherem Terrain vor dem Weißen Haus spiegelt die zunehmenden Herausforderungen und die sinkenden Wahlchancen inmitten politischer Spannungen wider.
(Bild: K… [+4705 chars]",,de,'LNG-Terminal'
https://www.telepolis.de/features/Joe-Bidens-sinkende-Wahlchancen-Wie-seine-Energiepolitik-ihn-in-Bedraengnis-bringt-9602918.html,https://www.telepolis.de/features/Joe-Bidens-sinkende-Wahlchancen-Wie-seine-Energiepolitik-ihn-in-Bedraengnis-bringt-9602918.html,0,www.telepolis.de,Joe Bidens sinkende Wahlchancen: Wie seine Energiepolitik ihn in Bedrängnis bringt,Bidens Chancen auf eine Wiederwahl schwinden. Konflikte um seine Energiepolitik erschüttern seine Position. Warum Trump eine Chance für Europa sein könnte.,https://heise.cloudimg.io/bound/1200x1200/q85.png-lossy-85.webp-lossy-85.foil1/_www-heise-de_/imgs/18/4/5/2/8/8/9/9/us-praesident-politische-instabilitaet-weisses-haus-05617b051ddead16.png,2024-01-19T14:00:00Z,,"Die Darstellung des US-Präsidenten auf unsicherem Terrain vor dem Weißen Haus spiegelt die zunehmenden Herausforderungen und die sinkenden Wahlchancen inmitten politischer Spannungen wider.
(Bild: K… [+4704 chars]",,de,'Energiepolitik'
https://www.morgenpost.de/vermischtes/article241459126/Mildere-Temperaturen-und-Wind-erwartet.html,https://www.morgenpost.de/vermischtes/article241459126/Mildere-Temperaturen-und-Wind-erwartet.html,0,www.morgenpost.de,Mildere Temperaturen und Wind erwartet,"Schlittern, frieren und im Stau stehen: Der Winter hat den Alltag vieler Menschen in Deutschland zuletzt stark geprägt. Jetzt zeichnet sich eine Beruhigung ab. Zumindest kurz.",https://img.sparknews.funkemedien.de/241459124/241459124_1705674221_v4_3_800.jpeg,2024-01-19T14:11:08Z,,"Offenbach. Schlittern, frieren und im Stau stehen: Der Winter hat den Alltag vieler Menschen in Deutschland zuletzt stark geprägt. Jetzt zeichnet sich eine Beruhigung ab. Zumindest kurz.
Nach mehrer… [+3745 chars]",,de,'Winter frieren'
https://stadt-bremerhaven.de/bundesnetzagentur-bussgelder-wegen-unerlaubter-telefonwerbung-2023-mit-neuer-rekordsumme/,https://stadt-bremerhaven.de/bundesnetzagentur-bussgelder-wegen-unerlaubter-telefonwerbung-2023-mit-neuer-rekordsumme/,0,stadt-bremerhaven.de,Bundesnetzagentur: Bußgelder wegen unerlaubter Telefonwerbung 2023 mit neuer Rekordsumme,"Im Jahr 2023 hat die Bundesnetzagentur nach eigenen Angaben einen neuen Höchststand bei der Verhängung von Bußgeldern wegen unerlaubter Telefonwerbung erreicht. So kamen Bußgelder in der Höhe von 1,435 Mio. Euro zusammen. Als Vergleich: 2022 waren es „nur“ 1,…",https://stadt-bremerhaven.de/wp-content/uploads/2024/01/Anruf-unerlaubt.jpg,2024-01-19T14:30:45Z,,"Im Jahr 2023 hat die Bundesnetzagentur nach eigenen Angaben einen neuen Höchststand bei der Verhängung von Bußgeldern wegen unerlaubter Telefonwerbung erreicht. So kamen Bußgelder in der Höhe von 1,4… [+3303 chars]",,de,'Energieversorgung'
https://www.golem.de/sonstiges/zustimmung/auswahl.html?from=https://www.golem.de/news/bundesnetzagentur-hohe-strafen-fuer-schwere-faelle-unerlaubter-telefonwerbung-2401-181366.html&referer=https://t.co/b8f63b6458,https://www.golem.de/sonstiges/zustimmung/auswahl.html?from=https://www.golem.de/news/bundesnetzagentur-hohe-strafen-fuer-schwere-faelle-unerlaubter-telefonwerbung-2401-181366.html&referer=https://t.co/b8f63b6458,0,www.golem.de,Bundesnetzagentur: Hohe Strafen für schwere Fälle unerlaubter Telefonwerbung,"Call Center geben sich als aktueller Energieversorger oder als Vergleichsportal aus. Die Bundesnetzagentur verhängt mehrfach 285.000 Euro Bußgeld. (Telefonwerbung, Bundesnetzagentur)",,2024-01-19T17:25:01Z,,"Besuchen Sie Golem.de wie gewohnt mit Werbung und Tracking,
 indem Sie der Nutzung aller Cookies zustimmen.
 Details zum Tracking finden Sie im Privacy Center.
Skript wurde nicht geladen. Informat… [+607 chars]",,de,'Bundesnetzagentur'
https://www.faz.net/aktuell/wissen/weltraum/japans-mondsonde-ist-trotz-probleme-wohl-weich-gelandet-19461843.html,https://www.faz.net/aktuell/wissen/weltraum/japans-mondsonde-ist-trotz-probleme-wohl-weich-gelandet-19461843.html,0,www.faz.net,Japans Mondsonde SLIM ist gelandet,Die japanische Raumsonde SLIM ist nach einer Reise von vier Monaten am Freitagnachmittag offenbar weich auf dem Mond gelandet. Doch es gibt Probleme bei der Stromversorgung.,https://media0.faz.net/ppmedia/aktuell/feuilleton/1218773164/1.9462050/facebook_teaser/illustration-der-landung-vom.jpg,2024-01-19T17:25:50Z,,"Japan ist die geplante weiche Landung der Sonde SLIM auf dem Mond nach Stand vom Freitagabend wohl geglückt, allerdings gebe es Schwierigkeiten bei der Stromversorgung. So arbeite das Solarpanel nich… [+2413 chars]",,de,'Stromversorgung'
https://www.sueddeutsche.de/wissen/japan-mond-probleme-1.6335957,https://www.sueddeutsche.de/wissen/japan-mond-probleme-1.6335957,0,www.sueddeutsche.de,Raumfahrt: Japanische Mondmission nur teilweise erfolgreich,Geplant war eine weiche Landung an fest definierter Stelle. Und tatsächlich: Das Mond-Landegerät sendet Daten zur Bodenstation. Allerdings gibt es Probleme mit der Stromversorgung.,https://www.sueddeutsche.de/image/sz.1.6202231/1200x675?v=1705687976,2024-01-19T17:55:55Z,,Japan ist die geplante weiche Landung einer Sonde auf dem Mond nach Stand vom Freitagabend wohl geglückt - allerdings kam es zu Problemen bei der Stromversorgung.Gestartet ist die kleine Sonde Anfang… [+1905 chars],,de,'Stromversorgung'
https://www.faz.net/aktuell/wirtschaft/vattenfall-chefin-anna-borg-ueber-kernenergie-und-smr-19460583.html,https://www.faz.net/aktuell/wirtschaft/vattenfall-chefin-anna-borg-ueber-kernenergie-und-smr-19460583.html,0,www.faz.net,Vattenfall-Chefin Borg: „Erneuerbare Energien allein sind auch nicht gut“,"Die Chefin des Energiekonzerns Vattenfall, Anna Borg, über ihre Pläne für neue Kernkraftwerke, die Probleme des deutschen Stromnetzes und die übertriebene Hoffnung auf Wasserstoff",https://media1.faz.net/ppmedia/aktuell/1407413612/1.9460581/facebook_teaser/anna-borg-52-ist-seit-2020.jpg,2024-01-19T18:00:58Z,,"Anna Borg, 52, ist seit 2020 Vorstandsvorsitzende des staatlichen schwedischen Energiekonzerns Vattenfall, der in halb Europa Strom und Wärme liefert, auch in Deutschland. Bild: Imago
Die Chefin des… [+2341 chars]",,de,'Erneuerbare Energie'
https://www.tagesschau.de/ausland/asien/japan-mondmission-106.html,https://www.tagesschau.de/ausland/asien/japan-mondmission-106.html,0,www.tagesschau.de,Unklarheiten nach japanischer Mondlandung,"Der japanischen Raumfahrtbehörde Jaxa ist es gelungen, eine Mondsonde weich auf dem Erdtrabanten zu landen. Ob die Mission ein voller Erfolg wird, ist aber offen: Es gibt Probleme mit der Stromversorgung.",https://images.tagesschau.de/image/8c92f0c5-3e00-4de8-9b95-b775df1a24ff/AAABjSMNeHg/AAABibBxqrQ/16x9-1280/slim-sonde-108.jpg,2024-01-19T18:48:33Z,,"Stand: 19.01.2024 19:48 Uhr
Der japanischen Raumfahrtbehörde Jaxa ist es gelungen, eine Mondsonde weich auf dem Erdtrabanten zu landen. Ob die Mission ein voller Erfolg wird, ist aber offen: Es gibt… [+1588 chars]",,de,'Stromversorgung'
https://www.welt.de/vermischtes/video249637738/Mondlandung-Die-Japaner-moechten-zeigen-welche-gute-Technologie-sie-haben.html,https://www.welt.de/vermischtes/video249637738/Mondlandung-Die-Japaner-moechten-zeigen-welche-gute-Technologie-sie-haben.html,0,www.welt.de,"„Die Japaner möchten zeigen, welche gute Technologie sie haben“","Japan ist mit einer unbemannten Sonde erfolgreich auf dem Mond gelandet. Allerdings kam es zu Problemen bei der Stromversorgung. Kontakt zu der Sonde bestehe aber, so Japans Raumfahrtagentur Jaxa. Der Ex-Astronaut Ulrich Walter spricht bei WELT TV über die Be…",https://img.welt.de/img/vermischtes/mobile249637954/9981356017-ci16x9-w1200/walter-jpg.jpg,2024-01-19T18:51:45Z,,"Die WELT als ePaper: Die vollständige Ausgabe steht Ihnen bereits am Vorabend zur Verfügung so sind Sie immer hochaktuell informiert. Weitere Informationen: http://epaper.welt.de 
 Der Kurz-Link die… [+49 chars]",,de,'Stromversorgung'
https://www.zeit.de/news/2024-01/20/stromkosten-fuer-landesgebaeude-haben-sich-fast-verdreifacht,https://www.zeit.de/news/2024-01/20/stromkosten-fuer-landesgebaeude-haben-sich-fast-verdreifacht,0,www.zeit.de,Energiepreise: Stromkosten für Landesgebäude haben sich fast verdreifacht,Hier finden Sie Informationen zu dem Thema „Energiepreise“. Lesen Sie jetzt „Stromkosten für Landesgebäude haben sich fast verdreifacht“.,https://img.zeit.de/news/2024-01/20/stromkosten-fuer-landesgebaeude-haben-sich-fast-verdreifacht-image-group/wide__1300x731,2024-01-20T07:29:18Z,,Der starke Anstieg der Energiepreise macht sich auch in Niedersachsens Landeshaushalt bemerkbar. Obwohl der Verbrauch von Strom und Wärme in den landeseigenen Gebäuden im vergangenen Jahr jeweils lei… [+2248 chars],,de,'Energiepreise'
https://www.stern.de/gesellschaft/regional/berlin-brandenburg/parteitag--gruene-wollen-afd-verbot-und-zeigen-sich-kaempferisch-34384410.html,https://www.stern.de/gesellschaft/regional/berlin-brandenburg/parteitag--gruene-wollen-afd-verbot-und-zeigen-sich-kaempferisch-34384410.html,0,www.stern.de,Parteitag: Grüne wollen AfD-Verbot und zeigen sich kämpferisch,"Die Grünen in Brandenburg haben mit ihrem Parteitag den Wahlkampf eingeläutet. Sie positionieren sich zur Frage eines AfD-Verbots, zum Klimaschutz und zum Kohleausstieg.",https://image.stern.de/34384412/t/kt/v2/w1440/r1.7778/-/20--urnnewsmldpacom2009010124012099685243v3w800h600l55t416r1335b1299jpeg---e7f9845c2f0ec7f4.jpg,2024-01-20T16:24:46Z,,"Die Grünen in Brandenburg haben mit ihrem Parteitag den Wahlkampf eingeläutet. Sie positionieren sich zur Frage eines AfD-Verbots, zum Klimaschutz und zum Kohleausstieg.
Die Brandenburger Grünen for… [+3645 chars]",,de,'Kohleausstieg'
https://www.n-tv.de/politik/05-38-Loescharbeiten-an-russischem-Gasterminal--article23143824.html,https://www.n-tv.de/politik/05-38-Loescharbeiten-an-russischem-Gasterminal--article23143824.html,0,www.n-tv.de,Ukraine-Krieg im Liveticker: +++ 05:38 Löscharbeiten an russischem Gasterminal +++,Lesen Sie alle aktuellen Entwicklungen und Nachrichten über den russischen Angriffskrieg auf die Ukraine im Liveticker von ntv.de.,https://bilder2.n-tv.de/img/incoming/crop23332537/9041326157-cImg_16_9-w1200/Liveticker1-grau-1-Kopie.jpg,2024-01-20T23:10:00Z,,Das russische Katastrophenschutzministerium und lokale Feuerwehreinheiten sind dem zuständigen Gouverneur zufolge an den Löscharbeiten in der Gasanlage an der Ostee beteiligt. Dort werde Gas unter an… [+5064 chars],,de,'Gas Ukraine'
https://www.n-tv.de/politik/11-14-Russland-Brand-in-Gasterminal-unter-Kontrolle--article23143824.html,https://www.n-tv.de/politik/11-14-Russland-Brand-in-Gasterminal-unter-Kontrolle--article23143824.html,0,www.n-tv.de,Ukraine-Krieg im Liveticker: +++ 11:14 Russland: Brand in Gasterminal unter Kontrolle +++,Lesen Sie alle aktuellen Entwicklungen und Nachrichten über den russischen Angriffskrieg auf die Ukraine im Liveticker von ntv.de.,https://bilder2.n-tv.de/img/incoming/crop23332537/9041326157-cImg_16_9-w1200/Liveticker1-grau-1-Kopie.jpg,2024-01-20T23:10:00Z,,"Der heute Nacht im russischen Ostseehaffen Ust-Luga ausgebrochen Brand an einem Terminal für Flüssiggas ist offenbar unter Kontrolle. Das teilt der Gouverneur der dortigen Region, Alexander Drozdenko… [+11421 chars]",,de,'Gas Ukraine'
https://www.dw.com/de/warum-m%C3%BCssen-so-viele-russen-zuhause-frieren/a-68038970,https://www.dw.com/de/warum-m%C3%BCssen-so-viele-russen-zuhause-frieren/a-68038970,0,www.dw.com,Warum müssen so viele Russen zuhause frieren?,"Die Kreml-Propaganda hatte den Westeuropäern prophezeit, sie würden ohne russisches Gas im Winter erfrieren. Es kam anders. Stattdessen müssen zehntausende Russen bei zweistelligen Minusgraden ohne Heizung ausharren.",https://static.dw.com/image/67887191_6.jpg,2024-01-21T05:05:00Z,,"Die Menschen sitzen in der Kälte, weil Heizungssysteme an vielen Orten Russlands den Dienst versagt haben. Auch Moskau und Umgebung, die Oblast Moskau, sind betroffen - und das in einem Jahr, in dem … [+7384 chars]",,de,'Winter Gas'
https://www.focus.de/politik/ausland/jetzt-frieren-auch-russen-ohne-heizung-geduld-der-menschen-hat-ein-ende_id_259594952.html,https://www.focus.de/politik/ausland/jetzt-frieren-auch-russen-ohne-heizung-geduld-der-menschen-hat-ein-ende_id_259594952.html,0,www.focus.de,„Schlafen unter zwei Bettdecken“ - Warum müssen so viele Russen zuhause frieren?,"Die Kreml-Propaganda hatte den Westeuropäern prophezeit, sie würden ohne russisches Gas im Winter erfrieren. Es kam anders. Stattdessen müssen zehntausende Russen bei zweistelligen Minusgraden ohne Heizung ausharren.",https://p6.focus.de/img/fotos/id_259595422/in-klimowsk-nur-50-kilomenter-von-moskau-entfernt-fiel-ein-heizwerk-aus.png?im=Crop%3D%2812%2C0%2C2168%2C1084%29%3BResize%3D%281200%2C627%29&impolicy=perceptual&quality=mediumHigh&hash=4676ba9289686904185bba9894994a0581a020cc9783f3e21a24059ef64c2e02,2024-01-21T05:35:04Z,https://web.archive.org/web/20240121122009/https://www.focus.de/politik/ausland/jetzt-frieren-auch-russen-ohne-heizung-geduld-der-menschen-hat-ein-ende_id_259594952.html,"Die Menschen sitzen in der Kälte, weil Heizungssysteme an vielen Orten Russlands den Dienst versagt haben. Auch Moskau und Umgebung, die Oblast Moskau, sind betroffen - und das in einem Jahr, in dem … [+7096 chars]",,de,'Winter frieren'
https://www.stern.de/gesellschaft/regional/berlin-brandenburg/krankenhaeuser--probleme-bei-stromversorgung---thw-einsatz-in-klinikum-34385302.html,https://www.stern.de/gesellschaft/regional/berlin-brandenburg/krankenhaeuser--probleme-bei-stromversorgung---thw-einsatz-in-klinikum-34385302.html,0,www.stern.de,Krankenhäuser: Probleme bei Stromversorgung - THW-Einsatz in Klinikum,"In der Stromversorgung des Klinikums in Neukölln gibt es Probleme. Feuerwehr und THW werden informiert, Stromaggregate sichern die Versorgung. Die Arbeiten werden noch etwas andauern.",https://image.stern.de/34385304/t/se/v2/w1440/r1.7778/-/21--urnnewsmldpacom2009010124012199692810v2w800h600l872t840r2456b1104jpeg---bbddbcd8afa222b0.jpg,2024-01-21T12:26:38Z,,"In der Stromversorgung des Klinikums in Neukölln gibt es Probleme. Feuerwehr und THW werden informiert, Stromaggregate sichern die Versorgung. Die Arbeiten werden noch etwas andauern.
Probleme bei d… [+1852 chars]",,de,'Stromversorgung'
https://www.focus.de/deals/shopping-deal-mit-focus-online-selbst-strom-produzieren-balkonkraftwerk-mit-exklusivem-gutscheincode-im-deal_id_259590380.html,https://www.focus.de/deals/shopping-deal-mit-focus-online-selbst-strom-produzieren-balkonkraftwerk-mit-exklusivem-gutscheincode-im-deal_id_259590380.html,0,www.focus.de,Shopping-Deal mit FOCUS online - Selbst Strom produzieren? Balkonkraftwerk mit exklusivem Gutscheincode ab 299 Euro,Mit dem Aus der Energiepreisbremse steigen 2024 auch wieder viele Stromrechnungen. Abhilfe schafft ein Balkonkraftwerk mit Speicher. So machen Sie sich unabhängiger von aktuellen Strompreisen. Im exklusiven Angebot sparen Sie bis zu 100 Euro und erhalten ein …,https://p6.focus.de/img/fotos/id_259591006/solakon-header.jpg?im=Crop%3D%2886%2C0%2C1028%2C514%29%3BResize%3D%281200%2C627%29&impolicy=perceptual&quality=mediumHigh&hash=b221d52f8918f753921ced65200768e08adf7e71a8657398ca44dddaea1eb665,2024-01-22T07:46:27Z,,"<ul><li>
Kommentare</li><li>
E-Mail</li><li>
Teilen</li><li>
Mehr</li><li>
Twitter</li><li>
Drucken</li><li>
Feedback</li><li>
Fehler meldenSie haben einen Fehler gefunden?
Bitte markieren S… [+9733 chars]",,de,'Energiepreisbremse'
https://www.morgenpost.de/wirtschaft/article241476310/heizoelpreise-aktuell-heute-22-januar-2024-heizoel-energie-heizung.html,https://www.morgenpost.de/wirtschaft/article241476310/heizoelpreise-aktuell-heute-22-januar-2024-heizoel-energie-heizung.html,0,www.morgenpost.de,Heizölpreise vom 22. Januar: Der Preis für einen Liter heute,Beeinflussen die internationalen Krisenherde die Heizölpreise? ○ Eine Expertin ordnet ein. ○ Die Preise für Heizöl vom 22. Januar finden Sie hier.,https://img.sparknews.funkemedien.de/238144069/238144069_1681477675_v4_3_800.jpeg,2024-01-22T10:26:24Z,,"Berlin. Inwieweit beeinflussen die internationalen Krisen die Heizölpreise? Wir haben uns die Preise für Heizöl am 22. Januar angeschaut. 
Krisenherde wie der Nahost-Konflikt und damit einhergehend … [+10163 chars]",,de,'Heizöl'
https://www.stern.de/gesundheit/nacktschlafen-ist-gut-fuer-den-koerper---sogar-im-winter-34381890.html,https://www.stern.de/gesundheit/nacktschlafen-ist-gut-fuer-den-koerper---sogar-im-winter-34381890.html,0,www.stern.de,Gut zu wissen: Nacktschlafen ist gut für den Körper – sogar im Winter,"Im Winter kuscheln wir uns gern im Pyjama unter flauschige Decken, man will schließlich nachts nicht frieren. Der Schlafgesundheit ist das aber nicht unbedingt zuträglich. Besser ist es, nackt zu schlafen.",https://image.stern.de/34388480/t/So/v1/w1440/r1.7778/-/schlafendes-paar.jpg,2024-01-22T18:49:00Z,,"Walgesänge im Ohr, Wollsocken an den Füßen, beschwerte Decke was sind eigentlich die perfekten Schlafzimmerbedingungen für guten Schlaf? Ist es absolute Dunkelheit, die Verbannung aller Elektronik-Ge… [+4162 chars]",,de,'Winter frieren'
https://www.bild.de/bild-plus/unterhaltung/tv/tv/dschungelcamp-2024-rassismus-aussetzer-von-anya-elsners-vater-86857680.bild.html,https://www.bild.de/bild-plus/unterhaltung/tv/tv/dschungelcamp-2024-rassismus-aussetzer-von-anya-elsners-vater-86857680.bild.html,0,www.bild.de,*** BILDplus Inhalt *** Während Blackout - Rassismus-Aussetzer in Dschungel-Show!,"Was war da denn los? In „Die Stunde danach“ kam es zu einem ekelhaften, rassistischen Spruch. Im Mittelpunkt: Anya Elsner.","https://images.bild.de/65ae36baaf26695d341cf713/3e7477e6d5872a78e9cdbcf8a125e128,c0c6d285?w=1280",2024-01-22T19:32:09Z,,"Was war da denn los? Am Sonntagabend blickten viele Dschungel-Fans auf schwarze Bildschirme. Sie wollten in der RTL-Sendung Die Stunde danach eigentlich sehen, warum Cora Schumacher das Camp freiwill… [+344 chars]",,de,'Blackout'
https://www.brigitte.de/leben/wohnen/haushalt/energie-sparen--5-heiz-fehler--die-du-diesen-winter-unbedingt-vermeiden-solltest-13079882.html,https://www.brigitte.de/leben/wohnen/haushalt/energie-sparen--5-heiz-fehler--die-du-diesen-winter-unbedingt-vermeiden-solltest-13079882.html,0,www.brigitte.de,"Energie sparen: 5 Heiz-Fehler, die du diesen Winter unbedingt vermeiden solltest","Musstest du auch schon mal Heizkosten nachzahlen? Erfahre hier fünf verbreitete Fehler, die das Heizen schnell ganz schön teuer machen.",https://image.brigitte.de/13079894/t/bY/v3/w1440/r1.7778/-/heizfehler.jpg,2024-01-22T20:00:00Z,,"von Pia Klaus und Marie Mühlenberg
22.01.2024, 21:00
Musstest du auch schon mal Heizkosten nachzahlen? Erfahre hier fünf verbreitete Fehler, die das Heizen schnell ganz schön teuer machen.
Seit de… [+564 chars]",,de,'Heizkosten'
https://www.focus.de/immobilien/bauen/renovieren/fuer-sie-durchgerechnet-sofort-oder-nie-ab-wann-sich-eine-waermepumpe-fuer-sie-rentiert_id_259598309.html,https://www.focus.de/immobilien/bauen/renovieren/fuer-sie-durchgerechnet-sofort-oder-nie-ab-wann-sich-eine-waermepumpe-fuer-sie-rentiert_id_259598309.html,0,www.focus.de,Für Sie durchgerechnet - Sofort oder nie: Ab wann sich eine Wärmepumpe für Sie rentiert,"Die Fördersätze für Wärmepumpen stehen, die Gas- und Strompreise auch. Jetzt lässt sich für Hausbesitzer verlässlich kalkulieren, was sie Einbau und Betrieb einer klimafreundlichen Heizung kostet. Unsere Analyse zeigt: Das ist gar nicht so trivial.Von FOCUS-o…",https://p6.focus.de/img/fotos/id_131701070/waermepumpe-74336105.jpg?im=Crop%3D%280%2C300%2C3445%2C1722%29%3BResize%3D%281200%2C627%29&impolicy=perceptual&quality=mediumHigh&hash=3edf790ae7d61ef7ad23df0a0c381ee8f6b81f0d865352ee3c8de784b7526953,2024-01-23T06:17:30Z,,"<ul><li>
Kommentare</li><li>
E-Mail</li><li>
Teilen</li><li>
Mehr</li><li>
Twitter</li><li>
Drucken</li><li>
Feedback</li><li>
Fehler meldenSie haben einen Fehler gefunden?
Bitte markieren S… [+9471 chars]",,de,'Gaspreis'
