index,url,valid,domain,title,description,image,published,archive,content,quote,language,keyword
https://www.handelsblatt.com/unternehmen/energie/energiekrise-shell-mit-rekordgewinn-aktionaere-sind-die-grossen-gewinner/28959672.html,https://www.handelsblatt.com/unternehmen/energie/energiekrise-shell-mit-rekordgewinn-aktionaere-sind-die-grossen-gewinner/28959672.html,0,www.handelsblatt.com,Energiekonzern: Shell mit Rekordgewinn – Aktionäre sind die großen Gewinner der Energiekrise,Der Energiekonzern hat im Schlussquartal seinen Profit trotz Sondergewinnsteuer verdoppelt. Rekordgewinne durch Öl und Gas sorgen für hohe Dividenden und Aktienrückkäufe – und heftige Kritik.,https://www.handelsblatt.com/images/shell-am-pranger-von-umweltschuetzern/28959816/3-format2003.jpg,2023-02-02T12:27:23Z,,"Das ist einer der höchste Profite, die jemals von einem Unternehmen in Großbritannien erzielt worden sind. Die Gassparte steuerte im letzten Quartal rund sechs Milliarden Dollar zu Shells Erfolg bei,… [+4465 chars]",,de,'EU Gaspreise'
https://www.handelsblatt.com/unternehmen/energie/gasspeicher-in-deutschland-fuellstand-von-78-prozent-erreicht/28819652.html,https://www.handelsblatt.com/unternehmen/energie/gasspeicher-in-deutschland-fuellstand-von-78-prozent-erreicht/28819652.html,0,www.handelsblatt.com,Gasspeicher in Deutschland: Füllstand von 78 Prozent erreicht,Ein hoher Gasspeicher-Füllstand ist für Deutschlands Gasversorgung in der Energiekrise essenziell. Wie steht es aktuell um die Gasreserven? Ein Überblick.,https://www.handelsblatt.com/images/gasspeicher-in-sachsen-anhalt/28877480/2-format2003.jpg,2023-02-02T12:49:44Z,https://web.archive.org/web/20230202131204/https://www.handelsblatt.com/unternehmen/energie/gasspeicher-in-deutschland-fuellstand-von-78-prozent-erreicht/28819652.html,"Gasspeicher in Sachsen-AnhaltDer Gasspeicher-Füllstand in Deutschland ist in der Energiekrise zum wichtigen Faktor geworden.
(Foto: dpa)
Düsseldorf Ein stabiler Füllstand der deutschen Gasspeicher … [+7471 chars]",,de,'Gasversorgung'
https://www.nzz.ch/finanzen/die-ezb-setzt-mit-einem-weiteren-zinsschritt-von-05-prozentpunkten-den-kampf-gegen-die-inflation-fort-ld.1724007,https://www.nzz.ch/finanzen/die-ezb-setzt-mit-einem-weiteren-zinsschritt-von-05-prozentpunkten-den-kampf-gegen-die-inflation-fort-ld.1724007,0,www.nzz.ch,"Die EZB setzt mit einem weiteren Zinsschritt von 0,5 Prozentpunkten den Kampf gegen die Inflation fort",In der Euro-Zone haben die Zinsen inzwischen das höchste Niveau seit der Finanzkrise erreicht. Am Donnerstag hob die Europäische Zentralbank ihre Schlüsselzinssätze zum fünften mal in Folge an. Weitere Zinsschritte dürften in den kommenden Monaten folgen.,"https://img.nzz.ch/2022/06/09/d58e8920-28c5-4508-baae-eeaf5c2bb306.jpeg?width=1200&height=675&fit=bound&quality=75&auto=webp&crop=5184,2916,x0,y270&wmark=nzz",2023-02-02T13:20:44Z,https://web.archive.org/web/20230202133032/https://www.nzz.ch/finanzen/die-ezb-setzt-mit-einem-weiteren-zinsschritt-von-05-prozentpunkten-den-kampf-gegen-die-inflation-fort-ld.1724007,"Hauptsitz der Europäische Zentralbank in Frankfurt: Die Notenbank will die Inflation wieder auf ihr Ziel von mittelfristig 2 Prozent drücken.
Die starke Teuerung in der Euro-Zone ist jüngst etwas zu… [+3494 chars]",,de,'Inflation'
"https://www.cio.de/a/verkauf-von-gut-15-millionen-produkten-gestoppt,3704488?utm_source=Seiten_3932&utm_medium=RSS&utm_campaign=RSS-Feeds","https://www.cio.de/a/verkauf-von-gut-15-millionen-produkten-gestoppt,3704488?utm_source=Seiten_3932&utm_medium=RSS&utm_campaign=RSS-Feeds",0,www.cio.de,Bundesnetzagentur: Verkauf von gut 15 Millionen Produkten gestoppt,Die Bundesnetzagentur hat im vergangenen Jahr den Verkauf von mehr als 15 Millionen verbotenen Produkten gestoppt.,https://images.cio.de/bdb/3357844/640x360.jpg,2023-02-02T13:48:00Z,,"Der Großteil der Verbote durch die Bundesnetzagentur betraf den Onlinehandel. Foto: Tobias Arhelger - shutterstock.com
Darunter waren allein fast 2,8 Millionen ""Energiespargeräte"", wie die Aufsichts… [+2245 chars]",,de,'Netzagentur'
https://www.stern.de/wirtschaft/news/energieversorgung--keine-mangellage--gasspeicher-gut-gefuellt-33159552.html,https://www.stern.de/wirtschaft/news/energieversorgung--keine-mangellage--gasspeicher-gut-gefuellt-33159552.html,0,www.stern.de,Energieversorgung: Keine Mangellage: Gasspeicher gut gefüllt,Einen fiesen Gasmangel mit Verbrauchsbeschränkungen hält mittlerweile sogar die Bundesnetzagentur für unwahrscheinlich. Eine komplette Entwarnung mag Behördenchef Müller aber nicht geben.,https://image.stern.de/33159554/t/8E/v2/w1440/r1.7778/-/02--urnnewsmldpacom2009010123020299447905v3w800h600l924t432r1446b859jpeg---e80b6cabbea0f5fa.jpg,2023-02-02T14:31:43Z,https://web.archive.org/web/20230202165930/https://www.stern.de/wirtschaft/news/energieversorgung--keine-mangellage--gasspeicher-gut-gefuellt-33159552.html,"Einen fiesen Gasmangel mit Verbrauchsbeschränkungen hält mittlerweile sogar die Bundesnetzagentur für unwahrscheinlich. Eine komplette Entwarnung mag Behördenchef Müller aber nicht geben.
Schon seit… [+3597 chars]",,de,'Gasmangel'
https://www.morgenpost.de/berlin/article237532517/Gasag-senkt-Gaspreis-in-der-Grundversorgung-ab-Mai.html,https://www.morgenpost.de/berlin/article237532517/Gasag-senkt-Gaspreis-in-der-Grundversorgung-ab-Mai.html,0,www.morgenpost.de,Verbraucher: Gasag senkt Gaspreis in der Grundversorgung ab Mai,"Nach mehreren Preiserhöhungen in den vergangenen Monaten können sich 250.000 Gaskunden im Grundversorgungstarif der Berliner Gasag auf etwas Entlastung freuen. Zum 1. Mai senkt das Unternehmen den Preis für diese Kunden um rund 20 Prozent, wie es am Donnersta…",https://img.morgenpost.de/img/berlin/crop237532515/7802603041-w820-cv16_9-q85/Gasherd-mit-Flamme.jpg,2023-02-02T15:28:53Z,https://web.archive.org/web/20230202160816/https://www.morgenpost.de/berlin/article237532517/Gasag-senkt-Gaspreis-in-der-Grundversorgung-ab-Mai.html,Berlin (dpa/bb). Nach mehreren Preiserhöhungen in den vergangenen Monaten können sich 250.000 Gaskunden im Grundversorgungstarif der Berliner Gasag auf etwas Entlastung freuen. Zum 1. Mai senkt das U… [+1258 chars],,de,'Gaspreis'
https://www.tagesspiegel.de/politik/energiekrise-abgewendet-deutschland-hat-ziel-fur-gasspeicher-ubererfullt-9284370.html,https://www.tagesspiegel.de/politik/energiekrise-abgewendet-deutschland-hat-ziel-fur-gasspeicher-ubererfullt-9284370.html,0,www.tagesspiegel.de,Energiekrise abgewendet?: Deutschland hat Ziel für Gasspeicher übererfüllt,"Bis zum 1. Februar sollten alle EU-Staaten die Gasspeicher zu mindestens 40 Prozent gefüllt haben. Deutschland hat das Ziel mit 78,6 Prozent weit übertroffen.",https://www.tagesspiegel.de/images/erdgasspeicher/alternates/BASE_16_9_W1400/erdgasspeicher.jpeg,2023-02-02T15:39:33Z,https://web.archive.org/web/20230202160740/https://www.tagesspiegel.de/politik/energiekrise-abgewendet-deutschland-hat-ziel-fur-gasspeicher-ubererfullt-9284370.html,"Schon seit Wochen hatte es sich abgezeichnet, jetzt ist es amtlich: Die Gasspeicher in Deutschland haben das Füllstandsziel von 40 Prozent zum 1. Februar mehr als erreicht. Mit 78,6 Prozent waren sie… [+3869 chars]",,de,'Energiekrise'
https://www.morgenpost.de/politik/article237532993/spanien-inflation-kampf-erfolge-wirtschaftswunder.html,https://www.morgenpost.de/politik/article237532993/spanien-inflation-kampf-erfolge-wirtschaftswunder.html,0,www.morgenpost.de,Inflation: Spaniens Wirtschaftswunder: Was Deutschland lernen kann,"Miet- und Strompreisbremse, kostenloser ÖPNV, billigere Lebensmittel: Spanien zieht im Kampf gegen die Inflation alle Register. Mit großem Erfolg.",https://img.morgenpost.de/img/politik/crop237532991/4852604614-w820-cv16_9-q85/81f2e238-a2e8-11ed-94f9-5403e75de0c9.jpg,2023-02-02T15:57:13Z,,"Berlin.  Die Touristen sind nach der Pandemie und trotz Ukrainekrieg und Energiekrise in Massen zurückgekommen: Mallorca, die meistbesuchte europäische Ferieninsel, war im vergangenen Sommer so gut w… [+4648 chars]",,de,'Energiemarkt'
https://www.diepresse.com/6246447/energiekrise-bringt-milliarden-fuer-omv-und-fiskus,https://www.diepresse.com/6246447/energiekrise-bringt-milliarden-fuer-omv-und-fiskus,0,www.diepresse.com,Energiekrise bringt Milliarden für OMV und Fiskus,Hohe Öl- und Gaspreise verhelfen der OMV zu einem kräftigen Gewinnsprung. Eine knappe Milliarde davon landet beim Staat.,https://media.diepresse.com/social_diepresse_nachrichten/images/uploads_1200/0/2/f/6246447/D70C2511-2779-493C-8360-28E5A3279AE6_v0_h.jpg,2023-02-02T17:22:00Z,https://web.archive.org/web/20230203233839/https://www.diepresse.com/6246447/energiekrise-bringt-milliarden-fuer-omv-und-fiskus,"Hohe Öl- und Gaspreise verhelfen der OMV zu einem kräftigen Gewinnsprung. Eine knappe Milliarde davon landet beim Staat.
Wien.OMV-Chef Alfred Stern kann auch in seinem zweiten Jahr eine starke Bilan… [+4859 chars]",,de,'Winter Gas'
https://www.focus.de/finanzen/news/energiewende-macht-probleme-zu-wenig-strom-tesla-und-viessmann-protestieren_id_184709076.html,https://www.focus.de/finanzen/news/energiewende-macht-probleme-zu-wenig-strom-tesla-und-viessmann-protestieren_id_184709076.html,0,www.focus.de,Energiewende macht Probleme - Stromanbieter in Angst vor Netz-Kollaps - wegen E-Autos und Wärmepumpen,"Elektroautos und Wärmepumpen sind entscheidende Bausteine für die Energiewende. Doch wenn alle sie nutzen, bricht das Stromnetz zusammen. Deswegen sollen Stromversorger den Saft auch mal drosseln dürfen. Die Industrie hält das für eine ganz schlechte Idee.Von…",https://p6.focus.de/img/fotos/id_184708434/stromleitung.jpg?im=Crop%3D%280%2C165%2C2048%2C1024%29%3BResize%3D%281200%2C627%29&impolicy=perceptual&quality=medium&hash=28bc7558bbb12ae6e8a04ca4c00cc3f1e1728f5af436f530f6b1af824e7ff810,2023-02-03T09:03:19Z,https://web.archive.org/web/20230203092741/https://www.focus.de/finanzen/news/energiewende-macht-probleme-zu-wenig-strom-tesla-und-viessmann-protestieren_id_184709076.html,"Elektroautos und Wärmepumpen sind entscheidende Bausteine für die Energiewende. Doch wenn alle sie nutzen, bricht das Stromnetz zusammen. Deswegen sollen Stromversorger den Saft auch mal drosseln dür… [+5883 chars]",,de,'Wärmepumpe'
https://www.morgenpost.de/wirtschaft/article237536663/gaspreis-aktuell-heute-3-februar-2023-energie-preis-gas-kwh.html,https://www.morgenpost.de/wirtschaft/article237536663/gaspreis-aktuell-heute-3-februar-2023-energie-preis-gas-kwh.html,0,www.morgenpost.de,Energiekosten: Gaspreis aktuell: Der Preis pro kWh Gas heute am 3. Februar,Aktuell sinkt der Gaspreis in Deutschland. ○ Profitieren die Verbraucher davon? ○ So hoch ist der Preis pro kWh heute am 3. Februar.,https://img.morgenpost.de/img/wirtschaft/crop237423343/3212605035-w820-cv16_9-q85/0941d004-98d1-11ed-9ffb-5de32a7e457c.jpg,2023-02-03T09:25:48Z,https://web.archive.org/web/20230203112530/https://www.morgenpost.de/wirtschaft/article237536663/gaspreis-aktuell-heute-3-februar-2023-energie-preis-gas-kwh.html,"Berlin. Auf dem Gasmarkt war die Lage zuletzt lange angespannt: Die Energiepreise in Deutschland schossen in die Höhe, die Versorgungssicherheit schien zeitweise gefährdet. Doch nun scheint sich das … [+4868 chars]",,de,'Energiekosten'
https://www.welt.de/politik/deutschland/article243550419/Kinder-lernen-nicht-schwimmen-weil-der-Politik-das-Energiesparen-wichtiger-ist.html,https://www.welt.de/politik/deutschland/article243550419/Kinder-lernen-nicht-schwimmen-weil-der-Politik-das-Energiesparen-wichtiger-ist.html,0,www.welt.de,Weniger Kinder lernen schwimmen – weil der Politik das Energiesparen wichtiger ist,"Nach der Pandemie forciert jetzt die Energie-Krise einen bedenklichen Trend: Immer weniger Grundschüler lernen schwimmen. So auch in Öhringen: Das Hallenbad bleibt nach Beschluss des Gemeinderats zu, es müsse gespart werden – aus Solidarität. Die Verärgerung …",https://img.welt.de/img/politik/deutschland/mobile243552671/3541351167-ci16x9-w1200/Hallenbad-in-Oehringen.jpg,2023-02-03T09:42:09Z,https://web.archive.org/web/20230203223037/https://www.welt.de/politik/deutschland/article243550419/Kinder-lernen-nicht-schwimmen-weil-der-Politik-das-Energiesparen-wichtiger-ist.html,"Es wären nur zehn Minuten, die Stefanie Klumpp montags mit ihren Drittklässlern laufen müsste. Vom Schulhof runter, durchs Wohngebiet, über eine Brücke und sie wären da. Doch ihr Ziel, das Hallenbad … [+6504 chars]",,de,'Energie sparen'
https://www.handelsblatt.com/unternehmen/mittelstand/familienunternehmer/produktion-von-waermepumpen-viessmann-baut-neue-waermepumpenfabrik-in-polen/28956084.html,https://www.handelsblatt.com/unternehmen/mittelstand/familienunternehmer/produktion-von-waermepumpen-viessmann-baut-neue-waermepumpenfabrik-in-polen/28956084.html,0,www.handelsblatt.com,Heizungsbauer: Wärmepumpen-Boom: Viessmann erzielt Rekordumsatz,Das Familienunternehmen profitiert vom Boom strombetriebener Heizungen infolge der Energiepreiskrise. Es hat seinen Umsatz 2022 um 19 Prozent gesteigert.,https://www.handelsblatt.com/images/waermepumpe-von-viessmann/28956242/3-format2003.jpg,2023-02-03T11:45:11Z,,"DüsseldorfViessmann schreibt einen Rekordumsatz: Der Heizungs- und Klimatechnikanbieter hat im abgelaufenen Jahr 2022 vier Milliarden Euro erwirtschaftet, wie das Unternehmen am Mittwochmorgen bekann… [+4307 chars]",,de,'Wärmepumpe'
https://www.focus.de/finanzen/news/preisbremsen-gas-oel-und-fernwaerme-so-kommen-mieter-an-das-heizgeschenk-vom-staa_id_184823473.html,https://www.focus.de/finanzen/news/preisbremsen-gas-oel-und-fernwaerme-so-kommen-mieter-an-das-heizgeschenk-vom-staa_id_184823473.html,0,www.focus.de,"Preisbremsen - Gas, Öl und Fernwärme - so kommen Mieter an das Heizgeschenk vom Staat","Ab 1. März können Millionen Haushalte von der Gaspreisbremse und Fernwärmbremse profitieren. Gleichzeitig starten die Bundesländer mit der Erstattung der Heizöl-, Pellets- und Flüssiggas-Mehrkosten aus dem Jahr 2022. FOCUS online sagt, wie Mieter an die Zahlu…",https://p6.focus.de/img/fotos/id_184112221/wohngeld.jpg?im=Crop%3D%280%2C130%2C3464%2C1732%29%3BResize%3D%281200%2C627%29&impolicy=perceptual&quality=medium&hash=df690c73ec04da8ee7324c75da4b6eead001d2b517a41fe5f3599bee28d4bda5,2023-02-03T13:35:09Z,https://web.archive.org/web/20230203233637/https://www.focus.de/finanzen/news/preisbremsen-gas-oel-und-fernwaerme-so-kommen-mieter-an-das-heizgeschenk-vom-staa_id_184823473.html,"Ab 1. März können Millionen Haushalte von der Gaspreisbremse und Fernwärmbremse profitieren. Gleichzeitig starten die Bundesländer mit der Erstattung der Heizöl-, Pellets- und Flüssiggas-Mehrkosten a… [+3545 chars]",,de,'Heizöl'
https://www.faz.net/aktuell/wirtschaft/konjunkturbericht-viele-risiken-bleiben-18651944.html,https://www.faz.net/aktuell/wirtschaft/konjunkturbericht-viele-risiken-bleiben-18651944.html,0,www.faz.net,Konjunkturbericht: „Deutschland hat keine Teflon-Wirtschaft“,"Hohe Energiepreise, Rekordinflation und überall fehlende Fachkräfte: Deutschland steht nicht am Abgrund – aber an Gefahren mangelt es nicht.",https://media1.faz.net/ppmedia/aktuell/367289805/1.8651147/facebook_teaser/hier-schweisst-ein-arbeiter.jpg,2023-02-03T14:13:53Z,https://web.archive.org/web/20230203143755/https://www.faz.net/aktuell/wirtschaft/konjunkturbericht-viele-risiken-bleiben-18651944.html,Die Aussicht auf eine wachsende Wirtschaft hat einen neuen Dämpfer bekommen. Dabei haben sich sowohl Bundeskanzler Olaf Scholz (SPD) als auch Bundeswirtschaftsminister Robert Habeck (Grüne) in diesem… [+3782 chars],,de,'Energiepreise'
https://www.focus.de/finanzen/news/heizkosten-trendwende-bei-heizoel-und-brennholz-erreicht-das-muessen-sie-beim-kauf-wissen_id_184829527.html,https://www.focus.de/finanzen/news/heizkosten-trendwende-bei-heizoel-und-brennholz-erreicht-das-muessen-sie-beim-kauf-wissen_id_184829527.html,0,www.focus.de,Heizkosten - Trendwende bei Heizöl und Brennholz erreicht? Das müssen Sie beim Kauf wissen,"Der Winter ist noch nicht vorbei. Die Temperaturen bleiben niedrig. Viele Haushalte überlegen jetzt, wann sie Heizöl oder Brennholz bestellen sollen. Entweder um für den Rest des Winters gerüstet zu sein oder um für den nächsten Winter vorzusorgen. FOCUS onli…",https://p6.focus.de/img/fotos/id_98030979/heizoel-72682473.jpg?im=Crop%3D%280%2C204%2C3489%2C1746%29%3BResize%3D%281200%2C627%29&impolicy=perceptual&quality=medium&hash=accd477c4a9af5b9ee56194b8a9cb57b2331cbc512496c4c2744edaf3d5c6fd1,2023-02-03T15:06:43Z,,"Der Winter ist noch nicht vorbei. Die Temperaturen bleiben niedrig. Viele Haushalte überlegen jetzt, wann sie Heizöl oder Brennholz bestellen sollen. Entweder um für den Rest des Winters gerüstet zu … [+5252 chars]",,de,'Winter Gas'
https://www.faz.net/aktuell/finanzen/energiekrise-heleba-und-kfw-verteilen-waermedecken-an-mitarbeiter-18652380.html,https://www.faz.net/aktuell/finanzen/energiekrise-heleba-und-kfw-verteilen-waermedecken-an-mitarbeiter-18652380.html,0,www.faz.net,Wärmedecken für Bankmitarbeiter,"Wegen der Energiekrise heizen viele Institute nur noch auf 19 Grad. Damit die Mitarbeiter sich dennoch wohlfühlen, greifen die Landesbank Hessen-Thüringen  (Helaba) und die KfW zu ungewöhnlichen Mitteln.",https://media1.faz.net/ppmedia/aktuell/gesellschaft/1513128336/1.8632789/facebook_teaser/frankfurter-skyline.jpg,2023-02-03T15:32:20Z,https://web.archive.org/web/20230203160951/https://www.faz.net/aktuell/finanzen/energiekrise-heleba-und-kfw-verteilen-waermedecken-an-mitarbeiter-18652380.html,"Es ist kühl in Frankfurts Bankentürmen. Wegen der Energiekrise heizen viele Institute nur noch auf 19 Grad. Damit die Mitarbeiter sich dennoch wohlfühlen, greifen die Landesbank Hessen-Thüringen (Hel… [+1484 chars]",,de,'Energieversorgung'
https://www.sueddeutsche.de/muenchen/muenchen-buergerentscheid-gruenflaechen-umsetzung-1.5744876,https://www.sueddeutsche.de/muenchen/muenchen-buergerentscheid-gruenflaechen-umsetzung-1.5744876,0,www.sueddeutsche.de,Direkte Demokratie: Das wurde aus Münchens Bürgerbegehren,"Die Politik übernimmt die Forderungen von ""Grünflächen erhalten"" - ein Sieg auf ganzer Linie für die Initiatoren? Ein Blick auf frühere Abstimmungen zeigt, so einfach ist das nicht. Vom Radentscheid über die Hochhausfrage bis zum Kohleausstieg: Wird Volkes Wi…",https://www.sueddeutsche.de/assets/png/sz-ecb090256670a577bd629a9718686332.png,2023-02-03T15:39:44Z,,"Die Politik übernimmt die Forderungen von ""Grünflächen erhalten"" - ein Sieg auf ganzer Linie für die Initiatoren? Ein Blick auf frühere Abstimmungen zeigt, so einfach ist das nicht. Vom Radentscheid … [+7459 chars]",,de,'Kohleausstieg'
https://www.nzz.ch/feuilleton/presseschau-des-wahnsinns-was-russische-medien-berichten-ld.1723979,https://www.nzz.ch/feuilleton/presseschau-des-wahnsinns-was-russische-medien-berichten-ld.1723979,0,www.nzz.ch,Presseschau des Wahnsinns: «Russland befindet sich nicht im Krieg mit der Ukraine – die ganze Geschichte wurde in Washington DC eingefädelt»,"Die Schriftstellerin Irina Rastorgujewa hat einen Monat lang russische Medien gelesen. Sie stiess dabei auf unfassbare Absurditäten: Für Kinder gibt es bei einem Sportspiel Gasmasken als Preis. Tote Soldaten gibt es angeblich fast keine, aber Putin fördert di…","https://img.nzz.ch/2023/02/02/0457d36f-2ee7-49f8-b6e1-414a9967d9e0.jpeg?width=1200&height=675&fit=bound&quality=75&auto=webp&crop=5472,3078,x0,y285&wmark=nzz",2023-02-04T04:30:00Z,https://web.archive.org/web/20230204044119/https://www.nzz.ch/feuilleton/presseschau-des-wahnsinns-was-russische-medien-berichten-ld.1723979,"Der russische Präsident Wladimir Putin auf dem Bildschirm an einer Fassade des Hotels Salyut in Moskau, im Dezember 2020.
Die russische Realität hat die roten Linien des Absurden seit langem übersch… [+11034 chars]",,de,'Russland Gas'
https://www.zeit.de/news/2023-02/04/spd-fordert-grosse-batteriespeicher-an-akw-standorten,https://www.zeit.de/news/2023-02/04/spd-fordert-grosse-batteriespeicher-an-akw-standorten,0,www.zeit.de,Energieversorgung: SPD fordert große Batteriespeicher an AKW-Standorten,,,2023-02-04T07:58:24Z,https://web.archive.org/web/20230204085216/https://www.zeit.de/news/2023-02/04/spd-fordert-grosse-batteriespeicher-an-akw-standorten,"When browsing with ads:
We collect personal data and also transmit it to third-party providers
 that help us improve and finance our digital content. Some of the information stored on your device, … [+732 chars]",,de,'AKW'
https://www.wiwo.de/politik/konjunktur/unruhe-am-rohstoffmarkt-der-dieselmarkt-duerfte-sich-deutlich-anspannen/28951546.html,https://www.wiwo.de/politik/konjunktur/unruhe-am-rohstoffmarkt-der-dieselmarkt-duerfte-sich-deutlich-anspannen/28951546.html,0,www.wiwo.de,Unruhe am Rohstoffmarkt: „Der Dieselmarkt dürfte sich deutlich anspannen“,Ab Sonntag gilt das EU-Embargo gegen Raffinerieprodukte aus Russland. Rohstoffanalyst Carsten Fritsch über die Folgen für Diesel- und Heizölkäufer – und die Entwicklung des globalen Ölmarktes in den kommenden Monaten.,https://www.wiwo.de/images/imago0168065719h/28959590/2-format11240.jpg,2023-02-04T08:01:30Z,https://web.archive.org/web/20230204153535/https://www.wiwo.de/politik/konjunktur/unruhe-am-rohstoffmarkt-der-dieselmarkt-duerfte-sich-deutlich-anspannen/28951546.html,"WirtschaftsWoche: Herr Fritsch, am 5. Februar tritt das EU-Embargo gegen russischen Diesel in Kraft. Was bedeutet das für die Autofahrer an der Zapfsäule?Carsten Fritsch: Der Dieselpreis dürfte vermu… [+3563 chars]",,de,'Heizöl'
https://www.morgenpost.de/wirtschaft/article237546073/Sinkende-Energiepreise-Deutlich-mehr-Anbieterwechsel.html,https://www.morgenpost.de/wirtschaft/article237546073/Sinkende-Energiepreise-Deutlich-mehr-Anbieterwechsel.html,0,www.morgenpost.de,Strom und Gas: Sinkende Energiepreise: Deutlich mehr Anbieterwechsel,Anbieterwechsel bei Strom und Gas sind 2022 zum Erliegen gekommen. Seit einigen Wochen sind die Großhandelspreise wieder gefallen. Haben Haushalte jetzt wieder mehr Auswahl?,https://img.morgenpost.de/img/wirtschaft/crop237546071/4762609146-w820-cv16_9-q85/Strom.jpg,2023-02-04T08:19:29Z,https://web.archive.org/web/20230204083514/https://www.morgenpost.de/wirtschaft/article237546073/Sinkende-Energiepreise-Deutlich-mehr-Anbieterwechsel.html,"München/Heidelberg. Die Strom- und Gaspreise für Haushalte kannten im Zuge der Energiekrise im vergangenen Jahr zumeist nur eine Richtung: aufwärts. Wer wechseln wollte, hatte oft keinen Erfolg: Viel… [+3825 chars]",,de,'Winter Gas'
https://www.stern.de/wirtschaft/news/strom-und-gas--sinkende-energiepreise--deutlich-mehr-anbieterwechsel-33166372.html,https://www.stern.de/wirtschaft/news/strom-und-gas--sinkende-energiepreise--deutlich-mehr-anbieterwechsel-33166372.html,0,www.stern.de,Strom und Gas: Sinkende Energiepreise: Deutlich mehr Anbieterwechsel,Anbieterwechsel bei Strom und Gas sind 2022 zum Erliegen gekommen. Seit einigen Wochen sind die Großhandelspreise wieder gefallen. Haben Haushalte jetzt wieder mehr Auswahl?,https://image.stern.de/33166374/t/6T/v1/w1440/r1.7778/-/04--urnnewsmldpacom2009010123020499471367v3w800h600l1072t97r2352b950jpeg---b856e2d57762fec3.jpg,2023-02-04T08:19:29Z,https://web.archive.org/web/20230204090318/https://www.stern.de/wirtschaft/news/strom-und-gas--sinkende-energiepreise--deutlich-mehr-anbieterwechsel-33166372.html,"Anbieterwechsel bei Strom und Gas sind 2022 zum Erliegen gekommen. Seit einigen Wochen sind die Großhandelspreise wieder gefallen. Haben Haushalte jetzt wieder mehr Auswahl?
Die Strom- und Gaspreise… [+4012 chars]",,de,'Energiepreise'
https://www.wiwo.de/unternehmen/energie/strom-und-gas-sinkende-energiepreise-fuehren-zu-deutlich-mehr-anbieterwechseln/28963892.html,https://www.wiwo.de/unternehmen/energie/strom-und-gas-sinkende-energiepreise-fuehren-zu-deutlich-mehr-anbieterwechseln/28963892.html,0,www.wiwo.de,Energie: Sinkende Energiepreise führen zu deutlich mehr Anbieterwechseln,Anbieterwechsel bei Strom und Gas sind 2022 vor allem durch die hohen Preise zum Erliegen gekommen. Seit einigen Wochen sind die Großhandelspreise wieder gefallen. Haben Haushalte jetzt wieder mehr Auswahl? Und was ist mit den Preisen?,https://www.wiwo.de/images/strom/28963890/1-format11240.jpg,2023-02-04T08:42:16Z,https://web.archive.org/web/20230204095150/https://www.wiwo.de/unternehmen/energie/strom-und-gas-sinkende-energiepreise-fuehren-zu-deutlich-mehr-anbieterwechseln/28963892.html,"Die Strom- und Gaspreise für Haushalte kannten im Zuge der Energiekrise im vergangenen Jahr zumeist nur eine Richtung: aufwärts. Wer wechseln wollte, hatte oft keinen Erfolg: Viele Neukundenverträge … [+4335 chars]",,de,'Energiepreise'
