index,url,valid,domain,title,description,image,published,archive,content,quote,language,keyword
https://www.morgenpost.de/wirtschaft/article409273315/heizoelpreise-aktuell-heute-18-juni-durchschnitt-heizoel-heizung-verbraucher.html,https://www.morgenpost.de/wirtschaft/article409273315/heizoelpreise-aktuell-heute-18-juni-durchschnitt-heizoel-heizung-verbraucher.html,0,www.morgenpost.de,Heizölpreise heute (18. Juni): Das kostet ein Liter aktuell,"Je höher die Temperaturen, desto niedriger der Heizölpreis? So viel müssen deutsche Haushalte am 18. Juni für einen Liter zahlen.",https://img.sparknews.funkemedien.de/406858449/406858449_1728458201_v16_9_1600.jpeg,2025-06-18T07:40:07Z,,"Berlin. Je höher die Temperaturen, desto niedriger der Heizölpreis? So viel müssen deutsche Haushalte am 18. Juni für einen Liter zahlen.
Auch die dritte Juni-Woche strotzt nur so vor Sonnenschein u… [+7574 chars]",,de,'Heizöl'
https://taz.de/Nach-Blackout-in-Spanien-und-Portugal/!6095081/,https://taz.de/Nach-Blackout-in-Spanien-und-Portugal/!6095081/,0,taz.de,Nach Blackout in Spanien und Portugal: Überspannung ließ Strom ausfallen,Ende April brach die Stromversorgung in Spanien und Portugal völlig zusammen. Nun liegt der Untersuchungsbericht zu den Ursachen vor.,https://taz.de/picture/7760507/1200/38264872-1.jpeg,2025-06-18T09:59:00Z,,Ende April brach die Stromversorgung in Spanien und Portugal völlig zusammen. Nun liegt der Untersuchungsbericht zu den Ursachen vor. mehr...,,de,'Blackout'
https://www.nzz.ch/international/spanischer-blackout-regierung-gibt-netzbetreiber-schuld-ld.1889478,https://www.nzz.ch/international/spanischer-blackout-regierung-gibt-netzbetreiber-schuld-ld.1889478,0,www.nzz.ch,Der Blackout in Spanien war kein Cyberangriff,In einem Untersuchungsbericht macht die Regierung die Netzbetreiber und privaten Stromerzeuger für den Stromausfall verantwortlich. In den darauffolgenden Tagen kam es zu einer erhöhten Sterblichkeit im Land.,"https://img.nzz.ch/2025/06/18/6ea4b72f-12d7-4dc5-8387-e738cb60f4a6.jpeg?width=1200&height=674&fit=bounds&quality=75&auto=webp&crop=6486,3648,x0,y338&wmark=nzz",2025-06-18T14:30:00Z,,"Ein Bus im Madrider Süden am Tag des Stromausfalls.
Fünfzig Tage hat es gedauert bis die spanische Regierung von Ministerpräsident Pedro Sánchez endlich einen Bericht über die Ursachen des den gröss… [+3650 chars]",,de,'Blackout'
https://www.stern.de/wirtschaft/spaniens-blackout--nicht-solaranlagen--die-netzbetreiber-waren-schuld-35820586.html,https://www.stern.de/wirtschaft/spaniens-blackout--nicht-solaranlagen--die-netzbetreiber-waren-schuld-35820586.html,0,www.stern.de,"Spanien: Blackout: Nicht Solaranlagen, die Netzbetreiber waren schuld","Der Blackout in Spanien war vermeidbar, erklärt die dortige Regierung. Schuld sei weder die Solarenergie, noch Cyberattacken. Aber das ist noch nicht das letzte Wort.",https://image.stern.de/35820808/t/w5/v1/w1440/r1.7778/-/blackout-in-spanien.jpg,2025-06-18T16:53:00Z,,"Kopiere den aktuellen Link
Zur Merkliste hinzufügen
Der Blackout in Spanien war vermeidbar, erklärt die dortige Regierung. Schuld sei weder die Solarenergie, noch Cyberattacken. Aber das ist noch n… [+7769 chars]",,de,'Blackout'
https://www.sueddeutsche.de/wissen/stromausfall-spanien-ursachen-analyse-li.3270997,https://www.sueddeutsche.de/wissen/stromausfall-spanien-ursachen-analyse-li.3270997,0,www.sueddeutsche.de,Spanien: Blackout bei der Ursachenforschung,"Wie kam es zum Stromausfall auf der iberischen Halbinsel? Ein Untersuchungsbericht macht klar, dass die sogenannte Blindleistung die entscheidende Rolle spielte. Die Schuldfrage ist indes noch offen.",https://www.sueddeutsche.de/2025/04/29/2439a892-0982-4d19-8083-a10099222752.jpeg?q=60&fm=webp&width=1200&rect=0%2C394%2C4000%2C2250,2025-06-18T18:10:31Z,,"Wasserstoff, so heißt es immer wieder, ist der Energieträger einer klimaneutralen Zukunft. Aber der Aufbau der nötigen Infrastruktur kommt einfach nicht in Gang. Fünf Gründe, warum es hakt und wie es… [+41 chars]",,de,'Blackout'
https://www.n-tv.de/politik/16-33-Journalist-Irans-Internet-Blackout-ist-Kriegsverbrechen--article25831358.html,https://www.n-tv.de/politik/16-33-Journalist-Irans-Internet-Blackout-ist-Kriegsverbrechen--article25831358.html,0,www.n-tv.de,Nahost-Krieg im Liveticker: +++ 16:33 Journalist: Irans Internet-Blackout ist Kriegsverbrechen +++,"Berlin, Washington, Brüssel - überall. ntv berichtet von allen wichtigen Schauplätzen der Innen- und Außenpolitik.",https://www.n-tv.de/img/incoming/crop25833554/8381321819-cImg_16_9-w1200/2025-06-13T185013Z-487992522-RC2U1FAUB14T-RTRMADP-3-IRAN-NUCLEAR-ISRAEL.jpg,2025-06-18T22:13:00Z,,"Das lahmgelegte Internet im Iran ist laut dem Journalisten Bamdad Esmaili, der dort selbst Angehörige hat, für Landsleute im Ausland kaum zu ertragen. Auch die erzwungene Flucht aus Teheran stellt di… [+24128 chars]",,de,'Blackout'
https://www.n-tv.de/politik/Iraner-seit-ueber-zwoelf-Stunden-im-Internet-Blackout-article25844772.html,https://www.n-tv.de/politik/Iraner-seit-ueber-zwoelf-Stunden-im-Internet-Blackout-article25844772.html,0,www.n-tv.de,Von der Außenwelt abgeschnitten: Iraner seit über zwölf Stunden im Internet-Blackout,"Das Regime in Teheran schränkt den Zugang zum Internet in kritischen Situationen oft ein: Nachdem der Iran die Verbindungen bereits vor wenigen Tagen drosselt, ist das Land jetzt fast vollständig offline. Die Regierung begründet den Schritt mit einem Missbrau…",https://www.n-tv.de/img/incoming/crop25844783/8601321674-cImg_16_9-w1200/531278864.jpg,2025-06-19T08:23:21Z,,"Das Regime in Teheran schränkt den Zugang zum Internet in kritischen Situationen oft ein: Nachdem der Iran die Verbindungen bereits vor wenigen Tagen drosselt, ist das Land jetzt fast vollständig off… [+1614 chars]",,de,'Blackout'
https://www.zeit.de/news/2025-06/19/meyer-ueber-borkum-bund-verteilt-geschenke-an-gaskonzerne,https://www.zeit.de/news/2025-06/19/meyer-ueber-borkum-bund-verteilt-geschenke-an-gaskonzerne,0,www.zeit.de,Umstrittene Gasförderung: Meyer über Borkum: Bund verteilt Geschenke an Gaskonzerne,Hier finden Sie Informationen zu dem Thema „Umstrittene Gasförderung“. Lesen Sie jetzt „Meyer über Borkum: Bund verteilt Geschenke an Gaskonzerne“.,https://img.zeit.de/news/2025-06/19/meyer-ueber-borkum-bund-verteilt-geschenke-an-gaskonzerne-image-group/wide__1300x731,2025-06-19T09:44:55Z,,Die Bundesregierung will für die umstrittene Gasförderung vor der Nordseeinsel Borkum nach Angaben aus Niedersachsen ein Abkommen mit den Niederlanden schließen. Die Eile in der Frage sei ungewöhnlic… [+4361 chars],,de,'Gasmangel'
https://www.stern.de/gesellschaft/regional/niedersachsen-bremen/umstrittene-gasfoerderung--meyer-ueber-borkum--bund-verteilt-geschenke-an-gaskonzerne-35822656.html,https://www.stern.de/gesellschaft/regional/niedersachsen-bremen/umstrittene-gasfoerderung--meyer-ueber-borkum--bund-verteilt-geschenke-an-gaskonzerne-35822656.html,0,www.stern.de,Umstrittene Gasförderung: Meyer über Borkum: Bund verteilt Geschenke an Gaskonzerne,"Ein deutsch-niederländisches Abkommen soll die Gasförderung vor Borkum regeln. Das wolle die neue Bundesregierung jetzt eilig auf den Weg bringen, kritisiert Umweltminister Meyer.",https://image.stern.de/35822658/t/jR/v1/w1440/r1.7778/-/19--mkqyo7oyyqv4axs2048jpeg---fe1af4536b3d70cc.jpg,2025-06-19T09:44:55Z,,"Kopiere den aktuellen Link
Zur Merkliste hinzufügen
Ein deutsch-niederländisches Abkommen soll die Gasförderung vor Borkum regeln. Das wolle die neue Bundesregierung jetzt eilig auf den Weg bringen… [+4556 chars]",,de,'Gasmangel'
https://www.golem.de/sonstiges/zustimmung/auswahl.html?from=https://www.golem.de/news/analyse-des-stromausfalls-in-spanien-in-30-sekunden-zum-voelligen-blackout-2506-197287.html&referer=https://t.co/243012d5be,https://www.golem.de/sonstiges/zustimmung/auswahl.html?from=https://www.golem.de/news/analyse-des-stromausfalls-in-spanien-in-30-sekunden-zum-voelligen-blackout-2506-197287.html&referer=https://t.co/243012d5be,0,www.golem.de,Analyse des Stromausfalls in Spanien: In 30 Sekunden zum völligen Blackout,"Nach der spanischen Regierung hat nun der Netzbetreiber eine Analyse des Blackouts vorgelegt. Diese zeigt Probleme bei Netzkomponenten und unerklärliche Abschaltungen. Ein Bericht von Friedhelm Greis (Blackout, Strom)",,2025-06-19T13:03:02Z,,"Besuchen Sie Golem.de wie gewohnt mit Werbung und Tracking,
 indem Sie der Nutzung aller Cookies zustimmen.
 Details zum Tracking finden Sie im Privacy Center.
Skript wurde nicht geladen. Informat… [+607 chars]",,de,'Blackout'
https://www.focus.de/finanzen/news/gaspreise-steigen-leser-debattieren-ueber-deutsche-energiepolitik_a22e7f96-1cf9-4347-b4cc-34fb8a27d23b.html,https://www.focus.de/finanzen/news/gaspreise-steigen-leser-debattieren-ueber-deutsche-energiepolitik_a22e7f96-1cf9-4347-b4cc-34fb8a27d23b.html,0,www.focus.de,Gaspreise steigen: Leser debattieren über deutsche Energiepolitik,"Israel-Iran-Konflikt und Energiekrise: Leser kritisieren deutsche Politik, fordern billiges russisches Gas oder den beschleunigten Umstieg auf erneuerbare Energien.",https://quadro.burda-forward.de/ctf/9e7e8efa-00d9-44b1-b71b-fbcac0cb1bb7.32b6e356-9eef-41f2-82f8-df3c6e1d7634.jpeg?im=RegionOfInterestCrop%3D%281200%2C630%29%2CregionOfInterest%3D%28320%2C180%29&hash=5623f19acdf2cb65b923fd95c3bf6b5bb2d04f34c2ce2fbc0f1dc407425d6848,2025-06-20T09:09:18Z,,"Die Sorge vor steigenden Heizkosten ist zurück: Deutsche Gasspeicher füllen sich dieses Jahr auffällig langsam, während neue Spannungen zwischen Israel und Iran die Energiemärkte verunsichern. Was be… [+5398 chars]",,de,'Energiekrise'
https://www.stern.de/politik/deutschland/klingbeils-milliarden-mogelplan--gasspeicherumlage-soll-weg-35825740.html,https://www.stern.de/politik/deutschland/klingbeils-milliarden-mogelplan--gasspeicherumlage-soll-weg-35825740.html,0,www.stern.de,Gasspeicherumlage: Klingbeils Milliarden-Mogelplan,Mit einer kleinen Gesetzesänderung will Minister Klingbeil die teure Gasbeschaffung zur Klimamaßnahme umdeklarieren. Zahlen müssten nicht mehr nur Gaskunden.,https://image.stern.de/35825742/t/Rl/v3/w1440/r1.7778/-/lars-klingbeil.jpg,2025-06-20T10:19:00Z,,"Kopiere den aktuellen Link
Zur Merkliste hinzufügen
Mit einer kleinen Gesetzesänderung will Minister Klingbeil die teure Gasbeschaffung zur Klimamaßnahme umdeklarieren. Zahlen müssten nicht mehr nu… [+5033 chars]",,de,'Energiekrise'
