index,url,valid,domain,title,description,image,published,archive,content,quote,language,keyword
https://www.bild.de/regional/hamburg/hamburg-aktuell/gasleitung-angebohrt-lng-pipeline-in-schleswig-holstein-sabotiert-86631212.bild.html,https://www.bild.de/regional/hamburg/hamburg-aktuell/gasleitung-angebohrt-lng-pipeline-in-schleswig-holstein-sabotiert-86631212.bild.html,0,www.bild.de,Gasleitung angebohrt! - LNG-Pipeline in Schleswig-Holstein sabotiert,Die Flüssigerdgasleitung zwischen Brunsbüttel und Hetlingen wurde an mehreren Stellen offenbar mutwillig beschädigt. Ein Fall für die Bundesanwaltschaft.,"https://images.bild.de/65969110d0a5d36f1f3551e9/76183ebb5afbd9e63c548880ca1a7691,45e910cc?w=1280",2024-01-04T16:08:11Z,,"Brunsbüttel (Schleswig-Holstein) Es ist ein Fall für die Bundesanwaltschaft.
Die Sicherheitsbehörde des Bundes nimmt immer dann die Arbeit auf, wenn es um Spionage oder um Terrorismus geht. Jetzt er… [+2208 chars]",,de,'LNG'
https://www.n-tv.de/wissen/Deutsches-Team-produziert-Solarzellen-aus-Mondstaub-article24638076.html,https://www.n-tv.de/wissen/Deutsches-Team-produziert-Solarzellen-aus-Mondstaub-article24638076.html,0,www.n-tv.de,Für bemannte Mondbasis: Deutsches Team produziert Solarzellen aus Mondstaub,"Um eine bemannte Mondbasis zu realisieren, ist eine Energieversorgung vor Ort unverzichtbar. Berliner Forschende und eine Braunschweiger Firma entwickeln dafür ein Verfahren, um Solarzellen aus Mondstaub herzustellen. Sie sind nicht allein, ein von Jeff Bezos…",https://bilder3.n-tv.de/img/incoming/crop24639518/4161322252-cImg_16_9-w1200/1999-07-14T120000Z-100877504-RP1DRILCJCAB-RTRMADP-3-SPACE-APOLLO.jpg,2024-01-04T17:17:42Z,,"Um eine bemannte Mondbasis zu realisieren, ist eine Energieversorgung vor Ort unverzichtbar. Berliner Forschende und eine Braunschweiger Firma entwickeln dafür ein Verfahren, um Solarzellen aus Monds… [+5185 chars]",,de,'Energieversorgung'
https://taz.de/Inflation-2023/!5983686/,https://taz.de/Inflation-2023/!5983686/,0,taz.de,Inflation 2023: Verbraucher haben draufgezahlt,"Die allgemeine Teuerungsrate betrug im vergangenen Jahr 5,9 Prozent. Ein Sozialverband fordert einen höheren Mindestlohn sowie Rentensteigerungen.",https://taz.de/picture/6746221/948/34320459-1.jpeg,2024-01-04T17:23:00Z,,"Die allgemeine Teuerungsrate betrug im vergangenen Jahr 5,9 Prozent. Ein Sozialverband fordert einen höheren Mindestlohn sowie Rentensteigerungen.
Die Sorgen von Millionen Menschen mit kleinem Geldb… [+3907 chars]",,de,'Olaf Scholz Gas'
https://www.jungewelt.de/artikel/466503.energiekrise-brandstifter-beim-löschen.html,https://www.jungewelt.de/artikel/466503.energiekrise-brandstifter-beim-löschen.html,0,www.jungewelt.de,Energiekrise: Brandstifter beim Löschen,Jahresrückblick 2023. Deutsche Wirtschaft. Rutschpartie in die Bedeutungslosigkeit.,https://www.jungewelt.de/img/1100/189638.jpg,2024-01-04T18:35:13Z,,"Egal, welche Zahlen das Statistische Bundesamt im Frühjahr verkündet: Deutschlands Wirtschaft steckt in der Krise. Die nach nominalem Bruttoinlandsprodukt noch viertgrößte Volkswirtschaft der Welt is… [+4537 chars]",,de,'Olaf Scholz Gas'
https://www.n-tv.de/politik/17-30-Finnland-will-Einfuhr-von-russischem-Gas-ab-2025-verbieten--article23143824.html,https://www.n-tv.de/politik/17-30-Finnland-will-Einfuhr-von-russischem-Gas-ab-2025-verbieten--article23143824.html,0,www.n-tv.de,Ukraine-Krieg im Liveticker: +++ 17:30 Finnland will Einfuhr von russischem Gas ab 2024 verbieten +++,Lesen Sie alle aktuellen Entwicklungen und Nachrichten über den russischen Angriffskrieg auf die Ukraine im Liveticker von ntv.de.,https://bilder2.n-tv.de/img/incoming/crop23332537/9041326157-cImg_16_9-w1200/Liveticker1-grau-1-Kopie.jpg,2024-01-04T23:06:00Z,,"Finnland plant, die Einfuhr von russischem Flüssigerdgas (LNG) ab dem nächsten Jahr zu verbieten, sagt der finnische Umweltminister Kai Mykkänen der Zeitung ""Helsingin Sanomat"". Die Gewinne aus fossi… [+27361 chars]",,de,'russisches Gas'
https://www.morgenpost.de/wirtschaft/article240909648/heizoelpreise-aktuell-heute-5-januar-2024-heizoel-kaufen-heizung-CO2-Kosten.html,https://www.morgenpost.de/wirtschaft/article240909648/heizoelpreise-aktuell-heute-5-januar-2024-heizoel-kaufen-heizung-CO2-Kosten.html,0,www.morgenpost.de,Heizölpreise aktuell: Der Preis je Liter heute am 5. Januar,Der CO2-Preis ist zum neuen Jahr gestiegen. ○ Wirkt sich das auf die Heizölpreise aus? ○ Das ist der aktuelle Preis je Liter heute am 5. Januar.,https://img.sparknews.funkemedien.de/238144069/238144069_1681477675_v4_3_800.jpeg,2024-01-05T07:27:00Z,,"Berlin. Der CO2-Preis ist gestiegen wirkt sich das bereits auf die Heizölpreise aus? Das ist der heutige Preis je Liter am 5. Januar.
Das neue Jahr ist da und die Heizölpreise bewegen sich seitwärts… [+9768 chars]",,de,'Heizöl'
https://www.stern.de/gesellschaft/regional/mecklenburg-vorpommern/energie--verwaltung-haelt-begehren-gegen-lng-terminal-fuer-unzulaessig-34339630.html,https://www.stern.de/gesellschaft/regional/mecklenburg-vorpommern/energie--verwaltung-haelt-begehren-gegen-lng-terminal-fuer-unzulaessig-34339630.html,0,www.stern.de,Energie: Verwaltung hält Begehren gegen LNG-Terminal für unzulässig,Schon lange haben die Initiatoren eines Bürgerbegehrens gegen das Rügener LNG-Terminal auf eine Entscheidung zur Zulässigkeit ihres Vorhabens gewartet. Das Ergebnis dürfte bei ihnen für Unmut sorgen.,https://image.stern.de/34339632/t/Zu/v1/w1440/r1.7778/-/05--urnnewsmldpacom2009010124010599499707v2w800h600l878t597r2643b1791jpeg---02b90370c2443ebd.jpg,2024-01-05T09:08:34Z,,Schon lange haben die Initiatoren eines Bürgerbegehrens gegen das Rügener LNG-Terminal auf eine Entscheidung zur Zulässigkeit ihres Vorhabens gewartet. Das Ergebnis dürfte bei ihnen für Unmut sorgen.… [+2190 chars],,de,'LNG-Terminal'
https://www.zeit.de/news/2024-01/05/verwaltung-haelt-begehren-gegen-lng-terminal-fuer-unzulaessig,https://www.zeit.de/news/2024-01/05/verwaltung-haelt-begehren-gegen-lng-terminal-fuer-unzulaessig,0,www.zeit.de,Energie: Verwaltung hält Begehren gegen LNG-Terminal für unzulässig,Hier finden Sie Informationen zu dem Thema „Energie“. Lesen Sie jetzt „Verwaltung hält Begehren gegen LNG-Terminal für unzulässig“.,https://img.zeit.de/news/2024-01/05/verwaltung-haelt-begehren-gegen-lng-terminal-fuer-unzulaessig-image-group/wide__1300x731,2024-01-05T09:08:34Z,,Ein gegen das Rügener LNG-Terminal gerichtetes Bürgerbegehren ist nach Rechtsauffassung der Stadtverwaltung von Sassnitz unzulässig. Eine nun veröffentlichte Vorlage für eine außerplanmäßige Stadtver… [+2819 chars],,de,'LNG-Terminal'
https://www.tagesspiegel.de/politik/deutschland-spart-gasverbrauch-sank-2023-um-funf-prozent-11006842.html,https://www.tagesspiegel.de/politik/deutschland-spart-gasverbrauch-sank-2023-um-funf-prozent-11006842.html,0,www.tagesspiegel.de,Deutschland spart: Gasverbrauch sank 2023 um fünf Prozent,Laut Bundesnetzagentur haben allein private Haushalte und Gewerbe 16 Prozent Gas im Vergleich zum vorherigen Durchschnittsverbrauch eingespart. Die Speicher seien gut gefüllt.,https://www.tagesspiegel.de/images/gaszahler-gaspreis-gas-meter-gas-price/alternates/BASE_16_9_W1400/gaszaehler-gaspreis--gas-meter-gas-price.jpeg,2024-01-05T09:52:20Z,,"Deutschland hat im vergangenen Jahr nach Angaben der Bundesnetzagentur viel Gas gespart. Im Vergleich zum Vorjahr sank der Gasverbrauch um fünf Prozent auf gut 810 Terawattstunden, wie die Behörde am… [+2067 chars]",,de,'Bundesnetzagentur'
https://www.zeit.de/news/2024-01/05/ihk-luebeck-will-buerokratieabbau-und-niedrigere-energiepreise,https://www.zeit.de/news/2024-01/05/ihk-luebeck-will-buerokratieabbau-und-niedrigere-energiepreise,0,www.zeit.de,Konjunktur: IHK Lübeck will Bürokratieabbau und niedrigere Energiepreise,Hier finden Sie Informationen zu dem Thema „Konjunktur“. Lesen Sie jetzt „IHK Lübeck will Bürokratieabbau und niedrigere Energiepreise“.,https://img.zeit.de/news/2024-01/05/ihk-luebeck-will-buerokratieabbau-und-niedrigere-energiepreise-image-group/wide__1300x731,2024-01-05T11:28:01Z,,"Die Industrie- und Handelskammer (IHK) zu Lübeck fordert den Abbau bürokratischer Hürden und gesetzlicher Auflagen für die Wirtschaft. Damit Deutschland auf den Wachstumspfad zurückkehren könne, müss… [+2037 chars]",,de,'Energiepreise'
https://www.dw.com/de/aus-f%C3%BCr-die-co2-schleudern-auf-see/a-67896733,https://www.dw.com/de/aus-f%C3%BCr-die-co2-schleudern-auf-see/a-67896733,0,www.dw.com,Aus für die CO2-Schleudern auf See?,"Die Dekarbonisierung der Schifffahrt wird jetzt auch von Kunden gefordert. LNG-Antriebe gibt es bereits - Methanol ist im Trend, Ammoniak im Gespräch. Doch die Frage ist: Was kommt nach Schweröl und Marine-Diesel? Segel setzen und die Flotte hart am Wind zurü…",https://static.dw.com/image/59709086_6.jpg,2024-01-05T13:02:00Z,,"Segel setzen und die Flotte hart am Wind zurück in die Zukunft steuern? Der kürzlich vom US-Konzern Cargill erstmals live erprobte Rohstoff-Frachter ""Pyxis Ocean"" wurde mit klappbaren Segeln aus Stah… [+5856 chars]",,de,'LNG'
https://www.stern.de/politik/energieexperte-manuel-frondel---weg-mit-stromsteuer-und-netzentgelt---34337590.html,https://www.stern.de/politik/energieexperte-manuel-frondel---weg-mit-stromsteuer-und-netzentgelt---34337590.html,0,www.stern.de,Energiewende: Ökonom Frondel: So können Haushalte sofort 400 Euro Stromkosten sparen,"Manuel Frondel, Ökonom am Essener RWI-Leibniz-Institut für Wirtschaftsforschung, erklärt, wie der Staat die Privathaushalte bei den Energiekosten drastisch entlasten könnte. Seine Forderung: Stromsteuer sofort senken, Netzentgelte abschaffen!",https://image.stern.de/34337700/t/S1/v10/w1440/r1.7778/-/manuel-frondel-0257.jpg,2024-01-05T13:12:00Z,,"05.01.2024, 14:12
 6 Min.
Manuel Frondel, Ökonom am Essener RWI-Leibniz-Institut für Wirtschaftsforschung, erklärt, wie der Staat die Privathaushalte bei den Energiekosten drastisch entlasten könnt… [+3157 chars]",,de,'Energiekosten'
https://www.zeit.de/wirtschaft/2024-01/euroraum-inflation-energiepreise-deutschland,https://www.zeit.de/wirtschaft/2024-01/euroraum-inflation-energiepreise-deutschland,0,www.zeit.de,"Energiepreise: Inflation in Eurozone steigt im Dezember auf 2,9 Prozent",Nach vorheriger Entspannung hat die Teuerung in den Euroländern zum Jahresende wieder zugelegt. Der Anstieg war erwartet worden – die Ursache liegt in Deutschland.,https://img.zeit.de/wirtschaft/2024-01/euroraum-inflation-energiepreise-deutschland-bild/wide__1300x731,2024-01-05T14:04:35Z,,"Die Inflation im 20 Länder fassenden Euroraum ist im Dezember 2023 wieder gestiegen. Nach 2,4 Prozent im November stiegen die Verbraucherpreise im Dezember um 2,9 Prozent gegenüber dem Vorjahresmonat… [+4550 chars]",,de,'Energiepreise'
https://taz.de/LNG-Boom-in-den-USA/!5975624/,https://taz.de/LNG-Boom-in-den-USA/!5975624/,0,taz.de,LNG-Boom in den USA: Ein schmutziges Geschäft,Die Flüssiggas-Industrie bringt Arbeitsplätze nach Louisiana – und zerstört Umwelt und Gesundheit der Menschen. Auch deutsche Firmen sind beteiligt.,https://taz.de/picture/6745255/948/34356065-1.jpeg,2024-01-05T16:22:00Z,,Travis Dardar ist mit hoher Wahrscheinlichkeit der bekannteste Krabbenfischer von Louisiana. An einem sonnigen Nachmittag navigiert der bullige Mann mit den freundlichen Augen sein Boot auf dem Calca… [+16811 chars],,de,'LNG'
https://www.morgenpost.de/politik/article241359256/Netzagentur-Chef-Deutsche-muessen-nicht-mehr-so-sparsam-sein.html,https://www.morgenpost.de/politik/article241359256/Netzagentur-Chef-Deutsche-muessen-nicht-mehr-so-sparsam-sein.html,0,www.morgenpost.de,Netzagentur-Chef: Deutsche müssen nicht mehr so sparsam sein,"Die kalten Tage stehen noch bevor – und Klaus Müller hat gute Nachrichten: Wer es mollig warm haben will, löst in diesem Winter keine Gasnotlage mehr aus.",https://img.sparknews.funkemedien.de/240899086/240899086_1703868018_v4_3_800.jpeg,2024-01-05T20:00:38Z,,"Berlin. Kalte Tage stehen bevor und Klaus Müller hat gute Nachrichten: Wer es mollig warm haben will, löst keine Gasnotlage aus.
Der Präsident der Bundesnetzagentur, Klaus Müller, erwartet von den V… [+2443 chars]",,de,'Winter Gas'
https://www.morgenpost.de/politik/article241359268/Prioritaet-hat-dass-im-Land-nicht-die-Lichter-ausgehen.html,https://www.morgenpost.de/politik/article241359268/Prioritaet-hat-dass-im-Land-nicht-die-Lichter-ausgehen.html,0,www.morgenpost.de,"„Priorität hat, dass im Land nicht die Lichter ausgehen“","Klaus Müller erklärt im Interview, ob die Deutschen noch Gas sparen müssen, wann Erneuerbare unseren Energiebedarf decken und was das Heizungsgesetz bringt.",https://img.sparknews.funkemedien.de/241359266/241359266_1704484842_v4_3_800.jpeg,2024-01-05T20:00:42Z,,"Bonn. Netzagentur-Chef Klaus Müller erklärt, ob die Deutschen noch Gas sparen müssen und wer jetzt einen Schornsteinfeger anrufen sollte.
Es ist kalt im Konferenzraum der Bundesnetzagentur, der wich… [+222 chars]",,de,'Gas Erneuerbare'
https://www.welt.de/wirtschaft/article249384502/Netzagentur-Chef-Mueller-Forderung-nach-mehr-Regulierung-bei-Online-Plattformen.html,https://www.welt.de/wirtschaft/article249384502/Netzagentur-Chef-Mueller-Forderung-nach-mehr-Regulierung-bei-Online-Plattformen.html,0,www.welt.de,Forderung nach mehr Regulierung bei Online-Plattformen,Der neue Digital Service Act der EU soll ab Februar in Deutschland umgesetzt werden. Er sieht eine regulierung von Online-Plattformen vor. Der Chef der Netzagentur spricht von mehr Schutz vor Hassrede und Fake-News – und sieht neue Hebel bei Verstößen.,https://img.welt.de/img/bildergalerien/mobile249384572/0401357377-ci16x9-w1200/Bundesnetzagentur-Klaus-Mueller.jpg,2024-01-06T00:07:28Z,,"Der Präsident der Bundesnetzagentur, Klaus Müller, sieht die neue Rolle der Behörde als Internetplattform-Regulierer als Herausforderung. Es gibt keine geregelten etablierten Verfahren, um das, was a… [+2003 chars]",,de,'Netzagentur'
https://www.stern.de/wirtschaft/news/energie--netzagentur-sieht-gaslage-entspannt---keine-kaelteren-duschen-34341860.html,https://www.stern.de/wirtschaft/news/energie--netzagentur-sieht-gaslage-entspannt---keine-kaelteren-duschen-34341860.html,0,www.stern.de,Energie: Netzagentur sieht Gaslage entspannt - keine kälteren Duschen,Die Temperaturen sinken und Deutschland verbraucht mehr Gas als im vergangenen Winter. Doch die Netzagentur ruft Verbraucher nicht mehr zum Runterdrehen der Heizung auf.,https://image.stern.de/34341862/t/9k/v1/w1440/r1.7778/-/06--urnnewsmldpacom2009010124010699507675v3w800h600l903t40r2183b862jpeg---94937877c9d055a8.jpg,2024-01-06T00:12:57Z,,"Die Temperaturen sinken und Deutschland verbraucht mehr Gas als im vergangenen Winter. Doch die Netzagentur ruft Verbraucher nicht mehr zum Runterdrehen der Heizung auf.
Die Bundesnetzagentur sieht … [+1581 chars]",,de,'Winter Gas'
https://www.zeit.de/news/2024-01/06/netzagentur-sieht-gaslage-entspannt-keine-kaelteren-duschen,https://www.zeit.de/news/2024-01/06/netzagentur-sieht-gaslage-entspannt-keine-kaelteren-duschen,0,www.zeit.de,Energie: Netzagentur sieht Gaslage entspannt - keine kälteren Duschen,Hier finden Sie Informationen zu dem Thema „Energie“. Lesen Sie jetzt „Netzagentur sieht Gaslage entspannt - keine kälteren Duschen“.,https://img.zeit.de/news/2024-01/06/netzagentur-sieht-gaslage-entspannt-keine-kaelteren-duschen-image-group/wide__1300x731,2024-01-06T00:12:57Z,,"Die Bundesnetzagentur sieht den Gasverbrauch in Deutschland in der Mitte der Heizperiode entspannt. «Die Bundesnetzagentur ruft nicht dazu auf, kälter zu duschen oder die Heizung runterzudrehen. Das … [+2017 chars]",,de,'Netzagentur'
https://www.focus.de/finanzen/news/energie-netzagentur-sieht-gaslage-entspannt-keine-kaelteren-duschen_id_259552446.html,https://www.focus.de/finanzen/news/energie-netzagentur-sieht-gaslage-entspannt-keine-kaelteren-duschen_id_259552446.html,0,www.focus.de,Energie - Netzagentur sieht Gaslage entspannt - keine kälteren Duschen,Die Temperaturen sinken und Deutschland verbraucht mehr Gas als im vergangenen Winter. Doch die Netzagentur ruft Verbraucher nicht mehr zum Runterdrehen der Heizung auf.,https://p6.focus.de/img/finanzen/news/id_259552445/kaelter-duschen-oder-die-heizung-runterdrehen-laut-der-bundesnetzagentur-muss-das-nicht-mehr-sein..jpg?im=Crop%3D%280%2C145%2C2048%2C1024%29%3BResize%3D%281200%2C627%29&impolicy=perceptual&quality=mediumHigh&hash=92c08277489333a765d95ece5eab40fde66d7898611d72035e176298aa618515,2024-01-06T00:20:04Z,,"Die Bundesnetzagentur sieht den Gasverbrauch in Deutschland in der Mitte der Heizperiode entspannt. «Die Bundesnetzagentur ruft nicht dazu auf, kälter zu duschen oder die Heizung runterzudrehen. Das … [+1361 chars]",,de,'Netzagentur'
https://www.welt.de/wirtschaft/article249386360/Bundesnetzagentur-Erneuerbare-koennen-den-Strombedarf-komplett-decken.html,https://www.welt.de/wirtschaft/article249386360/Bundesnetzagentur-Erneuerbare-koennen-den-Strombedarf-komplett-decken.html,0,www.welt.de,"Erneuerbare können den Strombedarf komplett decken, sagt die Netzagentur","Der Chef der Bundesnetzagentur zeigt sich optimistisch, was die Versorgung des Landes mit regenerativen Energien angeht. Gleichzeitig sagt er, in Deutschland werde es immer Dunkelflauten ohne Wind und Sonne geben. Bei der Gasversorgung gibt sich die Agentur e…",https://img.welt.de/img/bildergalerien/mobile249386352/2751354037-ci16x9-w1200/Schnelle-Verfahren-minimale-Buerokratie.jpg,2024-01-06T01:31:28Z,,"Der Präsident der Bundesnetzagentur, Klaus Müller, hält es für möglich, dass Deutschland seinen Energiebedarf zu 100 Prozent aus Erneuerbaren Energien deckt. Im vergangenen Jahr haben wir erstmals üb… [+2086 chars]",,de,'Gas Erneuerbare'
https://www.n-tv.de/wirtschaft/Deutschlands-Gasverbrauch-steigt-um-sechs-Prozent-article24642902.html,https://www.n-tv.de/wirtschaft/Deutschlands-Gasverbrauch-steigt-um-sechs-Prozent-article24642902.html,0,www.n-tv.de,Trotzdem kein Sparaufruf: Deutschlands Gasverbrauch steigt um sechs Prozent,In Deutschland wird wieder mehr Gas verbraucht als im vergangenen Winter. Bei der Bundesnetzagentur sieht man die Lage trotzdem entspannt. Niemand müsse in diesem Winter die Heizung runterdrehen - zumindest nicht wegen eines drohenden Gasmangels.,https://bilder2.n-tv.de/img/incoming/crop24642901/4521325753-cImg_16_9-w1200/431491960.jpg,2024-01-06T02:27:20Z,,In Deutschland wird wieder mehr Gas verbraucht als im vergangenen Winter. Bei der Bundesnetzagentur sieht man die Lage trotzdem entspannt. Niemand müsse in diesem Winter die Heizung runterdrehen - zu… [+1995 chars],,de,'Winter Gas'
https://stadt-bremerhaven.de/erneuerbare-energien-wachstum-im-jahr-2023/,https://stadt-bremerhaven.de/erneuerbare-energien-wachstum-im-jahr-2023/,0,stadt-bremerhaven.de,Erneuerbare Energien: Wachstum im Jahr 2023,"Die Bundesnetzagentur hat erste Daten zum Anstieg der erneuerbaren Energien für das Jahr 2023 veröffentlicht. Es wurde eine Zunahme der installierten Kapazität von erneuerbaren Energieanlagen um 17 Gigawatt gemessen, was eine Gesamtkapazität von etwa 170 Giga…",https://stadt-bremerhaven.de/wp-content/uploads/2023/06/Solarzelle-Dach.jpg,2024-01-06T16:00:54Z,,Die Bundesnetzagentur hat erste Daten zum Anstieg der erneuerbaren Energien für das Jahr 2023 veröffentlicht. Es wurde eine Zunahme der installierten Kapazität von erneuerbaren Energieanlagen um 17 G… [+2092 chars],,de,'Bundesnetzagentur'
https://www.welt.de/politik/deutschland/article249390550/CSU-Warum-viele-ihr-nicht-abnehmen-Gegenentwurf-der-Ampel-zu-sein.html,https://www.welt.de/politik/deutschland/article249390550/CSU-Warum-viele-ihr-nicht-abnehmen-Gegenentwurf-der-Ampel-zu-sein.html,0,www.welt.de,"Warum viele der CSU nicht abnehmen, „Gegenentwurf der Ampel“ zu sein","Bei der Klausur der CSU-Landesgruppe im Kloster Seeon präsentieren die Christsozialen ihre Pläne für einen Politikwechsel, von Verteidigungs-, über Migrations- bis zur Energiepolitik. Vieles klingt vernünftig, aber weckt bei Wählern mit gutem Erinnerungsvermö…",https://img.welt.de/img/politik/deutschland/mobile249390546/3431356267-ci16x9-w1200/Winterklausur-CSU-Landesgruppe-im-Bundestag-2.jpg,2024-01-06T16:20:27Z,,"Bayerns Ministerpräsident Markus Söder und der Chef der CSU-Landesgruppe im Bundestag, Alexander Dobrindt, hielten sich zum Start der Klausur in Kloster Seeon nicht lang auf mit Artigkeiten und Small… [+7272 chars]",,de,'Energiekosten'
https://www.n-tv.de/politik/Netzagentur-Chef-warnt-vor-unueberlegtem-Heizungstausch-article24643786.html,https://www.n-tv.de/politik/Netzagentur-Chef-warnt-vor-unueberlegtem-Heizungstausch-article24643786.html,0,www.n-tv.de,Kritik an Wärmepumpen-Preisen: Netzagentur-Chef warnt vor unüberlegtem Heizungstausch,"Seit Jahresbeginn gilt das neue Heizungsgesetz. Bauministerin Geywitz legt Verbrauchern deshalb einen rascheren Austausch ihrer Gasheizung nahe. Netzagentur-Chef Müller mahnt jedoch zur Vorsicht. Eigentümer müssten zunächst herausfinden, welche Sanierung für …",https://bilder2.n-tv.de/img/incoming/crop24643797/3631325765-cImg_16_9-w1200/440300260.jpg,2024-01-07T00:22:14Z,,Seit Jahresbeginn gilt das neue Heizungsgesetz. Bauministerin Geywitz legt Verbrauchern deshalb einen rascheren Austausch ihrer Gasheizung nahe. Netzagentur-Chef Müller mahnt jedoch zur Vorsicht. Eig… [+2499 chars],,de,'Gasheizung'
https://www.golem.de/sonstiges/zustimmung/auswahl.html?from=https://www.golem.de/news/recht-auf-schnelles-internet-bayerns-finanzminister-sieht-nichteinhaltung-des-gesetzes-2401-180892.html&referer=https://t.co/e81e0cfa64,https://www.golem.de/sonstiges/zustimmung/auswahl.html?from=https://www.golem.de/news/recht-auf-schnelles-internet-bayerns-finanzminister-sieht-nichteinhaltung-des-gesetzes-2401-180892.html&referer=https://t.co/e81e0cfa64,0,www.golem.de,Recht auf schnelles Internet: Bayerns Finanzminister sieht Nichteinhaltung des Gesetzes,"Albert Füracker hat als bayerischer Finanzminister kritisiert, dass das Recht auf schnelles Internet oft nicht umgesetzt werde. Die zuständige Behörde verteidigt sich. (Festnetz, Bundesnetzagentur)",,2024-01-07T08:13:01Z,,"Besuchen Sie Golem.de wie gewohnt mit Werbung und Tracking,
 indem Sie der Nutzung aller Cookies zustimmen.
 Details zum Tracking finden Sie im Privacy Center.
Skript wurde nicht geladen. Informat… [+607 chars]",,de,'Bundesnetzagentur'
https://stadt-bremerhaven.de/politiker-recht-auf-schnelles-internet-ist-wertlos/,https://stadt-bremerhaven.de/politiker-recht-auf-schnelles-internet-ist-wertlos/,0,stadt-bremerhaven.de,Politiker: Recht auf schnelles Internet ist wertlos,"Albert Füracker, der Finanzminister aus der CSU, kritisiert die Ampel-Koalition und die Bundesnetzagentur und beschuldigt sie der Untätigkeit hinsichtlich des vom Bund eingeführten Rechts auf schnelles Internet, welches seiner Meinung nach folgenlos verpufft.…",https://stadt-bremerhaven.de/wp-content/uploads/2022/05/snail-internet-schnewckezdenek-machacek-_9bRrDyOQTQ-unsplash__.jpg,2024-01-07T10:00:58Z,,"Albert Füracker, der Finanzminister aus der CSU, kritisiert die Ampel-Koalition und die Bundesnetzagentur und beschuldigt sie der Untätigkeit hinsichtlich des vom Bund eingeführten Rechts auf schnell… [+3424 chars]",,de,'Bundesnetzagentur'
https://noe.orf.at/stories/3239233/,https://noe.orf.at/stories/3239233/,0,noe.orf.at,Rauchwarnmelder in Kinderzimmern gefordert,"In Gloggnitz (Bezirk Neunkirchen) hat am Mittwoch eine Elektroheizung in einem Kinderzimmer zu brennen begonnen. Zwar konnte schnell Entwarnung gegeben werden, die Feuerwehr weist aber einmal mehr darauf hin, wie wichtig Rauchwarnmelder in Kinderzimmern seien.",https://ibs.orf.at/noe?image=https%3A%2F%2Foekastatic.orf.at%2Fmims%2F2020%2F41%2F11%2Fcrops%2Fw%3D1200%2Ch%3D627%2Cq%3D75%2F708268_master_245311_kh_rauchmelder_201002_00_00_30_15.jpg%3Fs%3Dc3fdacd2543a5d9e3591336d5380a724332a9883,2024-01-07T13:45:54Z,,"Laut der Feuerwehr Gloggnitz alarmierte der Bub, in dessen Kinderzimmer es brannte, seine Eltern. Diese steckten den Heizkörper umgehend aus und riefen die Feuerwehr. 18 Feuerwehrleute waren im Einsa… [+728 chars]",,de,'Elektroheizung'
https://www.tagesspiegel.de/internationales/14-neue-reaktoren-frankreich-baut-viel-mehr-neue-atomkraftwerke-als-geplant-11014657.html,https://www.tagesspiegel.de/internationales/14-neue-reaktoren-frankreich-baut-viel-mehr-neue-atomkraftwerke-als-geplant-11014657.html,0,www.tagesspiegel.de,14 neue Reaktoren : Frankreich baut viel mehr Atomkraftwerke als geplant,"Sechs AKWs waren bereits vorgesehen, acht weitere sollen nun hinzukommen. Doch das neue EPR-Reaktormodell bereitet auch Probleme.",https://www.tagesspiegel.de/images/765063-01-02jpg/alternates/BASE_16_9_W1400/765063-01-02jpg.jpeg,2024-01-07T14:49:58Z,,"Um den Anteil der fossilen Brennstoffe am Energieverbrauch zu senken, will Frankreich in den kommenden Jahren zusätzlich zu bereits geplanten sechs Atomkraftwerken acht weitere Meiler bauen und damit… [+2400 chars]",,de,'AKW'
