index,url,valid,domain,title,description,image,published,archive,content,quote,language,keyword
https://www.welt.de/politik/ausland/article69a56f4ecc6f44c0f427a064/ukraine-krieg-putin-droht-mit-stopp-der-gaslieferungen-in-eu-lng-tanker-im-mittelmeer-versunken-liveticker.html,https://www.welt.de/politik/ausland/article69a56f4ecc6f44c0f427a064/ukraine-krieg-putin-droht-mit-stopp-der-gaslieferungen-in-eu-lng-tanker-im-mittelmeer-versunken-liveticker.html,0,www.welt.de,Putin droht mit Stopp der Gaslieferungen in EU – LNG-Tanker im Mittelmeer versunken,"Bundeskanzler Friedrich Merz steht Gesprächen mit dem Kreml grundsätzlich offen gegenüber, sagt er. Derzeit seien solche Formate angesichts der russischen Kriegsführung aber sinnlos. Und: Rund um das Atomkraftwerk Saporischschja soll eine Waffenruhe gelten. M…",https://images.welt.de/69a56f4ecc6f44c0f427a064/e3ab9966dba0aef473186482c6a2a4aa/ci16x9-w1200/2026-03-04t180314z-882309917-rc2sxjauab2d-rtrmadp-3-ukraine-crisis-russia-hungary-jpg,2026-03-05T06:09:00Z,,"Die EU will die Gaslieferungen aus Russland bald komplett stoppen. Nun überlegt Kremlchef Putin, ob es dann nicht besser wäre, wenn die Rohstoffmacht selbst schon vorher den Energiefluss einstellt. M… [+7066 chars]",,de,'LNG'
https://www.welt.de/politik/ausland/video69a926ed79ec6de0dad41d1d/iran-krieg-das-ist-ein-schreckensszenario-das-die-russen-augenblicklich-beschreiben.html,https://www.welt.de/politik/ausland/video69a926ed79ec6de0dad41d1d/iran-krieg-das-ist-ein-schreckensszenario-das-die-russen-augenblicklich-beschreiben.html,0,www.welt.de,"„Das ist ein Schreckensszenario, das die Russen augenblicklich beschreiben“","Russland hat seine Arbeiten am iranischen Atomkraftwerk Buschehr eingestellt und vor Angriffen auf die Anlage gewarnt. Sollte das AKW beschädigt werden, „dann, so die Russen, besteht die Gefahr einer regionalen Katastrophe“, berichtet Korrespondent Christoph …",https://images.welt.de/69a926ed79ec6de0dad41d1d/8554a70977142dc1061f83e7e9c67935-master/ci16x9-w1200/wanner-png,2026-03-05T07:08:18Z,,"Russland hat seine Arbeiten am iranischen Atomkraftwerk Buschehr eingestellt und vor Angriffen auf die Anlage gewarnt. Sollte das AKW beschädigt werden, dann, so die Russen, besteht die Gefahr einer … [+124 chars]",,de,'AKW'
https://www.tagesspiegel.de/wirtschaft/spritpreise-sprit-immer-teurer-auch-super-e10-kostet-mehr-als-2-euro-15317670.html,https://www.tagesspiegel.de/wirtschaft/spritpreise-sprit-immer-teurer-auch-super-e10-kostet-mehr-als-2-euro-15317670.html,0,www.tagesspiegel.de,Spritpreise: Sprit immer teurer: Auch Super E10 kostet mehr als 2 Euro,Einen Tag nach Diesel überschreitet die günstigste gängige Benzinsorte die Preisschwelle von 2 Euro. Heizöl wird noch teurer. Ist ein Tankrabatt nötig? Experten sind sich einig.,https://www.tagesspiegel.de/images/15317914/alternates/BASE_16_9_W1400/1772696567000/benzinpreis-berlin.jpeg,2026-03-05T07:10:10Z,,Die Spritpreise steigen immer weiter: Einen Tag nach Dieselkraftstoff hat auch die günstigste gängige Benzinsorte Super E10 die Marke von zwei Euro pro Liter im bundesweiten Durchschnittspreis übersc… [+4756 chars],,de,'Heizöl'
https://www.basicthinking.de/blog/2026/03/05/deutsche-energiepolitik-zerschellt-im-iran/,https://www.basicthinking.de/blog/2026/03/05/deutsche-energiepolitik-zerschellt-im-iran/,0,www.basicthinking.de,Denkzettel für Deutschland: Energiepolitik zerschellt im Iran,"Der Beitrag Denkzettel für Deutschland: Energiepolitik zerschellt im Iran erschien zuerst beim Online-Magazin BASIC thinking. Über unseren Newsletter UPDATE startest du jeden Morgen bestens informiert in den Tag.
Der Iran-Krieg ist geografisch zwar weit von D…",https://www.basicthinking.de/blog/wp-content/uploads/2026/03/iran-spritpreise.jpg,2026-03-05T10:00:16Z,,"Der Iran-Krieg ist geografisch zwar weit von Deutschland entfernt, ökonomisch ist er aber längst hier angekommen. Grund ist die Sperrung der Straße von Hormus seitens des Iran, durch die jeweils rund… [+6758 chars]",,de,'Energiepolitik'
https://www.stern.de/news/verivox--starker-nachfrage-nach-neuen-gastarifen---neukundenpreise-noch-niedrig-37193802.html,https://www.stern.de/news/verivox--starker-nachfrage-nach-neuen-gastarifen---neukundenpreise-noch-niedrig-37193802.html,0,www.stern.de,Verivox: Starker Nachfrage nach neuen Gastarifen - Neukundenpreise noch niedrig,"Angesichts des Krieges im Nahen Osten und des Preisanstiegs im Großhandel mit Erdgas ist die Nachfrage nach neuen Gastarifen nach Angaben des Vergleichsportals Verivox sprunghaft angestiegen. Derzeit würden ""mehr als doppelt so viele neue Gasverträge abgeschl…",https://image.stern.de/37193804/t/A0/v1/w1440/r1.7778/-/05--thermostat-an-einer-heizung---008c6e0c1c2e1a00.jpg,2026-03-05T10:47:47Z,,"Kopiere den aktuellen Link
Zur Merkliste hinzufügen
Angesichts des Krieges im Nahen Osten und des Preisanstiegs im Großhandel mit Erdgas ist die Nachfrage nach neuen Gastarifen nach Angaben des Ver… [+1639 chars]",,de,'Krieg Gas'
https://www.welt.de/wirtschaft/plus69a8562c625a8415070ae8a8/das-einzige-akw-auf-der-arabischen-halbinsel-liegt-in-reichweite-iranischer-raketen.html,https://www.welt.de/wirtschaft/plus69a8562c625a8415070ae8a8/das-einzige-akw-auf-der-arabischen-halbinsel-liegt-in-reichweite-iranischer-raketen.html,0,www.welt.de,Das einzige AKW auf der Arabischen Halbinsel – und in Reichweite iranischer Raketen,Mit Angriffen auf die Energieversorgung der Nachbarstaaten könnte Iran den Krieg eskalieren. Die Atomenergie-Agentur IAEA versetzt ihr Notfallzentrum in Alarmbereitschaft. Das AKW Barakah ist aber nicht das einzige potenzielle Ziel.,https://images.welt.de/69a8562c625a8415070ae8a8/e1b29b928829d1408edcf041891913ee/ci16x9-w1200/454027423-jpg,2026-03-05T11:10:20Z,,Die WELT als ePaper: Die vollständige Ausgabe steht Ihnen bereits am Vorabend zur Verfügung so sind Sie immer hochaktuell informiert. Weitere Informationen https://epaper.welt.de,,de,'AKW'
https://www.tagesspiegel.de/wirtschaft/krieg-im-nahen-osten-nachfrage-nach-neuen-gastarifen-steigt-sprunghaft-15319106.html,https://www.tagesspiegel.de/wirtschaft/krieg-im-nahen-osten-nachfrage-nach-neuen-gastarifen-steigt-sprunghaft-15319106.html,0,www.tagesspiegel.de,Krieg im Nahen Osten: Nachfrage nach neuen Gastarifen steigt sprunghaft,"Sperrung der Straße von Hormus, Produktionsstopp von Flüssiggas in Katar: Das Vergleichsportal Verixov meldet trotz der hohen Nachfrage noch keinen Preisanstieg für Neukunden.",https://www.tagesspiegel.de/images/11549792/alternates/BASE_16_9_W1400/1728824212000/erdgasleitung-in-sachsen.jpeg,2026-03-05T11:15:59Z,,Angesichts des Krieges im Nahen Osten und des Preisanstiegs im Großhandel mit Erdgas ist die Nachfrage nach neuen Gastarifen nach Angaben des Vergleichsportals Verivox sprunghaft angestiegen. Derzeit… [+1879 chars],,de,'Krieg Gas'
https://www.stern.de/wirtschaft/news/spritpreise--sprit-immer-teurer--auch-super-e10-kostet-mehr-als-2-euro-37192984.html,https://www.stern.de/wirtschaft/news/spritpreise--sprit-immer-teurer--auch-super-e10-kostet-mehr-als-2-euro-37192984.html,0,www.stern.de,Spritpreise: Sprit immer teurer: Auch Super E10 kostet mehr als 2 Euro,Einen Tag nach Diesel überschreitet die günstigste gängige Benzinsorte die Preisschwelle von 2 Euro. Heizöl wird noch teurer. Ist ein Tankrabatt nötig? Experten sind sich einig.,https://image.stern.de/37194246/t/Pv/v1/w1440/r1.7778/-/05--xn6u2uc777v5axs2048jpeg---1f70a3964cf1809b.jpg,2026-03-05T12:12:55Z,,"Kopiere den aktuellen Link
Zur Merkliste hinzufügen
Einen Tag nach Diesel überschreitet die günstigste gängige Benzinsorte die Preisschwelle von 2 Euro. Heizöl wird noch teurer. Ist ein Tankrabatt … [+4905 chars]",,de,'Gas Industrie'
https://www.welt.de/debatte/plus69a96d79c8473971749b2952/fastenpredigt-merkels-abgrund.html,https://www.welt.de/debatte/plus69a96d79c8473971749b2952/fastenpredigt-merkels-abgrund.html,0,www.welt.de,Merkels Abgrund,"Kaum etwas hat Deutschland seit dem Zweiten Weltkrieg so sehr geschadet wie Angela Merkels Klima- und Energiepolitik. Jetzt hat die Kanzlerin a.D. in einer Predigt bedauert, nicht noch mehr davon durchgezogen zu haben.",https://images.welt.de/69a96d79c8473971749b2952/6801d62886d108285ff726c2dbf3627c/ci16x9-w1200/dpa-com-20090101-260304-911-029805-jpg,2026-03-05T13:50:00Z,,"Kaum etwas hat Deutschland seit dem Zweiten Weltkrieg so sehr geschadet wie Angela Merkels Klima- und Energiepolitik. Jetzt hat die Kanzlerin a.D. in einer Predigt bedauert, nicht noch mehr davon dur… [+18 chars]",,de,'Energiepolitik'
https://www.welt.de/debatte/plus69a96d79c8473971749b2952/migration-bei-einer-fastenpredigt-hat-merkel-einen-verstoerenden-einblick-in-ihre-motive-gegeben.html,https://www.welt.de/debatte/plus69a96d79c8473971749b2952/migration-bei-einer-fastenpredigt-hat-merkel-einen-verstoerenden-einblick-in-ihre-motive-gegeben.html,0,www.welt.de,Merkels Eitelkeit,Kaum etwas hat Deutschland seit dem Zweiten Weltkrieg so sehr geschadet wie Angela Merkels Klima- und Energiepolitik. Bei einer Fastenpredigt hat die Kanzlerin a.D. nun einen verstörenden Einblick in ihre Motive gegeben,https://images.welt.de/69a96d79c8473971749b2952/6801d62886d108285ff726c2dbf3627c/ci16x9-w1200/dpa-com-20090101-260304-911-029805-jpg,2026-03-05T13:50:00Z,,Die WELT als ePaper: Die vollständige Ausgabe steht Ihnen bereits am Vorabend zur Verfügung so sind Sie immer hochaktuell informiert. Weitere Informationen https://epaper.welt.de,,de,'Energiepolitik'
https://www.n-tv.de/politik/politik_kommentare/Jetzt-faellt-der-EU-ihre-Heuchelei-auf-die-Fuesse-id30435153.html,https://www.n-tv.de/politik/politik_kommentare/Jetzt-faellt-der-EU-ihre-Heuchelei-auf-die-Fuesse-id30435153.html,0,www.n-tv.de,Putin droht mit Gas-Stopp: Jetzt fällt der EU ihre Heuchelei auf die Füße,"Ein perfekter Moment, um Brüssel vorzuführen: Als der Krieg im Iran die Energiepreise hochtreibt, droht Putin, den Europäern den Gashahn zuzudrehen. So entlarvt er die Doppelmoral der EU. Denn die erlaubt noch Energiegeschäfte mit ihm – trotz der beschworenen…",https://www.n-tv.de/img/30435226/1772721456/Img_16_9/1200/DIESES-FOTO-WIRD-VON-DER-RUSSISCHEN-STAATSAGENTUR-TASS-ZUR-VERFUeGUNG-GESTELLT-RUSSIA-MOSCOW-FEBRUARY-26-2026-Vladimir-Putin-President-of-Russia-attends-a-meeting-of-the-Supreme-State-Council-of-the-Union-State-of-Russia-and-Belarus-at-the-Moscow-Kremlin.jpg,2026-03-05T15:12:28Z,,"Putin kann bei jeder neuen Energiekrise wieder drohen und die EU dumm dastehen lassen. (Foto: picture alliance / TASS)
Ein perfekter Moment, um Brüssel vorzuführen: Als der Krieg im Iran die Energie… [+4574 chars]",,de,'Gas Putin'
https://www.freitag.de/autoren/joern-boewe/oekonomie-des-oelpreises-wie-konzerne-durch-den-iran-krieg-rekord-profite-machen,https://www.freitag.de/autoren/joern-boewe/oekonomie-des-oelpreises-wie-konzerne-durch-den-iran-krieg-rekord-profite-machen,0,www.freitag.de,Die Ökonomie des Ölpreises: Wie Konzerne jetzt Rekord-Profite auf unsere Kosten machen,"Benzin, Heizen und Strom: Durch den Iran-Krieg wird alles teurer. Auch Flüssiggas verkaufen Energiekonzerne in Europa gerade zu teils doppelt so hohen Preisen, wie sie für die Beschaffung bezahlen. Wie diese Ungerechtigkeit funktioniert Geopolitische Konflikt…",https://www.freitag.de/autoren/joern-boewe/oekonomie-des-oelpreises-wie-konzerne-durch-den-iran-krieg-rekord-profite-machen/@@images/image/great,2026-03-05T16:34:00Z,,"Geopolitische Konflikte beginnen selten an Orten, die nach Alltag aussehen. Sie beginnen in diplomatischen Krisen, militärischen Drohungen und strategischen Meerengen. Doch ihre wirtschaftlichen Folg… [+10226 chars]",,de,'Flüssiggas'
https://www.welt.de/wissenschaft/plus699db921cfca786c686c9587/energie-dem-deutschen-gasnetz-droht-ein-ungeahnt-teures-ende-fuer-betreiber-und-kunden.html,https://www.welt.de/wissenschaft/plus699db921cfca786c686c9587/energie-dem-deutschen-gasnetz-droht-ein-ungeahnt-teures-ende-fuer-betreiber-und-kunden.html,0,www.welt.de,Dem deutschen Gasnetz droht ein ungeahnt teures Ende – für Betreiber und Kunden,"Der Krieg im Nahen Osten hat den Gaspreis zeitweise verdoppelt. Gleichzeitig erlaubt das neue Heizungsgesetz, Gasheizungen länger einzubauen. Ein Experte warnt: Wer weiter darauf setzt, geht ein doppeltes Risiko ein.",https://images.welt.de/699db921cfca786c686c9587/a8a796c780e5ddd375d2eadef7e89fc1-master/ci16x9-w1200/dwosb-gasnetz-ms-jpg,2026-03-06T06:24:21Z,,"Der Krieg im Nahen Osten hat den Gaspreis zeitweise verdoppelt. Gleichzeitig erlaubt das neue Heizungsgesetz, Gasheizungen länger einzubauen. Ein Experte warnt: Wer weiter darauf setzt, geht ein dopp… [+16 chars]",,de,'Krieg Gas'
https://www.welt.de/regionales/hamburg/article69aa7ffd7ce3c08db9d239d0/hamburger-buergermeister-sozialdemokrat-tschentscher-begruesst-angriff-auf-den-iran.html,https://www.welt.de/regionales/hamburg/article69aa7ffd7ce3c08db9d239d0/hamburger-buergermeister-sozialdemokrat-tschentscher-begruesst-angriff-auf-den-iran.html,0,www.welt.de,Sozialdemokrat Tschentscher begrüßt Angriff auf den Iran,In Hamburg lebt eine der größten Gruppen von Exil-Iranern in Europa. Der Bürgermeister stellte sich an ihre Seite – während die Zweite Bürgermeisterin auch auf Grundlage des Konflikts die neue Energiepolitik der Bundeswirtschaftsministerin scharf kritisiert.,https://images.welt.de/69aa7ffd7ce3c08db9d239d0/aab4c885b98f26a5c27c01c5396a89ae-master/ci16x9-w1200/dpa-com-20090101-260305-935-1196234-jpg,2026-03-06T07:47:41Z,,In Hamburg lebt eine der größten Gruppen von Exil-Iranern in Europa. Der Bürgermeister stellte sich an ihre Seite während die Zweite Bürgermeisterin auch auf Grundlage des Konflikts die neue Energiep… [+3456 chars],,de,'Energiepolitik'
https://www.telepolis.de/article/Katar-stoppt-Erdgas-Exporte-und-warnt-vor-monatelangen-Ausfaellen-11202200.html,https://www.telepolis.de/article/Katar-stoppt-Erdgas-Exporte-und-warnt-vor-monatelangen-Ausfaellen-11202200.html,0,www.telepolis.de,Katar stoppt Erdgas-Exporte und warnt vor monatelangen Ausfällen,"Katars Energieminister warnt vor ""Wochen bis Monaten"" Ausfall – doch das eigentliche Problem liegt woanders als gedacht.",https://heise.cloudimg.io/bound/1200x1200/q85.png-lossy-85.webp-lossy-85.foil1/_www-heise-de_/imgs/18/5/0/4/0/8/6/3/shutterstock_2597378261-f9ece638bd7975b9.jpg,2026-03-06T11:50:00Z,,"(Bild: Wojciech Wrzesien / Shutterstock.com)
Katars Energieminister warnt vor ""Wochen bis Monaten"" Ausfall doch das eigentliche Problem liegt woanders als gedacht.
Die europäischen Energiemärkte er… [+5837 chars]",,de,'Energieminister'
https://www.welt.de/politik/ausland/plus69aa9e0410f264d559775cf7/oellieferungen-verzweiflungstat-orbans-was-hinter-der-eskalation-zwischen-ungarn-und-der-ukraine-steckt.html,https://www.welt.de/politik/ausland/plus69aa9e0410f264d559775cf7/oellieferungen-verzweiflungstat-orbans-was-hinter-der-eskalation-zwischen-ungarn-und-der-ukraine-steckt.html,0,www.welt.de,„Verzweiflungstat Orbáns“ – Was hinter der Eskalation zwischen Ungarn und der Ukraine steckt,"Der ukrainisch-ungarische Streit um die Druschba-Pipeline erreicht eine neue Eskalationsstufe. Ungarn setzt Ukrainer fest, Selenskyj spricht eine scharfe Drohung aus. Um Energiepolitik geht es dabei nur vordergründig – im Kreml reibt man sich die Hände.",https://images.welt.de/69aa9e0410f264d559775cf7/adf71899bc55dc707b4fec5ba02b4f24/ci16x9-w1200/525816878-jpg,2026-03-06T16:14:01Z,,"Der ukrainisch-ungarische Streit um die Druschba-Pipeline erreicht eine neue Eskalationsstufe. Ungarn setzt Ukrainer fest, Selenskyj spricht eine scharfe Drohung aus. Um Energiepolitik geht es dabei … [+51 chars]",,de,'Energiepolitik'
https://www.welt.de/politik/ausland/plus69aa9e0410f264d559775cf7/oellieferungen-die-schwerwiegenden-folgen-des-showdowns-zwischen-orban-und-selenskyj.html,https://www.welt.de/politik/ausland/plus69aa9e0410f264d559775cf7/oellieferungen-die-schwerwiegenden-folgen-des-showdowns-zwischen-orban-und-selenskyj.html,0,www.welt.de,Die schwerwiegenden Folgen des Showdowns zwischen Orbán und Selenskyj,"Der ukrainisch-ungarische Streit um die Druschba-Pipeline erreicht eine neue Eskalationsstufe. Ungarn setzt Ukrainer fest, Selenskyj spricht eine scharfe Drohung aus. Um Energiepolitik geht es dabei nur vordergründig – im Kreml reibt man sich die Hände.",https://images.welt.de/69aa9e0410f264d559775cf7/adf71899bc55dc707b4fec5ba02b4f24/ci16x9-w1200/525816878-jpg,2026-03-06T16:14:01Z,,"Der ukrainisch-ungarische Streit um die Druschba-Pipeline erreicht eine neue Eskalationsstufe. Ungarn setzt Ukrainer fest, Selenskyj spricht eine scharfe Drohung aus. Um Energiepolitik geht es dabei … [+51 chars]",,de,'Energiepolitik'
https://www.nzz.ch/schweiz/juerg-grossen-mit-dem-ausbau-der-erneuerbaren-wird-die-kernkraft-an-bedeutung-verlieren-ld.1927433,https://www.nzz.ch/schweiz/juerg-grossen-mit-dem-ausbau-der-erneuerbaren-wird-die-kernkraft-an-bedeutung-verlieren-ld.1927433,0,www.nzz.ch,INTERVIEW - Jürg Grossen: «Mit dem Ausbau der Erneuerbaren wird die Kernkraft an Bedeutung verlieren»,"Die hohen Stromimporte im Winter seien kein Beleg für das Scheitern der Energiewende, sagt der Chef der Grünliberalen. Photovoltaik und weitere Erneuerbare würden die AKW schrittweise verdrängen – ein Technologiesprung bei der Kernkraft sei nicht in Sicht.","https://img.nzz.ch/2026/03/06/7adbae26-fb61-4bb1-ba59-a5416a4a52a9.jpg?width=1200&height=674&fit=bounds&quality=75&auto=webp&crop=8100,4556,x0,y179&wmark=nzz",2026-03-07T04:30:00Z,,"Die hohen Stromimporte im Winter seien kein Beleg für das Scheitern der Energiewende, sagt der Chef der Grünliberalen. Photovoltaik und weitere Erneuerbare würden die AKW schrittweise verdrängen ein … [+12269 chars]",,de,'Winter Kernkraft'
https://www.n-tv.de/politik/Mehr-als-1700-Firmen-kritisieren-Energiepolitik-des-Bundes-id30442879.html,https://www.n-tv.de/politik/Mehr-als-1700-Firmen-kritisieren-Energiepolitik-des-Bundes-id30442879.html,0,www.n-tv.de,"Unternehmen ""extrem besorgt"": Mehr als 1700 Firmen kritisieren Energiepolitik des Bundes","Die Regierung legt Entwürfe für ein neues Stromnetzpaket und das Heizungsgesetz vor. In einigen Betrieben kommen diese Papiere nicht gut an. Hunderte Unternehmer unterzeichnen einen Appell, der ein Umdenken in der Energiepolitik fordert.",https://www.n-tv.de/img/30442900/1772901825/Img_16_9/1200/20-MW-Peak-Solarpark-auf-rekultivierte-Tagebauflaechen-am-Braunkohletagebau-Garzweiler-Freiflaechen-Photovoltaikanlagen-mit-integriertem-Energiespeicher-13-MWh-in-Lithium-Ionen-Akkus-von-RWE-Windpark-NRW-Deutschland-PV-Windkraft-20-MW-peak-solar-park-on-recultivated-opencast-mining-areas-at-the-Garzweiler-opencast-lignite-mine-ground-mounted-photovoltaic-systems-with-integrated-energy-storage-13-MWh-in-lithium-ion-batteries-by-RWE-wind-farm-NRW-Germany-PV-wind-power.jpg,2026-03-07T16:56:35Z,,"Die Initiatoren der Unterschriftensammlung schreiben, dass es durchaus ein Problem beim Stromnetzausbau gebe. (Foto: IMAGO/Jochen Tack)
Die Regierung legt Entwürfe für ein neues Stromnetzpaket und d… [+2492 chars]",,de,'Energiepolitik'
https://www.zeit.de/wirtschaft/2026-03/wirtschaftsappell-energiepolitik-unternehmen-gebaeudemodernisierungsgesetz,https://www.zeit.de/wirtschaft/2026-03/wirtschaftsappell-energiepolitik-unternehmen-gebaeudemodernisierungsgesetz,0,www.zeit.de,"""Wirtschaftsappell"": Knapp 2.400 Unternehmen kritisieren Energiepolitik der Bundesregierung","Hunderte Unternehmen zeigen sich ""extrem besorgt"", dass die Energiewende abgewürgt werde. Sie warnen vor Auftragseinbrüchen und der Entwertung bisheriger Planungen.",https://img.zeit.de/politik/deutschland/2026-03/fast-2400-unternehmen-kritisieren-energiepolitik-der-bundesregierung-bild/wide__1300x731,2026-03-08T11:57:53Z,,"Fast 2.400 Unternehmen haben sich einem Appell angeschlossen, der die Energiepolitik der Bundesregierung kritisiert. ""Mit den Vorhaben, wie sie nun im Rahmen des Netzpakets oder den Eckpunkten eines … [+3418 chars]",,de,'Energiepolitik'
https://www.tagesschau.de/ausland/europa/ukraine-winterbilanz-100.html,https://www.tagesschau.de/ausland/europa/ukraine-winterbilanz-100.html,0,www.tagesschau.de,Ukraine blickt auf härtesten Kriegswinter zurück,Mit Hoffnung und Erleichterung sehen viele Menschen in der Ukraine dem beginnenden Frühling entgegen. Hinter ihnen liegt der härteste Winter seit Kriegsbeginn. Die Energieversorgung ist stark beeinträchtigt. Von Niels Bula.,https://images.tagesschau.de/image/c2e8bdf3-5393-4e04-9576-22bd936a41fe/AAABnM5L7Dw/AAABmyZE0EA/16x9-big/kiew-park-100.jpg?width=1280,2026-03-09T04:58:37Z,,"Stand: 09.03.2026 05:58 Uhr
Mit Hoffnung und Erleichterung sehen viele Menschen in der Ukraine dem beginnenden Frühling entgegen. Hinter ihnen liegt der härteste Winter seit Kriegsbeginn. Die Energi… [+4147 chars]",,de,'Energieminister'
https://www.tagesschau.de/wirtschaft/weltwirtschaft/oelpreis-iran-krieg-100-dollar-trump-100.html,https://www.tagesschau.de/wirtschaft/weltwirtschaft/oelpreis-iran-krieg-100-dollar-trump-100.html,0,www.tagesschau.de,Ölpreis wegen Iran-Krieg erstmals seit Jahren über 100 Dollar,Der Iran-Krieg treibt den Ölpreis erstmals seit Beginn des Ukraine-Kriegs wieder über 100 Dollar. US-Präsident Trump verteidigt die steigenden Energiepreise als notwendigen Preis für Sicherheit und Frieden.,https://images.tagesschau.de/image/96bc65f8-f816-4768-9658-47e173bc9c2e/AAABlegMOVw/AAABmyZE0EA/16x9-big/oel-150.jpg?width=1280,2026-03-09T07:22:38Z,,"Stand: 09.03.2026 08:22 Uhr
Der Iran-Krieg treibt den Ölpreis erstmals seit Beginn des Ukraine-Kriegs wieder über 100 Dollar. US-Präsident Trump verteidigt die steigenden Energiepreise als notwendig… [+3902 chars]",,de,'Energiepreise'
https://www.telepolis.de/article/Gas-Strom-Sprit-Was-Verbraucher-jetzt-wissen-muessen-11203846.html,https://www.telepolis.de/article/Gas-Strom-Sprit-Was-Verbraucher-jetzt-wissen-muessen-11203846.html,0,www.telepolis.de,"Gas, Strom, Sprit: Was Verbraucher jetzt wissen müssen","Energiepreise steigen seit Iran-Krieg stark. Gas verteuerte sich um 35 Prozent, Heizöl um 50 Prozent. Was Verbraucher jetzt wissen und tun sollten.",https://heise.cloudimg.io/bound/1200x1200/q85.png-lossy-85.webp-lossy-85.foil1/_www-heise-de_/imgs/18/5/0/4/1/6/9/9/oelpreis_ho-c812f256efcb5d42.jpg,2026-03-09T13:00:00Z,,"Der Ölpreis hat die Marke von 100 US-Dollar durchbrochen
Energiepreise steigen seit Iran-Krieg stark. Gas verteuerte sich um 35 Prozent, Heizöl um 50 Prozent. Was Verbraucher jetzt wissen und tun so… [+9007 chars]",,de,'Gas Ukraine'
