index,url,valid,domain,title,description,image,published,archive,content,quote,language,keyword
https://www.welt.de/wirtschaft/article248300044/Finanzminister-Lindner-stellt-Kohleausstieg-2030-wieder-infrage.html,https://www.welt.de/wirtschaft/article248300044/Finanzminister-Lindner-stellt-Kohleausstieg-2030-wieder-infrage.html,0,www.welt.de,Lindner stellt Kohleausstieg 2030 wieder infrage,"Die Bundesregierung plant den Ausstieg aus der Nutzung klimaschädlicher Kohle bis spätestens 2038, idealerweise sogar bis 2030. Finanzminister Christian Lindner stellt diesen Kurs nun infrage. Für das Klima bringe diese Vorgabe ohnehin nichts.",https://img.welt.de/img/wirtschaft/mobile248300046/9481354557-ci16x9-w1200/Bundesfinanzminister-Lindner-in-Duesseldorf.jpg,2023-11-01T01:24:46Z,,"Bundesfinanzminister und FDP-Chef Christian Lindner stellt den für 2030 angestrebten Kohleausstieg öffentlich infrage. Solange nicht klar ist, dass Energie verfügbar und bezahlbar ist, sollten wir di… [+983 chars]",,de,'Kohleausstieg'
https://www.faz.net/aktuell/wirtschaft/chrsitian-lindner-stellt-kohleausstieg-2030-infrage-19282818.html,https://www.faz.net/aktuell/wirtschaft/chrsitian-lindner-stellt-kohleausstieg-2030-infrage-19282818.html,0,www.faz.net,Christian Lindner stellt Kohleausstieg 2030 infrage,"Deutschland will 2030 aus dem Kohlestrom aussteigen. Diese „Träume“ solle Deutschland beenden, sagte Finanzminister Christian Lindner nun – zumindest, solange nicht klar sei, dass Energie verfügbar und bezahlbar ist.",https://media0.faz.net/ppmedia/aktuell/2644712823/1.9282820/facebook_teaser/finanzminister-christian.jpg,2023-11-01T07:07:54Z,https://web.archive.org/web/20231101083110/https://www.faz.net/aktuell/wirtschaft/chrsitian-lindner-stellt-kohleausstieg-2030-infrage-19282818.html,"Finanzminister Christian Lindner hat den für 2030 geplanten Kohleausstieg infrage gestellt. Solange nicht klar ist, dass Energie verfügbar und bezahlbar ist, sollten wir die Träume von einem Ausstieg… [+1082 chars]",,de,'Kohleausstieg'
https://www.zeit.de/wirtschaft/2023-11/christian-lindner-kohleausstieg-energie,https://www.zeit.de/wirtschaft/2023-11/christian-lindner-kohleausstieg-energie,0,www.zeit.de,Energieversorgung: Christian Lindner stellt Kohleausstieg 2030 infrage,"""Träume"" nennt der Bundesfinanzminister einen Ausstieg aus der Kohle bis 2030. Es sei noch nicht klar, dass Energie verfügbar und bezahlbar sei.",https://img.zeit.de/wirtschaft/2023-11/christian-lindner-kohleausstieg-energie-bild/wide__1300x731,2023-11-01T07:23:35Z,,"Bundesfinanzminister Christian Lindner (FDP) zweifelt den im Koalitionsvertrag genannten Zeitpunkt für den Kohleausstieg an. ""Solange nicht klar ist, dass Energie verfügbar und bezahlbar ist, sollten… [+1174 chars]",,de,'Kohleausstieg'
https://www.focus.de/auto/news/kein-akku-von-der-stange-technik-bmw-batteriestrategie_id_232963740.html,https://www.focus.de/auto/news/kein-akku-von-der-stange-technik-bmw-batteriestrategie_id_232963740.html,0,www.focus.de,Akku-Power aus München - BMW eröffnet Batteriezentrale - ihr Chef zerlegt deutsche und europäische Energiepolitik,BMW erprobt im Cell Manufacturing Competence Center (CMCC) die Fertigung der neuen leistungsstarken Rundzellenbatterien für die Neue Klasse. Bei der Eröffnung der Pilotanlage übt Produktionsvorstand Milan Nedeljković scharfe Kritik an Deutschland und der EU.,https://p6.focus.de/img/auto/news/id_232963533/technik-bmw-batteriestrategie.jpg?im=Crop%3D%280%2C133%2C800%2C400%29%3BResize%3D%281200%2C627%29&impolicy=perceptual&quality=mediumHigh&hash=cd9de4c64ffcf7631391888d1edfac354c888e6795a2478a2ffe7b051f616356,2023-11-01T07:37:10Z,,"<ul><li>
Kommentare</li><li>
E-Mail</li><li>
Teilen</li><li>
Mehr</li><li>
Twitter</li><li>
Drucken</li><li>
Feedback</li><li>
Fehler meldenSie haben einen Fehler gefunden?
Bitte markieren S… [+6193 chars]",,de,'Energiepolitik'
https://www.morgenpost.de/wirtschaft/article239912981/pelletspreise-aktuell-heute-1-november-heizen-heizung-energie.html,https://www.morgenpost.de/wirtschaft/article239912981/pelletspreise-aktuell-heute-1-november-heizen-heizung-energie.html,0,www.morgenpost.de,Energiepreise heute: Pelletspreise am 1. November: Der aktuelle Preis pro Tonne,Die Pelletspreise sind im Abwärtstrend ○ Wie viel kostet eine Tonne Pellets heute am 1. November? ○ Die aktuellen Preise finden Sie hier.,https://img.morgenpost.de/img/wirtschaft/crop238881417/4822609844-w820-cv16_9-q85/Heizen-mit-Holzpellets.jpg,2023-11-01T08:40:00Z,,"Berlin. Der November in Deutschland beginnt mit milden Temperaturen, mancherorts sogar mit Sonnenschein: Demnach laufen die Heizungen noch nicht in allen Haushalten auf Hochtouren. Einigen Verbrauche… [+9905 chars]",,de,'Energiepreise'
https://www.morgenpost.de/wirtschaft/article239912697/heizoelpreise-aktuell-heute-1-november-heizoel-heizung-energie.html,https://www.morgenpost.de/wirtschaft/article239912697/heizoelpreise-aktuell-heute-1-november-heizoel-heizung-energie.html,0,www.morgenpost.de,Heizen und Kosten: Heizölpreise aktuell (1.11.): Der Preis pro Liter Heizöl,Sinken oder steigen die Heizölpreise? ○ Der Blick auf die Woche zeigt eine klare Tendenz ○ Die aktuellen Preise vom 1. November finden Sie hier.,https://img.morgenpost.de/img/wirtschaft/crop239704817/4412604958-w820-cv16_9-q85/Heizung.jpg,2023-11-01T09:18:00Z,,Berlin. Mit Beginn des Nahost-Konflikts zwischen Israel und dem Gazastreifen befürchteten Verbraucherinnen und Verbraucher einen spürbaren Einfluss auf den Ölmarkt: Doch wie sehr beeinflusst die Kris… [+9830 chars],,de,'Heizöl'
https://www.n-tv.de/politik/Lindner-stellt-Kohleausstieg-bis-2030-infrage-article24502093.html,https://www.n-tv.de/politik/Lindner-stellt-Kohleausstieg-bis-2030-infrage-article24502093.html,0,www.n-tv.de,"""Sollten Träume beenden"": Lindner stellt Kohleausstieg bis 2030 infrage","In ihrem Koalitionsvertrag haben die Ampel-Parteien vereinbart, den Kohleausstieg auf 2030 vorzuziehen. Christian Lindner hält das angestrebte Ziel aber für nicht realistisch. Für das Klima spiele das Datum aber ohnehin keine Rolle, meint der Finanzminister.",https://bilder1.n-tv.de/img/incoming/crop24502100/2501321749-cImg_16_9-w1200/432654142-1-.jpg,2023-11-01T09:49:25Z,,"In ihrem Koalitionsvertrag haben die Ampel-Parteien vereinbart, den Kohleausstieg auf 2030 vorzuziehen. Christian Lindner hält das angestrebte Ziel aber für nicht realistisch. Für das Klima spiele da… [+1197 chars]",,de,'Kohleausstieg'
https://www.zeit.de/news/2023-11/01/greenpeace-demonstriert-gegen-pipeline-fuer-lng-terminal,https://www.zeit.de/news/2023-11/01/greenpeace-demonstriert-gegen-pipeline-fuer-lng-terminal,0,www.zeit.de,Energie: Greenpeace demonstriert gegen Pipeline für LNG-Terminal,Hier finden Sie Informationen zu dem Thema „Energie“. Lesen Sie jetzt „Greenpeace demonstriert gegen Pipeline für LNG-Terminal“.,https://img.zeit.de/news/2023-11/01/greenpeace-demonstriert-gegen-pipeline-fuer-lng-terminal-image-group/wide__1300x731,2023-11-01T11:53:28Z,,Greenpeace demonstriert vor Rügen mit Tauchern gegen den Bau der Anbindungsleitung für das an der Küste der Insel geplante Terminal für Flüssigerdgas (LNG). Eine Sprecherin der Wasserschutzpolizei be… [+696 chars],,de,'LNG'
https://www.titanic-magazin.de/news/lindner-kann-vom-koks-nicht-lassen-13831/,https://www.titanic-magazin.de/news/lindner-kann-vom-koks-nicht-lassen-13831/,0,www.titanic-magazin.de,Lindner kann vom Koks nicht lassen,"Finanzminister Christian Lindner (FDP) stellt den für 2030 geplanten Kohleausstieg infrage. Stattdessen kann er sich diese Klimaschutzmaßnahmen vorstellen:
Volker Wissing beschränkt sich beim Bau neuer Autobahnen auf maximal 100 pro...",https://www.titanic-magazin.de/fileadmin/core/images/social_media_icons/titaniclogo.png,2023-11-01T12:00:10Z,,"Zusammen mit dem US-Schriftsteller/innenverband verklagst Du nun den Entwickler von ChatGPT, weil dieser seine Wunder-KI mit Texten aus Deinen Büchern gefüttert hat.
Heiliges Drachenei, George R. R.… [+593 chars]",,de,'Kohleausstieg'
https://www.faz.net/aktuell/wirtschaft/energiepreisbremse-soll-verlaengert-werden-19283367.html,https://www.faz.net/aktuell/wirtschaft/energiepreisbremse-soll-verlaengert-werden-19283367.html,0,www.faz.net,"Energiepreisbremse soll verlängert werden, falls EU-Kommission zustimmt",Nach dem Bundeskabinett soll die Energiepreisbremse um vier Monate verlängert werden – den kommenden Winter hindurch. Dafür muss allerdings die EU-Kommission noch zustimmen.,https://media0.faz.net/ppmedia/aktuell/wirtschaft/1706481006/1.9283382/facebook_teaser/bald-teurer-die.jpg,2023-11-01T12:23:01Z,https://web.archive.org/web/20231101134600/https://www.faz.net/aktuell/wirtschaft/energiepreisbremse-soll-verlaengert-werden-19283367.html,"Die Bundesregierung bereitet die Verlängerung der Preisbremsen für Strom, Gas und Fernwärme um vier Monate vor, kann sich der dafür nötigen Zustimmung durch die EU aber nicht sicher sein. Das Kabinet… [+1778 chars]",,de,'Winter Gas'
https://www.sueddeutsche.de/wirtschaft/kohleausstieg-2030-lindner-1.6296843,https://www.sueddeutsche.de/wirtschaft/kohleausstieg-2030-lindner-1.6296843,0,www.sueddeutsche.de,Energiepolitik: Lindner zweifelt an Kohleausstieg 2030,"Zunächst müsse geklärt werden, welche Art von Energie verfügbar und bezahlbar, sagt der FDP-Politiker.",https://www.sueddeutsche.de/image/sz.1.6296844/1200x675?v=1698843834,2023-11-01T13:03:58Z,,"Zunächst müsse geklärt werden, welche Art von Energie verfügbar und bezahlbar, sagt der FDP-Politiker.Bundesfinanzminister Christian Lindner hat den im Koalitionsvertrag genannten Zeitpunkt für den K… [+840 chars]",,de,'Kohleausstieg'
https://www.stern.de/gesellschaft/regional/sachsen/energie--lindner---traeume-von-ausstieg-aus-kohlestrom-2030-beenden--33961936.html,https://www.stern.de/gesellschaft/regional/sachsen/energie--lindner---traeume-von-ausstieg-aus-kohlestrom-2030-beenden--33961936.html,0,www.stern.de,"Energie: Lindner: ""Träume von Ausstieg aus Kohlestrom 2030 beenden""","Bundesfinanzminister Christian Lindner hat den im Koalitionsvertrag genannten Zeitpunkt für den Kohleausstieg in Frage gestellt. ""Solange nicht klar ist, dass Energie verfügbar und bezahlbar ist, sollten wir die Träume von einem Ausstieg aus dem Kohlestrom 20…",https://image.stern.de/33961938/t/QT/v1/w1440/r1.7778/-/01--urnnewsmldpacom2009010123110199783940v2w800h600l756t175r3256b1837jpeg---b8c3eea851afce72.jpg,2023-11-01T13:04:36Z,https://web.archive.org/web/20231101200313/https://www.stern.de/gesellschaft/regional/sachsen/energie--lindner---traeume-von-ausstieg-aus-kohlestrom-2030-beenden--33961936.html,"Bundesfinanzminister Christian Lindner hat den im Koalitionsvertrag genannten Zeitpunkt für den Kohleausstieg in Frage gestellt. ""Solange nicht klar ist, dass Energie verfügbar und bezahlbar ist, sol… [+2530 chars]",,de,'Kohleausstieg'
https://www.tagesschau.de/inland/innenpolitik/lindner-fdp-kohleausstieg-100.html,https://www.tagesschau.de/inland/innenpolitik/lindner-fdp-kohleausstieg-100.html,0,www.tagesschau.de,Debatte um Kohleausstieg: Lindners Konter,Bundesfinanzminister Lindner stellt den Kohleausstieg 2030 infrage und greift damit die Grünen an. Die hatten sich zuvor für ein erneutes Aussetzen der Schuldenbremse offen gezeigt. Was steckt hinter dem Schlagabtausch? Von Alexander Budweg.,https://images.tagesschau.de/image/20128cda-9094-4624-9d36-368ad8baaa0c/AAABhpfE9lc/AAABibBxqrQ/16x9-1280/christian-lindner-169.jpg,2023-11-01T14:46:54Z,https://web.archive.org/web/20231102035415/https://www.tagesschau.de/inland/innenpolitik/lindner-fdp-kohleausstieg-100.html,"Stand: 01.11.2023 15:46 Uhr
Bundesfinanzminister Lindner stellt den Kohleausstieg 2030 infrage und greift damit die Grünen an. Die hatten sich zuvor für ein erneutes Aussetzen der Schuldenbremse off… [+4845 chars]",,de,'Kohleausstieg'
https://www.zeit.de/news/2023-11/01/mehrheit-optimistisch-bei-energieversorgung-im-winter,https://www.zeit.de/news/2023-11/01/mehrheit-optimistisch-bei-energieversorgung-im-winter,0,www.zeit.de,Umfrage: Mehrheit optimistisch bei Energieversorgung im Winter,Hier finden Sie Informationen zu dem Thema „Umfrage“. Lesen Sie jetzt „Mehrheit optimistisch bei Energieversorgung im Winter“.,https://img.zeit.de/news/2023-11/01/mehrheit-optimistisch-bei-energieversorgung-im-winter-image-group/wide__1300x731,2023-11-01T14:53:18Z,,"Eine große Mehrheit der Bevölkerung sieht Deutschland einer Umfrage zufolge bei der Energieversorgung gut auf den kommenden Winter vorbereitet. Das geht aus einer repräsentativen Umfrage hervor, die … [+2130 chars]",,de,'Energieversorgung'
https://www.tagesspiegel.de/wirtschaft/energieversorgung-in-deutschland-mehrheit-blickt-zuversichtlich-auf-die-kommenden-monate-10715923.html,https://www.tagesspiegel.de/wirtschaft/energieversorgung-in-deutschland-mehrheit-blickt-zuversichtlich-auf-die-kommenden-monate-10715923.html,0,www.tagesspiegel.de,Energieversorgung in Deutschland: Mehrheit blickt zuversichtlich auf die kommenden Monate,Vier von fünf Deutschen erwarten einer neuen Umfrage zufolge keine Versorgungsprobleme im Winter. Trotz voller Gasspeicher rät der Bundesverband der Energie- und Wasserwirtschaft zum Sparen.,https://www.tagesspiegel.de/images/heizung13/alternates/BASE_16_9_W1400/heizung.jpeg,2023-11-01T14:55:30Z,,"Eine große Mehrheit der Bevölkerung sieht Deutschland einer Umfrage zufolge bei der Energieversorgung gut auf den kommenden Winter vorbereitet. 
Das geht aus einer repräsentativen Umfrage hervor, di… [+1946 chars]",,de,'Winter Gas'
https://www.stern.de/news/strom-wird-teurer---verlaengerung-der-preisbremse-ungewiss-33961322.html,https://www.stern.de/news/strom-wird-teurer---verlaengerung-der-preisbremse-ungewiss-33961322.html,0,www.stern.de,Strom wird teurer - Verlängerung der Preisbremse ungewiss,"Trotz Milliardenzuschüssen der Bundesregierung steigen die Netzentgelte und damit die Strompreise im kommenden Jahr spürbar an. Nach vorläufigen Angaben der Netzbetreiber erhöhen sich die Verteilnetzentgelte im bundesweiten Durchschnitt um elf Prozent, wie da…",https://image.stern.de/33961992/t/VP/v1/w1440/r1.7778/-/01--stromleitungen---436c5b1cea3795d2.jpg,2023-11-01T15:00:09Z,,Trotz Milliardenzuschüssen der Bundesregierung steigen die Netzentgelte und damit die Strompreise im kommenden Jahr spürbar an. Nach vorläufigen Angaben der Netzbetreiber erhöhen sich die Verteilnetz… [+3616 chars],,de,'Preisbremse'
https://www.focus.de/finanzen/news/umfrage-mehrheit-optimistisch-bei-energieversorgung-im-winter_id_236884728.html,https://www.focus.de/finanzen/news/umfrage-mehrheit-optimistisch-bei-energieversorgung-im-winter_id_236884728.html,0,www.focus.de,Umfrage - Mehrheit optimistisch bei Energieversorgung im Winter,Reichen die Speicherkapazitäten für den bevorstehenden Winter aus? Laut einer Umfrage sieht eine Mehrheit die Versorgung als gesichert an. Energie sparen sollte man trotzdem.,https://p6.focus.de/img/finanzen/news/id_236884727/die-energieversorgung-im-winter-ist-laut-einer-umfrage-fuer-die-meisten-menschen-in-deutschland-sicher..jpg?im=Crop%3D%280%2C168%2C2048%2C1024%29%3BResize%3D%281200%2C627%29&impolicy=perceptual&quality=mediumHigh&hash=eae0d36436ccb6f9a0aefc7cc10959bb70ff730c72d97305742edfb737d2d0aa,2023-11-01T15:00:13Z,,"Eine große Mehrheit der Bevölkerung sieht Deutschland einer Umfrage zufolge bei der Energieversorgung gut auf den kommenden Winter vorbereitet. Das geht aus einer repräsentativen Umfrage hervor, die … [+1339 chars]",,de,'Energieversorgung'
https://www.zeit.de/news/2023-11/01/greenpeace-protest-mit-tauchern-gegen-lng-pipeline-dauert-an,https://www.zeit.de/news/2023-11/01/greenpeace-protest-mit-tauchern-gegen-lng-pipeline-dauert-an,0,www.zeit.de,Gas: Greenpeace-Protest mit Tauchern gegen LNG-Pipeline dauert an,Hier finden Sie Informationen zu dem Thema „Gas“. Lesen Sie jetzt „Greenpeace-Protest mit Tauchern gegen LNG-Pipeline dauert an“.,https://img.zeit.de/administratives/sharing/fallback-image/wide__1300x731,2023-11-01T15:19:45Z,,"Mit zwei Tauchern hat die Umweltorganisation Greenpeace die Verlegung eines Pipeline-Rohrs vor der Insel Rügen behindert. Nach Angaben der Wasserschutzpolizei war es schwierig, die Aktion gegen das g… [+1787 chars]",,de,'Gas Pipeline'
https://www.tagesschau.de/wirtschaft/energiepreise-kabinett-100.html,https://www.tagesschau.de/wirtschaft/energiepreise-kabinett-100.html,0,www.tagesschau.de,Kabinett beschließt Maßnahmen zur Dämpfung der Energiekosten,"Das Bundeskabinett hat eine Regelung auf den Weg gebracht, mit der die Subventionen für Netzentgelte verlängert werden sollen. Beschlossen ist auch eine Verordnung, um die Energiepreisbremsen bis Ende April zu verlängern.",https://images.tagesschau.de/image/7f9cae34-d1a7-45c6-8337-0669364a60dd/AAABi4uEUus/AAABibBxqrQ/16x9-1280/habeck-476.jpg,2023-11-01T16:07:28Z,https://web.archive.org/web/20231101222613/https://www.tagesschau.de/wirtschaft/energiepreise-kabinett-100.html,"Stand: 01.11.2023 17:07 Uhr
Das Bundeskabinett hat eine Regelung auf den Weg gebracht, mit der die Subventionen für Netzentgelte verlängert werden sollen. Beschlossen ist auch eine Verordnung, um di… [+3231 chars]",,de,'Energiekosten'
https://taz.de/Lindner-gegen-Kohleausstieg-2030/!5966983/,https://taz.de/Lindner-gegen-Kohleausstieg-2030/!5966983/,0,taz.de,Lindner gegen Kohleausstieg 2030: FDP will noch lange Strom aus Kohle,Bundesfinanzminister Lindner spricht sich gegen einen vorgezogenen Kohleausstieg 2030 aus. Im Koalitionsvertrag ist der als Ziel aber festgeschrieben.,https://taz.de/picture/6624899/948/christian-lindner-lense-flair-1.jpeg,2023-11-01T16:51:00Z,,"Bundesfinanzminister Lindner spricht sich gegen einen vorgezogenen Kohleausstieg 2030 aus. Im Koalitionsvertrag ist der als Ziel aber festgeschrieben.
Schlechte Umfragewerte, Unmut in der eigenen Pa… [+4713 chars]",,de,'Kohleausstieg'
https://www.n-tv.de/politik/Kabinett-will-Verbraucher-bei-Energiekosten-entlasten-article24503398.html,https://www.n-tv.de/politik/Kabinett-will-Verbraucher-bei-Energiekosten-entlasten-article24503398.html,0,www.n-tv.de,Preisbremse und Netzentgelt: Kabinett will Verbraucher bei Energiekosten entlasten,Mit zwei konkreten Maßnahmen will die Bundesregierung Die Bürger im kommenden Winter vor einem möglichen neuerlichen Anstieg der Energiekosten schützen. Vorsorglich sollen die Preisbremsen für Strom und Gas verlängert werden. Zudem soll der Anstieg der Netzen…,https://bilder1.n-tv.de/img/incoming/crop24503400/4971327881-cImg_16_9-w1200/432740077.jpg,2023-11-01T16:54:09Z,https://web.archive.org/web/20231102001228/https://www.n-tv.de/politik/Kabinett-will-Verbraucher-bei-Energiekosten-entlasten-article24503398.html,Mit zwei konkreten Maßnahmen will die Bundesregierung Die Bürger im kommenden Winter vor einem möglichen neuerlichen Anstieg der Energiekosten schützen. Vorsorglich sollen die Preisbremsen für Strom … [+3593 chars],,de,'Preisbremse'
https://www.morgenpost.de/politik/article239929066/Preisbremsen-fuer-Strom-und-Gas-Was-Verbraucher-davon-haben.html,https://www.morgenpost.de/politik/article239929066/Preisbremsen-fuer-Strom-und-Gas-Was-Verbraucher-davon-haben.html,0,www.morgenpost.de,Energiepreise: Preisbremsen für Strom und Gas: Was Verbraucher davon haben,Die Bundesregierung will Energiepreise weiter deckeln. Verbraucher sollten sich allerdings nicht darauf verlassen. Was ein Experte rät.,https://img.morgenpost.de/img/frontpage/crop239929062/6082603969-w820-cv16_9-q85/405125937.jpg,2023-11-01T17:29:35Z,https://web.archive.org/web/20231102022644/https://www.morgenpost.de/politik/article239929066/Preisbremsen-fuer-Strom-und-Gas-Was-Verbraucher-davon-haben.html,"Berlin. Die Bundesregierung hat am Mittwoch grünes Licht für die Verlängerung der Energiepreisbremsen für Gas und Strom gegeben, muss aber noch auf eine Entscheidung der Europäischen Union in Brüssel… [+5683 chars]",,de,'Energiepreise'
https://taz.de/Lindner-gegen-fruehen-Kohleausstieg/!5967048/,https://taz.de/Lindner-gegen-fruehen-Kohleausstieg/!5967048/,0,taz.de,Lindner gegen frühen Kohleausstieg: Deutschland plant zu kurz,Die Bundesregierung wollte den Kohleausstieg „idealerweise“ auf 2030 vorziehen. Dafür fehlen noch etliche Maßnahmen – und eine realistische Planung.,https://taz.de/picture/6624691/948/christian-lindner-fdp-steuerschaetzung-portrait-1.jpeg,2023-11-01T18:03:00Z,,"Die Bundesregierung wollte den Kohleausstieg idealerweise auf 2030 vorziehen. Dafür fehlen noch etliche Maßnahmen und eine realistische Planung.
Bundesfinanzminister Christian Lindner Foto: Kay Niet… [+1924 chars]",,de,'Kohleausstieg'
https://www.diepresse.com/17785511/berlin-will-preisbremse-fuer-energie-verlaengern,https://www.diepresse.com/17785511/berlin-will-preisbremse-fuer-energie-verlaengern,0,www.diepresse.com,Berlin will Preisbremse für Energie verlängern,Vor allem kleinere Staaten kritisieren die Hilfen in Milliardenhöhe und sehen in ihnen eine Wettbewerbsverzerrung.,https://img.diepresse.com/public/incoming/tq045e-kein-Titel/alternates/DPR_SOCIAL_NACHRICHTEN/%28kein%20Titel%29,2023-11-01T18:49:31Z,,"Vor allem kleinere Staaten kritisieren die Hilfen in Milliardenhöhe und sehen in ihnen eine Wettbewerbsverzerrung. 
Die deutsche Bundesregierung bereitet die Verlängerung der Preisbremsen für Strom,… [+1471 chars]",,de,'Preisbremse'
https://www.tagesspiegel.de/gesellschaft/panorama/verlegung-musste-gestoppt-werden-taucher-von-greenpeace-behindern-bau-von-lng-pipeline-vor-rugen-10717609.html,https://www.tagesspiegel.de/gesellschaft/panorama/verlegung-musste-gestoppt-werden-taucher-von-greenpeace-behindern-bau-von-lng-pipeline-vor-rugen-10717609.html,0,www.tagesspiegel.de,Verlegung gestoppt: Taucher von Greenpeace behindern Bau von LNG-Pipeline,Die rund 50 Kilometer lange Leitung soll das geplante LNG-Terminal auf Rügen mit dem Gasleitungsknotenpunkt in Lubmin verbinden. Aktivisten protestierten unter Wasser gegen den Ausbau.,https://www.tagesspiegel.de/images/greenpeace-demonstriert-gegen-pipeline-fur-lng-terminal/alternates/BASE_16_9_W1400/greenpeace-demonstriert-gegen-pipeline-fuer-lng-terminal.jpeg,2023-11-01T19:14:59Z,,"Mit zwei Tauchern hat die Umweltorganisation Greenpeace die Verlegung eines Pipeline-Rohrs vor Rügen behindert. Die Aktion richtete sich gegen das Terminal für Flüssigerdgas (LNG), das vor der Küste … [+2890 chars]",,de,'LNG'
https://www.stern.de/wirtschaft/news/umfrage--mehrheit-optimistisch-bei-energieversorgung-im-winter-33962710.html,https://www.stern.de/wirtschaft/news/umfrage--mehrheit-optimistisch-bei-energieversorgung-im-winter-33962710.html,0,www.stern.de,Umfrage: Mehrheit optimistisch bei Energieversorgung im Winter,Reichen die Speicherkapazitäten für den bevorstehenden Winter aus? Laut einer Umfrage sieht eine Mehrheit die Versorgung als gesichert an. Energie sparen sollte man trotzdem.,https://image.stern.de/33962712/t/zX/v1/w1440/r1.7778/-/01--urnnewsmldpacom2009010123110199785292v3w800h600l0t0r2112b1546jpeg---9b05391780c1c0c3.jpg,2023-11-01T20:12:00Z,,"Reichen die Speicherkapazitäten für den bevorstehenden Winter aus? Laut einer Umfrage sieht eine Mehrheit die Versorgung als gesichert an. Energie sparen sollte man trotzdem.
Eine große Mehrheit der… [+1524 chars]",,de,'Energieversorgung'
https://www.sueddeutsche.de/wirtschaft/gas-energie-bundesnetzagentur-1.6296859,https://www.sueddeutsche.de/wirtschaft/gas-energie-bundesnetzagentur-1.6296859,0,www.sueddeutsche.de,"Gasversorgung: ""Wir sind viel, viel besser vorbereitet als vor zwölf Monaten""","Klaus Müller, Präsident der Bundesnetzagentur, sieht keine Probleme für die Versorgung mit Gas - wenn die Menschen weiter Gas sparen und der Winter nicht außergewöhnlich hart wird.",https://www.sueddeutsche.de/image/sz.1.6296861/1200x675?v=1698847443,2023-11-02T05:04:51Z,https://web.archive.org/web/20231102112348/https://www.sueddeutsche.de/wirtschaft/gas-energie-bundesnetzagentur-1.6296859,"Klaus Müller, Präsident der Bundesnetzagentur, sieht keine Probleme für die Versorgung mit Gas - wenn die Menschen weiter Gas sparen und der Winter nicht außergewöhnlich hart wird.Die Namen der Veran… [+578 chars]",,de,'Bundesnetzagentur'
https://www.faz.net/aktuell/wirtschaft/energiewende-rwe-zieht-schiedsklage-wegen-kohleausstiegs-zurueck-19284072.html,https://www.faz.net/aktuell/wirtschaft/energiewende-rwe-zieht-schiedsklage-wegen-kohleausstiegs-zurueck-19284072.html,0,www.faz.net,RWE zieht Schiedsklage wegen Kohleausstieg zurück,"RWE wollte wie der Konkurrent Uniper eine Entschädigung für den Kohleausstieg, den die Niederlande bis zum Jahr 2030 beschlossen hatten. Doch der Konzern hat das Schiedsverfahren nun für beendet erklärt.",https://media0.faz.net/ppmedia/aktuell/2385453674/1.9284070/facebook_teaser/streitpunkt-kohlestrom-das-rwe.jpg,2023-11-02T06:29:51Z,,"RWE zieht seine milliardenschwere Schiedsklage gegen die Niederlande zurück. Auf 1,4 Milliarden Euro hatte der deutsche Energiekonzern den Staat vor dem Internationalen Zentrum zur Beilegung von Inve… [+3242 chars]",,de,'Kohleausstieg'
