index,url,valid,domain,title,description,image,published,archive,content,quote,language,keyword
https://www.stern.de/wirtschaft/news/energie--bundesnetzagentur-zur-gasversorgung---kein-grund-zur-sorge--34355462.html,https://www.stern.de/wirtschaft/news/energie--bundesnetzagentur-zur-gasversorgung---kein-grund-zur-sorge--34355462.html,0,www.stern.de,"Energie: Bundesnetzagentur zur Gasversorgung: ""Kein Grund zur Sorge""",Düsseldorf - Deutschland greift wegen des eisigen Wetters nach Angaben der Bundesnetzagentur seine Gasreserven an. Der Behörde zufolge ist dies aber,https://image.stern.de/34355464/t/vX/v1/w1440/r1.7778/-/11--urnnewsmldpacom2009010124011199563448v3w800h600l640t425r1920b1278jpeg---7b08dc1084044aff.jpg,2024-01-11T01:18:18Z,,"Trotz kalter Temperaturen in Deutschland sind die Gasspeicher weiterhin gut gefüllt. Die Bundesnetzagentur rät dennoch zur Sparsamkeit.
Deutschland greift wegen des eisigen Wetters nach Angaben der … [+1336 chars]",,de,'Gasmangellage'
https://www.zeit.de/news/2024-01/11/bundesnetzagentur-zur-gasversorgung-kein-grund-zur-sorge,https://www.zeit.de/news/2024-01/11/bundesnetzagentur-zur-gasversorgung-kein-grund-zur-sorge,0,www.zeit.de,Energie: Bundesnetzagentur zur Gasversorgung: «Kein Grund zur Sorge»,"Hier finden Sie Informationen zu dem Thema „Energie“. Lesen Sie jetzt „Bundesnetzagentur zur Gasversorgung: ""Kein Grund zur Sorge""“.",https://img.zeit.de/news/2024-01/11/bundesnetzagentur-zur-gasversorgung-kein-grund-zur-sorge-image-group/wide__1300x731,2024-01-11T01:18:18Z,,Deutschland greift wegen des eisigen Wetters nach Angaben der Bundesnetzagentur seine Gasreserven an. Der Behörde zufolge ist dies aber «kein Grund zur Sorge». «Wegen der kalten Temperaturen wird sei… [+1929 chars],,de,'Bundesnetzagentur'
https://www.focus.de/finanzen/news/energie-bundesnetzagentur-zur-gasversorgung-kein-grund-zur-sorge_id_259565763.html,https://www.focus.de/finanzen/news/energie-bundesnetzagentur-zur-gasversorgung-kein-grund-zur-sorge_id_259565763.html,0,www.focus.de,Energie - Bundesnetzagentur zur Gasversorgung: «Kein Grund zur Sorge»,Trotz kalter Temperaturen in Deutschland sind die Gasspeicher weiterhin gut gefüllt. Die Bundesnetzagentur rät dennoch zur Sparsamkeit.,https://p6.focus.de/img/finanzen/news/id_259565762/laut-der-bundesnetzagentur-sind-die-speicher-in-deutschland-mit-88-8-prozent-gut-gefuellt..jpg?im=Crop%3D%280%2C170%2C2048%2C1024%29%3BResize%3D%281200%2C627%29&impolicy=perceptual&quality=mediumHigh&hash=3e446a186e80761a8a2c2dd8bde4634b138e8f14dcf79ef20921c731f75a8c22,2024-01-11T01:25:04Z,,Deutschland greift wegen des eisigen Wetters nach Angaben der Bundesnetzagentur seine Gasreserven an. Der Behörde zufolge ist dies aber «kein Grund zur Sorge». «Wegen der kalten Temperaturen wird sei… [+1161 chars],,de,'Gasmangellage'
https://www.ibiza-heute.de/ibiza-leserfoto-des-tages-in-ibizaheute-222/,https://www.ibiza-heute.de/ibiza-leserfoto-des-tages-in-ibizaheute-222/,0,www.ibiza-heute.de,Ibiza: Leserfoto des Tages in IbizaHEUTE,"Rosen mitten im Winter – die milden Temperaturen im Dezember und jetzt im neuen Jahr lassen die Rosen in den […]
Der Beitrag Ibiza: Leserfoto des Tages in IbizaHEUTE erschien zuerst auf Ibiza Heute.",https://www.ibiza-heute.de/wp-content/uploads/2024/01/Ibiza-Rosen.MBA_.jpg,2024-01-11T05:00:00Z,,"Rosen mitten im Winter – die milden Temperaturen im Dezember und jetzt im neuen Jahr lassen die Rosen in den Gärten der Insel sprießen. Auch die Mandelbäume stehen in den Startlöchern, um ihre großen… [+435 chars]",,de,'milden Winter'
https://www.diepresse.com/17980940/reiberei-um-russengas-verzoegert-sicherheitsstrategie,https://www.diepresse.com/17980940/reiberei-um-russengas-verzoegert-sicherheitsstrategie,0,www.diepresse.com,Reiberei um Russengas verzögert Sicherheitsstrategie [premium],Bis Jahresende wollten ÖVP und Grüne die neue Sicherheitsstrategie vorlegen. Beim Thema Energiesicherheit konnte sich die Koalition aber noch nicht einigen. Die Opposition mahnt zur Eile.,https://img.diepresse.com/public/incoming/3pzspe-kein-Titel/alternates/DPR_SOCIAL_NACHRICHTEN_PAID/%28kein%20Titel%29,2024-01-11T09:19:05Z,,"Bis Jahresende wollten ÖVP und Grüne die neue Sicherheitsstrategie vorlegen. Beim Thema Energiesicherheit konnte sich die Koalition aber noch nicht einigen. Die Opposition mahnt zur Eile. 
Wien. Es … [+852 chars]",,de,'Energiesicherheit'
https://www.n-tv.de/politik/Krisenpolitik-und-Zinsen-erhoehen-Schuldenberg-article24654633.html,https://www.n-tv.de/politik/Krisenpolitik-und-Zinsen-erhoehen-Schuldenberg-article24654633.html,0,www.n-tv.de,"91,5 Milliarden Euro Defizit: Krisenpolitik und Zinsen erhöhen Schuldenberg",Mit Milliarden federt die Regierung die hohen Energiepreise ab und fördert den Umstieg auf den ÖPNV. Dies lässt sich nur über Kredite finanzieren. Das treibt die Verschuldung. Doch auch Kredite werden teurer.,https://bilder2.n-tv.de/img/incoming/crop24654665/1001323316-cImg_16_9-w1200/413532190-2-.jpg,2024-01-11T11:34:59Z,,Mit Milliarden federt die Regierung die hohen Energiepreise ab und fördert den Umstieg auf den ÖPNV. Dies lässt sich nur über Kredite finanzieren. Das treibt die Verschuldung. Doch auch Kredite werde… [+3448 chars],,de,'Energiepreise'
https://taz.de/Hohe-Strompreise/!5985068/,https://taz.de/Hohe-Strompreise/!5985068/,0,taz.de,Hohe Strompreise: Regierung soll Kosten dämpfen,"Der Branchenverband der Energiewirtschaft fordert eine Senkung der Stromsteuer. Und zwar nicht nur für Unternehmen, sondern auch für Privatleute.",https://taz.de/picture/6758863/948/34021936-1.jpeg,2024-01-11T15:04:00Z,,"Der Branchenverband der Energiewirtschaft fordert eine Senkung der Stromsteuer. Und zwar nicht nur für Unternehmen, sondern auch für Privatleute.
Die Netzentgelte sind nach den Beschaffungskosten di… [+3925 chars]",,de,'Energiewirtschaft'
https://www.diepresse.com/17982682/wo-bleibt-das-gesetz-fuer-gruenes-gas,https://www.diepresse.com/17982682/wo-bleibt-das-gesetz-fuer-gruenes-gas,0,www.diepresse.com,Wo bleibt das Gesetz für Grünes Gas?,"Die Branche hat wirklich kein Verständnis mehr dafür, dass das Erneuerbare-Gase-Gesetz (EGG) weiter hinausgezögert wird. Die Politik muss endlich handeln.",https://www.diepresse.com/assets_v2/images/diepresse_meinung.png,2024-01-11T15:05:54Z,,"Die Branche hat wirklich kein Verständnis mehr dafür, dass das Erneuerbare-Gase-Gesetz (EGG) weiter hinausgezögert wird. Die Politik muss endlich handeln. 
Das Erneuerbare-Gase-Gesetz (EGG) sieht im… [+3670 chars]",,de,'Gas Erneuerbare'
https://www.sueddeutsche.de/projekte/artikel/wirtschaft/gastronomie-preisanstieg-mehrwertsteuer-e514951/,https://www.sueddeutsche.de/projekte/artikel/wirtschaft/gastronomie-preisanstieg-mehrwertsteuer-e514951/,0,www.sueddeutsche.de,Gastronomie: Wenn der Restaurantbesuch zum Luxus wird,"Pandemie, steigende Energiekosten und nun ist wieder der volle Mehrwertsteuersatz fällig. Viele Gastwirte haben zum Jahresbeginn die Preise erhöht. Für Branche und Gäste ist das ein Problem.","https://www.sueddeutsche.de/projekte/artikel/wirtschaft/gastronomie-preisanstieg-mehrwertsteuer-e514951/72572e5b52ac3323cacbc030af1d287253bcc5405c63e76dcca5f10df45cfde3_w2400_h1256_r40,0,2079,1088_oszplus_q70.png",2024-01-11T16:42:46Z,,"Pandemie, steigende Energiekosten und nun ist wieder der volle Mehrwertsteuersatz fällig. Viele Gastwirte haben zum Jahresbeginn die Preise erhöht. Für Branche und Gäste ist das ein Problem.",,de,'Energiekosten'
https://www.zeit.de/news/2024-01/11/lng-arbeiten-wegen-eilverfahren-gestoppt,https://www.zeit.de/news/2024-01/11/lng-arbeiten-wegen-eilverfahren-gestoppt,0,www.zeit.de,Greifswalder Bodden: LNG-Arbeiten wegen Eilverfahren gestoppt,Hier finden Sie Informationen zu dem Thema „Greifswalder Bodden“. Lesen Sie jetzt „LNG-Arbeiten wegen Eilverfahren gestoppt“.,https://img.zeit.de/news/2024-01/11/lng-arbeiten-wegen-eilverfahren-gestoppt-image-group/wide__1300x731,2024-01-11T17:12:58Z,,Der Gasnetzbetreiber Gascade hat wegen eines laufenden Eilverfahrens Arbeiten im Zusammenhang mit dem Rügener LNG-Terminal im Greifswalder Bodden vorläufig gestoppt. «Bis zu einer Entscheidung des Bu… [+3255 chars],,de,'LNG-Terminal'
https://www.welt.de/debatte/kommentare/article249481204/IEA-erwartet-Oekostrom-Rekord-Warum-die-Wind-und-Solarzahlen-taeuschen.html,https://www.welt.de/debatte/kommentare/article249481204/IEA-erwartet-Oekostrom-Rekord-Warum-die-Wind-und-Solarzahlen-taeuschen.html,0,www.welt.de,Warum die Rekordzahlen der Wind- und Solarkraft täuschen,Laut Internationaler Energieagentur IEA könnte die von den UN erhoffte Verdreifachung der erneuerbaren Energien bald geschafft sein. Doch gemessen am Bedarf der ganzen Welt ist das Volumen weiter winzig. Zumal die Zahlen zur Kapazität neuer Wind- und Solaranl…,https://img.welt.de/img/wirtschaft/mobile246595496/1831355077-ci16x9-w1200/Autorenfoto-NEU-DIE-WELT-Fotoshooting-2.jpg,2024-01-11T20:40:37Z,,"Die globale Energiewende eilt von Rekord zu Rekord. Die von den Vereinten Nationen angestrebte Verdreifachung der erneuerbaren Energien in den nächsten sieben Jahren ist in Reichweite, vermeldet die … [+2272 chars]",,de,'Energieagentur'
https://tirol.orf.at/stories/3240147/,https://tirol.orf.at/stories/3240147/,0,tirol.orf.at,So funktioniert die Heizungstauschförderung,"Mit Anfang des neuen Jahres sind für Wärmepumpen, Pelletsheizungen und den Anschluss an Fernwärme die Förderungen des Bundes erhöht worden. Um Kosten rückerstattet zu bekommen, gibt es einige Anforderungen. Voraussetzung ist jedenfalls der Ausstieg aus einer …",https://ibs.orf.at/tir?image=https%3A%2F%2Foekastatic.orf.at%2Fmims%2F2022%2F49%2F98%2Fcrops%2Fw%3D1200%2Ch%3D627%2Cq%3D75%2F1592896_master_583298_waermepumpe_.jpg%3Fs%3D1ce48094a3b70c41023f855b90becea6302f075f,2024-01-12T05:17:51Z,,"Förderfähig sind verschiedene Arten von Wärmepumpen, Holzheizungen und der Anschluss an Fernwärme, sofern diese klimaschonend betrieben wird. In Tirol täten das die meisten Fernwärmeanbieter, sagt Br… [+3984 chars]",,de,'Gasheizung'
https://www.welt.de/wirtschaft/article249388052/Bundesnetzagentur-Chef-Klaus-Mueller-Der-Mann-der-jetzt-Musk-auf-die-Finger-gucken-muss.html,https://www.welt.de/wirtschaft/article249388052/Bundesnetzagentur-Chef-Klaus-Mueller-Der-Mann-der-jetzt-Musk-auf-die-Finger-gucken-muss.html,0,www.welt.de,"Der Mann, der jetzt Musk auf die Finger gucken muss",Der neue Digital Service Act der EU bringt der Bundesnetzagentur neue Kompetenzen bei der Regulierung von Online-Plattformen und Social Media. Deren Chef Klaus Müller sieht darin im Gespräch Schutz vor Hassrede und Fake-News – doch es gibt auch Bedenken.,https://img.welt.de/img/wirtschaft/mobile249486576/7401353927-ci16x9-w1200/Klaus-Mueller-2022.jpg,2024-01-12T06:32:02Z,,"Die Bundesnetzagentur, bislang vor allem für die Regulierung der Energie- und Telekommunikationsmärkte zuständig, übernimmt ab Februar eine zusätzliche Rolle: Die Bundesbehörde ist künftig als nation… [+13811 chars]",,de,'Energiesicherheit'
https://www.mobiflip.de/shortnews/e-on-verdoppelt-preis-fuer-waermepumpen-strom/,https://www.mobiflip.de/shortnews/e-on-verdoppelt-preis-fuer-waermepumpen-strom/,0,www.mobiflip.de,E.ON verdoppelt Preis für Wärmepumpen-Strom,"E.ON wird ab dem 1. Februar 2024 die Preise für Heizstromtarife im Grundversorgungsgebiet etwa verdoppeln, was zu höheren Kosten für Verbraucher mit Stromheizungen führen kann, wenn diese nicht handeln. Dies […]",https://www.mobiflip.de/wp-content/uploads/2023/05/waermepumpe.jpg,2024-01-12T07:25:40Z,,"E.ON wird ab dem 1. Februar 2024 die Preise für Heizstromtarife im Grundversorgungsgebiet etwa verdoppeln, was zu höheren Kosten für Verbraucher mit Stromheizungen führen kann, wenn diese nicht hande… [+2140 chars]",,de,'Energiekosten'
https://www.zeit.de/news/2024-01/12/stadtvertreter-lehnen-buergerbegehren-gegen-lng-terminal-ab,https://www.zeit.de/news/2024-01/12/stadtvertreter-lehnen-buergerbegehren-gegen-lng-terminal-ab,0,www.zeit.de,Energie: Stadtvertreter lehnen Bürgerbegehren gegen LNG-Terminal ab,Hier finden Sie Informationen zu dem Thema „Energie“. Lesen Sie jetzt „Stadtvertreter lehnen Bürgerbegehren gegen LNG-Terminal ab“.,https://img.zeit.de/administratives/sharing/fallback-image/wide__1300x731,2024-01-12T09:45:09Z,,Ein gegen das Rügener LNG-Terminal gerichtetes Bürgerbegehren ist laut Sassnitzer Stadtvertretung nicht zulässig. In einer Sondersitzung am Donnerstagabend stimmte eine knappe Mehrheit der Stadtvertr… [+2929 chars],,de,'LNG-Terminal'
https://taz.de/Marode-Infrastruktur-in-Russland/!5984820/,https://taz.de/Marode-Infrastruktur-in-Russland/!5984820/,0,taz.de,"Marode Infrastruktur in Russland: „Wir erfrieren. Putin, helfen Sie!“",Der extrem kalte Winter legt die marode russische Infrastruktur offen. Zehntausende Menschen frieren und schicken Hilferufe an Präsident Putin.,https://taz.de/picture/6754777/948/34388776-1.jpeg,2024-01-12T09:59:00Z,,"Der extrem kalte Winter legt die marode russische Infrastruktur offen. Zehntausende Menschen frieren und schicken Hilferufe an Präsident Putin.
Meteorologen melden für ganz Russland für diesen Janua… [+4215 chars]",,de,'Winter frieren'
https://www.welt.de/politik/deutschland/article249488572/Joe-Kaeser-Wir-schliessen-letzte-voellig-intakte-Atomkraftwerke-und-setzen-nun-auf-teures-fluessiges-Gas.html,https://www.welt.de/politik/deutschland/article249488572/Joe-Kaeser-Wir-schliessen-letzte-voellig-intakte-Atomkraftwerke-und-setzen-nun-auf-teures-fluessiges-Gas.html,0,www.welt.de,"„Wir schließen letzte, völlig intakte Atomkraftwerke und setzen nun auf teures flüssiges Gas“","Manager Joe Kaeser wirft der deutschen Politik vor, zu „oft in Legislaturperioden zu denken“. Dadurch sei es für die Wirtschaft schwer, eine vernünftige Zukunftsplanung aufzustellen. Eine Industrienation wie Deutschland könne so nicht geführt werden.",https://img.welt.de/img/bildergalerien/mobile249488498/2371353737-ci16x9-w1200/SZ-Streitgespraech-mit-Ricarda-Lang-und-Joe-Kaeser-2023.jpg,2024-01-12T12:00:50Z,,"Eine Energie-Agenda 2035 wäre die wichtigste gemeinsame Aufgabe von Politik und Wirtschaft. Dieser Dialog findet aktuell nicht statt, sagt Joe Kaeser, Aufsichtsratschef von Siemens Energy, gegenüber … [+1557 chars]",,de,'Gas Industrie'
https://www.n-tv.de/wirtschaft/Deutsche-drehen-Heizungen-wieder-hoeher-article24658024.html,https://www.n-tv.de/wirtschaft/Deutsche-drehen-Heizungen-wieder-hoeher-article24658024.html,0,www.n-tv.de,Weniger Sparsamkeit: Deutsche drehen Heizungen wieder höher,"Weiter sparsam sein oder höher drehen? In diesem Winter entscheiden sich viele Menschen bei ihrer Heizung vermehrt für Letzteres. Die Gaspreise sind zwar mittlerweile deutlich gesunken, befinden sich aber immer noch auf einem relativ hohen Niveau. Für viele V…",https://bilder4.n-tv.de/img/incoming/crop24658159/6821328174-cImg_16_9-w1200/388329710.jpg,2024-01-12T13:29:57Z,,"Weiter sparsam sein oder höher drehen? In diesem Winter entscheiden sich viele Menschen bei ihrer Heizung vermehrt für Letzteres. Die Gaspreise sind zwar mittlerweile deutlich gesunken, befinden sich… [+1916 chars]",,de,'Gaspreis'
https://www.zeit.de/news/2024-01/12/inflation-in-mv-ueber-bundesdurchschnitt,https://www.zeit.de/news/2024-01/12/inflation-in-mv-ueber-bundesdurchschnitt,0,www.zeit.de,Verbraucher: Inflation in MV über Bundesdurchschnitt,Hier finden Sie Informationen zu dem Thema „Verbraucher“. Lesen Sie jetzt „Inflation in MV über Bundesdurchschnitt“.,https://img.zeit.de/administratives/sharing/fallback-image/wide__1300x731,2024-01-12T14:44:50Z,,"Weiterhin kräftige Preissprünge bei Lebensmitteln und Energie halten die Inflation in Mecklenburg-Vorpommern hoch, auch über dem Bundesdurchschnitt. Wie das Statistische Amt am Freitag in Schwerin be… [+2981 chars]",,de,'Heizöl'
https://www.sueddeutsche.de/bayern/bayern-haftbefehl-mordversuch-holzdiebe-1.6332255,https://www.sueddeutsche.de/bayern/bayern-haftbefehl-mordversuch-holzdiebe-1.6332255,0,www.sueddeutsche.de,Wiesentheid: Mann angefahren - Haftbefehl wegen versuchten Mordes,"Ein 44-Jähriger beobachtet zwei Männer beim Holzdiebstahl. Als er sie bei ihrer Flucht aufhalten wollte, landete er auf der Motorhaube des Autos.",https://www.sueddeutsche.de/image/sz.1.5836606/1200x675?v=1705071882,2024-01-12T15:04:50Z,,Ein 29 Jahre alter mutmaßlicher Holzdieb ist wegen des Verdachts auf versuchten Mord und räuberischen Diebstahls in Untersuchungshaft gekommen. Wie Polizei und Staatsanwaltschaft am Freitag mitteilte… [+938 chars],,de,'Holzdiebstahl'
https://futurezone.at/produkte/start-up-heizung-myeko-hestiia-smart-elektro-krypto-bitcoin-chips-rechenzentrum-konvektion/402739750,https://futurezone.at/produkte/start-up-heizung-myeko-hestiia-smart-elektro-krypto-bitcoin-chips-rechenzentrum-konvektion/402739750,0,futurezone.at,"Start-up verkauft Heizung, die nach Kryptowährung schürft","Die Elektroheizung nutzt Chips aus Rechenzentren. Die Rechenleistung wird verkauft, um die Heizkosten zu reduzieren.",https://image.futurezone.at/images/facebook/8448364/16e6951d6e4e6793220836f5addf20e120d6bb15-2560x1800png.jpg,2024-01-12T15:18:47Z,,"12.01.2024
Die Elektroheizung nutzt Chips aus Rechenzentren. Die Rechenleistung wird verkauft, um die Heizkosten zu reduzieren.
Hestiia MyEko
© Hestiia
Hestiia MyEko
© Hestiia
Toggle Infobox
U… [+196 chars]",,de,'Heizkosten'
https://www.zeit.de/news/2024-01/12/aenderungsantrag-soll-zeitplan-fuer-lng-terminal-sichern,https://www.zeit.de/news/2024-01/12/aenderungsantrag-soll-zeitplan-fuer-lng-terminal-sichern,0,www.zeit.de,Gascade: Änderungsantrag soll Zeitplan für LNG-Terminal sichern,Hier finden Sie Informationen zu dem Thema „Gascade“. Lesen Sie jetzt „Änderungsantrag soll Zeitplan für LNG-Terminal sichern“.,https://img.zeit.de/news/2024-01/12/aenderungsantrag-soll-zeitplan-fuer-lng-terminal-sichern-image-group/wide__1300x731,2024-01-12T15:38:12Z,,Mit einem Änderungsantrag will der Gasnetzbetreiber Gascade die Anbindungsleitung für das Rügener LNG-Terminal auch vor Abschluss der kürzlich gestoppten Arbeiten im Greifswalder Bodden betreiben kön… [+2471 chars],,de,'LNG-Terminal'
https://www.capital.de/wirtschaft-politik/das-waermepumpen-desaster--wie-fortschritt-kaputtgeredet-wird-34350414.html,https://www.capital.de/wirtschaft-politik/das-waermepumpen-desaster--wie-fortschritt-kaputtgeredet-wird-34350414.html,0,www.capital.de,Energiewende: Das Wärmepumpen-Desaster: Wie Fortschritt in Deutschland kaputtgeredet wird,"Erst gehypt, dann verteufelt: Die Wärmepumpe geriet 2023 zwischen die Fronten von Politik, Lobbys und Boulevardmedien. Ein absurdes Lehrstück.",https://image.stern.de/34356506/t/th/v5/w1440/r1.7778/-/waermepumpen-stiebel-eltron-aufmacher.jpg,2024-01-13T06:59:00Z,,"Dieser Artikel ist eine Übernahme von Capital+, dem digitalen Premium-Angebot von Capital. Für Sie als stern PLUS-Abonnenten ist er exklusiv hier für eine Woche abrufbar. Danach wird er wieder aussch… [+3483 chars]",,de,'Wärmepumpe'
https://www.n-tv.de/wirtschaft/Netzagentur-droht-Post-mit-finanziellen-Konsequenzen-article24660534.html,https://www.n-tv.de/wirtschaft/Netzagentur-droht-Post-mit-finanziellen-Konsequenzen-article24660534.html,0,www.n-tv.de,"Beschwerden auf Rekordniveau: Netzagentur droht Post mit ""finanziellen Konsequenzen""","Der Rekord an Kundenbeschwerden über Post- und Paketdienstleister im Jahr 2022 war kein Ausreißer. Laut Netzagentur-Präsident Müller lag die Zahl der Beschwerden 2023 ähnlich hoch. Der Behörden-Chef hat auch Ratschläge parat, wie die Unternehmen die Probleme …",https://bilder4.n-tv.de/img/incoming/crop24660535/0261326697-cImg_16_9-w1200/437497750.jpg,2024-01-13T20:29:15Z,,Der Rekord an Kundenbeschwerden über Post- und Paketdienstleister im Jahr 2022 war kein Ausreißer. Laut Netzagentur-Präsident Müller lag die Zahl der Beschwerden 2023 ähnlich hoch. Der Behörden-Chef … [+2190 chars],,de,'Netzagentur'
https://www.welt.de/wirtschaft/article249517830/Deutsche-Post-Hohe-Unzuverlaessigkeit-Netzagentur-fordert-finanzielle-Konsequenzen.html,https://www.welt.de/wirtschaft/article249517830/Deutsche-Post-Hohe-Unzuverlaessigkeit-Netzagentur-fordert-finanzielle-Konsequenzen.html,0,www.welt.de,Hohe Unzuverlässigkeit der Post – Netzagentur fordert finanzielle Konsequenzen,"Es hat im Jahr 2023 dreimal so viele Beschwerden über die Unzuverlässigkeit der Post gegeben wie vor zwei Jahren, stellt der Chef der Bundesnetzagentur fest. Es müsse finanzielle Konsequenzen gaben. Auch bei anderen Problemen nimmt er die Post stärker in die …",https://img.welt.de/img/bildergalerien/mobile249517828/1381355777-ci16x9-w1200/Postgesetz-Reform.jpg,2024-01-14T03:25:59Z,,"Der Präsident der Bundesnetzagentur, Klaus Müller, hat sich enttäuscht über die Zuverlässigkeit von Postdienstleistern im abgelaufenen Jahr gezeigt und will künftig mit finanziellen Konsequenzen gege… [+1809 chars]",,de,'Netzagentur'
https://www.zeit.de/politik/deutschland/2024-01/bundesnetzagentur-deutsche-post-konsequenzen-unzuverlaessigkeit-zustellung-brief,https://www.zeit.de/politik/deutschland/2024-01/bundesnetzagentur-deutsche-post-konsequenzen-unzuverlaessigkeit-zustellung-brief,0,www.zeit.de,Deutsche Post: Netzagentur will finanzielle Folgen für Unzuverlässigkeit der Post,"Beschwerden über Post- und Paketdienste häufen sich. Die Bundesnetzagentur will deshalb nicht mehr nur ermahnen, sondern fordert finanzielle Konsequenzen.",https://img.zeit.de/politik/deutschland/2024-01/deutsche-post/wide__1300x731,2024-01-14T06:20:37Z,,"Der Präsident der Bundesnetzagentur, Klaus Müller, hat sich enttäuscht über die Zuverlässigkeit von Postdienstleistern im abgelaufenen Jahr gezeigt und würde künftig gern mit finanziellen Konsequenze… [+2163 chars]",,de,'Netzagentur'
https://www.tagesschau.de/wirtschaft/unternehmen/bundesnetzagentur-post-100.html,https://www.tagesschau.de/wirtschaft/unternehmen/bundesnetzagentur-post-100.html,0,www.tagesschau.de,Netzagentur droht Post finanzielle Folgen wegen Unzuverlässigkeit an,"Der Chef der Bundesnetzagentur, Müller, hat laut einem Bericht angekündigt, die Post finanziell sanktionieren zu wollen. Auch 2023 habe es wieder Kundenbeschwerden in Rekordhöhe gegeben. Ermahnungen seien nicht mehr ausreichend.",https://images.tagesschau.de/image/18a464be-411e-4e15-a53b-67d1ae42f4e2/AAABjQae2V4/AAABibBxqrQ/16x9-1280/brieftraegerwagen-post-100.jpg,2024-01-14T06:55:01Z,,"Stand: 14.01.2024 07:55 Uhr
Der Chef der Bundesnetzagentur, Müller, hat laut einem Bericht angekündigt, die Post finanziell sanktionieren zu wollen. Auch 2023 habe es wieder Kundenbeschwerden in Rek… [+1612 chars]",,de,'Netzagentur'
https://www.zeit.de/digital/2024-01/bundesnetzagentur-beschwerden-betrug-pishing-zollgebuehren,https://www.zeit.de/digital/2024-01/bundesnetzagentur-beschwerden-betrug-pishing-zollgebuehren,0,www.zeit.de,Pishing: Deutlich mehr Beschwerden über Betrugsversuche per SMS,"Verbraucher melden mehr Fälle, in denen Kriminelle sie in Kurznachrichten zu Zahlungen von Zollgebühren auffordern. Die Bundesnetzagentur warnt davor, Daten preiszugeben.",https://img.zeit.de/digital/2024-01/bundesnetzagentur-beschwerden-betrug-pishing-zollgebuehren-bild/wide__1300x731,2024-01-14T07:11:05Z,,"Die Betrugsmasche, bei der Kriminelle eine Textnachricht verschicken und sich als Paketdienstleister oder andere Firmen tarnen, hat stark zugenommen. Wie die Bundesnetzagentur auf Anfrage mitteilte, … [+1608 chars]",,de,'Bundesnetzagentur'
https://www.bild.de/sport/fussball/sv-darmstadt-98/nach-pfeiffer-blackout-lieberknecht-kuendigt-neuen-darmstadt-stuermer-an-86756556.bild.html,https://www.bild.de/sport/fussball/sv-darmstadt-98/nach-pfeiffer-blackout-lieberknecht-kuendigt-neuen-darmstadt-stuermer-an-86756556.bild.html,0,www.bild.de,Nach Blackout von Pfeiffer - Lieberknecht kündigt neuen Darmstadt-Stürmer an,Schlusslicht Darmstadt wartet nach dem 0:3 gegen Dortmund seit 10 Spielen auf einen Sieg.Foto: picture alliance / HMB Media,"https://images.bild.de/65a3e11df973e23df9cae361/d42a05e6c07189139525b7669526f9e9,c0f8f182?w=1280",2024-01-14T15:02:11Z,,"Diese Lilien könnten einem schon fast leidtun 
Nach dem 0:3 gegen Dortmund wartet Schlusslicht Darmstadt seit mittlerweile 10 (!) Spielen auf einen Bundesliga-Sieg. Die Truppe von Torsten Lieberknec… [+1584 chars]",,de,'Blackout'
https://www.morgenpost.de/politik/article241420848/Geheimtipp-Hybridheizung-Wann-sie-besonders-effizient-ist.html,https://www.morgenpost.de/politik/article241420848/Geheimtipp-Hybridheizung-Wann-sie-besonders-effizient-ist.html,0,www.morgenpost.de,Geheimtipp Hybridheizung – Wann sie besonders effizient ist,"Eine Wärmepumpe mit einem klassischen Heizsystem zu kombinieren, hat viele Vorteile – aber auch einen Nachteil. Der Experte gibt Rat.",https://img.sparknews.funkemedien.de/240868860/240868860_1703256658_v4_3_800.jpeg,2024-01-14T16:02:58Z,,"Berlin. Eine Wärmepumpe mit einem klassischen Heizsystem zu kombinieren, hat viele Vorteile aber auch einen Nachteil. Der Experte gibt Rat.
Julian Schwark ist Schornsteinfeger, Energieberater und Mi… [+4276 chars]",,de,'Wärmepumpe'
