index,url,valid,domain,title,description,image,published,archive,content,quote,language,keyword
https://m.focus.de/wissen/natur/meteorologie/jahr-startet-mit-unwettergefahr-schnee-und-100-liter-regen-der-winter-meldet-sich-zurueck-und-hochwasserlage-spitzt-sich-zu_id_259539887.html,https://m.focus.de/wissen/natur/meteorologie/jahr-startet-mit-unwettergefahr-schnee-und-100-liter-regen-der-winter-meldet-sich-zurueck-und-hochwasserlage-spitzt-sich-zu_id_259539887.html,0,m.focus.de,Schnee und 100 Liter Regen - Der Winter meldet sich zurück und Hochwasserlage spitzt sich wieder zu,"In der Neujahrswoche zeichnet sich ein Wetterkontrast ab, bei dem kältere Skandinavienluft in den Nordosten sickert. Diese wird allerdings schnell von milder und feuchter Luft aus Westen abgebremst, sodass es im Süden und Westen weiterhin mild und nass weiter…",https://p6.focus.de/img/fotos/id_259539854/de-winter-januar1123.jpg?im=Crop%3D%280%2C41%2C1280%2C640%29%3BResize%3D%281200%2C627%29&impolicy=perceptual&quality=mediumHigh&hash=8663b57b80a4f014015c2159bc427dfefbf1f0b5140d795461881f5b4d2b4bbd,2024-01-01T12:42:37Z,,"<ul><li>
Kommentare</li><li>
E-Mail</li><li>
Teilen</li><li>
Mehr</li><li>
Twitter</li><li>
Drucken</li><li>
Feedback</li><li>
Fehler meldenSie haben einen Fehler gefunden?
Bitte markieren S… [+3345 chars]",,de,'milder Winter'
https://www.sueddeutsche.de/sport/fifa-gianni-infantino-emmanuel-macron-steuerprivilegien-spielerberater-1.6326914,https://www.sueddeutsche.de/sport/fifa-gianni-infantino-emmanuel-macron-steuerprivilegien-spielerberater-1.6326914,0,www.sueddeutsche.de,Gianni Infantino: Doppelwumms gegen den Fifa-Boss,"Erst torpedieren Frankreichs Verfassungsrichter die Umzugspläne der Fifa, indem sie angedachte Steuerprivilegien kippen. Dann muss der Fußball-Weltverband ein Lieblingsprojekt einfrieren - das neue Reglement für Spielerberater.",https://www.sueddeutsche.de/image/sz.1.6326935/1200x675?v=1704124731,2024-01-01T15:29:28Z,,"1. Januar 2024, 16:29 Uhr
Die Pannen-Chronik des Affären-Funktionärs setzt sich fort: Das neue Jahr hat für Fifa-Präsident Gianni Infantino (hier im Dezember bei der Klub-Weltmeisterschaft) nicht gu… [+1287 chars]",,de,'Doppelwumms'
https://www.welt.de/wirtschaft/article249315506/Eon-Chef-kuendigt-Verbrauchern-steigende-Energiepreise-an.html,https://www.welt.de/wirtschaft/article249315506/Eon-Chef-kuendigt-Verbrauchern-steigende-Energiepreise-an.html,0,www.welt.de,Eon-Chef kündigt Verbrauchern steigende Energiepreise an,Zu Beginn des neuen Jahres stellt der Chef des Energiekonzerns Eon die Verbraucher auf steigende Energiepreise ein: Die Versorger müssten die Erhöhung der Netzentgelte und der Mehrwertsteuer für Gas an die Kunden weitergeben. Er kritisiert zudem überbordende …,https://img.welt.de/img/bildergalerien/mobile249315476/4951351317-ci16x9-w1200/Hochspannungsleitungen.jpg,2024-01-02T06:42:46Z,,"Eon-Chef Leonhard Birnbaum rechnet damit, dass im Jahr 2024 höhere Entgelte für Energie auch als höhere Preise an die Kunden weitergegeben werden. Das sind politisch bedingte Aufschläge, diese werden… [+1716 chars]",,de,'Energiepreise'
https://www.focus.de/finanzen/news/nach-haushaltseinigung-co2-hammer-gilt-so-teuer-wird-es-jetzt-fuer-autofahrer-mieter-hausbesitzer_id_259495937.html,https://www.focus.de/finanzen/news/nach-haushaltseinigung-co2-hammer-gilt-so-teuer-wird-es-jetzt-fuer-autofahrer-mieter-hausbesitzer_id_259495937.html,0,www.focus.de,"CO2-Hammer kommt - Große Energie-Rechnung! So teuer wird es jetzt für Autofahrer, Mieter, Hausbesitzer","Die Bundesregierung muss sparen, denn es fehlen Milliarden im Bundeshaushalt. Das Defizit sollen unter anderem alle Haushalte in Deutschland durch höhere CO2-Abgabe und einer höheren Mehrwertsteuer auf Gas und Fernwärme ausgleichen. FOCUS online rechnet vor, …",https://p6.focus.de/img/fotos/id_259495868/gettyimages-515149070.jpg?im=Crop%3D%280%2C423%2C3242%2C1621%29%3BResize%3D%281200%2C627%29&impolicy=perceptual&quality=mediumHigh&hash=dbdc4e57b95849ae5ba08c1394bf91579e52b9e0240cf06705cae4fe035ec7d4,2024-01-02T07:40:55Z,,"Das Jahr beginnt mit heftigen Preiserhöhungen bei der Energie! Grund? Der Bund muss sparen, im Haushalt klafft ein Milliardenloch. Besonders beim Heizen und Tanken treffen die Änderungen nun Millione… [+7786 chars]",,de,'Gas sparen'
https://www.telepolis.de/features/LNG-Protest-auf-Ruegen-Warum-jetzt-auch-ein-Fischer-gegen-Habecks-Plaene-klagt-9584737.html,https://www.telepolis.de/features/LNG-Protest-auf-Ruegen-Warum-jetzt-auch-ein-Fischer-gegen-Habecks-Plaene-klagt-9584737.html,0,www.telepolis.de,LNG-Protest auf Rügen: Warum jetzt auch ein Fischer gegen Habecks Pläne klagt,Energie und Klima – kompakt: Bauarbeiten bedrohen Heringspopulation. Dabei ist sie schon durch den Klimawandel beeinträchtigt. Der Kläger sieht weitere Gefahren.,https://heise.cloudimg.io/bound/1200x1200/q85.png-lossy-85.webp-lossy-85.foil1/_www-heise-de_/imgs/18/4/5/1/9/3/8/7/ruegen-5342ebaab5f8bde0.png,2024-01-02T08:00:00Z,,"Seit mehreren Monaten wird auf Rügen gegen die LNG-Pläne protestiert. Foto: Fridays for Future Germany via X
Energie und Klima kompakt: Bauarbeiten bedrohen Heringspopulation. Dabei ist sie schon du… [+5577 chars]",,de,'LNG'
https://www.zeit.de/wirtschaft/2024-01/energiepreise-anstieg-eon-leonhard-birnbaum,https://www.zeit.de/wirtschaft/2024-01/energiepreise-anstieg-eon-leonhard-birnbaum,0,www.zeit.de,Leonhard Birnbaum: Eon-Chef stimmt Verbraucher auf höhere Energiepreise ein,"Nachdem die Energiepreise zuletzt wieder gesunken waren, warnt Eon-Chef Birnbaum vor neuen Preissteigerungen. Bereits jetzt kostet Strom doppelt so viel wie noch 2021.",https://img.zeit.de/wirtschaft/2024-01/energiepreise-anstieg-eon-leonhard-birnbaum-bild/wide__1300x731,2024-01-02T08:43:00Z,,"Der Chef des Energiekonzerns Eon, Leonhard Birnbaum, hat die Verbraucher im neuen Jahr auf steigende Energiepreise eingestellt. ""Strom und Gas drohen nach den bisherigen Preissenkungen ab 2024 möglic… [+1822 chars]",,de,'Energiepreise'
https://www.focus.de/finanzen/news/zum-1-januar-2024-strompreisbremse-abgeschafft-das-muessen-mieter-und-eigentuemer-jetzt-tun_id_259471859.html,https://www.focus.de/finanzen/news/zum-1-januar-2024-strompreisbremse-abgeschafft-das-muessen-mieter-und-eigentuemer-jetzt-tun_id_259471859.html,0,www.focus.de,Zum 1. Januar 2024 - Strompreisbremse abgeschafft – das müssen Mieter und Eigentümer jetzt tun,"Seit 1. Januar ist Schluss mit der Preisbremse. Das hat Folgen für Millionen Menschen, die dann unter anderem mehr für Strom bezahlen müssen. Doch was sollen Haushalte tun? FOCUS online beantwortet die wichtigsten Fragen.Von FOCUS-online-Redakteur Konstantino…",https://p6.focus.de/img/fotos/id_259471959/strommasten-fin-vt2.jpg?im=Crop%3D%280%2C335%2C3384%2C1692%29%3BResize%3D%281200%2C627%29&impolicy=perceptual&quality=mediumHigh&hash=4549bc1f3f2083135897de854a6927062310b05a91b4dcbf3923b1cefa0ac42b,2024-01-02T10:51:45Z,,"Seit 1. Januar ist Schluss mit der Preisbremse. Das hat Folgen für Millionen Menschen, die dann unter anderem mehr für Strom bezahlen müssen. Doch was sollen Haushalte tun? FOCUS online beantwortet d… [+5674 chars]",,de,'Winter Gas'
https://www.zeit.de/news/2024-01/02/immer-mehr-menschen-fehlt-geld-fuer-ausreichendes-heizen,https://www.zeit.de/news/2024-01/02/immer-mehr-menschen-fehlt-geld-fuer-ausreichendes-heizen,0,www.zeit.de,Energiepreise: Immer mehr Menschen fehlt Geld für ausreichendes Heizen,Hier finden Sie Informationen zu dem Thema „Energiepreise“. Lesen Sie jetzt „Immer mehr Menschen fehlt Geld für ausreichendes Heizen“.,https://img.zeit.de/news/2024-01/02/immer-mehr-menschen-fehlt-geld-fuer-ausreichendes-heizen-image-group/wide__1300x731,2024-01-02T11:05:13Z,,"Menschen in Baden-Württemberg fehlt nach eigener Einschätzung zunehmend das Geld dafür, ihre Wohnungen im Winter angemessen zu heizen. Das berichtete das Statistische Landesamt am Dienstag unter Bezu… [+1621 chars]",,de,'Energiepreise'
https://www.stern.de/kultur/-tagesschau---korrespondentin-hat-live-im-tv-blackout-34330640.html,https://www.stern.de/kultur/-tagesschau---korrespondentin-hat-live-im-tv-blackout-34330640.html,0,www.stern.de,"Fernsehen: ""Muss mich kurz sammeln"": Israel-Korrespondentin hat Blackout in der ""Tagesschau""","In der ""Tagesschau"" kam es zu einem ungewöhnlichen Moment. Eine Korrespondentin vergaß mitten in der Live-Schalte, was sie sagen wollte. Das Internet reagiert jedoch empathisch darauf.",https://image.stern.de/34330920/t/4t/v1/w1440/r1.7778/-/tagesschau-israel-patzer.jpg,2024-01-02T11:44:00Z,,"Nur gut eine Minute dauerte der Beitrag in der ""Tagesschau"", doch aktuell wird im Internet viel darüber diskutiert. In der 20-Uhr-Ausgabe wurde die Reporterin Hanna Resch am 1. Januar live aus Tel Av… [+1836 chars]",,de,'Blackout'
https://www.bild.de/bild-plus/sport/fussball/fussball/nachfolger-schon-im-anflug-fck-stuermer-boyd-will-vor-stuermer-fluechten-86608238.bild.html,https://www.bild.de/bild-plus/sport/fussball/fussball/nachfolger-schon-im-anflug-fck-stuermer-boyd-will-vor-stuermer-fluechten-86608238.bild.html,0,www.bild.de,Nachfolger schon im Anflug - Lauterns Boyd will vor diesem Stürmer flüchten,Zweitligist 1. FC Kaiserslautern gibt im Winter-Transferfenster mächtig Gas! Einer ist davon überhaupt nicht begeistert: Publikumsliebling Terrence Boyd!,"https://images.bild.de/65941a682244565da5006e2f/6b0f342e1e47a97b9ad5183f4039f9dd,cda977f2?w=1280",2024-01-02T15:48:39Z,,"Dürfen sie gar nicht streiken? Deutsche Bahn verklagt Lokführer! 
 Dürfen sie gar nicht streiken? Deutsche Bahn verklagt Lokführer! 
 Dürfen sie gar nicht streiken? Deutsche Bahn verklagt Lokführer… [+476 chars]",,de,'Winter Gas'
https://www.stern.de/kultur/-tagesschau---das-sagt-die-korrespondentin-zu-ihrem-blackout-34331944.html,https://www.stern.de/kultur/-tagesschau---das-sagt-die-korrespondentin-zu-ihrem-blackout-34331944.html,0,www.stern.de,"""Tagesschau""-Korrespondentin: ""Dankbar, dass man vor der Kamera auch Mensch sein darf"": Hanna Resch äußert sich gegenüber dem stern über ihren Blackout","Hanna Resch ist Israel-Korrespondentin der ""Tagesschau"". Mit einem Blackout live in der Sendung erlangte sie unfreiwillig Bekanntheit. Mit dem stern spricht sie darüber.",https://image.stern.de/34330920/t/Jk/v2/w1440/r1.7778/-/tagesschau-hanna-resch-israel.jpg,2024-01-02T16:17:00Z,,"20 Uhr ist Primetime in der ARD, die ""Tagesschau"" schauen Millionen Deutsche, um sich über die Nachrichten vom Tag zu informieren. In der Ausgabe vom 1. Januar 2024 kam es jedoch zu einem ungewohnten… [+1633 chars]",,de,'Blackout'
https://www.faz.net/aktuell/wirtschaft/klima-nachhaltigkeit/strommix-anteil-der-erneuerbaren-energien-waechst-auf-56-prozent-19422409.html,https://www.faz.net/aktuell/wirtschaft/klima-nachhaltigkeit/strommix-anteil-der-erneuerbaren-energien-waechst-auf-56-prozent-19422409.html,0,www.faz.net,Strommix: Anteil der Erneuerbaren Energien wächst auf mehr als die Hälfte,"Im vergangenen Jahr wurde mehr Energie durch Wind, Wasser, Biomasse und sonstige alternative Verfahren erzeugt als 2022. Das lag besonders an einer Methode zur Energieerzeugung.",https://media1.faz.net/ppmedia/aktuell/wirtschaft/2804037798/1.9422417/facebook_teaser/ein-windpark-an-der-nordsee.jpg,2024-01-02T20:42:19Z,,"Alternative Energien haben im vergangenen Jahr mehr als die Hälfte der deutschen Stromerzeugung ausgemacht. Der Anteil des Stroms aus Wind, Wasser, Biomasse und sonstigen alternativen Energien stieg … [+1227 chars]",,de,'Erneuerbare Energie'
https://www.n-tv.de/wirtschaft/Gruener-Boom-Erneuerbare-2023-deutlich-ueber-50-Prozent-article24634733.html,https://www.n-tv.de/wirtschaft/Gruener-Boom-Erneuerbare-2023-deutlich-ueber-50-Prozent-article24634733.html,0,www.n-tv.de,Anteil an der Stromerzeugung: Grüner Boom: Erneuerbare 2023 deutlich über 50 Prozent,"Der Anteil erneuerbarer Energien an der deutschen Stromversorgung steigt im letzten Jahr deutlich. Das liegt einerseits am Ausbau, andererseits aber auch am Wind oder Regen. Photovoltaik hingegen schwächelt mangels Sonne leicht. Kohle verliert an Bedeutung.",https://bilder1.n-tv.de/img/incoming/crop24634748/8991322684-cImg_16_9-w1200/imago0302258740h.jpg,2024-01-02T22:18:37Z,,"Der Anteil erneuerbarer Energien an der deutschen Stromversorgung steigt im letzten Jahr deutlich. Das liegt einerseits am Ausbau, andererseits aber auch am Wind oder Regen. Photovoltaik hingegen sch… [+1827 chars]",,de,'Erneuerbare Energie'
https://www.n-tv.de/politik/20-04-Experten-duerfen-Reaktorhallen-von-AKW-Saporischschja-nicht-betreten--article23143824.html,https://www.n-tv.de/politik/20-04-Experten-duerfen-Reaktorhallen-von-AKW-Saporischschja-nicht-betreten--article23143824.html,0,www.n-tv.de,Ukraine-Krieg im Liveticker: +++ 20:04 Experten dürfen Reaktorhallen von AKW Saporischschja nicht betreten +++,Lesen Sie alle aktuellen Entwicklungen und Nachrichten über den russischen Angriffskrieg auf die Ukraine im Liveticker von ntv.de.,https://bilder2.n-tv.de/img/incoming/crop23332537/9041326157-cImg_16_9-w1200/Liveticker1-grau-1-Kopie.jpg,2024-01-02T23:06:00Z,,"Fachleute der Internationalen Atomenergiebehörde (IAEA) sind nach Angaben der Organisation daran gehindert worden, die Reaktorhallen von drei Blöcken im von Russland besetzten ukrainischen Atomkraftw… [+27771 chars]",,de,'AKW'
https://www.n-tv.de/politik/15-53-Russische-Gazprom-liefert-neue-Rekordmenge-Gas-an-China--article23143824.html,https://www.n-tv.de/politik/15-53-Russische-Gazprom-liefert-neue-Rekordmenge-Gas-an-China--article23143824.html,0,www.n-tv.de,Ukraine-Krieg im Liveticker: +++ 15:53 Russische Gazprom liefert neue Rekordmenge Gas an China +++,Lesen Sie alle aktuellen Entwicklungen und Nachrichten über den russischen Angriffskrieg auf die Ukraine im Liveticker von ntv.de.,https://bilder2.n-tv.de/img/incoming/crop23332537/9041326157-cImg_16_9-w1200/Liveticker1-grau-1-Kopie.jpg,2024-01-02T23:06:00Z,,"Der Energieriese Gazprom hat eigenen Angaben zufolge einen neuen Tagesrekord für Gaslieferungen nach China erzielt. Über die Pipeline ""Power of Siberia"" sei am Vortag mehr Gas als je zuvor binnen ein… [+21323 chars]",,de,'Gazprom'
https://www.zeit.de/gesellschaft/zeitgeschehen/2024-01/grossbritannien-streik-aerzte-bezahlung,https://www.zeit.de/gesellschaft/zeitgeschehen/2024-01/grossbritannien-streik-aerzte-bezahlung,0,www.zeit.de,Gesundheitswesen in Großbritannien: Ärzte in Großbritannien streiken bis zu sechs Tage,"Junge Ärzte wollen mehr Geld und einen Inflationsausgleich, damit der Job attraktiver wird – auch für Nachwuchs. Die Lage in Kliniken und Praxen verschärft sich dadurch.",https://img.zeit.de/gesellschaft/zeitgeschehen/2024-01/aerzte-grossbritannien-streik/wide__1300x731,2024-01-03T04:45:47Z,,Im britischen Gesundheitswesen beginnt der möglicherweise längste landesweite Streik in seiner Geschichte. Junge Ärztinnen und Ärzte wollen in England ab Mittwoch 7 Uhr für sechs Tage ihre Arbeit nie… [+661 chars],,de,'Inflation'
"https://www.computerwoche.de/a/rechenzentrum-modernisieren-energiekosten-senken,3698155?utm_source=Nach-Artikeltyp_1,30,119,124,125&utm_medium=RSS&utm_campaign=RSS-Feeds","https://www.computerwoche.de/a/rechenzentrum-modernisieren-energiekosten-senken,3698155?utm_source=Nach-Artikeltyp_1,30,119,124,125&utm_medium=RSS&utm_campaign=RSS-Feeds",0,www.computerwoche.de,"Live Webcast: Rechenzentrum modernisieren, Energiekosten senken","Immer mehr Daten und neue gesetzliche Vorgaben rücken das Thema nachhaltiges Rechenzentrum in den Fokus. Ein Webcast zeigt, wie Sie Energie sparen, indem Sie sie erst gar nicht verbrauchen.",https://images.computerwoche.de/bdb/3380868/640x360.jpg,2024-01-03T04:55:00Z,,"Die Digitalisierung hat die Datenmenge in Unternehmen massiv erhöht, und damit leider auch die Kosten: Denn der Energieverbrauch, der mit der Datenverarbeitung in den Rechenzentren einhergeht, steigt… [+1271 chars]",,de,'Energiekosten'
https://www.faz.net/aktuell/feuilleton/debatten/aengste-der-mittelschicht-wie-schlecht-geht-es-ihr-wirklich-19421243.html,https://www.faz.net/aktuell/feuilleton/debatten/aengste-der-mittelschicht-wie-schlecht-geht-es-ihr-wirklich-19421243.html,0,www.faz.net,Abstiegsängste der Mitte: Wie schlecht geht es der Mittelschicht?,"Inflation, hohe Mieten, Energiepreisschock: Die Mittelschicht fürchtet sich vor dem sozialen Abstieg – und schätzt sich gleichzeitig ärmer ein, als sie ist. Wie kommt das?",https://media0.faz.net/ppmedia/aktuell/3588861482/1.9421404/facebook_teaser/der-traum-vom-eigenheim-so.jpg,2024-01-03T06:28:22Z,,"Auf die Frage, welcher Schicht er angehört, reagierte ein Freund verdutzt. Er lachte und sagte sehr bestimmt: Mittelschicht! Sein Jahreseinkommen beträgt etwa 150.000 Euro, er lebt mit seiner Familie… [+4340 chars]",,de,'Energiekrise'
https://www.bild.de/regional/berlin/berlin-aktuell/heizkosten-schock-wir-muessen-zusammen-81000-euro-nachzahlen-86610814.bild.html,https://www.bild.de/regional/berlin/berlin-aktuell/heizkosten-schock-wir-muessen-zusammen-81000-euro-nachzahlen-86610814.bild.html,0,www.bild.de,Heizkosten-Schock - Wir müssen zusammen 81 000 Euro nachzahlen,Das Teuer-Jahr fängt ja gut an! Heizkosten-Schock für Mieter der landeseigenen Berliner Wohnungsbaugesellschaft Gewobag.,"https://images.bild.de/65943ac62244565da5006e8a/ecb9ff1a2df3a2ec99978ca69fa846dd,971ca602?w=1280",2024-01-03T07:18:42Z,,Das Teuer-Jahr fängt ja gut an! Heizkosten-Schock für Mieter der landeseigenen Berliner Wohnungsbaugesellschaft Gewobag: Zwischen 400 und 3500 Euro (!) müssen sie für 2022 nachzahlen. Und: Ihre Miete… [+3622 chars],,de,'Heizkosten'
https://www.morgenpost.de/wirtschaft/article240909648/heizoelpreise-aktuell-heute-3-januar-2024-heizoel-kaufen-heizung-kosten.html,https://www.morgenpost.de/wirtschaft/article240909648/heizoelpreise-aktuell-heute-3-januar-2024-heizoel-kaufen-heizung-kosten.html,0,www.morgenpost.de,Heizölpreise aktuell: Der Preis je Liter heute am 3. Januar,Der CO2-Preis ist zum neuen Jahr gestiegen. ○ Wirkt sich das auf die Heizölpreise aus? ○ Das ist der aktuelle Preis je Liter heute am 3. Januar.,https://img.sparknews.funkemedien.de/238144069/238144069_1681477675_v4_3_800.jpeg,2024-01-03T09:01:00Z,,"Berlin. Der CO2-Preis ist gestiegen wirkt sich das bereits auf die Heizölpreise aus? Das ist der aktuelle Preis je Liter heute am 3. Januar.
Das neue Jahr ist da und damit auch der erhöhte CO2-Preis… [+9785 chars]",,de,'Heizöl'
https://www.stern.de/gesellschaft/regional/rheinland-pfalz-saarland/verbraucher--inflationsrate-im-saarland-im-dezember-leicht-gestiegen-34333620.html,https://www.stern.de/gesellschaft/regional/rheinland-pfalz-saarland/verbraucher--inflationsrate-im-saarland-im-dezember-leicht-gestiegen-34333620.html,0,www.stern.de,Verbraucher: Inflationsrate im Saarland im Dezember leicht gestiegen,"Nach monatelangem Rückgang ist die Inflationsrate im Saarland im Dezember wieder leicht gestiegen. Sie lag bei 4,1 Prozent nach 3,7 Prozent im Vormonat November, wie das Statistische Landesamt Saarland am Mittwoch mitteilte. Dies sei der erste Anstieg der Teu…",https://image.stern.de/34333622/t/qn/v1/w1440/r1.7778/-/03--urnnewsmldpacom2009010124010399478353v3w800h600l145t0r2413b1703jpeg---c6e61a20173ffd7e.jpg,2024-01-03T10:12:10Z,,"Nach monatelangem Rückgang ist die Inflationsrate im Saarland im Dezember wieder leicht gestiegen. Sie lag bei 4,1 Prozent nach 3,7 Prozent im Vormonat November, wie das Statistische Landesamt Saarla… [+1231 chars]",,de,'Inflation'
https://www.zeit.de/news/2024-01/03/inflationsrate-im-saarland-im-dezember-leicht-gestiegen,https://www.zeit.de/news/2024-01/03/inflationsrate-im-saarland-im-dezember-leicht-gestiegen,0,www.zeit.de,Verbraucher: Inflationsrate im Saarland im Dezember leicht gestiegen,Hier finden Sie Informationen zu dem Thema „Verbraucher“. Lesen Sie jetzt „Inflationsrate im Saarland im Dezember leicht gestiegen“.,https://img.zeit.de/news/2024-01/03/inflationsrate-im-saarland-im-dezember-leicht-gestiegen-image-group/wide__1300x731,2024-01-03T10:12:10Z,,"Nach monatelangem Rückgang ist die Inflationsrate im Saarland im Dezember wieder leicht gestiegen. Sie lag bei 4,1 Prozent nach 3,7 Prozent im Vormonat November, wie das Statistische Landesamt Saarla… [+719 chars]",,de,'Inflation'
https://www.tagesspiegel.de/politik/energie-klima/spahn-rugt-verantwortungslose-ampel-strategie-deutschland-produziert-weniger-strom-und-kauft-mehr-ein-10997560.html,https://www.tagesspiegel.de/politik/energie-klima/spahn-rugt-verantwortungslose-ampel-strategie-deutschland-produziert-weniger-strom-und-kauft-mehr-ein-10997560.html,0,www.tagesspiegel.de,Spahn rügt „verantwortungslose“ Ampel-Strategie: Deutschland produziert weniger Strom und kauft mehr ein,"Weil der Strom in Deutschland teuer ist, wurde 2023 deutlich mehr Strom als in der Vergangenheit von europäischen Nachbarn gekauft. Welche Rolle spielt der Atomausstieg?",https://www.tagesspiegel.de/images/streit-um-neue-windrader-nahe-gartenreich-gutachten-soll-klaren/alternates/BASE_16_9_W1400/streit-um-neue-windraeder-nahe-gartenreich---gutachten-soll-klaeren.jpeg,2024-01-03T10:55:43Z,,"Deutschland hat im Jahr 2023 deutlich weniger Strom produziert als noch im Vorjahr. Wie die Bundesnetzagentur am Mittwoch mitteilte, sank die Bruttostromerzeugung in Deutschland im Vergleich zu 2022 … [+3409 chars]",,de,'Bundesnetzagentur'
https://www.focus.de/finanzen/wie-sollen-wir-das-stemmen-mieter-unter-schock-weil-sie-81-000-euro-heizkosten-nachzahlen-muessen_id_259544616.html,https://www.focus.de/finanzen/wie-sollen-wir-das-stemmen-mieter-unter-schock-weil-sie-81-000-euro-heizkosten-nachzahlen-muessen_id_259544616.html,0,www.focus.de,"„Wie sollen wir das stemmen?“ - Mieter unter Schock, weil sie 81.000 Euro Heizkosten nachzahlen müssen","Mieter einer Berliner Wohnanlage müssen 81.000 Euro Heizkosten für 2022 nachzahlen. Der Schock sitzt tief, doch ob es sich um Abrechnungsfehler handelt, ist unklar.",https://p6.focus.de/img/fotos/id_259544612/heizkosten.jpg?im=Crop%3D%280%2C152%2C3464%2C1732%29%3BResize%3D%281200%2C627%29&impolicy=perceptual&quality=mediumHigh&hash=7cd8576cfa2ad502d040bb42176c485b2f4c66936289ba14302a1147e243286b,2024-01-03T11:14:41Z,,"Mieter einer Berliner Wohnanlage müssen 81.000 Euro Heizkosten für 2022 nachzahlen. Der Schock sitzt tief, doch ob es sich um Abrechnungsfehler handelt, ist unklar.Unangenehmer Start ins neue Jahr fü… [+2237 chars]",,de,'Heizkosten'
https://www.stern.de/news/deutlich-ueber-die-haelfte-der-stromerzeugung-2023-aus-erneuerbaren-34334150.html,https://www.stern.de/news/deutlich-ueber-die-haelfte-der-stromerzeugung-2023-aus-erneuerbaren-34334150.html,0,www.stern.de,Deutlich über die Hälfte der Stromerzeugung 2023 aus Erneuerbaren,"Im vergangenen Jahr ging in Deutschland erstmals mehr als die Hälfte der Stromerzeugung auf erneuerbare Energieträger zurück. Der Anteil von Wind-, Solar-, Biomasse- und Wasserkraftanlagen sowie sonstigen Erneuerbaren stieg von 48,4 Prozent im Vorjahr auf 55 …",https://image.stern.de/34334152/t/S2/v1/w1440/r1.7778/-/03--windraeder-in-heide---94734f4d26fb63e1.jpg,2024-01-03T12:08:32Z,,"Im vergangenen Jahr ging in Deutschland erstmals mehr als die Hälfte der Stromerzeugung auf erneuerbare Energieträger zurück. Der Anteil von Wind-, Solar-, Biomasse- und Wasserkraftanlagen sowie sons… [+2751 chars]",,de,'Bundesnetzagentur'
https://www.bild.de/politik/2024/politik/blackout-in-der-live-schalte-tagesschau-reporterin-erklaert-ihren-aussetzer-86618648.bild.html,https://www.bild.de/politik/2024/politik/blackout-in-der-live-schalte-tagesschau-reporterin-erklaert-ihren-aussetzer-86618648.bild.html,0,www.bild.de,Blackout in der Live-Schalte - „Tagesschau“-Reporterin erklärt ihren Aussetzer,"Es war eine kurze Panne, wie sie jedem passieren kann – nur leider vor Millionen-Publikum.Foto: ARD","https://images.bild.de/6595422afcd6bf72da784124/58cebe0217965e71737b0867ca9887c7,a7e1c309?w=1280",2024-01-03T12:24:35Z,,"Es war eine kurze Panne, wie sie jedem passieren kann nur leider ausgerechnet vor einem Millionen-Publikum.
Die ARD-Reporterin Hanna Resch ist am Neujahrstag in einer Live-Schalte der Tagesschau ins… [+2147 chars]",,de,'Blackout'
https://www.sueddeutsche.de/wirtschaft/erneuerbare-energien-stromerzeugung-stromverbrauch-1.6327879,https://www.sueddeutsche.de/wirtschaft/erneuerbare-energien-stromerzeugung-stromverbrauch-1.6327879,0,www.sueddeutsche.de,Stromerzeugung: Erneuerbare Energien liefern mehr als die Hälfte des Stroms,"Zum ersten Mal erzeugen Wind, Sonne und Wasser den Großteil des Stroms in Deutschland. Grund dafür war auch das Wetter.",https://www.sueddeutsche.de/image/sz.1.6327880/1200x675?v=1704291006,2024-01-03T14:10:45Z,,"Es geht in Deutschland mit der Energiewende voran, zumindest schrittweise: 2023 stammte die Energie für die Stromerzeugung in Deutschland zum ersten Mal zu mehr als der Hälfte aus erneuerbaren Quelle… [+2231 chars]",,de,'Bundesnetzagentur'
