index,url,valid,domain,title,description,image,published,archive,content,quote,language,keyword
https://www.morgenpost.de/wirtschaft/article237511113/bier-preise-inflation-brauereien-klimawandel.html,https://www.morgenpost.de/wirtschaft/article237511113/bier-preise-inflation-brauereien-klimawandel.html,0,www.morgenpost.de,Brauereien: Inflation und Preise: Warum Bier jetzt viel teurer wird,Schlechte Stimmung unter Deutschlands Brauern: Die Kosten steigen. Kunden halten sich zurück. Beim Hopfen schlägt der Klimawandel zu.,https://img.morgenpost.de/img/wirtschaft/crop237511111/7702606461-w820-cv16_9-q85/a9bf06c2-a151-11ed-9646-4f1e17fee32c.jpg,2023-02-01T04:30:00Z,,"Berlin.  Es beginnt mit einem Kronkorken. Kleines Teil, aber für die Bierindustrie recht wichtig. Der Preis hat sich binnen Jahresfrist mehr als verdoppelt. Und auch Braumalz, Hopfen, Wasser, Flasche… [+5839 chars]",,de,'Gas Wirtschaft'
https://www.nzz.ch/wirtschaft/die-grossen-schweizer-energieverbraucher-fordern-von-albert-roesti-subventionen-nach-auslaendischem-muster-doch-die-sache-ist-selbst-in-den-betroffenen-sektoren-umstritten-ld.1723873,https://www.nzz.ch/wirtschaft/die-grossen-schweizer-energieverbraucher-fordern-von-albert-roesti-subventionen-nach-auslaendischem-muster-doch-die-sache-ist-selbst-in-den-betroffenen-sektoren-umstritten-ld.1723873,0,www.nzz.ch,Die grossen Schweizer Energieverbraucher fordern von Albert Rösti Subventionen nach ausländischem Muster – doch die Sache ist selbst in den betroffenen Sektoren umstritten,Der neue Energieminister Albert Rösti hat Ende Januar ungemütliche Post erhalten. Die Interessengemeinschaft der energieintensiven Branchen will Staatshilfen zur Kompensation von Subventionen für die ausländische Konkurrenz.,"https://img.nzz.ch/2022/08/25/1d13d7ab-588f-4cd2-ab6f-6aeb77b0e0d2.jpeg?width=1200&height=674&fit=bound&quality=75&auto=webp&crop=4665,2621,x0,y244&wmark=nzz",2023-02-01T04:30:00Z,,"Energieintensive Branchen wie die Stahlindustrie sind mit hohen Mehrkosten konfrontiert.
Die Schweizer Wirtschaftspolitik ist traditionell eher langweilig als genial. Aber Langeweile ist hier ein Qu… [+5072 chars]",,de,'EU Gaspreise'
https://www.diepresse.com/6245555/gas-strom-und-diesel-der-winter-ist-geschafft,https://www.diepresse.com/6245555/gas-strom-und-diesel-der-winter-ist-geschafft,0,www.diepresse.com,"Gas, Strom und Diesel: Der Winter ist geschafft [premium]","Anders als vor einigen Monaten befürchtet, gibt es trotz Wintereinbruchs keine Engpässe bei der Energieversorgung. Warum die Situation entspannter ist und welche Auswirkungen das auf die Preise hat.",https://media.diepresse.com/social_diepresse_magazin_paid/images/uploads_1200/c/b/3/6245555/EE75829C-AFF4-4EA4-B0B9-3F8D2EF16924_v0_h.jpg,2023-02-01T04:32:00Z,http://archive.md/20230201074245/https://www.diepresse.com/6245555/gas-strom-und-diesel-der-winter-ist-geschafft,"Anders als vor einigen Monaten befürchtet, gibt es trotz Wintereinbruchs keine Engpässe bei der Energieversorgung. Warum die Situation entspannter ist und welche Auswirkungen das auf die Preise hat.… [+1288 chars]",,de,'Energieversorgung'
https://www.sueddeutsche.de/wirtschaft/bundesnetzagentur-versorgungssicherheit-bericht-kohleausstieg-1.5742918,https://www.sueddeutsche.de/wirtschaft/bundesnetzagentur-versorgungssicherheit-bericht-kohleausstieg-1.5742918,0,www.sueddeutsche.de,Bundesnetzagentur: Stromversorgung laut Bericht auch bei früherem Kohleausstieg sicher,Deutschlands Versorgungssicherheit kann laut Bundesnetzagentur auch bei einem vollständigen Kohleausstieg bis 2030 gewährleistet werden.,https://www.sueddeutsche.de/image/sz.1.5742919/1200x675?v=1675226162,2023-02-01T04:38:47Z,https://web.archive.org/web/20230201045230/https://www.sueddeutsche.de/wirtschaft/bundesnetzagentur-versorgungssicherheit-bericht-kohleausstieg-1.5742918,Laut einem Bericht der Bundesnetzagentur ist die Versorgung mit Elektrizität in Deutschland im Zeitraum von 2025 bis 2031 gesichert.Auch bei einem vollständigen vorgezogenen Kohleausstieg bis 2030 wä… [+2174 chars],,de,'Stromversorgung'
https://www.welt.de/politik/deutschland/article243536701/Bundesnetzagentur-haelt-Stromversorgung-bei-frueherem-Kohleausstieg-fuer-sicher.html,https://www.welt.de/politik/deutschland/article243536701/Bundesnetzagentur-haelt-Stromversorgung-bei-frueherem-Kohleausstieg-fuer-sicher.html,0,www.welt.de,Bundesnetzagentur hält Stromversorgung bei früherem Kohleausstieg für sicher,Die Bundesnetzagentur hält die Stromversorgung für gesichert – auch im Falle eines vorgezogenen Kohleausstiegs bis 2030. Das geht aus einem neuen Bericht hervor. Krisenszenarien wurden darin allerdings nicht berücksichtigt.,https://img.welt.de/img/regionales/hamburg/mobile243356651/2321350967-ci16x9-w1200/Kohlekraftwerk-Moorburg.jpg,2023-02-01T07:10:05Z,https://web.archive.org/web/20230201073212/https://www.welt.de/politik/deutschland/article243536701/Bundesnetzagentur-haelt-Stromversorgung-bei-frueherem-Kohleausstieg-fuer-sicher.html,"Auch bei einem vollständigen vorgezogenen Kohleausstieg bis 2030 wäre eine sichere Stromversorgung gewährleistet: Zu diesem Ergebnis kommt ein Bericht der Bundesnetzagentur, der heute im Bundeskabine… [+2280 chars]",,de,'Kohleausstieg'
https://www.faz.net/aktuell/wirtschaft/netzagentur-haelt-stromversorgung-fuer-sicher-auch-bei-frueherem-kohleausstieg-18645322.html,https://www.faz.net/aktuell/wirtschaft/netzagentur-haelt-stromversorgung-fuer-sicher-auch-bei-frueherem-kohleausstieg-18645322.html,0,www.faz.net,Netzagentur hält Stromversorgung für sicher - auch bei früherem Kohleausstieg,Trotz steigenden Stromverbrauchs soll die Versorgung in Deutschland von 2025 bis 2031 gewährleistet sein. Das beschreibt die Netzagentur in einem neuen Bericht.,https://media0.faz.net/ppmedia/aktuell/wirtschaft/2235628800/1.8645336/facebook_teaser/ein-schaufelradbagger-arbeitet.jpg,2023-02-01T07:11:58Z,https://web.archive.org/web/20230201081902/https://www.faz.net/aktuell/wirtschaft/netzagentur-haelt-stromversorgung-fuer-sicher-auch-bei-frueherem-kohleausstieg-18645322.html,Auch bei einem vollständigen vorgezogenen Kohleausstieg bis 2030 wäre eine sichere Stromversorgung gewährleistet - zu diesem Ergebnis kommt ein Bericht der Bundesnetzagentur. Der Bericht ist an diese… [+2040 chars],,de,'Netzagentur'
https://www.focus.de/finanzen/news/gastbeitrag-von-gabor-steingart-der-westen-will-putin-oekonomisch-in-die-knie-zwingen-und-scheitert-grandios_id_184618928.html,https://www.focus.de/finanzen/news/gastbeitrag-von-gabor-steingart-der-westen-will-putin-oekonomisch-in-die-knie-zwingen-und-scheitert-grandios_id_184618928.html,0,www.focus.de,Gastbeitrag von Gabor Steingart - Der Westen will Putin ökonomisch in die Knie zwingen – und scheitert grandios,Nach dem Einmarsch in der Ukraine hat der Westen seinen langjährigen Handelspartner Russland mit Sanktionen überzogen. Doch diese treffen die russischen Wirtschaft offenbar weit weniger hart als angenommen. Laut IWF wird Russland auf absehbare Zeit sogar schn…,https://p6.focus.de/img/fotos/id_184617987/steingart.jpg?im=Crop%3D%280%2C0%2C714%2C357%29%3BResize%3D%281200%2C627%29&impolicy=perceptual&quality=medium&hash=052ccc7ab2812472346b03f5619ef173f1df5be8b0c17a4909416fc92fc8e384,2023-02-01T07:16:28Z,https://web.archive.org/web/20230201073117/https://www.focus.de/finanzen/news/gastbeitrag-von-gabor-steingart-der-westen-will-putin-oekonomisch-in-die-knie-zwingen-und-scheitert-grandios_id_184618928.html,Nach dem Einmarsch in der Ukraine hat der Westen seinen langjährigen Handelspartner Russland mit Sanktionen überzogen. Doch diese treffen die russischen Wirtschaft offenbar weit weniger hart als ange… [+6432 chars],,de,'Gas Wirtschaft'
https://oesterreich.orf.at/stories/3192851/,https://oesterreich.orf.at/stories/3192851/,0,oesterreich.orf.at,"Schnellschätzung: Inflation bei 11,1 Prozent","Die Inflation ist im Jänner wieder gestiegen. Wie die Statistik Austria am Mittwoch in ihrer Schnellschätzung mitteilte, dürfte sie auf 11,1 Prozent kommen. Das wäre der höchste Wert in der aktuellen Teuerungswelle, nach 11,0 Prozent im Oktober 2022.",https://ibs.orf.at/oes?image=https%3A%2F%2Foekastatic.orf.at%2Fmojo%2F1_4_1%2Fstoryserver%2Foeka%2Fcommon%2Fimages%2Fog-fallback-oes.png%3Fs%3Dec233e47ded343c91da59ce7aee601c044282ef3,2023-02-01T08:34:10Z,,"Grund seien die Strompreise, trotz Strompreisbremse, da die Maßnahmen zur Eindämmung der Netzkosten erst ab März greifen. Zuletzt hatte sich der Preisauftrieb leicht abgedämpft und lag im Dezember 20… [+188 chars]",,de,'Inflation'
https://www.morgenpost.de/wirtschaft/article237518181/verpuffung-gasspeicheranlage-zwischenfall-rehden.html,https://www.morgenpost.de/wirtschaft/article237518181/verpuffung-gasspeicheranlage-zwischenfall-rehden.html,0,www.morgenpost.de,Erdgas: Verpuffung: Deutschlands größte Gasspeicheranlage gestoppt,"Der Erdgasspeicher in Rehden ist die größte Anlage in Deutschland. Am Dienstag kam es dort zu einer Verpuffung - lesen Sie hier, was das bedeutet und welche Auswirkungen das auf die Gasversorgung hat.",https://img.morgenpost.de/img/frontpage/crop237517951/609260233-w820-cv16_9-q85/erdgasspeicher-rehden-5FAC5800C47A1D2C.jpg,2023-02-01T08:51:08Z,,Berlin/Rehden. Zwischenfall in Deutschlands größter Gasspeicheranlage: Nach einer Verpuffung musste die Einlagerung von Gas in der Einrichtung in Rehden gestoppt worden. Die Bundesnetzagentur erwarte… [+1503 chars],,de,'Gasversorgung'
https://www.faz.net/aktuell/rhein-main/wirtschaft/foerdersumme-kfw-2022-18644385.html,https://www.faz.net/aktuell/rhein-main/wirtschaft/foerdersumme-kfw-2022-18644385.html,0,www.faz.net,KfW-Bankengruppe: Frankfurter Kreditanstalt für Krisen,Die Beschäftigten der KfW haben zwei anspruchsvolle Jahre hinter sich. Neben den Corona-Hilfen trug die Förderbank fast 60 Milliarden Euro zur Sicherung der Energieversorgung bei. Die Aufgaben werden aber nicht kleiner.,https://media0.faz.net/ppmedia/aktuell/wirtschaft/1869617854/1.8644618/facebook_teaser/alle-haende-voll-zu-tun-kfw.jpg,2023-02-01T08:59:46Z,,"Für einen kleinen Moment wurde Stefan Wintels persönlich. Das Jahr 2022 war für die KfW Bankengruppe, für alle 8000 Mitarbeiter, aber auch für ihn selbst ein Ausnahmejahr, sagte Wintels am Dienstag i… [+5371 chars]",,de,'Energieversorgung'
https://www.telepolis.de/features/Volle-Gasspeicher-in-Deutschland-zu-welchem-Preis-7477595.html,https://www.telepolis.de/features/Volle-Gasspeicher-in-Deutschland-zu-welchem-Preis-7477595.html,0,www.telepolis.de,Volle Gasspeicher in Deutschland zu welchem Preis?,"Die kurzfristige Trennung vom russischen Gas und die folgende Sicherung der deutschen Gasversorgung hat zahlreiche bislang wenig berücksichtigte Langzeitfolgen, deren Kosten für die Endverbraucher bislang nur schwer abschätzbar sind.",https://heise.cloudimg.io/bound/1200x1200/q85.png-lossy-85.webp-lossy-85.foil1/_www-heise-de_/imgs/18/3/6/8/9/3/9/9/302b36a3775e6c28.jpeg,2023-02-01T09:00:00Z,https://web.archive.org/web/20230201175903/https://www.telepolis.de/features/Volle-Gasspeicher-in-Deutschland-zu-welchem-Preis-7477595.html,"Die kurzfristige Trennung vom russischen Gas und die folgende Sicherung der deutschen Gasversorgung hat zahlreiche bislang wenig berücksichtigte Langzeitfolgen, deren Kosten für die Endverbraucher bi… [+4640 chars]",,de,'Energiewende Gas'
https://www.stern.de/wirtschaft/news/energie--eon-chef-sieht-wettbewerbsfaehigkeit-europas-gefaehrdet-33155976.html,https://www.stern.de/wirtschaft/news/energie--eon-chef-sieht-wettbewerbsfaehigkeit-europas-gefaehrdet-33155976.html,0,www.stern.de,Energie: Eon-Chef sieht Wettbewerbsfähigkeit Europas gefährdet,"Eon-Chef Birnbaum hält wegen dauerhaft hoher Gaspreise einen Wohlstandsverlust in Europa für möglich und fordert: ""Ärmel hochgekrempelt lassen"". Auch wünscht er sich bessere Bedingungen für Investitionen.",https://image.stern.de/33155978/t/86/v1/w1440/r1.7778/-/01--urnnewsmldpacom2009010123020199434042v2w800h600l361t1233r3821b2998jpeg---09c064d85fb8c03d.jpg,2023-02-01T09:17:17Z,https://web.archive.org/web/20230201112357/https://www.stern.de/wirtschaft/news/energie--eon-chef-sieht-wettbewerbsfaehigkeit-europas-gefaehrdet-33155976.html,"Eon-Chef Birnbaum hält wegen dauerhaft hoher Gaspreise einen Wohlstandsverlust in Europa für möglich und fordert: ""Ärmel hochgekrempelt lassen"". Auch wünscht er sich bessere Bedingungen für Investiti… [+2349 chars]",,de,'Gaspreis'
https://www.wiwo.de/unternehmen/energie/energie-eon-chef-sieht-wettbewerbsfaehigkeit-europas-gefaehrdet/28956410.html,https://www.wiwo.de/unternehmen/energie/energie-eon-chef-sieht-wettbewerbsfaehigkeit-europas-gefaehrdet/28956410.html,0,www.wiwo.de,Energie: Eon-Chef sieht Wettbewerbsfähigkeit Europas gefährdet,Eon-Chef Birnbaum hält wegen dauerhaft hoher Gaspreise einen Wohlstandsverlust in Europa für möglich und fordert: „Ärmel hochgekrempelt lassen“. Auch wünscht er sich bessere Bedingungen für Investitionen.,https://www.wiwo.de/images/eon-chef-birnbaum/28956408/1-format11240.jpg,2023-02-01T09:42:04Z,https://web.archive.org/web/20230201103640/https://www.wiwo.de/unternehmen/energie/energie-eon-chef-sieht-wettbewerbsfaehigkeit-europas-gefaehrdet/28956410.html,"Der Vorstandsvorsitzende von Deutschlands größtem Energieversorger Eon, Leonhard Birnbaum, sieht infolge der Energiekrise die Wettbewerbsfähigkeit Europas gefährdet. Wir verlieren gegenüber den USA u… [+2820 chars]",,de,'Flüssiggas'
https://www.morgenpost.de/wirtschaft/article237518637/heizoelpreise-aktuell-heute-1-februar-2023-preis-liter-oelpreis.html,https://www.morgenpost.de/wirtschaft/article237518637/heizoelpreise-aktuell-heute-1-februar-2023-preis-liter-oelpreis.html,0,www.morgenpost.de,Energiekosten: Heizölpreise aktuell am 01.02.: Preis pro Liter Heizöl heute,Die Heizölpreise in Deutschland sind im Vergleich zur Vorwoche gesunken  ○ Wie viel kostet ein Liter Heizöl am 01.02.? ○ Hier erfahren Sie mehr.,https://img.morgenpost.de/img/wirtschaft/crop237451121/9202605211-w820-cv16_9-q85/dpa-pa-AP-Images-4.jpg,2023-02-01T09:47:10Z,,"Berlin. Verbraucherinnen und Verbraucher in Deutschland können entspannt in den Februar starten: Während das Jahr 2022 durch massiv gestiegene Energiepreise geprägt war, ist jetzt ein Abwärtstrend zu… [+7990 chars]",,de,'Heizöl'
https://www.bild.de/politik/inland/politik-inland/eon-chef-schlaegt-alarm-die-deutschen-sparen-zu-wenig-beim-gasverbrauch-82751626.bild.html,https://www.bild.de/politik/inland/politik-inland/eon-chef-schlaegt-alarm-die-deutschen-sparen-zu-wenig-beim-gasverbrauch-82751626.bild.html,0,www.bild.de,Eon-Chef schlägt Alarm - Die Deutschen sparen „zu wenig“ beim Gasverbrauch,"Viele Deutsche haben diesen Winter viel Energie gespart. Das reicht offenbar nicht.Foto: Hauke-Christian Dittrich/dpa, Roland Weihrauch/dpa","https://images.bild.de/63da2b523948940cb5293d5a/09f0c8e76d6356808345d9ebca304a4a,40385d83?w=1280",2023-02-01T10:36:27Z,https://web.archive.org/web/20230201110728/https://www.bild.de/politik/inland/politik-inland/eon-chef-schlaegt-alarm-die-deutschen-sparen-zu-wenig-beim-gasverbrauch-82751626.bild.html,"Viele Deutsche haben diesen Winter so viel Energie gespart wie selten zuvor.
Doch selbst das soll nicht genug sein!
Der Chef des Energiekonzerns Eon Leonhard Birnbaum hat die privaten Verbraucher a… [+1747 chars]",,de,'Gas sparen'
https://www.morgenpost.de/wirtschaft/article237519215/pelletspreise-heute-aktuell-1-februar-2023-energie-pellets.html,https://www.morgenpost.de/wirtschaft/article237519215/pelletspreise-heute-aktuell-1-februar-2023-energie-pellets.html,0,www.morgenpost.de,Energiekosten: Pelletspreise heute: So viel kostet eine Tonne am 01.02.,Die Pelletspreise in Deutschland fallen weiter.  ○ Wie viel kostet eine Tonne Pellets am 1. Februar? ○ Die aktuellen Preise finden Sie hier.,https://img.morgenpost.de/img/wirtschaft/crop237455087/1212602872-w820-cv16_9-q85/Foerderung-fuer-eine-Pelletheizung-Diese-Zuschuesse-gibt-es.jpg,2023-02-01T10:39:25Z,https://web.archive.org/web/20230201195111/https://www.morgenpost.de/wirtschaft/article237519215/pelletspreise-heute-aktuell-1-februar-2023-energie-pellets.html,"Berlin. Verbraucherinnen und Verbraucher in Deutschland können aufatmen. Waren in der Energiekrise im Zuge des russischen Angriffskriegs gegen die Ukraine die Preise für Pellets deutlich gestiegen, h… [+5046 chars]",,de,'Energiekosten'
https://www.ifun.de/bundesnetzagentur-nimmt-2022-rund-15-millionen-produkte-vom-markt-203381/,https://www.ifun.de/bundesnetzagentur-nimmt-2022-rund-15-millionen-produkte-vom-markt-203381/,0,www.ifun.de,Bundesnetzagentur nimmt 2022 rund 15 Millionen Produkte vom Markt,"Die Bundesnetzagentur hat ihren Jahresbericht zur Marktüberwachung im Online- und Einzelhandel veröffentlicht. Insgesamt wurden im Laufe des Jahres 2022 mehr als 15 Millionen Produkte vom Markt genommen, weil sie nicht den gesetzlichen Anforderungen entsprech…",https://images.ifun.de/wp-content/uploads/2023/02/discokugel.jpg,2023-02-01T11:03:08Z,https://web.archive.org/web/20230202174234/https://www.ifun.de/bundesnetzagentur-nimmt-2022-rund-15-millionen-produkte-vom-markt-203381/,Die Bundesnetzagentur hat ihren Jahresbericht zur Marktüberwachung im Online- und Einzelhandel veröffentlicht. Insgesamt wurden im Laufe des Jahres 2022 mehr als 15 Millionen Produkte vom Markt genom… [+1798 chars],,de,'Netzagentur'
https://www.morgenpost.de/wirtschaft/article237519559/inflation-teuerungsrate-eurozone-sinkt-januar-8-5-prozent.html,https://www.morgenpost.de/wirtschaft/article237519559/inflation-teuerungsrate-eurozone-sinkt-januar-8-5-prozent.html,0,www.morgenpost.de,Verbraucher: Inflation sinkt im Euroraum zum dritten Mal in Folge,"Die Verbraucherpreise im Januar stiegen im Jahresvergleich um 8,5 Prozent, wie das EU-Statistikamt Eurostat am Mittwoch mitteilte.",https://img.morgenpost.de/img/politik/crop237138253/3092608771-w820-cv16_9-q85/4e6365f2-7a41-11ed-97f3-81362a541ddd.jpg,2023-02-01T11:38:42Z,https://web.archive.org/web/20230201115431/https://www.morgenpost.de/wirtschaft/article237519559/inflation-teuerungsrate-eurozone-sinkt-januar-8-5-prozent.html,Berlin. Gute Nachrichten für Verbraucherinnen und Verbraucher: Die Teuerungsrate in der Eurozone hat sich im Januar den dritten Monat hintereinander abgeschwächt. Die Konsumentenpreise stiegen laut E… [+1353 chars],,de,'Inflation'
https://www.handelsblatt.com/unternehmen/energie/gasspeicher-in-deutschland-fuellstand-auf-79-prozent-gefallen/28819652.html,https://www.handelsblatt.com/unternehmen/energie/gasspeicher-in-deutschland-fuellstand-auf-79-prozent-gefallen/28819652.html,0,www.handelsblatt.com,Gasspeicher in Deutschland: Füllstand auf 79 Prozent gefallen,Ein hoher Gasspeicher-Füllstand ist für Deutschlands Gasversorgung in der Energiekrise essenziell. Wie steht es aktuell um die Gasreserven? Ein Überblick.,https://www.handelsblatt.com/images/gasspeicher-in-sachsen-anhalt/28877480/2-format2003.jpg,2023-02-01T12:22:16Z,https://web.archive.org/web/20230201135212/https://www.handelsblatt.com/unternehmen/energie/gasspeicher-in-deutschland-fuellstand-auf-79-prozent-gefallen/28819652.html,"Gasspeicher in Sachsen-AnhaltDer Gasspeicher-Füllstand in Deutschland ist in der Energiekrise zum wichtigen Faktor geworden.
(Foto: dpa)
Düsseldorf Ein stabiler Füllstand der deutschen Gasspeicher … [+7396 chars]",,de,'Gasversorgung'
https://www.sueddeutsche.de/wirtschaft/uniper-energiekrise-russland-gas-verstaatlichung-1.5743266,https://www.sueddeutsche.de/wirtschaft/uniper-energiekrise-russland-gas-verstaatlichung-1.5743266,0,www.sueddeutsche.de,"Uniper: Der Konzern, den keiner haben will",40 Milliarden Euro Verlust in nur neun Monaten: Nach der Verstaatlichung sucht die Bundesregierung eine Strategie für Uniper. Noch gibt es nicht einmal einen neuen Vorstandschef für Deutschlands größten Gasimporteur.,https://www.sueddeutsche.de/image/sz.1.5662910/1200x675?v=1675259579,2023-02-01T13:23:44Z,https://web.archive.org/web/20230201133936/https://www.sueddeutsche.de/wirtschaft/uniper-energiekrise-russland-gas-verstaatlichung-1.5743266,Nach der Verstaatlichung sucht die Bundesregierung eine Strategie für Uniper. Noch gibt es nicht einmal einen neuen Vorstandschef für Deutschlands größten Gasimporteur - stattdessen: Milliardenverlus… [+672 chars],,de,'Gasimporteur'
https://www.handelsblatt.com/unternehmen/energie/gaspreis-uniper-erwartet-deutlich-weniger-verlust-als-befuerchtet/28957236.html,https://www.handelsblatt.com/unternehmen/energie/gaspreis-uniper-erwartet-deutlich-weniger-verlust-als-befuerchtet/28957236.html,0,www.handelsblatt.com,Gaspreis: Uniper erwartet deutlich weniger Verlust als befürchtet,Deutschlands größter Gasimporteur legt vorläufige Zahlen vor. Dank der warmen Temperaturen muss der Konzern deutlich weniger Geld für Gasersatzbeschaffung ausgeben als erwartet.,https://www.handelsblatt.com/images/uniper-zentrale-in-duesseldorf/28957288/3-format2003.jpg,2023-02-01T14:02:51Z,https://web.archive.org/web/20230201150632/https://www.handelsblatt.com/unternehmen/energie/gaspreis-uniper-erwartet-deutlich-weniger-verlust-als-befuerchtet/28957236.html,"Düsseldorf Der Düsseldorfer Energiekonzern Uniper erwartet für das Geschäftsjahr 2022 niedrigere Verluste als bisher angenommen. Die Prognose für die Ergebnisse hätten sich deutlich verbessert, gab d… [+4703 chars]",,de,'Gaspreis'
https://www.tagesspiegel.de/berlin/zuschuss-fur-heizol-und-pellets-warum-sie-ihren-antrag-jetzt-stellen-sollten-9276732.html,https://www.tagesspiegel.de/berlin/zuschuss-fur-heizol-und-pellets-warum-sie-ihren-antrag-jetzt-stellen-sollten-9276732.html,0,www.tagesspiegel.de,Zuschuss für Heizöl und Pellets in Berlin: Warum Sie Ihren Antrag jetzt stellen sollten,"Berlin zahlt Menschen, die mit Öl, Kohle oder Pellets heizen, bis zu 2000 Euro als Ausgleich für die gestiegenen Kosten. Das Interesse ist groß.",https://www.tagesspiegel.de/berlin/images/heizal/alternates/BASE_16_9_W1400/heizl.jpeg,2023-02-01T14:18:07Z,http://archive.md/20230201172158/https://www.tagesspiegel.de/berlin/zuschuss-fur-heizol-und-pellets-warum-sie-ihren-antrag-jetzt-stellen-sollten-9276732.html,"Viele Berliner haben offensichtlich schon in den Startlöchern gesessen. Am Dienstagnachmittag hatte die Investitionsbank Berlin (IBB) die Onlineseite freigeschaltet, mit der Menschen die Heizkostenhi… [+4557 chars]",,de,'Heizöl'
https://www.morgenpost.de/wirtschaft/article237522347/Bundesnetzagentur-stoppt-Verkauf-von-Millionen-Produkten.html,https://www.morgenpost.de/wirtschaft/article237522347/Bundesnetzagentur-stoppt-Verkauf-von-Millionen-Produkten.html,0,www.morgenpost.de,Verbraucherschutz: Bundesnetzagentur stoppt Verkauf von Millionen Produkten,Fragliche Energiesparfunktion oder fehlende deutsche Bedienungsanleitungen: Die Aufsichtsbehörde hat 2022 gut 15 Millionen Produkte vom Markt genommen. Der Löwenanteil betrifft den Onlinehandel.,https://img.morgenpost.de/img/wirtschaft/crop237522345/8282605783-w820-cv16_9-q85/Bundesnetzagentur.jpg,2023-02-01T14:36:48Z,https://web.archive.org/web/20230201150804/https://www.morgenpost.de/wirtschaft/article237522347/Bundesnetzagentur-stoppt-Verkauf-von-Millionen-Produkten.html,"Bonn. Die Bundesnetzagentur hat im vergangenen Jahr den Verkauf von mehr als 15 Millionen verbotenen Produkten gestoppt. Darunter waren allein fast 2,8 Millionen Energiespargeräte, wie die Aufsichtsb… [+2271 chars]",,de,'Bundesnetzagentur'
https://www.stern.de/wirtschaft/news/verbraucherschutz--bundesnetzagentur-stoppt-verkauf-von-millionen-produkten-33157750.html,https://www.stern.de/wirtschaft/news/verbraucherschutz--bundesnetzagentur-stoppt-verkauf-von-millionen-produkten-33157750.html,0,www.stern.de,Verbraucherschutz: Bundesnetzagentur stoppt Verkauf von Millionen Produkten,Fragliche Energiesparfunktion oder fehlende deutsche Bedienungsanleitungen: Die Aufsichtsbehörde hat 2022 gut 15 Millionen Produkte vom Markt genommen. Der Löwenanteil betrifft den Onlinehandel.,https://image.stern.de/33157752/t/K7/v1/w1440/r1.7778/-/01--urnnewsmldpacom2009010123020199438927v3w800h600l1047t87r2475b1350jpeg---0713b34b9b182a05.jpg,2023-02-01T14:36:48Z,https://web.archive.org/web/20230201183323/https://www.stern.de/wirtschaft/news/verbraucherschutz--bundesnetzagentur-stoppt-verkauf-von-millionen-produkten-33157750.html,"Fragliche Energiesparfunktion oder fehlende deutsche Bedienungsanleitungen: Die Aufsichtsbehörde hat 2022 gut 15 Millionen Produkte vom Markt genommen. Der Löwenanteil betrifft den Onlinehandel.
Die… [+2461 chars]",,de,'Bundesnetzagentur'
https://www.sueddeutsche.de/muenchen/muenchen-swm-strompreis-senkung-1.5743404,https://www.sueddeutsche.de/muenchen/muenchen-swm-strompreis-senkung-1.5743404,0,www.sueddeutsche.de,Energiepreise: Strom wird 30 Prozent günstiger,"Wer Energie über die Münchner Stadtwerke bezieht, zahlt vom 1. April an zehn Cent weniger pro Kilowattstunde. Rechnet man die bundesweite Strompreisbremse hinzu, sinkt der Preis noch deutlicher.",https://www.sueddeutsche.de/image/sz.1.5743405/1200x675?v=1675263872,2023-02-01T15:04:42Z,http://archive.md/20230202031329/https://www.sueddeutsche.de/muenchen/muenchen-swm-strompreis-senkung-1.5743404,"Wer Energie über die Münchner Stadtwerke bezieht, zahlt vom 1. April an zehn Cent weniger pro Kilowattstunde. Rechnet man die bundesweite Strompreisbremse hinzu, sinkt der Preis noch deutlicher. Die … [+1354 chars]",,de,'Energiepreise'
