index,url,valid,domain,title,description,image,published,archive,content,quote,language,keyword
https://www.zeit.de/news/2025-06/16/krieg-im-nahen-osten-eu-will-mit-usa-energiemarkt-sichern,https://www.zeit.de/news/2025-06/16/krieg-im-nahen-osten-eu-will-mit-usa-energiemarkt-sichern,0,www.zeit.de,Steigende Preise: Krieg im Nahen Osten - EU will mit USA Energiemarkt sichern,Hier finden Sie Informationen zu dem Thema „Steigende Preise“. Lesen Sie jetzt „Krieg im Nahen Osten - EU will mit USA Energiemarkt sichern“.,https://img.zeit.de/news/2025-06/16/krieg-im-nahen-osten-eu-will-mit-usa-energiemarkt-sichern-image-group/wide__1300x731,2025-06-16T04:51:06Z,,Die EU will gemeinsam mit den USA einen starken Anstieg der Energiepreise wegen des Krieges zwischen Israel und dem Iran verhindern. Sie habe mit US-Präsident Donald Trump über das Thema gesprochen u… [+1403 chars],,de,'Energiepreise'
https://www.tagesspiegel.de/wirtschaft/steigende-preise-krieg-im-nahen-osten-eu-will-mit-usa-energiemarkt-sichern-13859815.html,https://www.tagesspiegel.de/wirtschaft/steigende-preise-krieg-im-nahen-osten-eu-will-mit-usa-energiemarkt-sichern-13859815.html,0,www.tagesspiegel.de,Steigende Preise: Krieg im Nahen Osten - EU will mit USA Energiemarkt sichern,Seit dem Angriff Israels auf den Iran steigen die Rohölpreise und in der Folge die Sprit- und Heizölpreise. Die EU und die USA sind alarmiert - und wollen notfalls handeln.,https://www.tagesspiegel.de/images/13859812/alternates/BASE_16_9_W1400/1750049559000/g7-gipfel-in-kanada.jpeg,2025-06-16T04:52:39Z,,Die EU will gemeinsam mit den USA einen starken Anstieg der Energiepreise wegen des Krieges zwischen Israel und dem Iran verhindern. Sie habe mit US-Präsident Donald Trump über das Thema gesprochen u… [+2128 chars],,de,'Heizöl'
https://www.deutsche-startups.de/2025/06/16/trawa-optimiert-die-energieversorgung-von-unternehmen/,https://www.deutsche-startups.de/2025/06/16/trawa-optimiert-die-energieversorgung-von-unternehmen/,0,www.deutsche-startups.de,#StartupsToWatch - trawa optimiert die Energieversorgung von Unternehmen,"Das Berliner Energie-Startup trawa sollten alle auf dem Schirm haben! In den vergangenen Jahren flossen bereits mehr als 35 Millionen Euro in die Jungfirma, die 2022 gegründet wurde. Das Geld stammt von VC-Schwergewichten wie Headline, Norrsken und Balderton.",https://www.deutsche-startups.de/app/uploads/2025/05/ds-trawa-team.jpg,2025-06-16T06:15:15Z,,"Zu den vielen Startups, die man unbedingt im Blick behalten sollte, gehört das millionenschwere Berliner B2B-Energieunternehmen trawa. Die Jungfirma, 2022 von David Budde, Max Lüddemann und Robert Qu… [+1779 chars]",,de,'Energiepreise'
https://www.diepresse.com/19798942/eu-und-usa-wappnen-sich-fuer-krise-am-energiemarkt,https://www.diepresse.com/19798942/eu-und-usa-wappnen-sich-fuer-krise-am-energiemarkt,0,www.diepresse.com,EU und USA wappnen sich für Krise am Energiemarkt,Der Krieg zwischen Israel und dem Iran hat auch Auswirkungen auf die Energiepreise. Die EU und die USA wollen deshalb für Stabilität sorgen.,https://img.diepresse.com/public/incoming/jnbnhs-ISRAEL-PALESTINIANSIRAN-OIL-MINISTER/alternates/DPR_SOCIAL_NACHRICHTEN/ISRAEL-PALESTINIANSIRAN-OIL%20MINISTER,2025-06-16T07:21:17Z,,"Der Krieg zwischen Israel und dem Iran hat auch Auswirkungen auf die Energiepreise. Die EU und die USA wollen deshalb für Stabilität sorgen. 
Die EU will gemeinsam mit den USA einen starken Anstieg … [+1623 chars]",,de,'Energiepreise'
https://www.morgenpost.de/wirtschaft/article409273315/heizoelpreise-aktuell-heute-16-juni-durchschnitt-heizoel-heizung-verbraucher.html,https://www.morgenpost.de/wirtschaft/article409273315/heizoelpreise-aktuell-heute-16-juni-durchschnitt-heizoel-heizung-verbraucher.html,0,www.morgenpost.de,Heizölpreise am Montag (16. Juni): Der aktuelle Preis pro Liter,Nach dem Hitze-Wochenende beginnt eine kühlere Woche: Wie wirkt sich der Temperaturabfall auf den Heizölmarkt aus? Ein Überblick.,https://img.sparknews.funkemedien.de/406858449/406858449_1728458201_v16_9_1600.jpeg,2025-06-16T07:43:36Z,,"Berlin. Nach dem Hitze-Wochenende beginnt eine kühlere Woche: Wie wirkt sich der Temperaturabfall auf den Heizölmarkt aus? Ein Überblick.
Mit Temperaturen von über 30 Grad schien der Winter am verga… [+7644 chars]",,de,'Heizöl'
https://www.focus.de/finanzen/boerse/marktkommentar-robert-halver-inflation-trump-und-geopolitische-brandherde_69f374f5-5d31-4781-95b1-47206cddfe35.html,https://www.focus.de/finanzen/boerse/marktkommentar-robert-halver-inflation-trump-und-geopolitische-brandherde_69f374f5-5d31-4781-95b1-47206cddfe35.html,0,www.focus.de,"Marktkommentar Robert Halver: Inflation, Trump und geopolitische Brandherde","Inflation, solide Arbeitsmarktdaten und die unsichere Handelspolitik kühlen die Zinslockerungslaune der Fed über den Sommer ab. Hinzu kommen steigende Ölpreise durch Konflikte im Nahen Osten.",https://quadro.burda-forward.de/ctf/a77a3e54-80e5-4992-b183-33eeb46cebd2.544a9df7-5d13-44aa-abb8-089cd0c1b35f.jpg?im=RegionOfInterestCrop%3D%281200%2C630%29%2CregionOfInterest%3D%28991%2C406%29&hash=a373cd8448f00ebc93005d5defd77fa43f2d20f8e09a7d2a1ec6b7012bba1580,2025-06-16T07:43:39Z,,"ANZEIGE
ISM Subindex bezahlte Preise Industrie und Dienstleister USA und US-InflationLSEG Datastream/Baader Bank Kapitalmarktanalyse
Zudem treibt die jüngste militärische Verschärfung im Konflikt z… [+10620 chars]",,de,'Inflation'
https://hallespektrum.de/aktuelles/willingmann-windkraft-ausbau-in-sachsen-anhalt-nimmt-weiter-fahrt-auf/471657/,https://hallespektrum.de/aktuelles/willingmann-windkraft-ausbau-in-sachsen-anhalt-nimmt-weiter-fahrt-auf/471657/,0,hallespektrum.de,Willingmann: Windkraft-Ausbau in Sachsen-Anhalt nimmt weiter Fahrt auf,"Sachsen-Anhalt sieht sich beim Ausbau der Windenergie auf einem guten Kurs. Wie Energieminister Prof. Dr. Armin Willingmann (SPD) am Sonntag zum internationalen „Global Wind Day“ erklärte, sei der Zubau im Land erneut kräftig vorangeschritten: Allein von Janu…",https://hallespektrum.de/wp-content/uploads/2024/12/Windrad-in-Maisfeld.png,2025-06-16T11:27:37Z,,"Sachsen-Anhalt sieht sich beim Ausbau der Windenergie auf einem guten Kurs. Wie Energieminister Prof. Dr. Armin Willingmann (SPD) am Sonntag zum internationalen Global Wind Day erklärte, sei der Zuba… [+2071 chars]",,de,'Energiepreise'
https://www.stern.de/gesellschaft/regional/baden-wuerttemberg/unternehmen--insolvenzzahlen-im-suedwesten-steigen-35812822.html,https://www.stern.de/gesellschaft/regional/baden-wuerttemberg/unternehmen--insolvenzzahlen-im-suedwesten-steigen-35812822.html,0,www.stern.de,Unternehmen: Insolvenzzahlen im Südwesten steigen,Hohe Energiepreise und die schwächelnde Konjunktur fordern auch im Südwesten ihren Tribut: Die Zahl der Unternehmenspleiten steigt weiter. Tausende Beschäftige bekommen das zu spüren.,https://image.stern.de/35812824/t/Kw/v1/w1440/r1.7778/-/16--2bybuuqs4sv3axs2048jpeg---6d93f524a516dbaa.jpg,2025-06-16T12:14:07Z,,"Kopiere den aktuellen Link
Zur Merkliste hinzufügen
Hohe Energiepreise und die schwächelnde Konjunktur fordern auch im Südwesten ihren Tribut: Die Zahl der Unternehmenspleiten steigt weiter. Tausen… [+2142 chars]",,de,'Energiepreise'
https://www.stern.de/gesellschaft/regional/mecklenburg-vorpommern/energie--vertrag-fuer-schiff-gekuendigt---deutsche-regas-und-bund-einig-35812850.html,https://www.stern.de/gesellschaft/regional/mecklenburg-vorpommern/energie--vertrag-fuer-schiff-gekuendigt---deutsche-regas-und-bund-einig-35812850.html,0,www.stern.de,Energie: Vertrag für Schiff gekündigt - Deutsche Regas und Bund einig,Bereits vor Monaten hatte die Deutsche Regas den Chartervertrag mit dem Bund für ein LNG-Terminalschiff gekündigt. Damals gab es Misstöne. Nun zeigen sich Bund und der Terminalbetreiber einig.,https://image.stern.de/35812852/t/44/v1/w1440/r1.7778/-/16--xgbdn2s34dv3axs2048jpeg---1dc2abba854b8fc6.jpg,2025-06-16T12:19:47Z,,"Kopiere den aktuellen Link
Zur Merkliste hinzufügen
Bereits vor Monaten hatte die Deutsche Regas den Chartervertrag mit dem Bund für ein LNG-Terminalschiff gekündigt. Damals gab es Misstöne. Nun ze… [+2254 chars]",,de,'Flüssiggas'
https://www.stern.de/capital/benzinpreise--wird-tanken-nach-israels-angriff-auf-den-iran-teurer--35812968.html,https://www.stern.de/capital/benzinpreise--wird-tanken-nach-israels-angriff-auf-den-iran-teurer--35812968.html,0,www.stern.de,Energiepreise: Was bedeutet Israels Angriff gegen den Iran für die Benzinpreise?,Israels Attacken gegen den Iran könnten das Angebot von Öl und Gas weltweit verknappen – und die Benzinpreise an den Tankstellen in Deutschland in die Höhe treiben.,https://image.stern.de/35812970/t/j3/v4/w1440/r1.7778/-/oel-energie-iran-israel.jpg,2025-06-16T13:16:00Z,,"Kopiere den aktuellen Link
Zur Merkliste hinzufügen
Israels Attacken gegen den Iran könnten das Angebot von Öl und Gas weltweit verknappen und die Benzinpreise an den Tankstellen in Deutschland in … [+4287 chars]",,de,'Energiepreise'
https://www.stern.de/news/bundesgerichtshof-verhandelt-in-streit-zwischen-gas-de-und-bundesnetzagentur-35814548.html,https://www.stern.de/news/bundesgerichtshof-verhandelt-in-streit-zwischen-gas-de-und-bundesnetzagentur-35814548.html,0,www.stern.de,Bundesgerichtshof verhandelt in Streit zwischen Gas.de und Bundesnetzagentur,"Der Bundesgerichtshof (BGH) beschäftigt sich am Dienstag (10.00 Uhr) noch einmal mit der Energiekrise. Der Kartellsenat in Karlsruhe verhandelt über eine Beschwerde des ehemaligen Billiganbieters Gas.de. Es geht um die Frage, ob die Bundesnetzagentur die Öffe…",https://image.stern.de/35814550/t/uw/v1/w1440/r1.7778/-/17--bundesgerichtshof---8abec84aad2394d5.jpg,2025-06-17T02:06:21Z,,"Kopiere den aktuellen Link
Zur Merkliste hinzufügen
Der Bundesgerichtshof (BGH) beschäftigt sich am Dienstag (10.00 Uhr) noch einmal mit der Energiekrise. Der Kartellsenat in Karlsruhe verhandelt ü… [+693 chars]",,de,'Bundesnetzagentur'
https://www.nzz.ch/schweiz/das-stromabkommen-mit-der-eu-soll-die-versorgungssicherheit-der-schweiz-staerken-doch-der-publizierte-text-des-abkommens-laesst-fragen-offen-ld.1889191,https://www.nzz.ch/schweiz/das-stromabkommen-mit-der-eu-soll-die-versorgungssicherheit-der-schweiz-staerken-doch-der-publizierte-text-des-abkommens-laesst-fragen-offen-ld.1889191,0,www.nzz.ch,Das Stromabkommen mit der EU soll die Versorgungssicherheit der Schweiz stärken – doch der publizierte Text des Abkommens lässt Fragen offen,Trotz dem Versprechen einer sichereren Stromversorgung ist das Abkommen mit der EU im Inland umstritten. Auffällig im Vertragstext ist unter anderem die Integration einer Serie von EU-Rechtserlassen.,"https://img.nzz.ch/2025/06/16/fe5002d1-328a-433b-ab57-f17a429ce73c.jpeg?width=1200&height=674&fit=bounds&quality=75&auto=webp&crop=1850,1040,x87,y2506&wmark=nzz",2025-06-17T03:30:00Z,,"Die Schweiz soll künftig noch stärker in den europäischen Strommarkt integriert sein.
2022 war eine Selbstverständlichkeit in der Schweiz plötzlich infrage gestellt: dass Strom fliesst, wenn wir ihn… [+6034 chars]",,de,'Stromversorgung'
https://www.morgenpost.de/wirtschaft/article409273315/heizoelpreise-aktuell-heute-17-juni-durchschnitt-heizoel-heizung-verbraucher.html,https://www.morgenpost.de/wirtschaft/article409273315/heizoelpreise-aktuell-heute-17-juni-durchschnitt-heizoel-heizung-verbraucher.html,0,www.morgenpost.de,Heizölpreise aktuell (17. Juni): Das kostet heute ein Liter,"Während draußen sommerliche Temperaturen herrschen, lohnt sich der Blick aufs Heizöl. Hier sind die aktuellen Zahlen für den 17. Juni.",https://img.sparknews.funkemedien.de/406858447/406858447_1724138717_v16_9_1600.jpeg,2025-06-17T07:34:50Z,,"Berlin. Während draußen sommerliche Temperaturen herrschen, lohnt sich der Blick aufs Heizöl. Hier sind die aktuellen Zahlen für den 17. Juni.
Die zweite Juni-Hälfte startet mit einem echten Sommerw… [+7662 chars]",,de,'Heizöl'
https://orf.at/stories/3397032/,https://orf.at/stories/3397032/,0,orf.at,Gas aus Russland: EU-Kommission für Verbot ab 2027,,https://orf.at/mojo/1_4_1/storyserver//news/common/images/og-fallback-news.png,2025-06-17T13:18:09Z,,"Die EU-Kommission hat ein Verbot von Gaslieferungen aus Russland vorgeschlagen. Brüssel legte heute einen mehrstufigen Plan vor, laut dem Unternehmen ab dem kommenden Jahr keine neuen Verträge mehr m… [+1352 chars]",,de,'Russland Gas'
https://www.focus.de/finanzen/news/unabwaegbare-risiken-gasspeicher-leer-gas-teuer-was-der-israel-iran-krieg-fuer-unseren-winter-bedeutet_54d2fb68-2eaa-434e-ae77-c0e573a08ac7.html,https://www.focus.de/finanzen/news/unabwaegbare-risiken-gasspeicher-leer-gas-teuer-was-der-israel-iran-krieg-fuer-unseren-winter-bedeutet_54d2fb68-2eaa-434e-ae77-c0e573a08ac7.html,0,www.focus.de,"Unabwägbare Risiken: Gasspeicher leer, Gas teuer: Was der Israel-Iran-Krieg für unseren Winter bedeutet","Die deutschen Gasspeicher füllen sich dieses Jahr langsamer als sonst – vor allem, weil die Gaspreise nach der jüngsten Eskalation im Nahen Osten angezogen haben. Hält der Konflikt an, könnte Heizen im Winter für Sie teurer werden.",https://quadro.burda-forward.de/ctf/378bb0b2-9e1b-4dc6-a02f-8405e4a6e0da.4aa6490b-8a26-474b-a194-e54ae66b3c6f.jpeg?im=RegionOfInterestCrop%3D%281200%2C630%29%2CregionOfInterest%3D%28720%2C405%29&hash=1b00e826bf0f1026130ae03935a69ddc7bdd1ab5af004774a1c73d0146e47cee,2025-06-17T13:36:38Z,,"Vor drei Jahren waren die Stände der deutschen Gasspeicher fast eine tägliche Meldung wert. In der Energiekrise bestand die reale Gefahr, dass sie bis zum Wintereinbruch nicht ausreichend gefüllt sei… [+4014 chars]",,de,'Gaspreis'
https://www.stern.de/news/madrid-nennt-ueberspannung-als-ursache-fuer-mega-stromausfall-im-april-35816972.html,https://www.stern.de/news/madrid-nennt-ueberspannung-als-ursache-fuer-mega-stromausfall-im-april-35816972.html,0,www.stern.de,Madrid nennt Überspannung als Ursache für Mega-Stromausfall im April,"Der massive Stromausfall auf der Iberischen Halbinsel Ende April ist laut Bericht der spanischen Regierung durch Überspannung im Netz ausgelöst worden, was zu einer ""unkontrollierbaren Kettenreaktion"" führte. Es habe mehrere Ursachen für den Blackout gegeben,…",https://image.stern.de/35816974/t/s9/v1/w1440/r1.7778/-/17--spaziergaengerin-in-vigo-im-nordwesten-spaniens-am-28-april---dcca4d3c6e6a851f.jpg,2025-06-17T13:43:47Z,,"Kopiere den aktuellen Link
Zur Merkliste hinzufügen
Der massive Stromausfall auf der Iberischen Halbinsel Ende April ist laut Bericht der spanischen Regierung durch Überspannung im Netz ausgelöst w… [+1343 chars]",,de,'Blackout'
https://www.zeit.de/gesellschaft/zeitgeschehen/2025-06/grossflaechiger-stromausfall-portugal-spanien-regierung-ursache-ueberspannung-kettenreaktion,https://www.zeit.de/gesellschaft/zeitgeschehen/2025-06/grossflaechiger-stromausfall-portugal-spanien-regierung-ursache-ueberspannung-kettenreaktion,0,www.zeit.de,Großflächiger Stromausfall: Überspannung war offenbar Grund für Blackout in Spanien,"Die spanische Regierung macht Überspannung für den großflächigen Stromausfall im April verantwortlich. Dies habe zu einer ""unkontrollierbaren Kettenreaktion"" geführt.",https://img.zeit.de/wissen/2025-06/blackout-ursache-notfall-spanien/wide__1300x731,2025-06-17T14:14:46Z,,"Der Stromausfall auf der Iberischen Halbinsel Ende April ist laut der spanischen Regierung durch Überspannung im Netz ausgelöst worden. Dies habe zu einer ""unkontrollierbaren Kettenreaktion"" geführt,… [+940 chars]",,de,'Blackout'
https://www.n-tv.de/wirtschaft/EU-Kommission-will-Moskaus-Gasimporte-vollstaendig-stoppen-article25840235.html,https://www.n-tv.de/wirtschaft/EU-Kommission-will-Moskaus-Gasimporte-vollstaendig-stoppen-article25840235.html,0,www.n-tv.de,Plan vorgelegt: EU-Kommission will Moskaus Gasimporte vollständig stoppen,Trotz der zahlreichen Sanktionen kommt russisches Gas weiter in Europa an. Das will die EU-Kommission nun endgültig verhindern und präsentiert einen Weg für ein Verbot. Doch es gibt Ausnahmen - zumindest vorläufig.,https://www.n-tv.de/img/incoming/crop25840231/6201328622-cImg_16_9-w1200/505857374.jpg,2025-06-17T14:19:21Z,,Trotz der zahlreichen Sanktionen kommt russisches Gas weiter in Europa an. Das will die EU-Kommission nun endgültig verhindern und präsentiert einen Weg für ein Verbot. Doch es gibt Ausnahmen - zumin… [+2839 chars],,de,'russisches Gas'
https://www.zeit.de/news/2025-06/17/ueberspannung-liess-strom-in-spanien-und-portugal-ausfallen,https://www.zeit.de/news/2025-06/17/ueberspannung-liess-strom-in-spanien-und-portugal-ausfallen,0,www.zeit.de,Historischer Blackout: Überspannung ließ Strom in Spanien und Portugal ausfallen,Hier finden Sie Informationen zu dem Thema „Historischer Blackout“. Lesen Sie jetzt „Überspannung ließ Strom in Spanien und Portugal ausfallen“.,https://img.zeit.de/news/2025-06/17/ueberspannung-liess-strom-in-spanien-und-portugal-ausfallen-image-group/wide__1300x731,2025-06-17T14:44:54Z,,Gut sieben Wochen nach dem historischen Stromausfall auf der Iberischen Halbinsel ist ein Untersuchungsbericht zu den Ursachen vorgelegt worden. Grund für den stundenlangen Blackout am 28. April in S… [+2110 chars],,de,'Blackout'
https://www.stern.de/panorama/historischer-blackout--ueberspannung-liess-strom-in-spanien-und-portugal-ausfallen-35817252.html,https://www.stern.de/panorama/historischer-blackout--ueberspannung-liess-strom-in-spanien-und-portugal-ausfallen-35817252.html,0,www.stern.de,Historischer Blackout: Überspannung ließ Strom in Spanien und Portugal ausfallen,Ende April brach die Stromversorgung in Spanien und Portugal völlig zusammen. Stundenlang ging gar nichts mehr. Jetzt liegt ein Untersuchungsbericht zu den Ursachen vor. Aber Fragen bleiben.,https://image.stern.de/35817254/t/gZ/v1/w1440/r1.7778/-/17--hpdqrgtvfwv9axs2048jpeg---f987c5b7617261a1.jpg,2025-06-17T14:44:54Z,,"Kopiere den aktuellen Link
Zur Merkliste hinzufügen
Ende April brach die Stromversorgung in Spanien und Portugal völlig zusammen. Stundenlang ging gar nichts mehr. Jetzt liegt ein Untersuchungsberi… [+2316 chars]",,de,'Blackout'
https://www.tagesspiegel.de/gesellschaft/panorama/historischer-blackout-uberspannung-liess-strom-in-spanien-und-portugal-ausfallen-13870282.html,https://www.tagesspiegel.de/gesellschaft/panorama/historischer-blackout-uberspannung-liess-strom-in-spanien-und-portugal-ausfallen-13870282.html,0,www.tagesspiegel.de,Historischer Blackout: Überspannung ließ Strom in Spanien und Portugal ausfallen,Ende April brach die Stromversorgung in Spanien und Portugal völlig zusammen. Stundenlang ging gar nichts mehr. Jetzt liegt ein Untersuchungsbericht zu den Ursachen vor. Aber Fragen bleiben.,https://www.tagesspiegel.de/images/13870279/alternates/BASE_16_9_W1400/1750171574000/nach-stromausfall-in-spanien-und-portugal.jpeg,2025-06-17T14:46:14Z,,Gut sieben Wochen nach dem historischen Stromausfall auf der Iberischen Halbinsel ist ein Untersuchungsbericht zu den Ursachen vorgelegt worden. Grund für den stundenlangen Blackout am 28. April in S… [+2832 chars],,de,'Blackout'
https://www.morgenpost.de/wirtschaft/article409242756/oelheizung-israel-iran-konflikt-preisanstieg-heizoelpreise-analyse-experte.html,https://www.morgenpost.de/wirtschaft/article409242756/oelheizung-israel-iran-konflikt-preisanstieg-heizoelpreise-analyse-experte.html,0,www.morgenpost.de,Jetzt Heizöl kaufen – oder warten? Analyse gibt eine klare Antwort,"Wegen des Nahost-Konflikts steigen die Heizölpreise in Deutschland spürbar. Ein Energieexperte erklärt, ob sich ein Kauf jetzt noch lohnt.",https://img.sparknews.funkemedien.de/409244399/409244399_1749913048_v16_9_1600.jpeg,2025-06-17T14:57:24Z,,"Berlin. Wegen des Nahost-Konflikts steigen die Heizölpreise in Deutschland spürbar. Ein Energieexperte erklärt, ob sich ein Kauf jetzt noch lohnt.
Nach dem Angriff Israels auf den Iran steigen die H… [+4133 chars]",,de,'Heizöl'
https://www.tagesspiegel.de/politik/reiche-muss-endlich-ihre-fossile-ideologie-begraben-grune-fordern-energie-kehrtwende-wegen-eskalation-in-nahost-13869958.html,https://www.tagesspiegel.de/politik/reiche-muss-endlich-ihre-fossile-ideologie-begraben-grune-fordern-energie-kehrtwende-wegen-eskalation-in-nahost-13869958.html,0,www.tagesspiegel.de,„Reiche muss endlich ihre fossile Ideologie begraben“: Grüne fordern Energie-Kehrtwende wegen Eskalation in Nahost,"Der Konflikt zwischen Israel und dem Iran lässt die Öl- und Gaspreise steigen. Weil eine erneute Inflation droht, fordern die Grünen eine neue Strategie von Wirtschaftsministerin Katherina Reiche.",https://www.tagesspiegel.de/images/13841785/alternates/BASE_16_9_W1400/1749808676000/oecd-stellt-konjunkturbericht-fur-deutschland-vor.jpeg,2025-06-17T15:40:27Z,,"Deutsche Autofahrer können die Eskalation zwischen Israel und dem Iran bereits an der Zapfsäule spüren. Um einige Cent sei der Preis pro Liter Benzin oder Diesel zuletzt gestiegen, heißt es vom ADAC.… [+4268 chars]",,de,'Inflation'
https://www.golem.de/sonstiges/zustimmung/auswahl.html?from=https://www.golem.de/news/spanien-und-portugal-ueberspannungen-und-fehlplanung-verursachten-den-blackout-2506-197220.html&referer=https://t.co/c420237927,https://www.golem.de/sonstiges/zustimmung/auswahl.html?from=https://www.golem.de/news/spanien-und-portugal-ueberspannungen-und-fehlplanung-verursachten-den-blackout-2506-197220.html&referer=https://t.co/c420237927,0,www.golem.de,Spanien und Portugal: Überspannungen und Fehlplanung verursachten den Blackout,"Eine Verkettung mehrerer Ursachen führte zum großflächigen Stromausfall in Spanien. Weder erneuerbare Energien noch ein Cyberangriff gehören dazu. (Blackout, Strom)",,2025-06-17T16:44:01Z,,"Besuchen Sie Golem.de wie gewohnt mit Werbung und Tracking,
 indem Sie der Nutzung aller Cookies zustimmen.
 Details zum Tracking finden Sie im Privacy Center.
Skript wurde nicht geladen. Informat… [+607 chars]",,de,'Blackout'
https://www.stern.de/panorama/weltgeschehen/blackout-in-spanien-und-portugal--grund-fuer-stromausfall-gefunden-35817252.html,https://www.stern.de/panorama/weltgeschehen/blackout-in-spanien-und-portugal--grund-fuer-stromausfall-gefunden-35817252.html,0,www.stern.de,Historischer Blackout: Grund für Stromausfall in Spanien und Portugal gefunden,"Ende April brach die Stromversorgung in Spanien und Portugal völlig zusammen. Stundenlang ging gar nichts mehr. Jetzt liegt ein Bericht zu den Ursachen vor, doch Fragen bleiben.",https://image.stern.de/35817736/t/EE/v1/w1440/r1.7778/-/stromausfall-spanien-barcelona.jpg,2025-06-17T18:06:00Z,,"Kopiere den aktuellen Link
Zur Merkliste hinzufügen
Ende April brach die Stromversorgung in Spanien und Portugal völlig zusammen. Stundenlang ging gar nichts mehr. Jetzt liegt ein Bericht zu den Ur… [+2233 chars]",,de,'Blackout'
https://www.n-tv.de/wirtschaft/Spanien-nennt-Uberspannung-als-Grund-fuer-Mega-Blackout-article25840328.html,https://www.n-tv.de/wirtschaft/Spanien-nennt-Uberspannung-als-Grund-fuer-Mega-Blackout-article25840328.html,0,www.n-tv.de,Stundenlanger Stromausfall: Spanien nennt Überspannung als Grund für Mega-Blackout,"Ende April kommt es in Spanien und Portugal zu massiven Stromausfällen. Über die Ursache für den stundenlangen Blackout auf der iberischen Halbinsel wird viel spekuliert. Die spanische Regierung spricht jetzt von einer ""unkontrollierbaren Kettenreaktion"".",https://www.n-tv.de/img/incoming/crop25840319/0291324074-cImg_16_9-w1200/522212030.jpg,2025-06-17T18:30:29Z,,Ende April kommt es in Spanien und Portugal zu massiven Stromausfällen. Über die Ursache für den stundenlangen Blackout auf der iberischen Halbinsel wird viel spekuliert. Die spanische Regierung spri… [+1786 chars],,de,'Blackout'
https://www.n-tv.de/mediathek/videos/ratgeber/Notfalltipps-fuer-den-Mega-Blackout-article25839036.html,https://www.n-tv.de/mediathek/videos/ratgeber/Notfalltipps-fuer-den-Mega-Blackout-article25839036.html,0,www.n-tv.de,Gute Vorbereitung ist alles: Notfalltipps für den Mega-Blackout,"Flächendeckende Stromausfälle, Waldbrände, Stürme und Hochwasser zeigen: Jeder sollte auf den Notfall vorbereitet sein. 
Aber nur ein Drittel der Deutschen hat dafür vorgesorgt. Dabei ist das weder teuer noch schwer. ntv verrät die wichtigsten Tipps.",https://www.n-tv.de/img/incoming/crop25839207/5311323370-cImg_16_9-w1200/blackout.jpg,2025-06-17T18:34:29Z,,,,de,'Blackout'
https://orf.at/stories/3397042/,https://orf.at/stories/3397042/,0,orf.at,Überspannung führte zu Spaniens Blackout,"Gut sieben Wochen nach dem außergewöhnlichen Stromausfall in Spanien und Portugal ist ein Untersuchungsbericht zu den Ursachen vorgelegt worden. Grund für den stundenlangen Blackout am 28. April sei zu hohe Spannung im Netz gewesen, so Spaniens Regierung. Das…",https://ibs.orf.at/news?image=https%3A%2F%2Fassets.orf.at%2Fmims%2F2025%2F25%2F56%2Fcrops%2Fw%3D1200%2Ch%3D630%2Cq%3D75%2F2665496_master_1024856_spanien_stromausfall_ursache_im.jpg%3Fs%3D6ded0bf7b9dd4ef62b246e774d499d3c25b39f07,2025-06-17T19:37:05Z,,"Die zu hohe Spannung im spanischen Stromnetz sei durch mehrere Faktoren ausgelöst worden, sagte Spaniens Vizeregierungschefin und Umweltministerin Sara Aagesen in Madrid. Zum einen habe der Netzbetre… [+4071 chars]",,de,'Blackout'
