index,url,valid,domain,title,description,image,published,archive,content,quote,language,keyword
https://www.sueddeutsche.de/wirtschaft/inflation-urlaub-ja-aber-bitte-guenstig-1.5745275,https://www.sueddeutsche.de/wirtschaft/inflation-urlaub-ja-aber-bitte-guenstig-1.5745275,0,www.sueddeutsche.de,"Inflation: Urlaub ja, aber bitte günstig","Statt in finanziell schwierigen Zeiten auf einen Urlaub ganz zu verzichten, setzen die Deutschen laut einer Studie lieber auf abgespeckte Ferien. So wollen sich...",https://www.sueddeutsche.de/assets/png/sz-ecb090256670a577bd629a9718686332.png,2023-02-05T17:54:26Z,https://web.archive.org/web/20230205223432/https://www.sueddeutsche.de/wirtschaft/inflation-urlaub-ja-aber-bitte-guenstig-1.5745275,"Statt in finanziell schwierigen Zeiten auf einen Urlaub ganz zu verzichten, setzen die Deutschen laut einer Studie lieber auf abgespeckte Ferien. So wollen sich 73 Prozent der Befragten bei Souvenirs… [+711 chars]",,de,'Inflation'
https://www.jungewelt.de/artikel/444248.wirtschaftskrieg-eu-im-sanktionswahn.html,https://www.jungewelt.de/artikel/444248.wirtschaftskrieg-eu-im-sanktionswahn.html,0,www.jungewelt.de,Wirtschaftskrieg: EU im Sanktionswahn,Neues Ölembargo gegen Russland tritt in Kraft. Importverbot für Treibstoff dürfte Inflation weiter anheizen • Foto: A. Friedrichs/imago,https://www.jungewelt.de/img/1100/177113.jpg,2023-02-05T18:40:02Z,https://web.archive.org/web/20230205215227/https://www.jungewelt.de/artikel/444248.wirtschaftskrieg-eu-im-sanktionswahn.html,"Nun gibt es noch ein zweischneidiges Embargo mehr: Am Sonntag trat ein Verbot in Kraft, Erdölprodukte aus Russland in die EU-Länder einzuführen. Das gilt unter anderem für Benzin, Diesel, Flugzeugtre… [+3042 chars]",,de,'Ölembargo'
https://www.basicthinking.de/blog/2023/02/06/5-tipps-um-im-februar-2023-geld-zu-sparen/,https://www.basicthinking.de/blog/2023/02/06/5-tipps-um-im-februar-2023-geld-zu-sparen/,0,www.basicthinking.de,"5 Tipps, um im Februar 2023 Geld zu sparen","Auch im neuen Jahr schwanken die Energiepreise. Die Inflation sorgt bei vielen Produkten derweil nach wie vor für ungewohnt hohe Preise. Das Thema Sparen spielt deshalb eine immer größere Rolle. Wir haben fünf Tipps parat, um im Februar 2023 Geld zu sparen.  …",https://www.basicthinking.de/blog/wp-content/uploads/2023/01/geld-sparen-februar-2023.jpg,2023-02-06T05:03:10Z,https://web.archive.org/web/20230206050641/https://www.basicthinking.de/blog/2023/02/06/5-tipps-um-im-februar-2023-geld-zu-sparen/,Auch im neuen Jahr schwanken die Energiepreise. Die Inflation sorgt bei vielen Produkten derweil nach wie vor für ungewohnt hohe Preise. Das Thema Sparen spielt deshalb eine immer größere Rolle. Wir … [+3725 chars],,de,'Energie sparen'
https://www.focus.de/finanzen/news/heizkosten-heizoel-pellets-oder-brennholz-ueberblick-ueber-die-aktuellen-preise_id_184829527.html,https://www.focus.de/finanzen/news/heizkosten-heizoel-pellets-oder-brennholz-ueberblick-ueber-die-aktuellen-preise_id_184829527.html,0,www.focus.de,"Heizkosten - Soll ich jetzt schon Heizöl, Pellets oder Brennholz kaufen?","Der Winter ist noch nicht vorbei und die Temperaturen bleiben weiterhin niedrig. Viele Haushalte überlegen jetzt, wann sie Heizöl oder Brennholz bestellen sollen. Entweder um für den Rest des Winters gerüstet zu sein oder um für den nächsten Winter vorzusorge…",https://p6.focus.de/img/fotos/id_98030979/heizoel-72682473.jpg?im=Crop%3D%280%2C204%2C3489%2C1746%29%3BResize%3D%281200%2C627%29&impolicy=perceptual&quality=medium&hash=accd477c4a9af5b9ee56194b8a9cb57b2331cbc512496c4c2744edaf3d5c6fd1,2023-02-06T07:51:17Z,https://web.archive.org/web/20230206161859/https://www.focus.de/finanzen/news/heizkosten-heizoel-pellets-oder-brennholz-ueberblick-ueber-die-aktuellen-preise_id_184829527.html,"Der Winter ist noch nicht vorbei und die Temperaturen bleiben weiterhin niedrig. Viele Haushalte überlegen jetzt, wann sie Heizöl oder Brennholz bestellen sollen. Entweder um für den Rest des Winters… [+5873 chars]",,de,'Heizöl'
https://www.faz.net/aktuell/rhein-main/wirtschaft/warum-sich-ein-wechsel-des-gas-und-stromanbieters-wieder-lohnen-kann-18656328.html,https://www.faz.net/aktuell/rhein-main/wirtschaft/warum-sich-ein-wechsel-des-gas-und-stromanbieters-wieder-lohnen-kann-18656328.html,0,www.faz.net,Energiepreise: Energieanbieterwechsel kann sich wieder lohnen,"Strom- und Gastarife sind wieder günstiger zu haben. Das öffnet Verbrauchern neue Optionen. Energieexperten empfehlen, Tarife zu vergleichen – trotz gesetzlicher Preisbremse.",https://media0.faz.net/ppmedia/aktuell/1549155757/1.8656326/facebook_teaser_fplus/verwirrungspotential-die.jpg,2023-02-06T07:58:00Z,https://web.archive.org/web/20230206113702/https://www.faz.net/aktuell/rhein-main/wirtschaft/warum-sich-ein-wechsel-des-gas-und-stromanbieters-wieder-lohnen-kann-18656328.html,"Dem milden Winter sei Dank. Die Preise für Strom und Gas, die im vergangenen Jahr durch den Krieg in der Ukraine immens gestiegen waren, haben an den Börsen deutlich nachgegeben. Ein wesentlicher Gru… [+679 chars]",,de,'Preisbremse'
https://www.n-tv.de/wirtschaft/Putin-leert-die-Kassen-seiner-Unternehmen-article23891326.html,https://www.n-tv.de/wirtschaft/Putin-leert-die-Kassen-seiner-Unternehmen-article23891326.html,0,www.n-tv.de,"Projekt ""Umsatzmobilisierung"": Putin leert die Kassen seiner Unternehmen","Für das vergangene Jahr meldet Russland das zweitgrößte Haushaltsdefizit seiner Geschichte. Hätte sich der Kreml nicht die Milliardengewinne von Gazprom unter den Nagel gerissen, wäre es sogar das größte gewesen - eine neue Realität auch für andere Staatskonz…",https://bilder1.n-tv.de/img/incoming/crop23891312/7471325600-cImg_16_9-w1200/393775268.jpg,2023-02-06T08:59:07Z,https://web.archive.org/web/20230206091204/https://www.n-tv.de/wirtschaft/Putin-leert-die-Kassen-seiner-Unternehmen-article23891326.html,"Für das vergangene Jahr meldet Russland das zweitgrößte Haushaltsdefizit seiner Geschichte. Hätte sich der Kreml nicht die Milliardengewinne von Gazprom unter den Nagel gerissen, wäre es sogar das gr… [+6385 chars]",,de,'Gazprom'
https://www.dw.com/de/spanien-trotzt-inflation-mit-wirtschaftsboom-und-wohltaten/a-64619676,https://www.dw.com/de/spanien-trotzt-inflation-mit-wirtschaftsboom-und-wohltaten/a-64619676,0,www.dw.com,Spanien trotzt Inflation mit Wirtschaftsboom und Wohltaten,"Jüngste Zahlen des Statistikamts in Madrid zeigen: Satte 5,5 Prozent legte die spanische Wirtschaft im vergangenen Jahr zu. Damit steht das südeuropäische Land besser da als die meisten nordeuropäischen Staaten. Die Touristen sind nach der Pandemie - und trot…",https://static.dw.com/image/62007798_6.jpg,2023-02-06T10:36:00Z,https://web.archive.org/web/20230206122135/https://www.dw.com/de/spanien-trotzt-inflation-mit-wirtschaftsboom-und-wohltaten/a-64619676,"Die Touristen sind nach der Pandemie - und trotz Ukrainekrieg und Energiekrise - in Massen zurückgekommen: Mallorca, die meistbesuchte europäische Ferieninsel, war in der vergangenen Hochsaison so gu… [+4823 chars]",,de,'Inflation'
https://www.morgenpost.de/wirtschaft/article237563257/heizoelpreise-aktuell-heute-6-februar.html,https://www.morgenpost.de/wirtschaft/article237563257/heizoelpreise-aktuell-heute-6-februar.html,0,www.morgenpost.de,Energiekosten: Die aktuellen Heizölpreise vom 6. Februar 2023,Die Heizölpreise in Deutschland sind im Vergleich zur Vorwoche gesunken. ○ Wie viel kostet ein Liter Heizöl aktuell am 06.02.? ○ Hier erfahren Sie mehr.,https://img.morgenpost.de/img/wirtschaft/crop236475113/7522603382-w820-cv16_9-q85/Heizoel-OEl-.jpg,2023-02-06T11:03:59Z,https://web.archive.org/web/20230206115243/https://www.morgenpost.de/wirtschaft/article237563257/heizoelpreise-aktuell-heute-6-februar.html,Berlin. Durch den Krieg in der Ukraine und den damit einhergehenden Konsequenzen für den europäischen Energiemarkt sahen sich Verbraucher in den vergangenen Monaten mit zum Teil drastisch gestiegenen… [+7866 chars],,de,'Energiekosten'
https://www.handelsblatt.com/unternehmen/waermepumpe-kosten-lohnen-sich-alternativen-zu-gasheizungen/28822824.html,https://www.handelsblatt.com/unternehmen/waermepumpe-kosten-lohnen-sich-alternativen-zu-gasheizungen/28822824.html,0,www.handelsblatt.com,Das Beste aus 2022: Lohnen sich Alternativen zu Gasheizungen?,"Hohe Energiepreise drängen zum Umrüsten der Gasheizung. Was kosten die Alternativen Wärmepumpe, Fernwärme und Pelletheizung langfristig im Vergleich? Eine Übersicht.",https://www.handelsblatt.com/images/heizkosten/28886330/2-format2003.png,2023-02-06T13:48:37Z,https://web.archive.org/web/20230206160717/https://www.handelsblatt.com/unternehmen/waermepumpe-kosten-lohnen-sich-alternativen-zu-gasheizungen/28822824.html,"HeizkostenBeim Erneuern oder Umrüsten einer Gasheizung auf Wärmepumpe, Fernwärme oder Pelletheizung summieren sich die Kosten.
(Foto: Getty Images) 
Düsseldorf Obwohl die Füllstände der Gasspeicher… [+1219 chars]",,de,'Energiepreise'
https://www.morgenpost.de/wirtschaft/article237566249/pelletspreise-6-februar-2023-pellets.html,https://www.morgenpost.de/wirtschaft/article237566249/pelletspreise-6-februar-2023-pellets.html,0,www.morgenpost.de,Energiekosten: Aktuelle Pelletspreise: Peise für eine Tonne Pellets am 6.2.,Die Pelletspreise in Deutschland fallen weiter.  ○ Wie viel kostet eine Tonne Pellets am 6. Februar? ○ Die aktuellen Preise finden Sie hier.,https://img.morgenpost.de/img/wirtschaft/crop207134877/4242607969-w820-cv16_9-q85/imago61890978h-582d96b6-dd13-4dae-b03d-57077cbc061d.jpg,2023-02-06T14:00:30Z,https://web.archive.org/web/20230206142318/https://www.morgenpost.de/wirtschaft/article237566249/pelletspreise-6-februar-2023-pellets.html,"Berlin. Nicht nur die Preise für fossile Energien sind im Zuge der Energiekrise in den vergangenen Monaten erheblich gestiegen. Da viele Verbraucher auf alternative Heizungsformen umsteigen wollten, … [+4902 chars]",,de,'Heizöl'
https://www.handelsblatt.com/finanzen/immobilien/immobilienmarkt-wie-die-energiekrise-immobilienpreise-auseinanderdriften-laesst/28932606.html,https://www.handelsblatt.com/finanzen/immobilien/immobilienmarkt-wie-die-energiekrise-immobilienpreise-auseinanderdriften-laesst/28932606.html,0,www.handelsblatt.com,Immobilien: 49 Prozent Preisabschläge: Diese Immobilien sind die größten Verlierer der Energiekrise,Experten sehen eine Spaltung am Markt für Häuser und Wohnungen: Die Preise driften immer weiter auseinander. Vor allem eine Gruppe muss sich auf deutliche Abschläge einstellen.,https://www.handelsblatt.com/images/waermedaemmung/28932622/5-format2003.jpg,2023-02-06T14:01:51Z,https://web.archive.org/web/20230206155712/https://www.handelsblatt.com/finanzen/immobilien/immobilienmarkt-wie-die-energiekrise-immobilienpreise-auseinanderdriften-laesst/28932606.html,"WärmedämmungEin Arbeiter befestigt eine Styroporplatte zur Wärmedämmung an einer Hausfassade in Niederbayern. Doch viele Häuser in Deutschland sind bisher schlecht energetisch saniert.
(Foto: dpa)
… [+1267 chars]",,de,'Energiepreise'
https://www.morgenpost.de/wirtschaft/article237567473/strompreis-aktuell-heute-6-februar-verbraucherpreise-energie.html,https://www.morgenpost.de/wirtschaft/article237567473/strompreis-aktuell-heute-6-februar-verbraucherpreise-energie.html,0,www.morgenpost.de,Energiekosten: Strompreis von heute (6.2.): Aktueller Preis pro kWh Strom,"Der Strompreis sinkt. ○ Doch nicht alle Verbraucher profitieren. ○ Wie viel eine kWh Strom heute am 6. Februar kostet, lesen Sie hier.",https://img.morgenpost.de/img/steuern/crop235756847/0292602023-w820-cv16_9-q85/Stromzaehler.jpg,2023-02-06T15:08:31Z,https://web.archive.org/web/20230206155539/https://www.morgenpost.de/wirtschaft/article237567473/strompreis-aktuell-heute-6-februar-verbraucherpreise-energie.html,Berlin. Durch den Ukraine-Krieg sind viele Energiepreise drastisch angestiegen. Auch beim Strom war das so. Zuletzt hatte sich trotz Energiekrise wieder eine Erholung abgezeichnet. Allerdings liegt d… [+7182 chars],,de,'Energiepreise'
https://www.tagesschau.de/wirtschaft/lng-bundesregierung-101.html,https://www.tagesschau.de/wirtschaft/lng-bundesregierung-101.html,0,www.tagesschau.de,Wie ist der Stand der LNG-Terminals in Deutschland?,Die LNG-Pläne der Bundesregierung nehmen weiter Fahrt auf. In Brunsbüttel sind am Montag die letzten Rohre für den Anschluss des LNG-Importterminals angekommen. Wie ist der Stand in Deutschland insgesamt?,https://www.tagesschau.de/multimedia/bilder/lng-brunsbuettel-103~_v-original.jpg,2023-02-06T15:14:38Z,https://web.archive.org/web/20230206162258/https://www.tagesschau.de/wirtschaft/lng-bundesregierung-101.html,Die LNG-Pläne der Bundesregierung nehmen weiter Fahrt auf. In Brunsbüttel sind am Montag die letzten Rohre für den Anschluss des LNG-Importterminals angekommen. Wie ist der Stand in Deutschland insge… [+3419 chars],,de,'Gasnetz'
https://www.faz.net/aktuell/finanzen/werden-jetzt-heizoel-und-diesel-teurer-18657880.html,https://www.faz.net/aktuell/finanzen/werden-jetzt-heizoel-und-diesel-teurer-18657880.html,0,www.faz.net,Werden jetzt Heizöl und Diesel teurer?,Seit Sonntag gilt ein neues Embargo für russische Ölprodukte. Die ersten Preisreaktionen sind eher verhalten. Über dem Durchschnitt liegen jetzt die Spritpreise in Ostdeutschland.,https://media1.faz.net/ppmedia/aktuell/finanzen/3339660407/1.8658341/facebook_teaser_fplus/oel.jpg,2023-02-06T17:24:41Z,https://web.archive.org/web/20230206173903/https://www.faz.net/aktuell/finanzen/werden-jetzt-heizoel-und-diesel-teurer-18657880.html,Seit Sonntag ist die dritte Stufe des EU-Embargos gegen russisches Öl in Kraft getreten. Jetzt sollen auch keine Ölprodukte wie Diesel oder Heizöl aus Russland mehr in die Europäische Union eingeführ… [+1366 chars],,de,'Heizöl'
https://www.welt.de/wirtschaft/article243630093/Staatliche-Zuschuesse-Der-Maerz-wird-zum-grossen-Auszahlmonat-fuer-Energiehilfen.html,https://www.welt.de/wirtschaft/article243630093/Staatliche-Zuschuesse-Der-Maerz-wird-zum-grossen-Auszahlmonat-fuer-Energiehilfen.html,0,www.welt.de,"Strom, Gas, Studenten-Pauschale – Wann Sie mit welcher Hilfe rechnen können","Längst nicht alle versprochenen Zuschüsse sind bereits angekommen. Nicht nur Studenten warten weiter auf ihre 200 Euro. Auch Gas-, Strom- und viele Heizölkunden müssen sich noch etwas auf die Unterstützung gedulden. Doch der große Auszahlungsmonat ist bereits…",https://img.welt.de/img/wirtschaft/mobile243633435/5561351147-ci16x9-w1200/GettyImages-1369185818.jpg,2023-02-06T17:53:45Z,https://web.archive.org/web/20230206175809/https://www.welt.de/wirtschaft/article243630093/Staatliche-Zuschuesse-Der-Maerz-wird-zum-grossen-Auszahlmonat-fuer-Energiehilfen.html,"Den unrühmlichen Rekord für die Energiepreishilfe mit der längsten Wartezeit hat Bildungsministerin Bettina Stark-Watzinger sicher. Fünf Monate sind mittlerweile vergangen, seit allen Studenten und F… [+6966 chars]",,de,'Heizöl'
https://www.handelsblatt.com/politik/deutschland/energiepreise-ampel-haushaelter-wollen-nun-doch-hilfen-fuer-unternehmen-mit-oel-oder-pelletheizung/28966928.html,https://www.handelsblatt.com/politik/deutschland/energiepreise-ampel-haushaelter-wollen-nun-doch-hilfen-fuer-unternehmen-mit-oel-oder-pelletheizung/28966928.html,0,www.handelsblatt.com,Energiepreise: Ampel-Haushälter wollen nun doch Hilfen für Unternehmen mit Öl- oder Pelletheizung,Entgegen ihres ursprünglichen Beschlusses wollen die Ampel-Haushälter nun doch Hilfen für Unternehmen mit Öl- oder Pelletheizung zulassen. Offenbar war der Ärger zu groß.,https://www.handelsblatt.com/images/heizung/28966932/2-format2003.jpg,2023-02-06T21:00:00Z,https://web.archive.org/web/20230206213704/https://www.handelsblatt.com/politik/deutschland/energiepreise-ampel-haushaelter-wollen-nun-doch-hilfen-fuer-unternehmen-mit-oel-oder-pelletheizung/28966928.html,Berlin Anders als ursprünglich geplant sollen die Härtefall-Hilfen für Unternehmen nun doch auch für Unternehmen mit Öl oder Pelletheizung gelten. Das geht aus einem Beschlussentwurf für die Sitzung … [+3032 chars],,de,'Heizöl'
https://www.telepolis.de/features/Energiewelt-steht-am-Beginn-einer-neuen-industriellen-Aera-7486331.html,https://www.telepolis.de/features/Energiewelt-steht-am-Beginn-einer-neuen-industriellen-Aera-7486331.html,0,www.telepolis.de,Energiewelt steht am Beginn einer neuen industriellen Ära,"Hunderte Milliarden Dollar durch Erneuerbare, viele Millionen neuer Jobs. Die Internationale Energieagentur spricht vom Konjunktur-Booster durch die Energiewende. Warum Deutschland lahmt und China vorangeht.",https://heise.cloudimg.io/bound/1200x1200/q85.png-lossy-85.webp-lossy-85.foil1/_www-heise-de_/imgs/18/3/6/9/3/9/6/9/Arbeiter_Solarpanels-d60df6bfdb6451dd.jpeg,2023-02-06T23:00:00Z,https://web.archive.org/web/20230206234202/https://www.telepolis.de/features/Energiewelt-steht-am-Beginn-einer-neuen-industriellen-Aera-7486331.html,"Solarpanels werden auf einem Dach eines Forschungszentrums installiert. Bild: Public Domain
Hunderte Milliarden Dollar durch Erneuerbare, viele Millionen neuer Jobs. Die Internationale Energieagentu… [+4043 chars]",,de,'Energiewirtschaft'
https://www.focus.de/finanzen/news/gastbeitrag-von-gabor-steingart-us-sanktionen-gefaehrden-nicht-russland-oder-china-sondern-deutsche-firmen_id_185155134.html,https://www.focus.de/finanzen/news/gastbeitrag-von-gabor-steingart-us-sanktionen-gefaehrden-nicht-russland-oder-china-sondern-deutsche-firmen_id_185155134.html,0,www.focus.de,Gastbeitrag von Gabor Steingart - In Wahrheit gefährden US-Sanktionen nicht Putin oder Xi - sondern deutsche Firmen,In Washington hat jemand die „Replay“-Taste gedrückt. Wir hören das düstere Echo der Geschichte. Denn die gedankliche Grundlage der heutigen Sanktionspolitik – die den Rivalen mit Strafzöllen belegt und mit Handelsverboten bestraft – stammt von Woodrow Wilson…,https://p6.focus.de/img/fotos/id_185155442/steingart.jpg?im=Crop%3D%280%2C52%2C424%2C212%29%3BResize%3D%281200%2C627%29&impolicy=perceptual&quality=medium&hash=34754f4fbcbc46a7ac8c49f0c3d4b2a7a9762d55d174a76a7bc3b28543b68331,2023-02-07T07:29:09Z,https://web.archive.org/web/20230207081857/https://www.focus.de/finanzen/news/gastbeitrag-von-gabor-steingart-us-sanktionen-gefaehrden-nicht-russland-oder-china-sondern-deutsche-firmen_id_185155134.html,In Washington hat jemand die Replay-Taste gedrückt. Wir hören das düstere Echo der Geschichte. Denn die gedankliche Grundlage der heutigen Sanktionspolitik die den Rivalen mit Strafzöllen belegt und … [+5974 chars],,de,'Gas Wirtschaft'
https://www.tagesschau.de/wirtschaft/russland-gold-devisen-verkauf-defizit-101.html,https://www.tagesschau.de/wirtschaft/russland-gold-devisen-verkauf-defizit-101.html,0,www.tagesschau.de,"Russland verkauft Goldreserven, um Etat defizit auszugleichen","Um sein hohes Haushaltsdefizit auszugleichen, hat Russland einen Teil seiner Goldreserven verkauft. Auch Devisen wurden veräußert, denn Einnahmen aus dem Verkauf von Öl und Gas gehen weiter zurück.",https://www.tagesschau.de/multimedia/bilder/gold-russland-105~_v-original.jpg,2023-02-07T07:56:17Z,,"Um sein hohes Haushaltsdefizit auszugleichen, hat Russland einen Teil seiner Goldreserven verkauft. Auch Devisen wurden veräußert. Die Einnahmen aus dem Verkauf von Öl und Gas gehen gleichzeitig weit… [+2579 chars]",,de,'Russland Gas'
https://www.focus.de/finanzen/news/auch-fuer-pellets-und-fluessiggas-haben-sie-2022-heizoel-bestellt-dann-winken-ihnen-bis-zu-2000-euro-hilfe_id_184726229.html,https://www.focus.de/finanzen/news/auch-fuer-pellets-und-fluessiggas-haben-sie-2022-heizoel-bestellt-dann-winken-ihnen-bis-zu-2000-euro-hilfe_id_184726229.html,0,www.focus.de,Auch für Pellets und Flüssiggas - Haben Sie 2022 Heizöl bestellt? Dann winken Ihnen bis zu 2000 Euro Hilfe,"Gaspreisbremse, Strompreisbremse und Erstattung für Fernwärme. Doch was ist mit Haushalten, die mit Heizöl heizen? Im Kleingedruckten hat die Bundesregierung eine Entlastung geplant. Doch nur wenige können davon profitieren. FOCUS online sagt, was genau gilt.",https://p6.focus.de/img/fotos/id_160188255/heizoel-lieferung-51920714.jpg?im=Crop%3D%280%2C248%2C3533%2C1766%29%3BResize%3D%281200%2C627%29&impolicy=perceptual&quality=medium&hash=c362821a40fc41e398678fce90cf69cd5cdcdc1aa2c5b6225e37d66030ecb725,2023-02-07T07:59:16Z,https://web.archive.org/web/20230207081858/https://www.focus.de/finanzen/news/auch-fuer-pellets-und-fluessiggas-haben-sie-2022-heizoel-bestellt-dann-winken-ihnen-bis-zu-2000-euro-hilfe_id_184726229.html,"Gaspreisbremse, Strompreisbremse und Erstattung für Fernwärme. Doch was ist mit Haushalten, die mit Heizöl heizen? Im Kleingedruckten hat die Bundesregierung eine Entlastung geplant. Doch nur wenige … [+3781 chars]",,de,'Strompreisbremse'
https://www.morgenpost.de/wirtschaft/article237572049/heizoelpreise-aktuell-heute-7-februar-heizoel-anbieter-verbraucher.html,https://www.morgenpost.de/wirtschaft/article237572049/heizoelpreise-aktuell-heute-7-februar-heizoel-anbieter-verbraucher.html,0,www.morgenpost.de,Energiekosten: Heizölpreise am 7. Februar: Der Preis pro Liter Heizöl heute,Die Heizölpreise in Deutschland sind im Vergleich zum Vormonat gesunken. ○ Wie viel kostet ein Liter Heizöl heute am 07.02.? ○ Hier erfahren Sie mehr.,https://img.morgenpost.de/img/wirtschaft/crop237390067/4102602930-w820-cv16_9-q85/Heizoel-bestellen-Mann-fuellt-Heizoel-in-einen-Heizoeltank.jpg,2023-02-07T09:20:21Z,https://web.archive.org/web/20230207093623/https://www.morgenpost.de/wirtschaft/article237572049/heizoelpreise-aktuell-heute-7-februar-heizoel-anbieter-verbraucher.html,Berlin. Die vom Krieg in der Ukraine ausgelöste Energie- und Preiskrise in Deutschland hat sich 2022 primär im Energiesektor bemerkbar gemacht. Die Kosten für Gas und Heizöl sind innerhalb weniger Wo… [+8500 chars],,de,'Energiekosten'
https://www.morgenpost.de/wirtschaft/article237572347/pelletspreise-7-februar-pellets-energiekrise-verbraucher-deutschland.html,https://www.morgenpost.de/wirtschaft/article237572347/pelletspreise-7-februar-pellets-energiekrise-verbraucher-deutschland.html,0,www.morgenpost.de,Energiekosten: Pelletspreise am 7. Februar: Der Preis für eine Tonne heute,Die Pelletspreise in Deutschland sind im Vergleich zum Vorjahr gesunken. ○ Wie viel kostet eine Tonne Pellets am 6. Februar? ○ Hier erfahren Sie mehr.,https://img.morgenpost.de/img/wirtschaft/crop237339455/7032607423-w820-cv16_9-q85/Brennstoff-mit-Zukunft-Lieferung-von-Holzpellets-per-Lkw.jpg,2023-02-07T09:55:43Z,https://web.archive.org/web/20230207114950/https://www.morgenpost.de/wirtschaft/article237572347/pelletspreise-7-februar-pellets-energiekrise-verbraucher-deutschland.html,Berlin. In der Energiekrise sind nicht nur die Gas- und Heizölpreise massiv angestiegen. Auch für alternative Brennstoffe wie Pellets mussten die Verbraucher in der Energie- und Preiskrise deutlich t… [+5006 chars],,de,'Heizöl'
https://www.morgenpost.de/wirtschaft/article237572837/strompreis-aktuell-heute-7-februar-stromkunden-energiekrise-grundversorger.html,https://www.morgenpost.de/wirtschaft/article237572837/strompreis-aktuell-heute-7-februar-stromkunden-energiekrise-grundversorger.html,0,www.morgenpost.de,Energiekosten: Strompreis am 07.02.: Der aktuelle Preis pro kWh Strom heute,Der Strompreis sinkt – doch nicht alle Verbraucher profitieren davon. ○ Wie viel kostet eine kWh Strom heute am 7. Februar? ○ Hier erfahren Sie mehr.,https://img.morgenpost.de/img/wirtschaft/crop237320967/0682608847-w820-cv16_9-q85/Strompreise-in-der-Energiekrise-Die-Verbraucher-zahlen-mehr.jpg,2023-02-07T10:25:28Z,https://web.archive.org/web/20230207103502/https://www.morgenpost.de/wirtschaft/article237572837/strompreis-aktuell-heute-7-februar-stromkunden-energiekrise-grundversorger.html,Berlin. Der Krieg in der Ukraine und der damit einhergehende Gaskonflikt mit Russland hat die Energiepreise in Deutschland 2022 massiv verteuert. Heizöl oder auch Gas waren teurer denn je vergleichsw… [+8161 chars],,de,'Heizöl'
https://www.tagesspiegel.de/berlin/berliner-wirtschaft/entlastungen-fur-berliner-unternehmen-zuschuss-fur-energiekosten-konnen-ab-marz-beantragt-werden-9305660.html,https://www.tagesspiegel.de/berlin/berliner-wirtschaft/entlastungen-fur-berliner-unternehmen-zuschuss-fur-energiekosten-konnen-ab-marz-beantragt-werden-9305660.html,0,www.tagesspiegel.de,Entlastungen für Berliner Unternehmen: Zuschuss für Energiekosten können ab März beantragt werden,Energieintensive Unternehmen aus Berlin können bald eine einmalige Zahlung von bis 30.000 Euro erhalten. Doch es gibt Bedingungen.,https://www.tagesspiegel.de/images/stadt-land/alternates/BASE_16_9_W1400/stadt-land.jpeg,2023-02-07T14:22:36Z,https://web.archive.org/web/20230207143801/https://www.tagesspiegel.de/berlin/berliner-wirtschaft/entlastungen-fur-berliner-unternehmen-zuschuss-fur-energiekosten-konnen-ab-marz-beantragt-werden-9305660.html,"Der Berliner Senat hat sich auf einen Energiekostenzuschuss für energieintensive, kleinere und mittlere Unternehmen geeinigt. Betriebe, Soloselbständige, Freiberufler, aber auch gemeinnützige Unterne… [+1660 chars]",,de,'Energiekosten'
