index,url,valid,domain,title,description,image,published,archive,content,quote,language,keyword
https://stadt-bremerhaven.de/energiepreise-in-deutschland-sorge-ist-weiterhin-gross/,https://stadt-bremerhaven.de/energiepreise-in-deutschland-sorge-ist-weiterhin-gross/,0,stadt-bremerhaven.de,Energiepreise in Deutschland: Sorge ist weiterhin groß,"Die Energiepreise kennen im Grunde in Deutschland nur einen Weg: den nach oben. Ich selbst habe etwa erst diesen Monat wieder eine Strompreiserhöhung ins Haus flattern sehen. Und diese Preisentwicklung bereitet dann auch immer noch vielen Menschen Sorgen, wie…",https://stadt-bremerhaven.de/wp-content/uploads/2025/05/Solar-Deutschland.jpg,2025-06-01T09:00:47Z,https://web.archive.org/web/20250601165556/https://stadt-bremerhaven.de/energiepreise-in-deutschland-sorge-ist-weiterhin-gross/,Die Energiepreise kennen im Grunde in Deutschland nur einen Weg: den nach oben. Ich selbst habe etwa erst diesen Monat wieder eine Strompreiserhöhung ins Haus flattern sehen. Und diese Preisentwicklu… [+3086 chars],,de,'Energiepreise'
https://www.zeit.de/news/2025-06/03/schule-in-suedhessen-gewinnt-klimaschutz-preis,https://www.zeit.de/news/2025-06/03/schule-in-suedhessen-gewinnt-klimaschutz-preis,0,www.zeit.de,Energie sparen: Schule in Südhessen gewinnt Klimaschutz-Preis,Hier finden Sie Informationen zu dem Thema „Energie sparen“. Lesen Sie jetzt „Schule in Südhessen gewinnt Klimaschutz-Preis“.,https://img.zeit.de/news/2025-06/03/schule-in-suedhessen-gewinnt-klimaschutz-preis-image-group/wide__1300x731,2025-06-03T10:12:52Z,,Die Gerhart-Hauptmann-Schule in Griesheim (Kreis Darmstadt-Dieburg) hat den Energiesparmeister-Wettbewerb in Hessen gewonnen. Die Gesamtschule mit Oberstufe habe durch ihr Praxisprojekt gegen Energie… [+633 chars],,de,'Energie sparen'
https://www.stern.de/gesellschaft/regional/hessen/energie-sparen--schule-in-suedhessen-gewinnt-klimaschutz-preis-35777594.html,https://www.stern.de/gesellschaft/regional/hessen/energie-sparen--schule-in-suedhessen-gewinnt-klimaschutz-preis-35777594.html,0,www.stern.de,Energie sparen: Schule in Südhessen gewinnt Klimaschutz-Preis,Griesheim (lhe) - Die Gerhart-Hauptmann-Schule in Griesheim (Kreis Darmstadt-Dieburg) hat den Energiesparmeister-Wettbewerb in Hessen gewonnen. Die,https://image.stern.de/35777596/t/zA/v1/w1440/r1.7778/-/03--7b4yxky6p4v4axs2048jpeg---ed02846562f82eb4.jpg,2025-06-03T10:12:52Z,,"Kopiere den aktuellen Link
Zur Merkliste hinzufügen
Wie lässt sich Energie beim Heizen sparen? Eine Schule in Griesheim hat dafür eine überzeugende Idee.
Die Gerhart-Hauptmann-Schule in Griesheim … [+750 chars]",,de,'Klimaschutz Gasverbrauch'
https://www.zeit.de/news/2025-06/03/inflation-in-der-eurozone-sinkt-unter-ezb-ziel-von-2-prozent,https://www.zeit.de/news/2025-06/03/inflation-in-der-eurozone-sinkt-unter-ezb-ziel-von-2-prozent,0,www.zeit.de,Kurz vor Zinsentscheid: Inflation in der Eurozone sinkt unter EZB-Ziel von 2 Prozent,Hier finden Sie Informationen zu dem Thema „Kurz vor Zinsentscheid“. Lesen Sie jetzt „Inflation in der Eurozone sinkt unter EZB-Ziel von 2 Prozent“.,https://img.zeit.de/news/2025-06/03/inflation-in-der-eurozone-sinkt-unter-ezb-ziel-von-2-prozent-image-group/wide__1300x731,2025-06-03T11:22:35Z,,"Die Inflation in der Eurozone ist unter die Zielmarke der Europäischen Zentralbank (EZB) von 2,0 Prozent gesunken. Die Teuerungsrate im Währungsraum fiel im Mai auf 1,9 Prozent, teilte das Statistika… [+1747 chars]",,de,'Inflation'
