index,url,valid,domain,title,description,image,published,archive,content,quote,language,keyword
https://www.faz.net/aktuell/wirtschaft/mehr-wirtschaft/eu-will-neue-gasliefervertraege-mit-russland-verbieten-110459688.html,https://www.faz.net/aktuell/wirtschaft/mehr-wirtschaft/eu-will-neue-gasliefervertraege-mit-russland-verbieten-110459688.html,0,www.faz.net,EU will neue Gaslieferverträge mit Russland verbieten,Noch deckt die EU fast 20 Prozent ihres Gasbedarfs mit Importen aus Russland. Die EU-Kommission will das ändern. Kann das gelingen?,https://media0.faz.net/ppmedia/aktuell/1727680326/1.10357278/facebook_teaser/ein-russischer-gas-tanker-vor.jpg,2025-05-06T14:38:52Z,http://archive.md/20250506153537/https://www.faz.net/aktuell/wirtschaft/mehr-wirtschaft/eu-will-neue-gasliefervertraege-mit-russland-verbieten-110459688.html,Die Europäische Union will neue Gaslieferverträge mit Russland bis zum Jahresende verbieten und bestehende Verträge bis Ende 2027 auslaufen lassen. Bestehende Spotverträge sollen ebenfalls schon zum … [+3558 chars],,de,'Russland Gas'
https://www.welt.de/politik/article256075970/Klare-Kante-gegen-Moskau-EU-plant-Verbot-neuer-Gasvertraege-mit-Russland-Ausstieg-bis-2027.html,https://www.welt.de/politik/article256075970/Klare-Kante-gegen-Moskau-EU-plant-Verbot-neuer-Gasvertraege-mit-Russland-Ausstieg-bis-2027.html,0,www.welt.de,EU plant Verbot neuer Gasverträge mit Russland – Ausstieg bis 2027,Die Europäische Union plant ein Verbot neuer Gasverträge mit Russland und will bestehende Lieferbeziehungen schrittweise beenden. Ein entsprechender Vorschlag soll noch heute veröffentlicht werden.,https://img.welt.de/img/politik/mobile256075968/7197936937-ci16x9-w1200/Fluessiges-Erdgas.jpg,2025-05-06T15:07:39Z,http://archive.md/20250507125316/https://www.welt.de/politik/article256075970/Klare-Kante-gegen-Moskau-EU-plant-Verbot-neuer-Gasvertraege-mit-Russland-Ausstieg-bis-2027.html,Die Europäische Union plant ein Verbot neuer Gasverträge mit Russland und will bestehende Lieferbeziehungen schrittweise beenden. Ein entsprechender Vorschlag soll noch heute veröffentlicht werden.Br… [+1181 chars],,de,'Flüssiggas'
https://www.sueddeutsche.de/politik/eu-russland-energie-gas-unabhaengigkeit-strategie-li.3247845,https://www.sueddeutsche.de/politik/eu-russland-energie-gas-unabhaengigkeit-strategie-li.3247845,0,www.sueddeutsche.de,Energiepolitik: So will die EU endgültig Putins Gas loswerden,"Die Europäische Kommission legt einen Plan vor, um bis 2027 komplett ohne russische Energieimporte auszukommen. Das wird kompliziert – und es gibt keine Garantie, dass es auch funktioniert.",https://www.sueddeutsche.de/2025/05/06/cbad6b0e-11a6-4d8a-ae76-35655bfbecc3.jpeg?q=60&fm=webp&width=1200&rect=0%2C209%2C4000%2C2250,2025-05-06T16:11:30Z,https://web.archive.org/web/20250506165339/https://www.sueddeutsche.de/politik/eu-russland-energie-gas-unabhaengigkeit-strategie-li.3247845,"Kurz nach dem russischen Angriff brachte die EU nicht nur weitreichende Sanktionen gegen Russland auf den Weg sie formulierte auch die Absicht, bis 2027 vollständig ohne Energieimporte aus dem Land a… [+5554 chars]",,de,'Energiepolitik'
https://www.morgenpost.de/wirtschaft/article408935772/heizoelpreise-heute-aktuell-7-mai-2025-was-kostet-oel-heizung-heizen.html,https://www.morgenpost.de/wirtschaft/article408935772/heizoelpreise-heute-aktuell-7-mai-2025-was-kostet-oel-heizung-heizen.html,0,www.morgenpost.de,Heizölpreise am Mittwoch (7. Mai): Der kostet heute ein Liter,Die zweite Mai-Woche bringt milde Temperaturen mit sich. Doch wie wirken sie sich auf die Heizölpreise aus? Die aktuellen Preise am 7. Mai.,https://img.sparknews.funkemedien.de/406858453/406858453_1725952448_v16_9_1600.jpeg,2025-05-07T06:13:44Z,,"Berlin. Im Mai ist die Heizölperiode endgültig vorbei. Doch wie wirkt sich das auf die Heizölpreise aus? Der aktuelle Überblick vom 7. Mai.
Nach fast sommerlichen Tagen zieht zum Start der zweiten M… [+7777 chars]",,de,'Heizkosten'
https://orf.at/stories/3392741/,https://orf.at/stories/3392741/,0,orf.at,Ausbau von tschechischem AKW Dukovany verschoben,,https://orf.at/mojo/1_4_1/storyserver//news/common/images/og-fallback-news.png,2025-05-07T08:20:47Z,https://web.archive.org/web/20250508122257/https://orf.at/stories/3392741/,Die für heute geplante Unterzeichnung des Vertrags über den Ausbau des tschechischen Atomkraftwerkes in Dukovany durch die südkoreanische Firma KHNP wurde in letzter Minute auf unbestimmte Zeit versc… [+1125 chars],,de,'AKW'
https://www.golem.de/sonstiges/zustimmung/auswahl.html?from=https://www.golem.de/news/zertifizierung-fuer-energieeffizienz-energy-star-soll-abgeschafft-werden-2505-195981.html&referer=https://t.co/c2b3e570ce,https://www.golem.de/sonstiges/zustimmung/auswahl.html?from=https://www.golem.de/news/zertifizierung-fuer-energieeffizienz-energy-star-soll-abgeschafft-werden-2505-195981.html&referer=https://t.co/c2b3e570ce,0,www.golem.de,Zertifizierung für Energieeffizienz: Energy Star soll abgeschafft werden,"Der Energy Star hilft, jährlich 40 Milliarden US-Dollar an Energiekosten einzusparen. US-Unternehmen und -Handelsorganisationen fordern dessen Erhalt. (Umweltschutz, GreenIT)",,2025-05-07T10:15:01Z,,"Besuchen Sie Golem.de wie gewohnt mit Werbung und Tracking,
 indem Sie der Nutzung aller Cookies zustimmen.
 Details zum Tracking finden Sie im Privacy Center.
Skript wurde nicht geladen. Informat… [+607 chars]",,de,'Energiekosten'
https://www.welt.de/debatte/article256081174/Merz-und-Macron-Einen-diktierten-Frieden-werden-wir-niemals-akzeptieren.html,https://www.welt.de/debatte/article256081174/Merz-und-Macron-Einen-diktierten-Frieden-werden-wir-niemals-akzeptieren.html,0,www.welt.de,Einen diktierten Frieden werden wir niemals akzeptieren,Deutschland und Frankreich werden die Ukraine weiter bei ihrer Verteidigung unterstützen – schreiben Emmanuel Macron und Friedrich Merz im gemeinsamen WELT-Gastbeitrag. Auch bei der Migration setzen sie auf deutsch-französische Zusammenarbeit.,https://img.welt.de/img/debatte/mobile256081538/8657937387-ci16x9-w1200/Merz-Makes-First-Foreign-Trip-As-German-Chancellor.jpg,2025-05-07T12:36:19Z,http://archive.md/20250507135856/https://www.welt.de/debatte/article256081174/Merz-und-Macron-Einen-diktierten-Frieden-werden-wir-niemals-akzeptieren.html,Deutschland und Frankreich werden die Ukraine weiter bei ihrer Verteidigung unterstützen schreiben Emmanuel Macron und Friedrich Merz im gemeinsamen WELT-Gastbeitrag. Auch bei der Migration setzen si… [+9528 chars],,de,'Energiepolitik'
https://taz.de/Wie-Deutschland-den-russischen-Krieg-finanzierte/!6081569/,https://taz.de/Wie-Deutschland-den-russischen-Krieg-finanzierte/!6081569/,0,taz.de,Enthüllungsbuch „Nord Stream“: Wie Deutschland den russischen Krieg finanzierte,"Geheime Dokumente zeigen die korrupten Umstände, unter denen Nord Stream 1 und 2 gebaut wurden. Über 104 Milliarden Euro flossen seit 2014 für Gas nach Russland.",https://taz.de/picture/7683942/1200/5829804-1.jpeg,2025-05-07T12:53:00Z,https://web.archive.org/web/20250507211916/https://taz.de/Wie-Deutschland-den-russischen-Krieg-finanzierte/!6081569/,"Geheime Dokumente zeigen die korrupten Umstände, unter denen Nord Stream 1 und 2 gebaut wurden. Über 104 Milliarden Euro flossen seit 2014 für Gas nach Russland. mehr...",,de,'Krieg Gas'
https://www.morgenpost.de/ratgeber-wissen/article408744896/waermepumpe-studie-kosten-deutschland-grossbritannien.html,https://www.morgenpost.de/ratgeber-wissen/article408744896/waermepumpe-studie-kosten-deutschland-grossbritannien.html,0,www.morgenpost.de,Wärmepumpe: Neue Kosten-Studie kommt zu eindeutigem Ergebnis,"Im Vergleich zu Großbritannien sind Wärmepumpen in Deutschland fast doppelt so teuer. Das hat vor allem drei Gründe, meint ein Experte.",https://img.sparknews.funkemedien.de/408747899/408747899_1744138762_v16_9_1600.jpeg,2025-05-07T14:15:07Z,,"Im Vergleich zu Großbritannien sind Wärmepumpen in Deutschland fast doppelt so teuer. Das hat vor allem drei Gründe, meint ein Experte.
Das Thema Heizung beschäftigt viele Eigenheimbesitzer in Deuts… [+6905 chars]",,de,'Wärmepumpe'
https://www.sueddeutsche.de/politik/bundesregierung-liveblog-news-klingbeil-hubig-bas-li.3246802,https://www.sueddeutsche.de/politik/bundesregierung-liveblog-news-klingbeil-hubig-bas-li.3246802,0,www.sueddeutsche.de,"Neue Bundesregierung: Minister Klingbeil, Hubig und Bas benennen erste Projekte","Klingbeil will als Finanzminister die Energiepreise senken, Justizministerin Hubig die Mietpreisbremse verlängern und Arbeitsministerin Bas die Tarifbindung von Arbeitnehmern stärken.",https://www.sueddeutsche.de/2025/05/08/04217525-2962-420a-9b7c-13ab01f3a597.jpeg?q=60&fm=webp&width=1200&rect=0%2C107%2C2048%2C1152,2025-05-08T03:02:00Z,https://web.archive.org/web/20250508032743/https://www.sueddeutsche.de/politik/bundesregierung-liveblog-news-klingbeil-hubig-bas-li.3246802,"Bundesfinanzminister Lars Klingbeil (SPD) hat laut Bild eine zügige Senkung der Energiepreise angekündigt. ""Mit niedrigen Energiepreisen, massiven Investitionen und weniger Bürokratie wollen wir unse… [+785 chars]",,de,'Energiepreise'
https://www.jungewelt.de/artikel/499648.energiepolitik-demo-für-pck-raffinerie.html,https://www.jungewelt.de/artikel/499648.energiepolitik-demo-für-pck-raffinerie.html,0,www.jungewelt.de,Energiepolitik: Demo für PCK-Raffinerie [Online-Abo],Rund 2.000 Menschen demonstrierten am Mittwoch für die PCK-Raffinerie in Schwedt. Ministerpräsident Woidke forderte vom Bund Investitionen. Ferner wird über die Ausnahmegenehmigung für Schwefeldioxidausstoß debattiert.,https://www.jungewelt.de/img/1100/208549.jpg,2025-05-08T17:39:32Z,,"Uneingeschränkter Zugriff auf alle Inhalte: Erleben Sie die Tageszeitung junge Welt in gedruckter oder digitaler Form oder beides kombiniert.
Nachrichtenauswahl und -aufbereitung erfordern finanziel… [+458 chars]",,de,'Energiepolitik'
https://www.faz.net/aktuell/wirtschaft/blackout-in-spanien-frankreich-wird-mitverantwortlich-gemacht-110464386.html,https://www.faz.net/aktuell/wirtschaft/blackout-in-spanien-frankreich-wird-mitverantwortlich-gemacht-110464386.html,0,www.faz.net,Blockierter Netzausbau: Ist Frankreich mitverantwortlich für den Blackout?,Der schlechte Anschluss der Iberischen Halbinsel an Frankreich ist schon seit Jahren eine Achillesferse im europäischen Stromnetz. In Spanien gibt es Unmut über die Pariser Blockade beim Leitungsbau.,https://media1.faz.net/ppmedia/aktuell/gesellschaft/672021798/1.10464491/facebook_teaser/wegen-des-stromausfalls-in-der.jpg,2025-05-09T07:14:35Z,http://archive.md/20250509073440/https://www.faz.net/aktuell/wirtschaft/blackout-in-spanien-frankreich-wird-mitverantwortlich-gemacht-110464386.html,Ist Frankreich mitverantwortlich für den iberischen Blackout? Nach dem stundenlangen Stromausfall in Spanien und Portugal richten sich die Schuldzuweisungen auch an den Nachbarn auf der anderen Pyren… [+7003 chars],,de,'Blackout'
https://www.tagesspiegel.de/wirtschaft/gasgeschafte-mit-russland-konkurs-abgewendet-nord-stream-2-ag-kann-weitermachen-13664008.html,https://www.tagesspiegel.de/wirtschaft/gasgeschafte-mit-russland-konkurs-abgewendet-nord-stream-2-ag-kann-weitermachen-13664008.html,0,www.tagesspiegel.de,Gasgeschäfte mit Russland: Konkurs abgewendet: Nord Stream 2 AG kann weitermachen,Der hoch verschuldete russische Pipeline-Betreiber Nord Stream 2 kann weiter nach neuen Investoren suchen. Die drohende Insolvenz wurde erneut abgewendet. Es wird schon über Interessenten spekuliert.,https://www.tagesspiegel.de/images/13664149/alternates/BASE_16_9_W1400/1746784605000/nord-stream-2.jpeg,2025-05-09T09:39:42Z,,"Der hoch verschuldete russische Pipeline-Betreiber Nord Stream 2 AG kann vorerst weiter nach einem neuen Investor suchen: Das Gericht im Schweizer Kanton Zug hat den Nachlassvertrag genehmigt, der di… [+4211 chars]",,de,'Russland Gas'
https://www.stern.de/wirtschaft/news/gasgeschaefte-mit-russland--konkurs-abgewendet--nord-stream-2-ag-kann-weitermachen-35708820.html,https://www.stern.de/wirtschaft/news/gasgeschaefte-mit-russland--konkurs-abgewendet--nord-stream-2-ag-kann-weitermachen-35708820.html,0,www.stern.de,Gasgeschäfte mit Russland: Konkurs abgewendet: Nord Stream 2 AG kann weitermachen,Der hoch verschuldete russische Pipeline-Betreiber Nord Stream 2 kann weiter nach neuen Investoren suchen. Die drohende Insolvenz wurde erneut abgewendet. Es wird schon über Interessenten spekuliert.,https://image.stern.de/35709186/t/ZY/v1/w1440/r1.7778/-/09--plfsoivfufv4axs2048jpeg---f7842f6a8077c231.jpg,2025-05-09T10:45:11Z,,"Kopiere den aktuellen Link
Zur Merkliste hinzufügen
Der hoch verschuldete russische Pipeline-Betreiber Nord Stream 2 kann weiter nach neuen Investoren suchen. Die drohende Insolvenz wurde erneut ab… [+3711 chars]",,de,'Russland Gas'
https://www.faz.net/aktuell/wirtschaft/unternehmen/nord-stream-2-ag-kann-weiter-machen-konkurs-abgewendet-110466245.html,https://www.faz.net/aktuell/wirtschaft/unternehmen/nord-stream-2-ag-kann-weiter-machen-konkurs-abgewendet-110466245.html,0,www.faz.net,Die Nord Stream 2 AG kann weiter machen,"Der hoch verschuldete russische Pipeline-Betreiber Nord Stream 2 kann weiter nach neuen Investoren suchen, hat ein Gericht im schweizerischen Zug entschieden. Längst wird über Interessenten spekuliert – auch aus den USA.",https://media0.faz.net/ppmedia/aktuell/politik/politische-buecher/3397449694/1.10096346/facebook_teaser/statt-russischem-gas-die.jpg,2025-05-09T11:10:51Z,,"Der hoch verschuldete russische Pipeline-Betreiber Nord Stream 2 AG kann vorerst weiter nach einem neuen Investor suchen: Das Gericht im Schweizer Kanton Zug hat den Nachlassvertrag genehmigt, der di… [+3401 chars]",,de,'Gasmarkt'
https://www.stern.de/gesellschaft/regional/mecklenburg-vorpommern/windkraft-ausbau--mv-minister-blank--energiewende-wirtschaftlich-und-sozial-35711558.html,https://www.stern.de/gesellschaft/regional/mecklenburg-vorpommern/windkraft-ausbau--mv-minister-blank--energiewende-wirtschaftlich-und-sozial-35711558.html,0,www.stern.de,Windkraft-Ausbau: MV-Minister Blank: Energiewende wirtschaftlich und sozial,Im Norden drehen sich besonders viele Windräder. Doch der regionale Nutzen der Ökostrom-Produktion ist nach Ansicht von Mecklenburg-Vorpommerns Energieminister Blank noch zu gering.,https://image.stern.de/35711560/t/uz/v1/w1440/r1.7778/-/10--ievu2tyejtv32axs2048jpeg---a398aadd641542f7.jpg,2025-05-10T09:49:22Z,https://web.archive.org/web/20250510105008/https://www.stern.de/gesellschaft/regional/mecklenburg-vorpommern/windkraft-ausbau--mv-minister-blank--energiewende-wirtschaftlich-und-sozial-35711558.html,"Kopiere den aktuellen Link
Zur Merkliste hinzufügen
Im Norden drehen sich besonders viele Windräder. Doch der regionale Nutzen der Ökostrom-Produktion ist nach Ansicht von Mecklenburg-Vorpommerns E… [+4391 chars]",,de,'Energieminister'
https://www.autobild.de/artikel/smartes-heizkoerperthermostat-aqara-e1-srts-a01-amazon-angebot-deal-28079909.html,https://www.autobild.de/artikel/smartes-heizkoerperthermostat-aqara-e1-srts-a01-amazon-angebot-deal-28079909.html,0,www.autobild.de,Aqara-Heizkörperthermostat E1 mit Zigbee 3.0 zum smarten Preis,"Wenn Sie Ihre Heizkosten senken möchten, dann setzen Sie auf smarte Heizkörperthermostate. Bei Amazon ist aktuell der populäre Heizkörperregler Aqara E1 zum Sparpreis im Angebot.",https://i.auto-bild.de/ir_img/3/9/4/3/9/2/3/Amazon-Angebot--Beliebtes-Aqara-Heizkoerperthermostat-E1-mit-Zigbee-3-0-zum-2869-2048x1152-9c9c67ed7e62e6e0.jpg?impolicy=og_images,2025-05-10T15:00:00Z,,"Amazon Prime 30 Tage kostenlos testen
statt 8,99 EUR
0,00 EUR",,de,'Heizkosten'
