index,url,valid,domain,title,description,image,published,archive,content,quote,language,keyword
https://www.focus.de/politik/ausland/usa-starten-milliarden-offensive-auf-dem-balkan-mit-gas-deals-und-ki-mega-projekt_7a491b70-32d1-45cc-8fb9-d9cab5601b0e.html,https://www.focus.de/politik/ausland/usa-starten-milliarden-offensive-auf-dem-balkan-mit-gas-deals-und-ki-mega-projekt_7a491b70-32d1-45cc-8fb9-d9cab5601b0e.html,0,www.focus.de,USA starten Milliarden-Offensive auf dem Balkan – mit Gas-Deals und KI-Mega-Projekt,Die USA stecken Milliarden in Energie und KI im Balkan und nehmen Russland damit einen seiner wichtigsten Einflussräume in Europa.,"https://quadro.burda-forward.de/ctf/9840bf4b-499f-4860-97dd-b7196961ba49.c6c448c0-cfc1-4bb2-aba3-8235624c702b.jpg?im=RegionOfInterestCrop=(1200,630),regionOfInterest=(3828,703)&hash=b057bd96026628910f0729d391130e2c9cb870a5f6ed3181a811e163ed98f52f",2026-05-01T08:38:00Z,,Die USA bauen ihren Einfluss auf dem Balkan mit milliardenschweren Energie- und Technologieprojekten aus. Nach Informationen von Reuters schließen die Vereinigten Staaten und US-Firmen neue Gasverträ… [+2406 chars],,de,'Gasnetz'
https://www.golem.de/sonstiges/zustimmung/auswahl.html?from=https://www.golem.de/news/kostenbremse-fuer-mieter-an-der-waermepumpe-kommt-auch-die-cdu-nicht-vorbei-2605-208224.html&referer=https://t.co/ebfc59cca2,https://www.golem.de/sonstiges/zustimmung/auswahl.html?from=https://www.golem.de/news/kostenbremse-fuer-mieter-an-der-waermepumpe-kommt-auch-die-cdu-nicht-vorbei-2605-208224.html&referer=https://t.co/ebfc59cca2,0,www.golem.de,Kostenbremse für Mieter: An der Wärmepumpe kommt auch die CDU nicht vorbei,"Zukünftig sollen die steigenden Kosten für Öl- und Gasheizung zwischen Mietern und Vermietern geteilt werden. Das Risiko explodierender Heizkosten wird damit verteilt. (Wärmepumpe, Umweltschutz)",,2026-05-01T10:20:02Z,,"Besuchen Sie Golem.de wie gewohnt mit Werbung und Tracking,
 indem Sie der Nutzung aller Cookies zustimmen.
 Details zum Tracking finden Sie im Privacy Center.
Skript wurde nicht geladen. Informat… [+607 chars]",,de,'Gasheizung'
https://www.tagesschau.de/wirtschaft/unternehmen/schwedt-oel-raffinierie-100.html,https://www.tagesschau.de/wirtschaft/unternehmen/schwedt-oel-raffinierie-100.html,0,www.tagesschau.de,"""Druschba""-Pipeline: Was der Öl-Stopp für Deutschland bedeutet","Russland will von heute an kein Öl aus Kasachstan durch die Pipeline ""Druschba"" leiten. Die Raffinerie in Schwedt versorgt Berlin und den Nordosten Deutschlands mit Diesel, Benzin, Kerosin und Heizöl - und braucht nun Ersatz. Von Andre Kartschall.",https://images.tagesschau.de/image/8d2868e7-3c51-46be-ae47-9ed0089cb3ed/AAABnd2wkgc/AAABnSSvrFg/16x9-big/raffinerie-schwedt-110.jpg?width=1280,2026-05-01T10:26:16Z,,"Stand: 01.05.2026 12:26 Uhr
Russland will von heute an kein Öl aus Kasachstan durch die Pipeline ""Druschba"" leiten. Die Raffinerie in Schwedt versorgt Berlin und den Nordosten Deutschlands mit Diese… [+5537 chars]",,de,'Heizöl'
https://www.faz.net/aktuell/politik/inland/energiekrise-waere-atomkraft-die-loesung-accg-200786772.html,https://www.faz.net/aktuell/politik/inland/energiekrise-waere-atomkraft-die-loesung-accg-200786772.html,0,www.faz.net,Energiepolitik: Also doch wieder Atomkraft?,"Angesichts der Energiekrise will manch einer wieder über Kernenergie reden. Ob die gerade eine Hilfe wäre, ist umstritten – in der Forschung, wie auch in der Koalition.",https://media0.faz.net/image/w1200h627/ca1de24c08ea/w3000h1567x0y373o/201403/431.0.39244005/das-atomkraftwerk.webp,2026-05-01T12:29:31Z,,"In CDU und CSU hört man gerade wieder häufiger ein Wort, das in der deutschen Debatte über Jahre erledigt war: Kernenergie. Als EU-Kommissionspräsidentin Ursula von der Leyen in dieser Woche nach Ber… [+11739 chars]",,de,'Energiepolitik'
https://www.nzz.ch/wirtschaft/die-wirtschaftsweise-veronika-grimm-fordert-wir-muessen-unsere-versorgung-mit-fossilen-energietraegern-dringend-besser-absichern-ld.10004923,https://www.nzz.ch/wirtschaft/die-wirtschaftsweise-veronika-grimm-fordert-wir-muessen-unsere-versorgung-mit-fossilen-energietraegern-dringend-besser-absichern-ld.10004923,0,www.nzz.ch,Die Wirtschaftsweise Veronika Grimm fordert: «Wir müssen unsere Versorgung mit fossilen Energieträgern dringend besser absichern»,Die Ökonomin plädiert für eine marktwirtschaftliche Neujustierung der Energiepolitik und kritisiert den Mangel an ordnungspolitischer Orientierung im Sachverständigenrat für Wirtschaft.,"https://img-msp-prod.nzz.ch/2012/04/19/1.16526102.1334839698.jpg?width=700&height=394&fit=bounds&quality=75&auto=webp&crop=700,394,x0,y37",2026-05-02T02:30:00Z,,"Die Ökonomin plädiert für eine marktwirtschaftliche Neujustierung der Energiepolitik und kritisiert den Mangel an ordnungspolitischer Orientierung im Sachverständigenrat für Wirtschaft.
Zusammenfass… [+12900 chars]",,de,'LNG'
https://www.nzz.ch/international-nzz-aktuell/die-usa-im-iran-krieg-sinnkrise-einer-militaermacht-ld.10004989,https://www.nzz.ch/international-nzz-aktuell/die-usa-im-iran-krieg-sinnkrise-einer-militaermacht-ld.10004989,0,www.nzz.ch,Die USA im Iran-Krieg: Sinnkrise einer Militärmacht,"Auch nach Tausenden von Bomben ist das iranische Regime noch an der Macht und die Strasse von Hormuz für den Öl- und Gasexport blockiert. Die USA, so stellt sich heraus, sind nicht für einen asymmetrischen Krieg gerüstet. Die weltbeste Armee hat offenbar die …","https://img-msp-prod.nzz.ch/2026/05/02/1530d024-f073-497c-b0fc-4a0d2e3bd886.jpg?width=1200&height=675&fit=bounds&quality=75&auto=webp&crop=6000,3375,x0,y327&wmark=nzz",2026-05-03T03:30:00Z,,"Auch nach Tausenden von Bomben ist das iranische Regime noch an der Macht und die Strasse von Hormuz für den Öl- und Gasexport blockiert. Die USA, so stellt sich heraus, sind nicht für einen asymmetr… [+12867 chars]",,de,'Krieg Gas'
https://www.focus.de/politik/ausland/milliarden-offensive-der-usa-auf-dem-balkan-gas-deals-und-mega-ki-projekt-gegen-russlands-einfluss_7a491b70-32d1-45cc-8fb9-d9cab5601b0e.html,https://www.focus.de/politik/ausland/milliarden-offensive-der-usa-auf-dem-balkan-gas-deals-und-mega-ki-projekt-gegen-russlands-einfluss_7a491b70-32d1-45cc-8fb9-d9cab5601b0e.html,0,www.focus.de,Milliarden-Offensive der USA auf dem Balkan: Gas-Deals und Mega-KI-Projekt gegen Russlands Einfluss,Die USA stecken Milliarden in Energie und KI im Balkan und nehmen Russland damit einen seiner wichtigsten Einflussräume in Europa.,"https://quadro.burda-forward.de/ctf/9840bf4b-499f-4860-97dd-b7196961ba49.c6c448c0-cfc1-4bb2-aba3-8235624c702b.jpg?im=RegionOfInterestCrop=(1200,630),regionOfInterest=(3828,703)&hash=b057bd96026628910f0729d391130e2c9cb870a5f6ed3181a811e163ed98f52f",2026-05-03T07:34:00Z,,Die USA bauen ihren Einfluss auf dem Balkan mit milliardenschweren Energie- und Technologieprojekten aus. Nach Informationen von Reuters schließen die Vereinigten Staaten und US-Firmen neue Gasverträ… [+2406 chars],,de,'Russland Gas'
https://www.welt.de/politik/ausland/article69f70c09db1aeefad1dbc4df/ostseehafen-primorsk-ukraine-greift-mit-drohnen-russische-schattenflotte-und-knotenpunkt-fuer-oelexporte-an.html,https://www.welt.de/politik/ausland/article69f70c09db1aeefad1dbc4df/ostseehafen-primorsk-ukraine-greift-mit-drohnen-russische-schattenflotte-und-knotenpunkt-fuer-oelexporte-an.html,0,www.welt.de,Ukraine greift mit Drohnen russische Schattenflotte und Knotenpunkt für Ölexporte an,"Immer wieder gelingt es Russland, mithilfe seiner Schattenflotte Sanktionen zu umgehen. Die Ukraine hat deshalb gezielt die Infrastruktur eines Ostseehafens ins Visier genommen – auch die Schiffe, mit denen das Öl transportiert wird.",https://images.welt.de/69f70c09db1aeefad1dbc4df/1e80b0dcb7704c21566c87b39c59eea7-master/ci16x9-w1200/1774463148131-afp-a4pj3t3-jpg,2026-05-03T09:17:01Z,,"Immer wieder gelingt es Russland, mithilfe seiner Schattenflotte Sanktionen zu umgehen. Die Ukraine hat deshalb gezielt die Infrastruktur eines Ostseehafens ins Visier genommen auch die Schiffe, mit … [+2039 chars]",,de,'Schattenflotte'
https://www.stern.de/gesellschaft/regional/baden-wuerttemberg/nahe-der-deutschen-grenze--paris-genehmigt-rueckbau-von-akw-fessenheim-37364152.html,https://www.stern.de/gesellschaft/regional/baden-wuerttemberg/nahe-der-deutschen-grenze--paris-genehmigt-rueckbau-von-akw-fessenheim-37364152.html,0,www.stern.de,Nahe der deutschen Grenze: Paris genehmigt Rückbau von AKW Fessenheim,"Während der Meiler Fessenheim abgebaut wird, setzt Frankreich anderenorts auf neue Atomkraftwerke und verlängerte Laufzeiten. Was die neue Strategie für die Energieversorgung vorsieht.",https://image.stern.de/37364154/t/i-/v1/w1440/r1.7778/-/03--munt4laukjv7axs2048jpeg---6bd4b34f1e136b11.jpg,2026-05-03T11:55:57Z,,"Kopiere den aktuellen Link
Zur Merkliste hinzufügen
Während der Meiler Fessenheim abgebaut wird, setzt Frankreich anderenorts auf neue Atomkraftwerke und verlängerte Laufzeiten. Was die neue Strate… [+2198 chars]",,de,'Energieversorgung'
https://www.zeit.de/news/2026-05/03/paris-genehmigt-rueckbau-von-akw-fessenheim,https://www.zeit.de/news/2026-05/03/paris-genehmigt-rueckbau-von-akw-fessenheim,0,www.zeit.de,Nahe der deutschen Grenze: Paris genehmigt Rückbau von AKW Fessenheim,Hier finden Sie Informationen zu dem Thema „Nahe der deutschen Grenze“. Lesen Sie jetzt „Paris genehmigt Rückbau von AKW Fessenheim“.,https://img.zeit.de/news/2026-05/03/paris-genehmigt-rueckbau-von-akw-fessenheim-image-group/wide__1300x731,2026-05-03T11:55:57Z,,"Die französische Regierung hat den Rückbau des stillgelegten Atomkraftwerks Fessenheim nahe der deutschen Grenze genehmigt. Der Erlass, der dem Stromkonzern EDF den Rückbau erlaubt, wurde im Amtsblat… [+1997 chars]",,de,'AKW'
https://www.faz.net/aktuell/politik/ukraine/ukraine-liveticker-neuer-drohnenangriff-bei-besetztem-akw-gemeldet-faz-110683325.html,https://www.faz.net/aktuell/politik/ukraine/ukraine-liveticker-neuer-drohnenangriff-bei-besetztem-akw-gemeldet-faz-110683325.html,0,www.faz.net,Liveblog Ukrainekrieg: Ukraine: Neuer Drohnenangriff bei besetztem AKW gemeldet,IAEA forderte Zugang zu angegriffenem Strahlenlabor +++ Nordkoreas Partei lobt Einsatz junger Soldaten in der Ukraine +++ Abermals Angriffe auf russischen Ölhafen +++ alle Neuigkeiten im Liveblog,https://media0.faz.net/image/w1200h627/ab227d917b90/w3365h1758x0y242o/202605/43601.0.2043099429/das-von-russischen-truppen.webp,2026-05-03T14:20:23Z,,"Ukrainische Streitkräfte haben zwei Tanker der Schattenflotte in den Gewässern vor dem russischen Schwarzmeerhafen Noworossijsk angegriffen, teilt der ukrainische Präsident Wolodymyr Selenskyj mit. D… [+741 chars]",,de,'AKW'
https://orf.at/stories/3428680/,https://orf.at/stories/3428680/,0,orf.at,IAEA: Drohnenangriff bei AKW Saporischschja,,https://orf.at/mojo/1_4_1/storyserver//news/common/images/og-fallback-news.png,2026-05-03T14:22:28Z,,"Ein Strahlenlabor des ukrainischen Kernkraftwerks Saporischschja ist von einer Drohne angegriffen worden. Darüber habe das AKW informiert, berichtete die Internationale Atomenergiebehörde (IAEA) mit … [+1055 chars]",,de,'AKW'
https://www.n-tv.de/politik/Drohne-attackiert-Labor-von-AKW-Saporischschja-id30781047.html,https://www.n-tv.de/politik/Drohne-attackiert-Labor-von-AKW-Saporischschja-id30781047.html,0,www.n-tv.de,Atomenergiebehörde beunruhigt: Drohne attackiert Labor von AKW Saporischschja,Erst vor wenigen Tagen wird ein Mitarbeiter des besetzten Kernkraftwerks Saporischschja getötet. Nun kommt es zu einem weiteren alarmierenden Vorfall im Umkreis der Anlage: Ein Strahlenlabor unweit des gesicherten Bereichs wird attackiert.,https://www.n-tv.de/img/30781059/1777824980/Img_16_9/1200/FILE-PHOTO-A-view-shows-Zaporizhzhia-Nuclear-Power-Plant-from-the-bank-of-Kakhovka-Reservoir-near-the-town-of-Nikopol-after-the-Nova-Kakhovka-dam-breached-amid-Russia-s-attack-on-Ukraine-in-Dnipropetrovsk-region-Ukraine-June-16-2023.jpg,2026-05-03T14:45:10Z,,"Das größte Atomkraftwerk Europas steht seit März 2022 unter russischer Kontrolle. (Foto: REUTERS)
Erst vor wenigen Tagen wird ein Mitarbeiter des besetzten Kernkraftwerks Saporischschja getötet. Nun… [+1394 chars]",,de,'AKW'
https://www.morgenpost.de/berlin/article411892848/nach-dem-mega-stromausfall-in-berlin-so-wurde-beim-schutz-aufgeruestet.html,https://www.morgenpost.de/berlin/article411892848/nach-dem-mega-stromausfall-in-berlin-so-wurde-beim-schutz-aufgeruestet.html,0,www.morgenpost.de,Nach dem Mega-Stromausfall in Berlin: So wurde beim Schutz aufgerüstet,Nach dem massiven Blackout Anfang des Jahres im Berliner Südwesten hat der Senat Konsequenzen gezogen. Wie das Stromnetz geschützt wird.,https://img.sparknews.funkemedien.de/411773514/411773514_1776757740_v16_9_1600.jpeg,2026-05-04T07:34:13Z,,Vier Monate nach dem großen Stromausfall im Berliner Südwesten sieht Wirtschaftssenatorin Franziska Giffey deutliche Fortschritte beim Schutz des Stromnetzes. Wir haben nach den Ereignissen Anfang de… [+1509 chars],,de,'Blackout'
https://www.welt.de/wirtschaft/article69f84bc2123c5d78227c0338/lubmin-bei-greifswald-gaskraftwerk-soll-an-ukraine-verschenkt-werden-afd-nennt-vorgang-absurd.html,https://www.welt.de/wirtschaft/article69f84bc2123c5d78227c0338/lubmin-bei-greifswald-gaskraftwerk-soll-an-ukraine-verschenkt-werden-afd-nennt-vorgang-absurd.html,0,www.welt.de,„Voll funktionsfähiges“ Gaskraftwerk soll an Ukraine verschenkt werden – AfD nennt Vorgang „absurd“,Ein stillgelegtes Gaskraftwerk an der Nord-Stream-Pipeline bekommt ein neues Ziel: Statt Verschrottung soll die Anlage in die Ukraine gehen – als ungewöhnliche Form der Energiehilfe. Die AfD nennt den Vorgang „absurd“.,https://images.welt.de/69f84bc2123c5d78227c0338/e4c324ece847a16363621988c3a7b24f/ci16x9-w1200/dpa-com-260430-935-1313517-jpg,2026-05-04T08:15:10Z,,Ein stillgelegtes Gaskraftwerk an der Nord-Stream-Pipeline bekommt ein neues Ziel: Statt Verschrottung soll die Anlage in die Ukraine gehen als ungewöhnliche Form der Energiehilfe. Die AfD nennt den … [+2338 chars],,de,'Gas Ukraine'
https://www.stern.de/gesellschaft/regional/berlin-brandenburg/energie--fernwaerme-aus-ueberschuessigem-strom---bew-baut-neue-anlage-37365624.html,https://www.stern.de/gesellschaft/regional/berlin-brandenburg/energie--fernwaerme-aus-ueberschuessigem-strom---bew-baut-neue-anlage-37365624.html,0,www.stern.de,Energie: Fernwärme aus überschüssigem Strom - BEW baut neue Anlage,"Wenn im Osten zu viel Wind- und Solarstrom produziert wird, wandelt eine neue Anlage diesen künftig in Fernwärme für Berlin um. Das soll unter anderem Gas sparen und CO2-Emissionen senken.",https://image.stern.de/37365626/t/KG/v1/w1440/r1.7778/-/04--36ux265ow5v7axs2048jpeg---476bd103807bfee9.jpg,2026-05-04T08:30:04Z,,"Kopiere den aktuellen Link
Zur Merkliste hinzufügen
Wenn im Osten zu viel Wind- und Solarstrom produziert wird, wandelt eine neue Anlage diesen künftig in Fernwärme für Berlin um. Das soll unter an… [+1682 chars]",,de,'Energie sparen'
https://www.tagesspiegel.de/berlin/energie-fernwarme-aus-uberschussigem-strom-bew-baut-neue-anlage-15552520.html,https://www.tagesspiegel.de/berlin/energie-fernwarme-aus-uberschussigem-strom-bew-baut-neue-anlage-15552520.html,0,www.tagesspiegel.de,Energie: Fernwärme aus überschüssigem Strom - BEW baut neue Anlage,"Wenn im Osten zu viel Wind- und Solarstrom produziert wird, wandelt eine neue Anlage diesen künftig in Fernwärme für Berlin um. Das soll unter anderem Gas sparen und CO2-Emissionen senken.",https://www.tagesspiegel.de/images/15552519/alternates/BASE_16_9_W1400/1777883493000/bew-berliner-energie-und-warme-heizkraftwerk-mitte.jpeg,2026-05-04T08:31:33Z,,"Wenn zu viel Strom aus Wind- und Solaranlagen kommt, kann dieser bald am Heizkraftwerk Berlin-Mitte innerhalb weniger Minuten in Fernwärme umgewandelt werden. Die BEW Berliner Energie und Wärme, der … [+1527 chars]",,de,'Gas sparen'
https://www.faz.net/aktuell/politik/ukraine/ukraine-liveticker-selenskyj-dieser-sommer-wird-entscheidend-faz-110683325.html,https://www.faz.net/aktuell/politik/ukraine/ukraine-liveticker-selenskyj-dieser-sommer-wird-entscheidend-faz-110683325.html,0,www.faz.net,Liveblog Ukrainekrieg: Selenskyj: Dieser Sommer wird entscheidend,Putin müsse zur Diplomatie gedrängt werden +++ Ukraine meldet neuen Drohnenangriff bei besetztem AKW +++ Nordkoreas Partei lobt Einsatz junger Soldaten in der Ukraine +++ alle Neuigkeiten im Liveblog,https://media0.faz.net/image/w1200h627/f0525e78b21d/w5087h2657x0y330o/202605/43601.0.2045075764/der-ukrainische-praesident.webp,2026-05-04T09:03:40Z,,"Der ukrainische Präsident Wolodymyr Selenskyj hat beim Gipfel der Europäischen Politischen Gemeinschaft (EPG) betont, dass dieser Sommer entscheidend sei für den weiteren Kriegsverlauf. In diesem Som… [+925 chars]",,de,'AKW'
https://www.faz.net/aktuell/wirtschaft/katherina-reiche-vs-carsten-schneider-streit-um-energiewende-accg-200796095.html,https://www.faz.net/aktuell/wirtschaft/katherina-reiche-vs-carsten-schneider-streit-um-energiewende-accg-200796095.html,0,www.faz.net,Zweifel an drei Gesetzentwürfen: So subtil wäscht Carsten Schneider Katherina Reiche den Kopf,"Der Umweltminister kritisiert die Wirtschaftsministerin nicht offen, aber zwischen den Zeilen ist klar: Es gibt keine geeinte Klima- und Energiepolitik.",https://media0.faz.net/image/w1200h627/8e23e59bab57/w4475h2338x0y441o/202603/43601.0.1927068745/wirtschaftsministerin.webp,2026-05-05T04:16:48Z,,"Umweltminister Carsten Schneider (SPD) wirft seiner Kabinettskollegin Katherina Reiche (CDU) indirekt vor, nicht rechnen zu können und die Öffentlichkeit in der Energiepolitik an der Nase herumzuführ… [+5895 chars]",,de,'Energiepolitik'
https://www.faz.net/aktuell/wirtschaft/gastbeitrag-von-carsten-schneider-fossile-krise-braucht-eine-erneuerbare-antwort-accg-200780605.html,https://www.faz.net/aktuell/wirtschaft/gastbeitrag-von-carsten-schneider-fossile-krise-braucht-eine-erneuerbare-antwort-accg-200780605.html,0,www.faz.net,Energiekrise: Die fossile Krise braucht eine erneuerbare Antwort,"Die Atomkraft ist keine Antwort auf die fossile Energiekrise. Sie ist teuer, riskant und auf staatliche Absicherung angewiesen. Von einer Renaissance kann weltweit keine Rede sein.",https://media0.faz.net/image/w1200h627/fd4194550c2f/w6000h3135x0y206o/202604/43601.0.2001589266/carsten-schneider-spd.webp,2026-05-05T04:18:38Z,,"Die Welt erlebt eine fossile Energiekrise. Wieder einmal. Das zeigt: Wer auf ausländisches Öl und Gas angewiesen ist, bleibt verwundbar. Russlands Krieg gegen die Ukraine und der Konflikt in Iran mac… [+416 chars]",,de,'Gas Erneuerbare'
https://www.faz.net/aktuell/politik/ukraine/ukraine-liveticker-ukraine-verkuendet-waffenruhe-ab-mittwoch-faz-110683325.html,https://www.faz.net/aktuell/politik/ukraine/ukraine-liveticker-ukraine-verkuendet-waffenruhe-ab-mittwoch-faz-110683325.html,0,www.faz.net,Liveblog Ukrainekrieg: Ukraine verkündet Waffenruhe ab Mittwoch,Selenskyj: Waffenruhe beginnt ab 0 Uhr +++ Moskau hatte Waffenruhe am 8. und 9. Mai angekündigt +++ Ukraine meldet neuen Drohnenangriff bei besetztem AKW +++ alle Neuigkeiten im Liveblog,https://media0.faz.net/image/w1200h627/a9c838d2261f/w2000h1045x0y144o/202605/43601.0.2047279706/der-ukrainische-praesident.webp,2026-05-05T06:13:31Z,,"Großbritannien erwägt eine Beteiligung an dem 90 Milliarden Euro schweren Kredit der Europäischen Union für die Ukraine. Die Diskussionen um eine britische Beteiligung würden derzeit geführt, sagte P… [+1214 chars]",,de,'AKW'
https://www.dw.com/de/iran-krieg-suche-nach-alternativen-zur-stra%C3%9Fe-von-hormus/a-77041610,https://www.dw.com/de/iran-krieg-suche-nach-alternativen-zur-stra%C3%9Fe-von-hormus/a-77041610,0,www.dw.com,Iran-Krieg: Suche nach Alternativen zur Straße von Hormus,"Der Konflikt legt die Schwächen des Energiemarktes offen. Die Golfstaaten wollen ihre Ölimperien sichern und suchen nach Wegen, die Straße von Hormus zu umgehen. Vor vier Jahrzehnten zeigte sich, wie verwundbar der globale Ölmarkt an der Straße von Hormus war…",https://static.dw.com/image/74879436_6.jpg,2026-05-05T09:29:00Z,,"Vor vier Jahrzehnten zeigte sich, wie verwundbar der globale Ölmarkt an der Straße von Hormus war: Während des Iran-Irak-Kriegs von 1980 bis 1988 griffen beide Seiten wiederholt Öltanker in der Meere… [+7422 chars]",,de,'Energiemarkt'
https://www.focus.de/finanzen/boerse/die-suche-nach-alternativen-zur-strasse-von-hormus_f2fcb8fe-8da0-4691-9708-f3bad5ec5d84.html,https://www.focus.de/finanzen/boerse/die-suche-nach-alternativen-zur-strasse-von-hormus_f2fcb8fe-8da0-4691-9708-f3bad5ec5d84.html,0,www.focus.de,Die Suche nach Alternativen zur Straße von Hormus,"Der Konflikt legt die Schwächen des Energiemarktes offen. Die Golfstaaten wollen ihre Ölimperien sichern und suchen nach Wegen, die Straße von Hormus zu umgehen.","https://quadro.burda-forward.de/ctf/e0875cf3-75e7-4765-b69b-b73e8c80af77.127b2d20-d384-4da4-8192-d0a077b235fb.png?im=RegionOfInterestCrop=(1200,630),regionOfInterest=(600,338)&hash=055c0448d038932d4a36a252e6b8cc7ffbf44d11277499bb0fc9140f237d32e5",2026-05-05T11:29:00Z,,"Vor vier Jahrzehnten zeigte sich, wie verwundbar der globale Ölmarkt an der Straße von Hormus war: Während des Iran-Irak-Kriegs von 1980 bis 1988 griffen beide Seiten wiederholt Öltanker in der Meere… [+7525 chars]",,de,'Energiemarkt'
https://taz.de/Angst-vor-Blackouts/!6176418/,https://taz.de/Angst-vor-Blackouts/!6176418/,0,taz.de,Angst vor Blackouts: EU verbannt Solaranlagen-Technik aus China,Blackout durch Photovoltaik aus Fernost? Die EU-Kommission stoppt die Förderung für sogenannte Wechselrichter. Die Branche ist überrascht.,https://taz.de/picture/8419583/1200/27119571.jpeg,2026-05-05T12:47:00Z,,Blackout durch Photovoltaik aus Fernost? Die EU-Kommission stoppt die Förderung für sogenannte Wechselrichter. Die Branche ist überrascht. mehr...,,de,'Blackout'
https://www.stern.de/wirtschaft/news/kaempfe-im-nahen-osten--ezb-praesidentin-plaediert-fuer-mehr-erneuerbare-energien-37371174.html,https://www.stern.de/wirtschaft/news/kaempfe-im-nahen-osten--ezb-praesidentin-plaediert-fuer-mehr-erneuerbare-energien-37371174.html,0,www.stern.de,Kämpfe im Nahen Osten: EZB-Präsidentin plädiert für mehr erneuerbare Energien,Der Iran-Krieg hat die Preise für Öl und Gas hoch getrieben. Aus Sicht von EZB-Präsidentin Lagarde muss Europa bei der Abhängigkeit von fossilen Energien handeln - auch aus Wirtschaftsinteressen.,https://image.stern.de/37371176/t/T3/v1/w1440/r1.7778/-/05--zpmgtguwchv6axs2048jpeg---e67d9d12781ba437.jpg,2026-05-05T13:55:57Z,,"Kopiere den aktuellen Link
Zur Merkliste hinzufügen
Der Iran-Krieg hat die Preise für Öl und Gas hoch getrieben. Aus Sicht von EZB-Präsidentin Lagarde muss Europa bei der Abhängigkeit von fossilen … [+2024 chars]",,de,'Gas Wirtschaft'
https://www.tagesspiegel.de/wirtschaft/kampfe-im-nahen-osten-ezb-prasidentin-pladiert-fur-mehr-erneuerbare-energien-15559692.html,https://www.tagesspiegel.de/wirtschaft/kampfe-im-nahen-osten-ezb-prasidentin-pladiert-fur-mehr-erneuerbare-energien-15559692.html,0,www.tagesspiegel.de,Kämpfe im Nahen Osten: EZB-Präsidentin plädiert für mehr erneuerbare Energien,Der Iran-Krieg hat die Preise für Öl und Gas hoch getrieben. Aus Sicht von EZB-Präsidentin Lagarde muss Europa bei der Abhängigkeit von fossilen Energien handeln - auch aus Wirtschaftsinteressen.,https://www.tagesspiegel.de/images/15559691/alternates/BASE_16_9_W1400/1777989425000/ezb-ratssitzung-mit-zinsentscheidung.jpeg,2026-05-05T13:57:06Z,,EZB-Präsidentin Christine Lagarde plädiert auch angesichts des Iran-Kriegs für den Ausbau erneuerbaren Energien. Europa importiert rund 60 Prozent seiner Energie - nahezu vollständig in Form fossiler… [+1864 chars],,de,'Gas Erneuerbare'
https://versicherungswirtschaft-heute.de/politik-und-regulierung/2026-05-05/allianz-in-der-kritik-wegen-bau-von-us-lng-terminal-keine-versicherungsgesellschaft-sollte-cp2-versichern/,https://versicherungswirtschaft-heute.de/politik-und-regulierung/2026-05-05/allianz-in-der-kritik-wegen-bau-von-us-lng-terminal-keine-versicherungsgesellschaft-sollte-cp2-versichern/,0,versicherungswirtschaft-heute.de,Allianz in der Kritik wegen Bau von US-LNG-Terminal: „Keine Versicherungsgesellschaft sollte CP2 versichern“,"Die Umweltorganisation Urgewald nutzt die am Donnerstag anstehende Hauptversammlung der Allianz, um Druck auf den Münchner Versicherungskonzern auszuüben. Im Zentrum der Kritik steht eine Versicherungspolice im Zusammenhang mit dem umstrittenen Flüssiggasproj…",https://versicherungswirtschaft-heute.de/wp-60d20-content/uploads/2024/09/Allianz-1200x829.jpg,2026-05-05T14:43:02Z,,"Die Umweltorganisation Urgewald nutzt die am Donnerstag anstehende Hauptversammlung der Allianz, um Druck auf den Münchner Versicherungskonzern auszuüben. Im Zentrum der Kritik steht eine Versicherun… [+416 chars]",,de,'LNG-Terminal'
