index,url,valid,domain,title,description,image,published,archive,content,quote,language,keyword
https://www.n-tv.de/politik/Reiches-Gesetzentwurf-begraebt-Habecks-Gasheizungs-Aus-id30788779.html,https://www.n-tv.de/politik/Reiches-Gesetzentwurf-begraebt-Habecks-Gasheizungs-Aus-id30788779.html,0,www.n-tv.de,Kein Betriebsverbot nach 2045: Reiches Gesetzentwurf begräbt Habecks Gasheizungs-Aus,"Geht dieser Entwurf durchs Kabinett, nimmt das Ende von Robert Habecks Heizungsgesetz die nächste Hürde: Das von Wirtschaftsministerin Katherina Reiche eingebrachte Gesetz sieht kein Ende von Gas- und Ölheizungen in Deutschland vor - und entsetzt mit offen bl…",https://www.n-tv.de/img/30789046/1777998804/Img_16_9/1200/Katherina-Reiche-CDU-Bundesministerin-fuer-Wirtschaft-und-Energie-nimmt-am-Wirtschaftstag-des-CDU-Wirtschaftsrates-teil-Seit-1963-diskutieren-jaehrlich-Vertreter-aus-Politik-Wirtschaft-und-Wissenschaft-ueber-aktuelle-wirtschaftspolitische-Themen.jpg,2026-05-05T15:09:51Z,,"Katherina Reiche will mit ihrem Gesetz ""Technologieoffenheit"" in der Energiewende ermöglichen, wie sie sagt. (Foto: picture alliance/dpa)
Geht dieser Entwurf durchs Kabinett, nimmt das Ende von Robe… [+5293 chars]",,de,'Gas Erneuerbare'
https://www.bild.de/leben-wissen/digital/digitaler-blackout-stoerung-legt-zahlreiche-de-webseiten-lahm-69fa7498c764528c1ad213c0,https://www.bild.de/leben-wissen/digital/digitaler-blackout-stoerung-legt-zahlreiche-de-webseiten-lahm-69fa7498c764528c1ad213c0,0,www.bild.de,Digitaler Blackout - Störung legt etliche .de-Webseiten lahm,Denic bestätigt nächtliche Störung: Viele .de-Seiten kurz nicht erreichbar. Ursache wird geprüft.,"https://images.bild.de/69fa7498c764528c1ad213c0/f174f09410eff2c4019879df5e48638f,9dc8d921?w=1280",2026-05-05T23:04:30Z,,TTS-Player überspringenArtikel weiterlesenBerlin In der Nacht konnten zahlreiche Websites mit der Endung .de zeitweise nicht aufgerufen werden. Der Grund: eine Störung im DNS-Service zur Auflösung vo… [+498 chars],,de,'Blackout'
https://www.bild.de/news/inland/stoerung-darum-ging-gestern-abend-das-internet-nicht-mehr-69fac9c9cd4a28c47001d51a,https://www.bild.de/news/inland/stoerung-darum-ging-gestern-abend-das-internet-nicht-mehr-69fac9c9cd4a28c47001d51a,0,www.bild.de,Digitaler Blackout - Darum ging gestern Abend das Internet nicht mehr,Eine heftige Störung bei einem Dienstleister legte in der Nacht große Teile des deutschen Internets lahm. Zahlreiche Internetseiten waren nicht erreichbar.,"https://images.bild.de/69fac9c9cd4a28c47001d51a/e3471005c87153b072990568fec3e806,a7c23741?w=1280",2026-05-06T05:57:40Z,,TTS-Player überspringenArtikel weiterlesenFrankfurt Eine heftige Störung bei einem Dienstleister legte in der Nacht große Teile des deutschen Internets lahm. In der Nacht konnten zahlreiche Nutzer pl… [+1529 chars],,de,'Blackout'
https://www.zeit.de/wirtschaft/2026-04/gasversorgung-kosten-heizung-verbraucherzentrale-daten,https://www.zeit.de/wirtschaft/2026-04/gasversorgung-kosten-heizung-verbraucherzentrale-daten,0,www.zeit.de,Gasversorgung: Er braucht kein Gas mehr – für den Anschluss soll er trotzdem zahlen,"Wer aus dem Gasnetz aussteigt, muss es oft trotzdem noch finanzieren – oder den Anschluss teuer stilllegen lassen. Verbraucherschützer kritisieren die unklaren Regeln.",https://img.zeit.de/wirtschaft/2026-05/gasversorgung-kosten-heizung-verbraucherzentrale-daten-bild/wide__1300x731,2026-05-06T06:05:28Z,,Im September 2025 bauten Installateure in Franz Zauners Keller eine Wärmepumpe ein. Erdgas braucht der Schwabe seitdem nicht mehr. Sein Haus hing dennoch weiterhin am Gasnetz und Zauner bekam einen B… [+444 chars],,de,'Gasnetz'
"https://www.gamestar.de/artikel/spanien-massnahmen-blackout,3452381.html","https://www.gamestar.de/artikel/spanien-massnahmen-blackout,3452381.html",0,www.gamestar.de,Energie - 589 Prozent mehr Speicher: Vor einem Jahr fiel in ganz Spanien der Strom aus. Seitdem hat das Land seine Hausaufgaben gemacht,Nach dem verheerenden Blackout im letztem Jahr hat Spanien schnell reagiert und gleich in mehreren Bereichen nachgebessert.,https://images.cgames.de/images/gamestar/293/teaser-spanien-ende-der-kohle-gs_6370516.jpg,2026-05-06T08:26:00Z,,"Spanien hat nach dem Blackout mehrere Maßnahmen ergriffen, um das Stromnetz abzusichern. (Bildquelle: Unsplash, Joey Harris und Adobe Firefly, generative KI)
Der Stromausfall im Frühjahr des Jahres … [+3868 chars]",,de,'Blackout'
https://www.focus.de/politik/ausland/21-menschen-getoetet-hinrichtungen-armut-mega-inflation-irans-brutaler-alltag_495fe5ca-d88b-43e5-83d3-44bb11034088.html,https://www.focus.de/politik/ausland/21-menschen-getoetet-hinrichtungen-armut-mega-inflation-irans-brutaler-alltag_495fe5ca-d88b-43e5-83d3-44bb11034088.html,0,www.focus.de,"21 Menschen getötet: Hinrichtungen, Armut, Mega-Inflation - Irans brutaler Alltag","Während Teheran mit den USA verhandelt, eskaliert im Inland die Gewalt: Hinrichtungen laufen weiter, Preise explodieren. Viele Iraner kämpfen ums Überleben – und reagieren längst nur noch mit Abstumpfung.","https://quadro.burda-forward.de/ctf/2ef0954d-6974-4afb-9945-e3c3abd8bac0.0452a2c8-b5dc-462d-91a1-e9d24bfb01b1.jpg?im=RegionOfInterestCrop=(1200,630),regionOfInterest=(591,433)&hash=f84c217c8dfdd1e3aaee831fd142e8eb975284770ffc948b87ea94f76ba6de4d",2026-05-06T10:58:00Z,,"Trotz des Kriegs mit den USA hält das iranische Regime an seinem harten Kurs gegen die eigene Bevölkerung fest. Wie der Sender ""Iran International"" berichtet, läuft die Hinrichtungsmaschinerie im Hin… [+3938 chars]",,de,'Blackout'
https://hallespektrum.de/aktuelles/streit-um-energiepolitik-im-gebaeudesektor-kritik-an-gesetzentwurf-waechst/476840/,https://hallespektrum.de/aktuelles/streit-um-energiepolitik-im-gebaeudesektor-kritik-an-gesetzentwurf-waechst/476840/,0,hallespektrum.de,Streit um Energiepolitik im Gebäudesektor: Kritik an Gesetzentwurf wächst,"Die Debatte um die künftige Ausrichtung der Energiepolitik im Gebäudebereich gewinnt an Schärfe. Hintergrund ist ein Gesetzentwurf aus dem Bundeswirtschaftsministerium unter Leitung von Katherina Reiche, der nach Ansicht von Kritikern Änderungen am bestehende…",https://hallespektrum.de/wp-content/uploads/2025/12/analog_film_photo_of_a_typical_German_garden_gnome_sitting_in_his_cosy_living_room_in_front_of_a_war_1056640118.jpg,2026-05-06T14:51:08Z,,Die Debatte um die künftige Ausrichtung der Energiepolitik im Gebäudebereich gewinnt an Schärfe. Hintergrund ist ein Gesetzentwurf aus dem Bundeswirtschaftsministerium unter Leitung von Katherina Rei… [+1555 chars],,de,'Gas Erneuerbare'
https://tirol.orf.at/stories/3353207/,https://tirol.orf.at/stories/3353207/,0,tirol.orf.at,"TIGAS senkt Gaspreis um 13,2 Prozent","Wie bereits angekündigt, senkt der landeseigene Energieversorger TIGAS den Gaspreis mit 1. Juli bei Standard-Fixprodukten um 13,2 Prozent ab. Damit liege er folglich bei 5,2501 Cent/kWh brutto, hieß es in einer Aussendung am Donnerstag.",https://ibs.orf.at/tir?image=https%3A%2F%2Foekastatic.orf.at%2Fmims%2F2026%2F12%2F18%2Fcrops%2Fw%3D1200%2Ch%3D627%2Cq%3D75%2F2973402_master_1149718_downloadmedium.jpg%3Fs%3D3704d30c6044c921c1e16c514473730878f0135b,2026-05-07T08:13:16Z,,Bereits im Vorjahr war der Preis um 16 Prozent gesenkt worden. Auch kündigte man eine Preisgarantie von einem Jahr an. TIGAS-Geschäftsführer Gerhard Tollinger betonte eine vorausschauende Beschaffung… [+778 chars],,de,'Gasnetz'
https://www.focus.de/politik/ausland/us-energieplan-fuer-den-balkan-nimmt-konkrete-formen-an-bosnien-nimmt-aerger-mit-eu-in-kauf_293330f1-8053-451a-bde8-c9f91e0f4bf8.html,https://www.focus.de/politik/ausland/us-energieplan-fuer-den-balkan-nimmt-konkrete-formen-an-bosnien-nimmt-aerger-mit-eu-in-kauf_293330f1-8053-451a-bde8-c9f91e0f4bf8.html,0,www.focus.de,US-Energieplan für den Balkan nimmt konkrete Formen an – Bosnien nimmt Ärger mit EU in Kauf,"Die US-Energieoffensive in Südosteuropa konkretisiert sich: In Bosnien-Herzegowina nimmt ein 1,5-Milliarden-Dollar-Pipelineprojekt Gestalt an, das die Abhängigkeit von russischem Gas beenden soll.","https://quadro.burda-forward.de/ctf/e18e1794-4d8a-4b33-91e6-e5d9464224aa.17ce4dc8-ff5e-4a2f-ae4f-0521fdf68780.jpg?im=RegionOfInterestCrop=(1200,630),regionOfInterest=(1411,735)&hash=cd8f90af74ade30dbf9316d5c3c5ea2e7dfd6c4f29651239e42c882233261882",2026-05-07T12:32:00Z,,Die von den USA angekündigte Ausweitung ihrer Energie- und Digitalinvestitionen im Westbalkan wird zunehmend konkret. Nach ersten Rahmenvereinbarungen vor wenigen Tagen zeichnet sich nun besonders in… [+2604 chars],,de,'Erdgas Russland'
https://www.nzz.ch/pro/blackout-simulation-mit-herbert-saurugg-liefert-lehren-fuer-die-krise-ld.10003775,https://www.nzz.ch/pro/blackout-simulation-mit-herbert-saurugg-liefert-lehren-fuer-die-krise-ld.10003775,0,www.nzz.ch,«NZZ Pro» hat ein Blackout simuliert und das Chaos entdeckt. Fünf Lehren für die Krise,Herbert Saurugg gehört zu den bekanntesten Blackout-Experten im deutschsprachigen Raum. Mit einem Brettspiel macht er auf die Gefahren des Stromausfalls aufmerksam. «NZZ Pro» hat es gespielt.,"https://img-msp-prod.nzz.ch/2026/04/22/2d0c2d93-fdd2-4c78-bd9f-9cc3a2b2c983.jpg?width=1200&height=675&fit=bounds&quality=75&auto=webp&crop=4983,2803,x0,y58&wmark=nzz",2026-05-08T03:30:00Z,,"Es stinkt nach Fäkalien in Schwarzbach, die Menschen frieren, und nun werden auch noch die Vorräte knapp. In der Nacht auf Freitag strömen die Bürger zum Rathaus, sie sind wütend, die ersten rütteln … [+13821 chars]",,de,'Blackout'
https://www.welt.de/videos/video69fdb0dccd4a28c470020b0d/abgelehnte-entlastungspraemie-uebergewinnsteuer-und-preisdeckel-das-ist-die-deutlich-haushaltsschonendere-variante.html,https://www.welt.de/videos/video69fdb0dccd4a28c470020b0d/abgelehnte-entlastungspraemie-uebergewinnsteuer-und-preisdeckel-das-ist-die-deutlich-haushaltsschonendere-variante.html,0,www.welt.de,Übergewinnsteuer und Preisdeckel – „Das ist die deutlich haushaltsschonendere Variante“,"Nach dem Nein zur Entlastungsprämie im Bundesrat fordert SPD-Politikerin Anke Rehlinger wirksamere Maßnahmen gegen hohe Energiepreise. Sie betont, dass die Prämie das falsche Instrument gewesen sei und plädiert stattdessen für eine Übergewinnsteuer und einen …",https://images.welt.de/69fdb0dccd4a28c470020b0d/9709801ee82f3cac3d0af7ca7521bec3/ci16x9-w1200/dpa-com-260416-935-1283972-jpg,2026-05-08T11:19:42Z,,"Nach dem Nein zur Entlastungsprämie im Bundesrat fordert SPD-Politikerin Anke Rehlinger wirksamere Maßnahmen gegen hohe Energiepreise. Sie betont, dass die Prämie das falsche Instrument gewesen sei u… [+131 chars]",,de,'Übergewinnsteuer'
https://www.stern.de/gesellschaft/regional/berlin-brandenburg/energieversorgung--kraftwerksplaene-im-osten-bedroht--leag-protestiert-37381472.html,https://www.stern.de/gesellschaft/regional/berlin-brandenburg/energieversorgung--kraftwerksplaene-im-osten-bedroht--leag-protestiert-37381472.html,0,www.stern.de,Energieversorgung: Kraftwerkspläne im Osten bedroht? Leag protestiert,"Beschäftigte des Energiekonzerns Leag haben große Sorge, dass der Osten beim Bau neuer Gaskraftwerke abgehängt wird. Was steckt hinter dem Protest in der Lausitz?",https://image.stern.de/37381474/t/Ej/v1/w1440/r1.7778/-/08--gswjutjnplv20axs2048jpeg---5faa6498909514bc.jpg,2026-05-08T11:38:49Z,,"Kopiere den aktuellen Link
Zur Merkliste hinzufügen
Beschäftigte des Energiekonzerns Leag haben große Sorge, dass der Osten beim Bau neuer Gaskraftwerke abgehängt wird. Was steckt hinter dem Protes… [+2302 chars]",,de,'Blackout'
https://www.zeit.de/news/2026-05/08/kraftwerksplaene-im-osten-bedroht-leag-protestiert,https://www.zeit.de/news/2026-05/08/kraftwerksplaene-im-osten-bedroht-leag-protestiert,0,www.zeit.de,Energieversorgung: Kraftwerkspläne im Osten bedroht? Leag protestiert,Hier finden Sie Informationen zu dem Thema „Energieversorgung“. Lesen Sie jetzt „Kraftwerkspläne im Osten bedroht? Leag protestiert“.,https://img.zeit.de/news/2026-05/08/kraftwerksplaene-im-osten-bedroht-leag-protestiert-image-group/wide__1300x731,2026-05-08T11:38:49Z,,Beschäftigte des Energiekonzerns Leag haben am Kraftwerkstandort Schwarze Pumpe in der Lausitz gegen Pläne des Bundeswirtschaftsministeriums zum Bau neuer Gaskraftwerke protestiert. «Kein Blackout Os… [+2121 chars],,de,'Blackout'
https://www.tagesspiegel.de/berlin/energieversorgung-kraftwerksplane-im-osten-bedroht-leag-protestiert-15575351.html,https://www.tagesspiegel.de/berlin/energieversorgung-kraftwerksplane-im-osten-bedroht-leag-protestiert-15575351.html,0,www.tagesspiegel.de,Energieversorgung: Kraftwerkspläne im Osten bedroht? Leag protestiert,"Beschäftigte des Energiekonzerns Leag haben große Sorge, dass der Osten beim Bau neuer Gaskraftwerke abgehängt wird. Was steckt hinter dem Protest in der Lausitz?",https://www.tagesspiegel.de/images/15575350/alternates/BASE_16_9_W1400/1778240403000/protest-in-der-lausitz-sorge-um-neue-gaskraftwerke-wachst.jpeg,2026-05-08T11:40:03Z,,Beschäftigte des Energiekonzerns Leag haben am Kraftwerkstandort Schwarze Pumpe in der Lausitz gegen Pläne des Bundeswirtschaftsministeriums zum Bau neuer Gaskraftwerke protestiert. Kein Blackout Ost… [+2173 chars],,de,'Energieversorgung'
https://www.stern.de/wirtschaft/news/eu-kommission--erstattung-fuer-flugausfall-auch-bei-teurem-kerosin-37381548.html,https://www.stern.de/wirtschaft/news/eu-kommission--erstattung-fuer-flugausfall-auch-bei-teurem-kerosin-37381548.html,0,www.stern.de,EU-Kommission: Erstattung für Flugausfall auch bei teurem Kerosin,"Infolge des Iran-Kriegs explodierten die Energiepreise, Flüge fielen deswegen bereits aus. Verbraucher müssen bei hohen Preisen trotzdem entschädigt werden - in einem bestimmten Fall aber nicht.",https://image.stern.de/37381550/t/bI/v1/w1440/r1.7778/-/08--23czearvx6v11axs2048jpeg---ee8dcfe371ff2715.jpg,2026-05-08T12:00:13Z,,"Kopiere den aktuellen Link
Zur Merkliste hinzufügen
Infolge des Iran-Kriegs explodierten die Energiepreise, Flüge fielen deswegen bereits aus. Verbraucher müssen bei hohen Preisen trotzdem entschäd… [+1939 chars]",,de,'Energiepreise'
https://www.tagesspiegel.de/wirtschaft/eu-kommission-erstattung-fur-flugausfall-auch-bei-teurem-kerosin-15575456.html,https://www.tagesspiegel.de/wirtschaft/eu-kommission-erstattung-fur-flugausfall-auch-bei-teurem-kerosin-15575456.html,0,www.tagesspiegel.de,EU-Kommission: Erstattung für Flugausfall auch bei teurem Kerosin,"Infolge des Iran-Kriegs explodierten die Energiepreise, Flüge fielen deswegen bereits aus. Verbraucher müssen bei hohen Preisen trotzdem entschädigt werden - in einem bestimmten Fall aber nicht.",https://www.tagesspiegel.de/images/15575455/alternates/BASE_16_9_W1400/1778241692000/flughafen-frankfurt.jpeg,2026-05-08T12:01:32Z,,"Wenn ein Flug wegen hoher Kerosinkosten gestrichen wird, haben Verbraucher auch in der derzeitigen Energiekrise ein Recht auf Erstattung. Wie die Europäische Kommission mitteilte, gelten die EU-Flugg… [+1780 chars]",,de,'Energiepreise'
https://www.stern.de/gesellschaft/regional/berlin-brandenburg/hohe-energiepreise--wegner-fordert-aussetzung-der-co2-steuer-37382224.html,https://www.stern.de/gesellschaft/regional/berlin-brandenburg/hohe-energiepreise--wegner-fordert-aussetzung-der-co2-steuer-37382224.html,0,www.stern.de,Hohe Energiepreise: Wegner fordert Aussetzung der CO2-Steuer,"Im Bundesrat ist die geplante Entlastungsprämie gescheitert. Berlins Regierungschef Wegner mahnt die Bundesregierung, das Votum ernst zu nehmen. Was er damit meint.",https://image.stern.de/37382226/t/KI/v1/w1440/r1.7778/-/08--l6vi4hctt4v4axs2048jpeg---51155fa60fbe1f68.jpg,2026-05-08T14:06:45Z,,"Kopiere den aktuellen Link
Zur Merkliste hinzufügen
Im Bundesrat ist die geplante Entlastungsprämie gescheitert. Berlins Regierungschef Wegner mahnt die Bundesregierung, das Votum ernst zu nehmen. … [+1751 chars]",,de,'Energiepreise'
https://www.zeit.de/news/2026-05/08/wegner-fordert-aussetzung-der-co2-steuer,https://www.zeit.de/news/2026-05/08/wegner-fordert-aussetzung-der-co2-steuer,0,www.zeit.de,Hohe Energiepreise: Wegner fordert Aussetzung der CO2-Steuer,Hier finden Sie Informationen zu dem Thema „Hohe Energiepreise“. Lesen Sie jetzt „Wegner fordert Aussetzung der CO2-Steuer“.,https://img.zeit.de/news/2026-05/08/wegner-fordert-aussetzung-der-co2-steuer-image-group/wide__1300x731,2026-05-08T14:06:45Z,,Nach dem vorläufigen Scheitern der geplanten Entlastungsprämie für Beschäftigte im Bundesrat fordert Berlins Regierender Bürgermeister Kai Wegner andere Maßnahmen für die Bürger. «Wir brauchen Entlas… [+1569 chars],,de,'Energiepreise'
https://www.tagesspiegel.de/berlin/hohe-energiepreise-wegner-fordert-aussetzung-der-co2-steuer-15576209.html,https://www.tagesspiegel.de/berlin/hohe-energiepreise-wegner-fordert-aussetzung-der-co2-steuer-15576209.html,0,www.tagesspiegel.de,Hohe Energiepreise: Wegner fordert Aussetzung der CO2-Steuer,"Im Bundesrat ist die geplante Entlastungsprämie gescheitert. Berlins Regierungschef Wegner mahnt die Bundesregierung, das Votum ernst zu nehmen. Was er damit meint.",https://www.tagesspiegel.de/images/15576208/alternates/BASE_16_9_W1400/1778249256000/kai-wegner.jpeg,2026-05-08T14:07:36Z,,Nach dem vorläufigen Scheitern der geplanten Entlastungsprämie für Beschäftigte im Bundesrat fordert Berlins Regierender Bürgermeister Kai Wegner andere Maßnahmen für die Bürger. Wir brauchen Entlast… [+1618 chars],,de,'Energiepreise'
https://www.stern.de/gesellschaft/regional/berlin-brandenburg/stromversorgung--stromausfall-trifft-4-500-haushalte-im-berliner-westen-37382480.html,https://www.stern.de/gesellschaft/regional/berlin-brandenburg/stromversorgung--stromausfall-trifft-4-500-haushalte-im-berliner-westen-37382480.html,0,www.stern.de,Stromversorgung: Stromausfall trifft 4.500 Haushalte im Berliner Westen,Plötzlich fließt kein Strom mehr bei fast 4.500 Haushalten im Berliner Westen. Auslöser waren Probleme bei zwei Umspannwerken. Bis zum Abend soll aber alles wieder nach Plan laufen.,https://image.stern.de/37382482/t/Nl/v1/w1440/r1.7778/-/08--fod7b24e23v5axs2048jpeg---aa250878c6f51331.jpg,2026-05-08T15:24:29Z,,"Kopiere den aktuellen Link
Zur Merkliste hinzufügen
Plötzlich fließt kein Strom mehr bei fast 4.500 Haushalten im Berliner Westen. Auslöser waren Probleme bei zwei Umspannwerken. Bis zum Abend soll… [+1003 chars]",,de,'Stromversorgung'
https://www.zeit.de/news/2026-05/08/stromausfall-trifft-4-500-haushalte-im-berliner-westen,https://www.zeit.de/news/2026-05/08/stromausfall-trifft-4-500-haushalte-im-berliner-westen,0,www.zeit.de,Stromversorgung: Stromausfall trifft 4.500 Haushalte im Berliner Westen,Hier finden Sie Informationen zu dem Thema „Stromversorgung“. Lesen Sie jetzt „Stromausfall trifft 4.500 Haushalte im Berliner Westen“.,https://img.zeit.de/news/2026-05/08/stromausfall-trifft-4-500-haushalte-im-berliner-westen-image-group/wide__1300x731,2026-05-08T15:24:29Z,,"In einigen Stadtteilen im Westen Berlins ist am Nachmittag bei Tausenden Haushalten der Strom ausgefallen. Bei den meisten Kunden in Charlottenburg, Grunewald und Westend sei die Versorgung aber rasc… [+805 chars]",,de,'Stromversorgung'
https://www.tagesspiegel.de/berlin/stromversorgung-stromausfall-trifft-4500-haushalte-im-berliner-westen-15576563.html,https://www.tagesspiegel.de/berlin/stromversorgung-stromausfall-trifft-4500-haushalte-im-berliner-westen-15576563.html,0,www.tagesspiegel.de,Stromversorgung: Stromausfall trifft 4.500 Haushalte im Berliner Westen,Plötzlich fließt kein Strom mehr bei fast 4.500 Haushalten im Berliner Westen. Auslöser waren Probleme bei zwei Umspannwerken. Bis zum Abend soll aber alles wieder nach Plan laufen.,https://www.tagesspiegel.de/images/15576562/alternates/BASE_16_9_W1400/1778253921000/jahres-pressekonferenz-stromnetz-berlin.jpeg,2026-05-08T15:25:21Z,,"In einigen Stadtteilen im Westen Berlins ist am Nachmittag bei Tausenden Haushalten der Strom ausgefallen. Bei den meisten Kunden in Charlottenburg, Grunewald und Westend sei die Versorgung aber rasc… [+859 chars]",,de,'Stromversorgung'
https://www.nzz.ch/wirtschaft/der-chef-von-deutschlands-groesstem-energiekonzern-sagt-unsere-energiewende-ist-viel-zu-teuer-geworden-ld.10004095,https://www.nzz.ch/wirtschaft/der-chef-von-deutschlands-groesstem-energiekonzern-sagt-unsere-energiewende-ist-viel-zu-teuer-geworden-ld.10004095,0,www.nzz.ch,INTERVIEW - Der Chef von Deutschlands grösstem Energiekonzern sagt: «Unsere Energiewende ist viel zu teuer geworden»,"Leonhard Birnbaum, CEO von E.On, stützt Wirtschaftsministerin Katherina Reiche: Das Land brauche neue Regeln in der Energiepolitik, Gaskraftwerke seien alternativlos. Eine Rückkehr zur Atomkraft hält er in Deutschland für ausgeschlossen – hofft aber auf die S…","https://img-msp-prod.nzz.ch/2026/05/08/e51c451f-1d0b-4736-860d-35e1d1e14f18.jpg?width=1200&height=674&fit=bounds&quality=75&auto=webp&crop=4288,2412,x0,y523&wmark=nzz",2026-05-09T03:30:00Z,,"Leonhard Birnbaum, CEO von E.On, stützt Wirtschaftsministerin Katherina Reiche: Das Land brauche neue Regeln in der Energiepolitik, Gaskraftwerke seien alternativlos. Eine Rückkehr zur Atomkraft hält… [+14967 chars]",,de,'Gas Erneuerbare'
https://www.stern.de/gesellschaft/regional/nordrhein-westfalen/energiewende--zwei-kuehltuerme-von-altem-kohlekraftwerk-gesprengt-37383256.html,https://www.stern.de/gesellschaft/regional/nordrhein-westfalen/energiewende--zwei-kuehltuerme-von-altem-kohlekraftwerk-gesprengt-37383256.html,0,www.stern.de,Energiewende: Zwei Kühltürme von altem Kohlekraftwerk gesprengt,15.000 Tonnen Beton krachen kontrolliert zusammen: In Gelsenkirchen wird Platz geschaffen für ein modernes Gaskraftwerk. In Zukunft soll am Standort auch Strom mit Wasserstoff erzeugt werden können.,https://image.stern.de/37383888/t/zM/v1/w1440/r1.7778/-/09--3pkiiubmyiv7axs2048jpeg---c7e07d79d26c1479.jpg,2026-05-09T11:31:06Z,,"Kopiere den aktuellen Link
Zur Merkliste hinzufügen
15.000 Tonnen Beton krachen kontrolliert zusammen: In Gelsenkirchen wird Platz geschaffen für ein modernes Gaskraftwerk. In Zukunft soll am Stand… [+1864 chars]",,de,'Energiewende Gas'
https://www.n-tv.de/wirtschaft/Ich-moechte-den-Politiker-sehen-der-sagt-In-meinem-Landkreis-bauen-wir-ein-AKW-id30800661.html,https://www.n-tv.de/wirtschaft/Ich-moechte-den-Politiker-sehen-der-sagt-In-meinem-Landkreis-bauen-wir-ein-AKW-id30800661.html,0,www.n-tv.de,"Die unaufrichtige Atomdebatte: ""Ich möchte den Politiker sehen, der sagt: In meinem Landkreis bauen wir ein AKW""","Deutschland und Atomkraft. Raus. Rein. Dann wieder raus. Jetzt wieder rein? Andreas Schell hat die Nase voll. ""Ich verstehe nicht, warum diese Diskussion immer wieder aufgebracht wird"", sagt der Chef von IB Vogt. Er  wirft Atomkraft-Befürwortern im Interview …",https://www.n-tv.de/img/30801007/1778246436/Img_16_9/1200/Protestaktion-der-Anti-Atom-Organisation-ausgestrahlt-Projektion-Nachtaufnahme-05-03-2026-Waldshut-AKW-Leibstadt-Rhein-Hochrhein-Kanton-Aargau-Schweiz.jpg,2026-05-10T07:27:26Z,,"Die EU-Kommission öffnet sich für mehr Atomkraft. Die entscheidenden Fragen möchte aber niemand beantworten. (Foto: picture alliance / imageBROKER)
Deutschland eiert herum. Raus aus der Atomkraft. R… [+9942 chars]",,de,'Gas Erneuerbare'
https://www.focus.de/finanzen/kunden-wollen-gasnetz-verlassen-so-vermeiden-sie-die-kostenfalle_b3702f11-2cb5-457d-8c7f-0042626de9aa.html,https://www.focus.de/finanzen/kunden-wollen-gasnetz-verlassen-so-vermeiden-sie-die-kostenfalle_b3702f11-2cb5-457d-8c7f-0042626de9aa.html,0,www.focus.de,Kunden wollen Gasnetz verlassen: So vermeiden sie die Kostenfalle,"Verbraucher, die aus dem Gasnetz aussteigen, zahlen trotzdem weiter für den Anschluss. Daran gibt es jetzt Kritik. Wie Verbraucher sich schützen.","https://quadro.burda-forward.de/ctf/15b1743d-a334-4b16-8012-2a383d3ad7e3.a5c2761d-4718-4bf5-bc27-f14436c32dd8.jpg?im=RegionOfInterestCrop=(1200,630),regionOfInterest=(2056,1911)&hash=15212de0f2922121dd0033912fca1760b2fcf39387f1f1269e390abed2c31581",2026-05-11T08:05:00Z,,"Gaskunden, die kein Gas mehr beziehen, sollen bei einigen Gasanbietern weiter für ihren Anschluss bezahlen oder dafür, endgültig vom Netz getrennt zu werden. Das berichtet die Zeit. Eine aktuelle Ana… [+5284 chars]",,de,'Gasnetz'
https://www.tagesschau.de/investigativ/russland-lng-100.html,https://www.tagesschau.de/investigativ/russland-lng-100.html,0,www.tagesschau.de,Bundeseigenes Unternehmen - Ein Gas-Deal für Putins Kriegskasse,"Ein Bundesunternehmen verhandelte 2023 mit einem Putin-Vertrauten über die Wiederaufnahme von LNG-Lieferungen - das zeigen <em>NDR</em>-Recherchen. Der Kreml gab das Geschäft frei, seitdem fließen Milliarden. Was wusste der damalige Minister Habeck?",https://images.tagesschau.de/image/70637da4-dd41-4823-875c-da36f179538e/AAABmL0X38U/AAABnSSvrFg/16x9-big/lng-russland-100.jpg?width=1280,2026-05-13T05:00:37Z,,"Stand: 13.05.2026 07:00 Uhr
Ein Bundesunternehmen verhandelte 2023 mit einem Putin-Vertrauten über die Wiederaufnahme von LNG-Lieferungen - das zeigen NDR-Recherchen. Der Kreml gab das Geschäft frei… [+8068 chars]",,de,'G20-Gipfel Gas'
