index,url,valid,domain,title,description,image,published,archive,content,quote,language,keyword
https://www.telepolis.de/features/Indiens-enges-Verhaeltnis-zu-Russland-Vorteil-fuer-den-Westen-9304599.html,https://www.telepolis.de/features/Indiens-enges-Verhaeltnis-zu-Russland-Vorteil-fuer-den-Westen-9304599.html,0,www.telepolis.de,Indiens enges Verhältnis zu Russland – Vorteil für den Westen?,Auf die Schwüre und schönen Bilder vom G20-Gipfel in Neu-Delhi folgt die Ernüchterung: Wahrscheinlich exportiert Indien trotz Sanktionen russisches Erdöl nach Deutschland. Wie ist damit umzugehen?,https://heise.cloudimg.io/bound/1200x1200/q85.png-lossy-85.webp-lossy-85.foil1/_www-heise-de_/imgs/18/4/3/0/2/4/5/0/Master_Scholz-ce5a72810b71acb3.jpeg,2023-09-14T06:00:00Z,,"Kanzler Scholz und Premier Modi im Februar 2023. Foto: Büro des indischen Premierministers / CC BY-SA 4.0
Auf die Schwüre und schönen Bilder vom G20-Gipfel in Neu-Delhi folgt die Ernüchterung: Wahrs… [+4840 chars]",,de,'Russland Erdöl'
https://www.zeit.de/news/2023-09/14/kein-baustopp-fuer-lng-terminal-gericht-lehnt-antrag-ab,https://www.zeit.de/news/2023-09/14/kein-baustopp-fuer-lng-terminal-gericht-lehnt-antrag-ab,0,www.zeit.de,Energie: Kein Baustopp für LNG-Terminal: Gericht lehnt Antrag ab,,,2023-09-14T07:25:19Z,,"When browsing with ads:
We collect personal data and also transmit it to third-party providers
 that help us improve and finance our digital content. Some of the information stored on your device, … [+821 chars]",,de,'LNG'
https://www.zeit.de/news/2023-09/14/kein-baustopp-fuer-ruegener-lng-terminal,https://www.zeit.de/news/2023-09/14/kein-baustopp-fuer-ruegener-lng-terminal,0,www.zeit.de,Bundesverwaltungsgericht: Kein Baustopp für Rügener LNG-Terminal,,,2023-09-14T07:28:26Z,,"When browsing with ads:
We collect personal data and also transmit it to third-party providers
 that help us improve and finance our digital content. Some of the information stored on your device, … [+821 chars]",,de,'LNG'
"https://www.ndr.de/nachrichten/mecklenburg-vorpommern/LNG-Terminal-auf-Ruegen-Gegner-scheitern-vor-Bundesverwaltungsgericht,lng884.html","https://www.ndr.de/nachrichten/mecklenburg-vorpommern/LNG-Terminal-auf-Ruegen-Gegner-scheitern-vor-Bundesverwaltungsgericht,lng884.html",0,www.ndr.de,LNG-Terminal auf Rügen: Gericht lehnt Antrag auf Baustopp ab,Gegner des Rügener Flüssigerdgas-Terminals haben vor Gericht einen Rückschlag erlitten. Das Bundesverwaltungsgericht lehnte einen Antrag auf einen Baustopp ab. Die Bauarbeiten können damit weitergehen.,https://images.tagesschau.de/image/034a7e56-5ddd-4760-9ecf-bd9284dc42f6/AAABipK0yhM/AAABibBxqrQ/16x9-1280/ndr-lng-terminal-auf-ruegen-100.jpg,2023-09-14T08:35:49Z,,"Stand: 14.09.2023 10:35 Uhr
Die Deutsche Umwelthilfe hat ihr Ziel verfehlt, einen Baustopp für das Rügener Flüssigerdgas-Terminal zu erwirken. Das Bundesverwaltungsgericht in Leipzig lehnte einen en… [+2107 chars]",,de,'LNG-Terminal'
https://www.zeit.de/news/2023-09/14/trotz-geringerem-verbrauch-energiekosten-steigen,https://www.zeit.de/news/2023-09/14/trotz-geringerem-verbrauch-energiekosten-steigen,0,www.zeit.de,Landesimmobilien: Trotz geringerem Verbrauch: Energiekosten steigen,,,2023-09-14T09:02:24Z,,"When browsing with ads:
We collect personal data and also transmit it to third-party providers
 that help us improve and finance our digital content. Some of the information stored on your device, … [+821 chars]",,de,'Energiekosten'
https://www.sueddeutsche.de/politik/mecklenburg-vorpommern-russland-klimastiftung-schwesig-sellering-1.6223729,https://www.sueddeutsche.de/politik/mecklenburg-vorpommern-russland-klimastiftung-schwesig-sellering-1.6223729,0,www.sueddeutsche.de,Mecklenburg-Vorpommern: Peinliches Erbe aus Russland,"Nach dem Stopp der Gas-Pipeline Nord Stream 2 wollte Manuela Schwesig die dazugehörige, russisch finanzierte Klimastiftung ihres Landes unbedingt loswerden. Doch die Folgen der Kooperation lassen sich nicht verdrängen.",https://www.sueddeutsche.de/image/sz.1.6225021/1200x675?v=1694687643,2023-09-14T10:34:08Z,,"Nach dem Stopp der Gas-Pipeline Nord Stream 2 wollte Manuela Schwesig die dazugehörige, russisch finanzierte Klimastiftung ihres Landes unbedingt loswerden. Doch die Folgen der Kooperation lassen sic… [+6569 chars]",,de,'Gazprom'
https://www.tagesspiegel.de/potsdam/landeshauptstadt/bock-auf-zukunft-festival-fur-klimaschutz-und-soziale-gerechtigkeit-im-potsdamer-landtag-10462804.html,https://www.tagesspiegel.de/potsdam/landeshauptstadt/bock-auf-zukunft-festival-fur-klimaschutz-und-soziale-gerechtigkeit-im-potsdamer-landtag-10462804.html,0,www.tagesspiegel.de,Für Klima und soziale Gerechtigkeit: Im Potsdamer Landtag findet das erste „Bock auf Zukunft“-Festival statt,"Kohleausstieg, Klimamythen und Klassismus: Beim ersten „Bock auf Zukunft“-Festival am 30. September wollen junge Menschen positive Visionen für Brandenburg entwickeln.",https://www.tagesspiegel.de/images/landtag-ladt-wieder-in-den-innenhof-ein2/alternates/BASE_16_9_W1400/landtag-laedt-wieder-in-den-innenhof-ein.jpeg,2023-09-14T10:41:01Z,,"Vorträge zum Moorschutz, Workshops über kostenlosen öffentlichen Nahverkehr und Livemusik vom Kama Orchestra: Am 30. September findet im Landtag Brandenburg das erste Bock auf Zukunft-Festival statt,… [+2622 chars]",,de,'Kohleausstieg'
https://www.nzz.ch/wirtschaft/das-ende-des-fossilen-zeitalters-ld.1756156,https://www.nzz.ch/wirtschaft/das-ende-des-fossilen-zeitalters-ld.1756156,0,www.nzz.ch,"Das Ende des fossilen Zeitalters beginne in Kürze, sagt die Internationale Energieagentur. Doch so einfach ist es nicht","Die Internationale Energieagentur geht davon aus, dass wegen der Klimapolitik die Nachfrage nach Öl, Gas und Kohle noch vor 2030 einen Höchststand erreichen wird. Zweifel sind angebracht.","https://img.nzz.ch/2023/09/14/d2326410-4c24-445b-b456-4dedc17c978b.jpeg?width=1200&height=675&fit=bound&quality=75&auto=webp&crop=1891,1064,x0,y0&wmark=nzz",2023-09-15T03:30:00Z,https://web.archive.org/web/20230915182450/https://www.nzz.ch/wirtschaft/das-ende-des-fossilen-zeitalters-ld.1756156,"Nicht nur Flugzeuge hinterlassen Spuren in der Atmosphäre: Das Verbrennen von Kohle, Erdöl und Erdgas führt zu Treibhausgasemissionen.
Es ist ein ungewöhnlicher Schritt der Internationalen Energieag… [+6815 chars]",,de,'Energieagentur'
https://www.diepresse.com/16213134/warum-baut-oesterreich-diese-pipeline-nicht,https://www.diepresse.com/16213134/warum-baut-oesterreich-diese-pipeline-nicht,0,www.diepresse.com,Warum baut Österreich diese Pipeline nicht? [premium],"Die Gasversorgung von morgen hängt nicht nur an der Suche nach neuen Lieferanten, sondern auch am Bau neuer Leitungen. Um das wichtigste Teilstück ist ein Streit entbrannt.",https://img.diepresse.com/public/incoming/oilthb-09.15-s15-Gas-Pipeline-WAG-LOOP-1-PW.gif/alternates/DPR_SOCIAL_MAGAZIN_PAID/09.15-s15-Gas-Pipeline-WAG-LOOP-1-PW.gif,2023-09-15T07:02:51Z,,"Die Gasversorgung von morgen hängt nicht nur an der Suche nach neuen Lieferanten, sondern auch am Bau neuer Leitungen. Um das wichtigste Teilstück ist ein Streit entbrannt.
Wien. Im Grunde ist die S… [+893 chars]",,de,'Gas Pipeline'
https://www.morgenpost.de/wirtschaft/article239414675/heizoelpreise-aktuell-preisentwicklung-heute-15-september-energie.html,https://www.morgenpost.de/wirtschaft/article239414675/heizoelpreise-aktuell-preisentwicklung-heute-15-september-energie.html,0,www.morgenpost.de,Heizen und Kosten: Heizölpreise aktuell: Der Preis pro Liter heute am 15.09.,"Die Heizölpreise sind Anfang September stark gestiegen. ○ Wie stehen die Chancen auf sinkende Preise? ○ Lesen Sie hier die aktuellen Heizölpreise von heute, am 15. September.",https://img.morgenpost.de/img/berlin/crop239253047/4912601048-w820-cv16_9-q85/Heizoel.jpg,2023-09-15T07:26:00Z,,Berlin. Mit den kalten Herbstmonaten steigt auch die Kaufbereitschaft für Heizöl. Angesichts der zuletzt stark gestiegenen Heizölpreise im September sind die Sparmöglichkeiten für Heizölkunden vor de… [+9604 chars],,de,'Heizöl'
https://www.stern.de/news/tuerkische-regierung-stellt-neues-erdgas-projekt-mit-russland-infrage-33828364.html,https://www.stern.de/news/tuerkische-regierung-stellt-neues-erdgas-projekt-mit-russland-infrage-33828364.html,0,www.stern.de,Türkische Regierung stellt neues Erdgas-Projekt mit Russland infrage,"Die türkische Regierung hat die geplante Einrichtung einer neuen Handelsplattform für russisches Erdgas infrage gestellt. ""Wir haben schon eine gut funktionierende und täglich genutzte Plattform für den Strom- und Gashandel"", sagte Energieminister Alparslan B…",https://image.stern.de/33828366/t/wf/v1/w1440/r1.7778/-/15--erdogan-und-putin-bei-einem-treffen---eb6f74271c6c315a.jpg,2023-09-15T08:46:18Z,,"Die türkische Regierung hat die geplante Einrichtung einer neuen Handelsplattform für russisches Erdgas infrage gestellt. ""Wir haben schon eine gut funktionierende und täglich genutzte Plattform für … [+1376 chars]",,de,'russisches Gas'
https://www.zeit.de/news/2023-09/15/kahl-lng-terminals-koennen-ziele-von-cyber-angriffen-sein,https://www.zeit.de/news/2023-09/15/kahl-lng-terminals-koennen-ziele-von-cyber-angriffen-sein,0,www.zeit.de,Digitalisierung: Kahl: LNG-Terminals können Ziele von Cyber-Angriffen sein,,,2023-09-15T11:52:26Z,,"When browsing with ads:
We collect personal data and also transmit it to third-party providers
 that help us improve and finance our digital content. Some of the information stored on your device, … [+821 chars]",,de,'LNG'
https://www.stern.de/gesellschaft/regional/baden-wuerttemberg/digitalisierung--kahl--lng-terminals-koennen-ziele-von-cyber-angriffen-sein-33829606.html,https://www.stern.de/gesellschaft/regional/baden-wuerttemberg/digitalisierung--kahl--lng-terminals-koennen-ziele-von-cyber-angriffen-sein-33829606.html,0,www.stern.de,Digitalisierung: Kahl: LNG-Terminals können Ziele von Cyber-Angriffen sein,"Der Präsident des Bundesnachrichtendienstes (BND), Bruno Kahl, warnt vor Cyber-Attacken auf die Terminals zur Einfuhr von verflüssigtem Erdgas (LNG). Es zeige sich seit dem russischen Angriff auf die Ukraine, dass sich der Krieg im Cyber-Raum internationalisi…",https://image.stern.de/33829608/t/OK/v1/w1440/r1.7778/-/15--urnnewsmldpacom2009010123091599206731v3w800h600l702t212r1690b1454jpeg---0cd52d630b536533.jpg,2023-09-15T11:52:26Z,,"Der Präsident des Bundesnachrichtendienstes (BND), Bruno Kahl, warnt vor Cyber-Attacken auf die Terminals zur Einfuhr von verflüssigtem Erdgas (LNG). Es zeige sich seit dem russischen Angriff auf die… [+1685 chars]",,de,'Gaslieferungen'
https://www.zeit.de/news/2023-09/15/bnd-chef-warnt-vor-cyber-angriffen-auf-lng-terminals,https://www.zeit.de/news/2023-09/15/bnd-chef-warnt-vor-cyber-angriffen-auf-lng-terminals,0,www.zeit.de,Sicherheit: BND-Chef warnt vor Cyber-Angriffen auf LNG-Terminals,,,2023-09-15T12:25:30Z,,"When browsing with ads:
We collect personal data and also transmit it to third-party providers
 that help us improve and finance our digital content. Some of the information stored on your device, … [+821 chars]",,de,'LNG'
https://www.diepresse.com/16414534/erste-russische-lng-lieferungen-an-china-durch-die-arktis,https://www.diepresse.com/16414534/erste-russische-lng-lieferungen-an-china-durch-die-arktis,0,www.diepresse.com,Erste russische LNG-Lieferungen an China durch die Arktis,Die nördliche Seeroute wurde wegen des Klimawandels nutzbar. Moskau hofft dadurch auf steigende Exporte.,https://img.diepresse.com/public/incoming/e1qs95-imago0072488098h.jpg/alternates/DPR_SOCIAL_NACHRICHTEN/imago0072488098h.jpg,2023-09-15T12:27:46Z,,"Die nördliche Seeroute wurde wegen des Klimawandels nutzbar. Moskau hofft dadurch auf steigende Exporte.
Der russische Gaskonzern Gazprom hat nach eigenen Angaben erstmals Flüssigerdgas (LNG) über d… [+1236 chars]",,de,'Russland Erdöl'
https://www.welt.de/wirtschaft/article247422592/Rezessions-Realitaet-Wie-es-mit-der-deutschen-Wirtschaft-weitergeht.html,https://www.welt.de/wirtschaft/article247422592/Rezessions-Realitaet-Wie-es-mit-der-deutschen-Wirtschaft-weitergeht.html,0,www.welt.de,Wie es mit der deutschen Wirtschaft weitergeht,"Hohe Energiepreise, überbordene Bürokratie, die anhaltende Inflation und chronischer Fachkräftemangel drücken auf die deutsche Wirtschaft. Wie es weitergehen soll und wie man sich vor der Rezession schützen kann, wollen unsere Finanz-Experten Anja Ettel und D…",https://img.welt.de/img/club/live-video-chat/mobile247466242/8451357777-ci16x9-w1200/Teaser-Generic-AE-DE-2209.jpg,2023-09-15T14:46:18Z,,Und so funktioniert die Teilnahme: Reichen Sie Ihre Frage einfach über das Kommentarfeld unten ein. Unser Moderationsteam wird Ihre Frage binnen weniger Minuten freigeben. Hinweis an die Nutzer der N… [+224 chars],,de,'Inflation'
https://www.nzz.ch/schweiz/albert-roesti-will-keine-debatte-ueber-neue-akw-diese-diskussion-ist-muessig-wenn-nicht-sogar-kontraproduktiv-ld.1756396,https://www.nzz.ch/schweiz/albert-roesti-will-keine-debatte-ueber-neue-akw-diese-diskussion-ist-muessig-wenn-nicht-sogar-kontraproduktiv-ld.1756396,0,www.nzz.ch,INTERVIEW - Albert Rösti will keine Debatte über neue AKW: «Diese Diskussion ist heute müssig – wenn nicht sogar kontraproduktiv»,"Der SVP-Energieminister erklärt, weshalb er zurzeit nicht über neue Atomkraftwerke reden will. Was seine Partei mehr freuen dürfte: Rösti sagt, ein Stromabkommen mit der EU sei nicht unbedingt nötig.","https://img.nzz.ch/2023/09/15/e9c10fc2-0433-4ec5-9192-a79b9701f643.jpeg?width=1200&height=675&fit=bound&quality=75&auto=webp&crop=2732,1537,x252,y1427&wmark=nzz",2023-09-15T14:59:00Z,,"«Ich bin und bleibe ein SVP-Mitglied, und das heisst: ein SVP-Bundesrat»: Albert Rösti, Umwelt-, Verkehrs- und Energieminister seit Anfang Jahr, im Korridor vor seinem Büro. 
Der Kanton Wallis hat i… [+14645 chars]",,de,'Energieminister'
https://www.nzz.ch/wirtschaft/russland-erneute-zinserhoehung-der-zentralbank-zur-inflationsbekaempfung-ld.1756457,https://www.nzz.ch/wirtschaft/russland-erneute-zinserhoehung-der-zentralbank-zur-inflationsbekaempfung-ld.1756457,0,www.nzz.ch,Leitzinserhöhung in Russland: Die Notenbank tritt auf die Bremse,Die russische Zentralbank hat erneut den Leitzins angehoben – auf jetzt 13 Prozent. Damit will sie vor allem die Inflation bekämpfen. Die Wirtschaft zeigt Anzeichen von Überhitzung.,"https://img.nzz.ch/2023/09/15/20554b11-0887-4d89-9f0b-bc536d92d993.jpeg?width=1200&height=674&fit=bound&quality=75&auto=webp&crop=4761,2675,x0,y85&wmark=nzz",2023-09-15T15:19:44Z,,"Russlands Präsidenten Wladimir Putin war die Freude anzusehen, als er am Freitag bei der Begrüssung seines regelmässigsten Gastes, des weissrussischen Machthabers Alexander Lukaschenko, von der soebe… [+278 chars]",,de,'Inflation'
https://www.jungewelt.de/artikel/459152.krise-wirtschaftliches-und-soziales-dilemma.html,https://www.jungewelt.de/artikel/459152.krise-wirtschaftliches-und-soziales-dilemma.html,0,www.jungewelt.de,Krise: Wirtschaftliches und soziales Dilemma [Online-Abo],"Für den Großteil der Bevölkerung ist Inflation Gift. Zinserhöhungen gleichen diesen Effekt in der Regel nicht aus, sondern verringern allenfalls den Kaufkraftverlust.",https://www.jungewelt.de/img/1100/185430.jpg,2023-09-15T17:42:15Z,,"Die Inflation im Euro-Raum bleibt hartnäckig. Im August schwächte sie sich nach ersten Schätzungen des EU-Statistikamtes Eurostat nicht weiter ab und verharrte bei 5,3 Prozent. Zuviel, sagt die Europ… [+273 chars]",,de,'Inflation'
https://www.n-tv.de/wirtschaft/Rezessionssorgen-lasten-auf-der-Wall-Street-article24400340.html,https://www.n-tv.de/wirtschaft/Rezessionssorgen-lasten-auf-der-Wall-Street-article24400340.html,0,www.n-tv.de,Rote Vorzeichen zum Wochenende: Rezessionssorgen lasten auf der Wall Street,In mehreren US-Autowerken hat die Belegschaft die Arbeit niedergelegt. Einige Experten befürchten Auswirkungen auf die Inflation und damit auf die Gesamtwirtschaft. Andere halten die Folgen für überschaubar. Zusammen mit Konjunkturdaten ohne klare Richtung ge…,https://bilder2.n-tv.de/img/incoming/crop24400341/7011329646-cImg_16_9-w1200/2023-09-01T100033Z-1079119400-RC2LZ2AMFZRM-RTRMADP-3-USA-STOCKS-WEEKAHEAD.jpg,2023-09-15T20:36:08Z,,In mehreren US-Autowerken hat die Belegschaft die Arbeit niedergelegt. Einige Experten befürchten Auswirkungen auf die Inflation und damit auf die Gesamtwirtschaft. Andere halten die Folgen für übers… [+4942 chars],,de,'Inflation'
https://www.morgenpost.de/wirtschaft/article239570169/heizung-waermepumpe-studie-gasheizung-temperatur-wetter.html,https://www.morgenpost.de/wirtschaft/article239570169/heizung-waermepumpe-studie-gasheizung-temperatur-wetter.html,0,www.morgenpost.de,Überraschende Studie: Wärmepumpen bei Kälte effizienter als Öl- und Gasheizungen,Besser als ihr Ruf? Daten von Wärmepumpen in Nordeuropa zeigen: Bei kaltem Wetter sind sie doppelt so effizient wie Öl- und Gasgeräte.,https://img.morgenpost.de/img/frontpage/crop237175143/0782602175-w820-cv16_9-q85/Waermepumpen-Symbolbild-sind-gerade-in-Neubauten-ein-beliebtes-Heizsystem.jpg,2023-09-16T06:28:43Z,,"Berlin. Es ist paradox, aber Fakt: Die in diesem Jahr bislang meistverkauften Heizungen in Deutschland basieren auf Gas auf einen fossilen Brennstoff. Dabei empfiehlt die Ampel-Regierung den Kauf und… [+5945 chars]",,de,'Gasheizung'
https://www.zeit.de/news/2023-09/16/1860-muenchen-verliert-nach-blackout-gegen-ex-coach-koellner,https://www.zeit.de/news/2023-09/16/1860-muenchen-verliert-nach-blackout-gegen-ex-coach-koellner,0,www.zeit.de,3. Liga: 1860 München verliert nach Blackout gegen Ex-Coach Köllner,,,2023-09-16T16:34:10Z,,"When browsing with ads:
We collect personal data and also transmit it to third-party providers
 that help us improve and finance our digital content. Some of the information stored on your device, … [+821 chars]",,de,'Blackout'
https://www.nzz.ch/nzzas/nzz-am-sonntag/energiestrategie-fdp-chef-thierry-burkart-will-neue-akw-ld.1756600,https://www.nzz.ch/nzzas/nzz-am-sonntag/energiestrategie-fdp-chef-thierry-burkart-will-neue-akw-ld.1756600,0,www.nzz.ch,«Die aktuelle Energiestrategie ist zum Scheitern verurteilt»: FDP-Chef Thierry Burkart will neue AKW,"FDP-Präsident Thierry Burkart geht in die Offensive: Seine Partei will den Bundesrat zwingen, die Energiestrategie zu überarbeiten. Es müsse zudem möglich sein, an den bisherigen Standorten neue AKW zu bauen.","https://img.nzz.ch/2023/09/16/37023742-8751-43c5-b9fc-78e96df17784.jpeg?width=1200&height=674&fit=bound&quality=75&auto=webp&crop=5000,2809,x0,y939&wmark=nzz",2023-09-16T19:45:00Z,,"Lanciert die Atom-Debatte neu: Thierry Burkart, Aargauer Ständerat und FDP-Präsident. (Bern, 13. September 2023)
Es war ein energiepolitisches Ausrufezeichen des Walliser Stimmvolkes: Vor einer Woch… [+5556 chars]",,de,'Blackout'
https://www.n-tv.de/politik/04-30-Gaskunden-droht-zum-Januar-Preissprung--article23143824.html,https://www.n-tv.de/politik/04-30-Gaskunden-droht-zum-Januar-Preissprung--article23143824.html,0,www.n-tv.de,Ukraine-Krieg im Liveticker: +++ 04:30 Gaskunden droht zum Januar Preissprung +++,Lesen Sie alle aktuellen Entwicklungen und Nachrichten über den russischen Angriffskrieg auf die Ukraine im Liveticker von ntv.de.,https://bilder2.n-tv.de/img/incoming/crop23332537/9041326157-cImg_16_9-w1200/Liveticker1-grau-1-Kopie.jpg,2023-09-16T22:22:00Z,,Gaskunden müssen sich zum Jahreswechsel womöglich auf höhere Preise einstellen. Der Grund: Früher als erwartet will das Finanzministerium auf Erdgas wieder eine höhere Mehrwertsteuer ansetzen. Wegen … [+4887 chars],,de,'Krieg Gas'
https://www.faz.net/aktuell/politik/ausland/tausende-protestieren-in-prag-gegen-tschechische-regierung-19179733.html,https://www.faz.net/aktuell/politik/ausland/tausende-protestieren-in-prag-gegen-tschechische-regierung-19179733.html,0,www.faz.net,Tausende protestieren in Prag gegen tschechische Regierung,"Tausende Menschen fordern in Prag den Rücktritt der Mitte-Rechts-Regierung von Ministerpräsident Fiala. Angeführt von der Protestpartei Pro, kritisieren sie die Unterstützung für die Ukraine und die hohe Inflation.",https://media1.faz.net/ppmedia/aktuell/politik/2674213643/1.9179751/facebook_teaser/unter-dem-slogan-tschechien.jpg,2023-09-17T00:55:27Z,https://web.archive.org/web/20230917012202/https://www.faz.net/aktuell/politik/ausland/tausende-protestieren-in-prag-gegen-tschechische-regierung-19179733.html,"Mehrere Tausend Menschen haben am Samstag in Prag gegen die Mitte-Rechts-Regierung von Petr Fiala demonstriert. Sie warfen der tschechischen Regierung unter anderem vor, sich mehr um den Ukrainekrieg… [+1239 chars]",,de,'Inflation'
https://www.stern.de/news/energie--gas--steuersenkung-koennte-frueher-auslaufen--33833016.html,https://www.stern.de/news/energie--gas--steuersenkung-koennte-frueher-auslaufen--33833016.html,0,www.stern.de,Energie: Gas: Steuersenkung könnte früher auslaufen,"Nach dem russischen Angriff auf die Ukraine schnellten die Gaspreise in die Höhe. Inzwischen hat sich die Lage etwas entspannt. Zeit, staatliche Hilfen zu beenden und den Kunden mehr aufzubürden?",https://image.stern.de/33833018/t/WX/v2/w1440/r1.7778/-/17--urnnewsmldpacom2009010123091799223711v2w800h600l741t464r2497b1646jpeg---29e7b4a03efc38bc.jpg,2023-09-17T06:36:45Z,,"Nach dem russischen Angriff auf die Ukraine schnellten die Gaspreise in die Höhe. Inzwischen hat sich die Lage etwas entspannt. Zeit, staatliche Hilfen zu beenden und den Kunden mehr aufzubürden?
Ga… [+4784 chars]",,de,'Gas Ukraine'
https://www.handelsblatt.com/unternehmen/energie/gaspreis-verbrauchern-droht-zum-jahreswechsel-zweistelliger-preissprung/29395470.html,https://www.handelsblatt.com/unternehmen/energie/gaspreis-verbrauchern-droht-zum-jahreswechsel-zweistelliger-preissprung/29395470.html,0,www.handelsblatt.com,Energieversorgung: Verbrauchern droht zum Jahreswechsel zweistelliger Sprung beim Gaspreis,Nach Ausbruch des Ukraine-Kriegs schnellten die Gaspreise in die Höhe. Inzwischen hat sich die Lage etwas entspannt. Nun aber steht das vorzeitige Ende der steuerlichen Begünstigung im Raum.,https://www.handelsblatt.com/images/gasflamme/29395486/2-format2003.jpg,2023-09-17T08:36:51Z,,Berlin Gaskunden müssen sich zum Jahreswechsel womöglich wieder auf höhere Preise einstellen. Der Grund: Früher als erwartet will das Finanzministerium auf Erdgas wieder eine höhere Mehrwertsteuer an… [+5100 chars],,de,'Krieg Gas'
https://www.morgenpost.de/politik/article239595545/gaspreise-energie-heizen-verbraucher-kosten-anstieg.html,https://www.morgenpost.de/politik/article239595545/gaspreise-energie-heizen-verbraucher-kosten-anstieg.html,0,www.morgenpost.de,Ab dem Jahreswechsel: Höherer Steuersatz: Gaspreise könnten wieder ansteigen,Als Reaktion auf die Energiekrise hatte die Bundesregierung die Mehrwertsteuer auf Gas gesenkt. Das damit könnte jetzt Schluss sein.,https://img.morgenpost.de/img/incoming/crop239595551/9812605376-w820-cv16_9-q85/5FAE5000AE8F2111.jpg,2023-09-17T10:24:38Z,,"Berlin. Haushalte, die mit Gas heizen, müssen zum Jahreswechsel möglicherweise mit höheren Preisen rechnen. Denn: Das Finanzministerium will früher als erwartet wieder eine höhere Mehrwertsteuer auf … [+5098 chars]",,de,'Gaspreis'
https://www.morgenpost.de/ratgeber/article239588079/heizung-altbau-waermepumpe-thermondo-daten-sanierung.html,https://www.morgenpost.de/ratgeber/article239588079/heizung-altbau-waermepumpe-thermondo-daten-sanierung.html,0,www.morgenpost.de,Installateur nennt Zahlen: Heizung im Altbau – reicht eine Wärmepumpe? Analyse erstaunt,Eine Wärmepumpe statt klassischer Heizung im Altbau? Laut einem Installateur sind dafür keine aufwändigeren Sanierungen notwendig.,https://img.morgenpost.de/img/incoming/crop239590757/4672601437-w820-cv16_9-q85/Umfrage-von-thermondo-zu-Waermepumpe-im-Altbau.jpg,2023-09-17T14:54:02Z,,Berlin. Es war ein zähes Hin und Her doch am Ende hat der Bundestag das Heizungsgesetz gebilligt. Nun muss es noch vom Bundesrat bestätigt werden. Schon Anfang 2024 könnte die Novelle für das Gebäude… [+7124 chars],,de,'Wärmepumpe'
https://www.faz.net/aktuell/rhein-main/frankfurt/ukrainische-medizinstudenten-ueben-in-frankfurter-summer-school-19166532.html,https://www.faz.net/aktuell/rhein-main/frankfurt/ukrainische-medizinstudenten-ueben-in-frankfurter-summer-school-19166532.html,0,www.faz.net,Summer School für Ukrainer: Praxis für geflüchtete Medizinstudenten,Geflüchteten Medizinstudenten aus der Ukraine fehlt es an praktischer Erfahrung. In einer Summer School des Frankfurter Uniklinikums wird deshalb mit Notfallszenarien geübt.,https://media1.faz.net/ppmedia/aktuell/401083379/1.9166527/facebook_teaser/simulant-im-krankenbett.jpg,2023-09-17T17:48:37Z,,"Der Patient im Krankenbett stöhnt. Können Sie mich hören?, fragt die Ärztin. Der Patient stöhnt noch einmal, scheint nicht antworten zu können. Der Blutdruck fällt, ruft ein Arzt und schaut auf den M… [+2887 chars]",,de,'Notfallszenarien'
