index,url,valid,domain,title,description,image,published,archive,content,quote,language,keyword
https://www.jungewelt.de/artikel/477395.schiedsgerichtsverfahren-schiedsspruch-gegen-gasprom.html,https://www.jungewelt.de/artikel/477395.schiedsgerichtsverfahren-schiedsspruch-gegen-gasprom.html,0,www.jungewelt.de,Schiedsgerichtsverfahren: Schiedsspruch gegen Gasprom [Online-Abo],Ein Schiedsgericht in Stockholm spricht dem verstaatlichtem Düsseldorfer Energiekonzern 13 Milliarden Euro Schadenersatz zu. Uniper macht Mehrkosten durch ausbleibende Gaslieferungen geltend.,https://www.jungewelt.de/img/1100/196104.jpg,2024-06-14T17:35:47Z,,"Uneingeschränkter Zugriff auf alle Inhalte: Erleben Sie die Tageszeitung junge Welt in gedruckter oder digitaler Form oder beides kombiniert.
Nachrichtenauswahl und -aufbereitung erfordern finanziel… [+458 chars]",,de,'Gaslieferungen'
https://www.n-tv.de/politik/23-07-Russland-meldet-Angriff-auf-Gas-Umschlagplatz-in-Kursk--article25016358.html,https://www.n-tv.de/politik/23-07-Russland-meldet-Angriff-auf-Gas-Umschlagplatz-in-Kursk--article25016358.html,0,www.n-tv.de,Ukraine-Krieg im Liveticker: +++ 23:07 Russland meldet Angriff auf Gas-Umschlagplatz in Kursk +++,Lesen Sie alle aktuellen Entwicklungen und Nachrichten über den russischen Angriffskrieg auf die Ukraine im Liveticker von ntv.de.,https://bilder2.n-tv.de/img/incoming/crop23332537/9041326157-cImg_16_9-w1200/Liveticker1-grau-1-Kopie.jpg,2024-06-14T18:30:00Z,,"Die Ukraine beschießt nach russischen Angaben einen Umschlagplatz für russische Gasexporte in Russland. Der Gouverneur der Region Kursk, Alexej Smirnow, teilt auf Telegram mit, die Ukraine habe mehre… [+42357 chars]",,de,'Gas Ukraine'
https://www.telepolis.de/features/Ukraine-Krieg-Massive-Probleme-der-Energieversorgung-bedrohen-Verteidigung-9764595.html,https://www.telepolis.de/features/Ukraine-Krieg-Massive-Probleme-der-Energieversorgung-bedrohen-Verteidigung-9764595.html,0,www.telepolis.de,Ukraine-Krieg: Massive Probleme der Energieversorgung bedrohen Verteidigung,Ukrainische Rüstungsbetriebe und lebenswichtige Infrastrukturen am Limit. Strategische Luftkampagne Russlands eskaliert. Patriots sind nur Tropfen auf den heißen Stein. Eine Einschätzung.,https://heise.cloudimg.io/bound/1200x1200/q85.png-lossy-85.webp-lossy-85.foil1/_www-heise-de_/imgs/18/4/6/1/4/6/0/3/Master_Ukraine-Krieg-992824b1d264fa86.jpeg,2024-06-15T08:00:00Z,,"Archivbild (Lviv, Ukraine, April 2022, nach einem russischen Angriff): Sodel Vladyslav / Shutterstock
Ukrainische Rüstungsbetriebe und lebenswichtige Infrastrukturen am Limit. Strategische Luftkampa… [+9808 chars]",,de,'Rakete Kraftwerk'
https://www.tagesspiegel.de/internationales/teilnehmerstaaten-fordern-schutz-von-besetztem-akw-und-ungehinderte-getreideexporte-11837534.html,https://www.tagesspiegel.de/internationales/teilnehmerstaaten-fordern-schutz-von-besetztem-akw-und-ungehinderte-getreideexporte-11837534.html,0,www.tagesspiegel.de,Uneinigkeit bei Ukraine-Friedensgipfel: Teilnehmerstaaten beschließen Schutz von besetztem AKW und ungehinderte Getreideexporte,"Die Abschlusserklärung zum Ukraine-Friedensgipfel in der Schweiz sei vollständig und „ausgewogen“, berichtet Kuleba. Allerdings haben sie nur 80 von 93 Teilnehmerstaaten gebilligt.",https://www.tagesspiegel.de/images/schweizer-friedenskonferenz6/alternates/BASE_16_9_W1400/schweizer-friedenskonferenz.jpeg,2024-06-15T18:43:32Z,,Die Abschlusserklärung des Friedensgipfels in der Schweiz wird nicht von allen Teilnehmerstaaten mitgetragen. Nach einer am Sonntag veröffentlichten Aufstellung der Schweizer Gastgeber wurde das Doku… [+8351 chars],,de,'Akw'
https://www.morgenpost.de/wirtschaft/article242586044/Waermepumpe-statt-Gas-Berechnung-zeigt-das-volle-Potenzial.html,https://www.morgenpost.de/wirtschaft/article242586044/Waermepumpe-statt-Gas-Berechnung-zeigt-das-volle-Potenzial.html,0,www.morgenpost.de,Wärmepumpe statt Gas: Berechnung zeigt das volle Potenzial,"Wer mit Wärmepumpe statt Gas heizt, hat Kostenvorteile – selbst mit wenig effektiven Geräten. Wie viel Verbraucher wirklich sparen.",https://img.sparknews.funkemedien.de/241668442/241668442_1707836946_v16_9_1600.jpeg,2024-06-15T19:00:17Z,,"Berlin. Wer mit Wärmepumpe statt Gas heizt, hat Kostenvorteile selbst mit wenig effektiven Geräten. Wie viel Verbraucher wirklich sparen.
Verbraucher, die mit einer Wärmepumpe statt mit Gas heizen, … [+5555 chars]",,de,'Gas sparen'
https://www.n-tv.de/wirtschaft/Effiziente-Waermepumpe-heizt-fast-40-Prozent-guenstiger-als-Gas-article25017623.html,https://www.n-tv.de/wirtschaft/Effiziente-Waermepumpe-heizt-fast-40-Prozent-guenstiger-als-Gas-article25017623.html,0,www.n-tv.de,Wegen steigender Energiepreise: Effiziente Wärmepumpe heizt fast 40 Prozent günstiger als Gas,"Wärmepumpen kosten mehr als Gasheizungen - allerdings nur in der Anschaffung. Im laufenden Betrieb kommen Haushalte, die mit Wärmepumpe heizen, deutlich günstiger weg, wie eine Analyse zeigt. Grund sind die Preissteigerungen beim Gas.",https://bilder3.n-tv.de/img/incoming/crop25017622/8031325157-cImg_16_9-w1200/imago0471406822h.jpg,2024-06-16T01:16:26Z,,"Wärmepumpen kosten mehr als Gasheizungen - allerdings nur in der Anschaffung. Im laufenden Betrieb kommen Haushalte, die mit Wärmepumpe heizen, deutlich günstiger weg, wie eine Analyse zeigt. Grund s… [+2889 chars]",,de,'Energiepreise'
https://www.n-tv.de/politik/Russland-hat-so-viele-Kraftwerke-in-der-Ukraine-zerstoert-dass-die-Haelfte-der-Stromproduktion-ausgefallen-ist-Fuer-den-Winter-sollen-Frankenstein-Einheiten-helfen-article25015701.html,https://www.n-tv.de/politik/Russland-hat-so-viele-Kraftwerke-in-der-Ukraine-zerstoert-dass-die-Haelfte-der-Stromproduktion-ausgefallen-ist-Fuer-den-Winter-sollen-Frankenstein-Einheiten-helfen-article25015701.html,0,www.n-tv.de,"Stromnot durch russische Raketen: Für den Winter baut die Ukraine ""Frankenstein-Einheiten""","Russland hat so viele Kraftwerke in der Ukraine zerstört, dass die Hälfte der Stromproduktion ausgefallen ist. Das ist schon jetzt schwierig, im Sommer - im Winter könnte es katastrophal werden. Deshalb muss improvisiert werden.",https://bilder4.n-tv.de/img/incoming/crop25015807/6391328407-cImg_16_9-w1200/460776070.jpg,2024-06-16T06:32:44Z,,"Russland hat so viele Kraftwerke in der Ukraine zerstört, dass die Hälfte der Stromproduktion ausgefallen ist. Das ist schon jetzt schwierig, im Sommer - im Winter könnte es katastrophal werden. Dmyt… [+12368 chars]",,de,'Winter Gas'
https://www.diepresse.com/18571769/ukraine-friedenskonferenz-entwurf-fuer-abschlusserklaerung-macht-russland-fuer-krieg-verantwortlich,https://www.diepresse.com/18571769/ukraine-friedenskonferenz-entwurf-fuer-abschlusserklaerung-macht-russland-fuer-krieg-verantwortlich,0,www.diepresse.com,Ukraine-Friedenskonferenz: Entwurf für Abschlusserklärung macht Russland für Krieg verantwortlich,"Am Sonntag wird eine gemeinsame Abschlusserklärung des Gipfels in der Schweiz erwartet. Eine Folgekonferenz, an der auch Russland teilnimmt, soll beschlossen werden. Saudiarabien und die Türkei gelten als mögliche Gastgeber.",https://img.diepresse.com/public/incoming/w1233f-UKRAINE-CRISISSUMMIT/alternates/DPR_SOCIAL_NACHRICHTEN/UKRAINE-CRISISSUMMIT,2024-06-16T07:01:46Z,,"Am Sonntag wird eine gemeinsame Abschlusserklärung des Gipfels in der Schweiz erwartet. Eine Folgekonferenz, an der auch Russland teilnimmt, soll beschlossen werden. Saudiarabien und die Türkei gelte… [+3974 chars]",,de,'Gas Ukraine'
https://www.diepresse.com/18571769/ukraine-gipfel-kanzler-nehammer-erwartet-keine-einstimmige-unterstuetzung-fuer-gipfel-erklaerung,https://www.diepresse.com/18571769/ukraine-gipfel-kanzler-nehammer-erwartet-keine-einstimmige-unterstuetzung-fuer-gipfel-erklaerung,0,www.diepresse.com,Ukraine-Gipfel: Kanzler Nehammer erwartet keine einstimmige Unterstützung für Gipfel-Erklärung,"Am Sonntag wird eine gemeinsame Abschlusserklärung des Gipfels in der Schweiz erwartet. Eine Folgekonferenz, an der auch Russland teilnimmt, soll beschlossen werden. Saudiarabien und die Türkei gelten als mögliche Gastgeber.",https://img.diepresse.com/public/incoming/w1233f-UKRAINE-CRISISSUMMIT/alternates/DPR_SOCIAL_NACHRICHTEN/UKRAINE-CRISISSUMMIT,2024-06-16T10:35:08Z,,"Am Sonntag wird eine gemeinsame Abschlusserklärung des Gipfels in der Schweiz erwartet. Eine Folgekonferenz, an der auch Russland teilnimmt, soll beschlossen werden. Saudiarabien und die Türkei gelte… [+4681 chars]",,de,'Gas Ukraine'
https://taz.de/Kommentar/!6014383/,https://taz.de/Kommentar/!6014383/,0,taz.de,"Kommentar: EZB? Nein, Habeck war's!","Inflation: Die Europäische Zentralbank schmückt sich mit fremden Federn. Dem Wirtschaftsminister ist zu verdanken, dass die Inflation wieder sinkt.",https://taz.de/picture/7065071/948/355058801-1.jpeg,2024-06-16T13:00:00Z,,"Inflation: Die Europäische Zentralbank schmückt sich mit fremden Federn. Dem Wirtschaftsminister ist zu verdanken, dass die Inflation wieder sinkt.
EZB-Chefin Christine Lagarde lobt sich selbst für … [+6062 chars]",,de,'Inflation'
https://www.zeit.de/politik/ausland/2024-06/stimmung-usa-wirtschaft-arbeitsmarkt-inflation-joe-biden,https://www.zeit.de/politik/ausland/2024-06/stimmung-usa-wirtschaft-arbeitsmarkt-inflation-joe-biden,0,www.zeit.de,Stimmungslage in den USA: Wenn nur die Schulden nicht wären,"Die Wirtschaft wächst, der Arbeitsmarkt läuft, die Inflation geht zurück – und doch sehen viele US-Amerikaner ihr Land in der Krise. Mit Ideologie hat das weniger zu tun.",https://img.zeit.de/politik/ausland/2024-06/stimmung-usa-wirtschaft-arbeitsmarkt-inflation-joe-biden-bild/wide__1300x731,2024-06-17T03:57:48Z,,"Es ist ein Rätsel, das inzwischen ein Heer von Expertinnen und Experten beschäftigt, von Ökonomen über Journalistinnen bis zu TikTokern. Gemessen an so gut wie allen üblichen Daten geht es den USA wu… [+590 chars]",,de,'Inflation'
https://www.tagesspiegel.de/internationales/tschernobyl-und-der-ukraine-krieg-so-riskant-ist-das-fruhere-kernkraftwerk-fur-europa-11828480.html,https://www.tagesspiegel.de/internationales/tschernobyl-und-der-ukraine-krieg-so-riskant-ist-das-fruhere-kernkraftwerk-fur-europa-11828480.html,0,www.tagesspiegel.de,Tschernobyl und der Ukraine-Krieg: So riskant ist das frühere Kernkraftwerk für Europa,"Zwei Jahre nach dem Abzug der russischen Besatzer aus der Sperrzone um das frühere AKW Tschernobyl ist die Sicherheitslage angespannt. Auch, weil Moskau eine Gefahr bleibt.",https://www.tagesspiegel.de/images/kyiv-region-ukraine-april-28-2022-the-new-safe-confinement-seals-off-the-object-shelter-also-known-as-the-sarcoph/alternates/BASE_16_9_W1400/kyiv-region-ukraine---april-28-2022---the-new-safe-confinement-seals-off-the-object-shelter-also-known-as-the-sarcoph.jpeg,2024-06-17T06:06:40Z,,"Zwei Jahre nach dem Abzug der russischen Besatzer aus der Sperrzone um das frühere AKW Tschernobyl ist die Sicherheitslage angespannt. Auch, weil Moskau eine Gefahr bleibt.
 Von Christian-Zsolt Varg… [+18 chars]",,de,'Akw'
https://www.tagesschau.de/ausland/europa/ukraine-strom-mangel-100.html,https://www.tagesschau.de/ausland/europa/ukraine-strom-mangel-100.html,0,www.tagesschau.de,Russische Angriffe sorgen für Strommangel in der Ukraine,Der Ukraine stehen drastische Einschränkungen bei der Stromversorgung bevor. Durch russische Angriffe auf die Energieinfrastruktur muss sich die Bevölkerung auf bis zu zwölf Stunden am Tag ohne Strom einstellen.,https://images.tagesschau.de/image/9dff4cad-247a-4dbc-8776-9f1a1c9f3369/AAABkCZZ7B8/AAABjwnlFvA/16x9-1280/stromversorgung-ukraine-102.jpg,2024-06-17T13:57:20Z,,"Stand: 17.06.2024 15:57 Uhr
Der Ukraine stehen drastische Einschränkungen bei der Stromversorgung bevor. Durch russische Angriffe auf die Energieinfrastruktur muss sich die Bevölkerung auf bis zu zw… [+1865 chars]",,de,'Stromversorgung'
https://www.sueddeutsche.de/wirtschaft/wirtschaftspolitik-wirtschaftsstandort-deutschland-wirtschaftsstandort-usa-lux.3UVyQrUERDkhjBQ98vFZWi,https://www.sueddeutsche.de/wirtschaft/wirtschaftspolitik-wirtschaftsstandort-deutschland-wirtschaftsstandort-usa-lux.3UVyQrUERDkhjBQ98vFZWi,0,www.sueddeutsche.de,Wirtschaftsstandort: Wie die Energiekosten dem Standort schaden,"Eine Studie zeigt, wie US-Firmen in Deutschland und deutsche Firmen in den USA den jeweiligen Wirtschaftsstandort sehen. Das Ergebnis eindeutig – vor allem ein Faktor ragt heraus.",https://www.sueddeutsche.de/2024/06/17/efb31a0f-780c-48d7-8025-df51a81cd43a.jpeg?q=60&fm=webp&width=1200&rect=0%2C55%2C2934%2C1651,2024-06-17T14:22:39Z,,"Eine Studie zeigt, wie US-Firmen in Deutschland und deutsche Firmen in den USA den jeweiligen Wirtschaftsstandort sehen. Das Ergebnis eindeutig vor allem ein Faktor ragt heraus.Im Grunde bedarf es ni… [+843 chars]",,de,'Energiekosten'
https://www.focus.de/earth/analyse/neue-konkurrenz-der-irre-grund-aus-dem-frankreich-und-spanien-jetzt-ihre-akws-abschalten_id_260057969.html,https://www.focus.de/earth/analyse/neue-konkurrenz-der-irre-grund-aus-dem-frankreich-und-spanien-jetzt-ihre-akws-abschalten_id_260057969.html,0,www.focus.de,"Neue Konkurrenz - Der irre Grund, aus dem Frankreich und Spanien jetzt ihre AKWs abschalten","Sie sind renoviert und rentabel, trotzdem musste der staatliche französische Energieversorger EDF zuletzt immer wieder eine Reihe von Atomkraftwerken abschalten. Die Ursache liegt in neuer Konkurrenz - und einer noch nicht behobenen Unzulänglichkeit der Energ…",https://p6.focus.de/img/fotos/id_260058417/gettyimages-1246584721.jpg?im=Crop%3D%280%2C159%2C3462%2C1733%29%3BResize%3D%281200%2C627%29&impolicy=perceptual&quality=mediumHigh&hash=2640febcf39dd2445f6d8f2ddbebca6bf193acf0e26c1a46610822ffea848140,2024-06-18T06:44:16Z,,"Sie sind renoviert und rentabel, trotzdem musste der staatliche französische Energieversorger EDF zuletzt immer wieder eine Reihe von Atomkraftwerken abschalten. Die Ursache liegt in neuer Konkurrenz… [+5448 chars]",,de,'AKW'
https://www.n-tv.de/politik/Scholz-verspricht-den-Deutschen-bezahlbare-Energieversorgung-article25024947.html,https://www.n-tv.de/politik/Scholz-verspricht-den-Deutschen-bezahlbare-Energieversorgung-article25024947.html,0,www.n-tv.de,"Für Bürger und Unternehmen: Scholz verspricht den Deutschen ""bezahlbare Energieversorgung""","Ostdeutschland soll in der Zukunft besonders von der Transformation zur Klimaneutralität hin profitieren, so Bundeskanzler Scholz. Gleichzeitig verspricht er nach einem Treffen mit den Ministerpräsidenten der ostdeutschen Länder eine Reform der Netzentgelte.",https://bilder1.n-tv.de/img/incoming/crop25024908/3161321905-cImg_16_9-w1200/468528757.jpg,2024-06-18T18:20:58Z,,"Ostdeutschland soll in der Zukunft besonders von der Transformation zur Klimaneutralität hin profitieren, so Bundeskanzler Scholz. Gleichzeitig verspricht er nach einem Treffen mit den Ministerpräsid… [+3163 chars]",,de,'Energieversorgung'
https://t3n.de/news/mini-akw-von-terrapower-so-funktioniert-das-atomkraftwerk-auf-das-bill-gates-setzt-1630803/,https://t3n.de/news/mini-akw-von-terrapower-so-funktioniert-das-atomkraftwerk-auf-das-bill-gates-setzt-1630803/,0,t3n.de,"Mini-AKW von Terrapower: So funktioniert das Atomkraftwerk, auf das Bill Gates setzt","Was hat es mit dem neuen Kernkraftwerk auf sich, bei dessen Baubeginn Bill Gates persönlich zur Schaufel griff? Die wichtigsten Fragen und Antworten rund um Natrium-Reaktoren und Terrapower.weiterlesen auf t3n.de",https://t3n.de/news/wp-content/uploads/2021/11/natrium-reactor-teaser.jpg,2024-06-19T06:15:45Z,,"Warum unterstützt Bill Gates den Bau eines neuen Kernkraftwerks?
Neue Designs für Kernkraftwerke versprechen, diese Energiequelle sicherer und kostengünstiger zu machen. Dazu gehören die Spaltreakti… [+6536 chars]",,de,'Akw'
https://stadt-bremerhaven.de/ecoflow-hausspeichersystem-powerocean-plus-strategische-partnerschaft-mit-tibber/,https://stadt-bremerhaven.de/ecoflow-hausspeichersystem-powerocean-plus-strategische-partnerschaft-mit-tibber/,0,stadt-bremerhaven.de,EcoFlow: Hausspeichersystem PowerOcean Plus & Strategische Partnerschaft mit Tibber,"Im Rahmen der Intersolar hat EcoFlow, Hersteller für Strom-, Speicher- sowie Solarlösungen, neue (Ökosystem-) Produkte sowie Partnerschaften verlauten lassen. Ganz konkret haben diese gemein, dass es ums Einsparen von Energie sowie Energiekosten geht. Mit Tib…",https://stadt-bremerhaven.de/wp-content/uploads/2024/06/Unbenannt.jpg,2024-06-19T06:59:36Z,,"Im Rahmen der Intersolar hat EcoFlow, Hersteller für Strom-, Speicher- sowie Solarlösungen, neue (Ökosystem-) Produkte sowie Partnerschaften verlauten lassen. Ganz konkret haben diese gemein, dass es… [+2241 chars]",,de,'Energiekosten'
https://www.diepresse.com/18583507/appell-an-tuerkis-gruen-milliarden-strafzahlungen-duerfen-die-parteien-nicht-kalt-lassen,https://www.diepresse.com/18583507/appell-an-tuerkis-gruen-milliarden-strafzahlungen-duerfen-die-parteien-nicht-kalt-lassen,0,www.diepresse.com,Appell an Türkis-Grün: „Milliarden-Strafzahlungen dürfen die Parteien nicht kalt lassen“,"Wenn sich Bauern und NGOs zusammentun, geht es um das Erneuerbare-Gas-Gesetz: Gefordert wird, dass das Parlament es vor der Sommerpause beschließt. Sonst drohe der Ruin von über 200 Betreibern und das Weiterbestehen einer „gigantischen Abhängigkeit von russis…",https://img.diepresse.com/public/incoming/l8lrbt-imago-images-0411672647/alternates/DPR_SOCIAL_NACHRICHTEN/imago%20images%200411672647,2024-06-19T11:47:33Z,,"Wenn sich Bauern und NGOs zusammentun, geht es um das Erneuerbare-Gas-Gesetz: Gefordert wird, dass das Parlament es vor der Sommerpause beschließt. Sonst drohe der Ruin von über 200 Betreibern und da… [+4003 chars]",,de,'Gasnetz'
https://steiermark.orf.at/stories/3261846/,https://steiermark.orf.at/stories/3261846/,0,steiermark.orf.at,Ungewöhnliche Allianz appelliert an Parlament,"Das Parlament möge sich noch vor der Sommerpause auf das Erneuerbares Gas-Gesetz einigen – dieser gemeinsame Appell erging am Mittwoch in Graz von der Landwirtschaftskammer, den Anlagenbetreibern, der Umweltschutzorganisation Global 2000 und der Austrian Gas …",https://ibs.orf.at/stm?image=https%3A%2F%2Foekastatic.orf.at%2Fmims%2F2023%2F34%2F27%2Fcrops%2Fw%3D1200%2Ch%3D627%2Cq%3D75%2F1911008_master_717027_010fe02e-6796-44f8-b5c0-aa82c4e09e38.jpg%3Fs%3D25315a81fa794d6b2b18cdbad98890c105b2ad4b,2024-06-19T14:31:00Z,,Für den steirischen Landwirtschaftskammerpräsident Franz Titschenbacher sprächen alle Fakten für das Gesetz: Es müsste normalerweise schon längst unter Dach und Fach sein. Doch seit Monaten spießt es… [+3383 chars],,de,'Gas Erneuerbare'
https://www.diepresse.com/18584522/oesterreich-verbietet-exekution-von-gazprom-geldern-nicht,https://www.diepresse.com/18584522/oesterreich-verbietet-exekution-von-gazprom-geldern-nicht,0,www.diepresse.com,Österreich verbietet Exekution von Gazprom-Geldern nicht,"Anders als Ungarn will die Regierung der Justiz keine Vorgaben machen, um Gasimporte zu sichern.",https://img.diepresse.com/public/incoming/c3f6aw-OMV-AGM/alternates/DPR_SOCIAL_NACHRICHTEN/OMV-AGM,2024-06-19T15:07:45Z,,"Anders als Ungarn will die Regierung der Justiz keine Vorgaben machen, um Gasimporte zu sichern. 
Falls auf Basis internationaler Gerichtsentscheidungen versucht werden sollte, in Österreich Zahlung… [+1292 chars]",,de,'Gazprom'
https://www.telepolis.de/features/Westliche-Sanktionen-und-Gazprom-Der-Riese-wankt-9769426.html,https://www.telepolis.de/features/Westliche-Sanktionen-und-Gazprom-Der-Riese-wankt-9769426.html,0,www.telepolis.de,Westliche Sanktionen und Gazprom: Der Riese wankt,Von der Cashcow zum Sorgenkind Russlands: Der Gasmonopolist Gazprom hat an Bedeutung verloren. Ein Ende seiner Krise ist trotz Strategiewechsel nicht in Sicht.,https://heise.cloudimg.io/bound/1200x1200/q85.png-lossy-85.webp-lossy-85.foil1/_www-heise-de_/imgs/18/4/6/1/7/1/5/1/9f61dbef7feb8e57.png,2024-06-19T22:00:00Z,,"Von der Cashcow zum Sorgenkind Russlands: Der Gasmonopolist Gazprom hat an Bedeutung verloren. Ein Ende seiner Krise ist trotz Strategiewechsel nicht in Sicht.
Etwa 40 Milliarden Euro hat der Verlus… [+5012 chars]",,de,'Gazprom'
https://www.n-tv.de/politik/08-14-Sanktionen-verpufft-Experte-Haben-die-ganze-Zeit-weiter-Gas-aus-Russland-bezogen--article23143824.html,https://www.n-tv.de/politik/08-14-Sanktionen-verpufft-Experte-Haben-die-ganze-Zeit-weiter-Gas-aus-Russland-bezogen--article23143824.html,0,www.n-tv.de,"Ukraine-Krieg im Liveticker: +++ 08:14 Sanktionen verpufft? Experte: ""Haben die ganze Zeit weiter Gas aus Russland bezogen"" +++",Lesen Sie alle aktuellen Entwicklungen und Nachrichten über den russischen Angriffskrieg auf die Ukraine im Liveticker von ntv.de.,https://bilder2.n-tv.de/img/incoming/crop23332537/9041326157-cImg_16_9-w1200/Liveticker1-grau-1-Kopie.jpg,2024-06-19T22:30:00Z,,"Nach dem Angriffskrieg auf die Ukraine will sich Europa unabhängiger von russischen Gaslieferungen machen. Doch seit diesem Jahr hat Russland die USA bei den Gasimporten wieder eingeholt. Ein Verbot,… [+12836 chars]",,de,'Krieg Gas'
https://www.n-tv.de/politik/22-11-Selenskyj-kuendigt-Massnahmen-zum-Schutz-der-Energieversorgung-an--article23143824.html,https://www.n-tv.de/politik/22-11-Selenskyj-kuendigt-Massnahmen-zum-Schutz-der-Energieversorgung-an--article23143824.html,0,www.n-tv.de,Ukraine-Krieg im Liveticker: +++ 22:11 Selenskyj kündigt Maßnahmen zum Schutz der Energieversorgung an +++,Lesen Sie alle aktuellen Entwicklungen und Nachrichten über den russischen Angriffskrieg auf die Ukraine im Liveticker von ntv.de.,https://bilder2.n-tv.de/img/incoming/crop23332537/9041326157-cImg_16_9-w1200/Liveticker1-grau-1-Kopie.jpg,2024-06-19T22:30:00Z,,"Ukraines Präsident Wolodymyr Selenskyj gibt Maßnahmen zum Schutz der Energieversorgung bekannt. Dazu gehören Schutzvorkehrungen für Anlagen, die unter russischem Beschuss stehen, sowie der Ausbau ern… [+32242 chars]",,de,'Energieversorgung'
https://www.n-tv.de/politik/09-34-Russischer-Luftangriff-beschaedigt-Energieversorgung-der-Ukraine--article23143824.html,https://www.n-tv.de/politik/09-34-Russischer-Luftangriff-beschaedigt-Energieversorgung-der-Ukraine--article23143824.html,0,www.n-tv.de,Ukraine-Krieg im Liveticker: +++ 09:34 Russischer Luftangriff beschädigt Energieversorgung der Ukraine +++,Lesen Sie alle aktuellen Entwicklungen und Nachrichten über den russischen Angriffskrieg auf die Ukraine im Liveticker von ntv.de.,https://bilder2.n-tv.de/img/incoming/crop23332537/9041326157-cImg_16_9-w1200/Liveticker1-grau-1-Kopie.jpg,2024-06-19T22:30:00Z,,"Ein schwerer russischer Luftangriff trifft nach Kiewer Angaben mehrere Anlagen der Energieversorgung in der Ukraine. Der staatliche Energieversorger berichtet von Schäden in den Gebieten Winnyzja, Dn… [+14156 chars]",,de,'Energieversorgung'
https://www.tagesschau.de/newsticker/liveblog-ukraine-donnerstag-352.html,https://www.tagesschau.de/newsticker/liveblog-ukraine-donnerstag-352.html,0,www.tagesschau.de,Ukraine-Liveblog: ++ Selenskyj will Stromversorgung verbessern ++,Der ukrainische Präsident Selenskyj hat Lösungen für die katastrophale Stromversorgung im Land versprochen. Die NATO zeigt sich angesichts der Beziehung zwischen Russland und Nordkorea beunruhigt. Alle Entwicklungen im Liveblog.,https://images.tagesschau.de/image/8d9b0e00-a106-43a0-a860-a9a84fe5c5aa/AAABkDL4l9E/AAABjwnlFvA/16x9-1280/wolodymyr-selenskyj-166.jpg,2024-06-20T01:07:00Z,,"Stand: 20.06.2024 03:07 Uhr
Der ukrainische Präsident Selenskyj hat Lösungen für die katastrophale Stromversorgung im Land versprochen. Die NATO zeigt sich angesichts der Beziehung zwischen Russland… [+2244 chars]",,de,'Heizperiode'
https://www.tagesspiegel.de/energie-massiver-blackout-millionen-ecuadorianer-ohne-strom-11865074.html,https://www.tagesspiegel.de/energie-massiver-blackout-millionen-ecuadorianer-ohne-strom-11865074.html,0,www.tagesspiegel.de,Energie: Massiver Blackout: Millionen Ecuadorianer ohne Strom,"Probleme im Stromnetz lösten eine Kettenreaktion aus, dann bricht das ganze Energiesystem zusammen. Jahrelang wurde die Instandhaltung vernachlässigt. Auch bei der Erzeugung gibt es Schwierigkeiten.",https://www.tagesspiegel.de/gesellschaft/panorama/images/blackout-in-ecuador/alternates/BASE_16_9_W1400/blackout-in-ecuador,2024-06-20T02:29:30Z,,"Bei einem landesweiten Stromausfall sind Millionen Ecuadorianer von der Energieversorgung abgeschnitten worden. «Es war eine Kettenreaktion. Als bestimmte Kraftwerke ausfielen, kam es zu einem «Black… [+1099 chars]",,de,'Energieversorgung'
https://www.n-tv.de/politik/Russland-greift-Energieversorgung-Kiew-Treibstofflager-an-article25029136.html,https://www.n-tv.de/politik/Russland-greift-Energieversorgung-Kiew-Treibstofflager-an-article25029136.html,0,www.n-tv.de,"Mit Iskander-Raketen und Drohnen: Russland greift Energieversorgung, Kiew Treibstofflager an",Nacht für Nacht geht die Zerstörung weiter. Nach schweren Luftangriffen sprechen mehrere ukrainische Energieversorger über Schäden. Angreifer Russland hingegen beklagt Brände in zwei Treibstofflagern durch ukrainische Drohnen.,https://bilder1.n-tv.de/img/incoming/crop25029128/0321321026-cImg_16_9-w1200/48481a5c7aed4ce62ca2f09b12680d9c.jpg,2024-06-20T07:50:09Z,,Nacht für Nacht geht die Zerstörung weiter. Nach schweren Luftangriffen sprechen mehrere ukrainische Energieversorger über Schäden. Angreifer Russland hingegen beklagt Brände in zwei Treibstofflagern… [+1768 chars],,de,'Energieversorgung'
