index,url,valid,domain,title,description,image,published,archive,content,quote,language,keyword
https://www.zeit.de/politik/deutschland/2024-06/schwarz-gruen-friedrich-merz-robert-habeck-maybritt-illner,https://www.zeit.de/politik/deutschland/2024-06/schwarz-gruen-friedrich-merz-robert-habeck-maybritt-illner,0,www.zeit.de,"Schwarz-Grün: Also dann, man sieht sich",Die Union will einen Untersuchungsausschuss zum AKW-Aus. Die Grünen verweisen auf deren Nordstream-Altlasten. Hoppla! So hätte Schwarz-Grün plötzlich doch wieder Charme.,https://img.zeit.de/politik/deutschland/2024-06/tv-duell-friedrichmerz-roberthabeck-illner/wide__1300x731,2024-06-06T22:11:10Z,,"Die Stücke von William Shakespeare machen dann besonders Spaß, wenn das Publikum längst erkennt, was seine Charaktere zu blind, zu stolz, zu befangen, zu töricht sind, einzusehen. Man darf diese dann… [+548 chars]",,de,'Nordstream'
https://www.tagesschau.de/newsticker/liveblog-ukraine-freitag-394.html,https://www.tagesschau.de/newsticker/liveblog-ukraine-freitag-394.html,0,www.tagesschau.de,Ukraine-Liveblog: ++ Weniger Strom durch Angriffe ++,Wegen Angriffen auf die Energieversorgung sind neue Stromabschaltungen in der Ukraine angekündigt. Die USA wollen offenbar neue Munition liefern. Präsident Selenskyj soll erneut nach Deutschland kommen. Die Entwicklungen im Liveblog.,https://images.tagesschau.de/image/5b073b67-29bf-4703-b6b1-71469e4c25bb/AAABjz78AfM/AAABjwnlFvA/16x9-1280/flagge-ukraine-truemmer-101.jpg,2024-06-07T00:45:44Z,,"Stand: 07.06.2024 02:45 Uhr
Wegen Angriffen auf die Energieversorgung sind neue Stromabschaltungen in der Ukraine angekündigt. Die USA wollen offenbar neue Munition liefern. Präsident Selenskyj soll… [+2555 chars]",,de,'Energieversorgung'
https://steiermark.orf.at/stories/3260146/,https://steiermark.orf.at/stories/3260146/,0,steiermark.orf.at,AK: Zinssenkung hat psychologischen Effekt,"Die Europäische Zentralbank (EZB) hat den Leitzins am Donnerstag um einen Viertel Prozentpunkt, also von 4,5 auf 4,25 Prozent abgesenkt. Nachdem die stark gestiegene Inflation und die Energiepreise Gründe für eine deutliche Zinserhöhung waren – scheint es jet…",https://ibs.orf.at/stm?image=https%3A%2F%2Foekastatic.orf.at%2Fmims%2F2022%2F17%2F13%2Fcrops%2Fw%3D1200%2Ch%3D627%2Cq%3D75%2F1318749_master_472113_220420_bh_zinsen_und_kredite_00_02_22_14.jpg%3Fs%3D2f51d2182d47158940b4d7d3840e7f8c3e692bb2,2024-06-07T04:12:00Z,,"Die Europäische Zentralbank läutete eine Zinswende ein der Leitzins ist um einen Viertel Prozentpunkt gesenkt worden mehr dazu in EZB senkt Leitzins erstmals seit 2019 (news.ORF.at).
Senkung führt z… [+1702 chars]",,de,'Inflation'
https://www.zeit.de/wirtschaft/2024-06/bruttoinlandsprodukt-robert-habeck-wirtschaftswachstum-2025,https://www.zeit.de/wirtschaft/2024-06/bruttoinlandsprodukt-robert-habeck-wirtschaftswachstum-2025,0,www.zeit.de,Bruttoinlandsprodukt: Robert Habeck rechnet 2025 mit deutlich mehr Wirtschaftswachstum,"Man habe die Inflation im Griff, sagt der Bundeswirtschaftsminister. Auch deswegen könnte das Bruttoinlandsprodukt um bis zu eineinhalb Prozent zulegen.",https://img.zeit.de/politik/deutschland/2024-06/robert-habeck-wirtschaftswachstum-bild/wide__1300x731,2024-06-07T08:20:25Z,,"Bundeswirtschaftsminister Robert Habeck (Grüne) rechnet im kommenden Jahr mit deutlich mehr Wirtschaftswachstum. Wenn es gut laufe, würden es ein bis eineinhalb Prozent sein, sagte der Grünen-Politik… [+1452 chars]",,de,'Energiepreise'
https://www.n-tv.de/wirtschaft/Wirtschaft-fasst-Tritt-auch-weil-Deutsche-mehr-kaufen-article24996569.html,https://www.n-tv.de/wirtschaft/Wirtschaft-fasst-Tritt-auch-weil-Deutsche-mehr-kaufen-article24996569.html,0,www.n-tv.de,Inflation sinkt langsam: Wirtschaft fasst Tritt - auch weil Deutsche mehr kaufen,"Seit zwei Jahren schwächelt die deutsche Wirtschaft. Jetzt geht es laut Konjunkturprognose der Bundesbank langsam bergauf, was auch an kauffreudigeren Privathaushalten liegt. Für 2025 sieht Wirtschaftsminister Habeck sogar deutlich mehr Wachstum.",https://bilder4.n-tv.de/img/incoming/crop24923923/0821321180-cImg_16_9-w1200/imago0311402254h.jpg,2024-06-07T08:22:54Z,,"Seit zwei Jahren schwächelt die deutsche Wirtschaft. Jetzt geht es laut Konjunkturprognose der Bundesbank langsam bergauf, was auch an kauffreudigeren Privathaushalten liegt. Für 2025 sieht Wirtschaf… [+3129 chars]",,de,'Inflation'
https://www.tagesschau.de/inland/eilantrag-lng-terminal-gescheitert-100.html,https://www.tagesschau.de/inland/eilantrag-lng-terminal-gescheitert-100.html,0,www.tagesschau.de,Klagen gegen LNG-Terminal in Mukran auf Rügen gescheitert,Mehrere Eilanträge gegen den Betrieb des Flüssiggas-Terminals im Hafen Mukran auf Rügen sind vom Bundesverwaltungsgericht in Leipzig für unzulässig erklärt worden.,https://images.tagesschau.de/image/c5a4fc08-cd85-4db6-ab06-cbf0ecbd6210/AAABj_IOImc/AAABjwnlFvA/16x9-1280/ndr-das-lng-terminal-mukran-von-see-aus-102.jpg,2024-06-07T09:07:00Z,,"Stand: 07.06.2024 11:07 Uhr
Mehrere Eilanträge gegen den Betrieb des Flüssiggas-Terminals im Hafen Mukran auf Rügen sind vom Bundesverwaltungsgericht in Leipzig für unzulässig erklärt worden.
Die E… [+491 chars]",,de,'LNG'
https://www.zeit.de/wirtschaft/2024-06/lng-terminal-ruegen-eilantraege-abgelehnt-bundesverwaltungsgericht,https://www.zeit.de/wirtschaft/2024-06/lng-terminal-ruegen-eilantraege-abgelehnt-bundesverwaltungsgericht,0,www.zeit.de,Binz auf Rügen: Bundesverwaltungsgericht lehnt Eilantrag gegen Rügener LNG-Terminal ab,Das Bundesverwaltungsgericht hat Eilanträge der Gemeinde Binz und weiteren Gegnern abgewiesen. Sicherheitsrisiken durch das LNG-Terminal auf Rügen seien nicht erkennbar.,https://img.zeit.de/administratives/sharing/fallback-image/wide__1300x731,2024-06-07T09:21:16Z,,"Die Eilanträge gegen den Betrieb des 
Flüssiggas-Terminals auf der Osteeinsel Rügen im Hafen Mukran sind gescheitert. Das Bundesverwaltungsgericht in Leipzig erklärte die Eilanträge für 
unzulässig… [+253 chars]",,de,'LNG'
https://futurezone.at/science/wasser-waermepumpe-4-mal-mehr-energie-wshp-seawarm-luft-fluesse-seen/402909941,https://futurezone.at/science/wasser-waermepumpe-4-mal-mehr-energie-wshp-seawarm-luft-fluesse-seen/402909941,0,futurezone.at,Gewässer statt Luft: Neuartige Wärmepumpe für kleine Häuser,Eine in Schottland entwickelte Wärmpumpe soll Vorteile gegenüber Luftwärmepumpen haben.,https://image.futurezone.at/images/facebook/8757977/pexels-rahulp9800-2260649.jpg,2024-06-07T10:07:32Z,,"07.06.2024
Eine in Schottland entwickelte Wärmpumpe soll Vorteile gegenüber Luftwärmepumpen haben.
© SeaWarm
Damit wäre ihr Wirkungsgrad in etwa so gut wie eine effiziente Luftwärmepumpe. Preislic… [+114 chars]",,de,'Wärmepumpe'
https://www.n-tv.de/wirtschaft/Gerichtsurteil-zu-LNG-Terminal-vor-Ruegen-Keine-Sicherheitsrisiken-im-Hafen-von-Mukran-article24997065.html,https://www.n-tv.de/wirtschaft/Gerichtsurteil-zu-LNG-Terminal-vor-Ruegen-Keine-Sicherheitsrisiken-im-Hafen-von-Mukran-article24997065.html,0,www.n-tv.de,Keine Risiken vor Rügen: Gericht schmettert Einsprüche gegen LNG-Terminal ab,"Noch immer besteht bei Vertretern vor Ort Hoffnung, das LNG-Terminal vor Rügen zu verhindern. Allerdings erteilt das Bundesverwaltungsgericht dem Anliegen nun eine Absage. Die beim Einspruch vorgebrachten Sicherheitsrisiken seien nicht erkennbar.",https://bilder3.n-tv.de/img/incoming/crop24997106/6591321554-cImg_16_9-w1200/461332408.jpg,2024-06-07T10:24:15Z,,"Noch immer besteht bei Vertretern vor Ort Hoffnung, das LNG-Terminal vor Rügen zu verhindern. Allerdings erteilt das Bundesverwaltungsgericht dem Anliegen nun eine Absage. Die beim Einspruch vorgebra… [+1959 chars]",,de,'LNG-Terminal'
https://www.stern.de/gesellschaft/regional/mecklenburg-vorpommern/energieversorgung--ruegen--bundesgericht-lehnt-eilantraege-gegen-lng-terminal-ab-34778196.html,https://www.stern.de/gesellschaft/regional/mecklenburg-vorpommern/energieversorgung--ruegen--bundesgericht-lehnt-eilantraege-gegen-lng-terminal-ab-34778196.html,0,www.stern.de,Energieversorgung: Rügen: Bundesgericht lehnt Eilanträge gegen LNG-Terminal ab,Mit allen Mitteln versuchte das Ostseebad Binz auf Rügen das Flüssigerdgas-Terminal im benachbarten Mukran zu verhindern. Ein letzter Versuch vor Gericht brachte aber auch keinen Erfolg.,https://image.stern.de/34778198/t/vV/v1/w1440/r1.7778/-/07--urnnewsmldpacom2009010124060799310022v3w800h600l476t540r1756b1393jpeg---97f1f1b37bc08911.jpg,2024-06-07T10:49:05Z,,"Mit allen Mitteln versuchte das Ostseebad Binz auf Rügen das Flüssigerdgas-Terminal im benachbarten Mukran zu verhindern. Ein letzter Versuch vor Gericht brachte aber auch keinen Erfolg.
Der Aufnahm… [+1484 chars]",,de,'Energieversorgung'
https://www.faz.net/aktuell/wirtschaft/mehr-wirtschaft/eilantraege-gegen-ruegener-lng-terminal-scheitern-vor-bundesverwaltungsgericht-19771975.html,https://www.faz.net/aktuell/wirtschaft/mehr-wirtschaft/eilantraege-gegen-ruegener-lng-terminal-scheitern-vor-bundesverwaltungsgericht-19771975.html,0,www.faz.net,Eilanträge gegen Rügener LNG-Terminal scheitern vor Bundesverwaltungsgericht,"Die Gemeinde Binz wollte den Betrieb des Flüssiggas-Terminals in einem Rügener Hafen mit einem Eilantrag verhindern. Angeführte Sicherheitsrisiken seien nicht erkennbar, urteilte nun ein Gericht. Die Anlage werde derzeit in Betrieb genommen.",https://media0.faz.net/ppmedia/aktuell/wirtschaft/4081071488/1.9772054/facebook_teaser/von-schleppern-begleitet.jpg,2024-06-07T10:55:22Z,,"Das Terminal besteht aus zwei schwimmenden Anlagen zur Speicherung und Regasifizierung von Flüssigerdgas (LNG), einem Tankschiff und weiteren Anlagen an Land. Es soll nach den Plänen der Bundesregier… [+1764 chars]",,de,'LNG-Terminal'
https://www.welt.de/wirtschaft/article251908282/Bundesverwaltungsgericht-weist-Eilantraege-gegen-Ruegener-LNG-Terminal-ab.html,https://www.welt.de/wirtschaft/article251908282/Bundesverwaltungsgericht-weist-Eilantraege-gegen-Ruegener-LNG-Terminal-ab.html,0,www.welt.de,Eilanträge gegen Rügener LNG-Terminal gescheitert,"Das Flüssiggas-Terminal im Rügener Hafen Mukran ist in der Region nicht überall beliebt. Die Gemeinde Binz, das Deutsche Jugendherbergswerk und zwei Privatleute haben gegen den Betrieb geklagt. Das Bundesverwaltungsgericht weist die Anträge aber ab – Sicherhe…",https://img.welt.de/img/bildergalerien/mobile251907892/5981355597-ci16x9-w1200/Energie-Terminal-Deutsche-Ostsee-im-Hafen-Mukran.jpg,2024-06-07T10:57:20Z,,"Die Eilanträge der Gemeinde Binz, des Deutschen Jugendherbergswerks und von zwei privaten Grundstückseigentümern gegen den Betrieb des Flüssiggas-Terminals auf Rügen im Hafen Mukran sind gescheitert.… [+2056 chars]",,de,'LNG'
https://taz.de/Eilantraege-abgeschmettert/!6015778/,https://taz.de/Eilantraege-abgeschmettert/!6015778/,0,taz.de,Eilanträge abgeschmettert: LNG-Terminal darf in Betrieb gehen,Eilanträge gegen Rügener Flüssiggasterminal scheitern vor dem Bundesverwaltungsgericht. Risiken für Umwelt und Tourismus seien nicht erkennbar.,https://taz.de/picture/7048666/948/35512297-1.jpeg,2024-06-07T11:21:00Z,,"Eilanträge gegen Rügener Flüssiggasterminal scheitern vor dem Bundesverwaltungsgericht. Risiken für Umwelt und Tourismus seien nicht erkennbar.
Das LNG-Terminal im Hafen von Mukran auf Rügen Foto: J… [+2357 chars]",,de,'LNG'
https://www.diepresse.com/18542938/oenb-chef-holzmann-die-inflation-ist-klebriger-als-erwartet,https://www.diepresse.com/18542938/oenb-chef-holzmann-die-inflation-ist-klebriger-als-erwartet,0,www.diepresse.com,OeNB-Chef Holzmann: „Die Inflation ist klebriger als erwartet“,"Nationalbank-­­Gouverneur Robert Holzmann nennt mehrere Gründe, warum er als einziger gegen die Zinssenkung der EZB gestimmt hat. Die österreichische Wirtschaft soll laut OeNB heuer vor allem durch die höchsten Reallohnsteigerungen seit 20 Jahren angetrieben …",https://img.diepresse.com/public/incoming/2vkdhf-RAIFFEISEN-INTL-STRABAGRUSSIA-HOLZMANN/alternates/DPR_SOCIAL_MAGAZIN/RAIFFEISEN%20INTL-STRABAGRUSSIA-HOLZMANN,2024-06-07T11:59:38Z,,"Nationalbank-­­Gouverneur Robert Holzmann nennt mehrere Gründe, warum er als einziger gegen die Zinssenkung der EZB gestimmt hat. Die österreichische Wirtschaft soll laut OeNB heuer vor allem durch d… [+4823 chars]",,de,'Energiepreise'
https://www.faz.net/aktuell/wirtschaft/mehr-wirtschaft/warum-die-schweiz-mehr-strom-produzieren-will-19772274.html,https://www.faz.net/aktuell/wirtschaft/mehr-wirtschaft/warum-die-schweiz-mehr-strom-produzieren-will-19772274.html,0,www.faz.net,Wie die Schweiz die Stromproduktion erhöhen will,Im Winter kann die Schweiz ihren Strombedarf nicht durch die eigene Produktion decken. Erneuerbare Energien sollen die Unabhängigkeit von Stromimporten sichern. Über das Stromgesetz entscheiden nun die Bürger.,https://media1.faz.net/ppmedia/aktuell/wirtschaft/2441037058/1.9772321/facebook_teaser/rotorblaetter-werden-an-eine.jpg,2024-06-07T12:17:35Z,,"Das Gesetz sieht zudem den Ausbau von Wasserkraftwerken vor, damit im Winter genügend Strom gespeichert werden kann. Regierung, Parlament und Kantone haben sich im Einvernehmen mit den Umweltorganisa… [+3718 chars]",,de,'Erneuerbare Energie'
https://www.focus.de/finanzen/news/war-laufzeitverlaengerung-moeglich-akw-akten-ploetzlich-widerspricht-habeck-im-zdf-seiner-gruenen-kabinettskollegin_id_260015354.html,https://www.focus.de/finanzen/news/war-laufzeitverlaengerung-moeglich-akw-akten-ploetzlich-widerspricht-habeck-im-zdf-seiner-gruenen-kabinettskollegin_id_260015354.html,0,www.focus.de,War Laufzeitverlängerung möglich? - Affäre um AKW-Akten: Plötzlich widerspricht Habeck im ZDF der grünen Ministerkollegin,Im ZDF hat Robert Habeck mit Friedrich Merz über die AKW-Akten und den wohl anstehenden Untersuchungsausschuss diskutiert. Der Vizekanzler widerspricht dabei plötzlich seiner grünen Kabinettskollegin Steffi Lemke. Für die Union ist das ein Anzeichen für Chaos…,https://p6.focus.de/img/fotos/id_260015356/robert-habeck-und-st-82285689.jpg?im=Crop%3D%280%2C400%2C3493%2C1745%29%3BResize%3D%281200%2C627%29&impolicy=perceptual&quality=mediumHigh&hash=3b798d81eb060a2eccab2b20dac933da446d48a4c8cccaabcab3402086568868,2024-06-07T13:44:11Z,,Im ZDF hat Robert Habeck mit Friedrich Merz über die AKW-Akten und den wohl anstehenden Untersuchungsausschuss diskutiert. Der Vizekanzler widerspricht dabei plötzlich seiner grünen Kabinettskollegin… [+2815 chars],,de,'AKW'
https://www.diepresse.com/18468076/rbi-chefanalyst-deuber-hohe-energiepreise-schmerzten-in-den-1970ern-mehr-als-heute,https://www.diepresse.com/18468076/rbi-chefanalyst-deuber-hohe-energiepreise-schmerzten-in-den-1970ern-mehr-als-heute,0,www.diepresse.com,RBI-Chefanalyst Deuber: „Hohe Energiepreise schmerzten in den 1970ern mehr als heute“ [premium],"Die Zinsentwicklung hält die Börsen weltweit auf Trab, der Ölpreis dürfte aus aktueller Sicht nicht allzu stark weiter steigen: RBI-Chefanalyst Gunter Deuber liefert eine Einschätzung.",https://img.diepresse.com/public/incoming/tjmbha-PB-ITV-Raja_Kauffmann.jpg/alternates/DPR_SOCIAL_MAGAZIN_PAID/PB%20ITV%20Raja_Kauffmann.jpg,2024-06-08T12:59:12Z,,"Die Zinsentwicklung hält die Börsen weltweit auf Trab, der Ölpreis dürfte aus aktueller Sicht nicht allzu stark weiter steigen: RBI-Chefanalyst Gunter Deuber liefert eine Einschätzung.
Die Inflation… [+1960 chars]",,de,'Energiepreise'
https://www.mobiflip.de/shortnews/waermepumpe-ohne-aerger-markt-fuer-schallschutzwaende-gedeiht/,https://www.mobiflip.de/shortnews/waermepumpe-ohne-aerger-markt-fuer-schallschutzwaende-gedeiht/,0,www.mobiflip.de,Wärmepumpe ohne Ärger: Markt für Schallschutzwände gedeiht,"Immer mehr Hausbesitzer nutzen Wärmepumpen zum Heizen, da der Gesetzgeber die Nutzung erneuerbarer Energien fördert. Wärmepumpen sind jedoch nicht geräuschlos, was zunehmend zu Beschwerden von Nachbarn führt. Der Anteil von […]",https://www.mobiflip.de/wp-content/uploads/2024/06/00_devaux_laermschutzwand_waermepumpe_aus.jpg,2024-06-08T14:16:35Z,,"Immer mehr Hausbesitzer nutzen Wärmepumpen zum Heizen, da der Gesetzgeber die Nutzung erneuerbarer Energien fördert. Wärmepumpen sind jedoch nicht geräuschlos, was zunehmend zu Beschwerden von Nachba… [+1254 chars]",,de,'Wärmepumpe'
https://www.focus.de/finanzen/news/der-einkauf-bleibt-weiter-teuer-welche-lebensmittelpreise-weiter-steigen_id_260018098.html,https://www.focus.de/finanzen/news/der-einkauf-bleibt-weiter-teuer-welche-lebensmittelpreise-weiter-steigen_id_260018098.html,0,www.focus.de,"Olivenöl, Kartoffeln, Schokolade - Bis zu 50 Prozent teurer! Bei welchen Lebensmitteln die Preise weiter stark steigen","Die Inflation ist so weit zurückgegangen, dass die EZB erstmals seit 2019 die Zinsen senkte. Diesen Rückgang spürt man an der Supermarktkasse nicht unbedingt – weil die Preise mancher Lebensmittel unbeirrt weiter klettern.",https://p6.focus.de/img/fotos/id_260018154/supermarkt-kasse.jpg?im=Crop%3D%280%2C199%2C3621%2C1810%29%3BResize%3D%281200%2C627%29&impolicy=perceptual&quality=mediumHigh&hash=cb5749c7f096a0b72ada92fa9dbf5675feab17867a236717ecd211b28f009ea9,2024-06-08T14:29:08Z,,"Die Inflation ist so weit zurückgegangen, dass die EZB erstmals seit 2019 die Zinsen senkte. Diesen Rückgang spürt man an der Supermarktkasse nicht unbedingt weil die Preise mancher Lebensmittel unbe… [+4611 chars]",,de,'Inflation'
https://www.n-tv.de/wirtschaft/Waermepumpen-Hersteller-schlagen-Alarm-article25000450.html,https://www.n-tv.de/wirtschaft/Waermepumpen-Hersteller-schlagen-Alarm-article25000450.html,0,www.n-tv.de,Verbraucher schlecht informiert?: Wärmepumpen-Hersteller schlagen Alarm,Der Absatz von Wärmepumpen bricht massiv ein. Schuld ist nach Ansicht der Branche die Debatte ums Heizungsgesetz und die kommunale Wärmeplanung - und dass die Immobilienbesitzer schlecht über die Gaspreise informiert sind. Ändern soll das die Regierung.,https://bilder4.n-tv.de/img/incoming/crop25000455/5971327383-cImg_16_9-w1200/446603629.jpg,2024-06-09T08:26:06Z,,Der Absatz von Wärmepumpen bricht massiv ein. Schuld ist nach Ansicht der Branche die Debatte ums Heizungsgesetz und die kommunale Wärmeplanung - und dass die Immobilienbesitzer schlecht über die Gas… [+2045 chars],,de,'Wärmepumpe'
https://www.stern.de/news/schweizer-stimmen-in-referendum-ueber--sichere-stromversorgung--ab-34782440.html,https://www.stern.de/news/schweizer-stimmen-in-referendum-ueber--sichere-stromversorgung--ab-34782440.html,0,www.stern.de,"Schweizer stimmen in Referendum über ""sichere Stromversorgung"" ab","In der Schweiz entscheiden die Menschen am Sonntag in einem Referendum über die künftige Energieversorgung im Land. Es wurde damit gerechnet, dass sich die Mehrheit der Bürger für ein Gesetz ausspricht, mit dem die Stromproduktion aus erneuerbarer Energie gef…",https://image.stern.de/34782442/t/rx/v1/w1440/r1.7778/-/09--referendum-ueber-erneuerbare-energie-in-der-schweiz---f8d1374cc3bfec26.jpg,2024-06-09T08:49:10Z,,"In der Schweiz entscheiden die Menschen am Sonntag in einem Referendum über die künftige Energieversorgung im Land. Es wurde damit gerechnet, dass sich die Mehrheit der Bürger für ein Gesetz ausspric… [+1662 chars]",,de,'Energieversorgung'
https://www.welt.de/wirtschaft/article251923210/Gas-Jetzt-plant-die-EU-Sanktionen-die-Russland-wirklich-wehtun.html,https://www.welt.de/wirtschaft/article251923210/Gas-Jetzt-plant-die-EU-Sanktionen-die-Russland-wirklich-wehtun.html,0,www.welt.de,"Jetzt plant die EU Gas-Sanktionen, die Russland wirklich wehtun","Europäische Unternehmen helfen Russland dabei, LNG-Flüssiggas in die ganze Welt zu verschiffen. Neue Sanktionen der EU sollen diese Geschäfte nun verbieten. Verbraucher und Unternehmen dürften unter dem Verbot nicht leiden. Es winken sogar Rabatte.",https://img.welt.de/img/wirtschaft/mobile251923764/9271350397-ci16x9-w1200/An-aerial-sunset-view-of-an-oil-tanker-on-The-Solent-sea-UK-stock-photo.jpg,2024-06-09T10:08:32Z,,"Trotz aller Rhetorik fällt es Europa notorisch schwer, auf russisches Erdgas zu verzichten. Zwar hat die EU den Import von russischer Kohle und auf dem Seeweg importiertem Öl aus Russland verboten. D… [+7180 chars]",,de,'LNG'
https://www.basicthinking.de/blog/2024/06/09/neuartiges-baumaterial/,https://www.basicthinking.de/blog/2024/06/09/neuartiges-baumaterial/,0,www.basicthinking.de,Lichtdurchlässig und selbstreinigend: Forscher präsentieren neuartiges Baumaterial,"Forscher haben ein neues Baumaterial mit besonderen Eigenschaften entwickelt: Es lässt Sonnenlicht durch, reguliert das Klima im Raum und kann sich selbst reinigen. Die Hintergründe   Lichtdurchflutete Räume und Gebäuden können Energiekosten reduzieren. Bishe…",https://www.basicthinking.de/blog/wp-content/uploads/2024/05/00_neuartiges-baumaterial-.jpeg,2024-06-09T11:00:20Z,,"Forscher haben ein neues Baumaterial mit besonderen Eigenschaften entwickelt: Es lässt Sonnenlicht durch, reguliert das Klima im Raum und kann sich selbst reinigen. Die Hintergründe  
Lichtdurchflut… [+3111 chars]",,de,'Energiekosten'
https://www.zeit.de/arbeit/2024-06/ig-metall-industrie-elektroindustrie-tarifrunde-forderung-loehne-inflation,https://www.zeit.de/arbeit/2024-06/ig-metall-industrie-elektroindustrie-tarifrunde-forderung-loehne-inflation,0,www.zeit.de,IG Metall: Beschäftigte der Metallindustrie fordern bessere Bezahlung,Die IG Metall hat mit Blick auf die Tarifrunde im Herbst fast 320.000 Angestellte von 2.705 Betrieben befragt. Sie wollen angesichts der Inflation deutlich mehr Gehalt.,https://img.zeit.de/wirtschaft/2024-06/g-metall-industrie-elektroindustrie-tarifrunde-forderung-loehne-inflation-bild/wide__1300x731,2024-06-09T11:42:12Z,,"Die Beschäftigten der deutschen Metall- und Elektroindustrie fordern für die Tarifrunde im Herbst vor allem höhere Löhne. Das habe eine Befragung von 318.453 Beschäftigten in 2.705 Betrieben ergeben,… [+3249 chars]",,de,'Inflation'
https://www.stern.de/news/prognosen--schweizer-stimmen-fuer-mehr-erneuerbare-energie-34782440.html,https://www.stern.de/news/prognosen--schweizer-stimmen-fuer-mehr-erneuerbare-energie-34782440.html,0,www.stern.de,Prognosen: Schweizer stimmen für mehr Erneuerbare Energie,Die Menschen in der Schweiz haben in einem Referendum Prognosen zufolge für die verstärkte Nutzung erneuerbarer Energien gestimmt. Das vom Parlament bereits beschlossene Gesetz wurde am Sonntag laut einer nach Schließung der Wahllokale veröffentlichten Progno…,https://image.stern.de/34782856/t/uq/v1/w1440/r1.7778/-/09--referendum-ueber-erneuerbare-energie-in-der-schweiz---3c4db1139d80ad0b.jpg,2024-06-09T12:12:12Z,,Die Menschen in der Schweiz haben in einem Referendum Prognosen zufolge für die verstärkte Nutzung erneuerbarer Energien gestimmt. Das vom Parlament bereits beschlossene Gesetz wurde am Sonntag laut … [+2801 chars],,de,'Erneuerbare Energie'
https://www.focus.de/finanzen/boerse/leitzins-starke-us-arbeitsmarktdaten-bremsen-fed-bei-zinssenkung_id_260021774.html,https://www.focus.de/finanzen/boerse/leitzins-starke-us-arbeitsmarktdaten-bremsen-fed-bei-zinssenkung_id_260021774.html,0,www.focus.de,Leitzins - Starke US-Arbeitsmarktdaten dürften Zinssenkung der Fed verzögern,Die US-Zentralbank Fed könnte laut Experten die geplante Zinssenkung verschieben. Denn die starken Arbeitsmarktdaten führen zu Lohnanstiegen. Das heizt die hohe Inflation weiter an.,https://p6.focus.de/img/fotos/id_259969455/jerome-powell.jpg?im=Crop%3D%280%2C289%2C3463%2C1731%29%3BResize%3D%281200%2C627%29&impolicy=perceptual&quality=mediumHigh&hash=5ddd9596d793d37cba59d541c084a5dea08c79393f51737c8e020ad0b39904af,2024-06-10T08:05:12Z,,Die US-Zentralbank Fed könnte laut Experten die geplante Zinssenkung verschieben. Denn die starken Arbeitsmarktdaten führen zu Lohnanstiegen. Das heizt die hohe Inflation weiter an.Anleger müssen sic… [+2275 chars],,de,'Inflation'
https://www.n-tv.de/politik/Wiederaufbaukonferenz-in-Berlin-Die-Ukraine-braucht-Strom-und-Luftabwehr-article25005948.html,https://www.n-tv.de/politik/Wiederaufbaukonferenz-in-Berlin-Die-Ukraine-braucht-Strom-und-Luftabwehr-article25005948.html,0,www.n-tv.de,Wiederaufbaukonferenz in Berlin: Die Hälfte der ukrainischen Stromkapazitäten ist zerstört,Nach Angaben des ukrainischen Präsidenten hat Russland die Hälfte der ukrainischen Stromkapazitäten zerstört. Die Energieversorgung dürfte das wichtigste Thema ist auf der Wiederaufbaukonferenz in Berlin sein.,https://bilder4.n-tv.de/img/incoming/crop25005967/9831325884-cImg_16_9-w1200/464163898.jpg,2024-06-11T09:51:46Z,,Nach Angaben des ukrainischen Präsidenten hat Russland die Hälfte der ukrainischen Stromkapazitäten zerstört. Die Energieversorgung dürfte das wichtigste Thema auf der Wiederaufbaukonferenz in Berlin… [+6114 chars],,de,'Akw'
https://www.diepresse.com/18555855/jeden-monat-ein-neues-eu-umweltgesetz,https://www.diepresse.com/18555855/jeden-monat-ein-neues-eu-umweltgesetz,0,www.diepresse.com,Jeden Monat ein neues EU-Umweltgesetz [premium],"Der EU-Wahlkampf hat vieles hervorgebracht, aber ein paar Themen wurden kaum beleuchtet. Über Europas neue Abhängigkeit, Von der Leyens Umweltgesetze-Rekord und der Illusion, dass es in wenigen Jahren wieder „normale“ Beziehungen zu Russland geben könnte.",https://img.diepresse.com/public/incoming/rmx0u6-06.08-s17-Wirtschaftsprognose-PW.gif/alternates/DPR_SOCIAL_MEINUNG_PAID/06.08-s17-Wirtschaftsprognose-PW.gif,2024-06-11T10:31:58Z,,"Der EU-Wahlkampf hat vieles hervorgebracht, aber ein paar Themen wurden kaum beleuchtet. Über Europas neue Abhängigkeit, Von der Leyens Umweltgesetze-Rekord und der Illusion, dass es in wenigen Jahre… [+772 chars]",,de,'Russland Abhängigkeit'
