index,url,valid,domain,title,description,image,published,archive,content,quote,language,keyword
https://www.n-tv.de/wirtschaft/Bruessel-und-Wien-zoffen-sich-ueber-russischen-Gas-Import-article24380581.html,https://www.n-tv.de/wirtschaft/Bruessel-und-Wien-zoffen-sich-ueber-russischen-Gas-Import-article24380581.html,0,www.n-tv.de,Diplomatische Spannungen: Brüssel und Wien zoffen über russischen Gas-Import,"Zwischen der EU-Kommission und der österreichischen Regierung knirscht es. Die Alpenrepublik ist noch immer stark abhängig von Energiesendungen aus Moskau, was der Vertreter der Europäischen Kommission in Wien kritisiert. Nun wird er in das Außenministerium i…",https://bilder2.n-tv.de/img/incoming/crop24380609/5971324709-cImg_16_9-w1200/413147578.jpg,2023-09-07T17:54:29Z,,"Zwischen der EU-Kommission und der österreichischen Regierung knirscht es. Die Alpenrepublik ist noch immer stark abhängig von Energiesendungen aus Moskau, was der Vertreter der Europäischen Kommissi… [+1707 chars]",,de,'Gas Import'
https://www.zeit.de/video/2023-09/6336749266112/lng-terminal-vor-ruegen-greenpeace-aktivisten-protestieren-gegen-lng-terminal,https://www.zeit.de/video/2023-09/6336749266112/lng-terminal-vor-ruegen-greenpeace-aktivisten-protestieren-gegen-lng-terminal,0,www.zeit.de,LNG-Terminal vor Rügen: Greenpeace-Aktivisten protestieren gegen LNG-Terminal,Mit Schlauchbooten haben Umweltschutzaktivisten im Hafen Sassnitz-Mukran demonstriert. Dort soll eine Pipeline zum Transport von Flüssiggas nach Lubmin verlegt werden.,,2023-09-07T21:32:53Z,https://web.archive.org/web/20230909202512/https://www.zeit.de/video/2023-09/6336749266112/lng-terminal-vor-ruegen-greenpeace-aktivisten-protestieren-gegen-lng-terminal,"When browsing with ads:
We collect personal data and also transmit it to third-party providers
 that help us improve and finance our digital content. Some of the information stored on your device, … [+821 chars]",,de,'LNG'
https://www.n-tv.de/politik/06-24-Kritik-an-russischen-Gasimport-Wien-bestellt-deutschen-EU-Diplomaten-ein--article23143824.html,https://www.n-tv.de/politik/06-24-Kritik-an-russischen-Gasimport-Wien-bestellt-deutschen-EU-Diplomaten-ein--article23143824.html,0,www.n-tv.de,Ukraine-Krieg im Liveticker: +++ 06:24 Kritik an russischen Gasimport: Wien bestellt deutschen EU-Diplomaten ein +++,Lesen Sie alle aktuellen Entwicklungen und Nachrichten über den russischen Angriffskrieg auf die Ukraine im Liveticker von ntv.de.,https://bilder2.n-tv.de/img/incoming/crop23332537/9041326157-cImg_16_9-w1200/Liveticker1-grau-1-Kopie.jpg,2023-09-07T22:17:00Z,,"Die heftige Kritik eines hochrangigen EU-Diplomaten an Österreichs Abhängigkeit von russischem Gas löst Irritationen in Wien und Brüssel aus. Martin Selmayr, der Vertreter der Europäischen Kommission… [+8141 chars]",,de,'Krieg Gas'
https://www.nzz.ch/wirtschaft/die-betroffenheitsdemokratie-nimmt-je-laenger-desto-mehr-ueberhand-der-oberste-vertreter-der-wirtschaft-sieht-ein-gravierende-reformprobleme-in-der-schweiz-ld.1755110,https://www.nzz.ch/wirtschaft/die-betroffenheitsdemokratie-nimmt-je-laenger-desto-mehr-ueberhand-der-oberste-vertreter-der-wirtschaft-sieht-ein-gravierende-reformprobleme-in-der-schweiz-ld.1755110,0,www.nzz.ch,"INTERVIEW - «Die Betroffenheitsdemokratie nimmt je länger, desto mehr überhand»: Der oberste Vertreter der Wirtschaft ortet in der Schweiz gravierende Reformprobleme","Altersvorsorge, Energieversorgung, Verhandlungen mit der EU: Der Economiesuisse-Präsident Christoph Mäder erkennt auf allen Ebenen im Land grosse Unlust, sich mit wichtigen Fragen auseinanderzusetzen. Trotzdem blickt er verhalten positiv auf die Parlamentswah…","https://img.nzz.ch/2023/09/07/8b961eba-e02b-4ade-bb42-458a753282e2.jpeg?width=1200&height=675&fit=bound&quality=75&auto=webp&crop=2558,1439,x0,y849&wmark=nzz",2023-09-08T03:30:00Z,https://web.archive.org/web/20230908122312/https://www.nzz.ch/wirtschaft/die-betroffenheitsdemokratie-nimmt-je-laenger-desto-mehr-ueberhand-der-oberste-vertreter-der-wirtschaft-sieht-ein-gravierende-reformprobleme-in-der-schweiz-ld.1755110,"«Leider hat man in den letzten beiden Legislaturen die grossen politischen Themen lieber vor sich hergeschoben, statt sie zu lösen», konstatiert Christoph Mäder. Der Präsident des Wirtschaftsdachverb… [+13282 chars]",,de,'Energieversorgung'
https://www.stern.de/gesellschaft/regional/mecklenburg-vorpommern/bundestag--ruegener-lng-terminal--kritik-an-besuch-petitionsausschusses-33806522.html,https://www.stern.de/gesellschaft/regional/mecklenburg-vorpommern/bundestag--ruegener-lng-terminal--kritik-an-besuch-petitionsausschusses-33806522.html,0,www.stern.de,Bundestag: Rügener LNG-Terminal: Kritik an Besuch Petitionsausschusses,Der Petitionsausschuss des Bundestags befasst sich am Montag auf Rügen mit dem umstrittenen Plänen für ein dortiges LNG-Terminal. Die Stimmung ist aufgeladen - das zeigt die Kritik an dem Termin.,https://image.stern.de/33806524/t/RI/v1/w1440/r1.7778/-/08--urnnewsmldpacom2009010123090899116645v2w800h600l1155t706r3470b2118jpeg---8fd434de9702da96.jpg,2023-09-08T04:20:28Z,https://web.archive.org/web/20230908045523/https://www.stern.de/gesellschaft/regional/mecklenburg-vorpommern/bundestag--ruegener-lng-terminal--kritik-an-besuch-petitionsausschusses-33806522.html,"Der Petitionsausschuss des Bundestags befasst sich am Montag auf Rügen mit dem umstrittenen Plänen für ein dortiges LNG-Terminal. Die Stimmung ist aufgeladen - das zeigt die Kritik an dem Termin.
Im… [+3998 chars]",,de,'LNG'
https://www.zeit.de/news/2023-09/08/ruegener-lng-terminal-kritik-an-besuch-petitionsausschusses,https://www.zeit.de/news/2023-09/08/ruegener-lng-terminal-kritik-an-besuch-petitionsausschusses,0,www.zeit.de,Bundestag: Rügener LNG-Terminal: Kritik an Besuch Petitionsausschusses,,,2023-09-08T04:20:28Z,https://web.archive.org/web/20230909115812/https://www.zeit.de/news/2023-09/08/ruegener-lng-terminal-kritik-an-besuch-petitionsausschusses,"When browsing with ads:
We collect personal data and also transmit it to third-party providers
 that help us improve and finance our digital content. Some of the information stored on your device, … [+821 chars]",,de,'LNG'
https://www.faz.net/aktuell/wirtschaft/wie-teuer-das-heizungsgesetz-fuer-hauseigentuemer-wird-19158166.html,https://www.faz.net/aktuell/wirtschaft/wie-teuer-das-heizungsgesetz-fuer-hauseigentuemer-wird-19158166.html,0,www.faz.net,Mit welchen Kosten Eigentümer fürs grüne Heizen rechnen müssen,"Wärmepumpe, Fernwärme oder doch wieder eine Gasheizung? Die Debatte über das Gebäudeenergiegesetz hat viele Immobilieneigentümer verunsichert. Viel hängt von der Förderhöhe ab. Und davon, wie sich die Energiepreise entwickeln.",https://media1.faz.net/ppmedia/aktuell/481466663/1.9158165/facebook_teaser/welche-heizart-darf-es-sein.jpg,2023-09-08T06:30:36Z,,"An diesem Freitag beschließt der Bundestag aller Voraussicht nach ein Gesetz, das für Millionen Bürger finanzielle Folgen hat. Formal tritt die Novelle des Gebäudeenergiegesetzes zum 1. Januar 2024 i… [+5287 chars]",,de,'Energiepreise'
https://www.handelsblatt.com/finanzen/geldpolitik/verbraucherpreise-inflationsrate-bestaetigt-energie-und-lebensmittel-als-preistreiber/29380104.html,https://www.handelsblatt.com/finanzen/geldpolitik/verbraucherpreise-inflationsrate-bestaetigt-energie-und-lebensmittel-als-preistreiber/29380104.html,0,www.handelsblatt.com,Verbraucherpreise: Inflationsrate bestätigt – Energie und Lebensmittel als Preistreiber,"Die Verbraucherpreise sind im August um 6,1 Prozent im Vergleich zum Vorjahresmonat gestiegen. Energie verteuerte sich dabei besonders stark.",https://www.handelsblatt.com/images/stromzaehler/29380112/2-format2003.jpg,2023-09-08T06:35:36Z,,"StromzählerVor allem Strom kostete mit einem Plus von 16,6 Prozent deutlich mehr als im August 2022.
(Foto: dpa)
Berlin Die Inflation in Deutschland sinkt wegen der stärker steigenden Energiekosten… [+2598 chars]",,de,'Heizöl'
https://www.stern.de/news/inflation-im-august-bei-6-1-prozent---nahrungsmittel-weiterhin-preistreiber-33806804.html,https://www.stern.de/news/inflation-im-august-bei-6-1-prozent---nahrungsmittel-weiterhin-preistreiber-33806804.html,0,www.stern.de,"Inflation im August bei 6,1 Prozent - Nahrungsmittel weiterhin Preistreiber","Die Verbraucherpreise sind im August um 6,1 Prozent im Vergleich zum Vorjahresmonat gestiegen und somit etwas weniger stark als im Juli (6,2 Prozent). Das Statistische Bundesamt in Wiesbaden bestätigte am Freitag seine erste Schätzung von vergangener Woche. S…",https://image.stern.de/33806806/t/Rw/v1/w1440/r1.7778/-/08--obst-und-gemuese---ee36ed6b68a07407.jpg,2023-09-08T06:38:26Z,,"Die Verbraucherpreise sind im August um 6,1 Prozent im Vergleich zum Vorjahresmonat gestiegen und somit etwas weniger stark als im Juli (6,2 Prozent). Das Statistische Bundesamt in Wiesbaden bestätig… [+1916 chars]",,de,'Heizöl'
https://www.welt.de/wirtschaft/article247354914/Teuerung-Inflationsrate-sinkt-nur-langsam-Nahrungsmittel-weiterhin-Preistreiber.html,https://www.welt.de/wirtschaft/article247354914/Teuerung-Inflationsrate-sinkt-nur-langsam-Nahrungsmittel-weiterhin-Preistreiber.html,0,www.welt.de,Inflationsrate sinkt nur langsam – Nahrungsmittel weiterhin Preistreiber,"Die Inflationsrate im August bleibt mit 6,1 Prozent auf einem hohen Niveau. Besonders stark stiegen die Preise für Süßwaren, Fisch, Brot und Gemüse. Für September erwarten die Statistiker einen stärkeren Rückgang der Teuerungsrate.",https://img.welt.de/img/regionales/rheinland-pfalz-saarland/mobile247188116/5971354167-ci16x9-w1200/Einkaufen-im-Supermarkt.jpg,2023-09-08T07:44:05Z,,"Die Verbraucherpreise sind im August um 6,1 Prozent im Vergleich zum Vorjahresmonat gestiegen und somit etwas weniger stark als im Juli (6,2 Prozent). Das Statistische Bundesamt in Wiesbaden bestätig… [+1872 chars]",,de,'Heizöl'
https://www.zeit.de/video/2023-09/6336749266112/ruegen-greenpeace-aktivisten-protestieren-gegen-lng-terminal,https://www.zeit.de/video/2023-09/6336749266112/ruegen-greenpeace-aktivisten-protestieren-gegen-lng-terminal,0,www.zeit.de,Rügen: Greenpeace-Aktivisten protestieren gegen LNG-Terminal,Mit Schlauchbooten haben Umweltschutzaktivisten im Hafen Sassnitz-Mukran demonstriert. Dort soll eine Pipeline zum Transport von Flüssiggas nach Lubmin verlegt werden.,,2023-09-08T07:52:00Z,https://web.archive.org/web/20230909202354/https://www.zeit.de/video/2023-09/6336749266112/ruegen-greenpeace-aktivisten-protestieren-gegen-lng-terminal,"When browsing with ads:
We collect personal data and also transmit it to third-party providers
 that help us improve and finance our digital content. Some of the information stored on your device, … [+821 chars]",,de,'LNG'
https://www.morgenpost.de/wirtschaft/article239360769/heizoelpreise-aktuell-preisentwicklung-heute-8-september-energie.html,https://www.morgenpost.de/wirtschaft/article239360769/heizoelpreise-aktuell-preisentwicklung-heute-8-september-energie.html,0,www.morgenpost.de,Heizen und Kosten: Heizölpreise aktuell: Der Preis pro Liter heute am 7.9.,Wie entwickeln sich die Heizölpreise heute? ○ Sollten Verbraucher jetzt kaufen? ○ Die aktuellen Preise vom 8. September im Überblick.,https://img.morgenpost.de/img/bilder/crop106057874/4752601525-w820-cv16_9-q85/heizxl3-35534902-original.jpg,2023-09-08T07:53:00Z,,"Berlin. Der Sommer dreht noch einmal auf: Bei Temperaturen von über 30 Grad fällt es schwer, die kommende Heizperiode im Blick zu behalten. Besitzerinnen und Besitzer von Ölheizungen sind allerdings … [+9735 chars]",,de,'Heizöl'
https://www.dw.com/de/inflationsrate-sinkt-im-august-minimal/a-66756199,https://www.dw.com/de/inflationsrate-sinkt-im-august-minimal/a-66756199,0,www.dw.com,Inflationsrate sinkt im August minimal,Die Teuerung in Deutschland hält sich trotz eines erneuten Rückgangs hartnäckig über sechs Prozent. Nach wie vor waren Energie und Lebensmittel entscheidende Preistreiber.,https://static.dw.com/image/66376706_6.jpg,2023-09-08T08:44:00Z,,"Die Inflation in Deutschland sinkt wegen der stärker steigenden Kosten für Energie und Lebensmittel nur im Schneckentempo. Die Verbraucherpreise lagen im August um durchschnittlich 6,1 Prozent höher … [+2494 chars]",,de,'Inflation'
https://orf.at/stories/3330421/,https://orf.at/stories/3330421/,0,orf.at,Streik in Australien treibt europäischen Gaspreis in die Höhe,,https://orf.at/mojo/1_4_1/storyserver//news/common/images/og-fallback-news.png,2023-09-08T08:44:54Z,https://web.archive.org/web/20230909014109/https://orf.at/stories/3330421/,Ein Streik in einer Flüssiggasanlage in Australien hat den europäischen Gaspreis heute nach oben getrieben. Am Vormittag kostete der richtungweisende Terminkontrakt TTF zur Auslieferung in einem Mona… [+1127 chars],,de,'LNG'
https://orf.at/stories/3330431/,https://orf.at/stories/3330431/,0,orf.at,Vorerst kein EU-Verbot für russische LNG-Importe,,https://orf.at/mojo/1_4_1/storyserver//news/common/images/og-fallback-news.png,2023-09-08T09:35:28Z,https://web.archive.org/web/20230909015053/https://orf.at/stories/3330431/,Die EU wird laut der spanischen Wirtschaftsministerin Teresa Ribera vorerst kein Verbot für den umstrittenen Import von russischem Flüssiggas (LNG) verhängen. Es herrscht ein Gefühl der Knappheit und… [+975 chars],,de,'LNG'
https://www.zeit.de/2023/38/aldi-inflation-lebensmittelpreise-bio-deutschland-chef,https://www.zeit.de/2023/38/aldi-inflation-lebensmittelpreise-bio-deutschland-chef,0,www.zeit.de,"Aldi und die Inflation: ""Wir senken die Preise als Erste""","Manager von Aldi zeigen sich öffentlich fast nie. Nun aber wehrt sich Deutschland-Chef Stefan Kopp gegen den Vorwurf, die Preise zu sehr erhöht zu haben.",,2023-09-08T09:49:52Z,https://web.archive.org/web/20230908115657/https://www.zeit.de/2023/38/aldi-inflation-lebensmittelpreise-bio-deutschland-chef,"When browsing with ads:
We collect personal data and also transmit it to third-party providers
 that help us improve and finance our digital content. Some of the information stored on your device, … [+821 chars]",,de,'Inflation'
https://www.welt.de/wirtschaft/article247356400/Gas-Europaeischer-Gaspreis-steigt-um-elf-Prozent-wegen-Streik-in-Australien.html,https://www.welt.de/wirtschaft/article247356400/Gas-Europaeischer-Gaspreis-steigt-um-elf-Prozent-wegen-Streik-in-Australien.html,0,www.welt.de,Streik in Australien sorgt für stark steigenden Gaspreis in Europa,"Am Freitag kostete eine Megawattstunde Gas an der Börse in Amsterdam 36,20 Euro – ein Anstieg um elf Prozent innerhalb eines Tages. Grund ist ein Streik in einer Flüssiggasanlage in Australien.",https://img.welt.de/img/wirtschaft/mobile247356700/6671352067-ci16x9-w1200/Ruegener-LNG-Terminal.jpg,2023-09-08T09:52:39Z,https://web.archive.org/web/20230908141200/https://www.welt.de/wirtschaft/article247356400/Gas-Europaeischer-Gaspreis-steigt-um-elf-Prozent-wegen-Streik-in-Australien.html,Ein Streik in einer Flüssiggasanlage in Australien hat den europäischen Gaspreis am Freitag nach oben getrieben. Am Vormittag kostete der richtungweisende Terminkontrakt TTF zur Auslieferung in einem… [+1107 chars],,de,'Flüssiggas'
https://www.tagesschau.de/wirtschaft/verbraucher/wo-preise-besonders-steigen-100.html,https://www.tagesschau.de/wirtschaft/verbraucher/wo-preise-besonders-steigen-100.html,0,www.tagesschau.de,Warum die Strompreise gerade steigen,"Die Inflation in Deutschland bleibt auf hohem Niveau. Grund dafür sind weiter steigende Preise für Lebensmittel, aber auch Strom. Verbraucher bekommen zu spüren, was auf den weltweiten Energiemärkten passiert.",https://images.tagesschau.de/image/8498c6f4-0e07-4973-8d3a-d567a9d923b4/AAABhnbI-mM/AAABibBxqrQ/16x9-1280/stromzaehler-109.jpg,2023-09-08T11:05:04Z,https://web.archive.org/web/20230908152213/https://www.tagesschau.de/wirtschaft/verbraucher/wo-preise-besonders-steigen-100.html,"Stand: 08.09.2023 13:05 Uhr
Die Inflation in Deutschland bleibt auf hohem Niveau. Grund dafür sind weiter steigende Preise für Lebensmittel, aber auch Strom. Verbraucher bekommen zu spüren, was auf … [+5448 chars]",,de,'Inflation'
https://www.diepresse.com/14897451/warum-oesterreich-nicht-von-russlands-gas-loskommt,https://www.diepresse.com/14897451/warum-oesterreich-nicht-von-russlands-gas-loskommt,0,www.diepresse.com,Warum Österreich nicht von Russlands Gas loskommt,"Löst die teilstaatliche OMV nicht ihren Vertrag mit Gazprom, hängt das Land bis 2040 an Moskaus Gashahn.",https://img.diepresse.com/public/incoming/q1jwtr-FILES-ROMANIA-AUSTRIA-GAS/alternates/DPR_SOCIAL_NACHRICHTEN/FILES-ROMANIA-AUSTRIA-GAS,2023-09-08T12:04:27Z,,"Löst die teilstaatliche OMV nicht ihren Vertrag mit Gazprom, hängt das Land bis 2040 an Moskaus Gashahn. 
Wien. Der Blutgeld-Sager von Martin Selmayr wurde von der heimischen Regierung zwar entrüste… [+1638 chars]",,de,'Gazprom'
https://www.focus.de/politik/deutschland/gastkommentar-olaf-scholz-muss-den-ausstieg-aus-den-fossilen-fordern_id_204061436.html,https://www.focus.de/politik/deutschland/gastkommentar-olaf-scholz-muss-den-ausstieg-aus-den-fossilen-fordern_id_204061436.html,0,www.focus.de,Gastkommentar - Olaf Scholz muss den Ausstieg aus den Fossilen fordern,"Im Angesicht geopolitischer Verwerfungen findet am Wochenende der G20-Gipfel statt. Er leitet einen klimadiplomatischen Marathon bis zum Jahresende ein. Als Vertreter Deutschlands fällt es dem Bundeskanzler zu, auf anspruchsvolle Ergebnisse zu drängen und Ang…",https://p6.focus.de/img/politik/deutschland/id_192800346/bundeskanzler-olaf-scholz-waehrend-seiner-rede-beim-14.-petersberger-klimadialog-im-auswaertigen-amt..jpg?im=Crop%3D%280%2C169%2C2048%2C1024%29%3BResize%3D%281200%2C627%29&impolicy=perceptual&quality=mediumHigh&hash=0395bfc7e998dd20f93b5b913569dfc7b4a74bc545ea240f45186ec2e1009b89,2023-09-08T13:28:21Z,,Im Angesicht geopolitischer Verwerfungen findet am Wochenende der G20-Gipfel statt. Er leitet einen klimadiplomatischen Marathon bis zum Jahresende ein. Als Vertreter Deutschlands fällt es dem Bundes… [+6061 chars],,de,'G20 Gas'
https://www.diepresse.com/14859987/streiks-in-australischen-lng-anlagen-lassen-gaspreis-steigen,https://www.diepresse.com/14859987/streiks-in-australischen-lng-anlagen-lassen-gaspreis-steigen,0,www.diepresse.com,Streiks in australischen LNG-Anlagen lassen Gaspreis steigen,Die Gewerkschaften haben sich vorerst mit dem Betreiber Chevron nicht über einen neuen Tarifvertrag und bessere Arbeitsbedingungen geeinigt.,https://img.diepresse.com/public/incoming/i5r7km-AUSTRALIA-LNGWORKERS/alternates/DPR_SOCIAL_NACHRICHTEN/AUSTRALIA-LNGWORKERS,2023-09-08T14:22:24Z,https://web.archive.org/web/20230909202215/https://www.diepresse.com/14859987/streiks-in-australischen-lng-anlagen-lassen-gaspreis-steigen,"Die Gewerkschaften haben sich vorerst mit dem Betreiber Chevron nicht über einen neuen Tarifvertrag und bessere Arbeitsbedingungen geeinigt.
Drohende Angebotsengpässe verteuern Erdgas. Der europäisc… [+358 chars]",,de,'LNG'
https://www.faz.net/aktuell/wirtschaft/hans-im-unglueck-19160640.html,https://www.faz.net/aktuell/wirtschaft/hans-im-unglueck-19160640.html,0,www.faz.net,Hans im Unglück,Wie sich die Inflation durch die Generationen frisst: Von den Erfahrungen der Deutschen im Jahr 1923 zum jüngsten Roman von Wolf Haas. Aber kann man wirklich von einem kollektiven Trauma sprechen?,https://media1.faz.net/ppmedia/aktuell/wirtschaft/3156515781/1.9164815/facebook_teaser_fplus/eine-kassiererin-gibt-einer.jpg,2023-09-08T16:56:35Z,https://web.archive.org/web/20230911014256/https://www.faz.net/aktuell/wirtschaft/hans-im-unglueck-19160640.html,Meine Mutter wurde im Jahr der Hyperinflation geboren. 1923 erreichte die seit Jahren tobende Geldentwertung ihren Höhepunkt. Sie blieb für das ganze Leben meiner Mutter bestimmend. Und dann auch für… [+616 chars],,de,'Inflation'
https://www.jungewelt.de/artikel/458624.energiepolitik-lng-arbeiter-im-streik.html,https://www.jungewelt.de/artikel/458624.energiepolitik-lng-arbeiter-im-streik.html,0,www.jungewelt.de,Energiepolitik: LNG-Arbeiter im Streik,Arbeitskampf beim US-Energiekonzern Chevron in Australien lässt weltweit Gaspreise steigen • Foto: Chevron/Handout via REUTERS,https://www.jungewelt.de/img/1100/185196.jpg,2023-09-08T17:40:37Z,https://web.archive.org/web/20230909032813/https://www.jungewelt.de/artikel/458624.energiepolitik-lng-arbeiter-im-streik.html,Der Streik ist da. Arbeitskampfmaßnahmen in Nordwestaustralien haben am Freitag einen Anstieg der Gaspreise ausgelöst. Nach mehrwöchigen ergebnislosen Verhandlungen um Löhne und Arbeitsbedingungen be… [+1857 chars],,de,'LNG'
https://www.tagesschau.de/newsticker/liveblog-ukraine-mittwoch-256.html,https://www.tagesschau.de/newsticker/liveblog-ukraine-mittwoch-256.html,0,www.tagesschau.de,Liveblog: ++ Russland meldet erneute Angriffe auf Brjansk ++,Der russische Regionalgouverneur Bogomas wirft der Ukraine erneute Attacken auf die Grenzstadt Brjansk vor. Die Internationale Atomenergiebehörde fordert erweiterten Zugang zur Anlage des AKW Saporischschja. Alle Entwicklungen im Liveblog.,https://images.tagesschau.de/image/5b073b67-29bf-4703-b6b1-71469e4c25bb/AAABinEp3YU/AAABibBxqrQ/16x9-1280/flagge-ukraine-truemmer-101.jpg,2023-09-08T20:08:48Z,https://web.archive.org/web/20230721232814/https://www.tagesschau.de/newsticker/liveblog-ukraine-mittwoch-256.html,"Stand: 08.09.2023 22:08 Uhr
Der russische Regionalgouverneur Bogomas wirft der Ukraine erneute Attacken auf die Grenzstadt Brjansk vor. Die Internationale Atomenergiebehörde fordert erweiterten Zuga… [+23250 chars]",,de,'Stromversorgung'
https://orf.at/stories/3330517/,https://orf.at/stories/3330517/,0,orf.at,China zahlt viel weniger für russisches Gas als Europa,,https://orf.at/mojo/1_4_1/storyserver//news/common/images/og-fallback-news.png,2023-09-08T21:37:18Z,https://web.archive.org/web/20230909032710/https://orf.at/stories/3330517/,"Russland erhält einem Regierungsbericht zufolge für sein Pipeline-Erdgas von China deutlich weniger Geld als von Europa. Zudem dürfte der Preis für die Volksrepublik in den kommenden Jahren sinken, h… [+1156 chars]",,de,'Gas Pipeline'
https://www.tagesschau.de/newsticker/liveblog-ukraine-samstag-312.html,https://www.tagesschau.de/newsticker/liveblog-ukraine-samstag-312.html,0,www.tagesschau.de,Liveblog : ++ IAEA berichtet von Explosionen nahe AKW ++,LAut IAEA-Chef Grassi sind nahe des ukrainischen AKW Saporischschja vermehrt Explosionen zu hören. Präsident Selenskyj ruft zu weiteren Sanktionen gegen Russland auf. Alle Entwicklungen im Liveblog.,https://images.tagesschau.de/image/02ee5d5e-455f-40db-9c97-c0164be51e3f/AAABiDRXQfI/AAABibBxqrQ/16x9-1280/saporischschja-135.jpg,2023-09-09T01:36:10Z,https://web.archive.org/web/20230909020309/https://www.tagesschau.de/newsticker/liveblog-ukraine-samstag-312.html,"Stand: 09.09.2023 03:36 Uhr
LAut IAEA-Chef Grassi sind nahe des ukrainischen AKW Saporischschja vermehrt Explosionen zu hören. Präsident Selenskyj ruft zu weiteren Sanktionen gegen Russland auf. All… [+1921 chars]",,de,'Akw'
https://www.zeit.de/politik/ausland/2023-09/ukraine-ueberblick-sanktionen-kaempfe-akw-saporischschja,https://www.zeit.de/politik/ausland/2023-09/ukraine-ueberblick-sanktionen-kaempfe-akw-saporischschja,0,www.zeit.de,"Ukraine-Überblick: Selenskyj fordert offensivere Sanktionen, Kämpfe um AKW Saporischschja","Präsident Selenskyj wirft den Verbündeten vor, die Sanktionen gegen Russland gelockert zu haben. Russland meldet weitere Drohnenangriffe auf Brjansk. Das war die Nacht.",,2023-09-09T03:15:03Z,,"When browsing with ads:
We collect personal data and also transmit it to third-party providers
 that help us improve and finance our digital content. Some of the information stored on your device, … [+821 chars]",,de,'AKW'
https://www.welt.de/politik/ausland/article247377306/Ukraine-News-IAEA-sieht-Anzeichen-fuer-mehr-Kaempfe-rund-um-AKW-Saporischschja.html,https://www.welt.de/politik/ausland/article247377306/Ukraine-News-IAEA-sieht-Anzeichen-fuer-mehr-Kaempfe-rund-um-AKW-Saporischschja.html,0,www.welt.de,IAEA sieht Anzeichen für mehr Kämpfe rund um AKW Saporischschja,Rund um das von Russland besetzte ukrainische Kernkraftwerk Saporischschja kommt es laut der Internationalen Atomenergiebehörde vermehrt zu kämpferischen Auseinandersetzungen. In den vergangenen Wochen seien zahlreiche Explosionen zu hören gewesen. Mehr im Li…,https://img.welt.de/img/politik/ausland/mobile247377320/1661353127-ci16x9-w1200/FILE-PHOTO-FILE-PHOTO-IAEA-expert-mission-visits-Zaporizhzhia-N.jpg,2023-09-09T03:56:06Z,https://web.archive.org/web/20230909045653/https://www.welt.de/politik/ausland/article247377306/Ukraine-News-IAEA-sieht-Anzeichen-fuer-mehr-Kaempfe-rund-um-AKW-Saporischschja.html,Im von russischen Truppen besetzten ukrainischen Kernkraftwerk Saporischschja stationierte Experten der Internationalen Atomenergiebehörde (IAEA) haben in der vergangenen Woche zahlreiche Explosionen… [+8244 chars],,de,'Akw'
https://www.faz.net/aktuell/politik/ausland/ukraine-krieg-iaea-explosionen-nahe-akw-saporischschja-19162159.html,https://www.faz.net/aktuell/politik/ausland/ukraine-krieg-iaea-explosionen-nahe-akw-saporischschja-19162159.html,0,www.faz.net,IAEA berichtet von Explosionen nahe AKW Saporischschja,Die Internationale Atombehörde meldet für die vergangene Woche verstärkte Kämpfe rund um das AKW Saporischschja. Präsident Selenkyj ruft indes zu mehr Sanktionen gegen Russland auf. Der Überblick.,https://media1.faz.net/ppmedia/aktuell/264740642/1.9162187/facebook_teaser/ein-russischer-soldat.jpg,2023-09-09T04:21:01Z,,Die Internationalen Atomenergiebehörde (IAEA) berichtet von verstärkten militärischen Aktivitäten rund um das von russischen Truppen besetzte ukrainische Kernkraftwerk Saporischschja. Die ersten zehn… [+2940 chars],,de,'AKW'
