index,url,valid,domain,title,description,image,published,archive,content,quote,language,keyword
https://www.welt.de/politik/ausland/article699bef01ee35d0f0647c4345/ukraine-krieg-belgien-kapert-tanker-der-russischen-schattenflotte-liveticker.html,https://www.welt.de/politik/ausland/article699bef01ee35d0f0647c4345/ukraine-krieg-belgien-kapert-tanker-der-russischen-schattenflotte-liveticker.html,0,www.welt.de,Belgien kapert Tanker der russischen Schattenflotte,"Bundeskanzler Friedrich Merz steht Gesprächen mit dem Kreml grundsätzlich offen gegenüber, sagt er. Derzeit seien solche Formate angesichts der russischen Kriegsführung aber sinnlos. Und: Rund um das Atomkraftwerk Saporischschja soll eine Waffenruhe gelten. M…",https://images.welt.de/699bef01ee35d0f0647c4345/f70f4d7d153cd291194ca0718cd66a2d/ci16x9-w1200/260301-belgium-schattenflotte-jpeg,2026-03-01T05:12:00Z,,Belgien hat einen Tanker der russischen Schattenflotte gekapert. Das Schiff soll in den Hafen von Seebrügge geschleppt werden. Frankreich unterstützte die Operation. Mehr im Liveticker.Die Ukraine se… [+19007 chars],,de,'Schattenflotte'
https://www.welt.de/wirtschaft/plus69a2f2ef7c787f6a1cef21cb/heizungsgesetz-strom-gas-bio-quoten-diese-fragen-muessen-sich-hausbesitzer-jetzt-stellen.html,https://www.welt.de/wirtschaft/plus69a2f2ef7c787f6a1cef21cb/heizungsgesetz-strom-gas-bio-quoten-diese-fragen-muessen-sich-hausbesitzer-jetzt-stellen.html,0,www.welt.de,"Strom, Gas und Bio-Quoten – Diese Grundsatzfragen müssen sich Hausbesitzer jetzt stellen","Die Eckpunkte des neuen Heizungsgesetzes sind bekannt, auf den zweiten Blick aber sind viele Punkte noch offen – auch für Eigentümer, die gerade erst eine neue Heizung eingebaut haben. Für alle Hausbesitzer, die ans Gasnetz angeschlossen sind, stellt sich ein…",https://images.welt.de/69a2f2ef7c787f6a1cef21cb/395851dcae45244ae0bae2040d302c00-master/ci16x9-w1200/gettyimages-1359726676-jpg,2026-03-01T14:37:23Z,,"Die Eckpunkte des neuen Heizungsgesetzes sind bekannt, auf den zweiten Blick aber sind viele Punkte noch offen auch für Eigentümer, die gerade erst eine neue Heizung eingebaut haben. Für alle Hausbes… [+92 chars]",,de,'Gasnetz'
https://orf.at/stories/3421768/,https://orf.at/stories/3421768/,0,orf.at,Badelt rechnet mit höheren Energiepreisen,Der Angriff Israels und der USA auf den Iran wird sich zumindest kurzfristig auch hierzulande auf die Energiepreise niederschlagen. Das sagte Fiskalratspräsident Christoph Badelt am Sonntag in der ORF-„Pressestunde“. Der Weltmarkt reagiere bereits auf den Aus…,https://ibs.orf.at/news?image=https%3A%2F%2Fassets.orf.at%2Fmims%2F2026%2F10%2F57%2Fcrops%2Fw%3D1200%2Ch%3D630%2Cq%3D75%2F2953197_master_1141757_pressestunde_badelt_edit_o.jpg%3Fs%3D428fa3a5be99f9fea07be2fc5003ca65d5fccd22,2026-03-01T15:35:15Z,,"Österreich sei durch die Blockade der Meerenge zwischen dem Iran und Oman speziell betroffen, weil dadurch kein Flüssiggas aus Katar mehr geliefert werden kann. Da stellt sich die Frage, wie schnell … [+3878 chars]",,de,'Energiepreise'
https://t3n.de/news/ki-chatbots-energieversorger-kundenservice-1725917/,https://t3n.de/news/ki-chatbots-energieversorger-kundenservice-1725917/,0,t3n.de,Wenn Energieversorger umdenken müssen,"Die Energiewirtschaft steht vor einer doppelten Herausforderung: Während Netze, Erzeugung und Regulierung immer komplexer werden, steigen gleichzeitig die Erwartungen der Kundinnen und Kunden an Transparenz, Erreichbarkeit und Servicequalität.
weiterlesen auf…",https://cdn.t3n.de/news/wp-content/uploads/2026/01/Shutterstock_2557414933.jpg?class=content,2026-03-01T17:30:00Z,,"Verpasse keine News mehr!
Die Energiewirtschaft steht vor einer doppelten Herausforderung: Während Netze, Erzeugung und Regulierung immer komplexer werden, steigen gleichzeitig die Erwartungen der K… [+4934 chars]",,de,'Energiemarkt'
https://www.n-tv.de/politik/Ministerin-Reiche-erwartet-trotz-Nahost-Konflikt-keine-Gasknappheit-id30419258.html,https://www.n-tv.de/politik/Ministerin-Reiche-erwartet-trotz-Nahost-Konflikt-keine-Gasknappheit-id30419258.html,0,www.n-tv.de,Höhere Energiepreise drohen: Ministerin Reiche erwartet trotz Nahost-Konflikt keine Gasknappheit,"Nach den amerikanisch-israelischen Angriffen auf den Iran sorgt die Lage an der Straße von Hormus für Unruhe. Das Bundeswirtschaftsministerium rechnet zwar mit höheren Energiepreisen, aber nicht mit Engpässen.",https://www.n-tv.de/img/30419269/1772394718/Img_16_9/1200/Katherina-Reiche-CDU-Bundesministerin-fuer-Wirtschaft-und-Energie-stellt-in-der-Bundespressekonferenz-den-Jahreswirtschaftsbericht-2026-vor-Berlin-28-01-2026.jpg,2026-03-01T19:37:47Z,,"Katherina Reiche sieht Deutschland bei Gas- und Öl-Lieferanten breit aufgestellt. (Foto: picture alliance / photothek.de)
Nach den amerikanisch-israelischen Angriffen auf den Iran sorgt die Lage an … [+1304 chars]",,de,'Gasknappheit'
https://www.telepolis.de/article/Erdoel-Krise-Stockender-Tankerverkehr-am-Persischen-Golf-11194406.html,https://www.telepolis.de/article/Erdoel-Krise-Stockender-Tankerverkehr-am-Persischen-Golf-11194406.html,0,www.telepolis.de,Erdöl-Krise: Stockender Tankerverkehr am Persischen Golf,Die Eskalation im Nahen Osten lähmt den Ölhandel durch die Straße von Hormus. Verbrauchern drohen höhere Spritpreise und eine neue Inflationswelle.,https://heise.cloudimg.io/bound/1200x1200/q85.png-lossy-85.webp-lossy-85.foil1/_www-heise-de_/imgs/18/5/0/3/6/8/8/0/shutterstock_2703971001-54eaf70aad6c51e7.jpg,2026-03-01T20:45:00Z,,"(Bild: jhxfilm / Shutterstock.com)
Die Eskalation im Nahen Osten lähmt den Ölhandel durch die Straße von Hormus. Verbrauchern drohen höhere Spritpreise und eine neue Inflationswelle.
Der Krieg, den… [+4192 chars]",,de,'Energiepreise'
https://www.welt.de/wirtschaft/article69a544694b8f567f12fcf086/iran-krise-gaspreis-schnellt-nach-oben-sprit-so-teuer-wie-seit-zwei-jahren-nicht-lufthansa-aktie-bricht-ein.html,https://www.welt.de/wirtschaft/article69a544694b8f567f12fcf086/iran-krise-gaspreis-schnellt-nach-oben-sprit-so-teuer-wie-seit-zwei-jahren-nicht-lufthansa-aktie-bricht-ein.html,0,www.welt.de,Gaspreis schnellt nach oben – Sprit so teuer wie seit zwei Jahren nicht – Lufthansa-Aktie bricht ein,"Die Krise im Iran schlägt sich auch an der Börse nieder: Zu Handelsbeginn rutscht der Dax, der Gold steigt dagegen deutlich. Auch Öl und andere Rohstoffe werden teurer. Das merkt man vor allem an der Tankstelle.",https://images.welt.de/69a544694b8f567f12fcf086/f144381cc87c074fc0d7523c30670e52/ci16x9-w1200/549813899-jpg,2026-03-02T08:12:18Z,,"Die Krise im Iran schlägt sich auch an der Börse nieder: Zu Handelsbeginn rutscht der Dax, der Gold steigt dagegen deutlich. Auch Öl und andere Rohstoffe werden teurer. Das merkt man vor allem an der… [+3761 chars]",,de,'Gaspreis'
https://www.stern.de/gesellschaft/regional/sachsen-anhalt/energiepolitik--industrie-mahnt-schnelleren-ausbau-der-energieversorgung-an-37182806.html,https://www.stern.de/gesellschaft/regional/sachsen-anhalt/energiepolitik--industrie-mahnt-schnelleren-ausbau-der-energieversorgung-an-37182806.html,0,www.stern.de,Energiepolitik: Industrie mahnt schnelleren Ausbau der Energieversorgung an,Hohe Energiekosten belasten die Wirtschaft in Sachsen-Anhalt. Warum die Industrie jetzt schnellere Entscheidungen und mehr Eigenständigkeit beim Ausbau der Energieversorgung fordert.,https://image.stern.de/37182808/t/8K/v1/w1440/r1.7778/-/02--somcsipz3ev5axs2048jpeg---f931e0aa692f29ea.jpg,2026-03-02T09:14:29Z,,"Kopiere den aktuellen Link
Zur Merkliste hinzufügen
Hohe Energiekosten belasten die Wirtschaft in Sachsen-Anhalt. Warum die Industrie jetzt schnellere Entscheidungen und mehr Eigenständigkeit beim … [+1569 chars]",,de,'Energiepolitik'
https://www.zeit.de/news/2026-03/02/industrie-mahnt-schnelleren-ausbau-der-energieversorgung-an,https://www.zeit.de/news/2026-03/02/industrie-mahnt-schnelleren-ausbau-der-energieversorgung-an,0,www.zeit.de,Energiepolitik: Industrie mahnt schnelleren Ausbau der Energieversorgung an,Hier finden Sie Informationen zu dem Thema „Energiepolitik“. Lesen Sie jetzt „Industrie mahnt schnelleren Ausbau der Energieversorgung an“.,https://img.zeit.de/news/2026-03/02/industrie-mahnt-schnelleren-ausbau-der-energieversorgung-an-image-group/wide__1300x731,2026-03-02T09:14:29Z,,Die Wirtschaft in Sachsen-Anhalt fordert eine stärkere energiepolitische Eigenständigkeit und schnellere Entscheidungen beim Ausbau der Energieversorgung. «Wir brauchen mehr energiepolitische Souverä… [+1351 chars],,de,'Energieversorgung'
https://www.bild.de/politik/ausland-und-internationales/strasse-von-hormus-dicht-mullah-blockade-koennte-oel-schock-ausloesen-69a54c4e4b8f567f12fcf171,https://www.bild.de/politik/ausland-und-internationales/strasse-von-hormus-dicht-mullah-blockade-koennte-oel-schock-ausloesen-69a54c4e4b8f567f12fcf171,0,www.bild.de,Straße von Hormus dicht - Mullah-Blockade könnte Öl-Schock auslösen,Hormus-Blockade bedroht globale Öl- und Gasversorgung und treibt Energiepreise hoch.,"https://images.bild.de/69a54c4e4b8f567f12fcf171/dcca16d65feddca3ec5a8e43e5b5ae37,a9790390?w=1280",2026-03-02T11:27:43Z,,TTS-Player überspringenArtikel weiterlesenAl-Chasab Dieses schmale See-Tor ist die Schlagader der globalen Wirtschaft. Und jetzt ist die Straße von Hormus im Würgegriff der Mullahs. Nichts geht mehr.… [+2820 chars],,de,'Energieversorgung'
https://orf.at/stories/3421970/,https://orf.at/stories/3421970/,0,orf.at,Angriff auf Iran lässt Energiepreise steigen,"Nach dem Angriff Israels und der USA auf den Iran ist der Großhandelspreis von Erdgas kräftig gestiegen. Der Preis betrug am Montag zu Handelsbeginn etwa 25 Prozent mehr als am Freitag, es war der stärkste Preissprung seit August 2023. Auch die Ölpreise legte…",https://ibs.orf.at/news?image=https%3A%2F%2Fassets.orf.at%2Fmims%2F2026%2F10%2F13%2Fcrops%2Fw%3D1200%2Ch%3D630%2Cq%3D75%2F2954501_master_1142213_iran_krieg_oel_gas_r.jpg%3Fs%3D690c54d49f29e18b8ba142163944fd55bdd975b4,2026-03-02T12:29:18Z,,Die Straße von Hormus ist eine der wichtigsten Engstellen des weltweiten Energiehandels. Rund ein Fünftel der globalen Öltransporte passiert täglich die Meerenge in der ölreichen Region am Persischen… [+3931 chars],,de,'Energieversorgung'
https://www.stern.de/wirtschaft/news/folgen-fuer-die-wirtschaft--iran-krieg-trifft-deutschland--sprit-und-gas-deutlich-teurer-37183546.html,https://www.stern.de/wirtschaft/news/folgen-fuer-die-wirtschaft--iran-krieg-trifft-deutschland--sprit-und-gas-deutlich-teurer-37183546.html,0,www.stern.de,Folgen für die Wirtschaft: Iran-Krieg trifft Deutschland: Sprit und Gas deutlich teurer,Der Irankonflikt hat Folgen für Verbraucher und Wirtschaft - von steigenden Kosten für Heizen und Tanken über sinkende Aktienkurse bis Sorgen um die Konjunktur. Viel hängt von der Dauer des Kriegs ab.,https://image.stern.de/37183790/t/9r/v1/w1440/r1.7778/-/02--qod5shm4n3v1axs2048jpeg---2c09ea15c4e45baf.jpg,2026-03-02T12:39:30Z,,"Kopiere den aktuellen Link
Zur Merkliste hinzufügen
Der Irankonflikt hat Folgen für Verbraucher und Wirtschaft - von steigenden Kosten für Heizen und Tanken über sinkende Aktienkurse bis Sorgen um … [+6329 chars]",,de,'Gas Wirtschaft'
https://www.zeit.de/news/2026-03/02/prognos-bayerns-klimaziel-2040-in-weiter-ferne,https://www.zeit.de/news/2026-03/02/prognos-bayerns-klimaziel-2040-in-weiter-ferne,0,www.zeit.de,Umbau der Energieversorgung: Prognos: Bayerns Klimaziel 2040 in weiter Ferne,Hier finden Sie Informationen zu dem Thema „Umbau der Energieversorgung“. Lesen Sie jetzt „Prognos: Bayerns Klimaziel 2040 in weiter Ferne“.,https://img.zeit.de/news/2026-03/02/prognos-bayerns-klimaziel-2040-in-weiter-ferne-image-group/wide__1300x731,2026-03-02T13:01:33Z,,Das einst von Ministerpräsident Markus Söder (CSU) verkündete Ziel eines klimaneutralen Bayern im 2040 liegt nach wie vor in weiter Ferne. Im mittlerweile 14. Jahresgutachten des Basler Prognos-Insti… [+2948 chars],,de,'Energieversorgung'
https://www.stern.de/gesellschaft/regional/bayern/umbau-der-energieversorgung--prognos--bayerns-klimaziel-2040-in-weiter-ferne-37183872.html,https://www.stern.de/gesellschaft/regional/bayern/umbau-der-energieversorgung--prognos--bayerns-klimaziel-2040-in-weiter-ferne-37183872.html,0,www.stern.de,Umbau der Energieversorgung: Prognos: Bayerns Klimaziel 2040 in weiter Ferne,Seit 14 Jahren lässt die bayerische Wirtschaft die Fortschritte der Energiewende vom Basler Prognos-Institut bewerten. Noch kein einziges Mal gab es gute Noten für Bund und Staatsregierung.,https://image.stern.de/37183874/t/c9/v1/w1440/r1.7778/-/02--s7ayzkqxsav9axs2048jpeg---9622064d089f3f35.jpg,2026-03-02T13:01:33Z,,"Kopiere den aktuellen Link
Zur Merkliste hinzufügen
Seit 14 Jahren lässt die bayerische Wirtschaft die Fortschritte der Energiewende vom Basler Prognos-Institut bewerten. Noch kein einziges Mal gab… [+3153 chars]",,de,'Energieversorgung'
https://www.focus.de/finanzen/boerse-liveticker-dax-stabil-china-kauft-mehr-russland-oel_fbf42556-1c31-450c-a1d0-25aae06dc69c.html,https://www.focus.de/finanzen/boerse-liveticker-dax-stabil-china-kauft-mehr-russland-oel_fbf42556-1c31-450c-a1d0-25aae06dc69c.html,0,www.focus.de,QatarEnergy stellt LNG-Produktion im Nahen Osten ein,"USA und Israel greifen Iran weiter an, Teheran schlägt zurück. Alle Folgen für Börse und Weltwirtschaft im Liveticker.",https://quadro.burda-forward.de/ctf/e3705113-6b53-47a2-b12a-b8165df043dd.7593e353-88e9-4748-834f-034f6dabc879.jpg?im=RegionOfInterestCrop%3D%281200%2C630%29%2CregionOfInterest%3D%28752%2C279%29&hash=eb898cb9c84f345344d196cbeef4c736e1da5e2f9b517ebeb109bbcf9bdbf9da,2026-03-02T13:11:00Z,,"Gaspreise im Höhenflug: Katar-Ausfall schockt den Markt
14.01 Uhr: Die Eskalation im Nahen Osten bringt die Energiemärkte massiv unter Druck: Der staatliche Produzent QatarEnergy hat seine LNG-Produ… [+18999 chars]",,de,'LNG'
https://www.stern.de/gesellschaft/regional/sachsen-anhalt/industrie-im-wandel--wirtschaftsdialog-zwischen-strukturwandel-und-nahost-krieg-37183476.html,https://www.stern.de/gesellschaft/regional/sachsen-anhalt/industrie-im-wandel--wirtschaftsdialog-zwischen-strukturwandel-und-nahost-krieg-37183476.html,0,www.stern.de,Industrie im Wandel: Wirtschaftsdialog zwischen Strukturwandel und Nahost-Krieg,"Steigende Energiepreise, Strukturwandel und Wachstumsfelder: Auf der regionalpolitischen Jahrestagung geht es um die Zukunft der ostdeutschen Industrie. Dabei geraten auch globale Krisen in den Blick.",https://image.stern.de/37184038/t/TK/v1/w1440/r1.7778/-/02--fhecxiet6pv3axs2048jpeg---0d480dff12af8b82.jpg,2026-03-02T13:30:40Z,,"Kopiere den aktuellen Link
Zur Merkliste hinzufügen
Steigende Energiepreise, Strukturwandel und Wachstumsfelder: Auf der regionalpolitischen Jahrestagung geht es um die Zukunft der ostdeutschen Ind… [+4151 chars]",,de,'Energiepreise'
https://www.stern.de/news/energiepreise--iran-krieg-laesst-spritpreise-immer-weiter-steigen-37182588.html,https://www.stern.de/news/energiepreise--iran-krieg-laesst-spritpreise-immer-weiter-steigen-37182588.html,0,www.stern.de,Energiepreise: Iran-Krieg lässt Spritpreise immer weiter steigen,Der Konflikt macht sich an den Zapfsäulen bemerkbar. Nach Hochs am Sonntag legen die Preise am Montag weiter zu. Beim Heizöl fällt der Sprung noch deutlicher aus.,https://image.stern.de/37184564/t/6F/v1/w1440/r1.7778/-/02--6ky6zasgu6v2axs2048jpeg---76094c19a154360a.jpg,2026-03-02T15:03:56Z,,"Kopiere den aktuellen Link
Zur Merkliste hinzufügen
Der Konflikt macht sich an den Zapfsäulen bemerkbar. Nach Hochs am Sonntag legen die Preise am Montag weiter zu. Beim Heizöl fällt der Sprung noc… [+3442 chars]",,de,'Heizöl'
https://www.focus.de/finanzen/news/lng-riese-schockt-europa-wall-street-trotzt-dem-krieg_b8564b28-0c19-4faf-a1a1-a6d836cce90c.html,https://www.focus.de/finanzen/news/lng-riese-schockt-europa-wall-street-trotzt-dem-krieg_b8564b28-0c19-4faf-a1a1-a6d836cce90c.html,0,www.focus.de,LNG-Riese schockt Europa – Wall Street trotzt dem Krieg,"USA und Israel greifen Iran weiter an, Teheran schlägt zurück. Alle Folgen für Börse und Weltwirtschaft im Liveticker.",https://quadro.burda-forward.de/ctf/e3705113-6b53-47a2-b12a-b8165df043dd.7593e353-88e9-4748-834f-034f6dabc879.jpg?im=RegionOfInterestCrop%3D%281200%2C630%29%2CregionOfInterest%3D%28752%2C279%29&hash=eb898cb9c84f345344d196cbeef4c736e1da5e2f9b517ebeb109bbcf9bdbf9da,2026-03-02T16:03:00Z,,"16.40 Uhr: Die US-Börsen haben mit moderaten Verlusten auf den Militärschlag reagiert. Der S&amp;P 500 notierte eine Stunde nach Handelsstart rund 0,5 Prozent im Minus. In einer ähnlichen Größenordnu… [+21281 chars]",,de,'LNG'
https://www.stern.de/gesellschaft/regional/niedersachsen-bremen/energiewende--hannover-schaltet-ersten-block-seines-kohlekraftwerks-ab-37185096.html,https://www.stern.de/gesellschaft/regional/niedersachsen-bremen/energiewende--hannover-schaltet-ersten-block-seines-kohlekraftwerks-ab-37185096.html,0,www.stern.de,Energiewende: Hannover schaltet ersten Block seines Kohlekraftwerks ab,"Hannover macht Ernst beim Kohleausstieg: Der erste Block des Kraftwerks Stöcken ging nun vom Netz, in zwei Jahren soll auch der zweite folgen. Was das für die Energieversorgung bedeutet.",https://image.stern.de/37185098/t/Gv/v1/w1440/r1.7778/-/02--a5rdsa5z3fv8axs2048jpeg---2cf8041f7c61a593.jpg,2026-03-02T18:00:04Z,,"Kopiere den aktuellen Link
Zur Merkliste hinzufügen
Hannover macht Ernst beim Kohleausstieg: Der erste Block des Kraftwerks Stöcken ging nun vom Netz, in zwei Jahren soll auch der zweite folgen. Wa… [+2068 chars]",,de,'Kohleausstieg'
https://www.stern.de/wirtschaft/news/iran-krieg--spritpreis-steigt-immer-weiter---diesel-ueberholt-e10-37185878.html,https://www.stern.de/wirtschaft/news/iran-krieg--spritpreis-steigt-immer-weiter---diesel-ueberholt-e10-37185878.html,0,www.stern.de,Iran-Krieg: Spritpreis steigt immer weiter - Diesel überholt E10,"München - Der Iran-Krieg lässt die Preise für Sprit und Heizöl weiter steigen. Am Morgen setzte sich der Anstieg der vergangenen Tage fort, wie Daten",https://image.stern.de/37186208/t/AJ/v1/w1440/r1.7778/-/03--v6vfuwiwpkv5axs2048jpeg---ed7b307d4ba594e2.jpg,2026-03-03T09:15:37Z,,"Kopiere den aktuellen Link
Zur Merkliste hinzufügen
Der Krieg im Nahen Osten macht Rohöl und damit auch Tanken und Heizen teurer. Am Dienstag geht der Anstieg weiter, wie erste Daten des ADAC zeige… [+3017 chars]",,de,'Energiepreise'
https://www.stern.de/gesellschaft/regional/sachsen/energie--so-wirkt-sich-der-iran-krieg-auf-die-gaspreise-aus-37186568.html,https://www.stern.de/gesellschaft/regional/sachsen/energie--so-wirkt-sich-der-iran-krieg-auf-die-gaspreise-aus-37186568.html,0,www.stern.de,Energie: So wirkt sich der Iran-Krieg auf die Gaspreise aus,"Der Krieg im Nahen Osten lässt die Weltmarktpreise für Gas in die Höhe schnellen. Macht sich das in Sachsen, Sachsen-Anhalt und Thüringen auch an der Heizrechnung bemerkbar?",https://image.stern.de/37186570/t/ru/v1/w1440/r1.7778/-/03--bsjbww37jqv4axs2048jpeg---63bcc09a37068909.jpg,2026-03-03T10:29:39Z,,"Kopiere den aktuellen Link
Zur Merkliste hinzufügen
Der Krieg im Nahen Osten lässt die Weltmarktpreise für Gas in die Höhe schnellen. Macht sich das in Sachsen, Sachsen-Anhalt und Thüringen auch an… [+1946 chars]",,de,'Gaskrise'
https://www.welt.de/wirtschaft/article69a6b1f7591973eb82a38ebb/krieg-im-iran-gaspreis-steigt-dramatisch-diesel-ueberholt-e10-linnemann-sieht-sehr-brenzlige-situation.html,https://www.welt.de/wirtschaft/article69a6b1f7591973eb82a38ebb/krieg-im-iran-gaspreis-steigt-dramatisch-diesel-ueberholt-e10-linnemann-sieht-sehr-brenzlige-situation.html,0,www.welt.de,Gaspreis steigt dramatisch – Diesel überholt E10 – Linnemann sieht „sehr brenzlige Situation“,"Der Krieg im Nahen Osten lässt Öl- und Gaspreise kräftig steigen, der Dax bricht ein. Autofahrer und Heizölkunden spüren die Folgen bereits – und bei weiterer Eskalation drohen noch deutlich höhere Preise.",https://images.welt.de/69a6b1f7591973eb82a38ebb/5c75d0f25284f2c4069e5811adae120d/ci16x9-w1200/2026-03-02t141332z-1972868938-rc2bwjatwjkf-rtrmadp-3-iran-crisis-germany-fuel-jpg,2026-03-03T11:21:21Z,,"Der Krieg im Nahen Osten lässt Öl- und Gaspreise kräftig steigen, der Dax bricht ein. Autofahrer und Heizölkunden spüren die Folgen bereits und bei weiterer Eskalation drohen noch deutlich höhere Pre… [+5070 chars]",,de,'Heizöl'
https://www.focus.de/finanzen/news/experten-warnen-kampf-um-us-fluessiggas-europa-gegen-china_b8564b28-0c19-4faf-a1a1-a6d836cce90c.html,https://www.focus.de/finanzen/news/experten-warnen-kampf-um-us-fluessiggas-europa-gegen-china_b8564b28-0c19-4faf-a1a1-a6d836cce90c.html,0,www.focus.de,Experten warnen: Kampf um US-Flüssiggas – Europa gegen China,"USA und Israel greifen Iran weiter an, Teheran schlägt zurück. Alle Folgen für Börse und Weltwirtschaft im Liveticker.",https://quadro.burda-forward.de/ctf/85a1ee42-798e-41b7-a65f-584daf96793a.ac31eaf4-4250-46b9-93f4-cd7c93220108.jpg?im=RegionOfInterestCrop%3D%281200%2C630%29%2CregionOfInterest%3D%282925%2C2132%29&hash=01cd54046c3e2cb5d9ed8e9c4d3cf18ba9f93d9d6c0937908167bf8054eb5685,2026-03-03T11:49:00Z,,"Tauziehen zwischen Europa und Asien
14.56 Uhr: Analystin Natasha Fielding warnt vor weiter explodierenden Gaspreisen: 
""Wir könnten mit jedem weiteren Tag, an dem die Straße von Hormus faktisch ges… [+31395 chars]",,de,'Heizöl'
https://www.tagesschau.de/wirtschaft/finanzen/marktbericht-inflation-eurozone-iran-krieg-100.html,https://www.tagesschau.de/wirtschaft/finanzen/marktbericht-inflation-eurozone-iran-krieg-100.html,0,www.tagesschau.de,Marktbericht: Inflation im Euroraum überraschend gestiegen,Die Inflation im Euroraum hat bereits vor dem am Samstag ausgebrochenen Nahost-Krieges überraschend angezogen. Anleger blicken heute aber vor allem auf die Energiemärkte - und es herrscht große Verunsicherung.,https://images.tagesschau.de/image/55a64147-f1c5-4803-a742-81ab0d80f0f6/AAABnLKv7ks/AAABmyZE0EA/16x9-big/inflation-eurozone-154.jpg?width=1280,2026-03-03T12:18:22Z,,"Stand: 03.03.2026 13:18 Uhr
Die Inflation im Euroraum hat bereits vor dem am Samstag ausgebrochenen Nahost-Krieges überraschend angezogen. Anleger blicken heute aber vor allem auf die Energiemärkte … [+5072 chars]",,de,'Energiepolitik'
https://www.telepolis.de/article/Erdgas-Katar-Ausfall-trifft-Europa-zur-Unzeit-11197395.html,https://www.telepolis.de/article/Erdgas-Katar-Ausfall-trifft-Europa-zur-Unzeit-11197395.html,0,www.telepolis.de,Erdgas: Katar-Ausfall trifft Europa zur Unzeit,Die größte LNG-Anlage der Welt steht still – und die wichtigste Exportroute ist dicht. Europa droht ein Preisschock schlimmer als 2022.,https://heise.cloudimg.io/bound/1200x1200/q85.png-lossy-85.webp-lossy-85.foil1/_www-heise-de_/imgs/18/5/0/3/8/4/0/5/shutterstock_677749657-4473a7ca3b78066e.jpg,2026-03-03T13:25:00Z,,"(Bild: Igor Grochev / Shutterstock.com)
Die größte LNG-Anlage der Welt steht still und die wichtigste Exportroute ist dicht. Europa droht ein Preisschock schlimmer als 2022.
Europas Erdgasmarkt erl… [+3651 chars]",,de,'Gas Industrie'
https://vorarlberg.orf.at/stories/3344219/,https://vorarlberg.orf.at/stories/3344219/,0,vorarlberg.orf.at,Rechtzeitig auf dem Energiemarkt eingekauft,"Je länger der Krieg im Iran dauert, umso stärker werden die Energiepreise am Weltmarkt wohl steigen. Die Vorarlberger Haushalte und Betriebe spüren in der eigenen Energieversorgung vorerst nichts davon. Denn die illwerke vkw versprechen eine Preisgarantie bis…",https://ibs.orf.at/vbg?image=https%3A%2F%2Foekastatic.orf.at%2Fmims%2F2020%2F10%2F40%2Fcrops%2Fw%3D1200%2Ch%3D627%2Cq%3D75%2F496510_master_167340_stromleitung.jpg%3Fs%3D499dedf84d0bd705744e1dfb3e4c1a06469cc718,2026-03-03T13:25:56Z,,"Nun gilt bis ins Frühjahr 2027 eine Garantie. Das heißt, die Preise sind bis 31. März 2027 fix. Mit einem neuen Produkt werden sogar Senkungen vorgenommen, erklärt der Landeshauptmann.
Tarife ab 1. … [+2487 chars]",,de,'Energiemarkt'
https://www.der-postillon.com/2026/03/wind-sonne.html,https://www.der-postillon.com/2026/03/wind-sonne.html,0,www.der-postillon.com,Mysteriös: Preise für Wind und Sonne trotz Irankrieg stabil,"Berlin (dpo) - Mit dem Irankrieg steigen hierzulande die Heizöl-, Gas- und Benzinpreise. Anders sieht es hingegen bei Wind und Sonne aus: Hier blieben die Preise bislang trotz des erbitterten Konflikts im sonnen- und windreichen Nahen Osten bemerkenswert stab…",https://blogger.googleusercontent.com/img/b/R29vZ2xl/AVvXsEgdInyl7n4KKQ12Czmycu4sHaJCXSTBQOGLeZlafTzrDIVXDEJKLNzCmnHJd7Gvv_tMho9RdTsC4pCTJ1Vb5UNiMZ1v4pmR36V2yfkyQdi3LidFOmTDaF9twCq2RVEHMxUk6hW9PdX-XKhU2isZ892ooO1l8-l8W6RF_Z7iP_CrB4Lta_BqeJxa2xQ2F4k/w1600/Preise-Sonne-Wind.jpg,2026-03-03T14:01:19Z,,"Berlin (dpo) - Mit dem Irankrieg steigen hierzulande die Heizöl-, Gas- und Benzinpreise. Anders sieht es hingegen bei Wind und Sonne aus: Hier blieben die Preise bislang trotz des erbitterten Konflik… [+1035 chars]",,de,'Heizöl'
https://www.sueddeutsche.de/meinung/energie-klimaschutz-iran-krieg-europa-sicherheitspolitik-li.3397093,https://www.sueddeutsche.de/meinung/energie-klimaschutz-iran-krieg-europa-sicherheitspolitik-li.3397093,0,www.sueddeutsche.de,"Energie: Der Iran-Krieg zeigt, wie verwundbar Europa durch seine Abhängigkeit von Öl und Gas ist","Europas Politiker haben den Klimaschutz zugunsten der Industrie in den Hintergrund gedrängt. Dabei zeigt der Iran-Krieg, dass Klimaschutz zugleich Sicherheitspolitik ist.",https://www.sueddeutsche.de/2026/03/03/01981c2a-8684-415f-b86a-e854d83b2215.jpg?q=60&fm=webp&width=1200&rect=0%2C121%2C2706%2C1522,2026-03-03T14:39:51Z,,"Das iranische Regime reagiert heftig auf die Angriffe der USA und Israels: Es attackiert Raffinerien in den Golfstaaten und in Saudi-Arabien, es hat die Straße von Hormus blockiert, eine der wichtigs… [+202 chars]",,de,'Krieg Gas'
