index,url,valid,domain,title,description,image,published,archive,content,quote,language,keyword
https://hallespektrum.de/nachrichten/wirtschaft/energieminister-willingmann-fordert-schnelleren-ausbau-des-stromnetzes/466188/,https://hallespektrum.de/nachrichten/wirtschaft/energieminister-willingmann-fordert-schnelleren-ausbau-des-stromnetzes/466188/,0,hallespektrum.de,Energieminister Willingmann fordert schnelleren Ausbau des Stromnetzes,"Der Energieminister von Sachsen-Anhalt, Prof. Dr. Armin Willingmann, hat im Landtag eine Beschleunigung des Stromnetzausbaus gefordert. Um den wachsenden Bedarf an erneuerbaren Energien zu decken, müsse insbesondere der Transport von Windstrom aus dem Norden …",https://hallespektrum.de/wp-content/uploads/2021/08/Strom.png,2024-06-11T11:54:09Z,,"Der Energieminister von Sachsen-Anhalt, Prof. Dr. Armin Willingmann, hat im Landtag eine Beschleunigung des Stromnetzausbaus gefordert. Um den wachsenden Bedarf an erneuerbaren Energien zu decken, mü… [+2460 chars]",,de,'Energieminister'
https://www.zeit.de/video/2024-06/6354805474112/ukraine-wiederaufbaukonferenz-luftverteidigung-ist-die-antwort-auf-alles,https://www.zeit.de/video/2024-06/6354805474112/ukraine-wiederaufbaukonferenz-luftverteidigung-ist-die-antwort-auf-alles,0,www.zeit.de,"Ukraine-Wiederaufbaukonferenz: ""Luftverteidigung ist die Antwort auf alles""","Sein Land benötige weitere Luftabwehrsysteme, so Präsident Selenskyj bei der Ukraine-Aufbaukonferenz in Berlin. Russland ziele derzeit primär auf die Energieversorgung.",https://img.zeit.de/video/2024-06/6354805474112-still/wide__1300x731,2024-06-11T13:15:48Z,,"Schließen
Hier können Sie interessante Artikel speichern, um sie später zu lesen und wiederzufinden.
Sie haben bereits ein Konto?
 Hier anmelden.",,de,'Energieversorgung'
https://www.tagesschau.de/ausland/europa/ukraine-kriegsschaeden-reparatur-100.html,https://www.tagesschau.de/ausland/europa/ukraine-kriegsschaeden-reparatur-100.html,0,www.tagesschau.de,Wie viel der Wiederaufbau der Ukraine kosten könnte,"Mit Raketen, Drohnen und Granaten zerstört Russland landesweit Gebäude und Infrastruktur in der Ukraine. Auch die Energieversorgung wird systematisch angegriffen. Andrea Beer über die finanziellen Kosten des Wiederaufbaus.",https://images.tagesschau.de/image/ef87756c-ca2f-456b-beda-02018dffeaa3/AAABkAeOMEU/AAABjwnlFvA/16x9-1280/truemmer-haus-ukraine-106.jpg,2024-06-11T15:18:14Z,,"Stand: 11.06.2024 17:18 Uhr
Mit Raketen, Drohnen und Granaten zerstört Russland landesweit Gebäude und Infrastruktur in der Ukraine. Auch die Energieversorgung wird systematisch angegriffen.Die fina… [+4193 chars]",,de,'Energieversorgung'
https://www.telepolis.de/features/Habeck-sucht-nach-Loesungen-fuer-Transit-von-Erdgas-durch-Ukraine-9758579.html,https://www.telepolis.de/features/Habeck-sucht-nach-Loesungen-fuer-Transit-von-Erdgas-durch-Ukraine-9758579.html,0,www.telepolis.de,Habeck sucht nach Lösungen für Transit von Erdgas durch Ukraine,"Die EU hängt an russischem Gas, obwohl sie unabhängiger werden wollte. Der Transitvertrag mit der Ukraine läuft aus. Findet Robert Habeck eine Lösung?",https://heise.cloudimg.io/bound/1200x1200/q85.png-lossy-85.webp-lossy-85.foil1/_www-heise-de_/imgs/18/4/6/1/1/4/3/5/shutterstock_2343857327-852013ee80aaaac5.jpeg,2024-06-11T16:00:00Z,,"(Bild: FOTOGRIN / Shutterstock.com)
Die EU hängt an russischem Gas, obwohl sie unabhängiger werden wollte. Der Transitvertrag mit der Ukraine läuft aus. Findet Robert Habeck eine Lösung?
Die Europä… [+3668 chars]",,de,'Gas Ukraine'
https://futurezone.at/science/forscher-wasser-schweben-akw-sicherer-machen-physik-leidenfrost-effekt/402911794,https://futurezone.at/science/forscher-wasser-schweben-akw-sicherer-machen-physik-leidenfrost-effekt/402911794,0,futurezone.at,"Forscher lassen Wasser schneller “schweben”, könnte Akw sicherer machen","Forschende haben eine neue Methode gefunden, wie sich der Leidenfrost-Effekt bereits ab 140 Grad Celsius erreichen lässt.",https://image.futurezone.at/images/facebook/8761372/46-32400276.jpg,2024-06-11T17:56:40Z,,"Forschende haben eine neue Methode gefunden, wie sich der Leidenfrost-Effekt bereits ab 140 Grad Celsius erreichen lässt.",,de,'Akw'
https://www.nzz.ch/wirtschaft/auf-der-suche-nach-500-milliarden-dollar-ld.1834484,https://www.nzz.ch/wirtschaft/auf-der-suche-nach-500-milliarden-dollar-ld.1834484,0,www.nzz.ch,"Ukraine-Konferenz: «Der beste Wiederaufbau ist der, der gar nicht stattfinden muss»",An der Berliner Ukraine-Wiederaufbaukonferenz hat der ukrainische Präsident Wolodimir Selenski um Unterstützung zur Luftverteidigung und zur Energieversorgung gebeten. Ziel der Veranstaltung ist die Vernetzung der Akteure.,"https://img.nzz.ch/2024/06/11/8d6b9367-c522-47f6-a034-1aeb5ac6a9c2.jpeg?width=1200&height=675&fit=bounds&quality=75&auto=webp&crop=5200,2925,x0,y94&wmark=nzz",2024-06-12T03:30:00Z,,"Dringendste Anliegen sind dem ukrainischen Präsidenten Wolodimir Selenski an der Medienkonferenz mit dem deutschen Bundeskanzler Olaf Scholz die Luftverteidigung und die Energieversorgung.
Es ist na… [+7492 chars]",,de,'Energieversorgung'
https://www.focus.de/experts/deutschland-verliert-wettlauf-um-kritische-rohstoffe-hoffnung-macht-kasachstan_id_203146718.html,https://www.focus.de/experts/deutschland-verliert-wettlauf-um-kritische-rohstoffe-hoffnung-macht-kasachstan_id_203146718.html,0,www.focus.de,"Moral als Problem - Deutschland verliert Wettlauf um kritische Rohstoffe, Hoffnung macht Kasachstan","Der Druck auf Deutschland und die EU, ihre Rohstoffversorgung zu sichern, steigt. Die Abhängigkeit von Ländern wie Russland und China ist riskant, wie die jüngsten Krisen zeigen. Neue Strategien und Partner sollen helfen, diese Abhängigkeit zu verringern, ana…",https://p6.focus.de/img/fotos/id_260028315/rohstoffe-v01.png?im=Crop%3D%280%2C60%2C1920%2C960%29%3BResize%3D%281200%2C627%29&impolicy=perceptual&quality=mediumHigh&hash=6faa26934f607fb4aed8d2ae9d511cdf02c9c7713e7d903e63cf0371b46c0c0a,2024-06-12T07:02:53Z,,"Der Druck auf Deutschland und die EU, ihre Rohstoffversorgung zu sichern, steigt. Die Abhängigkeit von Ländern wie Russland und China ist riskant, wie die jüngsten Krisen zeigen. Neue Strategien und … [+12263 chars]",,de,'Energiewende Gas'
https://www.stern.de/news/uniper-stehen-13-milliarden-euro-schadenersatz-von-gazprom-wegen-lieferstopps-zu-34791622.html,https://www.stern.de/news/uniper-stehen-13-milliarden-euro-schadenersatz-von-gazprom-wegen-lieferstopps-zu-34791622.html,0,www.stern.de,Uniper stehen 13 Milliarden Euro Schadenersatz von Gazprom wegen Lieferstopps zu,Dem in der Gaskrise verstaatlichten deutschen Energiekonzern Uniper steht laut einem Schiedsspruch Schadenersatz in Milliardenhöhe durch den russischen Gazprom-Konzern wegen nicht gelieferter Gasmengen zu. Weil Gazprom seine Lieferungen im Juni 2022 stark red…,https://image.stern.de/34791624/t/2b/v1/w1440/r1.7778/-/12--uniperzentrale-in-duesseldorf---c505b527b046847c.jpg,2024-06-12T07:48:13Z,,Dem in der Gaskrise verstaatlichten deutschen Energiekonzern Uniper steht laut einem Schiedsspruch Schadenersatz in Milliardenhöhe durch den russischen Gazprom-Konzern wegen nicht gelieferter Gasmeng… [+1078 chars],,de,'Gaskrise'
https://www.zeit.de/wirtschaft/2024-06/uniper-13-milliarden-euro-schadensersatz-schiedsspruch-gazprom,https://www.zeit.de/wirtschaft/2024-06/uniper-13-milliarden-euro-schadensersatz-schiedsspruch-gazprom,0,www.zeit.de,Russland: Uniper stehen 13 Milliarden Euro Schadensersatz von Gazprom zu,"Weil Gazprom seine Gaslieferungen 2022 einstellte, hat ein Schiedsgericht Uniper Schadenersatz zugesprochen. Der Konzern rechnet allerdings nicht mit dem Geld.",https://img.zeit.de/wirtschaft/2024-06/uniper-13-milliarden-euro-schadensersatz-schiedsspruchgazprom-bild/wide__1300x731,2024-06-12T09:01:01Z,,Dem im Zuge der Gaskrise verstaatlichten deutschen Energiekonzern Uniper steht laut einem Schiedsspruch ein Schadenersatz in Milliardenhöhe durch den russischen Gazprom-Konzern wegen nicht gelieferte… [+2253 chars],,de,'Gaskrise'
https://www.stern.de/news/schiedsspruch--gazprom-soll-uniper-wegen-gaslieferstopps-13-milliarden-euro-zahlen-34791622.html,https://www.stern.de/news/schiedsspruch--gazprom-soll-uniper-wegen-gaslieferstopps-13-milliarden-euro-zahlen-34791622.html,0,www.stern.de,Schiedsspruch: Gazprom soll Uniper wegen Gaslieferstopps 13 Milliarden Euro zahlen,Dem in der Gaskrise verstaatlichten deutschen Energiekonzern Uniper steht laut einem Schiedsspruch Schadenersatz in Milliardenhöhe durch den russischen Gazprom-Konzern zu: Weil Gazprom seine Lieferungen im Juni 2022 stark reduziert und im August desselben Jah…,https://image.stern.de/34792296/t/cP/v1/w1440/r1.7778/-/12--uniperzentrale-in-duesseldorf---3d2367b45ea8795d.jpg,2024-06-12T10:07:32Z,,Dem in der Gaskrise verstaatlichten deutschen Energiekonzern Uniper steht laut einem Schiedsspruch Schadenersatz in Milliardenhöhe durch den russischen Gazprom-Konzern zu: Weil Gazprom seine Lieferun… [+1696 chars],,de,'Gaskrise'
https://www.faz.net/aktuell/wirtschaft/unternehmen/aus-hunderttausend-solardaechern-wird-ein-grosskraftwerk-19781418.html,https://www.faz.net/aktuell/wirtschaft/unternehmen/aus-hunderttausend-solardaechern-wird-ein-grosskraftwerk-19781418.html,0,www.faz.net,Der Solar-Installateur Enpal baut das größte virtuelle Kraftwerk in Europa,"Das Berliner Energieunternehmen Enpal hat zehntausende Solaranlagen, Speicher, Ladestationen und Wärmepumpen bei Kunden installiert – und große Pläne damit.",https://media1.faz.net/ppmedia/aktuell/wirtschaft/2366666282/1.9782071/facebook_teaser/einbau-von-solarpaneelen.jpg,2024-06-12T12:40:26Z,,"Wenn man Einzelhaushalte gegen die Strompreiskurve optimiert, kann man ganz viele Dinge gar nicht machen, weil der Strommarkt nicht für solche Größen gedacht ist, sagt Benjamin Merle, Leiter der Prod… [+6072 chars]",,de,'Wärmepumpe'
https://www.tagesspiegel.de/einkommen-wer-erhalt-urlaubsgeld-11813459.html,https://www.tagesspiegel.de/einkommen-wer-erhalt-urlaubsgeld-11813459.html,0,www.tagesspiegel.de,Einkommen: Wer erhält Urlaubsgeld?,Die Inflation hat das Leben deutlich verteuert. Viele Arbeitgeber federn das etwas ab. Aber nicht alle Beschäftigten profitieren. Auch beim Urlaubsgeld geht eine Mehrheit leer aus.,https://www.tagesspiegel.de/images/bargeld-auf-einem-tisch/alternates/BASE_16_9_W1400/bargeld-auf-einem-tisch,2024-06-12T12:58:57Z,,"Ob Inflationsausgleich oder Urlaubsgeld: Solche Sonderzahlungen sind bei Arbeitnehmern und Arbeitnehmerinnen sehr beliebt. Doch längst nicht alle bekommen sie, wie Umfragen zeigen.
So erhält in dies… [+3230 chars]",,de,'Inflation'
https://www.focus.de/finanzen/boerse/nahrung-und-energie-bleiben-problem-us-inflation-verlangsamt-sich-anleger-atmen-auf_id_260030190.html,https://www.focus.de/finanzen/boerse/nahrung-und-energie-bleiben-problem-us-inflation-verlangsamt-sich-anleger-atmen-auf_id_260030190.html,0,www.focus.de,"Nahrung und Energie bleiben Problem - US-Inflation verlangsamt sich, Anleger atmen auf",Die Inflation in den USA zeigt im Mai keine Veränderung. Manche Beobachter hatten mit weiteren Anstiegen gerechnet. Energie und Lebensmittelpreise klettern aber weiter.,https://p6.focus.de/img/fotos/id_260030187/supermarkt.jpg?im=Crop%3D%280%2C51%2C3464%2C1732%29%3BResize%3D%281200%2C627%29&impolicy=perceptual&quality=mediumHigh&hash=6986d7c45da9b59299542c50c634eb16ea0e7f9a038154a6e0c8a0472bce19a0,2024-06-12T13:11:41Z,,Die Inflation in den USA zeigt im Mai keine Veränderung. Manche Beobachter hatten mit weiteren Anstiegen gerechnet. Energie und Lebensmittelpreise klettern aber weiter.Der amerikanische Verbraucherpr… [+878 chars],,de,'Inflation'
https://www.zeit.de/2024/26/energieversorgung-stromausfall-ukraine-raketen-kraftwerk-investoren,https://www.zeit.de/2024/26/energieversorgung-stromausfall-ukraine-raketen-kraftwerk-investoren,0,www.zeit.de,Energieversorgung in der Ukraine: Raketen auf Kraftwerke,"In der Ukraine fällt immer wieder der Strom aus, weil Russland die Energieversorgung angreift. Westliche Geldgeber dürfte das aber nicht abschrecken – im Gegenteil.",https://img.zeit.de/2024/26/ukraine-angriffe-energiestruktur-teaser/wide__1300x731,2024-06-12T15:48:20Z,,"Es passiert in diesen Tagen in Kiew immer wieder, auch ohne Ansage, mitten am Tag. Dann gehen die Ampeln aus, springen vor Läden und an Kiosken Generatoren an, die vor sich hinrattern wie Rasenmäher.… [+338 chars]",,de,'Rakete Kraftwerk'
https://www.n-tv.de/politik/16-51-Londons-Sanktionen-sollen-russische-Schattenflotte-treffen--article23143824.html,https://www.n-tv.de/politik/16-51-Londons-Sanktionen-sollen-russische-Schattenflotte-treffen--article23143824.html,0,www.n-tv.de,Ukraine-Krieg im Liveticker: +++ 16:51 Londons Sanktionen sollen russische Schattenflotte treffen +++,Lesen Sie alle aktuellen Entwicklungen und Nachrichten über den russischen Angriffskrieg auf die Ukraine im Liveticker von ntv.de.,https://bilder2.n-tv.de/img/incoming/crop23332537/9041326157-cImg_16_9-w1200/Liveticker1-grau-1-Kopie.jpg,2024-06-12T22:30:00Z,,"Großbritannien beschließt Strafen gegen Frachter, mit denen westliche Sanktionen gegen Russland umgangen werden. ""Die heutigen Maßnahmen umfassen die ersten britischen Sanktionen gegen Schiffe in Put… [+25249 chars]",,de,'Schattenflotte'
https://www.diepresse.com/18561705/nationalrat-gasversorger-muessen-konzepte-zur-versorgungssicherheit-erstellen,https://www.diepresse.com/18561705/nationalrat-gasversorger-muessen-konzepte-zur-versorgungssicherheit-erstellen,0,www.diepresse.com,Nationalrat: Gasversorger müssen Konzepte zur Versorgungssicherheit erstellen,Die Notfallkonzepte sollen beim Ausfall von Gaslieferungen eingesetzt werden sowie zur schrittweisen Reduktion der Abhängigkeit von russischem Erdgas dienen. Die Erzeugung von erneuerbarem Wasserstoff soll mit Bundesmitteln im Ausmaß von bis zu 820 Millionen …,https://img.diepresse.com/public/incoming/l8b305-imago-images-0306339992/alternates/DPR_SOCIAL_NACHRICHTEN/imago%20images%200306339992,2024-06-13T06:21:18Z,,Die Notfallkonzepte sollen beim Ausfall von Gaslieferungen eingesetzt werden sowie zur schrittweisen Reduktion der Abhängigkeit von russischem Erdgas dienen. Die Erzeugung von erneuerbarem Wasserstof… [+3041 chars],,de,'Erdgas Wasserstoff'
https://www.tagesspiegel.de/berlin/bezirke/das-ziel-der-russen-ist-charkiw-zu-erobern-zusagen-uber-72-millionen-euro-fur-die-ukrainische-grossstadt-bei-der-berliner-konferenz-11824508.html,https://www.tagesspiegel.de/berlin/bezirke/das-ziel-der-russen-ist-charkiw-zu-erobern-zusagen-uber-72-millionen-euro-fur-die-ukrainische-grossstadt-bei-der-berliner-konferenz-11824508.html,0,www.tagesspiegel.de,"„Das Ziel der Russen ist, Charkiw zu erobern“: Zusagen über 72 Millionen Euro für die ukrainische Großstadt bei der Berliner Konferenz","Vor dem Winter eine dezentrale Energieversorgung in der Millionenstadt aufzubauen, habe höchste Priorität, sagt der Charkiwer Journalist Juri Larin. Für ihn ist klar: Putin will die Stadt einnehmen.",https://www.tagesspiegel.de/images/der-charkiwer-journalist-juri-larin-36-das-ziel-der-russen-ist-charkiw-zu-erobern/alternates/BASE_16_9_W1400/der-charkiwer-journalist-juri-larin-36-das-ziel-der-russen-ist-charkiw-zu-erobern,2024-06-13T14:51:53Z,,"Er ist aus Charkiw nach Berlin gereist 39 Stunden dauerte die Anfahrt, früher waren es mit Ryanair zweieinhalb Flugstunden. Juri Larin (35) ist Chefredakteur des Charkiwer Nachrichtenportals dumka.me… [+375 chars]",,de,'Energieversorgung'
https://taz.de/Filmemacher-Steyerl-und-Radynski/!6016739/,https://taz.de/Filmemacher-Steyerl-und-Radynski/!6016739/,0,taz.de,Filmemacher Steyerl und Radynski: „Eher ein fraktaler Kolonialismus“,Hito Steyerl und Oleksiy Radynski über Verstrickungen russisch-deutscher Gasgeschäfte und ihr Kunstprojekt „LEAK. Das Ende der Pipeline“ in Leipzig.,https://taz.de/picture/7059330/948/MdbK-Leak-Installationsansicht-6-13-06-2024-1.jpeg,2024-06-13T16:25:00Z,,"Hito Steyerl und Oleksiy Radynski über Verstrickungen russisch-deutscher Gasgeschäfte und ihr Kunstprojekt LEAK. Das Ende der Pipeline in Leipzig.
Pipeline-Röhren um Filmcollagen: Ausstellungsansich… [+10543 chars]",,de,'Gas Pipeline'
https://www.n-tv.de/politik/Union-schiesst-sich-auf-Habeck-ein-sein-Gegenschlag-laeuft-schon-article25012948.html,https://www.n-tv.de/politik/Union-schiesst-sich-auf-Habeck-ein-sein-Gegenschlag-laeuft-schon-article25012948.html,0,www.n-tv.de,Untersuchungsausschuss kommt: Union schießt sich auf Habeck ein - sein Gegenschlag läuft schon,"Die Grünen seien die Hauptgegner in der Regierung, das sagte CDU-Chef Merz schon im vergangenen Jahr. Diesen Worten folgen immer mehr Taten. Im Zentrum der Angriffe steht Wirtschaftsminister Habeck. Nun soll es einen Untersuchungsausschuss zum Atomausstieg ge…",https://bilder1.n-tv.de/img/incoming/crop25012964/3671325190-cImg_16_9-w1200/imago0313580326h.jpg,2024-06-13T16:34:30Z,,"Die Grünen seien die Hauptgegner in der Regierung, das sagte CDU-Chef Merz schon im vergangenen Jahr. Diesen Worten folgen immer mehr Taten. Im Zentrum der Angriffe steht Wirtschaftsminister Habeck. … [+7479 chars]",,de,'Atomausstieg'
https://www.tagesschau.de/ausland/europa/gegengipfel-g7-apulien-100.html,https://www.tagesschau.de/ausland/europa/gegengipfel-g7-apulien-100.html,0,www.tagesschau.de,Anti-G7-Protest in Süditalien: Mit trockenem Brot gegen die Großmächte,"Während die G7-Staaten sich hinter geschlossenen Türen treffen, protestieren die Apulier gegen Krieg, Gas und soziale Ungerechtigkeit. Und ein Armenessen aus trockenem Brot wird zum Symbol der Kritik. Von Elisabeth Pongratz.",https://images.tagesschau.de/image/c8400cd0-c16a-4275-a2be-90c70b494b94/AAABkBJJeBs/AAABjwnlFvA/16x9-1280/assennato-102.jpg,2024-06-13T19:00:06Z,,"Stand: 13.06.2024 21:00 Uhr
Während die G7-Staaten sich hinter geschlossenen Türen treffen, protestieren die Apulier gegen Krieg, Gas und soziale Ungerechtigkeit. Und ein Armenessen aus trockenem Br… [+4232 chars]",,de,'Krieg Gas'
https://www.n-tv.de/politik/08-29-Ehemaliger-Mitarbeiter-des-AKW-Saporischschja-wegen-Kollaboration-verurteilt--article23143824.html,https://www.n-tv.de/politik/08-29-Ehemaliger-Mitarbeiter-des-AKW-Saporischschja-wegen-Kollaboration-verurteilt--article23143824.html,0,www.n-tv.de,Ukraine-Krieg im Liveticker: +++ 08:29 Ehemaliger Mitarbeiter des AKW Saporischschja wegen Kollaboration verurteilt +++,Lesen Sie alle aktuellen Entwicklungen und Nachrichten über den russischen Angriffskrieg auf die Ukraine im Liveticker von ntv.de.,https://bilder2.n-tv.de/img/incoming/crop23332537/9041326157-cImg_16_9-w1200/Liveticker1-grau-1-Kopie.jpg,2024-06-13T22:30:00Z,,Die Ukraine verurteilt einen ehemaligen Mitarbeiter des Kernkraftwerks Saporischschja wegen Kollaboration mit den russischen Besatzungstruppen zu zehn Jahren Gefängnis. Dies teilt die Staatsanwaltsch… [+12403 chars],,de,'Akw'
https://www.n-tv.de/politik/17-03-Ostseerat-Russische-Schattenflotte-besteht-aus-kaum-seetauglichen-Schiffen--article23143824.html,https://www.n-tv.de/politik/17-03-Ostseerat-Russische-Schattenflotte-besteht-aus-kaum-seetauglichen-Schiffen--article23143824.html,0,www.n-tv.de,Ukraine-Krieg im Liveticker: +++ 17:03 Ostseerat: Russische Schattenflotte besteht aus kaum seetauglichen Schiffen +++,Lesen Sie alle aktuellen Entwicklungen und Nachrichten über den russischen Angriffskrieg auf die Ukraine im Liveticker von ntv.de.,https://bilder2.n-tv.de/img/incoming/crop23332537/9041326157-cImg_16_9-w1200/Liveticker1-grau-1-Kopie.jpg,2024-06-13T22:30:00Z,,Die demokratischen Ostseeanrainerstaaten wollen sich gemeinsam gegen umstrittene russische Öl-Exporte auf kaum seetauglichen Schiffen zur Wehr setzen. Gegen die sogenannte Schattenflotte seien entsch… [+31544 chars],,de,'Schattenflotte'
https://www.nzz.ch/panorama/frauenstreik-wie-steht-es-um-den-feminismus-ld.1834934,https://www.nzz.ch/panorama/frauenstreik-wie-steht-es-um-den-feminismus-ld.1834934,0,www.nzz.ch,"INTERVIEW - Ukraine, Gaza, Klimawandel: Ist der Feminismus nebensächlich geworden?",Ein Interview mit der Expertin Elisabeth Joris zum Frauenstreik am Freitag und zum Zustand des Feminismus in der Schweiz im Jahr 2024.,"https://img.nzz.ch/2024/02/17/fad7492c-7311-40c8-bc21-327abb4b1e41.jpeg?width=1200&height=675&fit=bounds&quality=75&auto=webp&crop=7006,3941,x0,y0&wmark=nzz",2024-06-14T03:30:00Z,,"Am Freitag demonstrieren die Schweizerinnen wieder wie hier 2023 in Lausanne.
Der 14. Juni 2019 war ein einziges Fest. Eine halbe Million Frauen zogen durch die Strassen der Schweiz, trugen violette… [+7460 chars]",,de,'Ukraine Klimawandel'
https://www.nzz.ch/wirtschaft/der-zuger-erdgasriese-met-will-den-groessten-duengerhersteller-litauens-uebernehmen-das-schuert-im-baltikum-aengste-ld.1834070,https://www.nzz.ch/wirtschaft/der-zuger-erdgasriese-met-will-den-groessten-duengerhersteller-litauens-uebernehmen-das-schuert-im-baltikum-aengste-ld.1834070,0,www.nzz.ch,Der Zuger Erdgasriese MET will den grössten Düngerhersteller Litauens übernehmen. Das schürt im Baltikum Ängste,"Der Energiekonzern MET legt ein beeindruckendes Wachstum hin, investiert in erneuerbare Energien und weiterhin in den Gasmarkt. Doch Schatten aus der Vergangenheit bremsen das Schweizer Unternehmen.","https://img.nzz.ch/2024/06/13/4f338223-ddef-446f-be1e-fb5612ca0506.jpeg?width=1200&height=675&fit=bounds&quality=75&auto=webp&crop=3888,2187,x0,y149&wmark=nzz",2024-06-14T03:30:00Z,,"Die Chemiefabrik Achema ist das Herzstück eines der grössten Firmenkonglomerate in Litauen.
Die Unternehmen von Achema produzieren Stickstoffdünger, fördern und verkaufen Erdgas, stellen Windparks a… [+9126 chars]",,de,'Gasmarkt'
https://www.welt.de/politik/deutschland/article252027486/Atomausstieg-Wir-muessen-annehmen-dass-es-Fehlverhalten-gab-namentlich-bei-Habeck-und-Lemke.html,https://www.welt.de/politik/deutschland/article252027486/Atomausstieg-Wir-muessen-annehmen-dass-es-Fehlverhalten-gab-namentlich-bei-Habeck-und-Lemke.html,0,www.welt.de,"„Müssen annehmen, dass es Fehlverhalten gab, namentlich bei Habeck und Lemke“",Die Opposition hat die Ampel wegen des Atomausstiegs im Bundestag scharf kritisiert. Die Union will einen Untersuchungsausschuss einsetzen. Die SPD hingegen wirft der CDU Stimmungsmache und einen Zickzack-Kurs vor.,https://img.welt.de/img/politik/deutschland/mobile252028660/2371354947-ci16x9-w1200/Bundestag.jpg,2024-06-14T11:26:36Z,,In der Bundestagsdebatte zu einem möglichen Untersuchungsausschuss zu politischen Entscheidungen vor dem endgültigen Atomausstieg 2023 haben sich Vertreter von Ampel und Opposition mit Vorwürfen über… [+3618 chars],,de,'Atomausstieg'
https://www.bild.de/politik/ausland-und-internationales/anstieg-um-920-prozent-putins-blut-duenger-flutet-europa-6658342d3cdddc0b5f3cd02f,https://www.bild.de/politik/ausland-und-internationales/anstieg-um-920-prozent-putins-blut-duenger-flutet-europa-6658342d3cdddc0b5f3cd02f,0,www.bild.de,Anstieg um 920 Prozent - Russischer Blut-Dünger flutet Europa,"Kreml-Diktator Wladimir Putin (71) verdient weiterhin prächtig Geld in Europa – allerdings weniger mit Öl oder Gas, sondern mit Dünger!","https://images.bild.de/6658342d3cdddc0b5f3cd02f/1fa2646774386d2fe0da6badcbe7130e,1cab8359?w=1280",2024-06-14T12:21:54Z,,"Kreml-Diktator Wladimir 
Putin (71) verdient weiterhin prächtig Geld in Europa allerdings weniger mit Öl oder Gas, sondern mit Dünger!
Laut Statistischem Bundesamt hat Russland in der Düngeperiode … [+1979 chars]",,de,'Gas Putin'
https://www.sueddeutsche.de/politik/ostseerat-schaerfer-gegen-russische-oel-schattenflotte-vorgehen-lux.GR71qsuUE3ihfSaVeZQHxz,https://www.sueddeutsche.de/politik/ostseerat-schaerfer-gegen-russische-oel-schattenflotte-vorgehen-lux.GR71qsuUE3ihfSaVeZQHxz,0,www.sueddeutsche.de,Ostseerat: Schärfer gegen russische Öl-Schattenflotte vorgehen,,https://www.sueddeutsche.de/szde-assets/img/szde-article-sharing-image-no-teaser-image-fallback.png,2024-06-14T14:04:42Z,,Die demokratischen Ostseeanrainerstaaten wollen sich gemeinsam gegen umstrittene russische Ölexporte auf kaum seetauglichen Schiffen zur Wehr setzen. Gegen die sogenannte Schattenflotte seien entschl… [+377 chars],,de,'Schattenflotte'
https://www.faz.net/aktuell/politik/ausland/russlands-illegale-oelexporte-anrainer-wollen-ostsee-besser-schuetzen-19789845.html,https://www.faz.net/aktuell/politik/ausland/russlands-illegale-oelexporte-anrainer-wollen-ostsee-besser-schuetzen-19789845.html,0,www.faz.net,Russlands „Schattenflotte“: Ostseerat will illegalen Ölexport stärker bekämpfen,"Russland nutzt alte Tanker, um illegal Öl zu exportieren. Die Ostseeanrainer fürchten eine Umweltkatastrophe und wollen nun dagegen vorgehen.",https://media1.faz.net/ppmedia/aktuell/politik/3719389393/1.9789841/facebook_teaser/annalena-baerbock-und-elina.jpg,2024-06-14T16:05:45Z,,"Russlands Schattenflotte sei eine Bedrohung nicht nur für die europäische Sicherheit, sondern auch für die fragile Umwelt der Ostsee, sagte Valtonen. Russland umgehe damit sehr effektiv den Ölpreisde… [+1430 chars]",,de,'Schattenflotte'
