index,url,valid,domain,title,description,image,published,archive,content,quote,language,keyword
https://www.stern.de/gesellschaft/regional/rheinland-pfalz-saarland/inflation--inflationsrate-in-rheinland-pfalz-leicht-gesunken-34842846.html,https://www.stern.de/gesellschaft/regional/rheinland-pfalz-saarland/inflation--inflationsrate-in-rheinland-pfalz-leicht-gesunken-34842846.html,0,www.stern.de,Inflation: Inflationsrate in Rheinland-Pfalz leicht gesunken,"Die Preise steigen, aber etwas weniger stark. Gerade für einige Nahrungsmittel müssen die Verbraucherinnen und Verbraucher weniger tief in die Tasche greifen.",https://image.stern.de/34842848/t/4o/v1/w1440/r1.7778/-/01--hxkwnqjl3nv16axw800h600jpeg---e9e904373f8e0f07.jpg,2024-07-01T09:39:07Z,,"Die Preise steigen, aber etwas weniger stark. Gerade für einige Nahrungsmittel müssen die Verbraucherinnen und Verbraucher weniger tief in die Tasche greifen.
Sinkende Preise für Gemüse und Heizöl h… [+1088 chars]",,de,'Inflation'
https://orf.at/stories/3362254/,https://orf.at/stories/3362254/,0,orf.at,Ursachen für Teuerung verschieben sich,"Erst waren es die Energiepreise, die die Inflation nach oben getrieben haben, aktuell sind es laut einem am Montag veröffentlichten Bericht des Wirtschaftsforschungsinstituts (WIFO) vor allem die Preise für Dienstleistungen – und etwa auch die Mieten –, die d…",https://ibs.orf.at/news?image=https%3A%2F%2Fassets.orf.at%2Fmims%2F2024%2F27%2F94%2Fcrops%2Fw%3D1200%2Ch%3D630%2Cq%3D75%2F2263519_master_860594_inflation_wifo_prognose_2026_pba.jpg%3Fs%3D1dbee5fa2481980c7208a0a5a84e93f975c966cf,2024-07-01T11:57:39Z,,"Die Preisspirale hatte sich 2021, mehr oder minder von null weg, zu drehen begonnen, von 0,8 Prozent stieg die Inflationsrate bis Jänner 2023 auf den Rekordwert von 11,2 Prozent. Die Jahresinflation … [+4163 chars]",,de,'Inflation'
https://www.autobild.de/artikel/smartes-heizkoerperthermostat-aqara-e1-srts-a01-amazon-angebot-26255847.html,https://www.autobild.de/artikel/smartes-heizkoerperthermostat-aqara-e1-srts-a01-amazon-angebot-26255847.html,0,www.autobild.de,Aqara-Heizkörperthermostat E1 mit Zigbee 3.0 zum starken Preis,"Wenn Sie Ihre Heizkosten senken möchten, dann setzen Sie auf smarte Heizkörperthermostate. Bei Amazon ist derzeit der populäre Heizkörperregler Aqara E1 zum Sparpreis im Angebot.",https://i.auto-bild.de/ir_img/3/6/3/3/8/4/5/929669695_e843d9fe41-5dbf3f05335d397b.jpg?impolicy=og_images,2024-07-01T15:00:00Z,,"Amazon Prime 30 Tage kostenlos testen
statt 8,99 EUR
0,00 EUR",,de,'Heizkosten'
https://www.faz.net/aktuell/wirtschaft/inflation-im-euroraum-geht-wieder-leicht-zurueck-daten-fuer-juni-19827677.html,https://www.faz.net/aktuell/wirtschaft/inflation-im-euroraum-geht-wieder-leicht-zurueck-daten-fuer-juni-19827677.html,0,www.faz.net,Daten für Juni: Inflation im Euroraum geht wieder leicht zurück,"Im Juni ist die Teurerung in den Euro-Ländern auf 2,5 Prozent gesunken. Damit liegt sie weiter über dem Zielwert der Europäischen Zentralbank.",https://media1.faz.net/ppmedia/aktuell/wirtschaft/157418506/1.9827681/facebook_teaser/markt-in-teruel-spanien.jpg,2024-07-02T09:24:57Z,,"Noch im Mai hatte sich die Teuerungsrate auf 2,6 Prozent erhöht nach 2,4 Prozent im April. Für die Europäische Zentralbank (EZB) ist das Abflauen der Teuerung im Juni eine gute Nachricht. Sie kommt d… [+1349 chars]",,de,'Energiepreise'
https://www.zeit.de/wirtschaft/2024-07/inflation-preise-sinken-eurozone-juni,https://www.zeit.de/wirtschaft/2024-07/inflation-preise-sinken-eurozone-juni,0,www.zeit.de,Inflation: Preise im Euroraum sinken im Juni leicht,"Nachdem die Inflation im Euroraum im Mai leicht gestiegen war, sank sie nun um 0,1 Prozentpunkte. Vor allem bei Dienstleistungen blieben die Preise im Juni aber hoch.",https://img.zeit.de/wirtschaft/2024-07/preise-inflation-sinken-euro-bild/wide__1300x731,2024-07-02T10:15:50Z,,"Nach einem leichten Anstieg im Vormonat hat sich die Inflation in der Eurozone im Juni wieder auf 2,5 Prozent abgeschwächt. Im Jahresvergleich fiel damit der Preisanstieg 0,1 Prozentpunkte weniger st… [+1968 chars]",,de,'Energiepreise'
https://www.zeit.de/wirtschaft/2024-07/industrie-europa-fordert-mehr-erneuerbare-energie,https://www.zeit.de/wirtschaft/2024-07/industrie-europa-fordert-mehr-erneuerbare-energie,0,www.zeit.de,Energiepreise: Europas Industrie fordert stärkeren Ausbau erneuerbarer Energien,Die jetzige EU-Energiepolitik ist nach Ansicht des Dachverbandes BusinessEurope zu langsam. Die hohen Energiepreise würden Europas Industrie ernsthaft beeinträchtigen.,https://img.zeit.de/politik/deutschland/2024-07/industrie-europa-erneuerbare-energie/wide__1300x731,2024-07-04T08:16:29Z,,"Der Dachverband der europäischen Industrie- und Unternehmensverbände drängt auf einen stärkeren Ausbau erneuerbarer Energiequellen. Dieser müsse dringend vorangetrieben werden, um Europas Industrie i… [+2027 chars]",,de,'Energiepreise'
https://www.stern.de/wirtschaft/news/energie--shell-erwartet-abschreibungen-von-bis-zu-zwei-milliarden-34855584.html,https://www.stern.de/wirtschaft/news/energie--shell-erwartet-abschreibungen-von-bis-zu-zwei-milliarden-34855584.html,0,www.stern.de,Energie: Shell erwartet Abschreibungen von bis zu zwei Milliarden,"London - Der Öl- und Gaskonzern Shell erwartet im zweiten Quartal Abschreibungen von bis zu zwei Milliarden US-Dollar (1,85 Mrd Euro). Shell begründete",https://image.stern.de/34855586/t/C1/v1/w1440/r1.7778/-/05--bfok44gjn6v11axw800h600jpeg---247d9409484ab5de.jpg,2024-07-05T07:30:17Z,,"Unter anderem der Bau einer Biospritanlage in den Niederlanden kommt nicht voran wie geplant. Das hat Folgen für den Energieriesen Shell.
Der Öl- und Gaskonzern Shell erwartet im zweiten Quartal Abs… [+798 chars]",,de,'Gaskonzern'
